286455	What are the strongest majors in terms of job prospects and what are the weakest majors at Brooklyn College ?
286456	What are the strongest majors in terms of job prospects and what are the weakest majors at Pomona College ?
286457	Can the people of Delhi testify about AAP and its work ? How is it different from previous governments ?
286458	Find Your Dream Home in Noida ?
286459	Why did controversial ex-Congressperson Mark Foley recently attend a Trump rally ?
286460	How do I make a gaming PC ?
286461	How do I make a pc game ?
286462	How much does a Papa John's franchise make ?
286463	What is the average revenue and net profit of Beard Papa's franchise ?
286464	What universities does MFA Financial recruit new grads from ? What majors are they looking for ?
286465	Which mobile is better lenevo k5 or redmii 3s ?
286466	Is the Milky Way a Blazar ?
286467	How can Tibet gain independence ?
286468	Should Tibet gain independence ?
286469	What is bias in artificial neural network ?
286470	How are artificial neural networks and Markov chains different ?
286471	Which is the most famous ` unedited' photograph ever taken ?
286472	Which is the most famous photograph ever taken ?
286473	Are ovarian cysts genetic ?
286474	Why are AAP followers certain that Arvind Kejriwal's model of governance is better than other models ?
286475	Does animals have periods ?
286476	What do animals do if they have periods ?
286477	What words can be used instead of awesome and cool ?
286478	Freeduino is not working and it is giving me a code 10 error . Why is this happening ?
286479	How badly will it affect me if I use my work laptop for personal coding projects during off-work hours ?
286480	Do the Swiss and belgians hate each other ?
286481	What is it like to be lonely your whole life ?
286482	Can I get refund on an unused court fee stamp paper ?
286483	What is the difference between Catholicism , Orthodoxy and Protestantism ?
286484	What's the difference between Catholicism and Protestantism ?
286485	How do I increase the download speed on BitTorrent ?
286486	How do I increase download speed ?
286487	What would happen if two sociopaths met ? What would happen if a sociopath and a psychopath met ? And finally , what would happen if two psychopaths met ?
286488	If you could recommend anything to me , what would it be ?
286489	What machine learning algorithm should I use for my app ?
286490	How much does the latest Leica camera cost to make ?
286491	What are my best options for web scraping ?
286492	What is the best technology for web scraping ?
286493	Are pickles healthy for you ?
286494	Are pickles healthy ?
286495	What kind of flowers grow on trees ?
286496	What kind of tree is this ?
286497	How tall is Baron Trump , Donald Trump's ten year old son ?
286498	Which is the best software for hacking ?
286499	What is the difference between a flat surface flask and a round bottom flask ?
286500	How does organizational structure affect the stakeholders ?
286501	Why is the Power Corp organizational structure so complicated ?
286502	What is the difference between nationalism of the RSS and nationalism of our freedom movement ?
286503	I am electrical and electronics student trying ms in us 2017 fall . Can anyone suggest good universities for electronics ?
286504	After doing part time M.Sc . from open university , can I join part time M.Tech ?
286505	Is it a good idea to pursue Part-Time M.Tech (CSE/3 years) from Amity University , Noida ?
286506	Is businesspartners.com legit ?
286507	Which website will be suitable for downloading eBooks and lectures ?
286508	At a constant temperature what should be the percentage increase in pressure for a 5 % decrease in the volume of gas ?
286509	By keeping the pressure constant , at what temperature does the volume of a gas become half of what it is at 25 degrees Celsius ?
286510	Methane : How much dung can a cow produce in a day ?
286511	Why is cow dung given so much importance over other types of dung ?
286512	How did truecaller got my Facebook profile link ?
286513	Why does Facebook not buy Truecaller ?
286514	How can I set the weather application showing the update on my Lumia glance screen (Lumia 640 XL) ?
286515	How was the Lumia 640 received when it was released ?
286516	Flowers for Algernon ?
286517	Why do shops refuse to swipe cards below Rs 100 ?
286518	Did Doug kill Rachel in Episode 39 (S3E13) of House of Cards and if so , why did he do it ?
286519	What are some effective ab exercises ?
286520	What's the difference between a promise and a callback in Javascript ?
286521	What is the difference in Javascript between Number (-RRB- , parseFloat (-RRB- , and {String} * 1 ?
286522	Is Trump building the most anti-science administration in the USA's history ?
286523	How does Big Lots' layaway program work ?
286524	Can an international F1 visa student get an SSN without a job offer in the US ?
286525	What visa do I need to visit the USA ?
286526	Which US president did the fewest bad things while in office ? (Formerly : Who was the best US president base on the least bad things they did ?)
286527	How do I answer this question : why MBA and why should I choose you ?
286528	'''' `` Why do You choose our bank ?'''' How do I answer this question ?''
286529	Who invented money ?
286530	Who invented the theory of money ?
286531	What is average fees for tabla class ?
286532	What is Madvacharya's Dvaita siddantha ?
286533	What is the antiderivative of cot (x) ?
286534	What is COT leave ?
286535	Which are some of the amazing cafeterias you have come across & what is unique about them ?
286536	Is Amazon a mass recruiter in US for software engineers similar to TCS in India ?
286537	Why Engineering Students don't want to join mass recruiters like TCS , Infosys and Accenture ?
286538	How do I get the tweet count on a page to increase when I tweet a shortened link (of that page) ?
286539	As an Angel investor , what are the top three things you look for in a potential investment ?
286540	When meeting quickly (coffee for instance) with a potential investor , what top level things should be the focus to make them further interested ? And in what format ?
286541	What is the half-life of knowledge for computer science ?
286542	How would you use 10,000 hours to most effectively acquire deep knowledge of Computer Science ?
286543	What is it like to live in Himachal Pradesh ?
286544	What would be the cost of living in a small town in Himachal Pradesh ?
286545	Why do some schools force teenagers to shave facial hair ?
286546	Why do Human Rights sound like something supreme in our society nowadays ? He who disobeys is doomed .
286547	Do you believe that not living in fear is a basic human right ? If so , how would a society organize itself to best guarantee that right ?
286548	For newspaper ad directors or the like ; Even with the attrition of print , do you still sign annual agency volume agreements ? Why or why not ?
286549	Which vegetables should I include in my diet to improve the health of my hair ?
286550	Probability Density Functions : Find the constant k so that f (x) is a pdf of the continuous random variable x ?
286551	If U is the mean of a continuous random variable X , is the CDF of X always 1/2 at U ?
286552	Can a web designer learn Java ?
286553	Where can I buy pure bhringraj powder in Hyderabad ?
286554	Are you charged if you accidentally request an uber or lyft ?
286555	How did Uber and Lyft become comparable ?
286556	Does Netflix still use AWS for streaming ?
286557	How is Ratan Tata as a person ?
286558	In the movie Interstellar , Cooper sees Murph sitting in her room after he reaches the 5D world . Does it mean that the light reflected off of Murph crosses the spacetime barrier of 3D world & enters Cooper's 5D world ? If Cooper can see Murph , why can't she see him ? Principle of reversibility right ?
286559	What do you think about my short film ?
286560	What do you think about my short film `` DIARIES'' ?
286561	RESTful APIs : For performing bulk actions , say marking more than one customer inactive where customer is one of my resource , I need to give an array of ids for that action.How shall I configure my url for doing so ?
286562	Is there an app that can be used to run a custom rest API calls ?
286563	How can you make me believe in ghosts ?
286564	What made you a believer in ghosts ?
286565	Which is the best government exam for electrical engineers ?
286566	Which is the best government exam for mechanical engineers ?
286567	How much mobile data gets used if I play battlefield on PS4 for 1 hour ?
286568	How much mobile data gets used if I play games on my PS4 for 1 hour ?
286569	How I prepare for amu sssc +2 entrance examination ?
286570	How can Indian college students earn pocket money by working online ?
286571	Dating and Relationships : Do guys normally avoid or block a girl they have strong feelings for ?
286572	How can I save apps to my phone's SD card ?
286573	What is the English word for फ़जेती ?
286574	Why can big files not download via 3G networks from the store in a Windows Phone ?
286575	How do I send files from a Windows PC to my Android phone using XENDER or ZAPYA ?
286576	What are the environmental impacts of the tourism industry and how has it negatively impacted Prague ?
286577	My son keeps getting into fights at school and bosses his siblings around whenever he's at home . How do I make him stop ?
286578	What is cureinstant and why do people are talking a lot about it in India ?
286579	What's your favorite scene from the movie Fatal Attraction ?
286580	Which is the best place to unleash my business for free ?
286581	What is the best fighting style for a street fight ?
286582	What's the most effective sport for real-world street fight ?
286583	What kind of marriages last longer ? Love or arrange ?
286584	What cities do born and raised New Yorkers most frequently move to ?
286585	When you've moved to a new city , what's been the most valuable tool for finding a new job ?
286586	Should we upload our common app essays on essay forums ?
286587	What is the purpose of the extra limb on police batons ?
286588	We are literate enough to understand that expectations hurt , yet we end up expecting from others - friends and / or family - and get hurt . why is this so ?
286589	I know expectations always hurt but still I end up expecting something from everyone . Why does it happen and how should we overcome it ?
286590	A six-year-old kid (a friend's son) drew this while eating dinner . Is he an artistic genius ?
286591	How can I get my 2.5-year-old son interested in studying ?
286592	Clash of Clans : How can I make my base stronger against attacks ?
286593	What is the oxidation state of FeCr2O4 ?
286594	What is the oxidation state of BP ?
286595	Are QR codes a success ?
286596	Is it true Celtic people all have O negative blood ?
286597	How can I fix an unwritable Micro SD ?
286598	How do I fix my micro SD card that became a read-only memory card ?
286599	`` How much does it cost to pay someone else to set up my car to be able to do'' `` aux in'''' with an ipod or phone if it only has a CD player at the moment ?''
286600	What is the cheapest car + modifications to get to 600hp ?
286601	What four-legged animal (i.e. quadruped) is most similar to the human ?
286602	What is the most useless animal i.e. one whose extinction would have the least impact upon the world ? (Please don't say ` humans')
286603	Was General George S. Patton the best general of the World War II ?
286604	Was General George Patton the greatest general of all time ?
286605	How is it to trip on LSD ?
286606	Is the Reformed Church in America conservative ?
286607	What are some of the ways an amateur like me can easily make money online ?
286608	How do you get a bike on Pokemon Fire Red ?
286609	Who invented ice cream ?
286610	If any question is not asked to me , can I answer it ?
286611	How do you record a FaceTime call on an iPhone ?
286612	How can I record a FaceTime call on a Mac ?
286613	How restorative is resting but not sleeping ?
286614	I go to bed about 9pm . I awaken between 11pm-1am . The rest of the night is restless sleep . What can I do to ensure a full eight hours of sleep ?
286615	Does anyone know the purpose of watches that have a ring around them that you can turn . Usually they have marks that line up with the numbers on the dial , and usually one mark is different from all the others ?
286616	What purpose do the dials on a watch serve ?
286617	Aggregator websites like Indeed , Simply Hired , ZipRecruiter , etc. are worthless to most unemployed people as well as for recruiters . Do you have any solutions & / or idea (s) to things that you would like to see that changed ?
286618	What will be the recursive C++ code for the following problem for 1 - 3 +5 -7 ... . + / - n (if n is even , last term is n-1) as shown in figure ?
286619	How can I write a C++ function to shut down a computer ?
286620	What is the point in living if you are already dead inside ?
286621	How does it feel to be dead inside ?
286622	What is the best horror movie of 2013 ?
286623	Why do people get knocked out after getting hit on their head ?
286624	Can you get a concussion from hitting yourself in the head ?
286625	In what kind of spirits did the old pagans believe in ?
286626	Was it a strategic mistake for Microsoft not to make the Xbox One S capable of running games at native 4K ?
286627	Are there any websites like Craigslist ?
286628	Is the amount of work that goes into building profitable startups underestimated ?
286629	What are the best hostels at BITS Pilani (wifi , network , convenience etc ...) ?
286630	Can we use air compressor instead of refrigerant compressor ?
286631	Can an air conditioner compressor also be used as a refrigeration compressor replacement ?
286632	How do I crack UPSC CSE 2018 while working in a 7am - 7pm job from Mon-Fri (Sat , Sun are holidays) ?
286633	I'm currently studying at IITB . I'm just at the end of my first year here . I want to crack the IAS (UPSC) on my first attempt . What should I do ? How do I manage my studies and also get along with the preparation ?
286634	How does Vemo earn money in YouTube ?
286635	What is North Korea famous for ?
286636	What are the differences between top-tier and average schools for a physics undergraduate program ?
286637	Is drinking green tea before going to bed good for health ?
286638	Is it advisable to drink green tea before a workout or after it ?
286639	My laptop screen is reversed , how can this be fixed ?
286640	What are the requirements to become president in the United States and how are the requirements different in Switzerland ?
286641	Which clay is better : Sculpey or Fimo ?
286642	If you're struck once by lightning , are you more likely to be struck again ?
286643	Has anyone been struck by lightning 2 times or more ?
286644	I am in class 11th and I really enjoy reading novels and writing things . My parents want me to become a doctor . It's not that I'm not interested in science , but what if I don't get selected in the All India Pre-Medical Test ?
286645	Are there any shopping malls in Seattle near the South Lake Union area ?
286646	How do I get a Shop Attendant Job in malls ?
286647	If all objects which has mass exert gravitational force on another object then why we don't see objects on earth moving towards each other ?
286648	How is the mass of an object affected by a gravitational field ?
286649	Is it possible that every planet in our solar system had life at one time ?
286650	Why do non-Indian people love Indian food , but hate the spice smell ?
286651	Facebook engineers : How is it to work at Facebook ?
286652	What happens at the end of naruto shippuden ?
286653	What are the nutritional differences between lemons and limes ?
286654	What are the differences between an orange and a sweet lime ?
286655	What are flaws in religion ?
286656	What are your flaws ?
286657	What should I do as a housewife ?
286658	I want to be a housewife , what do I do ?
286659	I have a friend (girl) whome i trust and respect . today I got to know she sleeps with my teammate . what should I do ?
286660	My child has nro account and I want to transfer some money to the nro account from my resident sb account . Can I do so . If so what is tax impications ?
286661	Why is a good quantitative fund only generates return in the single digits ?
286662	I am a new h1b visa holder and my visa is valid for three years . Can I have my spouse apply for H4 EAD ?
286663	When you apply for a driver's license in a new state , do they check the state you are leaving for arrest warrants before issuing the new license ?
286664	Does the DMV take your old license when applying for an out-of-state license ?
286665	`` Do girls find it attractive when guys attempt to emphasize the'' `` penis bulge'''' in their pants ?''
286666	What was the most attractive body part of a guy that the girls love most ?
286667	Some useful life hacks ?
286668	`` Which'' `` digital and logic design (DLD)'''' project should I choose ?''
286669	What is a nerd ?
286670	How hard is programming ?
286671	How hard is it to program facebook ?
286672	What are some of the best online courses to join ?
286673	What is the mass (atomic mass unit) of alpha , beta , and gamma particles/ray ?
286674	In depth , what really is an atomic mass unit ?
286675	Why the planets not twinkle ?
286676	Why don't planets twinkle ?
286677	How do I keep videos on iCloud after deleting them from my phone ?
286678	Who would you say is a better flash , Jay Garrick , Barry Allen , Wally West , or Bart Allen ?
286679	Why did Barry Allen and felicity kiss ?
286680	Can a woman get pregnant if she does not have periods ?
286681	Where can I find sample German A1 exam questions ?
286682	What's the validity of the German A1 or other exams ?
286683	Can pussies fart ?
286684	Which are the best English songs with fast music ?
286685	`` Is a comma necessary after the word'' `` titled ,'''' as in'' `` The book was titled ` My Hero' .'''' ?''
286686	Is it necessary to add a comma before or after' yet' ?
286687	What are the differences between RancherOS and CoreOS ?
286688	What is the difference between Git and Docker ?
286689	What was the purpose of the Monroe Doctrine ?
286690	What was the intended purpose of the Tariff of 1816 ?
286691	What is the best way to kill spiders ?
286692	How would one solve this Physics problem ?
286693	How do you solve this physics problem ?
286694	What are the salaries of Principals , Partners and GMs at VC's with a $ 500M - $ 1B fund ?
286695	What is the total compensation for a VC associate at a San Francisco VC fund ?
286696	Which type/which companies' cigarettes are less harmful in comparison with normal cigarettes like Classic and Four Square ?
286697	Why does liquor , which is less harmful , need a licence for selling and cigarettes don't ?
286698	How much sunlight hits the Earth ?
286699	Will a Magnetar Shockwave hit earth in 9-10 days ?
286700	Who is Samuel in the bible ?
286701	Who is Jonah in the bible ?
286702	What is the procedure of retest in NMAT Exam ?
286703	How is the recommended amount of suboxone determined ? What factors are considered ?
286704	Good score in gate ?
286705	What is the best way to get good score in gate ?
286706	How can I use my smartphone to increase my productivity ?
286707	Which method is better to increase productivity : to schedule or to use a timer ?
286708	How did evil originate ?
286709	How evil are you ?
286710	What are the four major aspects that differentiates the role of Android and iOS developers ?
286711	What is the difference between Chrome canary and Chrome stable ?
286712	Were Americans and Englishmen better educated 100 years ago ?
286713	How do guns cool down now vs 100 years ago ?
286714	Where do you find downloaded files on an iPhone 5S ?
286715	How can I recover my data from a damaged iPhone 5 ?
286716	What is the best way to soft boil an egg ?
286717	How should one prepare for an internship at Softinator ?
286718	What makes one visit to the toilet or restroom better than another ?
286719	Why ads not showing on my YouTube video on mobile , ads showing desktop only why ?
286720	What is the best Gillette for shaved-head guys ?
286721	What makes diamond the hardest material ?
286722	What is the hardest type of diamond ?
286723	Which one is better : The Godfather 1 or The Godfather 2 ?
286724	`` Why is'' `` The Godfather'''' such a popular film ?''
286725	How can I keep my nose from frequently bleeding in one nostril only ?
286726	What are the best aspects of living in Columbus , GA as a young adult ?
286727	If I delete WhatsApp , will the messages sent to me while my WhatsApp was deleted be delivered to me when I reinstall it again ?
286728	What happens When the messages to be sent is queued when I am in offline & delete it before coming to online in whatsapp ? Will it be delivered ?
286729	What is a general conversion for Nike Fuel into Calories ? (knowing that it will be imprecise)
286730	How do they know how many calories there are in fat ?
286731	How is junior college in Singapore compared to Ecuador ?
286732	Why do five-star hotels not have water in washrooms , only tissues and dustbins ?
286733	How do I sell my chaat masala to a five star hotel in delhi ?
286734	Why is cooking salt called table salt ?
286735	What's the difference between resultant and equivalent ?
286736	`` What is'' `` equivalence between regular languages'''' ? What does it mean ?''
286737	Who is your favorite professor and why ?
286738	What is a LaPierre Professor ?
286739	Can anyone name the best coaching centre in Hyderabad for AIIMS and NEET 2017 ?
286740	Do referendums lead to better governance ?
286741	Does a referendum solve the problems of a country/region ? Does the collective opinion of the people of that region always lead to a better future for them ?
286742	What is the meaning of Hindi words ` Shubh' and ` Laabh' ?
286743	What is the best online-job for writers ?
286744	What are the best online jobs ?
286745	What elements of your job interest you the most , and least ?
286746	Grapich designer demand in India ?
286747	Will computers ever be able to perform actual intelligence ?
286748	What are the best dance songs from the 70's ?
286749	What are the best dance songs from the 80's ?
286750	Suggest a best app to download videos or songs from windows lap ?
286751	Why the fall of China worry us ?
286752	I was given an assignment of ` In situ ex situ conversation of biodiversity' in Environmental science subject of my college . How can I make it ?
286753	I have got 85 % in my 12th and I'm a non - maharashtrian , will I get a seat in Fregusson college under bsc environmental science stream ?
286754	Which iOS DLNA player lets you configure a connection to localhost to stream over SSH ?
286755	Which iOS SSH apps use the ssh : / / hook for cross-app launching ?
286756	What are some of the questions to ask on rural women's day ?
286757	Is celibacy normal ?
286758	Is celibacy possible ?
286759	Is it legal to own a pet fox in California ?
286760	Can CBSE improvement exam be given from another region ?
286761	In India people like electrician plumber carpainter etc fooling people I feel after making my home ?
286762	How can I get a body like Conan Mcgregor ?
286763	Is it worth buying Magic the Gathering booster case ?
286764	What is the best starter deck for Magic The Gathering ?
286765	How do I get best car repair service center in Gurgaon . . ?
286766	Should I buy a motorcycle or a car ?
286767	What is Captain Marvel's story ?
286768	What is Captain Marvel's weakness ?
286769	What is pe ratio ?
286770	How is a PE ratio calculated ?
286771	How do charity donation websites make the revenue for the running of the website , and the support of the staff ?
286772	What does it mean when someone stare at your lips ?
286773	Today after hearing Dr Pankaj Narang Death case , Is Delhi very unsuitable place to live in India ?
286774	Has anyone tried Domino's Quattro Formaggi Burst pizza ? How is it ?
286775	How much tax does Domino's charge on a pizza ?
286776	Are there any schools that offer courses in metamathematics to undergraduates ?
286777	What does it mean when your younger sister dreamed about you wearing a wedding gown and is getting married to a brazilian japanese guy ?
286778	What can echogenicity levels of the liver tell you about your health ?
286779	Why did Indiana develop here ?
286780	Why is there a place called Indiana in the USA ? How did it get the name Indiana ?
286781	Could Congress prevent a President elect from becoming a President if he/she violated State law , or does this only apply to Federal law ?
286782	What is going wrong with me ?
286783	What's going wrong ?
286784	Any blogs about solo travel in India by men and also any portals avaliable to meet other solo travellers ?
286785	If I told my gf to make my photo as dp , is it wrong ?
286786	How many hours should I spend Quora each day ?
286787	What percentage of donations to Greenpeace go towards paying their street team to solicit more donations ?
286788	What is the estimate of how much teens donate or raise toward charity each year in the us ?
286789	How can one answer a critical reasoning question in an easy way especially for a beginner ?
286790	Why is metal considered satanic ?
286791	Is Halloween satanic ?
286792	Why don't imgur images show up in Google Image Search results ?
286793	Where Imgur store all that images ?
286794	How do Native American tribes commemorate death ? What ceremonies do the Pueblo Tribe practice ?
286795	How does USPS forward packages ?
286796	What is the difference between 2D , 3D , 4D , 5D and 9D movies ?
286797	How a student is going to manage his course fee in iIIM's if he is from poor background means he is not going to bear the amount of fee ?
286798	What's the best ap calculus ab problem book that'll enable me to do any problem pertaining to that topic ?
