523417	What does it mean when someone says change of scale or change of origin?
523418	How do you change bin limits or class ranges in R Histograms?
399359	Does deactivating Facebook hinders you as a blogger to gain traffic?
399360	Are there any non-PHP LMS that is compatible with SCORM 1.2 and 2004?
520089	What did Russia find out about Trump?
520090	Is the story about Donald Trump's own emails and his ties with Russia really true?
273262	Home Renovation: How to pump water out of a lake?
20681	Where can I get all the background music without the voice (of the singer)?
340085	How would I benefit from studying a computer science degree?
340086	What are the benefits of studying Computer Science?
127657	Military and world conflicts: Why is the Pakistani army unable to defeat the Taliban?
127658	What kinds of military technologies does the Taliban possess?
439675	Anyone using a Morphy richards microwave MWO MBG?
439676	Could a large microwave be used as a cage for small animals?
221307	How would you convert an MP3 file to a .dat file?
352152	Who was or is the most influential philosopher of all time?
352153	Who is the most influential living philosopher?
426333	What do people think of Electronic Dance Music?
426334	I have 60% till my 6th sem will I get admission in mcmaster university?
49747	What are examples of a rational choice theory?
49748	What is rational choice theory? What are some examples?
495765	When thinning hair, which of thinning shears, razor, or normal scissors damages hair least?
495766	How do you determine the rate of diffusion?
74164	What are the things that separate India from other countries making it unique in that special way?
450345	What is tensile stress and how is it calculated?
521543	If the energy remains constant what explains the increasing work and labour that current day humanity does each day,will we reach equilibrium?
521544	Why are Muslims supportive of Mosque Noise Pollution around the world?
251929	Whom should I contact if my employer doesn't pay me , or in case of disputes in payment?
251930	What is the list of organisms by chromosome count? How are they different from each other?
20060	Is it okay to use my phone's turbo charger on another phone?
20061	Can I use Motorola's Turbo Charger in other phone which has a input of 5V?
164658	Why do spiders eat flies?
164659	What do spiders eat?
280784	What is the possibility that we will meet with aliens?
72960	When will we meet aliens?
41506	Do any companies offer credit card reading hardware for accepting mobile payments in Latin America, specifically Peru?
41507	Will your business always accept credit card payments?
255827	Hyderabad, India: What places does Old City Hyderabad consist of?
255828	What are good places for bachelors to live near the Q City at Hyderabad?
264648	I'm appearing for the JEE 2016. Is it possible? How do I prepare for getting into IIT Bombay if I start studying from today?
264649	Is it possible to crack JEE advanced 2017 by self study with an AIR under 1000 if I start preparation from scratch from jan 2016?
122130	How does Cotton Hill die?
255145	How do I get a scholarship to study in abroad?
58939	Which book is best for learning advanced HTML?
58940	What are the best books to learn advanced html?
265484	How about semipermanent eyebrows? Would you try it?
281329	Can I legally try to make myself immune to all poison and venom? How would I go about it?
252520	How and where to sell luxury watches like Rado, Patek Philippe, Chanel etc?
252521	How and where to sell luxury watches like Rado, Patek Philippe, Chanel etc in India or internationally?
496885	Do men know if their gf/wife is a virgin or not?
496886	Do all men need virgin wifes?
464362	Can we apply hair wax daily?
338590	Should we use hair wax daily?
307676	Can I continue laser hair removal with roaccutane?
307677	What are some characteristics of a 3-months old Rottweiler?
253880	How much water would it take to put out the sun?
253881	If one trillion buckets of water don’t really affect the Sun, what about 10 trillion or 100 trillion buckets? Can we put it out, hypothetically?
67976	Will BJP win UP Elections in 2017? What strategy should they use to win the voters' trust in UP?
419029	How do you find your Health First policy number?
525908	What is the difference between simple past and present perfect tense?
525909	What are the differences between the English perfect tense and past tense?
185471	Is the reason white women are attracted to black men when they get older because they are initially afraid of them as children?
481696	Why do some men scare and stress when it comes to be intimate with women? Are they afraid of pussy?
196822	Who will win the 2020 presidential election and why?
24699	Who do you think is the happiest person in the world?
24700	Are you are the happiest person in the world? Why?
293863	How to build non-lethal weapons?
293864	What are some non-lethal weapons technologies?
203820	What is the future for a petroleum engineering student? Is it still safe?
19255	How often do US high schools typically hold reunions? How are the reunions funded?
163059	If you skip the first (5-year) high school reunion, will everybody have forgotten you by the second (10-year) high school reunion?
303599	How do I become a user experience designer?
327204	Who seems to be winning the presidential race?
327205	Who is the likely winner of the presidential race?
293898	Can I live without a driving license?
293899	Can I live without a drivers license?
139805	Could you actually buy a country if you could afford it?
139806	Apart from Western countries, which other countries actually benefit from a democracy?
104022	If a genie offered you three wishes, what are safe wishes to make?
249948	What are your three wishes for the genie lamp?
323527	Am I the only one who wants to get away from home at the age of 24?
372590	I'm 19 and I am fed up of studies and don't want to stay at home. I want to live an independent life away from home. What should I do?
344122	What is Personal Life?
344123	What are your personal life facts?
337482	What are the cheapest college/university in Canada for international students?
337483	What is the most expensive university in Canada for international students?
322490	What would you do if you found yourself tied to a chair after a night of heavy partying?
322491	Which type of shoes suits best for night parties?
24045	What import duties and taxes are applicable on products imported into Norway?
24046	What import duties and taxes are applicable for products imported into Chile?
170946	What is resistive touchscreen and capacitive?
339399	What is a capacitant?
341753	Is there any jobs after complete my diploma in mechanical engineering?
221970	What are the job opportunities after completing diploma in mechanical engineering?
399523	How do I download PHP?
399524	How do I install PHP?
487056	Where do career inspiration comes from?
487057	Where does inspiration come from?
363822	What skills do self-taught programmers commonly lack?
363823	What does it feel like to be a self-taught programmer?
416382	Which is the most upvoted answer on Quora?
160611	What is a way to get girls on Omegle?
93077	Why don't all the passengers jump out of plane if the plane is going to crash but flying stable enough?
93078	During a plane crash why don't passengers just jump out of the plane?
113748	Love marriages or Arrange marriage? Which is better
537505	What happens if you start pounding your chest in front of a gorilla?
537506	What will happen if a gorilla punches a human?
140554	What is the best service to manage a postal mail box (virtual PO box)?
140555	If your startup used to receive mail at your office sublet address, but then you moved and set up a PO Box, how do you get your old mail?
464788	What is the average customer acquisition rate of Asana?
464789	What is rent the runway customer acquisition?
146582	What are your best weight-loss tips?
146583	How do I lose weight, suggest some exercise and diet?
258326	Has the brace position on a plane ever saved anyone?
258327	Does the brace position on planes work, or does it kill people?
338713	How do you create a second gmail account?
76290	How do I create a fake Gmail account?
99658	Will others see a direct message sent to someone in instagram?
430302	"How do you solve the ""system partition is not allowed to be formatted"" error?"
430303	"How do I solve ""Unhandled Exception Caught"" error in Call Of Duty: Black Ops II for Windows 7?"
289017	Hey everyone, I'm a 28 year old woman going back to college for Computer Science after an 8 year gap from associates degree, am I too old for CS? Does it matter what college for big name employers to hire me (..I.e western michigan vs michigan state) if I graduate quicker?
289018	25 years old with an associates degree. Is it too late to go back to school to become a lawyer?
245319	What is the green card policy at Tata Consultancy Services USA?
245320	What is your review of Tata Consultancy Services?
210738	What are some of the best lyrics in a romantic song?
289935	How does it feel to be loved?
76283	How can I wait patiently for God for me to get married?
137460	How many months should I wait for a company to call me for an intership?
386557	"How do I change my life by the ""20 minutes rule""?"
386558	How can I change my life in 20 minutes?
108389	What is the difference between spandex and compression shorts?
108390	Are compression shorts considered to be underwear?
464774	What are the differences between elements, compounds and mixtures?
464775	What are the differences between elements, compounds, and mixtures? What are their similarities?
196228	What/who is Uber?
140864	"What does the Chinese word ""煥森"" mean?"
234438	How do I keep zippers from falling down?
270915	What will happen if I take Panadol and Coca Cola instead of water?
270916	Do I take any risk if I down medicine with Coca-Cola instead of water?
280577	How can I run Python 3.5 code if I have Python 2.7 installed?
280578	How can I run Python 2.7 code if I have Python 3.4 installed?
472648	Which is the best site to download English music?
111436	Is there any Free calling app by that make call without mobile verification?
46979	How can I make free calls without Internet?
378571	How is an international SIM card better than international roaming cards?
378572	How are international SIM cards better than international roaming cards?
389464	Why do India still pay cess forced for Bangladesh war?
389465	Why do India pay cess forced for Bangladesh war?
444659	What are some questions one should never ask?
468130	Is living a life with bipolar still worth living?
468131	Is a life with bipolar still worth living?
429685	I am in final yearhow to get placed in VLSI field without doing any courses in VLSI after my b.tech?
172659	What are the required courses in the field of VLSI that students must take to get jobs in professional companies?
528646	If your daughter and her boyfriend got into a massive fight, would you block her boyfriend from speaking to her?
528647	Should I let my daughter cheat on her boyfriend?
494672	What do lawyers do?
103763	What did Mexico do in World War 2?
466876	"Is there any good, realistic thriller anime like ""Monster ""?"
466877	Can someone quit their violent past?
454790	Who is your favourite artist and why?
454791	Who's your favourite artist?
352042	How do I prove that [math] a^n + b^n [/math] is divisible by [math] a + b [/math] when [math]n[/math] is odd, and is never divisible by [math] a - b [/math]?
449703	Can Any Person has 6/9 vision with glases?
449704	How do I solve m/6 +9 =23?
356473	What are tips and hacks for new ride-sharing drivers in Denver?
149943	What are tips and hacks for new ride-sharing drivers in Pittsburgh?
503804	What are some things new employees should know going into their first day at Cabot Microelectronics?
503805	What are some things new employees should know going into their first day at Cabot?
66097	Why do so many people still believe we have been to the moon in 1969 despite all the evidence (that we haven't) 50 years later?
66098	Why do so many people believe we DIDN'T visit the Moon 50 years ago, despite all the evidence to the contrary?
499231	Which is the best activity of SEO?
499232	What is the best activity of SEO?
172862	I want to start writing. How and where do I start?
219836	How can I improve my English through self study?
219837	How can I improve my English by self-studying?
402514	What is your biggest regret in life?
402515	What is your biggest regret in life, but you are happy it happened?
277746	What is the hardest decision you've made?
277747	What is the toughest decision you've ever made?
86938	What are the best films to watch on YouTube?
394962	We all feel electrical shocks. Which is really responsible for the shock, voltage or current?
394963	What would happen if you got an electric shock of very high voltage at a very low current?
58104	Have you ever had a dream and that dream came true? What was that dream?
168060	Which area was more important to the Ottoman empire, the Balkans or Anatolia?
168061	What was the impact of the Balkan wars on the internal policy in the Ottoman Empire?
420034	How does the $9 computer work?
420035	How does a computer work?
101631	What are the 10 best English TV series to watch?
234973	Who are the best doctors?
234974	Who is the best Doctor (in your opinion)?
124867	As an American moving to Australia, what are some of the biggest benefits as well as challenges that I will face?
124868	What is it like moving from U.S. to Australia?
125008	What do startups expect from mentors?
104086	I'm 19 and I want to be a multi-millionaire. I have no work experience, no job, no money. I want to start my own business. What's a good field to get into?
5973	Why are specs & sunglasses so expensive?
5974	Why are Ray-Ban sunglasses so expensive?
508261	What can you do with a nutrition degree?
465632	What is nutrition?
337431	Who is the Replicator?
337432	Who is the Replicator in criminal minds?
444903	9.Sulfur dioxide and bromine and water react to form hydrogen bromide and sulfuric acid (H2SO4) . SO2+Br2+2H2O→HBr+2H2SO4 S2O+2Br+2H2O→2HBr+H2SO4 SO2+Br2+H2O→HBr+2H2SO4 SO2+Br2+2H2O→2HBr+H2SO4?
444904	Is SO2 a Lewis acid or base?
149755	Which of the organs perform the following function in human [1] absorption of food?
149756	Which of the following organized crimes do you hate/despise the most? Drug trafficking or human trafficking? Why?
489927	How can taking part in a drama club impact a student's life?
489928	How does drama mirror real life?
43477	What are some taboo topics that shouldn't be taboo?
184884	I am confused about should I learn things in front end development only or learn about data science?
184885	If it wasn't Tchalla, what character of marvel would you be playing?
263428	To have an online shop in Hong-Kong, what payment and delivery options should I implement to cover 90% of the cases?
263429	What is there to do in Hong Kong for Chinese New Year? Anything special that I should be aware of?
477291	I think I have a thin and small penis. My erect length is 5.5 inches. But girth is only 4 inches and even less near the head?
231276	"What is the true meaning of this line ""Most friendship is feigning, most loving mere folly""?"
231277	Should I end a friendship with a girl who friendzoned me after I told her that I had a crush on her?
495866	How is the ACLU funded? How are the funds used?
58794	What's the ACLU been up to?
129520	What is the meaning behind the tinder logo?
129521	What is the story behind the Best Buy logo?
532615	How does one deal with annoying situations?
532616	How to deal with an annoying class?
178867	Are people afraid of the truth?
377184	Are people afraid of the truth or do they just not care?
287989	Why is void main illegal in C++?
381880	"What are ""natural rights""?"
381881	What are some Natural Rights?
452142	What is the best online course for learning the Bible?
227889	What is the best online course to learn R?
311741	How do I request for a song in Gaana?
311742	Could anyone go for 3 days straight, without sleep?
191009	Why does it take so much effort to lose weight?
232921	Drupal (CMS): Where the hell are the new modules I've installed on the menu?
232922	Is there a good Drupal 7 Statistics Module?
70649	I have an idea to sell for Facebook, how can I sell it?
202910	How do I sell my idea to Google?
410420	Why is one rock the raw material for another?
135239	What type of raw material is used for paper cups?
446494	"How do you dispute a ""disobeyed traffic control device"" ticket in NY?"
446495	What can cause a traffic ticket to not be in the system?
239177	What is the difference between fava beans and lima beans?
239178	Are beans potatoes?
286495	How do I become a multi-millionaire within a few years?
220504	Can a user interface be patented?
220505	How defensible are user interface patents?
401292	I am a pre-medical student and kind of homesick. I want to go to another city far away from my home in order to study in the best academy, but I have a very limited time. Also, hostel problems scare me. What should I do?
401293	I am a 12th pass student of science. I am preparing for medical entrances. I also want to become an astronaut. What should I do in the future?
289792	How many 6-digit even numbers can be formed using the digits 1, 2, 4, 5, 5, and 6?
218801	How do you write a short story?
128918	Can someone hack my snapchat password?
307191	How can I have sex with my teacher?
307192	How do I make my teacher have a crush on me?
419298	Why will a 3 phase AC supply produce a rotating magnetic field only in an induction motor but not in a transformer?
419299	Will a rotating magnetic field produce a 3-phase AC supply only in an induction motor and not in a transformer?
279347	What is difference between offsite and onsite work?
279348	What is one’s salary after doing MTech from IIT?
447242	What is the first thing you should do when you wake up?
202453	Do you expect another copyright term extension act before copyrights start expiring in 2019?
202454	Should copyrighted material expire after the copyright creator's death?
422250	Is Java a compiled language or interpreted? What is the difference? What is JIT compiler?
510371	What do you want a skincare app to have?
374075	How can a skincare app help you? What features would you want it to have?
200028	How do I stop seeing the same question which I am not interested on my quora feed?
357650	What statistical procedure would be used to determine black money after demonitisation?
357651	Wil I be able to pursue MTech Electricals after BSc Physics?
532793	How do I change the background of my Google Chrome home page?
113285	What is your strength and weaknesses?
185759	How much time does TCS take to give the off campus fresher offer letter?
185760	How much time does TCS take to give the off campus freshers the joining letter?
404566	What are the daunting problems of India?
251367	Dominion (card game): What are some good Native Village strategies?
185928	Dominion (card game): What are some good Village strategies?
257332	Who are the most underrated actors in Hollywood and Bollywood?
291312	Who is the popular politicians in Chhattisgarh?
512016	How long does it take to cook pork chops?
513619	Is Clonazepam (Klonopin) a antidopaminergic medication?
513620	Is Klonopin an antidopaminergic medication?
392407	What are some stereotypes people have about Turkey?
392408	What are the major stereotypes people have about Turkey and to what extent are they true?
34966	What are the best websites in Germany for classified ads?
34967	What are some of the best classified ads sites in Uruguay?
240517	Was there a remake of the movie Roman Holiday in color?
240518	Are there any movies that need a remake or reboot badly?
251643	How many hostels are there in the Dayanand Sagar college of engineering for engineering students and what are the per-semester fees for them?
251644	What is the minimum hostel fees in ssn college of engineering chennai?
160614	How can I download content from a torrent on a torrent-blocked WiFi?
360098	Where could I find someone with a Google developer account to upload an APK for me that's made by me?
287787	Will copying and pasting from Google make me a bad developer?
385967	I live in the San Francisco area, where can I get a corgi puppy? Any recommended breeder?
385968	What are the largest classes at Wesleyan University, CT? Are they worth taking? What is the workload like for them?
112015	What would be the benefits of a land value tax in the US?
112016	Are taxes on land values practical?
289157	Do people get smarter as they age?
289158	Do people get smarter with age?
49376	What is a better car, the Mercedes Benz G LA or the Acura RDX?
78641	How much does intelligence depend on one's ability to retain information and remember concepts?
316817	Why isn't Iran an Arab country?
180699	How can I learn programming from zero ability to become an efficient programmer?
121517	How can I learn programming from zero level?
119278	Will the price of the iPhone SE be reduced?
119279	Has the price of an iPhone 6/6S gone down since the SE introduction? Will it?
225510	What is the second largest planet in the solar system, and how does its composition compare to Uranus?
491212	What are some good ways of investing a small amount of money? ..lets say 500$.
220102	Which is the best way to invest small amount of money?
65487	Can walking for 7-8 km a day help in weight loss?
492255	How can I loose 7-8 kgs weight in 15 days?
344914	Why do we read fiction?
27080	Theoritcally, which human race is the most adavanced/evolved in every aspect?
27081	Which human race is most evolved?
355252	She flirts with me but says she only likes me as a friend. What should I do?
355253	I thought she loved me. Now she says she only considered me as a friend. Was I wrong? What should I do next?
463036	What are some good short term courses that I can do along with CA so that it benefits me and gets reflected on my C.V.?
308693	Technology: Is it safe to stand close to a running, newly manufactured microwave oven?
308694	Is it safe to stand close to a microwave oven?
182440	Do people who have never heard of Christianity go to heaven?
182441	Can uncontacted peoples go to heaven even if they have never heard of Jesus?
514576	How is the unemployment rate calculated?
514577	What's the youth unemployment rate in the US?
532283	Is there any effect on my US VISA/GC application, if I have a bad credit score on my SSN?
532284	I got denied with my first credit card application. My credit score is above 700. Why is that?
218235	Are Marvel's Daredevil and upcoming Punisher TV shows part of the same universe as the Marvel Movies? If so will they be featured in future movies?
483298	What would be my in-hand salary every month if the offer is 20 LPA CTC?
225684	How do horizontal and vertical stressors compare and contrast?
384070	What happens when you don't eat after exercising?
431003	What is the political theory of niccolo machiavelli?
227759	How much would it cost to invent immortality?
259098	What are the best websites a circuit maker should visit?
214038	What is the difference between article and essay?
214039	What's the difference between an article, a paper, and an essay?
430846	Which is better i5-7th generation or i7-6th generation?
430847	Which is better 4th generation i7 or 6th generation i5?
237935	How do I decorate a bedroom with a 1989 theme?
494954	How is Rohit Kapoor so knowledgeable?
476263	Who is Rohit Kapoor?
340109	What are some practical business uses of the HTML5 canvas element?
451044	What is the best platform for mobile phone?
96633	What is your favorite aebleskiver recipe?
433868	Hacking a password?
535026	Can we clean a tempered phone glass with alcohol like the screen without having problems?
234077	How do I cut my mobile phone's tempered glass at home?
40306	Can you offer some tips on how to make a long flight with ten month old comfortable, for both, the baby and fellow travellers?
40307	What are good tips for a long flight with a 10-month old baby?
282112	Why would a guy avoid/ignore you after hooking up?
282113	Why do guys start ignoring girls after showing all the signs he likes her?
510065	What are the working days of a post office in India?
498279	What is it like to work at Amazon in India?
12074	How safe is it to travel to Kanyakumari alone?
12075	How safe is Kanniyakumari?
438478	Why do people work so hard in life even though they know that nothing they have done or ever will do will remain with them?
438479	Why is my life so bad? All of my friends have a Mercedes while I can afford a used Honda Civic. Why can't I afford things even though I work hard and help out?
143640	How do I know if someone is a sociopath or an introvert?
50401	What song has you obsessed right now?
168950	What song would describe your life right now?
105724	I am 14 years old and my height is 4 feet 6 inches. What will be my adult height?
237353	What is the new technology behind new 2000 rupee note?
274350	What is special about the new 2000₹ note?
475112	Who will form the government in Uttar Pradesh in 2017 elections?
356098	Why don't many people from Tamilnadu support Narendra Modi's Government?
244354	What are must-see places to visit in Ireland?
100397	What are the must-visit places for those visiting Australia for the first time?
206153	"Who composed the music used in the Crown Royal commercial ""The One""?"
206154	What is a good way to compose music?
108301	Why do you love living in Toronto?
108302	Is Toronto a nice place to live?
273134	What are the best motivational success movies?
126824	What should I know about Iranian (Persian) men?
126825	What do Iranian people do with the goldfish after Persian New Year is over?
387285	What is the difficulty level/standard of question papers prepared by IIT-Roorkee for GATE exams?
387286	What is the difficulty level of JEE papers set by IIT Guwahati?
