test-313480	What does the Giving Pledge do?
test-313481	"What does ""The Giving Pledge"" invest in?"
test-313482	What is the most profitable legal cash crop that an inexperienced farmer could plant on five flat acres in Northern California?
test-313483	How do cash crops affect GDP growth rates?
test-313484	Can I gain muscle by doing only push ups?
test-313485	Do sit-ups and push-ups stunt height growth?
test-313486	How is the Symbiosis Institute of Management Studies (SIMS) Pune for an MBA for a non defence student, i.e open category?
test-313487	Symbiosis Institute of Business Management, Pune: Are the career opportunites for E&E and OM branch at SIIB and SIOM good? Are they good choices to pick up?
test-313488	How can I make money from my website?
test-313489	Earn money from websites?
test-313490	Why is my internet really slow all of the sudden?
test-313491	What do you do if your RCN internet is slow?
test-313492	When does nlsiu bangalore provide year end holidays?
test-313493	What did hazrat muhammad saw father do?
test-313494	"How much does a movie ""extra"" earn in a day in the US?"
test-313495	How much does an average movie theater make in a day?
test-313496	I did not operate hdfc saving bank account and now I have negative -7730 in my account. can I pay or not…?
test-313497	As a budding musician, which music app must be good for music promotion?
test-313498	Why do people say Dhoni is a better captain than Ganguly?
test-313499	Who according to you is the better captain, Ganguly or Dhoni?
test-313500	What should I do to keep myself motivated?
test-313501	How do I keep motivated?
test-313502	What can you tell me about YK11?
test-313503	Can any one tell me my face shape?
test-313504	I'm a girl how do I know if a girl likes me?
test-313505	How do I tell if a girl likes me? And if so what do I tell her?
test-313506	Why do I care so much about what others think about me?
test-313507	How can I stop myself from being affected by what other people think about me?
test-313508	How does the new Mashable velocity graph work?
test-313509	CNN to buy mashable for $200M? is the news real?
test-313510	How much does an IPL ticket cost?
test-313511	In the IPL, many sponsors like Pepsi and Vodafone are giving free tickets. How can I get those tickets?
test-313512	What is a new slogan for save the environment?
test-313513	What are some save environment hacks?
test-313514	What are the top healthcare startups or life sciences startups in Mexico?
test-313515	What are the top healthcare startups or life sciences startups?
test-313516	Which dasi spirit were killed by Sri Krishna?
test-313517	Which demons were killed by Sri Krishna?
test-313518	What is the difference between Computer Science, Electrical & Electronics, Electronics & Instrumentation Engineering?
test-313519	What is the difference between the following : Electrical Engineering(EE), Electrical and Electronics Engineering(EEE), Electronics and Communications Engineering(ECE), and Electronics and Instrumentation engineering(EIE).
test-313520	"What is a more informal way of saying ""all the best for your future endeavors""?"
test-313521	"What is an alternative phrase for "" All the best for your future endeavors""?"
test-313522	Is a 7 GPA at Amrita University equivalent to 70 percentage point?
test-313523	What is the best thing that you learned from Amrita University?
test-313524	"What is the definition of ""despot""? How can it be used in a sentence?"
test-313525	"What is the definition of ""usurp""? How do you use it in a sentence?"
test-313526	How many stamps do you need to send letters within the United States?
test-313527	How many stamps do I need to send a letter in the usa?
test-313528	What is Lutyen’s journalism?
test-313529	What is international journalism?
test-313530	How it will effect Indian economy after banning rs.500 and rs.1000 currency bills?
test-313531	What will be the implications of banning 500 and 1000 rupees currency notes on Indian economy?
test-313532	Can anyone give me an introduction about PYTHON in brief?
test-313533	"Should I major in computer science if I don't really ""love"" writing code?"
test-313534	"What does it mean when a job listing says ""Salary DOE""?"
test-313535	"What does the saying ""There's no job too small"" mean?"
test-313536	What are the best gift recommendations for mother's day?
test-313537	What will be the best gift for my mother this Mother's Day?
test-313538	What does a secondary coil do in transformers?
test-313539	What is the recipe of chana chor garam?
test-313540	How many parts are there in the human body?
test-313541	What is the last body part to rot when a human being dies?
test-313542	Where can I deposit old Rs. 500 & Rs. 1000 notes after 30 December 2016?
test-313543	Why did PM Modi fly to Japan after banning Rs. 500 and 1000 notes?
test-313544	How do I turn off Airplane mode on Windows 10?
test-313545	What is Windows defender? And why does it turn itself off?
test-313546	What's the most embarrassing thing that has ever happened to you, or the most embarrassing thing that you have seen?
test-313547	What's the most embarrassing thing that has ever happened to you in public?
test-313548	I am not here to ask any question, but actually to thank all my seniors from Shiv Nadar University?
test-313549	Which is better to doing training in embedded system sofcon, dkop lab or cetpa?
test-313550	What does Bollywood dancing look like?
test-313551	Which is the most iconic and awesome Bollywood dance step we all love?
test-313552	Can Congress stop Donald Trump from being inaugurated as president until his involvement with the Russian?
test-313553	Can Congress stop Donald Trump from taking the oath of the Presidency until questions about his involvement with Russia have been solved?
test-313554	What are the best books for CBSE class 12 (PCM)?
test-313555	Which reference book is best for chemistry for class 12 CBSE?
test-313556	Which branch can I expect with rank 4000 in muoet 2016?
test-313557	What branch can I expect with a score of 106/200 in MUOET 2016?
test-313558	What is difference between derivative (f'(x)) and differantial (df(x))?
test-313559	I live in Bhubaneswar what are some businesses done near Kiit?
test-313560	What causes the formation of subarticular cysts?
test-313561	What causes the formation of testicular cysts after varicocele surgery?
test-313562	How to... be a good programmer and good developer?
test-313563	How can one define a good programmer?
test-313564	"In ""Macbeth,"" why does the porter imagine he is opening the gates of hell?"
test-313565	Is the myth regarding Macbeth true?
test-313566	What was the worst war to fight in as a United States foot soldier?
test-313567	What might have happened if the Confederacy had won the American Civil War?
test-313568	What is the meaning of swag?
test-313569	What is the actual meaning of SWAG?
test-313570	Will Jats be considered as OBC or as general category students in PSU recruitment through GATE?
test-313571	I had secured a ~400 rank in the CE GATE 2015. Is there any chance of getting any PSU in the OBC category?
test-313572	I don't like being dependent on other people, is this a problem?
test-313573	I don't know what problems I can help people solve, how can I find out?
test-313574	My parents sold some land in Asia and wants to send me money to buy a house in the US, who will get taxed by the US govt?
test-313575	"Ppl who can't question politicians&govt.officials over their duties, ppl who can't even follow trafficrules, Have any right to say""I Love My Country""?"
test-313576	How do you prove that [math]\frac{\mathrm{d} }{\mathrm{d} x} \frac{x}{1-x} = \frac{\mathrm{d} }{\mathrm{d} x} \frac{1}{1-x} = \frac{1}{(1-x)^2}[/math]?
test-313577	How do I find [math] \int_0^1 \frac{1-x}{1+x+x^2} \, \mathrm{d}x [/math]?
test-313578	What is the meaning of meaning?
test-313579	What is the meaning of sibghatallah?
test-313580	"How do you say ""enjoy"" in Japanese? How is used in conversation?"
test-313581	"How do you say ""beer"" in Japanese? How is it used in conversation?"
test-313582	Garage door company Illinois?
test-313583	How do I change a name error on a Facebook page.?
test-313584	"What is the translation of the word ""talkative"" in French?"
test-313585	"What is the translation of the word ""actually"" to French?"
test-313586	Is there a God really?
test-313587	Does god exist? How do we recognise?
test-313588	Who would the Republican nominee be if Trump isn't nominated at the convention?
test-313589	If Trump becomes the Republican nominee would Republicans vote Democratic?
test-313590	Why do some married men have affairs?
test-313591	Why do beautiful women marry ugly men?
test-313592	what rank can I expect with 156 marks in JEE main and 97.6 % in cbse 2016?
test-313593	What rank can I expect if I got 114 in JEE mains 2016 and 97% in cbse boards?
test-313594	How can I get myself to be more expressive?
test-313595	How can I be more expressive?
test-313596	How is medical electronics different from other electronic engineering branches?
test-313597	Is an electronics technician different from an electronic engineer and electronic engineer technician?
test-313598	Career Advice: I am in the finals of chartered accountancy. Should I pursue a CPA or a CFA after it? Why?
test-313599	I am a Chartered Accountant by profession. If I migrate to Australia and want to practice there then what should I opt for, CA Australia or CPA?
test-313600	What are the places to visit for a honeymoon in Kerala?
test-313601	What are the best places to visit on a trip to Kerala?
test-313602	How can one learn Japanese well?
test-313603	How can I effectively learn Japanese vocabulary?
test-313604	How can I convert a JPEG file into .JPG?
test-313605	How do you convert raw files to JPEG?
test-313606	Are you proud of your religion? If yes then why?
test-313607	What makes you proud of your religion?
test-313608	Where can I find CPH4?
test-313609	How is NZT different from CPH4 used in Lucy (2014 film)?
test-313610	How long can swelling last before its a concern?
test-313611	How is life as a fresh graduate in corporate world?
test-313612	What is the difference between contamination and pollution?
test-313613	How can you tell the difference between air pollution and fog?
test-313614	What is the true meaning of freedom according to you?
test-313615	Is it true that to love is to give freedom?
test-313616	Who are the current rising stars in astronomy?
test-313617	Who are the current rising stars in economics?
test-313618	Can smoking cause Pneumonia?
test-313619	Does vaping cause pneumonia?
test-313620	What is wi-fi data in reliance jio?
test-313621	How did the Targaryens rule so long before Robert?
test-313622	Should one consider CSE at PESIT South Campus or EEE at MSRIT in terms of placements and faculty?
test-313623	In terms of placements, faculty, opportunities, internship, and more, which is better: DCSE-CSE or PESIT south campus ISE?
test-313624	Why has Imran khan been a failure in Pakistan politics?
test-313625	Why isn't Imran Khan successful as a politician in Pakistan?
test-313626	Can listening to any type of music help you study?
test-313627	Which kind of music helps you study?
test-313628	How do I ask a question on Quora?
test-313629	How do I add a question on Quora?
test-313630	What pays better, being a commercial pilot or a private pilot?
test-313631	If a person has adult ADHD, can they be a private pilot?
test-313632	Could India and Bangladesh unite again?
test-313633	Can India, Pakistan and Bangladesh unite?
test-313634	What does remustering candidate mean?
test-313635	"What does it mean for a candidate to ""pull nomination papers"" in an election?"
test-313636	What is IPL auction game?
test-313637	How do IPL auctions work?
test-313638	How good is NMIMS Hyderabad?
test-313639	IBS Hyderabad, NMIMS Hyderabad/Bengaluru or UBS Mumbai? Which B-School is better in terms of placements, faculty and campus?
test-313640	Which are the best books to start learning programming?
test-313641	What's the best book for learning to program?
test-313642	I talk to my girlfriend a lot on phone. The problem is that I do not get to be fully romantic with her as I fear someone in my family might listen?
test-313643	From where can I get NEET JEE MAIN AIOTS free Download?
test-313644	"What is the Mandarin (Chinese) word for ""grandfather""?"
test-313645	Is it wrong for an overseas Chinese to not want to learn Chinese Mandarin language?
test-313646	Why do our faces look puffy in the morning just after waking up?
test-313647	Why do my face swell after waking up?
test-313648	Can you delete your question on Quora?
test-313649	How can you delete a question that you asked on Quora?
test-313650	What is the deep/dark web and how do you access it?
test-313651	Can Deep Web be accessed from India?
test-313652	What is the probability that upper age limit of 32 will continue in 2017 for IAS?
test-313653	Is there any change in the upper age limit which had been relaxed the previous year for a general candidate to 32 for the IAS 2015?
test-313654	What is the percentage of fresh water on the Earth?
test-313655	Why is it easier to swim in sea water than in fresh water?
test-313656	If husband and wife have same o positive blood group any problem for children?
test-313657	Will there be any problem if both the husband and the wife are of the same blood group (B+)?
test-313658	Hygiene: If I've accidentally eaten from a bowl that has been licked all over by my dog does it pose a health hazard?
test-313659	Why does my dog take her food away from the bowl and eat?
test-313660	What will be the impact for India if Trump becomes the US president?
test-313661	Will relations between India and the USA get affected with Donald Trump as President?
test-313662	Why does my ankle hurt after any physical activity that involve legs?
test-313663	Should I buy Asus laptop?
test-313664	What is the difference between a controller and a compensator?
test-313665	What is difference between Ic7404 and Ic74c14?
test-313666	In the Harry Potter movies, which side were the Dementors on? If they were recognized for the protection of Hogwarts, then why didn't they help to protect the school in the Deathly Hallows (Part 2)?
test-313667	In Harry Potter, Albus Dumbledore wears the Gaunt ring that is cursed so he will die in a few days. The trio wear the locket until they find a way to destroy it. Why didn't it prove fatal for them?
test-313668	What kind of cell phone does Bill Gates own/use?
test-313669	What phone and computer does Bill Gates use?
test-313670	If [math]a[/math] and [math]b[/math] are positive numbers such that [math]2b=3a[/math], what is the value of [math]\frac{a+b}{b}[/math]?
test-313671	What is the sum of all digits used in writing 1 to 999?
test-313672	Is it OK to spray the toilet cleaners liquid inside the toilet seat without flushing afterwards?
test-313673	If I give xerox of certificate to hr then any problems?
test-313674	"What are some sentence examples using ""credible""?"
test-313675	"What are some sentence examples using ""credibility""?"
test-313676	Who is Anonymous on Quora?
test-313677	Why is downvoting anonymous on Quora?
test-313678	Should I believe in astrology?
test-313679	Do you believe in astrology?
test-313680	What does it mean when an NFL referee throws his hat at a play?
test-313681	What does it mean to clear waivers in the NFL?
test-313682	Where can I get best locksmith services in Sydney to repair and install any type of lock?
test-313683	Where can I get quality services in Sydney to repair door locks, customised window locks, sliding door locks, etc?
test-313684	How can one overcome the fear of failure?
test-313685	How can overcome the fear of failure?
test-313686	Why do Muslim women wear the burqa?
test-313687	Why do Indian Muslim women wear a Burqa? Who started this superstition?
test-313688	Why do people believe in heaven and hell?
test-313689	Can Hindus believe in heaven and hell?
test-313690	How can I increase my Internet access speed?
test-313691	Is it possible to increase my internet speed?
test-313692	How many parts are in an aircraft?
test-313693	How many aircraft industries are there in the world?
test-313694	How can I charge my iPhone without a charger?
test-313695	Can I charge my phone with a charger that outputs different amperes than my normal charger?
test-313696	I think my house is haunted, what's the first thing to do?
test-313697	How do we come to know if our house is haunted?
test-313698	Do you believe that people should have the right to choose how and when they want to die?
test-313699	Does a person have a right to die?
test-313700	What are the four stages of infection?
test-313701	Is my cut infected?
test-313702	How do I find investors for my idea?
test-313703	Where can I find Investors to fund my new mobile app idea?
test-313704	Does friction depend on area of contact? If yes, then which term in the formula f=uN accounts for it?
test-313705	Why does force of friction not depend on area of contact between the respective surfaces?
test-313706	Cloud Storage: How do Dropbox and Google Drive compare?
test-313707	Do Amazon S3, Windows Azure Storage, and Google Cloud Storage have tape backup for their storage?
test-313708	How do you get a cash advance from American Express?
test-313709	How do you find how much interest your paying on a cash advance?
test-313710	Does Donald Trump support Israel?
test-313711	Is Trump pro-Israel?
test-313712	What does it feel like when your child gets expelled from school?
test-313713	What is it like to lose a child?
test-313714	What are the best phones under Rs.10000 except Yureka and Samsung?
test-313715	What is the best phone under 10k in India?
test-313716	Why some people like something and another don't ?
test-313717	Why do people you like, don't like you?
test-313718	What are the most popular YouTube tags?
test-313719	What are some of the most common and utilized YouTube tags?
test-313720	What are the pros and cons of online fame?
test-313721	What are the pros and cons of fame?
test-313722	My Instagram account is set to private. If one of my followers likes my photo, does it appear to their followers on the following feed, or are liked private photos not shown on the following feed?
test-313723	Can instagram likes of private profiles be visible to other followers?
test-313724	How do I unarchive a conversation on Facebook Messenger?
test-313725	Who designed the Facebook chat stickers?
test-313726	Why do British accents dominate the American drama, Game of Thrones?
test-313727	Who has the best accent in Game of Thrones?
test-313728	Why do folks ask questions on Quora that a Google search could answer faster and more accurately?
test-313729	Why do people ask stuff on Quora that they could just google and find out themselves?
test-313730	If 60% of 3/5 of a number is 36 then the number is?
test-313731	When 60 is subtracted from 60% of a number, the result is 60, then what is the number?
test-313732	What ways are to become stock broker in india after btech?
test-313733	How can I become a stock broker in India? Is it worth it?
test-313734	What's your bed time routine?
test-313735	What is your night time routine?
test-313736	What is the pH of 1 molar H+ solution?
test-313737	How is the pH and the pOH of an aqueous solution calculated?
test-313738	How much time should I spend on networking per day?
test-313739	How much time should I spend on the internet per day?
test-313740	Is there an encyclopedia on paradoxes?
test-313741	Which is the Power electronics device use to increase frequency except cycloconverter?
test-313742	How do you roll up your shirt's sleeves, so as the contrasting color on the back of the cuff shows?
test-313743	I am looking for long sleeve, high neck/back body shirts to layer under clothing and dresses. I want to purchase bulk. Where can I find them?
test-313744	What are the average costs of remodeling per square foot in Silicon Valley?
test-313745	How much is concrete per square foot?
test-313746	In how many different ways can the letters of the word 'MATHEMATICS' be arranged such that the vowels must always come together?
test-313747	In how many ways can the letter of the word “Kebetulan” be arranged if the vowels are next to each other?
test-313748	What is the time zone at the North or South Pole?
test-313749	If I am standing at the North or South Pole, which time zone am I in?
test-313750	What are some words to say or text a woman to convince her to sleep with you?
test-313751	"If a woman texts back ""Aw, that's very sweet, thank you"" when you text her about how hot she looks in a photo, are you getting blown off?"
test-313752	What can one do if he/she has forgotten to take the printout of the application form for the IBPS PO exam?
test-313753	Which exam is tough LIC or IBPS PO?
test-313754	How much marks are required for under 3000 rank in jee advanced 2016?
test-313755	How much marks should I get for rank less than 5000 in JEE advance?
test-313756	What's the best book about Chandragupta Maurya?
test-313757	Which is the best book on Chandragupta mourya?
test-313758	How do I my find a girlfriend?
test-313759	How do I find a girlfriend?
test-313760	How do I start talking to a girl again?
test-313761	How can I learn to start talking to girls?
test-313762	Which part of a neuron can act as a receptor as well?
test-313763	What are the parts of a neuron? What is their function?
test-313764	I can't keep my face straight when I talk to my seniors at the office. Is this some kind of syndrome?
test-313765	I can't keep my face straight when I talk to my seniors at the office. What kind of syndrome is this?
test-313766	How do I hide my last seen on Facebook?
test-313767	How can we hide last seen on Facebook?
test-313768	Where is the best place to have a cheese platter in Paris?
test-313769	Who makes the best cheese in America?
test-313770	Which services are built around the Uber model?
test-313771	Which is better: Uber or Ola? Why?
test-313772	What are the best make up lines for black women?
test-313773	Do Brazil men like black women?
test-313774	How can I get my friend's WhatsApp messages on my phone?
test-313775	Why do I stop receiving Whatsapp messages if the phone is left idle for long?
test-313776	What are all the boundaries a girlfriend should not cross?
test-313777	Are there any science research bases in the deserts of the world?
test-313778	Which are the best coaching institutes for NDA?
test-313779	Is hotel green park safe?
test-313780	How does one become a sociopath? What makes one?
test-313781	How can someone become a sociopath?
test-313782	What is the counselling status in Manipal university for b.tech 2016?
test-313783	What is the counselling status for CSE and IT at Manipal University 2016 (all campuses) ?
test-313784	What's the origin of the word 'word'?
test-313785	Why is Quora called Quora?
test-313786	What are Linux and Unix?
test-313787	Which one is easier to learn, Linux or UNIX?
test-313788	How is XLRI as compared to IIM A, B, C and L in terms of reputation and placements' mean salary package?
test-313789	What are the average and maximum packages out of IIM A/B/C?
test-313790	What is the best age to get married for a man?
test-313791	What is the best age to get married for a woman?
test-313792	What is the reason why dewclaws are so important to remove from Boxers?
test-313793	Why does matte foundation make my face oily?
test-313794	How do I develop the power of my subconscious mind?
test-313795	"How good is the book ""The Power of the Subconscious Mind"" by Joseph Murphy?"
test-313796	Is it possible implement a Meta-State-Machine using Boost api and ROS architecture?
test-313797	I have a 6km kidney stone on the upper right side of kidney do I need surgery or oral meds to remove it?
test-313798	How realistic is the concept of smart city?
test-313799	What is the concept of a smart city?
test-313800	25, brain injury, need to regain knowledge. What's the basics I need to know about life?
test-313801	Would a Louis Vuitton belt be good for everyday-wear?
test-313802	Why does cats behave very strange and crazy?
test-313803	"Do publication dates tell you everything about the date of a book's ""creation,"" or only about the edition of that specific copy that you have?"
test-313804	How famous was Shakespeare when he was alive?
test-313805	If William Shakespeare wrote in broken English grammar, why is he so famous for his literary works?
test-313806	How does Paytm work?
test-313807	If I ask Paytm to be the exclusive payment platform for my business, would they pay me? If yes, how would that work?
test-313808	What blog post would you read?
test-313809	What is a blog post?
test-313810	How do you want to be remembered after you die?
test-313811	What will President Obama's legacy be?
test-313812	What are the environmental impacts of the tourism industry and how does it negatively impacted Turkey?
test-313813	What are the environmental impacts of the tourism industry and how does it negatively impacted Guangzhou?
test-313814	How long does it take a cargo ship to go from San Francisco to Hawaii?
test-313815	How do cargo ships deal with heavy storms?
test-313816	Are there any sports bettor who is a multi milionaire on Quora and have made over. 25 million sports betting?
test-313817	Are there any sports bettor who is a multi milionaire on Quora and have made over 30 million sports betting?
test-313818	What is the impact of Brexit on Indian economy?
test-313819	How does Brexit affect India?
test-313820	If I do my LLM from India and then LLM from USA, will I be able to practice law in the US?
test-313821	How do I get a job after doing law from India and LLM in USA?
test-313822	Which is the best place to buy pajama online?
test-313823	Which is the best place to buy nightwear online?
test-313824	Are there any sales of granite jaw crusher in Turkey?
test-313825	Can you find a jaw crusher in Argentina?
test-313826	What can I do to believe in myself?
