test-21499	What is the best route to vemulavada temple from Hyderabad?
test-21500	How do I evaluate [math]\int \mathrm{e}^{x} \frac{x^2+1}{(x+1)^2} \mathrm{d}x [/math]?
test-21501	How do I evaluate [math] \displaystyle \int \frac{\arctan x}{x^2(x^2+1)} \: dx [/math]?
test-21502	How do I calculate the cost of house construction building?
test-21503	What is the cost of the construction of a house?
test-21504	Were Adam and Eve married or are we all bastards?
test-21505	Were Adam and Eve religious?
test-21506	How do I convert CC to mL on a syringe?
test-21507	Is it needed to use same syringe which is given in a pack of Rabipur?
test-21508	What are the advantages of doing MBA after CA?
test-21509	If I do MBA (executive) after CA, what are my future career prospects (salary, scope for promotion etc)?
test-21510	I know we all can be fat, but can and should we all be skinny?
test-21511	What is skinny fat?
test-21512	Could India and Pakistan unite again?
test-21513	Should India rely on Pakistan again?
test-21514	What is a necrobully?
test-21515	Have you ever bullied someone without realizing it?
test-21516	If I say playing football is my hobby what will be interview question?
test-21517	In an interview what questions can I expect from my Hobby-Guitar playing?
test-21518	What is the importance of homeostasis?
test-21519	What is homeostasis? Why is it important?
test-21520	What is that one book you read that changed your life the most?
test-21521	What are some books that changed your life, and why?
test-21522	Why is it so important to ask questions?
test-21523	What question do you get asked the most? And why is it important?
test-21524	What happens if Hillary Clinton is indicted after she has won the primary nomination?
test-21525	Can the DNC just replace Hillary Clinton with Joe Biden if she gets indicted or has to withdraw?
test-21526	How many people do have a pool in your country?
test-21527	How can I be an owner of a jet?
test-21528	How easy/hard is it to get part time jobs in Cork, Ireland for international students?
test-21529	Is it easy/hard for international students to get a job in Dublin, Ireland?
test-21530	Which is best rucksack available in India which is in budget and has build quality equivalent to Wildcraft?
test-21531	Can I use a rucksack for normal travelling?
test-21532	How do I get birth certificate?
test-21533	How can I get my birth certificate?
test-21534	What should I do to enhance my English?
test-21535	How can I improve my oral English?
test-21536	What does datastage online training?
test-21537	Are you looking for datastage online training?
test-21538	What is the most useless public service provided by the government in the US?
test-21539	Who started the custom of putting songs in Bollywood movies?
test-21540	Is the universe a computer simulation?
test-21541	Are humans part of a simulation?
test-21542	Can dogs get fleas from cats?
test-21543	Can cats and dogs get fleas during the winter?
test-21544	How do I get my wife to divorce me?
test-21545	How do I legally divorce my wife if I caught her cheating?
test-21546	Where did people purchase guns in the 1800s?
test-21547	Why do people in Iraq shoot their guns into the air?
test-21548	How do I get over over my ex girlfriend?
test-21549	How do I forget my ex after everything we've been through?
test-21550	What is the easiest way to stop masturbation?
test-21551	How do I stop masturbution?
test-21552	Where can I find vegeterian food in Coventry, England?
test-21553	Is 122,000 SGD a good salary in Singapore with 6+ years of mobile app development experience?
test-21554	"My uTorrent suddenly stopped downloading anything. All it shows is that torrent is ""connecting to peers"" and nothing else happens. What should I do?"
test-21555	How do you fix a utorrent that has stopped downloading?
test-21556	Are notarized documents legal?
test-21557	Where can I notarize foreign document?
test-21558	How do I stop mouth ulcers?
test-21559	How do you get rid of mouth ulcers?
test-21560	What is the reason of strong connection to a person?
test-21561	Why do we feel a strong connection with some people without a reason?
test-21562	In my system is showing e drive is not working?
test-21563	How can I effectively revise 11th before going to 12th? Some topics of mine of +1 are weak.
test-21564	What is the melting point of steel?
test-21565	What is the melting point of metal?
test-21566	How can I get more sleep than necessary?
test-21567	Why do I sleep more than I should?
test-21568	How can I concentrate more on studies as I am addicted to my android phone and cricket both?
test-21569	How do I concentrate on studies when I am so addicted to my phone and the internet? How do I keep the disturbing things aside?
test-21570	If there's an object with a really strong magnetic field nearby, will it suck iron from our blood?
test-21571	If our blood cells contain iron, then why aren't magnets hazardous to our health?
test-21572	How can someone become a pilot in the Indian Air Force after completing a B.Tech? Can someone join after correcting his vision through surgery?
test-21573	How can I join the Indian Navy or Indian Air Force if I'm a chemical engineering graduate?
test-21574	Optics: what will an air bubble in water act like?
test-21575	Can jade stone have air bubbles inside it?
test-21576	What is the difference between mathematics and pure mathematics?
test-21577	What is the real difference between applied and pure mathematics?
test-21578	How does cyclone and storm differ?
test-21579	What is the difference between a tornado, a cyclone, a hurricane, a typhoon and a storm?
test-21580	What are some Indian companies looking for undergrads for jobs?
test-21581	What was a direct result of the Intolerable Acts of 1774:?
test-21582	What does waking up at 3:33, 2:22 or 1:11 mean?
test-21583	Why did I wake up at 3:33am?
test-21584	What are the best thoughts to lose weight?
test-21585	How can I lose weight quickly?
test-21586	I am in my first year engineering. I want to join the air force after completing my degree. What are the  exams that I  should clear and How do I prepare for it?
test-21587	How do I join the Indian Air Force after completing my MBBS?
test-21588	Is it true that high performance athletes have a high sex drive?
test-21589	Is it normal as a guy not to desire/want sex?
test-21590	Who is Meena boy?
test-21591	Who is this meena boy?
test-21592	What happens if a girl doesn't want a divorce and a guy wants it?
test-21593	My husband says he is not in rush to file divorce but he doesn't want to live with me anymore. Why is he doing this?
test-21594	Why don't more poor people play golf?
test-21595	Why is there a stereotype that old people play golf?
test-21596	How is kinetic constant of hydrolysis anhydrid acetic reaction? Value
test-21597	What would European society and culture be like if Jewish communities were at their pre-WW2 levels?
test-21598	Has it been proven that reproduction is a primary goal for all species?
test-21599	What is the reproduction process of euglena?
test-21600	Who created Metacrawler.com?
test-21601	Who created gowhispr.com?
test-21602	What is the unhealthiest food in the world?
test-21603	What KFC food item is the unhealthiest in the UK?
test-21604	Is it normal to share intimate pictures of each other in a long distance relationship?
test-21605	Why did you break up with your last bf or gf?
test-21606	What is the best health insurance policy for senior citizens above 72 years age in India?
test-21607	Which is the best insurance policy for senior citizens around the age of 65 & above in India?
test-21608	Porters five forces of competition?
test-21609	What is porters five forces?
test-21610	Can I teach English in Indonesia without a degree?
test-21611	Can I teach English in Vietnam without a degree?
test-21612	What is it like to be on a bad mushroom trip?
test-21613	Why do some mushrooms taste like meat?
test-21614	How do I get a job after a 4-year gap?
test-21615	How do I get job after having a gap of 4 years in net working?
test-21616	From where do you draw your strength?
test-21617	Can I apply for Canadian PR or AUS/NZ/US/UK/EUR/etc with my Freelance experience?
test-21618	Will we ever achieve absolute unity?
test-21619	If I remove dvd writer and speakers from my laptop will my lap function normally?
test-21620	How will driverless cars affect a car's insurance?
test-21621	How driverless cars will affect the life insurance industry?
test-21622	How do I get incoming messages in Jio sim in iPhone 5s?
test-21623	How do I activate Jio Voice Service on iPhone 5s?
test-21624	What does this say in English?
test-21625	How do you say this in English?
test-21626	How can I get more StumbleUpon Followers?
test-21627	How do I get more StumbleUpon Followers?
test-21628	Why can't we troll on Quora?
test-21629	Are there trolls on Quora?
test-21630	How and why do guys get raped (by women)?
test-21631	How can a man get raped by a woman?
test-21632	What are the different types of securities market in business organisation?
test-21633	What are the different types of securities market?
test-21634	What is the difference between big data and Hadoop?
test-21635	What is the difference between big data and Hadoop developer and administrator?
test-21636	What are your favorite date ideas in Washington?
test-21637	What are your favorite date ideas in Maine?
test-21638	Are there interviews of UPSC toppers who chose Management as the optional in Mains?
test-21639	I am about to pursue ECE. So how should I prepare myself from now, given that college will begin in two months?
test-21640	Where can I download valid CompTIA A+ 220-901 PDF Dumps and 220-901 VCE Dumps for 100% passing the 220–901 Exam?
test-21641	Youth: What is great about being young?
test-21642	How is the Lewis dot structure determined?
test-21643	How is the Lewis Dot structure for Co determined?
test-21644	I want be RN but some how I worry I might not have what it takes to be?
test-21645	If you could live like anybody who has ever lived, who would that be?
test-21646	Is there a youtube views increaser?
test-21647	What are ways to get more views on youtube?
test-21648	What movies are similar to The Da Vinci Code and Angels And Demons?
test-21649	"Why do movies like ""The Da Vinci Code"" and ""Angels and Demons"" have such low ratings on IMDB and why are they disliked by many? Is it because of the level of the novels or due to fact-manipulation?"
test-21650	What is the disadvantage of demonetization of Indian currency?
test-21651	What're the disadvantages of currency reformations?
test-21652	Given the Dunning-Kruger Effect, what's the best way to deal with someone who gives themselves credit for things they can't do (in reality)?
test-21653	Why do the things I mearly listen or I had a glance somewhere came to happen or something I have to do about it within few days?
test-21654	How does the endochondral ossification process occur?
test-21655	How many Haredi Jews live in Jerusalem (east and west)?
test-21656	Is the counselling fee in LNMIIT refundable?
test-21657	What is the counselling fee at LNMIIT and is it refundable?
test-21658	How do I post a topic in Quora?
test-21659	How do I add a photo to a topic on Quora?
test-21660	How can I learn Chinese language easily?
test-21661	How can I learn the Chinese language easily and smoothly?
test-21662	What is the corporate culture like at Brink's? How is the culture different than other companies?
test-21663	What is the corporate culture like at Ford? How is the culture different than other companies?
test-21664	What would happen if a presidential candidate were to die the day or week before an election?
test-21665	What would happen if one of the major-party candidates were to die before election day?
test-21666	Do people get a notification on Instagram if I take a screenshot of one of their photos?
test-21667	Can someone get me the screenshot of the Instagram profile named supriyaxsingh?
test-21668	What type of oil do you use to make french fries?
test-21669	How much peanut oil is used for a turkey fryer? What do you do with the oil after you fry a turkey?
test-21670	If I add castor oil, coconut oil, olive oil, and vaseline together, will it help the growth on my eyebrows?
test-21671	What is the precaution I take during brain stroke?
test-21672	Why are felons not allowed to vote in the United States?
test-21673	Do you think teenagers (under 18) should be allowed to vote in the United States? Why or why not?
test-21674	Why does Flickr force users to create a Yahoo username and password to access or build a Flickr account?
test-21675	Is there a limit to the number of Flickr accounts I can have?
test-21676	What are examples of sentences with the word despotic?
test-21677	"What are some examples of sentences with the word ""ignorance""?"
test-21678	What are the funniest quotes from Winston Churchill?
test-21679	What are some of the best quotes from Winston Churchill?
test-21680	If you are doing nothing, does that mean you are doing something?
test-21681	"Does ""having the right to do something"" mean we can take it for granted that we can do that?"
test-21682	What is AdMob mediation and what are the benefits of implementing it?
test-21683	How does CPM work on AdMob?
test-21684	Courses can be taken after bsc physics?
test-21685	Why isn't the Armenian Genocide recognized by the US?
test-21686	How download youtube playlist using eagleget software?
test-21687	How can I download youtube playlists?
test-21688	What's the name for the skin tone women like Jessica Chobot, Maddie Moate, etc., have?
test-21689	Does skin tone play a part in muscle definition?
test-21690	How do I avoid watching porn and other diverting things?
test-21691	What should be done to avoid watching porn?
test-21692	"How do I get over ""Your lie in April"", the Anime?"
test-21693	What should I do to get over an anime crush? I like Tsunade of Naruto too much. What should I do?
test-21694	What are some of the peaceful ways to commit suicide?
test-21695	What are some painless ways to commit suicide?
test-21696	What is a Clip and strip bond?
test-21697	What is clip and strip bonds?
test-21698	Why do we feel emotionally touched when confronted with beauty?
test-21699	What's the worst emotion a person can feel and why?
test-21700	Does China's two-child policy apply to foreigners and expats living in the country?
test-21701	Does the one child policy apply to foreigners moving to China? Does it matter if they are of Chinese origin?
test-21702	What are some unique things about India?
test-21703	What makes you sad about people living in India?
test-21704	What are the health risks of eating undercooked chicken?
test-21705	What are the health risks of eating raw mussels?
test-21706	What is the best book for studying CPIM?
test-21707	What are some regional English words, that you think ought to become more widely known?
test-21708	Who is Adam West?
test-21709	Who is Adam West married to?
test-21710	I spend lot of time myself so I could finger out and listen to what is inside people heart and head?
test-21711	Hurricanes die out quickly when they pass over land or cold water, why?
test-21712	How can I improve my english?
test-21713	How can I improve my English skills?
test-21714	Who would win in a fight to the death? Boromir or Jaime Lannister?
test-21715	Who would win a fight between bronn and Jaime Lannister?
test-21716	Why did Bangladesh declare independence from Pakistan in 1971?
test-21717	Will Balochistan get freedom from Pakistan?
test-21718	How do I attain inner peace?
test-21719	How did you find inner peace?
test-21720	I have dropped my iMac and it went black screen. It still starts, however, I can't see anything. What can I do to repair it?
test-21721	My laptop screen is broken (there are black spots/lines which keep on increasing), does the repair guy need to know my windows password to fix it?
test-21722	What will be the pros and cons of introducing GST into the Indian economy?
test-21723	What are the pros and cons of the introduction of a GST in the Indian tax system?
test-21724	What is pronouniciation?
test-21725	What is @+£>§?
test-21726	What is the need of java programming?
test-21727	What are the benefits of learning java programming?
test-21728	How many chromosomes does a gamete have?
test-21729	How many chromosomes does a zygote have?
test-21730	I'm trying to buy a shoe under 30$ from Aliexpress, can I request them to ship my goods to Canada as Gift so I can avoid paying duty and custom fees?
test-21731	Do I have to pay customs fees or taxes if I ship wholesale goods from Canada to the USA if I already paid customs fees when importing these same goods from China to Canada?
test-21732	What do you think of Jaqen H'ghar?
test-21733	How do you pronounce Jaqen H'ghar?
test-21734	What is the best way to get rid of pimples?
test-21735	How do you get rid of pimple on the chest?
test-21736	What is the difference between J2EE and Spring?
test-21737	What are the differences between HTML5 and (pre-5) HTML?
test-21738	Who designed Union Jack flag?
test-21739	Is it a crime to burn the Union Flag in the UK? How would British people generally feel about such act of desecration done in front of them?
test-21740	What do people live for? What is the purpose of living or the purpose of life?
test-21741	What's the purpose of a human life?
test-21742	I am looking for a funder for many projects in indonesia in hotels and renewable energy sector. how can I find investor or funder?
test-21743	Why do they say that brown bag keep bread fresher?
test-21744	How much do marvel merchandise get paid?
test-21745	What A levels should I take?
test-21746	Do Malayalis think that Modi is fit to be the PM of India?
test-21747	"If Narendra Modi promotes ""Make in India"" then why does he use a BMW car for commuting?"
test-21748	Is there any solution of indo-pak Kashmir issue?
test-21749	What is the best solution for Kashmir issue?
test-21750	What is the difference between a CI engine and an SI engine?
test-21751	Which one has higher a compression ratio, SI or CI engine?
test-21752	Why are many Indians not proud of the achievements of India in the ancient times (e.g. Vedic Age)?
test-21753	What incidents and events have made India proud?
test-21754	What would you prefer? A high paying arrogant boss or a drastically low paying nice boss?
test-21755	How do I prepare for NMAT 2016 (19 dec) if I start now?
test-21756	I like the guy, feel good with him, enjoy his attention..then suddenly when we get together for sometime, I start to see him as less attractive, why?
test-21757	My mom did not allow me sleeping in floor for I will be cold . Is she right or wrong?
test-21758	Would men prefer to have sex with a loose vagina or a tight vagina?
test-21759	What's it like to have sexual intercourse (penile/vaginal penetration) with a woman who has a prodigious vagina?
test-21760	How do you think that human resource practices in organization can be aligned with CSR?
test-21761	The electric field in some region of space is uniform in magnitude and direction. What is the volume charge density in this region of space?
test-21762	Why won't the QR code scanner come up in my whatsapp when I attempt to scan it with my iPhone 4S?
test-21763	How can I stop someone from going on my WhatsApp web?
test-21764	Who is the best intenational SMS gateway provider?
test-21765	What is the best international SMS gateway?
test-21766	Why isn’t the address of an array a pointer to pointer in C++?
test-21767	In C++, why is a pointer an object?
test-21768	Did Patsy Cline have an autopsy? Was her death suspicious?
test-21769	Would it be possible to exhume Edgar Allan Poe's body for an autopsy to settle the mystery of his death?
test-21770	What are some examples of an agent who went rogue and what happened as a result?
test-21771	What are the most famous real-life instances of agents going rogue?
test-21772	What's stated by the theory of evolution by natural selection?
test-21773	What is natural selection?
test-21774	How do I loose belly fat?
test-21775	How can I reduce my Belly and tummy fat?
test-21776	How can one eat cheap and healthy?
test-21777	What are strategies for eating cheap and healthy?
test-21778	How do I stop myself from eating fast food?
test-21779	How do I stop eating junk food?
test-21780	What is a good trail running shoe for a beginner?
test-21781	How many miles is a 3K run? Is it a good distance for a beginner to run?
test-21782	Who is best car?
test-21783	Which is best car?
test-21784	How can I get Quora to stop displaying this avalanche of inane gun questions?
test-21785	How do I stop Quora sending me questions about the USA and guns?
test-21786	What is the size and overall GDP share of startup economy in US?
test-21787	How can I find a business mentor for a service and economy-sharing startup in Pune?
test-21788	The last NASA mission to Venus was in the 1970's. We've been to Mars and Jupiter several times. Why are scientists not as interested in this planet?
test-21789	How long has NASA been planning this manned Mars mission Orion?
test-21790	I want to start a rocket company in India. Where do I start from?
test-21791	Do year back students have the chances of working in DRDO?
test-21792	How do I get over my ex-best friend?
test-21793	How do you get over your best friend?
test-21794	Worth of a lossless data compression startup?
test-21795	How does file compression work?
test-21796	Will Singapore be able to cope with the Zika virus?
test-21797	Where is the first Zika virus vaccine made?
test-21798	What is the value of the square root of 1%?
test-21799	What is the square root of [math]-1[/math]?
test-21800	Do you believe in God, why/why not?
test-21801	Why are some people atheists?
test-21802	What should I know when visiting Iceland?
test-21803	What should I know before visiting Finland?
test-21804	How do you unlock a Sony Ericsson Xperia?
test-21805	How do I unlock my Sony Ericsson XPeria X10?
test-21806	Has caste system improved India?
test-21807	Why does the caste system still prevail in India?
test-21808	What is linear mass density?
test-21809	Is gravity a function of density or mass?
test-21810	What are the requirements to work at GameStop?
test-21811	What are the best aspects of working at GameStop?
test-21812	When will India become a major electronics manufacturing hub like China?
test-21813	How can India become a manufacturing hub?
test-21814	What are some unbelievable, but true news stories?
test-21815	What is an under-reported news story?
test-21816	What is the difference between cry and weep?
test-21817	When was the last time you cried without anyone seeing you and why?
test-21818	"Why is ""Japan's Marine Day"" unknown in Barbados?"
test-21819	"Why is ""Japan's Marine Day"" unknown in Cuba?"
test-21820	Why do some people enjoy watching gory and disturbing films?
test-21821	How often do you watch films?
test-21822	How do I  post on Instagram without the app, on mobile, for free?
test-21823	What's the point of a free mobile app?
test-21824	What are the various ways through which one can earn money online?
test-21825	How too make money online?
test-21826	Where can I find the original One Punch Man online?
test-21827	Who would win in a fight, in-game Kirito or one punch man?
test-21828	What is the most beautiful city in the world?
test-21829	What are the most beautiful cities in the world?
test-21830	What's the right way to brown ground turkey?
test-21831	How do you cook a turkey?
test-21832	How can I improve my English communication skill?
test-21833	How can we improve our English language skills?
test-21834	What happens to engine oil of a car when it is unused for a stretch, let's say three months?
test-21835	What happens to engine oil of bike when it unused for a stretch, let's say three months?
test-21836	When will transferring a credit card balance from one CC company to another CC company offering a lower interest payment happen?
test-21837	Which credit card companies offer cash back?
test-21838	Is it required to give permanent address in bank exam?
test-21839	If you were to rebuild (recode) Quora today, would you use Python 3.5?
test-21840	What is Web crawling?
test-21841	What is web crawling? How does it work?
test-21842	How do I speak English with a black accent?
test-21843	Is it weird for a chinese person to speak in a english accent?
test-21844	What is the best car brand?
test-21845	Which car brand is the best?
test-21846	How can I make money off of my music?
test-21847	How can I make money with music?
test-21848	My boyfriend says I am not his preferred body type, (we don't have a strong sex life) but he says he is with me because he loves me. Is this enough?
test-21849	My boyfriend says love is 'empty' to him right now because he does not feel it, yet he wants me in his life forever. Should I stay?
test-21850	How should graphic designers approach the issue of performing design test exercises during the job interview process?
test-21851	Is it inappropriate to ask a candidate for a designer position to do a test project as part of the interview process?
test-21852	"Who were the most surprising and/or unexpected winners of the TV show, ""Survivor""?"
test-21853	Is watchseries.cr an illegal website? If I use it could I be in trouble? I have been watching POI show for free. I'm not sure if this is legal.
test-21854	How can I download the PDF book 'Strength Of Materials' by S. Ramamrutham?
test-21855	Which is the best site for movie download at fast speed?
test-21856	What are some examples of abiotic factors?
test-21857	What are biotic and abiotic components?
test-21858	Should I resend an email of employer hadn't responded?
test-21859	How do I play overwatch online?
test-21860	Who will win the UEFA Euro Cup in 2016?
test-21861	Who will win this Euro Cup 2016?
test-21862	Should I submit a recording of my music to MIT or Stanford Slideroom if it isn't considered fine art?
