test-247480	What are some rarely known tips about Asphalt 8?
test-247481	How do I get unlimited coins in Asphalt 8?
test-247482	I have a Deloitte technical interview for a business analyst position. I'm weak at my technical core subjects. How do I prepare?
test-247483	How do I prepare for the Deloitte tax analyst interview?
test-247484	Is it okay to start a sentence with also?
test-247485	I stop in the middle of a sentence and start the sentence again. Why is this?
test-247486	Will smart drugs improve my studies?
test-247487	Should I use smart drugs to study?
test-247488	What are some strengths, weaknesses, opportunities, and threats of owning a Napa winery?
test-247489	What are good wineries to go with groups in Napa?
test-247490	I am going to be really good so god can hear my wishes, he always gives me what I want does a lot of people hear god talk to them?
test-247491	Is /are there any decent theatre group(s) in kanpur?
test-247492	What is an organ?
test-247493	What is an encysted organism?
test-247494	How do I know if shes playing games?
test-247495	How do I know if a girl is playing with my feelings?
test-247496	How many international science olympians (IMO, IPhO, IChO, IOI, IBO) join Princeton's freshman class each year?
test-247497	How many international science olympians (IMO, IPhO, IChO, IOI, IBO) join MIT's freshman class each year?
test-247498	We know that smoking is dangerous for health, so why do people still smoke?
test-247499	How bad is smoking 3-5 cigarettes a day for a 17 year old kid?
test-247500	I'm an electronics engineering student currently in the third year planning to pursue ccna. Can I do it while I'm studying for my engineering?
test-247501	Which area top escorts girls are available?
test-247502	How do I add a question on Quora?
test-247503	How do I ask someone a question on Quora?
test-247504	Why there are no answers for my questions on Quora?
test-247505	Why does no one answer my questions on Quora?
test-247506	How many fundamental particles are there?
test-247507	How many different particles are there?
test-247508	Does weight training stop height growth?
test-247509	Does height gets blocked by doing weight training in gym at the age of 17?
test-247510	What is the best free ecommerce wordpress theme?
test-247511	What are the best sites for free wordpress themes?
test-247512	Can I use fresh minced onions instead of onion powder?
test-247513	Why are sliced onions used for caramelization instead of diced onions?
test-247514	What are your new year resolutions’2017?
test-247515	What will be some of the most productive new year resolutions for the year 2017?
test-247516	Are there any benefits to asking a good question on Quora?
test-247517	Are there any benefits to asking questions non-anonymously on Quora?
test-247518	How is the term 'aristocrat' used in sentences?
test-247519	How is the word 'interrogate' used in a sentence?
test-247520	Can woman have intercourse after menopause?
test-247521	Can a woman lactate after menopause?
test-247522	How do I become a animal activist in India?
test-247523	How can I become an animal activist?
test-247524	Why has Pakistan never had a non muslim Prime Minister?
test-247525	Why has Bangladesh never had a non muslim Prime Minister?
test-247526	How badly shredded is an enemy combatant's body after getting hit by a couple of 30mm rounds from an A-10's GAU-8 cannon?
test-247527	How well would a modern bullet proof vest protect its wearer against an A-10's GAU-8?
test-247528	How do you log into instagram with out knowing your password or email?
test-247529	What do you do when you log out of Instagram, and you forgot the password and the email?
test-247530	I have two ₹1 notes (1 printed in 1985 and 1 in 1986). Are they valuable or do they cost just 1 rupee?
test-247531	Why did the RBI start a 1 rupee note?
test-247532	How do you know what time zone you are in if you're at the north or south pole?
test-247533	What is the time zone at the North or South Pole?
test-247534	How can I easily pass the HP2-H35 exam?
test-247535	How can I easily pass the HP2-H33 exam?
test-247536	Should I take up computer science engineering or electronics and communication engineering?
test-247537	Computer science engineering vs electronics and communication engineering?
test-247538	Who is the only Indian cricketer to score 300 runs in an Innings in test cricket?
test-247539	Do some Indian cricketers smoke?
test-247540	Instagram will only let me tag two people on one (new) account, but as many as I want on another (established) account. Why is this?
test-247541	Can people see what instagram accounts my account is linked to?
test-247542	What are some unknown interesting facts about OK Google?
test-247543	What are some interesting Wikipedia facts?
test-247544	How I will get job in IT sector after having gap of 4 years?
test-247545	Can I get job in IT after having 4 years gap? And how?
test-247546	What are the reasons for the formation of desert in Rajasthan?
test-247547	What is the main reason for formation of desert in rajasthan?
test-247548	Vedic Astrology: What is the difference between moon chart and lagna chart?
test-247549	What does my astrology chart says about me?
test-247550	Why does sand heat up faster than water?
test-247551	When I'm waiting for the water to heat up, does the water heat up faster when there's more water flow?
test-247552	What are ways of earning money online?
test-247553	What are ways to make money online?
test-247554	Are you allowed to advertise on Quora?
test-247555	How do I advertise on Quora?
test-247556	What are the club rules in Dubai and how strict are they about it?
test-247557	Does qualitative financial analyst has low entry to barrier?
test-247558	What is the story of asus and dell?
test-247559	What is the current relationship between Asus and Dell? Does Dell still outsource to them?
test-247560	Which is the best BE colleges in tamil nadu?
test-247561	Which is the best for mech engginering college in tamil nadu?
test-247562	What is the present (2015) ranking of BITS Pilani among the engineering colleges in India?
test-247563	What is the real position of JEC among all the best engineering colleges of India? Was it ranking adequate in list of top 100 college or not?
test-247564	How can I build e-commerce website paying zero amount?
test-247565	Can I become a USACO finalist this year?
test-247566	Can a Notary in one country certify a signature for another country's law?
test-247567	What should I do when another company has the exact name of my company in a different country?
test-247568	Do Uber drivers actually rate their passengers?
test-247569	How do Uber drivers rate passengers?
test-247570	How much does it cost to build a nuclear submarine, such as those of the US Navy?
test-247571	How will women serving on US Navy submarines work out?
test-247572	Which non fiction book has the best story?
test-247573	What are the best non fiction books of all time?
test-247574	How do you get your Instagram back, once you've been hacked?
test-247575	How do you get messages back on Instagram on a computer?
test-247576	Why has Nepal failed to produce a patriotic leader like Rajapakshe?
test-247577	Why do you think Modi is the greatest leader India has ever produced?
test-247578	What are the quickest healthiest ways to loose weight?
test-247579	What are the best way of loose the weight?
test-247580	In English, is it incorrect to use two words in one sentence, that have the very same meaning?
test-247581	What is it called when you use two words with the same meaning in a single sentence?
test-247582	I have 932 rank in (A+B) which center can I get in Pune?
test-247583	Is september 30, 2016 an important date for the us dollar?
test-247584	Are beans considered a fruit or a vegetable?
test-247585	Are beans fruit?
test-247586	What are the 7 fundamental units?
test-247587	What is the fundamental unit of information?
test-247588	"How do you translate ""Kanji"" to English?"
test-247589	How does this translate into English and Kanji?
test-247590	How do I earn money in online?
test-247591	How does one earn money online without an investment from home?
test-247592	"What is the noun form of the Latin verb ""morior""?"
test-247593	Which is the best website to buy vevo views?
test-247594	How bad is it to not have 20/20 vision?
test-247595	What is 20/20 vision?
test-247596	What is the best HTC service center in Hyderabad?
test-247597	Which is the best iPhone service center in Hyderabad?
test-247598	Is there any possibility to increase bank fd interest in next 1year?
test-247599	I always feel hopeless?
test-247600	Why is it so important to find life on another planet?
test-247601	How close are we to finding life on another planet?
test-247602	What is the differnence between burglary in the 1st and 2nd degree?
test-247603	Is there a time limit on charging someone for a home burglary?
test-247604	What are some mind blowing and interesting successfull buisness ideas?
test-247605	What are some mind blowing, unknown and interesting facts about Pashtuns?
test-247606	In the Catholic church, is marrying your first cousin more, or less taboo than marrying a non-Catholic?
test-247607	Can a Catholic boy marry a Muslim girl?
test-247608	Is it bad that I have to ask my mom if I can go running outside and I'm 19?
test-247609	How do people who work in/for an open-source software/project earn a living? Example: Blender 3d software.
test-247610	Can anyone predict my career and marriage?
test-247611	DoB 10/09/1990, 8:15 a.m Plac: Madurantakam can you accurately predict my marriage, career?
test-247612	"So what does ""waking up"" mean to you in terms of both understanding and behavior. How do those mutually reinforce each other?"
test-247613	Do you know the meaning of “Your actions and behavior can be looked upon by the Spirit of God”?
test-247614	What is the most probable way the Feds are getting information from darknet drug selling sites (by using spies)? Have they found a way to break the anonymity that TOR offers?
test-247615	What's a good way to get started using Tor?
test-247616	How do I start a HR career in MNC after MBA?
test-247617	What are the options after MBA-in HR?
test-247618	"While marking a question as ""needing improvement"", why doesn't Quora tell what exactly needs to be improved?"
test-247619	Why won't Quora tell me exactly what is wrong with my question?
test-247620	Why do some people hate people that are too nice?
test-247621	How can I stop expecting things from others?
test-247622	If Tywin dies, who will become the Lord of Casterly Rock?
test-247623	When Cersei dies, who will become Lord of Casterly Rock?
test-247624	Are there any tech startups in Kolkata?
test-247625	What are the startups based in Kolkata, India?
test-247626	How can I eliminate my stage fear?
test-247627	What is the best way to overcome stage fear?
test-247628	"How do you say ""I like cheese"" in French? How can this phrase be used on a visit to France?"
test-247629	I am general category candidate(From UP).Which colleges can I get if I scored 157 in JEE main 2016 and 93.6% in CBSE board?
test-247630	How do I create Android application using Gimbal SDK so as to detect beacons?
test-247631	How do I get a Gimbal Beacon UUID / Unique ID?
test-247632	Will Netflix’s Stranger Things eventually be released on DVD/Blu-Ray?
test-247633	Are region-free DVD/Blu-Ray players legal in the UK?
test-247634	How do you determine a good stock investment?
test-247635	How do I choose good stock while investing in equities (stock) in share market?
test-247636	Where can I sell Rs 1 note of 1981 in Mumbai?
test-247637	Can my dog drink milk? She's a shih tzu
test-247638	What dish soap makes the most bubbles? Why?
test-247639	How can I make bubbles with dish soap?
test-247640	Which website is important for UPSC preparation?
test-247641	How important is India yearbook for UPSC preparation?
test-247642	I don't want my picture added to the company website, what explanation can I provide to the employer?
test-247643	I was handed a Facebook campaign idea that I'm not comfortable working on. Should I tell my boss I don't want to work on it?
test-247644	Who are some of the celebrities to follow on Quora?
test-247645	Which celebrities are there on Quora?
test-247646	Is it advisable to leave the hair loose while sleeping? I am not comfortable with plaited hair while sleeping.
test-247647	Change my SBI ph no.?
test-247648	Is the white powdery stuff that leaks out of a AAA/AA battery toxic or dangerous?
test-247649	Can an AA battery kill you?
test-247650	What compiler was used to compile the first compiler?
test-247651	What is the compiler used to compile gcc?
test-247652	Why does my MacBook Pro won't turn off?
test-247653	What should I do if my MacBook Pro won't turn on?
test-247654	What is it like to be a multimillionaire?
test-247655	Where is most of the money tied up in recently wealthy multimillionaires?
test-247656	Is there any link for online calculating the maturity amount of Indian Postal Life Insurance Santosh Endowment scheme?
test-247657	What kind of benefits does one get in a life insurance scheme?
test-247658	What is a good inpatient drug and alcohol rehab center near Alachua County FL?
test-247659	What is a good inpatient drug and alcohol rehab center near Jefferson County FL?
test-247660	What are the some good movies to watch?
test-247661	What are some hilarious good movies to watch?
test-247662	How much would it cost to create and maintain (operating costs) an application like Teen Patti?
test-247663	How much would it cost to make and to maintain (operating costs) an instant messaging app like whatsapp?
test-247664	Most healhy thung to eat first in d mornng?
test-247665	What if all the conspiracy theories are true?
test-247666	How much money per hour do Uber drivers make in Tuscaloosa, AL? What's the most a person can reasonably make per month?
test-247667	How much money per hour do Uber drivers make in Philadelphia? What's the most a person can reasonably make per month?
test-247668	Which video player for android can play audio files of AC3 format?
test-247669	Which android video players can play 1080p videos perfectly?
test-247670	Does New Zealand and Australia not like each other?
test-247671	How do I call Australia and New Zealand for free?
test-247672	"What did Bran Stark mean by ""I found it""?"
test-247673	Which is the best Carnatic music performance?
test-247674	What is green card in india?
test-247675	What is green card in america?
test-247676	How much money do restaurants make in a year?
test-247677	How much money a year should one make to afford an $80000 car?
test-247678	Do You have a story to share about Silk Route and Quanzhou?
test-247679	What do you think of Quanzhou?
test-247680	What happens after you cock a gun and decide not to shoot?
test-247681	Why do people in Iraq shoot their guns into the air?
test-247682	What should a beginner get first: a regular skateboard or a longboard?
test-247683	What's a good store or website to find a longboard for beginners?
test-247684	How will I reset my nokia 500 security code?
test-247685	How do I hack any fb account?
test-247686	[Solved] How can I fix my mobile internet not working after flashing Cyanogenmod?
test-247687	How does installing CyanogenMod on an HTC One X work? What are its advantages and disadvantages?
test-247688	How do I remember GRE words?
test-247689	What is the best way to remember GRE words?
test-247690	How difficult is is to learn Japanese for a native Chinese speaker?
test-247691	What are the hardest foreign languages for native Chinese speakers to learn?
test-247692	What colors go with brown?
test-247693	What color shoes go with a grey color dress?
test-247694	"Who sings the song ""my peenie weenie""?"
test-247695	Who sings the song hideaway?
test-247696	How do I read top most voted answers easily on Quora?
test-247697	How would you choose between SPJIMR, IIM-I, IIT-B, and IIFT-D? (assuming all have been converted)?
test-247698	Who's your bias in BTS and why?
test-247699	Who is your bias in BTS?
test-247700	How do I go about learning new machine learning algorithms?
test-247701	How should I go about learning Machine Learning?
test-247702	Why did Faf Du Plessis return to play for South Africa after the Kolpak deal with English county cricket?
test-247703	Why is watching an Australia vs South Africa ODI cricket match the best thing a cricket fan could ever ask for?
test-247704	What are the pros and cons of softwood?
test-247705	What are the pros and cons of the polyclinic model?
test-247706	How do I get Vajiram & Ravi notes free of cost?
test-247707	What is it that makes Vajiram and Ravi so popular?
test-247708	What is the incident that changed your life?
test-247709	Have you ever experienced any incident that changed your life?
test-247710	Will Bernie Sanders take the presidency?
test-247711	Can Bernie Sanders still win the Democratic nomination as of March 16, 2016?
test-247712	Would you rather have a significant impact on a few people or a small impact on many people? Why?
test-247713	Why am I suppose to bear the attitude of my in laws (husband's side)?
test-247714	Can a foreigner?
test-247715	Why can't the police/bsf/army stop stone pelting mob in Kashmir?
test-247716	Who are the actual Aryans - Europeans, Iranians or Indians?
test-247717	What do Iranians think about Indians?
test-247718	What are some examples of science experiments where scientists lost control of the situation?
test-247719	What happens if I'm accepted by Oxford but can't afford it? Will I be kicked out?
test-247720	What are some of the interesting facts about prophet Muhammad?
test-247721	What is some example interesting quotes by Jalaludin Rumi about prophet Muhammad?
test-247722	Why do we feel wet by water?
test-247723	Why does water wet glass but mercury does not?
test-247724	What is torrent's architecture?
test-247725	What are torrents?
test-247726	What are the best jobs for freelancers in India?
test-247727	What are the best jobs In India?
test-247728	"What do real life lawyers think about the TV series ""Suits""?"
test-247729	Suits (TV series): Is there a lawyer in real life that mirrors Harvey Specter?
test-247730	What is the difference between floor planning in FPGA, Standard Cell Based Design (ASIC) and Gate Array?
test-247731	How much does it cost to make an ASIC based on an existing FPGA design?
test-247732	Why is tea naturally caffeinated?
test-247733	Does tea have caffeine in it naturally?
test-247734	Overall, was Obama's external policy a success or a failure?
test-247735	How is Capgemini in Bangalore?
test-247736	What is paradox effect?
test-247737	What is a paradox?
test-247738	What is the difference between a President and a Prime Minister?
test-247739	What is the difference between a prime minister and a president and why do some countries have both?
test-247740	Why was there an incest in the Old Testament?
test-247741	Why there is so much of violence in the old testament bible?
test-247742	How do I deal with a narcissistic father?
test-247743	How do you deal with narcissistic people?
test-247744	Is twed.com legit?
test-247745	Are badhackers.com legit?
test-247746	Why don't most of the companies In India wont allow their employees to grow a beard?
test-247747	Is www.hostmania.es a good web hosting?
test-247748	What's the most popular Quora topic?
test-247749	Which topics on Quora are the most popular and have the most followers?
test-247750	If the UK leaves the EU will UK citizens require visas to travel within Europe?
test-247751	Will British citizens need visas to the EU if The UK exits the Eu?
test-247752	What theory explains quantum mechanics?
test-247753	Is quantum mechanics a theory?
test-247754	On average, which brand of motorcycle is documented as the longest lasting and most durable without expensive repairs?
test-247755	What is the best quality/most durable/longest life/best gas milage motorcycle-specific engine that can be mounted in a Harley Davidson Dyna frame?
test-247756	Where is the best Location for NRI to Investment in Indian Real Estate Market?
test-247757	Where is the best place to invest in Indian real estate?
test-247758	How are concave and convex mirrors used?
test-247759	How are convex mirrors used?
test-247760	What is the average starting salary of a fresh software engineering graduate in USA?
test-247761	What is the average starting salary of a civil engineer?
test-247762	"How is the word ""vitriolic"" used in a sentence?"
test-247763	"How is the word ""pride"" used in a sentence?"
test-247764	How do I earn money in online?
test-247765	How can you make some money sitting in home online?
test-247766	What are the answers to codeHS JavaScript?
test-247767	Who is hiring JavaScript programmers purely for their JavaScript skills?
test-247768	How is the brexit referendum connected to India? How does it affect India?
test-247769	What are the effects of Brexit on india?
test-247770	Are Ramsay Snow and Jon Snow related, or is it just that the bastards in the North have surnames of Snow?
test-247771	Who are Jon Snow's real parents?
test-247772	Is Narendra Modi really doing well?
test-247773	Politics of India: Who is Narendra Modi?
test-247774	How's Arizona state university for VLSI?
test-247775	How is Arizona State University?
test-247776	What are free biostastics courses available?
test-247777	What type of doctor is the one who treats sciatic nerve pain?
test-247778	Is there a public and maintained list of spam trap email addresses?
test-247779	How can I rid my email address from getting spammed?
test-247780	Where can I buy leather jackets in Kolkata?
test-247781	Where do I buy pure leather jacket in Bangalore?
test-247782	Can I get the IP address back which I had on my AWS EC2 Instance before Stop/Start?
test-247783	How do I get the date and time of stopped EC2 instance?
test-247784	What is a good way for a foodie to lose weight?
test-247785	What are the best ways to lose weight?
test-247786	What are the job opportunities in Canada after pursuing PG in accounting/finance at Canadian colleges?
test-247787	What are the job opportunities in Canada after pursuing PG courses at Canadian colleges?
test-247788	Can we let high school students perform the necessary reproducible experiments needed in science?
test-247789	Mailchimp users: If I send a campaign to different segments simultaneously and same person appears in several segments. Will he have duplicate emails?
test-247790	What the best answer you've come across on Quora which you think didn't get many upvotes?
test-247791	What is the best question you have /had come across Quora?
test-247792	Where can I get free legal advice in NSW?
test-247793	Where can I get free legal advice?
test-247794	What are smart grid applications?
test-247795	What is smart grid and its advantages?
test-247796	Any good middle range colleges?
test-247797	How are gangsters so capable of being ruthless?
test-247798	Can black holes rotate faster than light?
test-247799	Is it possible that a black hole could be spinning faster than the speed of light?
test-247800	How can Hillary Clinton run for President if she is being investigated by the FBI?
test-247801	Will Hillary Clinton run for president in 2016?
test-247802	How do you fix an orange light on a Belkin router?
test-247803	How do I change my Xbox NAT type for a Belkin router?
test-247804	What are SEO tools?
test-247805	What is SEO and SEO tool?
test-247806	Why does Quora allow anonymous questions?
test-247807	Why does Quora allow others to edit my questions?
test-247808	I got 1151 rank (A+B+C). Is there any chance I can get DESD at CDAC Hyderabad, Bangalore or Pune?
test-247809	I got a 721 rank. Is there any chance I can get DESD at CDAC Hyderabad, Bangalore or Pune?
test-247810	What should I do to find a cure for cancer?
test-247811	How can I help cure cancer?
test-247812	What's the best way to clean blonde wooden floors?
test-247813	How do you clean wooden floors?
test-247814	How do rivers get water?
test-247815	How can rivers have a continuous flow? Where does the water come from?
test-247816	Is Ireland good for an MS in computer science? How is the education and job opportunities for the software field there?
test-247817	Is Ireland better place for pursuing MS in IT/Computer field?
test-247818	How do people apply for a passport if they have a different name on my birth certificate than the name on their other documents?
test-247819	How do I apply passport if name in 10th Cert. is different than that of Adhaar?
test-247820	How do I earn money with YouTube?
test-247821	How can we earn from youtube?
test-247822	How important is CCNA?
test-247823	What is Cisco CCNA?
test-247824	What is the most complicated & complete short films you have ever watched? And why??
test-247825	Is there a viable Conservative movement in Africa?
test-247826	Is it possible to upgrade MacBook Pro (Retina, 15-inch, Mid 2014) to 32GB RAM?
test-247827	I purchased a new MacBook Pro with 16GB of RAM. I want to upgrade to 32GB. What is the best source for RAM?
test-247828	Do we put the <footer> inside <body>?
test-247829	How do I make an image fit into my footer?
test-247830	How are the sex/bedroom scenes filmed in Bollywood movies?
test-247831	What is it like to perform sex with a hijra in India?
test-247832	How do know if the Illuminati want me?
test-247833	How would one know if one is being recruited by the Illuminati?
test-247834	What is the role of associate software engineer in Accenture?
test-247835	What is the future of a fresher joining sapient as junior associate-infrastructure? Is this role technical like that of a software engineer or tester?
test-247836	What is a way to crack the IES exam?
test-247837	What was your study plan to crack the IES exam? How much time did you spend studying?
test-247838	What were old fashioned pirates really like? Did they really have black sails and pirate flags?
test-247839	Maritime Piracy: Who were the most famous pirates?
