283380	How do I disable my laptop webcam ?
283381	Why do low frequency signals attenuate slowly as compared to a high frequency signal ?
283382	What are some major social faux pas to avoid when visiting Kazakhstan ?
283383	What are some major social faux pas to avoid when visiting Poland ?
283384	How can we use the resistor in electronic circuits ?
283385	What alternatives can be used for resistors in an electronic circuit ?
283386	Is SkyLux legitimate ?
283387	Do you need good grades to land a job in computer science ?
283388	When the buzzer in Jeopardy is pressed too early , is the contestant disqualified from answering that question ?
283389	Has a Jeopardy! answer ever been used more than once ?
283390	What are the simplest things that make IITians sad ?
283391	What are the simplest things that make IITians happy ?
283392	Is Buddhism a religion or philosophy ?
283393	How do I run python scripts ?
283394	What is the easiest way to run a Python script in the background ?
283395	How do you calculate the cross section area of cylinder ?
283396	How can you prove that any cross section of an ellipsoid is an ellipse ?
283397	How much money required to live in chennai ?
283398	How much money is required to live in mumbai ?
283399	What is the difference between 1 % and 2 % milk ?
283400	`` What is the velocity of milk in 2'''' line ?''
283401	Is Reliance planning to launch Reliance Jio 3G ?
283402	How does one get a bad trip after smoking weed ?
283403	Why do you get high after smoking weed ?
283404	In what year was Indian currency released with Mahatma Gandhi's photo on it ?
283405	When did Mahatma Gandhi first appear on Indian currency ?
283406	Which languages do I need to learn to create android and iPhone apps ?
283407	What programming language do I need to learn to create iPhone apps ?
283408	I am going to join Mu Sigma next week . What are some do's and dont's that I must know ?
283409	Should I join Mu Sigma or SBI as a probationary officer ?
283410	Why does Facebook give playstore update daily ?
283411	Is there any research in geometric analysis at Yale ?
283412	What is an impulsive force ?
283413	Why is spring force a variable force ?
283414	What parties should I involve in a technical feasibility study for a large engineering project ?
283415	What is UFO ` disclosure' ?
283416	What is a UFO ?
283417	What are the best online free courses on calculus ?
283418	What are the best online courses to learn for free ?
283419	Which are the best hotel for unmarried couple in Allahabad ?
283420	Why was the word Hades used in the Septuagint instead of translating the original Hebrew word for Sheol to Greek ?
283421	Why do the Greek font characters I've written in a Word doc not convert to Greek in a PDF doc but convert instead into their english transliteration ?
283422	What are some unexpected things first-time visitors to Croatia notice ?
283423	How can I make ego a good thing ?
283424	What will happen if Kashmir becomes independent of India & Pakistan ?
283425	Is helium an element , mixture or a compound ?
283426	Why do many people have baby hairs around their hairline ?
283427	Why do Jewish people curl their hair ?
283428	What is Valentine's Day for singles ?
283429	What did you do on this Valentine's day ?
283430	Can I get a restraining order against someone so they stop calling me ?
283431	How can a US citizen work in Canada ?
283432	Why can't India have only two political parties like the US ?
283433	Do the Americans only have the two political parties to choose from ? And if so , why are they keeping it that way ?
283434	Which is the best tutorial video for quick books ?
283435	Shareit is not working in my windows 8.1 PC , im not able to transfer files between PC n Android ?
283436	Why is expansion valve and condenser used in refrigerator ?
283437	What is the pressure and temperature of refrigerant at expansion valve and condenser ?
283438	What is the salary of a support engineer II at Amazon India with 3 years of experience ?
283439	What is the work of a Chemical engineer in the companies of Tyre , Bosch and what is the future scope ?
283440	I'm pursuing a diploma in computer engineering . What should I be doing after this course ?
283441	I am pursuing my diploma in Information technology . What should I do after that ?
283442	Why would a girl treat a guy she likes coldly ?
283443	Why do k-pop artists sue S.M. Entertainment ?
283444	I'm a graphic designer , and I'll move to Korea soon . If I could message S.M. Entertainment , would they employ me or is it just for K-pop stars ?
283445	From existing diet now days what diet gives the best result to lose weight ?
283446	What stereotypes do Chinese people have about Indians (or other South Asian ethnicities) ?
283447	What are some stereotypes that people from a particular Asian nation have about other Asians ?
283448	What are the websites to find freelance job providers ?
283449	What is the best place to find freelance jobs ?
283450	How do optical heart rate sensors work ?
283451	How can I convert an optical mouse to an optical flow sensor ?
283452	What type of government does Turkey have ? How does it compare to the one in Somalia ?
283453	What is the minimum GMAT score required for the PGDM in the Great Lakes Chennai ?
283454	Where can I find someone to help me write a motivation letter for university ?
283455	What is the shape of India ?
283456	What is the total coastline of India ?
283457	How do people working full time find the time to work on a startup ?
283458	Do people hate working full time ?
283459	What is the price of a bottle of Hoegaarden white beer ?
283460	Why are beer bottles amber coloured while other alcohol bottles are in white glass ?
283461	Why is water liquid but H2S gas ?
283462	Have you ever had such a good session of delicious , hard , sex , that you could not walk as usual the next day ?
283463	What's the worst ever day you had as a teenager ?
283464	When did I create my Instagram account ?
283465	How do I see when am Instagram account was created ?
283466	What is the use of power factor ? Why do we need to improve it ?
283467	Do we need to improve the power factor in domestic appliances (i.e. at home) ?
283468	Hypothetical : Using fictional creatures that humans turn into , what is the worst combination ?
283469	Hypothetical Question : Imagine human invented creatures , as intelligent as human and able to do any task . Then , due to some reasons , human put them in a distant habitable planet . After many generations will they believe that someone created them ?
283470	`` How can I delete an unopened message in'' `` pending'''' ?''
283471	'''' `` What's the most important message you want to leave your audience with and why should they care ?''''
283472	I have 5 + years of experience in oil and gas industry . Which SAP course will be suitable for me to join IT industry to switch the career ?
283473	Considering I am new in the oil and gas industry (2 years of experience) , should I switch to another industry since oil & gas is not a promising career anymore ?
283474	What is the best health center in India for alternative medicine ? Who , & where , are the best Ayurveda & / or Herbal doctors (ayurvedic vaidya) , centres , hospitals in India & world ?
283475	Who is the best doctor in India ?
283476	Do Census Bureau income figures count sources of unearned income , or do they just count earned income ?
283477	How does it feel to be broke at UChicago ?
283478	Did Jason Bourne and Nicky Parsons have a relationship in The Bourne Directory ? If so , what was the result of their relationship ?
283479	Do secret agents like James Bond (Bond Series) , Ethan Hunt (Mission Impossible series) , Jason Bourne (Bourne series) really exist in real life ?
283480	Can a child consider a hurricane a traumatic event ?
283481	What are the best books on trading ?
283482	What are some good books on electronic trading ?
283483	Why are flat keys more stable than the square keys in the design of shafts ?
283484	What is tha diffrent between absolute and strict liability ?
283485	What kind of lawyer handles complicated identity issues ?
283486	How do the lawyers handle losing their cases ? Is it difficult ? Is it humiliating ?
283487	How much I have to pay to get 100000 views in youtube ?
283488	How much did it cost Google to develop the Pixel phone ?
283489	How much does Google modular phone cost ?
283490	What is Panera Bread ?
283491	Does the earth retain its water ?
283492	Does earth lose any water ?
283493	What does it mean if a cute girl asks you for favors ?
283494	Is it mandatory to remember all the articles of the Indian constitution for civil services ?
283495	If President Putin said he'd nuke the US if we didn't provide $ 1T in 48 hours , what would happen ?
283496	If President Obama said he'd nuke Russia if they didn't provide $ 1T in 48 hours , what would happen ?
283497	Do athletes often have low blood pressure ?
283498	How do you really know if you have low blood pressure ?
283499	What is an interpretation ?
283500	What is an interpreter in java ?
283501	What happens when a 30 M ☉ star comes close to a 3 M ☉ black hole ?
283502	What if I stand 1 meter behind a 30 cm black hole ? What would happen to me ?
283503	Why is calling someone a bitch considered offensive but calling someone a dog isn't ?
283504	Sherlock Holmes : What does the phrase ` It's so overt , It's covert' mean ?
283505	How did Sherlock Holmes die ?
283506	How is Micromax p680 tablet ?
283507	Does battery of Micromax A116 compatible with Micromax E455 ?
283508	Why is sampling important ?
283509	How can you find the difference between a best friend & others ?
283510	What if Germany won the American Civil War ?
283511	Who won the American Civil War ?
283512	Is there a relationship between not having dipole-dipole forces and having a molecular structure (simple/giant/large) ?
283513	Did the loyalty of Indians towards their work reduce after MNCs entered India ?
283514	How can I upload music on YouTube without getting copyright infringement ?
283515	How do I post my soccer video on youtube without getting a copyright infringement ?
283516	Why don't Dunkin Donuts employees upsell or suggestive sell ? Is it against company policy ?
283517	What are algorithm and why they use ?
283518	Is Skype still popular as it used to be . Most people use Android and Hangouts is default app . Why would they install Skype if they have Hangouts ?
283519	Which is the best android free app for GROUP VIDEO CHAT for personal use ? Hangouts ? OoVoo ? And why ?
283520	How I found my ex friend new no ?
283521	Is it okay to change PhD advisers and sacrifice the topic for better environment and mentoring ?
283522	What is Isaac Held like as a PhD adviser ?
283523	Should I tell my boyfriend about my other boyfriend ?
283524	Should I tell my boyfriend everything I do ?
283525	How is drama different from other literary genres ?
283526	What are the different kinds and types of literary genres ?
283527	I can't root my phone . I have tried many methods but they failed . My mobile is a Karbonn A4 + Android 4.0.4 . Which method is the best and works for every type ?
283528	How do I root Android KitKat 4.4.2 without downloading any software ?
283529	What does it mean when imessage doesn't say delivered ?
283530	For some reason that I don't really understand I have always kept a certain distance to rap and hip-hop music . What are good places (aka songs) to start expanding my horizons ?
283531	Why don't American hip-hop and rap singers come to Russia ?
283532	Which country has the largest population of Chinese outside of China ?
283533	Should China be broken up into many countries to solve its over-population ?
283534	What is the best way to make money in india ?
283535	What is the value of (0/0) ?
283536	`` What is the Japanese word for'' `` happy'''' ?''
283537	Can a straight man have mannerisms of a stereotypical gay man ?
283538	How does a gay man propose to straight man ?
283539	How dangerous is the Dodger Stadium ?
283540	Why is Dodger Stadium dangerous ?
283541	How do I simplify the circuit to get the equivalent resistance ?
283542	Advantage and disadvantage of curd ?
283543	What are advantages and disadvantages of soap ?
283544	What is the best srategy for current affairs of ias exam 2017 ?
283545	I am preparing for group II exams . What is the best book to buy in market for current affairs ?
283546	What is the best university in Canada to study medicine ?
283547	What is the best university in Germany to study medicine ?
283548	What were the wealthiest provinces of the Roman Empire ?
283549	What were the Roman provinces and when did they dissolve and into what ?
283550	How do you treat an ingrown pimple ?
283551	How do I treat the small pimples on my lips ?
283552	Why did terrorists attack Brussels ?
283553	What do you call it when your legs go funny when you step on an escalator that isn't moving ?
283554	What are some mind-blowing home gadgets that exist that most people don't know about ?
283555	How are belly buttons formed ?
283556	What is a belly button ?
283557	Is MPM & Partners in Monaco real ?
283558	All those who live in Monaco are fabulously wealthy ?
283559	What is a 1st order reaction ?
283560	Why conversion will be same in case of 1st order reaction ?
283561	In the USA , can a public defender refuse to defend someone ?
283562	Which municipalities pay their public defenders the most ?
283563	Where can I buy Quinoa in Bangalore ?
283564	What do you do when your manager keeps picking on your behaviors ?
283565	How can I check for my use employment visa ?
283566	How do face recognition algorithms detect human faces ?
283567	How can the speed of face recognition algorithms be improved ?
283568	What are the things that you like about being a civil engineer ?
283569	Is there a way to remove a US president if s/he is proved to be too radical/harmful (for US) in his work as a president ?
283570	What role do appropriation and simulacrum play in post-modern photography ?
283571	What are the main differences of modern and post-modern architecture ?
283572	What does India need the most at this moment ?
283573	What is the Improve India movement ? Who leads it ?
283574	What are currently the hot topics in Electrical engineering research ?
283575	What are the topics on which electrical engineers do research ?
283576	What percentage of worldwide pepperoni consumption is due to its use as a pizza topping ?
283577	How did pepperoni pizza become so popular ?
283578	Who creates features and tasks in JIRA in gaming industry ?
283579	How do you distinguish the tasks of non-industrial photography and video freelancers who don't work for a company , but for themselves ? What are the differences in their work ?
283580	Can technology help grow the game of golf ?
283581	What tweak has made the most-significant improvement in your golf game ?
283582	How do I get over my technical inferiority complex ?
283583	How can I get over my programming inferiority complex ?
283584	Can you write and send messages in mandarin using web XMS (previously ebuddy) messaging service ? is it both in both desktop and mobile apps ?
283585	All the world use whatsapp application we know it . but ebuddy xms application was published by ebuddy . Its also like whatsapp.I noticed that ebuddy xms working with pin code like blackberry BBM and whatsapp so lower for using ?
283586	I want to open an alcohol or wine outlet shop in Karnataka . How do I start ?
283587	I want to open a frozen yogurt shop . How do I start ?
283588	How do Oxford and Cambridge compare to Harvard and Stanford ?
283589	Is Cambridge really superior compared to Oxford ?
283590	Can I lose weight this way ?
283591	When we should take green tea in the morning ?
283592	Who invented democracy , the USA or the Greeks ?
283593	Should the USA bring democracy in Venezuela ?
283594	Can education resolve any problem ?
283595	Do you like resolving problems ?
283596	How do I get a dynamic table in Microsoft Excel ?
283597	What are pivot tables in Microsoft Excel ?
283598	How do I stop people from stealing my app idea ?
283599	What are the best free premium link generators for uploaded , Rapidgator , NitroFlare , etc. . ?
283600	What is the best RSS sitemap generator that is free ?
283601	Do I have to be a super-genius to get into RSI ?
283602	What is it like to be a RSI mentor ?
283603	Which is the best book for economics ?
283604	Which is the best book on economics in tamil ?
283605	What are some real-world problems that should be fixed in the US ?
283606	If I unroot my phone will it denger for my warranty ?
283607	How do I find someones gmail email address ?
283608	How can I change my gmail email address ?
283609	If it's moving fast enough , could a normal 8.5 x 11 sheet of paper cut a person in half ?
283610	`` What is a good average'' `` safe area'''' for most printers on 8.5 x 11 paper ? And for A4 paper ?''
283611	What are the most followed topics on Quora in 2013 ?
283612	Are weed seeds legal ?
283613	Working of marine propulsion system in ships ?
283614	What is Trump's plan for helping senior citizens and protecting Social Security and Medicare ?
283615	What weapon (s) can an Indian citizen lawfully buy and carry for personal protection ?
283616	Which software is best for personal financial management ?
283617	What personal finance management software do you use and why ?
283618	According to you , who is Rajiv Dixit ?
283619	Who is Rajiv Dixit ?
283620	How do I perform or operate in a binary string with less time and space complexity in Java ?
283621	How do I write a Python script that will download a current profile picture of our friend's list ?
283622	How do I write a python script to check my exam results when uploaded and notify me ?
283623	How could we use corroborate in a sentence ?
283624	How would you use the word corroborate in a sentence ?
283625	Which industries would replace the top tier industries in the next 10 years in India ?
283626	How many lives have been saved my looking both ways before crossing the street ?
283627	Why does New York City still have police officers on horses ?
283628	What are the laws regarding riding a horse in the streets of New York City ?
283629	How long can a direct message be in Instagram ?
283630	What are butterfly knives ?
283631	What do you do with butterfly knives ?
283632	Is someone spying on me through my cell phone camera ?
283633	What's the difference between pressure and force ?
283634	What's an easy way to remove henna tattoos ?
283635	Why does inflation happen ?
283636	How do I find the total number of credit and debit cards issued by banks in India ?
283637	What is the cecum ? What is its function in the digestive system ?
283638	What is the function of the esophagus in the digestive system ?
283639	`` What is a sentence with the word'' `` entreat'''' ?''
283640	Average speed of plane ?
283641	How did the Renaissance and the scientific revolution change the world ?
283642	How are the Renaissance and the scientific revolution related ?
283643	Are there video lectures in Allentab for JEE ?
283644	I am an engineer with some courses in Sanskrit (High School Level) . How hard would it be to become fluent enough to compose folk poetry ?
283645	What are the health benefits of almond butter ?
283646	What are the health benefits of cheese and butter ?
283647	What's the point in living if you're so depressed it's ruining your life and you can't seem to get healthier no matter how hard you try ?
283648	What is a suitable inpatient drug and alcohol rehab center near Jenkins County GA ?
283649	What is a suitable inpatient drug and alcohol rehab center near Worth County GA ?
283650	How are computers cooled and does it vary based on the size and function of the computer ?
283651	Why Petroleum is more volatile than water ?
283652	Does South Dakota State University plays division 1 in football ?
283653	Does South Dakota State University plays division 1 in basketball ?
283654	How do I clear a selection of JRadioButton in Java ?
283655	Who can help me in selecting mini java project ?
283656	Espionage and Spying : How do you spot a secret agent ?
283657	What's the difference between secret agent and spy ?
283658	What are some unusual aspects about politics and government in Estonia ?
283659	Why is the weather so cold in Mumbai today ?
283660	Why do so many people dislike cold weather ?
283661	Which parts of the human body will remain alive and for how much time after death ?
283662	Can tails be a part of human body once again ?
283663	My acds are Xth 88 % , XIth 84.8 % and UG 78.5 % . What shuold my CAT percentile be in order to get a call from A , B , C ?
283664	How different tennis game is to play at Indoor versus outdoor courts ?
283665	What are some best on court tennis strategies ?
283666	What are some examples of stimuli ?
283667	How are stimuli and response related ?
283668	What would happen if Russia wanted to join NATO ?
283669	How is chandragupta institute of management patna ?
283670	My All India Rank in NCHMCT is 3500 . Which institute of hotel management would I get ?
283671	How do you get a contract job in Boston ?
283672	How can I get a contract job in the U.S. ?
283673	Is Rohit sharma is unsung hero ? Why we forget him every time and give credits to kohli , raina etc. . ?
283674	Why do Quora moderators spend so much time diddling small animals ?
283675	How can I start feeling loved ?
283676	How do I start feeling love ?
283677	Where is the best location in southern CA to open an mmj clinic ?
283678	Which is best ratio 4.3 or 16.9 for photo clicking from mobile
283679	What does a left palm itching means ?
283680	What does it mean when the palm of your hand aches ?
283681	How can I get a job in core electronics ?
283682	How can I get a job in core electronics companies ?
283683	Will he ever take me back ?
283684	Will my narc ex ever come back to me even though he hates me right now ?
283685	What are the options for a high school drop out ?
283686	What are the basis accounting ?
283687	What are the differences between cash-basis and accrual-basis accounting ?
283688	How has Bollywood corrupted the Indian youth's perception of love ?
283689	Are Indian youth immoral . ?
283690	I am reading the same questions again in Quora which has the same answers ?
283691	How does Meebo use CouchDB ?
283692	Which startups use CouchDB ?
283693	Do we have to learn the value of constants and electrode potentials for NEET exam or it comes mentioned in the question ?
283694	4 yrs exp ` ed in a service MNC , Low economic background . I have planned go for MBA . Is 1yr MBA or 2 yrs a right choice ? Also , if its 1year - CAT or GMAT ?
283695	How did rich roman girls live ?
283696	Does living in mountainous areas prolong human life , Andes , Himalayas , Caucasus ? Why ?
283697	How can I get famous on Instagram anonymously ?
283698	How do I get famous on Instagram ?
283699	How much of a role do siblings play in personality development ?
283700	Does anyone using Jio in HTC one M8 ?
283701	What would happen to earth if it was caught by a black hole ?
283702	What would happen to Earth if a tiny black hole collided with it ?
283703	What wiring I need to do to install ignition live lighter socket on opel/vauxhall zafira B ? Socket will be for DVR and phone charger .
283704	Who has the best pussy in Bollywood ?
283705	What was the first Q&A website ?
283706	What was the first website ?
283707	Should I go against my family and marry an average-looking girl who loves me a lot or go with the easily available , beautiful girl my family approves of ?
283708	Is it worth marrying a girl for her beauty ?
283709	Is there a perfect translator for all languages in the world ?
283710	Should I bring a laptop in my 1st year in Engineering ?
283711	What is a suitable solar panel installation provider near Camp Pendleton , California CA ?
283712	How do I become an international arms dealer from Pakistan ?
283713	Can a jet fighter fly to orbit where ISS space station located and fly back again ?
283714	Who are the best personal financial advisors in Miami for people saving for retirement ? What were your experiences with them ?
283715	Where is the peace in the world ?
283716	How much bullshit is on Quora ?
283717	How to write a C++ program to check whether a number is even or odd without using the modulus operator ?
283718	How do I pay cash for a uber ?
283719	How does Uber/OlaCabs charge if you are paying cash to a driver ?
283720	What is it like to work for Nokia Siemens Networks at the Bangalore location as a software engineer/senior software engineer ?
283721	Do software engineers prefer to work remotely ?
283722	If I delete someone's conversation (old msgs + new unread message) on WhatsApp without reading it and without opening their chat window , will they receive blue ticks ?
283723	Installing RFID tags on trolleys to track them to prevent more of them being abandoned ?
283724	Which things feels much better than sex ?
283725	What is the value (log e) ?
283726	What is the value of log (- ∞) ?
283727	What is the difference between keyboard and keytar in operation or playing ?
283728	What is it like to be a freshman at the University of Florida ?
283729	What is it like to attend the University of Florida ?
283730	`` How do porn stars separate'' `` real sex'''' from'' `` porn sex'''' ?''
283731	What would I have to do to have sex with the Russian porn star Anjelica ?
283732	Can ` c' be considered speed of time ?
283733	Is there a speed of time ?
283734	What are the rounds for freshers bsc students ?
283735	How much does a printing of banner cost ?
283736	What is a suitable inpatient drug and alcohol rehab center in Iroquois County IL ?
283737	What coaching institute in Delhi or Kota should I join if I plan to drop a year seriously ?
283738	Which is the best coaching institute in Kota for droppers ?
