482730	What are some common examples of idealism ?
482731	Have we replaced idealism with egotism ?
482732	What is the Lewis structure for OH - ?
482733	Is the Star Trek society socialist or communist ?
482734	What font should I use to type Roman numerals ?
482735	What software and font do I use to type my novel ?
482736	How much do I need to score in CAT to get into SIM ?
482737	Is liquid nitrogen flammable ?
482738	What is it like to have a friend who is a porn star ?
482739	Which IIT's and NIT's provide winter internships ?
482740	Do any IITs or NITs provide internships ? How can I get one ?
482741	What is the best website to help with a statistic online class course ?
482742	If you are a trader , what do you want to buy from China ?
482743	What are the best jobs/careers if you want to have a comfortable , fulfilling life , but you don't want to spend your life behind a computer ?
482744	Why did Mao spare Chiang Kai Shek to rule Taiwan ?
482745	`` What's your opinion on social media (Facebook , Twitter etc) ? Do you think that people around you or people you know use it too much ? Has anyone shared a detail of his/her life on social media that made you think'' `` this is too private to be shared'''' ?''
482746	What are some simple ways of saving money for your dream trip ?
482747	Which is the best ladies leather handbags brand in India ?
482748	Is it safe to bathe the bunny ?
482749	Is it legal to provide services to move money from paypal to payoneer and vice versa ?
482750	How do Muslims feel about sharing a part of Temple Mount with Jews (not Israel) ?
482751	Should Jews and Muslims accept a peace plan based on returning the temple mount to its natural state and allowing the open air site to be shared ?
482752	What are the key factors mobile phone makers consider when choosing a battery ?
482753	We all have diff . mobile feature preferences & one key pref . is battery life . What are the factors in battery amp h one must consider when picking a phone ?
482754	When does it snow in Canada ?
482755	What is the future of IT graduates in England ?
482756	What is the future of England ?
482757	I am a high school student . How do I start a startup with little to no capital ?
482758	What should I start doing if I want a job in finance (I am a high school student) ?
482759	Has anyone successfully deleted Facebook messages that were sent to the recipient (I'm desperate to delete a message before it gets to them) ?
482760	`` Which members of Forbes''' `` 30 Under 30'''' are on Quora ?''
482761	What do you really know about Iran ?
482762	What should everyone know about Iran ?
482763	How does concentration in Applied Mathematics with a focus field in Economics at Harvard help in getting in a graduate school ?
482764	I graduated magna cum laude , with a double major in computer science and economics . Does it look good to employers ?
482765	How does moodle.org make money ?
482766	Why we need ampersand in scanf (-RRB- but not in printf (-RRB- in C language ?
482767	What is the review of the Vedant builder group in Pune , India with projects like Kingston XYZ ?
482768	What are some theatre groups for kids in Pune ?
482769	How do I stop a false report on Facebook ?
482770	Why is AngularJS so popular in India ?
482771	How do 3d printers print houses ?
482772	How do 3D printers print food ?
482773	What are some things to know before sky diving ?
482774	How do I generate APK in my own tablet (Android) , instead of using Android studio ?
482775	Which is the best Internet Service Provider in Dhanbad ?
482776	Which is the best internet service provider in Sion , Mumbai ?
482777	Is a platypus considered a bird ?
482778	Do dogs eat birds ?
482779	What does SSL mean ?
482780	What is HTTPS/SSL ?
482781	What are some other movies like Fast & Furious , and Need for Speed ?
482782	Will Hyderabad , IN be a Union Territory ?
482783	How many users does behance have as of 2016 ?
482784	How many users does Behance have ?
482785	What is Darth Vader's favorite book ?
482786	How do I live life constructlively and achieve success in career ? While suffering with anxiety and obsessive compulsive and disorder ?
482787	How can I recover from depression , panic disorder and generalized anxiety disorder with lower chance of relapse ?
482788	What can I use to clean a washing machine drum ?
482789	What is the best way to clean a washing machine ?
482790	When should a startup hire an expensive data architect instead of letting their young software engineers build ad-hoc database tables through the framework and ORM (Rails , Django , etc) ?
482791	Is MailChimp a good option for a startup ?
482792	Why was Hizbul Mujahideen commander Burhan Wani's funeral attended by so many Kashmiris ?
482793	Why are some people supporting Burhan Wani ?
482794	'''' `` For admission to IITs we need to be in Top 20 percentile of passed students in ur STD 12th boards or 75 per cent in 12th boards'''' What Does this mean ?''
482795	I have scored 376/500 in 12th board exams . Do I qualify for admissions to IITs and NITs in 2017 ?
482796	What habits have changed people's lives ?
482797	How can I change my daily habits ?
482798	What are some things new employees should know going into their first day at Ceva ?
482799	How is religion root of terrorism ?
482800	Am I a good father ?
482801	Are there any accurate Thanksgiving books available for children ?
482802	Is liposuction a safe and right way to remove excessive fat ?
482803	Can any professional football (soccer) players score 1000 goals in modern football like what Pele did in his career ?
482804	Who is the football player with the most international goals in his career ?
482805	What are the similarities and differences between Islam and Shaivism ?
482806	What is the best company to work as a business analyst ?
482807	What are the best industries to work for as a business analyst ?
482808	What is mean in statistics mean ?
482809	Denomzation is good ?
482810	Can any body elaborate how wipro limited is different from wipro digital ?
482811	I missed a call from Wipro.What should I do ?
482812	How did vivaldi make a lasting impact on classical music ?
482813	Google database software ?
482814	There are many foreign players in the NHL and MLB . What do they think about having to stand for the US National anthem ?
482815	How we can apply for campus recruitment for other colleges ?
482816	What was the first time Christians blamed the Jews for something ? (In written History)
482817	`` Apart from Tony , who are your most favorite and least favorite characters on'' `` The Sopranos .'''' (It's a difficult question , I know .) ?''
482818	How energy related to time ?
482819	You're right . We were drunk the whole time . It was all nothing . I agree . Congrats ?
482820	: - > what does this symbol mean ?
482821	Who are some people in the US that have more decision power than the president ?
482822	Is there anyone from Heritage Institute of Technology , Kolkata ; who have pursued or planning to pursue PG in Physics after their Btech ?
482823	Where can I buy minoxidil ?
482824	Can the Magic TV be used to create MP4 files from recorded TV shows ?
482825	How do movies and tv shows create passports ?
482826	Can we call intermolecular forces as chemical bond ?
482827	What kind of chemical bond is CCl4 ? Is it covalent bond or ionic bond or both ?
482828	He's a junior in college living with six of his friends . He wants me to climb through his window instead of going through the front door . I know that pretty much makes me a booty call ; how do I change that ?
482829	How do I change who I am ?
482830	Why did Christmas get so big compared to other holidays ?
482831	What should I get for Christmas ?
482832	How do I find the number that appears only once in an array of size n that has numbers that can appear multiple times ?
482833	How do I write an algorithm to search an array to make sure that all of its values appear at least twice ?
482834	Why do I feel so empty after watching a movie ?
482835	I want to watch Manto Film . Where can I get it ?
482836	If I purchase gems in Clash of Clans using the Freedom app , can I play multiplayer after that ?
482837	What is the real effective exchange rate (REER) ?
482838	What is the expected GBP to INR exchange rate in Feb 2017 ?
482839	How should I start a mobile marketing and mobile commerce business ?
482840	Should an e-commerce business opt for a mobile app or a mobile website ? Why ?
482841	Who is the Hindu god of nature ?
482842	Are we a nature or god ?
482843	Why do cocaine users cut up lines on a mirror ?
482844	Is cocaine ever legal anywhere ?
482845	Out of Chitkara University punjab and Manipal university which one is better , my 2nd year has just started , want to change my college ?
482846	Can I change my university with backlogs after the 2nd year ?
482847	`` Has the'' `` Be limitless'''' browser plugin gotten stuck on a quotation for anyone but me ?''
482848	How could you be limitless ?
482849	What is the best self study book on differential equations ?
482850	Which is the best book for learning Differential Equations ?
482851	What are alternates to linkreferral.com ?
482852	Specific Types of Adult Content : Where on the Internet can I find strangers willing to watch me masturbate ?
482853	How is Accenture different ?
482854	How can I join the merchant navy after my B.Tech in mechanical engineer ? How can ensure my job in the merchant navy ?
482855	How does distilled water and demineralized water differ ?
482856	Is Indian media always right ?
482857	Why is the Indian media always criticizing ?
482858	What is it like to be an Indian in America ?
482859	What are some common but not easy to get interview questions related to C programming language ?
482860	What is the history of the profession of wedding planning ? When did wedding planners become an oft-used resource ?
482861	I'm planning a Cayman Wedding for my sister . How do I find a suitable planner for her wedding who will take utmost care of even the minute details ?
482862	Is hydroxide an ionic bond ?
482863	How do I control a DC motor with an encoder using Arduino ?
482864	How can I control the speed of 4v dc motor ?
482865	Is a sin to kill an animal overtaken with cancerous tumors ?
482866	How are my IGCSE grades going to be decided ?
482867	What is your review of Slide (company) ?
482868	What is your review of Slidely ?
482869	Which mobiles are compatible with Reliance Jio ?
482870	Is Moto mobile compatible with Reliance Jio ?
482871	Is there any formula to find average of prime numbers between any two given numbers ?
482872	Is there any formula to find average of consecutive numbers between any two given numbers ?
482873	Where can I find an online YouTube-to-MP3 extractor ?
482874	If I was going the speed of light and travelled 10 light years , would that be 10 years to someone on earth or 10 years to me ?
482875	If I travel to a planet 10 light years away from earth at 90 % of the speed of light , why will it take me less than 10 years according to the time dilation equation ?
482876	Why Vedas Verses can't be adulterated while same is possible for Bibal or quran ?
482877	How should Muslims interpret the verses 9:5 , 9:29 , and 4:89 ? In what contexts were these verses in the Quran revealed ?
482878	Should the reservation in Indian education sector be based solely on income ?
482879	Is Reservation in India Caste-based or Class-based ?
482880	How can I contact Elon Musk ?
482881	Is Elon Musk a unicorn ?
482882	`` How do you pronounce the letter'''' ï'''' ?''
482883	My Android phone is hacked by someone . how do I unhack it ?
482884	How can I aim to become a data scientist from being a software engineer for 3 years ? Can anyone show me the road-map ?
482885	How reliable is valuecart ? Has anyone bought a mobile phone from them.If yes , How was your experience ?
482886	How do I fix an OKI printer not printing black ink and missing colours ?
482887	Are Hindus cheaters ?
482888	I want to learn ecology , where should I start ?
482889	What is the most embarrassing moment of your parent's life ?
482890	What are some strange things banned in countries ?
482891	What is the shape of the universe , conical or spherical ?
482892	Why do people say I'm aggressive ?
482893	What are the major stereotypes people have about Hungary and to what extent are they true ?
482894	Does any law govern to limit the amount of cash withdrawal by any account holder per day / month ? # I know about temporary gazetted notification
482895	What knowledge do mechanical engineers need to invest in ?
482896	What is the DELTA vendors ?
482897	How do I prepare for campus placement in Delloite ?
482898	What is the Versant communication test ?
482899	What are the different kinds of track and field positions ?
482900	I qualified to compete in the State Track and Field Meet . However , it's on the same day as my graduation from high school . Which should I choose ?
482901	What is the meaning of Fourier transform of an image ? Why is it important in image processing ?
482902	Why is image compression important ?
482903	How do I prepare for the IES/GATE while in my second year of civil engineering ?
482904	Do Christians think that once they go to heaven , they will exist there forever , past the death of our universe ?
482905	Where should smoking be banned , and why ?
482906	Obama's Final Two Years (2015-16) : If World War 3 or any war occurs during 2016 , will President Obama stay President until the war is over or can an election occur during a major war ?
482907	What had happened during the world war ?
482908	Does Vegas control results in major sports leagues ?
482909	How do I start a sports league in India ?
482910	What is a finance rate ?
482911	What is finance ?
482912	Where can I buy cheap and good bean bag couches ?
482913	We have just moved to SF from Australia . Where is the best place to buy a bed and a couch that aren't too expensive ?
482914	Is wbJEE board release marks officially in the wbJEE examination ?
482915	Is it possible to have true randomness ? (i.e. not fixed probability but probability itself changes undeterminably) ?
482916	Why do people pay subscriptions to news media outlets when there is plenty of free , up to date and reliable information on other sites ?
482917	Is physical or mental labour more difficult ?
482918	Which is more difficult , mental labour or physical labour ?
482919	What's the most unwanted purchase you have made in your first 4 years of earning that you regret now ?
482920	What marks will I get if I write 120 words in TCS verbal ability test ?
482921	What marks will I get if I write 93 words in TCS verbal ability test ?
482922	Does being compassionate to another human being should be a much needed human trait ? If yes , then why do we have wars and killings ?
482923	Can India have a PM who is a poor farmer and don't know anything about politics ?
482924	Why do some people hate Sandeep Maheshwari ?
482925	How do I save some iOS app settings in Xcode using Swift ?
482926	When can you start using Swift in your iOS app ?
482927	`` What does'' `` low-hanging fruit'''' mean in research ?''
482928	What is some low-hanging fruit in microbiology research ?
482929	Can Redmi note 3 be wirelessly charged ?
482930	How will Pope Benedict XVI's successor be chosen ?
482931	What will be Pope Benedict XVI's legacy as a Pope ?
482932	Is Bill Nye the science guy on Hulu or Netflix ?
482933	When will Netflix or Hulu arrive in France ?
482934	What's the purpose of being active on Quora for a psychopath/sociopath ?
482935	Why do psychopaths answer questions on Quora ?
482936	What are the pros and cons of giving birth to a child in the US given that the parents are non-citizens (with a chance that they will naturalize in a few years) ?
482937	If a US citizen gives birth outside the US , is the baby a US citizen ?
482938	Why are payday loans legal ?
482939	How can I teach my baby three languages at the same time ?
482940	What are great questions to interview a salesman ?
482941	What are some great example answers you've given or heard for a behavioral interview question ?
482942	What are the design differences between naval combat ships for littoral waters versus those for the high seas ?
482943	Why Australia lost 2016 test series against South Africa at home ?
482944	Are Credit courses from Harvard extension school helpful for graduate school admission ?
482945	Need complete information about Apache Spark RDD , how it gets partitions , memory for it , any default size is there and all ?
482946	Is Sausage Party the best comedy of the year ?
482947	What are fractal antennas ? How do they work ?
482948	What is special about fractal antennas ? Why do they work the way they do ?
482949	Should I go to the career fair at UW during my first quarter even if I don't have any experience ?
482950	What are the best UW dorms ?
482951	Which Indian comic superhero is the best and why ?
482952	Which comic superhero is the best ?
482953	How does a recipe change if you substitute unsalted butter for salted butter ?
482954	What happened to Saruman after the One Ring was destroyed ?
482955	Can the rolling wheels of a car generate enough electricity so the car itself can be completely energy independent ?
482956	How do electric cars work ?
482957	What is the difference between Dragon Ball and Dragon Ball Super ?
482958	What's the difference between Dragon Ball Super and Dragon Ball Z ?
482959	Public opinion : as a Bulgarian , what do you think about the EU ?
482960	What does the average Bulgarian think of America ?
482961	I have been told to prepare a presentation on any topic of my choice for a job interview . What kind of topic should I choose ?
482962	What is 1/1/infinity ?
482963	If a person from a different religion converts to Hinduism , what will be his/her caste ?
482964	If someone decides to follow the Hindu religion , what would be his/her caste ?
482965	Hostels in Delhi near madeeasy ?
482966	What is the best strategy to invest in Nifty 50 stocks in India for good returns ?
482967	Is it worth working at whirlpool and leaving ibm ?
482968	Micro wind turbine ?
482969	What is up with the world ? Why can't there be peace ?
482970	Are international schools performing better than mainstream schools in Chennai ?
482971	Which is the best international school in Chennai ?
482972	How genuine is online profit guru ?
482973	Can I have some genuine online based jobs ?
482974	How large are the batteries in a typical bluetooth earpiece ? How long do they typically last at min/avg/max power drain ?
482975	How do I know about mobile phone battery timing ? How long will the battery life time be if it has 1000mAh , 2000mAh , 3000mAh ? Is mAh the only metric for battery timing or does it also depend on other factors ?
482976	What do you think about the brazilian music ?
482977	People who are pro gun (liberal or conservative) ; can you explain why you are ?
482978	What is a scope resolution operator in PHP ? How is it used ?
482979	Who is the best cm in development in India ?
482980	What chemicals (toxic and non-toxic) are released , if any , when drinking hot liquids through a plastic straw ?
482981	Is it safe to drink coffee in plastic cup ?
482982	Do police officers often swear ?
482983	What numbers that are bigger than Graham's number have been used in mathematics so far ?
482984	My lumia 720 camera lens is now not clear , after clicking pics , when I see it there will be blar pics how to solve that problem ?
482985	Facebook pics are not visible while on my android . Theres a frame where the photo should be . . But I have to click on it ir order to see it . Same with peoples default pics and cover pics . Any suggestions ?
482986	Where can I find illegal business in Bangalore ?
482987	What are the real way to succeed in business (no scam , not illegal) ?
482988	Would catamarans and trimarans have fared well as large scale military ships (let's say in the 18th and early 19th century) ?
482989	Why do we say `` 18th century'' when it's the 1700s ?
482990	I've been dating a guy for a month . I met his family and he wants a serious relationship . But he has my name under Larissa in his phone . Is that bad ?
482991	How is the repo rate fixed by RBI in India ?
482992	Why did the RBI not reduce the repo rates in this quarter ?
482993	How are heptane's isomer determined ?
482994	Why are ants attracted to human sweat ?
482995	Can I attempt all the four sections in KVPY , Sabya ?
482996	Can I attempt all four sections in KVPY ?
482997	Can we flash MIUI 8 stable to developer rom ?
482998	How do I overcome fear and laziness ?
482999	Uber in 2015 : Can I use my Audi A4 for UberX ?
483000	What roles did beauty and love play in the Renaissance ?
483001	What role does beauty and love play in the philosophy of the Renaissance ?
483002	What wisdom you want to share today ?
483003	I want to fuck as many women as I can in my life ? How can I achive it ?
483004	Why does my ex-boyfriend want to tell me about the new women in his life ?
483005	What is the best mobile operator in Sweden ?
483006	How do you login on Kik from your PC ?
483007	Can you get Kik on a PC ?
483008	Is there any place to give suggestions to Quora ?
483009	What type of bridge is best suited to offset the insidious effects of Seismic Creep ?
483010	What is the best design for a top-loaded balsa wood bridge ?
483011	How hard is it for an undergraduate at Stanford to double major in EE and MS&E ?
483012	A double major in Engineering Physics and Philosophy ? Would it be worth it ? How hard ?
483013	Is it the Big Ongoing , not the Big Bang ?
483014	Does dark energy make the Big Bang superfluous ? Does dark energy make the Big Bang incorrect ?
483015	What is the cutest creature that most people find gross ?
483016	What is the cutest thing you've ever seen a dog do ?
483017	What is Gennxt program in Wipro ?
483018	How is the wipro coherts programme ?
483019	What are the worst things about models ?
483020	What are the worst things about modeling ?
483021	Why is my head twitching ?
483022	Why is my left cheek twitching ?
483023	What are some clever ways to save money ?
483024	`` In the 1940s , did'' `` leftist'''' and'' `` left-wing'''' mean the same thing ?''
483025	What is the best protein powder for protein shakes ?
483026	Which is the best window 1.5 ton ac ? Hitachi , blue star or Panasonic ?
483027	How do I get a Bluetooth security code ?
483028	How can I apply for TSPSC Group 2 Notification ?
483029	How safe is the paleo diet ?
483030	Is a vegetarian paleo diet safe ?
483031	`` Do women also want'' `` happy endings'''' when they go get a massage ?''
483032	Is it possible to use Square as a POS system for a bar ?
483033	How do you use Square as a POS system between two bartenders to keep tips separate ?
483034	What are some lesser-known sights to see when visiting Mixco , Guatemala , Guatemala ?
483035	What are some lesser-known sights to see when visiting Guatemala City , Guatemala ?
483036	Is it possible to stay in sun ?
483037	How do you learn how to write Japanese characters ?
483038	My Samsung Galaxy S Duos is getting too slow . What application or other method could help me ?
483039	What is the best custom ROM for Samsung Galaxy S Duos S7562 in terms of performance ?
483040	Reddit (website) : Who are some of the smartest/most interesting/most trustable Redditors on Reddit's / r/askscience ?
483041	What are the requirements to get internship for eee ?
483042	What does it feel like to have alcohol in space ?
483043	What is alcohol ?
483044	What are the best ways to get startup funding in India ?
483045	What are some lesser-known sights to see when visiting Salta , Argentina ?
483046	What are some lesser-known sights to see when visiting Lanús , Argentina ?
483047	What happens to a bullock after it is used for Jallikattu ?
483048	What does being social actually mean ?
483049	FIltering of AC voltage via transformer with no step up or step down AC prior to DC conversion by a Full Wave Rectifier providing DC voltage for use ?
483050	What are some things new employees should know going into their first day at Rackspace ?
483051	What do social process theories of crime include ?
483052	What are the social process theories of crime used for ?
483053	How do you manage inventory on Amazon ?
483054	Which is better for medical entrance coaching Jodhpur or Udaipur ?
483055	Can I settle in u.s at 42 age ?
483056	Are OCI card holders eligible to obtain a Aadhar card / UID card ?
483057	How does admission into engineering , science or medical colleges in India work for students who are OCI card holders ?
483058	Who , according to you , is the best character on Suits ? Why ?
483059	Are Daenerys and Aegon I similar ?
483060	What are some things that people think are illegal but are not ?
483061	Is SMU the surprise team in college basketball ?
483062	Why did movie actors and voice-over ` artists' of newsreels and the like (in the 1930s or so) used to speak in much harder , harsher ways than similar people do today ? Or is it just me ?
483063	How do I use IDM Grabber to download a YouTube playlist ?
483064	What is federation and why it is important ?
483065	How can I improve my Quora writing skills ?
483066	Can someone who works for my company take a picture of me without my knowledge while posing as a customer using their cell phone ?
483067	Was Domenico Scarlatti musically far ahead of his time ?
483068	What do you think about Zaha Hadid's architecture design ?
483069	Why am I not growing taller ?
483070	Should/shouldn' t Narendra Modi be our next PM ?
483071	Which is more financially beneficial : being in a firm or teaching in an architecture college ?
483072	Why might career training programs be more beneficial than a college degree , if at all , to aspiring entrepreneurs and tycoons ?
483073	I want to clear NEET 2017 without taking drop and without coaching and I'm currently in class 12 . Can you give me some tips and tricks ?
