198000	Which is the better place to live : Goa or Kerala ?
198001	1.855.662.4436 What is the best canon printer technical support number for printing issues in USA ?
198002	What is the technical support phone number for Canon printers in the UK
198003	What's it like working at Dropbox ?
198004	What is it like to work at Dropbox ?
198005	How do I make my stories longer ?
198006	What are some good ways to make a story longer ?
198007	Why shouldn't we vote for Donald Trump ?
198008	`` Which is the best track in the new album of Pink Floyd'' `` The Endless River'''' ?''
198009	`` What are some good songs from'' `` The Endless River'''' by Pink Floyd ?''
198010	What is yellow journalism ? What are some modern day examples ?
198011	As ALL matter is created soon after the Big Bang , and in a relatively small area , why doesn't it collapse into a black hole under its own gravitation ?
198012	Which year had the best olympics ?
198013	Why do men get sleepy after sex ?
198014	What is the silliest question ever asked ?
198015	What is an intuitive explanation of a zero-sum game ?
198016	What is a zero-sum game ?
198017	What is female reproductive system ?
198018	What is the female reproductive system ?
198019	My girlfriend is very smart and personable but not pretty . How can I call the relationship off without hurting her ? (long distance relationship , < 1yr)
198020	How do I become multimillionaire with LIC ?
198021	How do I become a multimillionaire in LIC as a development officer ?
198022	What is a canyon ?
198023	What's a canyon ?
198024	Can a high school graduated-student take AP Exam ?
198025	Can you take AP exams after graduating high school ?
198026	How can I beat laziness ?
198027	Why are there stones on railway tracks ?
198028	What is the best thing a person can give to his kids ?
198029	What is the best thing you can give your kids ?
198030	What is difference between aerospace engineering and aeronautical engineering ?
198031	What is the difference between aerospace engineering and aeronautical engineering ?
198032	Why do I feel inferior among all Quorans ?
198033	Why do I feel so inferior here on Quora ?
198034	How can I deal with inferior complex ?
198035	How do I deal with inferiority complex ?
198036	`` How is the word'' `` fuck'''' associated with racism ?''
198037	`` Is the word'' `` fuck'''' racist ?''
198038	Is it possible to learn web development from scratch ?
198039	Does anyone have any helpful diet advice for hyperthyroidism ?
198040	What diet should one take if suffering from hyperthyroidism ?
198041	Does intelligence really differ from person to person ?
198042	Why does intelligence differ from one person to another ?
198043	Why are you a fit for this role regional operations coordinator role ?
198044	Why are you a fit for regional operations coordinator role ?
198045	What is the expectation-maximization (EM) algorithm ?
198046	What is an intuitive explanation for the expectation maximization (EM) algorithm ?
198047	What were the main causes for the disaster at the Chernobyl Nuclear Power Plant ?
198048	What were the main causes of the Chernobyl Nuclear Power Plant disaster ?
198049	If you had a billion dollars , what would you do with it ?
198050	Who do you miss the most and why ?
198051	How do you deal with nosy people ?
198052	What is the best app for mindfulness meditation ?
198053	What would have happened if the United States had won the Vietnam War ?
198054	What would've happened if the United States won the Vietnam war ?
198055	How safe is rain water to drink ?
198056	Is rain water safe to drink ?
198057	How do I get into the ISB ?
198058	How do I get free cell phones ?
198059	How do I get a free cell phone now ?
198060	What is the best company to work for as an actuary ?
198061	What are the best companies to work for as an actuary ?
198062	If NASA found out , halfway through the STS-107 mission , that the shuttle is damaged , what could it have done to save the crew ?
198063	Which is better : personal loan or credit card ?
198064	Which is better , personal loans or a credit card loan ?
198065	What does SC mean in Facebook ?
198066	What is the SC on Facebook photos ?
198067	How one can differentiate love and lust ?
198068	How would you differentiate love and lust ?
198069	What would happen if Harvey Specter met Sheldon Cooper ?
198070	What would happen if Sheldon Cooper met Harvey Specter ?
198071	When will someone answer my question ?
198072	Will someone answer my other question ?
198073	Who do you think will be the next U.S. president ?
198074	If you could make one wish what would it be ?
198075	What is the monetization strategy of Quora ?
198076	What's it like to work for PornHub ?
198077	What is it like to work at Pornhub ?
198078	Why is it correct for the Philippine President to call the U.S. son of bitch in the world ?
198079	What is the US presidential election process ?
198080	What is the method of presidential election in USA ?
198081	Under which department is humanitarian assistance ?
198082	Under which department does humanitarian assistance is considered ?
198083	Why can't India lift Article 370 from Jammu & Kashmir ?
198084	Is South Korea developed ?
198085	Hackers : How do email accounts get hacked in layman's terms ?
198086	What was your most embarrassing moment on a date ?
198087	What is the most embarrassing moment in a date (gf/bf) ?
198088	How can I wake myself up when I'm tired ?
198089	How do I wake yourself up when tired during the day ?
198090	Can I live a happy life without ever experiencing romantic love ?
198091	Can I have a happy life without ever experiencing romantic love ?
198092	At what point did the American Psychology Association remove homosexuality from the Diagnostic and Statistical Manual of Mental Disorders (DSM) ? What were the internal arguments for and against the decision ?
198093	What was the scientific reasoning behind the removal of homosexuality from the Diagnostic and Statistical Manual of Mental Disorders ?
198094	How do I control my mind ?
198095	What should I do to control my mind ?
198096	How many hours of deep sleep needed per day ?
198097	How many hours a night should people sleep ?
198098	What is it that makes you angry ?
198099	How is jogging or running good for weight loss ?
198100	How is joging or running good for weight loss ?
198101	How do you know you have a crush ?
198102	Why does Quora keep collapsing every answer I write ?
198103	Why is every single answer I post automatically collapsed ?
198104	What are some really strange mathematical facts ?
198105	What are some outrageous mathematical facts ?
198106	Can Argentina become a superpower ? If Argentina became a superpower , how would this affect Brazil and USA ?
198107	Is it possible , for Argentina to become a superpower ?
198108	What is your review of Xiaomi Redmi Note 3 ?
198109	What is your review of Xiaomi Redmi Note 3 16GB ?
198110	What are some good photo editing apps for Android and how do they work ?
198111	Why did you cry ?
198112	In ten words or less , what makes you cry ?
198113	What are some of the fun facts about FC Barcelona ?
198114	How do I improve my article writing ?
198115	How can I improve my article writing ?
198116	What is that one thing which you can not live without ?
198117	`` My height is 6'' `` 3 which royal Enfield would you prefer ?''
198118	Why would my boyfriend have a fake facebook account if he doesn't even use it according to him ?
198119	What can my boyfriend be up to (hiding) if he has two fake Facebook accounts ?
198120	What do you know about China ?
198121	How do dermatology and pharmaceutical companies market their products ?
198122	How pharmaceutical companies market their product in market ?
198123	How many countries you have traveled so far ?
198124	How many countries have you been to ?
198125	How transformer action happens ?
198126	What is transformer action ?
198127	What are sleep cycles ?
198128	What is a sleep cycle ?
198129	What foods should I stop eating ?
198130	What are the foods one should stop eating ?
198131	Why is history so important ?
198132	Why is History Important ?
198133	What is it like flying on Ryanair ?
198134	What is your favorite Pokemon ?
198135	`` How do I know that my'' `` friends'''' are actually my true friends ?''
198136	Why is marriage so essential in life ?
198137	Why is marriage important ?
198138	Does Islamic State have a right to exist ?
198139	Was Steve Jobs an inventor or an innovator ?
198140	Was Steve Jobs an inventor ?
198141	Who is the best chief minister in India now ?
198142	What are the best hacks to get free food ?
198143	What are some hacks you've used to get free food ?
198144	How can I make classroom lectures more interesting for students ?
198145	Would you prefer to be rich or famous ?
198146	If you could only choose one , which would you prefer to be : rich or famous ?
198147	How can I know girl is interested in me or not ?
198148	What are some good movies rated low on IMDb ?
198149	Which was the most scariest places in the world ?
198150	Fear : What are some of the scariest/haunted places in world ?
198151	Gillian Anderson : What would you say has been your biggest mistake in your career or life ?
198152	Modi Ji was very positive about the Lokpal before coming to power . Why hasn't he appointed a Lokpal committee yet ?
198153	What is the importance of maths in other subjects ?
198154	Should Social media comments be protected by free speech ?
198155	Should all social media comments be protected by free speech and why ?
198156	Who is the most badass professor at IIT Delhi ?
198157	Why are chess championships separated by gender ?
198158	Why is there a separate stream and separate championships for male and female chess players ?
198159	How do I start learning or strengthen my knowledge of data structures and algorithms ?
198160	What is it like to work as a summer analyst intern at Goldman Sachs in India ? Is an individual given technical task or managerial task
198161	Why does the bottom of my stomach hurt after intercourse ?
198162	Why does my stomach hurt after intercourse ?
198163	What's it like being a lesbian ?
198164	What are some Nanny Cams ?
198165	What is a good nanny cam ?
198166	Do aliens even exist ?
198167	What is Arvind Kejriwal doing nowadays ?
198168	What is Arvind Kejriwal doing now a days ?
198169	Is the world going to end in Halloween 2016 ?
198170	How can I flip my computer screen ?
198171	What are some ways to flip my desktop screen ?
198172	How do I become like Balaji Vishwanathan ?
198173	What does it take to be like Balaji Vishwanathan ?
198174	After watching Castle , I'm compelled to watch similar series . What should I watch ?
198175	After watching Castle , I'm compelled to watch similar movies/TV series with the orgasmic romance it had . What should I watch guys ?
198176	What makes an Indian girl beautiful ?
198177	What makes an Indian girl more beautiful ?
198178	Who are some of the best programmers in India ?
198179	Who is the best programmer of India ?
198180	What is a CPU's main function and use ?
198181	What is the main function of a CPU ?
198182	Why are most gay men so feminine ?
198183	Is it legal to put works of art on T-shirts for personal use ?
198184	Is it legal to copy a shirt design for personal use ?
198185	What is your favourite part of history ?
198186	What is your favourite part of history and why ?
198187	How do you get better at writing song lyrics ?
198188	What are benefits of learning Android ?
198189	What are the benefits of learning android ?
198190	What are the great books to read before I die peacefully ? And how can I get updated with the new releases ?
198191	What are some great books to read before I can die peacefully ? And how can I get updated with new releases ?
198192	Is the Modern-Illuminati real ?
198193	Why do we see numbers or codes on the screen while watching TV ?
198194	What are those numbers appearing on tv ?
198195	How frequent should one shower ?
198196	How frequently should I shower ?
198197	What exactly is presence of mind ?
198198	What should an 18 year old know before going into the outside world ?
198199	What is the Drake equation ?
198200	What is the Drake equation ? Can anyone explain it to me the simplest way possible ?
198201	How is Yorkshire Tea made ?
198202	How do you make Yorkshire tea ?
198203	Is salicylic acid or benzoyl peroxide better to prevent cystic acne ?
198204	Is benzoyl peroxide or salicylic acid better to get rid of acne ?
198205	How do I decide on arrange marriage ?
198206	How do I decide who is the right life partner in an arranged marriage ?
198207	What are the top 10 addictive websites for you ?
198208	Why does Quora site named by that name ?
198209	Did Bill Clinton cheat on Hillary ? If so , how did Hillary deal with it ?
198210	How did Hillary Clinton react when she found out Bill cheated on her ?
198211	How do I start clothing line ?
198212	How can I start my own clothing line ?
198213	What are some of the most important things to factor in when deciding when to take a company public ?
198214	What are some of the most important things to factor in when deciding when to IPO ?
198215	Why doesn't india just close its embassy in Nepal and cut off all ties ?
198216	How can I download video from youtube ?
198217	Do we need more evidence to prove a multiverse ?
198218	What evidence is there for a multiverse ?
198219	What are common dreams ?
198220	What are the common dreams of human beings ?
198221	When were the first sewers built in Europe ?
198222	When was the first sewer built in Europe and how did people maintain them ?
198223	What would happen if president-elect Donald Trump were to suddenly die before being sworn in as president ? Who would then be sworn in ?
198224	If President Elect Donald Trump is assassinated before he is sworn in , will Mike Pence be sworn in instead ?
198225	Why is the national anthem played in theatres ?
198226	Why is the national anthem being played in theaters ?
198227	Are secret schizoids or covert schizoids introverts or extroverts ?
198228	Are secret schizoids or covert schizoids introverts or extroverts ? Can they be bipolar ?
198229	Why do some Chinese people hate Japan ?
198230	Why Chinese hate Japanese ?
198231	What is derivatives market ?
198232	What is derivatives market ? How it is trading ?
198233	What is the selection procedure for PGPM at Great Lakes Institute of Management ?
198234	What are the selection criteria for Great Lakes PGPM ?
198235	What does a dopamine reuptake inhibitor do ? How is it used ?
198236	How do dopamine reuptake inhibitors work ?
198237	For the next 24 hours , everyone on Earth will try to find you and murder you . You are given 30 min . headstart . What would you do ?
198238	How would you survive if , for the next 24 hours , everyone on Earth tried to hunt you down and kill you ?
198239	Is Donald Trump sexist ? Does he objectify women ?
198240	Can dictatorships be better than democracy ? Please name some advantages .
198241	In what ways dictatorship better than democracy ?
198242	What is the best series to watch after Breaking Bad ?
198243	What is a good series to watch after Breaking Bad ?
198244	What are the best Hollywood thriller movies ?
198245	Why do humans have different blood types and why can certain types not be mixed ?
198246	Why do humans have different blood types ? Why can certain types not be mixed ?
198247	I am 25 year old guy and never had a girlfriend . Is this weird ?
198248	How does it feel to be friends with a celebrities ?
198249	How does it feel to be friends of celebrities ?
198250	How do I become less horny ? (Male)
198251	I am a 22 years male . How do I become less horny ?
198252	Why do central banks exist ?
198253	Which is the biggest lie ever told ?
198254	Do I need an antivirus program for my Macintosh ? Why or why not ?
198255	Why don't Mac computers need an antivirus program ?
198256	Is it justifiable to boycott Pakistani artists from India ?
198257	Is it really good to send back the Pakistani artists from India ?
198258	Why are British eggs brown and American eggs white ?
198259	Why do American eggs have white shells and British ones have brownish shells ?
198260	What are the relationship between a state , nation and society ?
198261	What are the relationship between a state , nation and a society ?
198262	What is the size of the universe ?
198263	Why is the Universe the size of what it is ?
198264	What is the difference between multilevel and multinomial logistic regression ?
198265	What is the difference between multilevel and multiple logistic regression ?
198266	Why don't Indians watch Korean dramas ?
198267	Do Indians watch Korean dramas ?
198268	How long does it take to methamphetamine out of your blood ?
198269	How long does it take the body to get rid of methamphetamine ?
198270	What are the most complex indie video games ?
198271	What is the most technically ambitious video game made by a small indie company ?
198272	What can I do in London ?
198273	What should I do in London ?
198274	Is it possible to detect hidden cameras ?
198275	How do I raise funds for a cause ?
198276	What are the best career advice books you have ever read ?
198277	How does the US election system works ?
198278	How does the American election system work ?
198279	What is the best and most user-friendly software for building ebooks ?
198280	What is the best software for ebook creation in your opinion ?
198281	How should I prepare for SBI SO Assistant Manager System ?
198282	What and how to study for the post of assistant manager (system) in SBI ?
198283	How do I develop my English accent ?
198284	What's a good way to improve your English accent ?
198285	`` What is the difference between'' `` Electrical and Computer Engineering'''' and'' `` Computer Science and Engineering'''' ?''
198286	Why there is high and low current tripping for any pump ?
198287	Why there is a low and high current tripping for any pump ?
198288	What would be the best places to visit near Delhi on weekend ?
198289	What are the best places to visit near Delhi ?
198290	How do I find a saved wifi password in my phone ?
198291	How do I know the saved wifi password in my phone ?
198292	A famous saying is `` magnets , how do they work' . How do magnets work ?
198293	How do magnets work ?
198294	Why transformers are not characterized by power factor ?
198295	Why does power in transformer is represented without power factor ?
198296	Was Barack Obama aware that Hillary Clinton was using a private email server while she was Secretary of State ?
198297	Was Obama aware that Clinton had a private server ?
198298	How to initiate sex ?
198299	How do you feel about music ?
198300	What do you feel about music ?
198301	What is the best way to give a birthday surprise ?
198302	How do I give a birthday surprise ?
198303	Can a BBA student with maths and statistics as the subjects of the course apply for Indian forest services ?
198304	Can I apply for Indian Forest Service ?
198305	`` What does'' `` under the weather'''' mean ?''
198306	What is the origin of buoyant force ?
198307	What is the cause of buoyant force ?
198308	How is CGI as a company ?
198309	Is CGI good company ?
198310	How can I mute questions on Quora ?
198311	How do I mute a question ?
198312	What are some good horror stories ?
198313	Do we exist some place or in some form prior to birth ?
198314	What are people , before being born in this world?Do we exist before birth ?
198315	Why is the Protestant Reformation so important to world history ?
198316	How is the Protestant Reformation important to world history ?
198317	Is there any lack in the architecture of the Meenakshi Temple , Tamil Nadu . ?
198318	Is there any lack in the architecture of the Meenakshi Temple , Tamil Nadu ?
198319	How could I be a fashion designer ?
198320	What is the best Android phone out right now ?
198321	What is the best Android phone right now ?
198322	What are the best ways to study biology ?
198323	What is the best way to study for a biology test ?
198324	What thinking do you have about Chinese food ? Do you like it ?
198325	If Asian isn't a race , how can you be racist towards Asians ?
198326	How can you be racist against Asians ?
198327	What is the greatest mystery movie ?
198328	What does a women feel during sex ?
198329	What is the best treatment for rheumatoid arthritis ?
198330	Which is the best treatment for rheumatoid arthritis ?
198331	Can Donald Trump strengthen relations with Russia if he is elected ?
198332	If Trump is elected president will relations with Russia improve ?
198333	Why don't people like The Hobbit movies as much as the Lord of the Rings movies ?
198334	Why do people consider the Hobbit movies to be really bad ?
198335	Can I transfer funds from my bank account (SBI bank) to my friend's bank account (ICICI bank) through Green channel counter ?
198336	Can I transfer funds from my bank account (SBI bank) to my friend's bank account (ICICI bank) through net banking ?
198337	What are some unusual tips for weight loss that worked for you ?
198338	What do solopreneures struggle with most in starting a business and making progress ?
198339	What plagues you the most in your business as an entrepreneur or solopreneur ?
198340	Which is the best hospital in India for treatment of kidney disease ?
198341	Which are the nude beaches in Goa ?
198342	What is the cheapest way to ship Amazon books ?
198343	What is the cheapest way to ship books on Amazon ?
198344	What's the difference between a Maid of Honor and a Matron of Honor ?
198345	How is a Maid of Honor different from a Matron of Honor ?
198346	Can India survive an invasion by China ?
198347	Can India survive a Chinese Military Invasion ?
198348	Why was carbon-12 selected as the standard element for atomic mass ?
198349	Why carbon12 is selected for atomic weight ?
198350	What's it like to have your child commit suicide ?
198351	What are some of the best photos ?
198352	What percentage of brain capacity do humans use ?
198353	What is the technology stack behind Stack Overflow ?
198354	What is the technology behind Stack Overflow ?
198355	Why do I forget my dreams ?
198356	How can I improve my psychic abilities ?
198357	How do I hone my psychic abilities ?
198358	I have a RJ45 port cable provided by my ISP can any one suggest me a good wifi router compatible with it and with good range ?
198359	I have a RJ45 port provided by my ISP can any one suggest me a good wifi router compatible with it and with good range ?
198360	Does Donald Trump have any positive traits and/or qualifications ?
198361	What is the difference between successful people and unsuccessful people ?
198362	What are the differences between successful people and unsuccessful people ?
198363	Is soap harmful or not for our body and skin ?
198364	Is soap is good or harmful to our body ?
198365	What programming languages are used at Quora ?
198366	What are the programming languages used in Quora ?
198367	Is it healthy or effective to lose weight by starving yourself ?
198368	What Deve Gowda did for the country when he was prime minster of India ?
198369	What has Deve Gowda done as the PM of India ?
198370	What are the most noteworthy or useful capabilities of Amazon Echo ?
198371	What are the best uses of Amazon Echo ?
198372	How can I effectvely loss 20 kgs of excess weight from my body ?
198373	What is Quora most useful for ?
198374	Who is Daenerys likely to marry ?
198375	Who will Daenerys marry ?
198376	What does an investment banker do and how can I become one ?
198377	How do you build an inexpensive sound booth ?
198378	How do you build a soundproof booth ?
198379	What is subculture and what are some examples ?
198380	How do I , a novice programmer , become a good Java programmer ?
198381	Why are shallots different than onions ?
198382	How are shallots different from onions ?
198383	Why do people ask questions they already know the answers to ?
198384	Why do people ask questions that they know the answer to ?
198385	Where and how is data processed ?
198386	What is data processing ?
198387	What are the best poems on women you have come across ?
198388	What are some of the best poems that you have come across ?
198389	Is my computer safe from viruses ?
198390	how to keep your computer secure and safe from viruses ?
198391	How did god come into existence out of nothing ?
198392	How did God come into existence ?
198393	What are some of the rarest diseases ?
198394	What is the rarest disease in the world ?
198395	What are Page Authority and Domain Authority ?
198396	What is Domain Authority and Page Authority ?
198397	What are various blogs related to mobile apps that accept guest posts ?
198398	What are some conversations that can happen only in India ?
198399	What kind of conversations only happen in India ?
198400	What can a student buy and sell online for profit ?
198401	What is something that I can buy in bulk and sell online for a profit ?
198402	How are store bought Bacon Bits made ?
198403	What are bacon bits made out of ?
198404	Is it better to be single ?
198405	Is it better to be in a relationship or to be single ?
198406	How can one apply for an SSB ?
198407	How do I apply for an SSB ?
198408	What are the hottest IT startup companies in Mumbai ?
198409	What are the best IT companies in Mumbai ?
198410	What is the difference between tf-idf and Delta tf-idf from the formula ?
198411	What are the differences between TF-idf and Delta Tf-idf ?
198412	What did T.S. Eliot mean when he said that April is the cruelest month ?
198413	Why would April be the cruelest month ?
198414	Is there any difference between Pepsi and Coca-Cola ?
198415	What ` s the difference between Pepsi and Coca-Cola ?
198416	Is vegetarian good for health or non-vegetarian ?
198417	Which is good food for our health : vegetarian or non-vegetarian ?
198418	Which are the top five mobile application development companies in Dubai ?
198419	Which are the top five mobile payment development companies in Dubai ?
