370445	If an American woman wants to marry an Indian man from India , does that man still have to pay a dowry even if the woman's family won't take it ?
370446	If a woman does not seem to take interest in a man , can he fulfill his need to feel cared using ASMR videos and his sexual needs using porn , without ever needing an actual woman ?
370447	Which is the best classic 350 or 500 ?
370448	What are the best and worst things about public transit in Hangzhou ? How could it be improved ?
370449	What is the salary of the people working on the ISS ?
370450	How many people are aboard the ISS at a given time ?
370451	As a student how to get ni refund back ?
370452	Is it true that aliens built the earth , as well as put humans on it , as an experiment ? Did they ? Or not ?
370453	Do India have National Animal , Sport , Bird , Tree , and Language ? Are they according with the Constitution ?
370454	Which is best intermediate colleges in Hyderabad for IIT ?
370455	What can I do with a major in Biology and a minor in computer science ?
370456	Which is the most popular database language ?
370457	What is the remedy for Wisdom tooth pain ?
370458	What is it like to work in the finance team at Apple ?
370459	Is working at Apple fun ?
370460	How can I learn to use more posh words in daily life ?
370461	What skills would be useful to learn in life
370462	What are some examples of failed causal thinking ?
370463	What are some of the most common examples of confusing correlation and causality ?
370464	How often should I do calf raises ? Why ?
370465	What are calf raises and how do you do them ?
370466	Is hepatitis E curable ?
370467	Is hepatitis A curable ? How ?
370468	Which site provides us with various offers on fitness along with the booking of villa in Mauritius ?
370469	How much money and time would it take to become a doctor in india and how much in the US if an indian wants ?
370470	What are the features of a normal distribution ?
370471	Should I be a normal person ?
370472	What is the best parking option for a Golden State Warriors game at Oracle Arena ? What is the difference between VIP parking and valet ?
370473	What are the best seats for Warriors games at the Oracle Arena ?
370474	When was the last time you have felt loved ?
370475	When is the last time you felt like you were the happiest person in the world ?
370476	`` How true is it that ones height stops growing when you start off with weight lifting ? I'm around 5' 8'''' right now . I'm thinking of going to the gym . Is it advisable ?''
370477	I'm 15 and weigh around 130 pounds . When should I start to worry about my weight ? And when should I start to hit the gym and eat healthy ?
370478	What is a consecutive calendar day and how is it related with the Qin calendar ?
370479	Which is better ? Vim or gvim ?
370480	How can I see the score of LinkedIn placement test powered by HackerRank ?
370481	What happens if I erase my Hotmail account on Lollipop ? Will all my mail disappear even when I log in from the web ?
370482	What will happen with my Google apps account when change the DNS MX records on my domain ?
370483	If I want to become an astrophysicist and I want to start studying on my own , how do I start ?
370484	I want to learn astrophysics . Where should I start ?
370485	What did Franz Joseph Haydn contribute to the enlightenment ?
370486	Was Franz Joseph a good king for Hungary ?
370487	What are the U.K. Visa requirements for U.S. green card holders ?
370488	As a U.S. green card holder , would I be able to travel to and from Canada by land using just my green card ?
370489	What are the basic Questions asked for mechanical engineering placement ?
370490	What are the most important questions that are asked during a technical interview by core mechanical or automobile companies ?
370491	What is intelligence for ?
370492	Can women have hairs on chest and breasts ?
370493	How do you (if you do) remove your chest hair - waxing or hair cream ?
370494	How can I connect two Bluetooth headphones to a laptop/tablet ?
370495	How much does it cost to build an oil refinery and how long does it take to build one ?
370496	Why do profits of oil refineries drop when oil prices go high ?
370497	What is a function space in layman's terms ?
370498	How do you explain to your child that you are dying ?
370499	In addition to presenting at conferences and publishing in journals , how can researchers publicize or even promote their research ?
370500	How can I use a VPNBook on a Mac ?
370501	How do you set up VPNBook on a Mac ?
370502	How do you know if a guy is teasing you or just being rude ?
370503	How do you know if a girl is teasing you or insulting you ?
370504	How close are we to genetically engineering adult humans ?
370505	What are the documents to be submitted in medical colleges for admission to MBBS-UG under K-CET 2016 ?
370506	We put n balls in p discernable boxes . If balls are discernable , and every box can receive any number of balls , how do you find combinations if every box can receive only 1 ball at most ?
370507	How do I go from $ 0 to $ 1,000,000 ?
370508	How would you go from $ 0 to $ 1,000,000 ?
370509	Where is the best place to have sex in public ?
370510	In the U.S. , which is the most respectful term : cleaning lady , housekeeper or maid ?
370511	`` Is it'' `` a U.S company'''' or'' `` an U.S company ?''
370512	Can shockwaves stop humans ?
370513	What happens when an officer is involved in a shooting on a traffic stop ?
370514	Do online marketplaces of India like Flipkart , Snapdeal , Craftsvilla , Shimply.com etc. ship overseas ?
370515	FDI in Retail in India : How E-Commerce websites like flipkart , Myntra , Jabong , Snapdeal , Shimply earn as they sell other companies products ? Do they buy products directly from the company or other shops ?
370516	Where can you find the answers to Wiley Plus accounting homework ?
370517	How can I find the answers to accounting I-101 ?
370518	How do you stay positive in a negative company ?
370519	How do you stay positive in such a negative world ?
370520	How will be policing in 2050 ?
370521	Ramez Naam : How is the world in 2050 ?
370522	How do I survive the competition in online food ordering (middleman) business ?
370523	Are there laws against passive aggressive traps ?
370524	Has anyone ever produced a Hollywood movie to date with no character being dead in the movie ?
370525	If the stalemate in the Western Front continued in WWI , how long would each nation last ?
370526	Why does TCS hire so many freshers ?
370527	Does TCS recruit freshers ?
370528	What's Jimmy Wales' IQ ?
370529	Is Jimmy Wales arrogant ?
370530	What traffic laws in Greece are particularly hard for foreign drivers to get used to ?
370531	What do you think of the book of Revelations in the Holy Bible ?
370532	What is the Revelation book about in The Holy Bible ?
370533	Is there a free Tai Lopez 67 steps download link ?
370534	What makes Tai Lopez such a charismatic speaker ?
370535	What is the difference between equity and royalty ?
370536	A publisher has offered me 7.5 percent royalties for my book . The book is 100,000 words in length . Should I accept this offer ? Is it a fair deal ?
370537	16 year old male 5 foot 4 inches White . How tall will I be ?
370538	I am 15 years 5 months old boy . I just hit my puberty . I am 5 feet 4 inches tall . When will I hit my growth spurt ?
370539	My husband has erectile dysfunction , what do I do ?
370540	What is erectile dysfunction ?
370541	What are some ways to fall in love with yourself ?
370542	Which Is best broadband network in Jabalpur ?
370543	How do I fix my YouTube notifier to allow comments ?
370544	What does it feel like to be a sex addict ?
370545	What is it like to be married to a sex addict ?
370546	Are atheists really misunderstood by everyone ?
370547	Is the music business really as shady as it's been portrayed , or is it misunderstood by outsiders ?
370548	In a computer instruction format , the instruction length is 16 bits and the size of an address field is 4 bits . Is it possible to have : 15 3-address instructions , 256 2-address instructions , and 32 0-address instructions using the format ?
370549	In a computer instruction format , the instruction length is 11 bits and the size of an address field is 4 bits . Is it possible to have : 5 2-address instructions 45 1-address instructions 32 0-address instructions using the format ?
370550	How can you avoid feeling scared and paranoid of meeting new people when going to college ?
370551	Is Pokmon GO a good way to meet new people ?
370552	Is it an irony of Bengaluru that the people who come from other states are its biggest critics ?
370553	How often does Google upgrade its hardware infrastructure ? Does it need to closely follow the release cycle of new CPUs , GPUs , etc. . ?
370554	Will GPUs be displaced by CPUs with integrated graphics capabilities ?
370555	Which Hindi film had the best bloopers ?
370556	What is the cheapest way to transfer money from India to US ?
370557	Why is it not possible to obtain F2 by electrolysis of aqueous NaF , aqueous HF or anhydrous HF ?
370558	Why can't reactive metals such as Ti and Al be produced by aqueous electrolysis ?
370559	In ` The Scarlet Letter' , why was Chillingworth called a leech ?
370560	What is a series of books called ?
370561	What is the second-hand price which I should pay for an Alto LXI B4 2012 (white colored) model if it has run for 25,000 km ?
370562	Should I buy an e-bike or a second hand car ?
370563	What is entrepreneurial passion ?
370564	What is passion ?
370565	Where can find information on average salaries of marketing academics into different countries ?
370566	Where can find information on average annual salaries of marketing academics in different countries ?
370567	Does North Indian people think bad about South Indian people ?
370568	What do north indian boys think about south Indian girls ?
370569	How do I write a test scenario for a mobile ?
370570	Why use demand draft ?
370571	What is the difference between chalan and demand draft ?
370572	Why is electricity produced in the form of alternating current rather than direct current all over the world ?
370573	If I delete my WhatsApp account , will that cancel the delivery of all undelivered messages ?
370574	Why do naked mole rats live so long ?
370575	Why can't naked mole rats live as long as people ?
370576	What are some of the words in Hindi that can't be translated to English ?
370577	`` What do we call the Hindi word'' `` Sankoch'''' in English ?''
370578	Is there an Apple business email product that would allow user to delink an old phone number they no longer use with the product after device return ?
370579	How do you do dropshipping in Mxico ?
370580	How the dropshipment works ?
370581	How much force is require to a give a 50.0 kg body an acceleration that is half the acceleration due to gravity on earth ?
370582	When we take water to moon what happens ?
370583	How can I whiten my groin area ?
370584	Can Westeros and its neighboring continents have a modern future in perspective ?
370585	What are some reasons your car might die while driving ?
370586	Is it possible to scale up the mechanical movement in watches , including the escapement mechanism and the tourbillon ?
370587	Does a mechanical watch work differently in space ?
370588	Why does chicken reheated in a microwave smell terrible ?
370589	Why does pizza taste better when reheated in the oven rather than the microwave ?
370590	How does the average Russian citizen view and feel about the United States of America and its people ?
370591	Where can I get online test series and mocks for the GATE ? What are some tips to prepare for the exams ?
370592	Where can I get online test series and mocks for the GATE (mechanical) 2017 ? What are some tips to prepare for the exams ?
370593	Who are some lesser known important historical figures of Serbia and what should people know about them ?
370594	Has anyone ever gotten excited to do something but can't get themselves to actually do it ?
370595	What is Freud's explanation of love ?
370596	What is a foliated rock ?
370597	How do foliated and non-foliated rocks differ ?
370598	Do most restaurant owners hire tax accountants to do their taxes ?
370599	How do I derive the equation of infinitesimal mass of Robe's three-body problem ?
370600	How does the Law of Conservation of Mass apply to the human body ?
370601	A gentleman decided to distribute sweets to kids in his town . Out of the 612 children in his town , half of the girls and three fourth of the boys were present to take the sweets . The man distributed 12 sweets to each girl and 12 sweets to each boy . Determine the total sweets distributed by him ?
370602	What would you do if you had 10 seconds to live ?
370603	What is that one mistake of your life you always repent of ?
370604	What is the aristotelian physics ?
370605	If f (x) = (x ^ 2 + x +1) / (2x +7) and g (x) = (x ^ 2 + x +1) / (0x ^ 2 +2 x +7) , are they equal ?
370606	What is 2x +7 ?
370607	Why are so few muslim majority countries democratic and secular ?
370608	Are Muslims in both Muslim majority countries and western ones getting more and more secular ?
370609	How do you add a family member to your LA fitness membership ?
370610	Where can I get expert dust free floor sanding and polishing services in Bournemouth ?
370611	What is the equation for finding the volume of a box ?
370612	What is convertible currency ?
370613	Sarcastic comments regarding traffic problem ?
370614	What is it like to be a visual designer at Google ?
370615	What do visual designers do at google ?
370616	What are visceral reactions ?
370617	What's the difference to weed that is medical or weed that is recreational ?
370618	Did the paper doors and windows of ancient China become wet , soggy , and fall apart at the first sign of rain ?
370619	When we are traveling in a vehicle and it rains , we see that rain drops fall at an angle . If we travel at the speed of light , will it rain upside down ?
370620	Is there any app that can tell me about my carbon footprint or monitor it ?
370621	Why don't Indian politicians speak about campaign finance reform eventhough it is the most effective way to reduce corruption and `` PAYtoPLAY'' politics ?
370622	How do I improve my relationship with my girlfriend ?
370623	Ashlee Vance : Are you tired about hearing Elon Musk questions all the time ?
370624	What's the worst thing about Elon Musk ?
370625	From where should I buy things : Amazon or Flipkart ?
370626	From whom should I order , Flipkart or Amazon ?
370627	Is it really necessary to build Shivaji Maharaj monument in Mumbai mid sea ?
370628	What shall I do if my crush confessed to me ?
370629	How do I confess to my crush ?
370630	Why was the Clinton Foundation never mentioned during the DNC ?
370631	`` If Hillary Clinton did nothing wrong , why does the Clinton Foundation have to refile 5 years of tax returns after the book'' `` Clinton Cash'''' disclosed unreported donations ?''
370632	How is Game of Thrones different from traditional fantasy ?
370633	Is dy patil college of engineering of akurdi good ?
370634	Do the sufferings , struggles , pains , and the fate of the beings on this earth prove that God is good ?
370635	What is the reason behind the coconut breaking ritual in Hindu religion ?
370636	What are some mind-blowing facts about Indian Temples ?
370637	Is there such a thing as being mathematically inclined ?
370638	What does it take to be very good at math ?
370639	What is the difference between dissolution and wind up of company ?
370640	In Quidditch , what is the point of throwing the Quaffle through the hoops when you can just win by catching the golden snitch ?
370641	How do you play Muggle Quidditch ?
370642	How much and how often should you be drinking coffee ?
370643	Why are shortstops so often right-handed instead of left-handed ?
370644	By changing a left-handed person to right-handed , will there be change in their character ?
370645	What is urban culture music ?
370646	Why so many pianists and cellists in Croatia ? Is it a culture to learn music there ?
370647	How do you say anyway in French ?
370648	How do you say ` dumplings' in French ?
370649	What are the long term health effects of eating the cheapest chicken eggs ?
370650	Does Importing Yahoo mails on Google take size of Google Account ?
370651	How do I give self introduction through action ?
370652	Why is The Guardian comes across as Racist and Hinduphobic ?
370653	Why can't we eat the peel of a banana ?
370654	Is transistor a voltage controlled or a current controlled device ?
370655	Is it wrong to believe that Transistors (BJT) are current controlled ?
370656	Should I consume sperm for survival (say in dessert) if there were no other edible substances ? And how much energy does it provide ?
370657	In my Virtusa offer letter role mentioned as QA what does it mean ?
370658	How does Quora get so many users ?
370659	How do I ask a professor to take me as a PhD student after introductory talk ?
370660	Can I take LOR from a PHD student ?
370661	Should we encourage premarital sex ?
370662	What are computer algorithms ?
370663	Why are men so much better than women in a fight ?
370664	Why can't most men tolerate women who are better than them (better in terms of career and education) ?
370665	What college options are there with 83 percentile in CAT ?
370666	What colleges should I apply to with 83.91 % ile in cat ?
370667	If we combined communism and capitalism , would that possibly hurt or aid America ?
370668	Which system works better in a country , capitalism or communism ? Why ?
370669	Where could I get a piece of dielectric material ? What could I buy to scavange for it ?
370670	According to the Bible , is deception in warfare allowed ?
370671	What are some home remedies to get rid of ringworm scars ?
370672	What is the best video editor ?
370673	What kind of startup could challenge the Boeing-Airbus monopoly ?
370674	Can the Airbus-Boeing duopoly ever be broken ?
370675	What's life like after leaving a company like Google mid-career ? How does it feel to not have golden handcuffs ? Do you regret it ?
370676	What do you think on Andhra CM's decision of rewarding INR 100 crore to anyone from Andhra who wins Nobel prize ?
370677	What do you think of Andhra Pradesh Government's Rs . 40,000 crores of farm loan waivers ?
370678	What is the cost of 1 Mbps internet speed in the USA ?
370679	What is subjective and objective evaluation ?
370680	Why are not using star - delta connections below 5hp ?
370681	What's a star/delta starter ?
370682	What can I teach someone in the next 10 minutes that will be useful for the rest of his/her life ?
370683	As a Biology student , what can I learn right now in just 10 minutes that could be useful for the rest of my life ?
370684	What is the importance of education to the United States and how are their views of education different from Germany's ?
370685	Does converting my credit card transactions into EMIs make any negative impact ?
370686	Citibank says they cant rewrite or convert my credit card debt into EMIs . Is this their policy ?
370687	Why is the frictional force considered to be a centripetal force ?
370688	What's the difference between six-speed automatic and CVT ?
370689	What is cvt tuning ?
370690	As a tourist , should I rent a car in india ?
370691	How do I set up a remittance transfer business in US ?
370692	How do I set up a remittance transfer business ?
370693	What are the benefits of being a limited liability company ?
370694	Should I consume cod liver oil supplements without doctor's prescription ? I read it's a lot healthy .
370695	What is the difference between voltage and current in details ?
370696	How does A36 mild steel and SS400 differ ?
370697	What is the value of the modulus of elasticity of mild steel ?
370698	Can you feel sad after sex ?
370699	Can cats eat corn ? If so , what benefits does it provide ?
370700	Can cats eat nuts ? If so , what benefits does it provide ?
370701	What is excitation system ?
370702	Has the 26 week maternity leave in India come into effect ?
370703	Should I take a job filling in for maternity leave ?
370704	What do Pakistan think of Indian education system ?
370705	What do you all think of the Indian education system ? And what reforms should be made to rectify it ?
370706	How is Gahan MG , the international level chess player as a person , in personal life ?
370707	Is their any medicine for lactose intolerance in babies available in India ?
370708	Will a master degree in MPH increase my chance to get in a MedSchool ?
370709	Should I pursue a degree in a foreign country to increase my chance of getting selected for a highly payed job , or an Indian degree for a better education ?
370710	What is the best way to clear an overgrown garden with mostly grass and weeds without using chemicals ?
370711	How do I make my garden grass denser ?
370712	If he's over me then why does he send me random messages and pictures ?
370713	How do I stop random companies from sending me automated SMS text messages ?
370714	What is alcohol USP TOP ?
370715	Technology : What all things can be done with WhatsApp API ?
370716	How do I write a web service in PHP with a SOAP API for an Android application ?
370717	If I was to deactivate my Instagram what would happen to my direct messages ?
370718	Will others see my direct message to someone in Instagram ?
370719	What song is this ? Who is the singer ?
370720	Is it okay to masturbate while sick ?
370721	Is it bad for health and studies to masturbate 3 or 4 times a day ?
370722	How can I prepare for the UPSC on my own ?
370723	Ethanol comes from sugar . The fermentation process means part of sugar's energy has been consumed . Then why is ethanol flammable and sugar is not ?
370724	What should a girl do when she is preparing for JEE and she is crazy about IIT but her family is not supporting her ?
370725	What nationality has the healthiest traditional dishes ?
370726	Which are the best screen guards and cases for Honor 4X ?
370727	Is it necessary to use a screen guard for MacBook Pro ?
370728	What should I be expecting for my first day of work at Google ?
370729	How many days will it take to move to the first page on a Google search ?
370730	What is automation test framework ?
370731	Why is Israel denying access to their Place of Worship (Al Aqsa Mosque) for Palestinians ?
370732	Why are the Israeli Security Forces stopping worshipers from praying at Al Aqsa mosque to allow the entry of Jews to the Temple Mount ?
370733	What freedom does America have ?
370734	What is freedom ?
370735	Who do you hate on Quora and why ?
370736	What are some samples of good goodbye speeches for my boss ?
370737	What are some samples of good goodbye speeches for work ?
370738	Will I get teased in the locker room because I don't wear boxers ?
370739	What should I do if I don't get science in 11th grade ?
370740	What is a moral right ?
370741	Is abortion morally right ?
370742	Medical Research : CFDA , 510K , CE test means what ?
370743	Does an American software company need to charge VAT for goods / service rendered to a VAT registered company in EU ?
370744	As a US company buying services from the UK , do you have to pay VAT ?
370745	What is the difference between centripetal and centrifugal force ?
370746	What are the principles of marketing ?
370747	What is the current rate of return on the Systematic Investment Plan (SIP) in India ?
370748	How does NAV value affect a systematic investment plan ?
370749	How should one obtain a perfect 6/6 vision ?
370750	South Africans , on average , How much money do you spend on reading books per month or year ?
370751	Can I see a dm after I've deleted it on Instagram ?
370752	How do I get men to see me as more than a sex object ?
370753	How should I propose to a girl if she is more superior than me as a programmer ?
370754	Can you provide a clear example of a provisional patent filing ?
370755	What is Wired today like when compared to the original vision for it at founding ?
370756	Do sheep care if one of the flocks dies or disappears ?
370757	I want my body to need only 5-6 hours of sleep . Is it possible for me to change my body system ?
370758	If I changed my sleep from 7 hours to 6 , what will happen to me ?
370759	How do I print out business cards in Photoshop ?
370760	What is the best website to get you business cards printed in Florida ?
370761	How long after stopping smoking can you be called a non-smoker ?
370762	What is the best iPhone/Android game to play during cigarette cravings after stop smoking ?
370763	Why do people speak in dream ?
370764	Why do some people speak and cry in their dreams ?
370765	`` What is the best example of a person who'' `` rose from ashes'''' ?''
370766	Are there any people in their 20's who feel like they're stuck and need some guidance in their life ?
370767	How did Allegiant (2016 movie) get greenlit ? What's the backstory of how the movie got made ?
370768	Which is the best nationalised bank In India ?
370769	Who nationalises banks in India ?
370770	How can you create invoice and shipment automatically in Magento 2 ?
370771	How do I install Magento extension in 2.1.2 ?
370772	Are car accidents more common among high school students or college students ?
370773	Were carriage accidents more or less common than car accidents are today ?
370774	What is the goal of living ?
370775	Can I download Creative Commons licensed YouTube videos to edit them and use them ?
370776	Is there any benefit to use Creative Commons license on YouTube ?
370777	Which one of the numbers does not belong in the following series ? 2 - 3 - 6 - 7 - 8 - 14 - 15 -- 30
370778	Could you analyze this list of numbers :1 -6 -1 -8 -0 -3 -3 - (number is obscured appears to be a 9) -8 -8 -7 -4 -9 -8 -9 -14 -11 -9 -4 ?
370779	How should i study in classes 11th and 12th and what should i focus on ?
