486000	Is 18 cm a normal penis size for a 20 year old guy ?
486001	WhatsApp : I am not getting blue tick marks for only one contact in my WhatsApp . What's the reason ?
486002	I've sent a message to my friend through WhatsApp a day ago and recently I saw her online but I still didn't get the blue ticks . What could be the reason ?
486003	Why do Russian and Ukrainian women love Arabs so much ?
486004	How is Amazon able to send me an item from Las Vegas to San Francisco in a few hours when it stores millions of items in warehouses around the globe ?
486005	Marketing strategy of a service courier company ?
486006	What do women think of men who are nerds or geeks ?
486007	Do all men secretly think women are useless ?
486008	Does pasta freeze well ?
486009	How is Arby's roast beef prepared so that it does not resemble roast beef available at a delicatessen ?
486010	How do you cook a beef roast ?
486011	Why did Oswald kill JFK ?
486012	What do you think about XFlow CFD program ?
486013	How can you track deleted Facebook messages ?
486014	Did Michael Jackson smoke ?
486015	How can I have a chance to act in a TV advertisement ?
486016	What is cost of TV advertising on Travel Channel ?
486017	Why is education important to Jews ?
486018	Why are so many people fascinated with nonsense ?
486019	Is 15 mbps considered fast internet ?
486020	What are the best things to do in Singapore as a family ?
486021	What are some interesting things to do in Singapore ?
486022	What is the function of a centrifugal governor and its application ?
486023	How is a centrifugal pump assembled ?
486024	Is knowledge of numerical methods and knowledge of complex numbers required for the Physics Aptitude Test for Oxford University ?
486025	Is knowledge of statistics needed for the Physics Aptitude Test for Oxford University ?
486026	Which are real website where I can make money online ?
486027	How can I maintain friendship with my competitors ?
486028	How would Harley Quinn be as a girlfriend ?
486029	I love a girl and she is a Rajput ?
486030	To the Masons and Shriners , is knowledge without power paradoxical ?
486031	What are the duties and responsibilities of a Member of Parliament (MP) in India ?
486032	Is Arvind Kejriwal a member of Parliament ?
486033	What is your favorite month of the year in America ?
486034	Where can I find a good slider for a time lapse in India ?
486035	Is there any way I can shoot a time lapse with a Nikon D3200 ?
486036	Which is the best Kindle to buy ?
486037	Which Kindle is the best ?
486038	What its like to be high functioning ?
486039	What does it feel like to have high functioning anxiety ?
486040	Which is more addictive : Facebook or Quora ?
486041	`` I am new to the Indian culture as I just started'' `` dating'''' an Indian , I just trying to learn about the culture , I guess my question would be is there anything that I should be aware of ?''
486042	Why is media silent about the Qnet scam ?
486043	When will India start exporting Nuclear Reactors ?
486044	What is the temporal bone's projection ?
486045	Can I become a cricketer if I start at the age of 17 ?
486046	Do people on Quora share more using their real name because they are accorded the choice to become anonymous later ?
486047	What is the best way to balance an ethane combustion reaction ?
486048	Is there any Batman comics about Alfred's youth ?
486049	What are good colleges for MBA or PGDM in India apart from the IIMs ?
486050	What are some experiences at the Infosys Mysore campus ?
486051	What is the dress code for 2015 trainees at Infosys Mysore campus ?
486052	How could you lose 10lbs in 2 days in a healthy way ?
486053	How much weight can you realistically lose in 2 days ?
486054	Why does Rahul Gandhi lack common sense ?
486055	Industrial Revolution : What was the first application of the steam engine ?
486056	Which deodorant is best for men ?
486057	Wonderlandads : When I connect to my home Wi-Fi with any of my devices , it automatically redirects to wonderlandads.com . How can I stop it ?
486058	Will Australia's culture be negatively affected from the increase of people from non-English speaking countries moving to Australia ?
486059	What are the main things that people from the U.S. notice when they move to Australia ?
486060	Why do Virender Sehwag fans hate M.S. Dhoni ?
486061	Can I upgrade from intel i3 to i5 processor ?
486062	Which company has a better work-life balance than Robert Bosch India ?
486063	How is Robert Bosch's company in Bangalore , India ?
486064	Why some highly developed european country could not build nuclear bomb but pakistan did ?
486065	Why doesn't anybody dispute whether China , India , Pakistan etc. could start a nuclear war ?
486066	What does ` petit-père' mean ?
486067	How much money a person can make in India if he puts one hectare of land for dairy ?
486068	What is the typical day during the training period of a selected candidate in engineering services (mechanical) in Ordnance or CPWD ?
486069	`` What does'' `` candela'''' mean in Spanish ? Does it have more than one meaning ?''
486070	`` In Spanish , what is the meaning of the word'' `` fecha'''' ?''
486071	How do I find the equation of parabola when vertex and focus are given ?
486072	What is FRTB (fundamental review of trading book) & how will it impact risk management in investment banks ?
486073	Investment banking : What are book-running managers ?
486074	Which are the most interesting facts associated with the human subconscious mind ?
486075	How can I get the maximum benefit from a subconscious mind ?
486076	What if the candidate switched her name after getting married ?
486077	If a girl changes her last name after the wedding , what else does she have to change ?
486078	What is the average life expectancy of a transgender person ?
486079	What makes silk sarees so sought after ?
486080	When a police officer pulls you over and you drive into your own driveway , what will the police do ?
486081	Is object oriented programming worth in power systems ?
486082	What is the role of RBI in demonetisation ?
486083	How do you accept that you have changed and it may not be possible to revert to the person you once were ?
486084	How do I (adportal.Shoppingnu.com) promote my website on Google Search ?
486085	What are the best songs to sing for your sister on her birthday ?
486086	What is the difference between pitch and tar ?
486087	What are the best React.js repositories that follow best practices and are good to learn from ?
486088	Is it possible for people with antisocial personality disorder to fall in love deeply ?
486089	Is it possible to love some with borderline personality disorder ?
486090	What will happen if I add camphor and water to an emptied good night bottle and plug it in ?
486091	What will happen if I reuse packaged drinking water bottles for long time ?
486092	What traffic laws in Belarus are particularly hard for foreign drivers to get used to ?
486093	Is it advisable to enter Canada for 1 and half month after 4 months USA stay and re enter USA (B1-B2 visa) for a new 6 month visitor stamp . ?
486094	What are the characteristics of bugs that are not found by software testing ?
486095	What's the easiest way to make $ 3,000 in a week ?
486096	What is the easiest way to make $ 10/day ?
486097	I've read that movies like the Wizard of Oz and Alice in Wonderland are being used to program our brain . How do we get out ?
486098	What does The Wizard of Oz look like ?
486099	Is having 2 days period normal ?
486100	Is there an investment management platform for private equity as Addepar is for hedge funds ?
486101	Can hedge funds invest in private companies ?
486102	Is JIO 4G have good network (range) in all over Nasik ?
486103	What technology Jio used to provide 4G network all over India ?
486104	How are blind people treated in India ?
486105	Do you think there is a relation between Raghuram Rajan leaving RBI and the demonetisation move by the Modi government ?
486106	How do you make black food coloring ?
486107	What are the greatest comebacks in your career ?
486108	What are some of the greatest comebacks in academics ?
486109	Should there be an 1980s music revival for the 2020s ?
486110	Do you hate your ex and if yes then why ?
486111	Will you always hate your ex ?
486112	Which Linux distribution is most suitable for data science/big data beginners and enthusiasts ?
486113	How do I install a Linux distro on a MacBook Air ?
486114	What is the difference between tube and pipe ?
486115	What is the difference between a PP pipe and a PP fiber ?
486116	How does Spotify determine a users' top artists ?
486117	`` How does Spotify determine an Artist's'' `` Top Tracks'''' ?''
486118	Differentiate between ALTER table and Drop Table Command . What is the impact of both of these commands on table , with examples ?
486119	What are some real world examples of 3 table joins in SQL ?
486120	What is the best way to learn Linux and Shell scripting for a beginner ?
486121	Who are the most beautiful female athletes ?
486122	If a girl dates someone else after breaking up with you and then wants to get back together 6 months later , does it lessen the value of your initial relationship (3 years) ?
486123	How do I get over my fear of talking to girls in real life , after my break up (2 years back) ?
486124	Is it better to wash your hair without shampoo ?
486125	What is C in C Programming language ?
486126	Which is best inverter air conditioner in india ?
486127	Do employees at Saga Communications have a good work-life balance ? Does this differ across positions and departments ?
486128	What is the National Guard ?
486129	Why do mosquitoes revel in darkness more than light to irritate us while we are sleeping ?
486130	Is sleep more important than food ?
486131	Which iit don't have proxy limits ?
486132	Which IITS have proxy limits ?
486133	Are scorpios funny ?
486134	How do Scorpio men show love ?
486135	What types of food do Chinese eat that people from other parts of the world find disgusting ?
486136	What is the messiest food in the world to eat ?
486137	How do I transfer money from one ATM to another account in ICICI ?
486138	What is solutions engineer at intel ?
486139	What can US$ 1 buy around the world ?
486140	Would you ever date a guy or girl with crooked teeth ?
486141	Do hot girls ever date a decent and average looking guy ?
486142	Where do I meet girls in Pune ?
486143	Where do I meet girls in mumbai ?
486144	What is direct mail listing ?
486145	What is a direct mail list broker ?
486146	How likely is it that a person who has smoked cigarettes for 50 years will get cancer ?
486147	What are the strongest majors in terms of job prospects and what are the weakest majors at Princeton ?
486148	`` What does'' `` query expressiveness'''' mean ?''
486149	What's wrong with MySQL query ?
486150	What are the Internet speeds at the various IITs ?
486151	How is the internet speed in iit Delhi ?
486152	What do I need to create a game like Clash Of Kings ? Can I buy a starter kit ?
486153	Does anyone play the game Clash of Kings ? How many is the needed pikemen to stop Calvary ?
486154	If all perceptions aren't equal , by what means is the value of each perception determined ?
486155	Why are school supply lists so long ?
486156	What is the chemical name for diamonds ?
486157	What is Kink 420 ?
486158	Where did the name of 420 for weed day come from ?
486159	What's your favorite advertisement ?
486160	What are some of your favorite advertisement photos ?
486161	What are Daemon tools used for ?
486162	What are Daemon Tools ?
486163	What is the TIME CAT coaching fee structure for 6 months ?
486164	How do I buy a car for my parents in India ?
486165	Which car should I buy for my parents in India ?
486166	Where can I get best roof painting service in Sydney ?
486167	Why isn't the earth and the other matter inside the earth atmosphere is blown away because of the higher pressure inside the atmosphere and the vacuum in outer space ?
486168	How is The Price is Right able to afford all the prizes they give away ?
486169	How good and valid is MBA in Biotechnology Management from IGNOU ?
486170	What are some good online singing courses ?
486171	Where can I find a good basic cooking course online ?
486172	Which PSU is the best in India for an electrical engineer ? Why ?
486173	Which is best core company for an undergraduate electrical engineer in india in terms of pay , work environment etc. . ?
486174	What is the corporate culture like at Targa Resources ? How is the culture different than other companies ?
486175	What do guys think about girls who flirt ?
486176	What do girls/boys think of guys who flirt ?
486177	Do you hate your job ?
486178	What were the top 10 military powers in 1914 ?
486179	If there is a rank of top powerful military countries of the world , what will be the ranking table look like ?
486180	What cell parts are only found in plant cells ?
486181	How can I tell if a man loves me ? How can I tell if I should move on ?
486182	What universities does iRobot recruit new grads from ? What majors are they looking for ?
486183	What is Intel XDK ?
486184	What Bollywood actor/actress do you like the most ? Why ?
486185	What are the benefit of applying coconut oil on face ?
486186	Will I go to hell if I wear this shirt that has all this sign on it ?
486187	Will I go to hell if I wear this tee shirt ?
486188	Is it a good thing to tell a guy your true feelings for him or can he use this against you and end up hurting you ?
486189	`` Have Neil Young's songs ever been used in a TV commercial , or was he true to his song ,'' `` This Bud's For You'''' and refused to let it happen ?''
486190	What online dating site is best for no-strings-attached sex hookups with hot girls ?
486191	As a girl , what do you expect to receive in an online dating site message from a guy ?
486192	SCS : What would happen to the appointment of arbitrators made by the President ITLOS if China did not approve it ?
486193	What are common jobs for people with pure mathematics degrees (e.g. a B.S. in Mathematics) ?
486194	What jobs can one get with a degree in probability (mathematics) ?
486195	What are the best Lavani songs in Marathi ?
486196	Was The Hobbit written before The Lord of the Rings ? If so , should it be read before TLotR ?
486197	How do Scientologists feel about the South Park episode on the Church of Scientology ?
486198	What are some good South Park episodes with Randy Marsh as a major character ?
486199	What do women buy the most ?
486200	Would Pakistani women buy undergarments online ?
486201	How many dead KTs are allowed for placements ?
486202	How is the Indian cricket team selected ? Is there any particular procedure ?
486203	What's it like being religious on Quora ?
486204	Adobe Illustrator : How can I export the JPG or PNG of the object I selected not contain all objects in the artboard ?
486205	How can I export the JPG image of an object I selected not all the artboard in Illustrator ?
486206	Do you think the stories Usamah b. Munqidh told are true ? Why or why not . ?
486207	How long does it take to create a website ?
486208	How long does it take to build a social website ?
486209	What are the best job boards for MBA ?
486210	How can I tell the girl I'm dating about my last relationship ? Details *** and update in comments
486211	If you could go back in time , what would you tell your college self about dating and relationships ?
486212	How is the equation for flow speed determined ?
486213	How do I solve the equation [math] 4 ^ {2x-2} = 9 ^ {x +3} ? [/ math]
486214	Why do people write about problems on Quora but do not write an email or letter to the Prime Minister's office about it ?
486215	How are driving conditions towards club mahindra binsar Valley ?
486216	Is it necessary to take a regular shower after taking a bath ?
486217	What does it mean when soldiers say ` actual' in a radio conversation ?
486218	Do soldiers in the Army National Guard say they are in the Army ?
486219	I have -0.5 cyl power but lenskart has sent me specs with cyl power -0.75 , should I keep usng it or should I get replaced (askng bcoz of tme issues) ?
486220	Is a 12 year old socially fit for 5th grade ?
486221	Am I too old for graduate school ?
486222	I'm 53 . Do men think I am too old to date ?
486223	If Schindler's List was made in Bollywood , which stars would be cast ?
486224	Difference between 1099 and w2 ?
486225	What is it called when we change our behavior according to whom we are with ?
486226	What kind of spider is this (Midwest US) ?
486227	Why does the video stutter when there is a fast moving action scene on the screen ?
486228	What is the purpose of small green screens in the background of a scene with VFX ?
486229	Is there a way to put all iPhone photos in iCloud without taking iPhone storage space ?
486230	Can I get call letter ?
486231	What should I do if I don't get call letter ?
486232	What are the practical applications of the photo electric effects ?
486233	How do I make a proper routine to crack IBPS so i.t officer in 2 months ?
486234	What is a good inpatient drug and alcohol rehab center near Dallas County AL ?
486235	If I want to become a music composer , what should I learn in school ?
486236	Why do people say that love is stupid ?
486237	Why do people say unrequited love isn't real love ?
486238	`` What is the exact meaning of'' `` your time is limited so don't waste it living someone else life'''' by Steve jobs ?''
486239	I am attending university at age 30 , dead end job , poor , never had a girlfriend , spending all my free time on studying for school . Am I wasting life ?
486240	Is a credit union bank better then bank of America ?
486241	How do I get the vocals of a song to make a remix ?
486242	How do you create a dance remix of a song ?
486243	What do people do with social media when they get sent flashing messages that can cause grand mal seizures ?
486244	A reacts with socl2 and give propan1ol?find what is A ?
486245	If , in the aftermath of a terror bombing , you could save a dying innocent or save a dying attacker for questioning , which would you save ?
486246	Why everything keeps spinnig in space ?
486247	How do I apply OBC non creamy layer for SSC CGL exam ? Also when do I get this certificate and let me know validity of OBC certificate ?
486248	`` What is the meaning of'' `` weeping'''' in distillation ?''
486249	What does the term ` flooding in a distillation column' mean ?
486250	Is it a fact that from 2017 onwards , DU is going to conduct only entrance exams for all of its UG admissions ?
486251	Is it a fact that from 2016 onwards Du is going to conduct entrance exams for its UG admissions ?
486252	Where can we get details about how rich is ken block ?
486253	How many people died in the earthquake in Spain on May 11 2011 ?
486254	Are there any living organisms that don't excrete waste ?
486255	If plants don't have organs what's the way they live ?
486256	What are the best lesbian movies on Netflix Instant ?
486257	What is the best device on which to watch Netflix movies ?
486258	I've been sleeping on the PILLO1 cervical pillow for a while and it has worked wonders for me . Has anyone else reduced their neck pain or gotten better sleep with this pillow ?
486259	Should I use a pillow when I sleep on my back ?
486260	What is the difference between phone storage and internal memory in a smartphone ?
486261	How do I bowl fast with a tennis ball ?
486262	How high did the bowling ball go , in Flubber ?
486263	What Should I Gift My Dad Under A Budget Of 30,000 To 32,000 Rs ?
486264	What kind of business would I realistically be able to start that would help a lot of people , with a $ 5,000 - $ 10,000 + budget (my own money) ?
486265	What is the importance of education to the United States and how are their views of education different from Singapore's ?
486266	Is it possible to use Google drive to upload pics directly to Picasa web ?
486267	How can I delete my pics from Google drive ?
486268	I really like this guy and I don't know if he likes me . How do I know if he likes me , so that I can tell him I like him ?
486269	I really like a younger guy . I know him through his work and we are both quite shy . We laugh and flirt a lot together . How do I know if he likes me ?
486270	What are the top ten tips you would give to a complete beginner of poker ?
486271	Who says a army man kiling a man of his country is murder but killing of other country's soilder is noble work ?
486272	Why does my penis hurt a lot sometimes after I pee ?
486273	Why do I pee a lot when I drink a lot of alcohol ?
486274	Which part of the brain is the reactive part of the brain ?
486275	Why is cellular respiration called cellular respiration if cells don't breathe ?
486276	What are the all-time best complete love story movies in Telugu (Tollywood) ?
486277	Which are the best movies based on love stories ?
486278	What are some of the most interesting experiments conducted or being conducted by NASA ?
486279	What are the advantages and disadvantages of being a member of the UN ?
486280	What does it take to be a member of the UN ?
486281	What should I choose : BITS Pilani CS or IIT KGP CS ?
486282	How is Mechanical engineering in BITS Pilani compared to IIT-B , IIT-K , IIT-KGP ?
486283	What is a list of unexplained archaeological finds ?
486284	What is the most interesting subject one can study in CSE (like I don't have interest in coding) ?
486285	What is the logic behind logic gates ?
486286	Which Indian city is truly cosmopolitan for women ?
486287	Which Indian city is truly cosmopolitan ? Why ?
486288	How many protons are in sulfur 36 ?
486289	How many protons does sulfur have ?
486290	What are some myths which are myths ?
486291	What is the MYTH you hope wasn't a MYTH ?
486292	If Tamilians can learn English happily , why are they disinclined to learn Hindi ?
486293	What is full transaction right and limited transaction right in net banking ?
486294	What is the charge for full transaction rights SBI accounts ?
486295	What happens to your body when you fast ?
486296	How 2017 Budget is going to affect mutual fund market in India ?
486297	How do rabies in mice form ?
486298	Can fasting cause stomach ulcers ?
486299	Who are some good writers on instagram ?
486300	Who is the best writer for you ?
486301	What are the 4 P's of marketing in the case of Reliance Jio ?
486302	What are some famous Reliance Jio jokes ?
486303	What are some decoder applications ?
486304	What are the applications of decoders ?
486305	Can airliners and planes land in smog ?
486306	What are some good things to add to a bath besides epsom salt ?
486307	What does it feel like to take an Epsom Salt bath ?
486308	What is Jason Day's training regime ?
486309	What are some good tools for collaboration on web product development ?
486310	How do I get back on WhatsApp groups when I'm the one who created the group ?
486311	Who are the Top 10 personalities according to you in the world ?
486312	Which are the top 10 personalities in the world ?
486313	How did Indeed avoid litigation/blocking of its crawlers from competing sites ?
486314	If a site were to compete directly with Google , could Google block the site from its search ?
486315	Is a shell the same as an orbit ?
486316	Who is the most famous personality from when humans evolved to till now ?
486317	What are some neat , smart , confident and outgoing girl rules ?
486318	Are the girls more attracted to confidence or the look of a guy ?
486319	How is yogurt made ?
486320	What is yogurt made of ?
486321	What sales skills sets translate successfully from one industry to another ?
486322	As a . NET desktop application developer , what coding-specific skill set should one have to be successful ?
486323	What is the difference between Спасибо and благодаря ?
486324	When did Andhra bank and canara bank conducts PO and clerk exams ?
486325	What is the oldest known star cluster and what is know about it ?
486326	Are you able to think yourself into a mental disorder ?
486327	Who are the top gay VC in Bay Area , California other than Peter Thiel ?
486328	Can RealD glasses do anything on a normal LCD monitor ?
486329	Why are the Fallout 4 reviews so bad ?
486330	What are some unsolved mysteries of WW2 ?
486331	How much muscle will I lose if I lift once a week as opposed to every 2 days ?
486332	How do I face my ex girlfriend if I have to see her and talk to her a day every week ?
486333	How do I overcome fear when you have lost it because of few incidents ?
486334	If Mars was replaced by Venus , would Venus be habitable ?
486335	If I'm shortsighted , is it a good idea to wear glasses even when looking at close objects or reading ?
486336	Can someone have glasses and be good-looking ?
486337	Can international students join the US Army and get a green card (F1 visa) ?
486338	What are the requirements to be considered for the United States Air Force and how do these requirements compare to China's ?
486339	Why are there no white Third World Countries ?
486340	Is there any mobile camera that has background blurring feature ?
486341	Who is the CEO of Tolethelp.com ?
486342	How do I get an air hostess job ?
486343	Why do we lean forward while climbing a hill ?
486344	Why do we lean forward while climbing up a hill ?
486345	Who is the best deep house DJ in South Africa ?
486346	What is the best way to fund/acquire a petrol station in South Africa ?
486347	What is the difference between TCP's FIN and RST packets ?
486348	What is the formal protocol to be followed if all of our satellite networks were suddenly destroyed ? What would the aftermath of such an event be ?
486349	How can you tell if a private investigator is any good before you hire him or her ?
486350	Where do I get Anthropology Brain tree notes in Bangalore ?
486351	Why did Luke have to face Darth Vader to become a Jedi ?
486352	Who would win Thor or Godzillia ?
486353	Is Thor stronger than Hulk ?
