test-19681	Do British people feel guilty for what they had done to India?
test-19682	Who will win the Euro cup 2016 football tournament?
test-19683	Who is going to win Euro 2016?
test-19684	Will Narendra Modi answer my letter?
test-19685	How can I get a letter from Narendra Modi conveying his best wishes for my college magazine?
test-19686	What are good social media websites?
test-19687	What is a good social media, website idea?
test-19688	How do I access Marianas web?
test-19689	What is the Marianas web?
test-19690	How do you port forwarding without router?
test-19691	What are the implications and useful uses of setting up port forwarding on your repeater instead of your router?
test-19692	If a+bj is a complex number denoted by z, where a and b are integers. If b is equal to zero z gives a real number, does it mean the set of real numbers is a subset of the set of complex numbers?
test-19693	How do I prove that the set of real numbers is a subset of the set of complex numbers?
test-19694	What are some things new employees should know going into their first day at Team?
test-19695	What are some things new employees should know going into their first day at Telenav?
test-19696	Which is more important, learning or grades?
test-19697	Which is more important: education or learning?
test-19698	What is the difference between UMTS and LTE?
test-19699	"Why Airtel uses term ""4G"" and Jio uses term ""LTE"" for the same service? Is there any difference?"
test-19700	I am a student studying electrical engineering and software development what laptop should I buy?
test-19701	I'm studying electrical engineering. Which laptop should I buy?
test-19702	How do I to seduce a girl?
test-19703	What is the best way to impress a girl?
test-19704	How can you get hacked on kik?
test-19705	How can a person hack into a Kik account?
test-19706	What are the qualities of an ideal wife?
test-19707	What qualities does one look for in a good wife?
test-19708	Can any one tell me best trance music?
test-19709	Why is communism portrayed negatively in media while capitalism isn't?
test-19710	Why do I have a sweet tasting discharge?
test-19711	"How do you break from the ""follower"" mindset to become a leader?"
test-19712	What are the advantages and disadvantages of consumerism?
test-19713	Will consumerism slow down in the near future?
test-19714	How do I download pulp fiction movie in dual audio?
test-19715	What is the significance of The Gimp in the movie Pulp Fiction?
test-19716	How can I lose weight in no time?
test-19717	How can I lose weight quickly for my theater role?
test-19718	Did any other country land a person on the moon?
test-19719	How can a person land on moon?
test-19720	Atheists: if God were somehow proven to be real and active, would you follow him?
test-19721	Atheists: If you were finally presented enough evidence to convince you that God exists, would you worship Him?
test-19722	Should skinny guys go to a gym for getting better body?
test-19723	At what age should I start going to the gym?
test-19724	What can I do after having diploma in mechanical engineering?
test-19725	Can I do areonautical engineering after diploma in mechanical engineering?
test-19726	If a caged lion is provided only vegetarian food and water, will it die?
test-19727	What is the university experience in South Africa like?
test-19728	What is the difference between “tmpfs” and “devtmpfs”?
test-19729	What is the difference between a file system and a database?
test-19730	What are the highlights of SXSW?
test-19731	What is Highlight doing at SXSW?
test-19732	Anything you can do to prevent total fatigue the day after doing heavy deadlifting?
test-19733	"How much do you have to lift to ""maintain"" strength gains if you have gotten to a 350lb deadlift?"
test-19734	What the difference between cotton and silk?
test-19735	What is the difference between cotton and cotton twill?
test-19736	Why am I afraid of dating?
test-19737	Why am I afraid of telling my boyfriend I love him?
test-19738	What are good websites for escorts?
test-19739	How do I know that escort girls are safe for sex?
test-19740	Is a cactus a tree?
test-19741	Why does a cactus do not have leaves?
test-19742	How do I get followers in Quora app?
test-19743	What is the easiest way to find topics to follow using the Quora app?
test-19744	What do you think of the decision by the Indian Government to demonetize 500 and 1000 rupee notes?
test-19745	What are the impacts on Indian Rupee value after demonetizing Rs. 500 or Rs. 1000 notes in market as economic stand point?
test-19746	How can I find the cheapest guest house at Trivandrum near Technopark?
test-19747	This is my laptop Sony Vaio VPCEC35FG can I play GTA V in it?
test-19748	What does it mean if a guy blushes when he is praised by a lady?
test-19749	What does it mean when a guy giggles when he hugs you?
test-19750	Which of the Friends character do you pity the most?
test-19751	Which fictional character do you hate most, and why?
test-19752	How can I get budget hotel list in Pune to visit this New Year Eve?
test-19753	How can I get budget hotel list in Shimla to visit this New Year Eve?
test-19754	Why are black people so strong?
test-19755	Why did it seem Hitler also hated black people?
test-19756	Is it normal that  I feel jealous whenever I find my girl laughing with other guys?
test-19757	Would a guy be jealous of a girl if he didn't like her?
test-19758	Mercurial (software): How would I emulate 'git stash' in hg?
test-19759	How do I restore not tracked file from stash (in git)?
test-19760	In the crossroads scene in the movie Cast Away, did Chuck end up going back to that women with the wings symbol?
test-19761	Has anyone really been cast away like in Tom hanks movie?
test-19762	How can I prepare for GK for CMAT?
test-19763	What should one study for the CMAT GK section?
test-19764	What do you do if you have a good idea that your husband is cheating or trying to cheat with random local women that he meets on hookup apps?
test-19765	What should I look for on my husband's smart phone to see if he is hiding apps for cheating?
test-19766	How does YouTube channel earn you money?
test-19767	How much can you make on YouTube?
test-19768	I have an old computer memory and don't know exactly what type of ram it is?
test-19769	If I get write eLitmus in november and get good scores could I be able to get company's call for placemnt?
test-19770	Which are the best ways to lose weight?
test-19771	What are the best ways to start losing weight?
test-19772	What are some good substitutes for salad oil to use in recipes?
test-19773	What are good substitutes for ghee for use in recipes?
test-19774	What are some practical applications of variance and standard deviation?
test-19775	What is the difference between variance and standard deviation?
test-19776	Which books are good to read during pregnancy?
test-19777	What kind of books should I read during pregnancy?
test-19778	Is it possible to fix bow-legs without surgery?
test-19779	How are bow legs corrected for adults?
test-19780	What are the spindle fibers attach to? What purpose do they serve?
test-19781	What are the spindle fibers attached to? What purpose do they serve?
test-19782	Why do so many people believe in me?
test-19783	Why so many people believe in politicians?
test-19784	How can I root the android?
test-19785	How can I root my Android device?
test-19786	How do I set goals for myself?
test-19787	How do I set a goal?
test-19788	"Is there ""rule of law"" in Mainland China?"
test-19789	How does China have the authority to kidnap political prisoners and deny them basic legal protection? Does rule of law exist in China?
test-19790	What is the conversion factor between Volt and Newton?
test-19791	How do I amplify a voltage of 2.4-2.7 volts to 0-5 volts?
test-19792	Have the children of the forest been wiped out?
test-19793	[SPOLIERS]Are all the Children of the Forest dead?
test-19794	Is backward time travel possible?
test-19795	Is time travel is possible in this age of technology?
test-19796	How do I get good marks in school?
test-19797	How do I get good marks?
test-19798	What is going to be the best country to live in as a foreigner?
test-19799	Which is the best country to live for a foreigner?
test-19800	Where can I learn Muay Thai online?
test-19801	Where can I learn Muay Thai in Bengaluru?
test-19802	What would happen to a person if they had only Coca Cola to drink, instead of water, for one week?
test-19803	What will happen if I drink only water and not other beverages?
test-19804	How do gender differences affect communication in the classroom?
test-19805	How can Gender Differences affect communication in the workplace?
test-19806	What is cyber squatting?
test-19807	Which color shirt is suitable for white pant…?
test-19808	Do you agree with the perona's description of old age? If so, why?
test-19809	Do you agree with the persona's description of old age? Why?
test-19810	Do Muslims believe in Hindu gods?
test-19811	Is Mamata Banerjee Hindu or Muslim by faith?
test-19812	What are some characteristics of data warehouse?
test-19813	What characteristics should a data warehouse posses?
test-19814	Why do Koreans use metallic and not wooden chopsticks like the Chinese?
test-19815	Why do Koreans use chopsticks made from steel?
test-19816	What would happen if we touch the running battery terminal?
test-19817	When I touch positive or negative terminal (one at a time) of a battery do I get charged? If not what else happens?
test-19818	Which are the busiest airports in India?
test-19819	Delhi has the busiest airport in India but which is the one with largest international arrivals?
test-19820	Do animals also dream while asleep?
test-19821	Does animals dream during sleep too?
test-19822	What are some beginner node.js project ideas?
test-19823	Is it a good choice to develop a final year project in: MongoDB + Express.js + AngularJS + Node.js?
test-19824	What causes skin to Peel off?
test-19825	What causes sunburned skin to peel?
test-19826	Which laptop is best under 25000 INR?
test-19827	Which would be best laptop under 25k INR?
test-19828	Is time travel is possible in this modern age?
test-19829	Will time travel be possible in the next 10 years?
test-19830	"Why is ""Japan's Marine Day"" unknown in Samoa?"
test-19831	"Why is ""Japan's Marine Day"" unknown in Kiribati?"
test-19832	How do I root htc desire 526g+?
test-19833	How do I root HTC Desire 526g?
test-19834	Why would someone aspire to have a complex vocabulary, if using it in writing isn’t encouraged by the best writers?
test-19835	Which is better practice for an aspiring writer: writing novels or writing short stories?
test-19836	Is Glaive still strong in the Vainglory META?
test-19837	Vainglory: What are the differences in play styles between the various regions?
test-19838	Hi I got job regarding networking is this good?
test-19839	Can an indian citizen get job in nasa as space scientist?
test-19840	Which companies are located inside Kalyani Magnum Tech Park, JP Nagar, Bangalore?
test-19841	Are tech holding companies considers tech companies?
test-19842	What are some good topics to write articles on?
test-19843	What are the best topics to write an article for your college annual magazine?
test-19844	What are the coloured dots at the bottom of a newspaper? What do they mean?
test-19845	What do the four coloured circles/hearts/stars at the bottom of the newspaper depict?
test-19846	Who do you think is most likely to end up as shichibukai from Straw Hat crew in One Piece?
test-19847	Where can I get different types of personal unsecured loans in Sydney?
test-19848	What are the prerequisites for learning Hadoop & big data?
test-19849	Which programming language should I learn to be a big data developer (Hadoop)?
test-19850	How do you kill boredom at workplace?
test-19851	What kills your boredom at workplace?
test-19852	Is it easy to get at least 75% in CBSE class 12?
test-19853	How do I get good marks in class 12 CBSE Practical?
test-19854	Should I buy gold jewelry online?
test-19855	Where can I buy jewelry online?
test-19856	How should I know if he's lying?
test-19857	How can I find that someone is lying?
test-19858	How do I improve my YouTube channel?
test-19859	How can I improve my youtube channel?
test-19860	What is the easiest way to get rid of ACNE?
test-19861	How can I get rid of acne permanently?
test-19862	Who are the faculties of Vajiram and Ravi?
test-19863	Who is Vajiram and Ravi?
test-19864	How can I create new topics on Gamefaq?
test-19865	What is the best job consultancy in Nehru place, Delhi for civil engineers?
test-19866	How to not fall in love?
test-19867	How does one fall in love?
test-19868	How can I lose my weight naturally?
test-19869	How do I plan my diet to lose weight naturally?
test-19870	Do animals also dream while asleep?
test-19871	Does cats and other animals dream when they sleep?
test-19872	Can I be pregnant even after my period if I didn't have sex?
test-19873	Can I be pregnant even after having a period?
test-19874	Which is better - love or an arranged marriage?
test-19875	What do you prefer: love marriage or arranged marriage?
test-19876	How do I prepare IAS?
test-19877	How do start preparation for IAS?
test-19878	How do I can whole tomatoes?
test-19879	What could be the consequences of eating only tomatoes for a month? What about a whole year?
test-19880	What are some examples of upper class controling the media and helping poticians to use the media in their benefit?
test-19881	Can you contest a life insurance claim that's already been paid out?
test-19882	How can I improve in English?
test-19883	What are some of the good ways of learning English?
test-19884	What are the effects of drinking cold water?
test-19885	What is the adverse effect on body if you drink cold water?
test-19886	I easily get distracted when I start studying, what should I do?
test-19887	When I do something serious like studying, I get distracted by thinking in the purpose of nature, Existence. What should I do to concentrate?
test-19888	"Did Narendra Modi really say ""Hang me if I am unable to bring back black money."" Is there any video that shows this?"
test-19889	Is Narendra Modi really doing any development?
test-19890	How effective is LinkedIn in getting you internships?
test-19891	What are some tips for effectively networking on Linkedin?
test-19892	Does the suggested user list that appears when searching in  Instagram mean you have searched for them in the past?
test-19893	"In Instagram, under the magnify glass- what does the ""top"" section mean? Does that mean I've searched that Instagram account the most?"
test-19894	Which are the best books for preparing CAT exam?
test-19895	What are some good books that a CAT aspirant must read?
test-19896	Is Lady Brienne of Tarth a knight?
test-19897	Will Brienne become Lady of Tarth?
test-19898	Feeling depressed day by day… how to over come this? ..
test-19899	How do I make something battery AND outlet powered?
test-19900	Which are the manga related episodes in 'Naruto Shippuden' anime?
test-19901	Where can I find Naruto Shippuden episodes to watch ad free?
test-19902	I cheated on my boyfriend. What should I do?
test-19903	My girlfriend cheated on me. What should I do?
test-19904	How are pilots different from the average person?
test-19905	How much weight does the average person have as a pilot?
test-19906	Do girls like guys who are introverts or extroverts more and why?
test-19907	Do boys like introvert girls?
test-19908	What is the best way to spend a gap year before med school?
test-19909	How do I spend a gap year productively?
test-19910	What are the best ways to make money online?
test-19911	How can someone make money online for real?
test-19912	Who are Keystone Computer Associates's top competitors?
test-19913	Who are Bosley's top competitors?
test-19914	Is it good to eat groundnuts daily?
test-19915	How can Asian people eat rice three times a day?
test-19916	Why does Wil Wheaton guest star on Dark Matter?
test-19917	Did the guest actors on Ted 2 get paid?
test-19918	Did the Greek gods exist?
test-19919	Is there any evidence that Greek gods actually existed?
test-19920	If you were told about a start up called 'TriCitizen', what would you imagine it does?
test-19921	If you heard about a new FinTech (Financial Tech) called 'TriCitizen', what would you imagine it does?
test-19922	Should I start with Python 2 or Python 3?
test-19923	If you are just starting to learn Python, should you start with Python 3 or Python 2?
test-19924	How can I get a legendary card in clash royale following a chest pattern?
test-19925	How do I gain coins quickly in Clash Royale?
test-19926	Can you actually kill demons with a blessed katana?
test-19927	What are some ways to get a traditionally made katana?
test-19928	What is the highest bench press ever recorded? Who performed it?
test-19929	What is the bench press record?
test-19930	How can I study better?
test-19931	Are there any studies on how to study better?
test-19932	If someone blocks me on WhatsApp, how can I unblock?
test-19933	If someone block me on WhatsApp may I block him again?
test-19934	How is it to be an immigration officer?
test-19935	What is the qualification to become an immigration officer?
test-19936	What are CC and BCC in Gmail? How do I use them?
test-19937	"How we can send the mail to many people at the same time , keeping them in ""To"" and not in ""Bcc"" and still unicast them?"
test-19938	Which is better: Nikon 3200d or Canon EOS 1100d?
test-19939	Which DSLR is better, a Canon 1200D or a Nikon D3200?
test-19940	Who is the best hair stylist for curly hair in NYC?
test-19941	Who is the best hair stylist for Curly hair in Bangalore?
test-19942	The President is Commander in Chief of the Armed Forces of the USA. What does the rank look like?
test-19943	Is foul language really prevalent in the US armed forces as many movies depicted? Is there any formal policy about language in the US armed forces?
test-19944	I cheated on my fiance with a coworker and oddly I don't regret it. Does that make me a bad person? What should I do next?
test-19945	I realize I'm a hateful person but don't necessarily dislike this side of me. I kind of embrace it. Is this a good or bad thing for me?
test-19946	Who wins first debate tonight trump or Hillary?
test-19947	Who will win the first debate between Donald Trump and Hillary Clinton, and why?
test-19948	How can I get phone call logs online?
test-19949	How can I get phone call logs in Xcode?
test-19950	When and where was the first time women started covering upper part of their bodies and how did it spread around the world?
test-19951	Why does the upper and lower part of the human body have different heat capacity?
test-19952	Which company is better to start with for a fresher: TCS, Infosys, Wipro or Cognizant?
test-19953	I am placed in Infosys, TCS, Cognizant and Wipro. My stream is IT. Which company is best to join as a fresher?
test-19954	"What is ""DLC"" in gaming?"
test-19955	How has the introduction of DLC hurt the gaming industry?
test-19956	"Can someone provide a latin translation for the phrase, ""Nothing is permanent but change.""? Thank you!"
test-19957	"Can someone translate ""We act like mortals in all that we fear, and like immortals in all that we desire."" to Latin?"
test-19958	What are the legal separation laws in PA and how do they compare with the ones in Washington?
test-19959	What are the legal separation laws in PA and how do they compare with the ones in Maryland?
test-19960	How do I write the career objective for mechanical engineering?
test-19961	What are some good career objectives to write in a resume of a mechanical engineer (fresher)?
test-19962	Who is the best financial advisor in San Francisco?
test-19963	Who are the best personal financial advisors in San Francisco for people saving for retirement? What were your experiences with them?
test-19964	Can aliens ever be real?
test-19965	Do aliens exist?
test-19966	What are the best programming books?
test-19967	What are some good computer programming books?
test-19968	I have secured a rank of 3551 in IPU CET 2016.What should be my preference order in choice filling?
test-19969	I have secured a rank of 6117 in IPU CET 2016.What should be my preference order in choice filling?
test-19970	Does love jihad exist?
test-19971	Does love jihad really exists?
test-19972	Is there any other platformer game like Limbo?
test-19973	What are some games like Limbo?
test-19974	How can I design a social media strategy?
test-19975	How do I create a social media strategy?
test-19976	What do young people think about China outside of China? What are the ways to learn about China? Do they like china?
test-19977	What do people think of China?
test-19978	What role did computers play in helping the Allies win World War II?
test-19979	What are the best photos of World War II?
test-19980	Does Naruto still have the Nine-Tails inside him after being the seventh Hokage?
test-19981	Will Naruto end without Naruto being the Hokage?
test-19982	How is Hillary Clinton doing these days?
test-19983	What would Hillary Clinton do now that the election is over?
test-19984	What's the weirdest thing that have ever happened to you?
test-19985	What is the weirdest thing that has ever happen with you?
test-19986	Is it possible to learn or re-learn a foreign language while sleeping?
test-19987	Is it really possible to learn language while sleeping?
test-19988	Do you think that the demonetization policy will backfire for BJP in 2019 elections?
test-19989	Will demonetization affect Modi in 2019 elections?
test-19990	How do I get the owner's details from the vehicle registration number in India?
test-19991	Can auto rickshaws in Mumbai have MH 03 in their vehicle registration number?
test-19992	How can I start my studies again after 5 years gap?
test-19993	Does secret relationship works in india?
test-19994	If my brother is vaporizing weed in his room, and I walk in, can I get high?
test-19995	If my brother was vaporizing weed in his room would I be able to smell it at all?
test-19996	Why should you NOT invest in stocks?
test-19997	Why invest in stocks?
test-19998	What is a p type and an n type semiconductor?
test-19999	What is the difference between N-type and P-type semiconductor materials?
test-20000	How can you tell if a guy is nervous around you?
test-20001	If someone asks why do you love me, what should I say?
test-20002	Is there any perfect university for international students to study MBBS in Europe?
test-20003	Which medical university is the best one to study MBBS in Europe for Indian students?
test-20004	What are the best career option after civil engineering?
test-20005	What are the best career options for a civil engineer after getting a bachelor's degree for girls?
test-20006	"Counterfactual: If white is the ""absence of color"" then how do you explain the color clear?"
test-20007	Which color combinations make gray other than black and white?
test-20008	On Property Brothers, Love It or List It, Fixer Upper and other HGTV shows, how true is the cost of the renovation to what it would be sans the show?
test-20009	Does HGTV's Flip or Flow showcase any deals in the red? (flops)
test-20010	Why should the present day Indians respect Gandhi?
test-20011	What have the present day Indians forgotten the most?
test-20012	Why did mermaids never appeared in the English dub of Doraemon?
test-20013	Did Sophia from Doraemon movies appear in the English dub of the anime?
test-20014	What is it like flying from Bangkok to Manila and how are these touristic cities compared to Kolkata?
test-20015	What is it like flying from Bangkok to Manila and how are these touristic cities compared to Colombo?
test-20016	What is the methodology opted by JOSAA in seat allotment?
test-20017	What is the JoSAA mock seat allotment?
test-20018	What would a hypothetical conversation between D.C’s Wonder Woman and Marvel’s Black Widow be like?
test-20019	Will Charlize Theron be in the next Mad Max film?
test-20020	If energy cannot be created nor destroyed, does that mean there has to be an afterlife? After we die, where does our energy go?
test-20021	Is there any evidence for reincarnation?
test-20022	How can cardiovascular diseases be prevented?
test-20023	What is cardiovascular disease?
test-20024	Which website to refer for learning C?
test-20025	Which website should I use for learning c language?
test-20026	What is the most effective way to lose weight?
test-20027	Which is the fastest way to lose weight?
test-20028	What are some acid-proof/resistant material?
test-20029	What are novel materials?
test-20030	Why does Quora select me to answer the lamest questions?
test-20031	"How does Quora select ""Can you answer __?"" questions?"
test-20032	How much do Cirque du Soleil performers make?
test-20033	What happens if a Cirque du Soleil performer is sick or injured?
test-20034	How self-conscious are psychopaths?
test-20035	How can you not be self-conscious?
test-20036	Is it good to start your career in technical support if I want my future in like Network admin and Network engineer (btw I'm goin to give CCNA)?
test-20037	Is it possible to move from the software engineering field to the network engineering field? If so, how? Is the CCNA exam a good choice?
test-20038	Can Britain reverse BREXIT?
test-20039	What would it take to reverse the Brexit decision?
test-20040	Why do people think that money rule the world?
test-20041	Why do people think that banks rule the world?
test-20042	Which Nassim Nicholas Taleb book should I read first?
test-20043	Is Nicholas Nassim Taleb writing a new book?
test-20044	The Godfather, Part II (1974 movie): Why did Michael kill Fredo?
test-20045	The Godfather, Part II (1974 movie): Who killed the gunmen that shot up Michael and Kay's bedroom?
test-20046	Is it too late to drop a year for JEE?
test-20047	Is it worth it to drop a year for the JEE?
test-20048	Where can I learn basics of stock market?
