test-417465	Is there any problem with using 0 diopter lens glasses for patient with repaired RD?
test-417466	Why does India use 230 V 50HZ while the USA uses 120V 60HZ?
test-417467	Why is 60hz 120v supply used in the USA?
test-417468	How long did it take for New Orleans to fully recover from Hurricane Katrina?
test-417469	What is it like to move from St. Louis to New Orleans?
test-417470	Can we construct 150 degree angle using compass?
test-417471	How can you determine the degrees of a acute angle?
test-417472	Beer Brewing in India: Where does one buy beer brewing ingredients in India?
test-417473	What is the best place to buy a home beer brewing kit in India?
test-417474	Why does viscosity of liquids decrease with temperature?
test-417475	What is the effect of pressure and temperature on viscosity of natural gas?
test-417476	Why is there a liberal bias in the media?
test-417477	Does the media have a liberal bias?
test-417478	Would therapy help me overcome the feelings of resentment towards my father?
test-417479	How can you learn faster?
test-417480	How can I reduce knots in my shoulders (trapezius muscles)?
test-417481	How can I realign my shoulders?
test-417482	When drinking or eating something sour, once in a while, the area of my jaws closest to my ear stings for a few seconds. Not chronic pain, but has happened all my life. Can someone explain what this is?
test-417483	How do you cure chronic pain?
test-417484	Why do I get fat even though I don’t eat much?
test-417485	Why don't I get fat no matter how much fat I consume?
test-417486	How should I celebrate my husband's first birthday after our marriage?
test-417487	How should I celebrate my wife's first birthday after our marriage?
test-417488	Can the Iron Man Technology be made Real?
test-417489	Can iron man suit be made in reality?
test-417490	How do poor people eat healthy?
test-417491	What do super healthy people eat?
test-417492	Which is better: Sodexo or food card?
test-417493	How do I get free Sodexo coupons?
test-417494	How do socialists view Human Nature?
test-417495	What's your view of human nature?
test-417496	Who is Emon Ghaneian?
test-417497	What is Emon Ghaneian known for?
test-417498	What color of curtains will go with orange and green walls?
test-417499	What color of curtains will go with orange walls?
test-417500	What is the difference between software engineering and computer science engineering?
test-417501	What's the difference between computer science, computer engineering, and software engineering?
test-417502	Why did AICTE to choose Microsoft platform for India's SWAYAM initiative over existing open source alternatives?
test-417503	Salary increment in nokia?
test-417504	How do I apply direct and inverse variation to real life?
test-417505	How is the value π applied in real life?
test-417506	How can I find out if my husband is using dating apps?
test-417507	How do I find out if my husband is dating anyone online?
test-417508	How does one trade Pokémon in Pokémon GO?
test-417509	How do I catch more Pokémon in Pokémon GO?
test-417510	Living in tier 2 vs tier 1 city?
test-417511	If anyone knows my Apple account's password, will they be able to watch everything I do in my phone?
test-417512	What are the rules of wearing Janeu (Upnayan thread)?
test-417513	What is the significance of Janeu (Upnayan Sanskar)? What does a thread do to change anything? What are the rules while wearing it and why?
test-417514	What is the difference between sex workers and prostitutes?
test-417515	What is the difference between prostitution and sex work?
test-417516	What is the best piece of advice you'd give to a 16 year old?
test-417517	What advice would you give to your 18-year-old self?
test-417518	Is your husband cheating on you?
test-417519	How do I catch my cheating partner?
test-417520	What is the corporate culture like at Civitas Solutions? How is the culture different than other companies?
test-417521	What is the corporate culture like at PDF Solutions? How is the culture different than other companies?
test-417522	"What is the meaning behind the song ""Purple Rain""?"
test-417523	What do the lyrics of Purple Rain mean?
test-417524	Is there any remedy for plagiocephaly (aka flat head syndrome)? And is it possible to make one's head flatter if one keeps sleeping on their back into adulthood?
test-417525	Why it aches at the back of head?
test-417526	What are the best names for marine company conference rooms?
test-417527	What are the best names for marine theme conference rooms?
test-417528	How tough is it for an Indian student to get admitted to top Canadian universities (UBC or SFU) for an MS in computer science?
test-417529	What are the top 20 Canadian universities for computer science?
test-417530	What is the difference between beer, wine, liquor, alcohol, brandy, whiskey, rum, vodka, bourbon, stout, scotch, feni, champagne, tequila and gin?
test-417531	What is the difference between beer and stout?
test-417532	Why can't iOS run on any Android device?
test-417533	Can you run iOS on Android?
test-417534	How can you format text (make text bold, italic etc) on Facebook posts?
test-417535	How do I add a text link to a Facebook wall post?
test-417536	What is good goal in your life?
test-417537	What is your goals in life?
test-417538	"Which is grammatically correct: ""John and I"" or ""John and me""?"
test-417539	"Which is grammatically correct: ""Is it I?"" or ""Is it me?"""
test-417540	Why Michael Jackson is so popular?
test-417541	Why is Michael Jackson so popular?
test-417542	What type of dream do blind people see?
test-417543	What do blind people dream about (born blind)?
test-417544	What is Dr. Nowzaradan's diet plan before he performs a surgery?
test-417545	If a doctor performs a surgery on someone, but the person dies and he was unable to save him, does the patient's family still have to pay?
test-417546	How can I take timelapse video on Nikon D3400?
test-417547	How can I take a panorama photo with the Nikon D3200?
test-417548	What is the alternate website of torrentz.eu?
test-417549	What is the best alternative for kat.cr (kickasstorrents)?
test-417550	Where can I get quality support in Sydney for buying, selling or leasing a property?
test-417551	Where can I get very friendly assistance for buying, selling or remortgaging a property in Sydney?
test-417552	How much percentage is required in the 12th grade to get an admission in DU?
test-417553	What percentage is a 12th grade CBSE studest required to get directly admission into BITS colleges.I mean if he doesn't give BITSAT?
test-417554	Can our likes actually be changed due to circumstances? How to be less hurt while doing so?
test-417555	How do I become a more interesting person?
test-417556	How can I make some money?
test-417557	What is the best way to to make money?
test-417558	Should you use primer with BB cream?
test-417559	Can we use BB cream everyday?
test-417560	How do I calculate the number of linkage groups in a chromosome?
test-417561	What is a diploid number in reference to chromosomes?
test-417562	What is the best way to start my own forum?
test-417563	How do I make my own forum?
test-417564	How much wedding management company charge for complete wedding in Ahmedabad, India?
test-417565	How much will an average wedding cost in Goa?
test-417566	How do I make money online?
test-417567	What is the easy way to make money online?
test-417568	What's the difference between Illuminati, Satanism, and Freemasonry?
test-417569	What is the relationship between the Illuminati and the devil?
test-417570	How do I study again after studying for a long time already?
test-417571	Life: How can I motivate myself for a long time?
test-417572	What is the best i5 processor for gaming?
test-417573	Processors: Is 2 nd generation core i7 good for gaming or or 3 rd generation i5 or i3?
test-417574	Is there a motion tracking plug in to Final Cut Pro X?
test-417575	"Final Cut Pro: Will Motion 4 be usable on a 13"" MacBook Air?"
test-417576	What is the future of web development in 2017?
test-417577	What should be goal of a future web developer?
test-417578	Humans are known to consciously do self-damaging things: smoking, taking drugs, drinking. Do animals in nature show some behavior similar to this?
test-417579	"Given the flexibility of animal (including primates) behavior and adaption, is there any such thing as a true, fixed, ""human nature?"""
test-417580	If life is a game, what are the rules of it?
test-417581	If life is a game what are the rules and how does one win?
test-417582	Do employers value an MOOC certification? Has anyone received a promotion or a new job based primarily on a cert from Coursera, Udacity, Udemy, etc.?
test-417583	Do Employers in India value MOOC certifications?
test-417584	What is voltage control?
test-417585	What is voltage regulation?
test-417586	How does one delete duplicate photos in Google Photos from the web or from the app? Is there feature where you can scan and delete for duplicates?
test-417587	Can I delete my iPhone photos once they are uploaded to Google Photos?
test-417588	How could I be a good friend to any girl?
test-417589	How do I become a good friend to a girl?
test-417590	What we have to do when we are angry?
test-417591	What should we do when we are angry?
test-417592	How do I get rid of my acne and get nice skin?
test-417593	What is the easiest way to get rid of ACNE?
test-417594	How do I change my SBI register mobile number?
test-417595	How can I register a mobile number at SBI?
test-417596	How do I understand a girl?
test-417597	How do I understand my girlfriend?
test-417598	Which Pioneer DJ Controller would you advise ddj-wego3 vs ddj-sb2?
test-417599	Who is the best DJ?
test-417600	What big incident in your life changed the way you are?
test-417601	What is an incident that changed your life?
test-417602	I broke up with my boyfriend, and now I miss him terribly, but I know it was the right decison to end the relationship and I don't want to get back together. How do I best cope with the pain and sadness from missing him in my life?
test-417603	Why I didn't miss him before but missing him talking to other people?  My boyfriend and I recently broke up after 5 years. Its been more than a month and we didn't talk (we used to talk daily for long hours). I was looking at his Facebook updates, statuses but today he didn't use Facebook and I am missing him.
test-417604	Have you ever prayed to God?
test-417605	Who prays to God the most?
test-417606	"What is the meaning of ""que"" in English?"
test-417607	"What does ""que pasa"" mean in English?"
test-417608	Why did Britain even have a vote to leave or remain in the EU?
test-417609	Has Britain just voted to leave the EU?
test-417610	How do I prepare for an MH CET for an MBA in 2017?
test-417611	What is the best strategy and books to prepare for MBA CET 2017?
test-417612	Do plant cells have cytoskeleton? What are its functions?
test-417613	Do plant cells have a plasma membrane?
test-417614	Does God exist? If yes, How and where?
test-417615	Does god exist?
test-417616	What makes a perfect pizza?
test-417617	How can I make good pizza?
test-417618	Why are monkeys so important?
test-417619	Why are there no monkeys in the US?
test-417620	Which is thebest engineering college through bcece?
test-417621	What games on MacBook Air AppStore are compatible with Xbox one controller?
test-417622	What is the property tax rate in Granville, Ohio? How is it compared to the one of Massachusetts?
test-417623	Why am I having high blood pressure at age 21?
test-417624	What are some example sentences where every word starts with D?
test-417625	"What are examples of sentences featuring the word ""anecdote""?"
test-417626	"What is the origin of the phrase ""One team, One dream""?"
test-417627	"What does the phrase ""one size fits all"" mean?"
test-417628	Why do so many quarterbacks wear number 12?
test-417629	Why are Americans frightened of the number 13? Yesterday I went to a function on floor number 14, just above number 12, in an American-owned hotel.
test-417630	What is the difference between a person and a human?
test-417631	Is the difference between humans and other primates infinite when the human mind is considered?
test-417632	How can I fix these posture problems?
test-417633	How do you fix bad posture?
test-417634	Who was the 26th president of USA?
test-417635	Who was the 3rd president of the USA?
test-417636	How can I find out if my little brother is vaporizing weed in his room?
test-417637	How can I figure out if my little brother is vaporizing weed in his room?
test-417638	What is the difference between branding and marketing?
test-417639	What is the difference between a brand and company?
test-417640	What should I need to do if my passport is in review at RPO?
test-417641	Do I need a US passport to leave the US?
test-417642	What are some mathematical theorems that a high school student without knowledge of calculus could attempt to prove?
test-417643	Which one is easy public economy or global political economy?
test-417644	Why is Amazon selling Indian flag doormats?
test-417645	What is your opinion on Amazon retailer selling Indian flag doormat?
test-417646	What are some things new employees should know going into their first day at Azarga Uranium?
test-417647	What are some things new employees should know going into their first day at ALX Uranium?
test-417648	How many yards of tulle do you need to make a tutu for a child?
test-417649	How do you make a ballerina tutu?
test-417650	Why do people have problems with legal immigrants in their country?
test-417651	Which is the best option among the following : Shivaji College(bcom) or PGDAV(bcom) or Bhagat Singh eve(bcom) or Satyawati(bcom hons)?
test-417652	What exercises I do in order to be taller?
test-417653	What are some exercises I could do to get taller? What other strategies can I use besides exercises?
test-417654	How can you tell whether a woman is enjoying sex?
test-417655	How do you know if a woman just wants sex and nothing else?
test-417656	Is there any lawyer who can tell me how one should avoid a false dowry case against me and my parents?
test-417657	In India, what grounds do I need to apply for anticipatory bail in case my wife threatens to file a false domestic violence accusation against me?
test-417658	How do I kill people?
test-417659	"How do you ""kill people with kindness""?"
test-417660	Dushka Zapata: I want to take a class in Philosophy but it overlaps with a CS course. What should I do?
test-417661	What was the most annoying thing about growing up LDS Mormon?
test-417662	Did Josef Mengele's experiments result in any advances in medicine?
test-417663	Who was worse, Josef Mengele or Adolf Hitler?
test-417664	Is Nigeria considered a third world country? If so, why?
test-417665	What is a third world country?
test-417666	If I insert Jio sim in Lumia 535 will it not work at all?
test-417667	Does Cortana work on the Lumia 535?
test-417668	What does it mean when you constantly dream of someone?
test-417669	What does it mean if you dream about a person you don't know?
test-417670	How are the placements for the automobile branch in Manipal University?
test-417671	How are the placements for the aeronautical branch in Manipal University?
test-417672	How do I get a radiology seat in India?
test-417673	How hard is it to get into a radiology residency?
test-417674	Is it possible to genetically engineer humans to breath the martian atmosphere?
test-417675	Is it possible to genetically engineer humans to become biologically immortal?
test-417676	I'm actively looking for a research topic for PhD related to behavioral finance. What are some ideas or suggestions?
test-417677	I'm actively looking for fresh research topic for PhD in Behavioral Finance? What are some suggestions?
test-417678	What did Harsha Bhogle think about virat kohli?
test-417679	What does Harsha Bhogle think about Rahul Dravid?
test-417680	What's your favorite iPhone?
test-417681	What are your favorite iPhone apps?
test-417682	Is there a Lollipop 5.0 ROM for the Galaxy Core Duos I8262?
test-417683	What are the custom ROMS based on Lollipop for Samsung Galaxy A5 Duos (SM-A500G)?
test-417684	What is happening (chemically) to gasoline that makes it go bad?
test-417685	Does gasoline go bad when stored for a long time?
test-417686	What is the difference between productivity and efficiency?
test-417687	What is effectiveness and efficiency? How are they different?
test-417688	If Space Agencies are ranked, where will ISRO stand?
test-417689	Where does the Indian space program stand in comparison to Chinese space achievements?
test-417690	Do you still show up as active on tinder if you delete the app?
test-417691	If you delete Tinder from your phone, will you still show up in the list of people who use the app to your friends?
test-417692	What's your favorite room in your home and why?
test-417693	What is your favorite room in your home?
test-417694	Where can I find venture capital for my startup?
test-417695	How can I get an investor for my startup?
test-417696	How can you learn to be a kinder person but without people taking advantage of you?
test-417697	What strikes first time visitors as special or unusual when they arrive in Ziguinchor, Senegal?
test-417698	Why do cats cry at night?
test-417699	Why is my cat crying?
test-417700	Who is barbari?
test-417701	Who was Barbarika? What was his importance in Mahabhartha?
test-417702	How tolerant are Germans towards foreigners?
test-417703	Is German society welcoming of foreigners (foreign students)?
test-417704	"How do you say ""charro"" in English?"
test-417705	"How do you say ""señor"" in English?"
test-417706	Which are the manga related episodes in 'Naruto Shippuden' anime?
test-417707	Why Naruto Shippuden Episode 464 is So Special?
test-417708	How do I unfollow my comment in a Quora answer?
test-417709	How can I see all of my comments on Quora?
test-417710	If there is one thing you would do for your country, what would it be?
test-417711	What is one thing that you had done for your country?
test-417712	How does it feel to be a grandfather?
test-417713	How does it feel like to have a grandfather?
test-417714	What is the best mobile phone in RS 10k budget with a good camera?
test-417715	What is the best smart phone in RS 10K budget with a good camera?
test-417716	What is Alternating current (AC)?
test-417717	What makes Alternating Current(AC) alternating?
test-417718	What happens to the money donated to the Lord Balaji temple, Tirumala?
test-417719	What happens to large number of gold and money donated at Indian temples? To whom does that money and gold belongs? How are they utilised?
test-417720	What are the best Malayalam movies in the recent year's?
test-417721	What are the best Malayalam movies since 2010?
test-417722	If you are writing a business letter on behalf of an entity (i.e. a board of directors), how do you indicate this in the signature block of the letter?
test-417723	How do I write a business letter from a department, not an individual (i.e. with no signature or person's name)?
test-417724	What happens to a UPS package mistakenly dropped into a USPS Dropbox?
test-417725	Can I drop off USPS packages at a UPS store?
test-417726	How do I find static and kinematic indeterminacy of structure easily?
test-417727	Can I get some questions of kinematics in 3d?
test-417728	Why is iron so malleable?
test-417729	Is sulfur malleable? Why or why not?
test-417730	How do you know that a boy likes you?
test-417731	How do you know if a boy loves you?
test-417732	Is age really just a number?
test-417733	Is age really only a number?
test-417734	New technology in market in terms of electrical enginnering?
test-417735	Why do I feel so lost and numb?
test-417736	Why is homosexuality a crime in India?
test-417737	Why is practising homosexuality a crime in india?
test-417738	What's the worst thing someone told you about another person?
test-417739	What's the worst thing you've ever said or thought about another person? What is the worst thing you can ever say to someone?
test-417740	How does DNS work?
test-417741	How does DNS works?
test-417742	Is having Aloo gobi with all gobi and no Aloo gauche?
test-417743	What is Aloo?
test-417744	Why is Deer Antler spray banned?
test-417745	What is deer antler spray?
test-417746	Which are the books for mechanical engineering that have been written keeping GATE syllabus in mind?
test-417747	How tough is the NIT syllabus?
test-417748	If I delete a snapchat friend will they still see the last message I sent?
test-417749	If I remove a friend on Snapchat, how can I see the last saved messages?
test-417750	How can I innovate and improve on a current idea that's already out there in the market?
test-417751	How can I develop problem solving skills like Monk?
test-417752	Why do I get so emotional in relationships?
test-417753	Why do we get emotional in relationship?
test-417754	What's the best way to forget someone you love?
test-417755	How do I forget someone whom I once loved deeply?
test-417756	How do you get unblocked on Twitter?
test-417757	How do I unblock everyone I've blocked on Twitter?
test-417758	What is the easy way to earn money online?
test-417759	What is the best way for making money online?
test-417760	With Fairy tail, why was episodes 276 and 277 english dub before 240 to 265?
test-417761	When will Fairy Tail episodes 240-265 be dubbed?
test-417762	Should films be educational?
test-417763	How do I stand out with my portfolio when there is a small chance I will get the education you want (I want to go to the film academy)?
test-417764	Two circles having centre O and O' intersect at P. Through P, A line drawn parallel to OO' intersecting the circle at C and D is drawn. prove CD=2OO'?
test-417765	When Given two circles with centers O and P, tangent to each other at A and a line tangent to both circles at B and C. Prove angle BAC is 90 degrees?
test-417766	What are some basic books to read to understand the stock market and economics for a beginner?
test-417767	I am a 12th standard student, average in studies. Do I have any chances of getting admission to ISI with MSQE after completing ug in economics?
test-417768	What are the vision, mission and goals of the UN?
test-417769	What are the goals and purposes of the UN?
test-417770	What we will do first with data set, normalization or feature reduction?
test-417771	How and Where can you find archive of internet content and website that doesn't exist anymore?
test-417772	How do you tell Uber you want to pick up another passenger on the way to your final destination?
test-417773	Can a Uber driver cancel a ride before he pi picks them up?
test-417774	How do you close a Yahoo email account permanently?
test-417775	How do you delete your Yahoo account permanently?
test-417776	Is Hc Verma's book sufficient for grasping all concepts for JEE Advanced?
test-417777	What are good topics for thesis on pathology at BS level?
test-417778	Did Roman soldiers really have tattoos that said SPQR or was that just something they made up for Gladiator?
test-417779	Does my tattoo need a touch up?
test-417780	How can I find an investor for my business?
test-417781	What is the best way to find angel investors?
test-417782	Does iOS 10 supports VoLTE in iPhone 5s?
test-417783	Should I update iOS 9 to iOS 10 on my iPhone 5s?
test-417784	If a bed bug crawls into your mouth or ears while sleeping, can it live inside you?
test-417785	How can bed bug bites be treated?
test-417786	Should Public Arsenals be considered by the United States?
test-417787	Why are there so little mirrorlink licensed apps?
test-417788	What is a dividend warrant?
test-417789	Do all stocks pay dividends?
test-417790	My upes rank is 3321 is there any chance to get petroleum?
test-417791	Will there be any chance of getting petroleum branch with 3321 rank in UPES?
test-417792	How much does Arijit Singh charge for a concert in kolkata ?
test-417793	How does it feel to be attending an Arijit Singh concert?
test-417794	How is forex trading in India? Is it illegal in India?
test-417795	Why is forex trading illegal in India?
test-417796	What are the Ayurvedic remedies for a diabetes cure?
test-417797	What is the best home remedy for ear infections in adults?
test-417798	What do countries with an eagle on their flag have in common?
test-417799	What do Australians think of this new flag for their country?
test-417800	How do I learn about better posture?
test-417801	Where does a data scientist fit in a company governed by digital marketers?
test-417802	How do I recover Gmail password without user knowing?
test-417803	How do I reset a Gmail password without the security question?
test-417804	How do I design edit text view with bottom border alone in Android and edit text view with some special symbol like below image?
test-417805	What is the meaning of “view view” in Android?
test-417806	What happens to a surgeon when a patient dies on his or her operating table?
test-417807	How do surgeons learn the art of stitching patients on the operating table?
test-417808	Why do some people in Northern Ireland want NI to become part of the Republic of Ireland?
test-417809	Would the people of Northern Ireland prefer to become part of the Republic of Ireland rather than leave the EU?
test-417810	What is the best affordable wrist watch for geeks?
test-417811	How you can compare two wrist watches brand?
test-417812	What is the best way to dispose ciggrate buds without getting caught?
test-417813	Could they be a connection between Johnny Depp's and Brad Pitts' divorces?
test-417814	Should consumers care what CPU is inside their laptop?
test-417815	What happens during exam time when a person sleeps 4 hrs night before exam who is used to sleep for 7-8 hours?
test-417816	What is Shah Rukh Khan doing now?
test-417817	Who is Shah Rukh Khan?
test-417818	I have got 293 in BITSAT 2016 what can I get in BITS Goa?
