24000	Why do copper vessels turn green ?
24001	What is the chemical change that turns copper green ?
24002	How did Kung Fu originate ?
24003	What is kung fu ?
24004	Can I recover my Facebook account after I deactivate it once ?
24005	What do I have to do to relax during sex ?
24006	How can I relax to enjoy sex ?
24007	What's the most studied or the most popular foreign language (excluding English) in your country ?
24008	Are there any reasons to consider Spanish a dying language ?
24009	What is an atomic number ?
24010	What is an atomic number ? What are examples of this ?
24011	I have tried different types of hair gels but after 2-3 minutes they don't hold my hair.Any kinds of specific products which I should try using ?
24012	Can siblings be financial partner for student visa in Australia ?
24013	What are some of the best online resources to learn economics ?
24014	What are the best online resources for learning economics from scratch ?
24015	How were New Horizons , Rosetta , Mars missions , and Juno aimed at their respective planets ?
24016	How does NASA know for certain the photos sent back by New Horizons were of Pluto ?
24017	How will demonetization affect India ?
24018	Is demonetisation good for India ?
24019	Is Signature just an identify proof ?
24020	How painful is Osteochondral autograft ?
24021	Why do human need sleep ?
24022	Why do humans need sleep ?
24023	I need a Fast twitch muscle building Workout ?
24024	Should I prepare every chapter in geography (ICSE class 10th) or should I leave some ?
24025	Why do people make noises during sex ?
24026	Is architecture a good career ?
24027	Who is a good architect ?
24028	What has been the best decision you have made in life ?
24029	What does the emoticon : ~) mean ?
24030	Why do people ask basic questions instead of searching them ?
24031	How do I fix ERR_CONNECTION_REFUSED on Chrome ?
24032	How do I fix Trello on Chrome ?
24033	How was your KVPY SX 2016 ?
24034	How was KVPY 2016 ? How much are are all of you scoring ?
24035	I am 2nd year ECE student I dnt like programming but I want to learn it . how should I start ?
24036	What are the pros and cons of suing in federal instead of state court ?
24037	How do you learn to do graphic design ?
24038	How can I learn graphic design ?
24039	If it possible to hack Google play games high score ?
24040	Is it possible to play pirated games on PS3 by modding it successfully ?
24041	What are some examples of how data and information differ ?
24042	Ms. Clinton : How will you pull back from the hawkish foreign policy of the last 15 years ? Or will your administration maintain this level of violence ?
24043	What will be the impact of the step taken to ban the 500 & 1000 rupee note on Indian economy ?
24044	What will be the effects after banning on 500 and 1000 rupee notes ?
24045	How much does a day pass for LA Fitness cost ?
24046	How much does a free trial pass for LA Fitness cost ?
24047	Which song gives you goosebumps when you hear it ?
24048	Which song gives you goosebumps when you hear it every-time ? Why ?
24049	Can we invest in Arnab Goswami's new company Republic ?
24050	Is Arnab Goswami biased toward the BJP ?
24051	Which is the best course for digital marketing ?
24052	I am MBA (Marketing) Student . I want to pursue Digital marketing Course . So where Can I find best course of Digital Marketing ? Is there any Institute in Mumbai who are providing the Digital marketing Course ?
24053	Who were the most powerful countries in the world at different points in history ?
24054	What is most powerful country in Asia and why ?
24055	As a pilot , would you prefer to fly cargo or passengers ?
24056	Do airline pilots prefer flying passenger or cargo flights ?
24057	How do I legally download apk from my website ?
24058	How do I prevent a website from automatically downloading a . exe file (likely virus) onto my computer ?
24059	Why do many people dislike Chetan Bhagat's novels so much ?
24060	Why do people dislike Chetan Bhagat ?
24061	What are the benefits to India if they declare a war with Pakistan ?
24062	Will India and Pakistan really face a war ? If they do , what is gon na be the impact on the world ?
24063	What are some of the most closely guarded secrets ?
24064	What are the most awesomely guarded secrets in the world ?
24065	Why are covalent compounds more soluble in alcohols than ionic ones ?
24066	Can ionic compounds become ionic gases ?
24067	What is the best way to market my first novel ?
24068	How do I market a novel ?
24069	`` What is the past participle of'' `` fly'''' ?''
24070	What is the past participle of meet ?
24071	What works to make a man's penis thicker ?
24072	How can I make my penis big and long ?
24073	Why do people from the southern states of India usually have a very long first name/family name ?
24074	My boyfriend has a thing for brown skinned girls but I have light skin . Why would he date me if I'm not brown skinned ?
24075	What are some tips for marinating frozen chicken ?
24076	What are some ways of marinating frozen chicken ?
24077	How do I use reliance Jio wifi device on my CCTV dvr of newlook brand with ethernet ?
24078	Can I use iPhone 6 Plus with Reliance Jio Sim Card ?
24079	Where can someone buy genuine passport and birth certificate on the internet ?
24080	Where can I buy genuine documents on the internet?eg passports , birth certificate .
24081	What's the best home remedy for ear mites in cats ?
24082	What is the best home remedy for a toddler vomiting ?
24083	What are your views on demonetization of 500 and 1000 rupee notes by the Modi Government ?
24084	`` Who said'' `` holding a grudge is like drinking poison and waiting for the other person to die'''' ?''
24085	New York Daily News : Who said this ?
24086	How can the drive from Edmonton to Auckland be described , and how do these cities' attractions compare to those in Vancouver ?
24087	Is it legal to own lock picking tools in India ?
24088	Is it better to use your own hand made lock picking tools or just buy a set ?
24089	Where do airplanes dump shit from the toilet ?
24090	Where do airplanes dump sh*t from the toilet ?
24091	How do I tie-up with top 10 App Marketing Companies ?
24092	How do we do space branding inside tie up companies ?
24093	Which country would be the best to replace Qatar as World Cup host for 2022 ?
24094	Who would be the frontrunner to replace Qatar , if they are removed as the host of the 2022 FIFA World Cup ?
24095	I am from IP University and want to apply for MS in Germany , My aggregate percentage is but my CPI is 73 . How can I get CGPA from the university ?
24096	I am currently pursuing (4th semester) mechanical & automation engg . Is it possible to get admit from German universities for MS with low percentage ?
24097	How do you start a private equity firm ?
24098	What do you need to start your own private equity firm ?
24099	Would some Israelis be aggravated if a Turkish tourist visits Israel as the Turkish government is becoming more anti-semitic ?
24100	If Erdogan starts a war with the Syrian Kurds , would he lose Turkish and American support ?
24101	Is there any other method for wireless power transmission other than induction method ?
24102	Is there any method for wireless power transmission other than induction method ?
24103	What universities does Stifel Financial recruit new grads from ? What majors are they looking for ?
24104	What universities does Discover Financial recruit new grads from ? What majors are they looking for ?
24105	What is your favorite music genre , band , or song ? Why so ?
24106	What are the examples of unsaturated hydrocarbon ?
24107	What is a hydrocarbon ? What are some example ?
24108	What is Triple Talaaq ?
24109	How does triple talaq work ?
24110	Who is Lady Stoneheart ?
24111	Who has Lady Stoneheart killed ?
24112	How do you hack into Instagram ?
24113	Why is alligator meat considered red meat and not white ?
24114	Why is fish not considered to be red meat ?
24115	Wat is my drivers license number ?
24116	What is my driver license number ?
24117	What hotel in Jammu Hill-station would be safe for unmarried couples , without the harassment of police , hotel staff , and moral police ?
24118	What hotel in Munsiyari Hill-station would be safe for unmarried couples , without the harassment of police , hotel staff , and moral police ?
24119	What incident made you cry in public ?
24120	What made you cry in public ?
24121	When you use an AWS EC2 instance for less than an hour , are you charged for a full hour ?
24122	Can you purchase an Amazon on-demand instance for less than one hour ?
24123	Which are some of the best British movies ?
24124	What is the singular best British movie ?
24125	What are some things new employees should know going into their first day at International Bancshares ?
24126	What are some things new employees should know going into their first day at Merchants Bancshares ?
24127	How does a hang drum work ?
24128	How does the Hang music drum work ?
24129	What are the standard books for manufacturing process to crack IES ?
24130	How can I crack IES electrical 2016 ?
24131	How can I loose weight in a week ?
24132	How can I loose fat ?
24133	What hotel in Dehradun Hill-station would be safe for unmarried couples , without the harassment of police , hotel staff , and moral police ?
24134	What hotel in Mirik Hill-station would be safe for unmarried couples , without the harassment of police , hotel staff , and moral police ?
24135	What is difference between Catholics and protestants ?
24136	Christianity : What is the difference between Roman Catholics and Protestants ?
24137	Are you happy with the people around you ?
24138	Why will people be around you only when you are happy ?
24139	What does New York City do with their garbage ?
24140	Where does New York City's garbage end up ?
24141	What was the origin of Von Neumann Architecture ?
24142	What is von Neumann architecture ?
24143	Is there any permanent treatment of hypothyroidism ?
24144	Is there any permanent treatment for thyroid ?
24145	What is the best material for understanding algorithmic analysis by a newbie ?
24146	What math does a complete newbie need to understand algorithms for computer programming ? What books on algorithms are suitable for a complete beginner ?
24147	What are Donald Trumps Chances to be president ?
24148	What are the chances of Donald Trump becoming the President ?
24149	Does time end ?
24150	When does time end ?
24151	What makes people hate brahmins ?
24152	Why do some people still hate the Bramhin community in the 21st century ?
24153	`` What is it meant by'' `` bus jacking'''' in Kerala ?''
24154	Where should I stay in Goa ?
24155	Where are some great places to stay in Goa ?
24156	What happens if the next U.S. President resumes ban of Indian PM Modi's entry to the U.S. due to his religional massacre when Modi was a CM ?
24157	What will happen if PM Modi accepts Rakhi Sawant's proposal of banning ceiling fan to curb suicide ?
24158	What basically is big data ?
24159	What's big data ?
24160	How do bouncers spot a fake ID ?
24161	What happens if you get caught using a fake ID in Las Vegas ?
24162	What is the last thing you want to do before you die ?
24163	What are the things you want to do before you die ?
24164	Who is the most beautiful woman on Game of Thrones ?
24165	Who is the most badass Game of Thrones villain ?
24166	Which are the top 10 psychological thriller films ?
24167	What are some good psychological thriller movies ?
24168	Which book has taught you something valuable and important in life ? What lesson did you learn ?
24169	What is the most crucial lesson life has taught you so far ?
24170	Why are men cheats ?
24171	Why men cheat ?
24172	To what degree do authors censor their final manuscripts to purge violence , horror or disturbing content ?
24173	How often , or what's the rule used for 9gag or buzzfeed or upworthy to change the content of their related content on their sidebar ?
24174	What's the meaning of life ? (mathematically and logically)
24175	When is someone with an MBA more likely to get a job over someone with credentials like the CPA/CFA etc ?
24176	I have done MBA finance from india . Now got PR of canada . Should I do MBA or CPA or CFA or other certificate course to get good job in canada ?
24177	Does Airbnb have competitors ?
24178	Who are the competitors to AirBnB around the world ?
24179	Is in current times getting a job interview in unorganized private sector is impossible without giving money to placement consultants ?
24180	Could the Doctor use his Sonic Screwdriver to locate and remotely control the TARDIS ?
24181	Was 9-11 an inside job ?
24182	What is the best evidence that 9/11 was an inside job ?
24183	What is the most popular programming language in Asia ?
24184	What is the most popular programming language ?
24185	Did Caitlyn Jenner have SRS ?
24186	Has Caitlyn Jenner gone through gender reassignment surgery ?
24187	How do I gain 10 kg of weight ?
24188	How can I loss 12 kg weight in 3 month ?
24189	What is the most shocking thing you have ever seen ?
24190	What is the most shocking thing you have seen or heard ?
24191	Does cooked food become carcinogenic after storing overnight ?
24192	Can I leave a pot of freshly cooked food (like a soup or stew) overnight without it going bad ?
24193	Will a Trump Presidency damage the environment so much that we can never recover ?
24194	How concerned should I be about the environment with Trump as president ?
24195	Which is the best cream or what is the remedy to remove dark spots from faces ?
24196	What are some natural remedies for lightening skin and removing dark spots ?
24197	Does anyone still use monocles ?
24198	Do people still wear monocles ?
24199	Does steaming your face help acne ?
24200	Is steaming your face daily harmful ?
24201	How does it feel to get your first salary ? How did you spend it ?
24202	How did you feel when getting your first salary ?
24203	How is the University of Illinois Chicago for computer science undergraduate ?
24204	How is the University of Illinois , Chicago for a PhD in computer science ?
24205	What should I do to get a glowing skin ?
24206	How many liters of water does an astronaut need ?
24207	How much energy is needed to boil water ? How much energy would it take to boil 1 liter of water ?
24208	Is there any popular service similar to Quora ?
24209	Are there any websites that has similar functions as Quora ?
24210	Where is the Flipkart warehouse in Mumbai ?
24211	Does flipkart keep ay inventory in its warehouse ?
24212	Is iPhone 5s , iPhone 6 and iPhone 6 plus really worth the price ? I am using a Google Nexus 5 and should I go for the upgrade ?
24213	Is buying an iPhone 6 Plus worth it ?
24214	What are the best online resources ?
24215	What are some of the best online resources for writers ?
24216	How can I improve my English writing skills ? Which books do you suggest ?
24217	What is nuclear explosion ?
24218	What does a nuclear explosion smell like ?
24219	How do I know whether a person is lying ?
24220	How do I know whether person is lying ?
24221	What is the best book ever written about the Detroit Pistons ?
24222	What are some of the best basketball books ?
24223	How was Chinese and Japanese look before the nuclear attack ?
24224	How was Chinese and Japanese look like before the nuclear attack ?
24225	What are the most effective ways to study history ?
24226	Which one programming language one must master as a fresher for a job ?
24227	Is there (already) a factual proof that demonetization in India is Success/Failure ?
24228	Is the demonetization in India successful ?
24229	What is the difference between dominant and recessive alleles ?
24230	Why might some characteristics from both the dominant and recessive alleles be shown in an organism ? And why is this rare ?
24231	What are some mind blowing bike technology that most people dont know ?
24232	What are some mind-blowing bike inventions that exist that most people don't know about ?
24233	How is life in central engineering service roads ?
24234	What is the salary of an AEE in central engineering service ?
24235	Early Childhood Education : How do I start to teach my child to read ?
24236	How do I teach a child to read and write ?
24237	What is project Mausam ? Can it really be a counter strategy to the One Belt , One Road initiative of China ?
24238	What are the potential opportunities and challenges of China's Silk Road initiative (OBOR) for the BRICS cooperation ?
24239	How does one become a celebrity ?
24240	What is the easiest way to become a celebrity ?
24241	What do you hate that everyone else loves ?
24242	Why does everyone love me ? No matter what i do i still am being loved . What to do to make people hate me ?
24243	If given a choice , what would be the ONE thing from your past that you would change/remove ?
24244	If you could change one thing about the past what would it be ? Why ?
24245	How do I become a millionaire in IT ?
24246	How do millionaires think ?
24247	Was Steve Jobs at all technical ? Did he know how to code ? much math ? Or was he just a business guy ?
24248	`` Was Steve Jobs just an'' `` idea guy'''' ?''
24249	What's it like to be an uncle/aunt ?
24250	What does it mean to you to be an uncle or aunt ?
24251	Which religion does it exist before Christianity and Islam ?
24252	Which religion came first ? Christianity or Islam ?
24253	`` What is the first thing that comes to your mind when you hear the word'' `` Asia'''' ?''
24254	`` What is the first thing that comes to your mind when you hear the word'' `` Delhi'''' ?''
24255	Which is the best use of internet ?
24256	What is the best use of Internet ?
24257	How are the prime factors of 27 calculated ?
24258	How can you calculate the prime factors of 21 , and what is the mathematical importance of being able to do so ?
24259	What are the best internet business ideas ?
24260	How do I convert a string to integer array in Java ?
24261	How do I convert string array to string in Java ?
24262	How do I begin to understand human behavior ?
24263	How can I improve my skills in understanding human behavior ?
24264	What are the rules for Yahoo's fantasy hockey ?
24265	How do I join Yahoo! Fantasy Football 2013 ?
24266	If you believe earth is flat , how thick is the earth ?
24267	How thick would a flat Earth be ?
24268	What are some strategies for stopping a 9 week old puppy from biting ?
24269	What are some strategies for stopping a 6 week old puppy from biting ?
24270	How is a seismograph similar to the Richter scale ?
24271	How can one differentiate a seismograph and the Richter scale ?
24272	What are some of the must listen carnatic songs on flute ?
24273	What are some of the must-listen Carnatic Songs ?
24274	How do I get chiseled body from the chubby one ?
24275	What should I do to get a six pack with a ripped and chiseled body ?
24276	What are some famous and important examples of modern day heroes in Mexico ?
24277	What are some famous and important examples of modern day heroes in China ?
24278	How will Donald Trump becoming a president affect the Indian students who are trying to pursue their masters in America ?
24279	Is salicyclic acid more acidic than phenol ?
24280	Phenols are more acidic than alcohol ? Why ?
24281	If I am visiting Chennai , what are the dishes I should not miss ?
24282	Why isn't there a Nobel Prize for mathematics ?
24283	Why Nobel prize not awarded in mathematics ?
24284	How do you sell yourself on a resume ?
24285	How do you sell yourself ?
24286	What is the best way to learn internet marketing , i.e. SEO , analytics , conversion , etc. . ?
24287	What's the best way to get started in internet marketing ?
24288	How much is the White House worth ?
24289	Is there any job opportunity for Agricultural or Food Engineering either in govt or private sector ?
24290	What is the importance of the order of operations in math ?
24291	In mathematics , why does the order of operations matter ?
24292	How accurate is radiation dating ?
24293	How accurate is carbon dating ?
24294	Which Linux distribution is best for programming between Ubuntu and opensuse ?
24295	Between Ubuntu and opensuse , which is the best distribution for programming ?
24296	Noam Chomsky : Do you think our civilization will be able to bring about global justice in the near future or ever at all ? How can we achieve justice for all ?
24297	Do you think AK will ever become the PM of India in future ?
24298	Why do people commit suicide ? Can we stop it ?
24299	Why do people commit for suicide ?
24300	Why did Telangana secede from AN ?
24301	What would happen if a part of a colony seceded ?
24302	How hard is aipvt as compared to aipmt ?
24303	How big is the petcare industry (business) in India as compared to the USA ?
24304	As a third year btech student what should I do to start preparing for ias exam ?
24305	How can I start preparing for ias exam ? I have 4 yrs .
24306	Who is your least favorite character from Big Bang Theory ? If there is any , why ?
24307	What should I do if I want to talk with her but I really don't know what to say ?
24308	There's this girl and I really want to talk to her . Only I don't know what exactly to say . Do you have any examples of smooth things to say to her ?
24309	How long do you have to call the insurance company of the person who hit me before it's too late ?
24310	What was the position of life insurance companies before 1956 ?
24311	If I want to start my own business , but there are already few companies available to sell there franchise of the same business , which is better : start it myself or buy a franchise ?
24312	I want to start my own business , unsure if I should look into franchise or something on my own . Is franchise the safer bet ?
24313	What are the legal implications of food allergies ?
24314	Is the upcoming Redmi 4 Prime a good catch ?
24315	`` I know there is probably not a'' `` typical'''' day for a commercial real estate agent/broker , but could someone give me what a'' `` most typical'''' day might look like ?''
24316	What is a commercial real estate broker's day like ?
24317	How much does the average traffic light and street light cost to build and maintain in India ?
24318	How much does the average traffic light and street light cost to build and maintain in the USA ?
24319	Which system is better - collegium or NJAC ?
24320	Which system for appointment of judges is better , the old collegium system or the newly constituted NJAC ?
24321	Defloration : How does it feel for a girl to have a penis in her vagina for the first time ?
24322	Do you remember the first time as girl asked you to go down on her ?
24323	What do you do to overcome writer's block ?
24324	As a novice writer , what are some tips to get beyond writer's block ?
24325	Most innovation Android apps of 2016 ?
24326	What are most innovative Android apps of 2015 ?
24327	What is the best way to prepare for the exam of GRE ?
24328	What's the best way to prepare for GRE ?
24329	What is kitchen garden ?
24330	Is a kitchen garden a food garden ?
24331	What are the most upvoted answers on Quora ?
24332	How many tampons can you put in at once ?
24333	How do you put a tampon in ?
24334	2 . If the Universe was born at the Big Bang , what existed before then ?
24335	Are thick cast iron Tawas good for making dosa ?
24336	What's it like to work at NRG Yield for your first job ?
24337	What supplement is a good replacement to viagra ?
24338	What is the best otc supplement alternative to viagra ?
24339	`` I am a 20 year old guy and 1.65 m (5'' `` 4 ft) tall . How screwed Am I ?''
24340	`` I am 5' 10'''' tall and a 21-year-old guy . Am I short for these days ?''
24341	What is the in hand salary of RBI grade B officer now ?
24342	What is the impact that the 7th pay commission is going to have on RBI grade B (manager) salary ?
24343	What are major differences between Greek and Roman culture or government ?
24344	What's it like to be mistaken for being a different ethnicity than you actually are ?
24345	Do CS SRM Ramapuram students get good placements offer like KTR ?
24346	What are the placements and packages offered at the Ramapuram campus of SRM like ? Are they as good as that of the main campus ?
24347	Is Hinduism and Greek mythology related ? Are there similarities between the gods of both these religions ?
24348	What parallels can we draw between Indian & Greek Mythology ?
24349	How widely accepted are credit cards at small businesses and restaurants in Ecuador ?
24350	How widely accepted are credit cards at small businesses and restaurants in Jordan ?
24351	How can girls get rid of lice and nits ?
24352	How do I get rid of a stubborn case of head lice ?
24353	How do you enable emojis on an iphone ?
24354	How do you enable emojis in Android ?
24355	What are the pros and cons of convenience foods ?
24356	What are the pros and cons of convenience food ?
24357	Who is the best dressed Silicon Valley CEO ?
24358	What do Silicon Valley company CEOs do on the weekends ?
24359	What is dark matter in very basic terms ?
24360	What are some Birthday gift ideas for your Fiance who is 31 years old man ?
24361	What are some birthday gift ideas for a 13-year-old ?
24362	What should I do to get up early in the morning ?
24363	What is the best website ?
24364	What is the most important website ?
24365	How does a penis become erect ?
24366	Why do men get erect ?
24367	How is the WACC of Boeing calculated ?
24368	How much does a single tire cost for a 747 airplane ?
24369	What is the typical path to becoming a Hollywood director ?
24370	What steps should someone follow to become a Hollywood director ?
24371	Was Achilles a real character ? If so , how do we know he actually existed ?
24372	What are the powers of Achilles ?
24373	How do you see the decision of Karnataka government to give 100 % reservation to locals ?
24374	What is your view on Karnataka made 100 % reservation for local people ?
