25519	I want to code . Where do I start learning ?
25520	I am btech graduate ECE 28yrs . NOT GET PLACED.NOT ABLE TO ATTEND ANY INTERVIEW BECAUSE OF MY TENTION.WHAT TO DO ?
25521	Are Nasik and Hyderabad good place for work and a fun lifestyle ?
25522	How to Join Indian Army , After Engineering ?
25523	How do actors and actresses get paid ? What happens if the movie doesn't make a profit ? Do they still get their salary ?
25524	How do workers in non-profits get paid ?
25525	What Android apps should I develop ?
25526	What Android app would you like to be developed ?
25527	Who is Magnus Carlsen ?
25528	What is Magnus Carlsen's IQ ?
25529	Which is the best treatment for vitiligo ?
25530	What is the best treatment of vitiligo ?
25531	What causes yellow acne ?
25532	How do presidents pick their VP's ?
25533	Is Jesus God ?
25534	Is Jesus God or a prophet ?
25535	Is the Federal Reserve a public or private institution ?
25536	Why are American people not concerned about the Federal Reserve being a private organization ?
25537	How do I crack the Tech-mahindra aptitude test ?
25538	How should I crack tech mahindra online test ?
25539	How do I pronounce the letter's' ?
25540	`` How do you pronounce the letter'' `` i'''' and'' `` a'''' ?''
25541	What are some best short stories ?
25542	What are some really great short stories ?
25543	I'm having belly and can I get six packs in six months ?
25544	How can I get a six pack in a week ?
25545	How can I lose 30 pounds in 30 days with a workout plan ?
25546	What is the best diet to lose 30 pounds in a month ?
25547	How can I read my palm ?
25548	Could someone read my palm ?
25549	What habits , I can develop to avoid procrastination ?
25550	`` Is someone has'' `` timepass the memoir of protima bedi'''' pdf ?''
25551	What are some of the best criminal memoirs ?
25552	What is the future of Indian Air Force ?
25553	What will be the future of Indian Air Force ?
25554	Can Indians work for NASA ?
25555	How do I get a job in NASA from India ?
25556	What would happen if India and Pakistan merged ?
25557	What would happen if India and Pakistan reunited ?
25558	What are the best places to celebrate Holi in Karnataka ?
25559	What are some good places to celebrate Holi in Delhi ?
25560	Who is the best competitive programmer from Bangladesh ?
25561	Who are the best competitive programmers in Bangladesh now ?
25562	What would have happened to Jack and Rose if the Titanic hadn't sunk ?
25563	Why does everyone love Jack (Leonardo DiCaprio) from Titanic ?
25564	What kinds of body types do women prefer in men if they were to hit on you at the bar/on tinder - basically for a casual relationship ?
25565	What kinds of body types do men prefer in women ?
25566	Which is the best institute in Delhi for GMAT Coaching ?
25567	Which is the best institute for GMAT preparations in Delhi ?
25568	Why might some secular individuals be homophobic ?
25569	Why are some people homophobic ?
25570	I want jion ebiz it is best are n`t ?
25571	Is eBiz the best company for doing network marketing ?
25572	Can curry be made without turmeric ?
25573	Why do almost all Indian curries have so much turmeric and red pepper ?
25574	What should I do to motivate my friend ?
25575	How should I motivate my friend ?
25576	How do I get more views on YouTube for free ?
25577	How can I get more view and subscribes on YouTube ?
25578	How can I increase the page rank of my website ?
25579	What are some tips on how to increase rank in search engines ?
25580	What area of games programming is most mathematically involved and suited to a math major ?
25581	If one was to go about learning Python to be able to apply it to his area of study (Major in Chem minor in Math) , what applications of Python could be most useful when applying for a job ?
25582	Is it possible to get admission into a PhD program without a masters degree ?
25583	Can you get a PHD without a master or an official degree ?
25584	How painful is it to simulate and optimize a 4D construction schedule using BIM data and traditional tools like Revit & Primavera or MS Project ?
25585	Which industry or company use MS Project intensively ?
25586	What genre is Drake ? Is he pop ?
25587	Is Drake music genre pop ?
25588	Is Marketing-Hr a dual specialization good career option in PGDM course ?
25589	Is SSC a good career option ?
25590	What is the difference between Exception and Error in Java ?
25591	What is the difference between Errors and Exceptions in Java ?
25592	Is tricks4me.com scam ?
25593	Is AnnualCreditReport.com a scam ?
25594	How cold can the Gobi Desert get , and how do its average temperatures compare to the ones in the Chihuahuan Desert ?
25595	Where is the best place to look for startup investors in Europe ?
25596	Where is the best place to look for startup investors in the Netherlands ?
25597	How many seats do the Lok Sabha elections have ?
25598	How many seats are there in Lok Sabha ?
25599	When was computer used first ?
25600	What was the first personal computer ?
25601	How can I improve my ability of mental calculation ?
25602	How can I improve my mental calculation ?
25603	I am a house wife . I am 40 years old . How do I find jobs . I have an interest in social service . How do I find such a job for myself ?
25604	I'm 21 years old , can't find a job , and have a lot of free time on my hands . What should I do in the meanwhile ?
25605	How can I ask a question to a specific person on Quora other than the ones suggested ?
25606	I want to ask a question to a specific person on Quora , what I have to do ?
25607	Do batteries run out even if they are not being used ?
25608	Should the battery of a device be removed if it is not used for some time ?
25609	Can non-profit organizations pay a salary ?
25610	How do nonprofit organizations pay employees ?
25611	How does one subscribe to the printed version of magazines like American Mathematical Monthly or Crux Mathematicorum ?
25612	Where can I subscribe for magazines at a cheap price ?
25613	Is a double major in math and economics worth it ?
25614	Should I double major in math and economics ?
25615	Would a startup have the same success without the . com domain ?
25616	Can an online business be successful without a . com top-level domain ?
25617	What is a concentration gradient and what is it used for ?
25618	What is a concentration gradient and how is it used ?
25619	Which are some of the best hotels to stay in Stockholm ?
25620	Which are some of the best hotels to stay in Sweden ?
25621	How should I ask this girl out ?
25622	What are the benefits of buying an investment property ?
25623	What are the benefits of buying an investment property on an LLC ?
25624	Is Govt.of India is making big mistake by its decision to circulate INR 2000 bills ?
25625	What is the way to get such a website design ?
25626	What are some effective study and exam-testing habits or tricks that you would recommend ?
25627	How do nude beaches in Punta Cana compare to other nude beaches in Jamaica ?
25628	How do nude beaches in Punta Cana compare to other nude beaches in Haiti ?
25629	What licenses are required to start a mobile phone refurbish factory ?
25630	What licenses are required to start a mobile refurbish factory ?
25631	Why have so many people made fun of the song , Angel , by Tahir Shah ?
25632	Why did the band FUN stopped making songs ?
25633	What is a heat pump ?
25634	What is heat pump ?
25635	I have a crush on girl , but she lives far away from me and she is my long relative . What should I do ?
25636	How can I tell if a girl actually cares or thinks about me when she lives so far away ?
25637	Is hair on penis common ?
25638	Is penis hair common ?
25639	Rather , how many spiritual dimensions are there and what type of dimension is the Asral world ?
25640	Which country should I study Environmental science (bachelors) ? Germany ? Or India ? I am an Indian
25641	How can a girl know if a boy is interested in her , or would like to be in a relationship with her ?
25642	Can I take a leave of absence from my CS PhD to do an applied mathematics masters ?
25643	Can a CS undergraduate apply for an aerospace engineering master or PhD ?
25644	Are our thoughts and reactions controlled by genes ? In same situations different people react differently .
25645	Are our reactions controlled by genes ?
25646	Can two planets repel each other due to their magnetic fields or vice versa ?
25647	Can anyone give me the lyrics of ` Endukante Premanta' movie song (kicko gicko) translation in English ?
25648	Why is still India a developing country ?
25649	Why ia India still considered as a developing country ?
25650	What is resilience ?
25651	What is mental resilience ?
25652	How can I ask questions over here ?
25653	Which is the best Sherlock Holmes movie/TV series of all time ?
25654	Where can I find Koe no Katachi to watch ?
25655	What is the ultimate goal of science (as of today) ?
25656	What is the ultimate goal of Science ?
25657	How can I join India's intelligence agency RAW ?
25658	What is the general notion of people with respect to RAW officers ? What do people think of the persons that are working in an intelligence agency ?
25659	What are general questions asked for in an interview
25660	What are the basic questions asked in a job interview ?
25661	Do girls love blowjobs ?
25662	Why do some people enjoy giving blowjobs ?
25663	Are Indian nuclear scientists really being murdered ? Is the government of India investigating ?
25664	Why do nuclear scientists in India keep dying ? Why isn't the government or media requesting answers ?
25665	How can I install Google Play services in a BlackBerry Z10 ?
25666	How do I download and install Play Store on a Blackberry Z10 ?
25667	How can the ban of 500 and 1000 rupee notes increase the Indian economy ?
25668	How far is Hawaii from the nearest land mass ?
25669	What would the world be like if land masses were swapped ? Oceans are land and lands are ocean ?
25670	Harvard College Courses : What is general shopping advice for Armenian classes ?
25671	What are the tips and hacks for getting the classes that you want as a freshman at Jackson State ?
25672	What are the tips and hacks for getting the classes that you want as a freshman at Indiana State ?
25673	What's a way to last longer during sex ? (For guys) ?
25674	How do I last longer during sexual activity ?
25675	Are the Illuminati real ?
25676	Is ISIS Illuminati ?
25677	What is bad about dictatorships ?
25678	Why is a dictatorship bad automatically ?
25679	How many people in your own family have you had sex with ?
25680	From this description , how many times have I had sex ?
25681	Can we pursue biotechnology after B.tech in mechanical engineering ?
25682	What are career opportunities in companies after an M.Tech in production engineering with a B.Tech in mechanical engineering ?
25683	Is it possible to run a PC without a RAM ?
25684	Which games can my new PC run ?
25685	Which is the best place to visit in India during January with my best friend ?
25686	Which is the best place in India to travel in January ?
25687	How can I connect Tata Sky Set top Box to my WiFi Router to stream on my LED TV ?
25688	Can we use non Tata sky dish antenna for Tata Sky set top box ?
25689	What will be the impact of discontinuing Rs 500 and Rs 1000 notes ?
25690	What are the consequences of abolishing Rs 500 and Rs 1000 notes ?
25691	Trucks & heavy vehicles usually stands along road side in India thus reducing the actual driving space of road . Is it ethical ?
25692	What free online dictionaries / iPhone apps are there for Japanese that include pitch accent ?
25693	How will the ban of 500 and 1000 rs notes will affect land prices ?
25694	What are ethical dilemmas in the workplace ?
25695	What are ethical dilemmas ?
25696	How is time travel possible ?
25697	Could time travel be a real thing ? Could it be scientifically explained ?
25698	How does the flight crew know if your phone is in airplane mode ?
25699	Why there are no airplanes captured (filmed) in-flight mode ?
25700	What is the Lewis dot structure for acetone ? How is this determined ?
25701	How much is 1.8 lakh in dollars ?
25702	How much is 1 lakh Indian Rupees in US Dollars ?
25703	How can I effectively lose belly fat ?
25704	How can I lose body fat in my belly and chest ?
25705	What if you have counterfeit money but you don't know it and use it and get caught with it ?
25706	I am a CA Final student and want to leave CA but my parents do not allow me . They don't even want to talk to me on this topic . What should I do ?
25707	Who are Tesla's top competitors ?
25708	Who are Tesla's competitors ?
25709	What are the differences between dictatorship and a democracy ?
25710	What are the differences between a democracy and a republic ?
25711	Is gta 5 available for Android also ?
25712	Is GTA 5 available for Android ?
25713	What are the reviews for www.questionbrain.com ?
25714	What is your review of www.pointclicktailor.com ?
25715	What are some of the best YouTube workout channels for men ?
25716	Which are the best YouTube fitness channels for men ?
25717	What can I do for 7 days in pondicheery ?
25718	How much money do I need to travel around and in Tokyo for 7 days ? Can someone who's been there or lives there answer ?
25719	How can I perform telekinesis ?
25720	What is telekinesis ? How is telekinesis performed ?
25721	Why are there so many Gorkha rifles in the Indian regiments ?
25722	Why is there no 2 Gorkha Rifles in the Indian army ?
25723	How do I get a glow skin ?
25724	What is the future of SEO in 2020 ?
25725	What is the future of SEO in 2014 ?
25726	How can I make money online with free of cost ?
25727	How can I make money online for free ?
25728	What are your reviews of the iPhone 7 ?
25729	What is your review of iPhone 5 ?
25730	My rank in COMEDK 2016 is 1412 , will I get CSE in the top colleges ?
25731	My JoSAA 2016 merit rank is 18879 . In which top college and discipline can I get into ?
25732	What is your opinion about brexit ?
25733	Are Germans proud to be German ?
25734	Do non-Germans cook German food ?
25735	How I become beautiful like any girl ?
25736	How do I become a beautiful girl ?
25737	Which color temprature lights are used in most airport interiors ?
25738	What is the difference between primary colors and primary pigment colors ? Because both can be used to make new colors . Light is confusing me ! Help me !
25739	What's good song for a best friend lyric prank ?
25740	What are some good songs for a song lyric prank ?
25741	What are the things to look for before buying a laptop ?
25742	What are some of the things that I should look out for when buying a used laptop ?
25743	What shall I choose : BITS Hyderabad Manufacturing or NIT Kurukshetra Civil ?
25744	Shall I choose BITS Hyderabad Manufacturing over NIT Kurukshetra Civil ?
25745	What does the CVS in CVS Pharmacy stand for ?
25746	Does CVS still develop film ? Why or why not ?
25747	Is India preparing for war with Pakistan ?
25748	Is India preparing for a war ?
25749	What are some major social faux pas to avoid when visiting Samoa ?
25750	What is the best super power ? Why ?
25751	What is the best super power ?
25752	How do I download videos from unblocked site ?
25753	What are the functions of a DivX player ?
25754	What are your top ten favorite movies ?
25755	Which is the best book for geography in Hindi medium for the preparation of UPSC ?
25756	Ndls muv express max waiting list confirmations ?
25757	Why do/would you disable comments on your answers ?
25758	Why would a person disable comments on his/her answer ?
25759	How much money do you actually need to live like a millionaire as portrayed in the media ?
25760	How much money is needed per month to live in india ?
25761	Why do some completely straight forward questions get marked by Quora as needing improvement and what can you do about it ?
25762	`` What's the difference between'' `` How do you think'''' and'' `` What do you think'''' ?''
25763	What do U.S people think of TESOL / ESL major ?
25764	How does a B affect your graduate school application ?
25765	What are some of the best resume for graduate school applications ?
25766	What is the best way to stop being obsessed with something ?
25767	How do I stop being obsessed over something ?
25768	Why are there shariah law courts in non-Muslim countries ?
25769	Should Muslims in the U.S. be allowed to live and conduct their affairs by Sharia law and not by state or federal laws ?
25770	What would be the best thing to do when you are angry or depressed ?
25771	What is the best thing we can do when we are angry ?
25772	What are some things new employees should know going into their first day at EP Energy ?
25773	What are some things new employees should know going into their first day at CMS Energy ?
25774	How do I reduce my belly fat easily ?
25775	Does watching TV actually cause brain cells to die ? If not , does it negatively affect cognition in some way ?
25776	What is the best way to binge watch TV series without it affecting your brain ?
25777	Why Indians always compare themselves with Pakistanis ?
25778	Why are Indians always compared to Pakistanis ?
25779	What are the most ideal urban design or urban planning for your country ? Is it your country ideal for living already ? Put the reasons and solutions ?
25780	`` Should I write'' `` to give , to show and to influence'''' or'' `` to give , show , and influence'''' ?''
25781	What are the similarities between Darwin's Theory and Lamarck's Theory ?
25782	How do Lamarck's and Darwin's theories differ , and what does each theory postulate ?
25783	Am I just causing a problem with my girlfriend for no reason ?
25784	I'm feeling very alone because I just had a breakup with my girlfriend . I'm not getting out of it . How can I overcome this situation ?
25785	You are president of the United States . What will you do in the 4 or 8 years of your presidency ?
25786	What is it like to move away from home and live alone as an eighteen-year-old ?
25787	I am 25 years old and have found difficult to live alone in a big city . What should I do ?
25788	When did Ralph Lauren introduce the Polo Bear ?
25789	Where can I get cheap Ralph Lauren polo shirts online ?
25790	What is the best place to visit in Kerala in June ?
25791	Why doesn't HFDC Bank have a toll-free customer service number ? I have to pay every time I call .
25792	I could not pay 1 installment of a two-wheeler loan to HDFC bank on time . How do I pay the fine ?
25793	How many different religions are there in the World ?
25794	How many religions in the world ? Which one is right ?
25795	Can I rent my live/work space to a business ?
25796	What should I do if I want to learn dancing from the beginning ?
25797	How do you know when it's time to divorce ?
25798	When do you know if it's time to divorce someone ?
25799	If I ask all the class to pick a number below 20 and I would gift the person who picked 2/3 of the average response , what would you pick ?
25800	Can electrical and electronics grads can fill Indian NAVY form as a electrical grad ?
25801	How do I build traffic to my website ?
25802	Why are atheists so ready to say that if God exists , He must be a sadist ? Why so much anger against the `` nonexistent'' God ?
25803	`` Why do Christian conspiracy theorists argue against the'' `` All-seeing eye'''' from Illuminati when the eye is a symbol of Christian Trinity of God ?''
25804	Will the new Rs 2000 notes carry a nano GPS chip ? Will it really Help ?
25805	Is there really a chip embedded in the new Rupees 2000 note ?
25806	Why should I lose weight ?
25807	Why can't I lose weight ?
25808	What are some of the best places to visit in Kerala in a span of 5 days ?
25809	Which one is better Adreno 330 or Adreno 405 ?
25810	Which is better - NVIDIA or Intel HD graphics ?
25811	Would someone get in trouble if you started a rumor that lead to someone being hurt or killed ?
25812	Would you get in trouble if you started a rumor that lead to someone being hurt or killed ?
25813	Is it possible to accelerate the rate of brning fat from abdominal by using hot belts ? If yes suggest any brand ?
25814	`` Does the'' `` sauna slim belt'''' and similar products actually work ? Why ?''
25815	How do you repair the sole of a shoe ?
25816	How do you repair shoe soles ?
25817	How do I search Amazon product in Facebook ?
25818	How can Amazon product search be improved ?
25819	What should be standard Deviation ?
25820	What is standard of deviation ? Why is standard deviation used ?
25821	What are the table manners in the military ?
25822	What are some table manners at home ?
25823	How do I recover a Gmail account when I have the username and password , but don't have the recovery phone number or email or any other information ?
25824	How do I reset my Gmail password when I don't remember my recovery information ? 13 Answers
25825	I just bought Audio Technica M40X headphones , but I am not satisfied by their output . Do they just need some burn-in , or do I have to listen to high quality audio files , or do I need a headphone amplifier to overcome the low volume ?
25826	I'm new to cars . Do I need to buy amplifiers for my car audio ?
25827	Do hamsters eat nuts ?
25828	Can hamsters eat cheese ?
25829	How can I choose sd card as default storage for Huawei Asend G6 ?
25830	Is there a way to make my Sd Card as the default storage for my LG D415 ?
25831	How can I learn digital marketing ?
25832	What should I learn to become a great digital marketer ?
25833	What was the worst thing that happened to you for being nice ?
25834	Is there a cure for histrionic personality disorder ?
25835	Does my friend have histrionic personality disorder ?
25836	What are the funniest jokes / stories you ever heard ?
25837	Can a male love several females ?
25838	Is it possible for a man to love two women at same time ?
25839	How can I get more masculine ?
25840	How can one become more masculine ?
25841	Do you think Clash of Clans big boost sale is a response to competition from Pokémon GO ?
25842	What are some tips for my admissions interview with Washington and Lee University ?
25843	Is metaphysics real ?
25844	Is metaphysics a real field of study ?
25845	What is the admission criteria for Msc econometrics and mathematical economics in LSE ?
25846	Why did JFK invite Nazi pilot Hanna Reitsch to the White House ?
25847	If you had a time machine would you take a one way trip into the future or past ?
25848	If you had a time machine with one-way travel , would you go to the past or the future , and why ?
25849	Through which water or wire more current will flow ?
25850	In railways electrification work , which path is used for return of current when current flows from catenary wire to pantographs ?
25851	How do I know what martial art is right for me ?
25852	Do employees at Sierra have a good work-life balance ? Does this differ across positions and departments ?
25853	Do employees at PMC-Sierra have a good work-life balance ? Does this differ across positions and departments ?
25854	Which is the best headphone under 3K INR ?
25855	What are the best headphones under Rs . 3000 available in India ?
25856	What is the difference in Vmware workstation and Vmware vsphere ?
25857	How do I start VMware ?
25858	Does India posses anti ballistic missiles ?
25859	Do India have anti-ballistic missiles ? And if not ? Then Why ?
25860	What is the scariest paranormal experience you've ever had ?
25861	How can we make green tea ?
25862	How can I downgrade my windows 10 to the Windows 95 ?
25863	Where can I find the Windows 10 update ?
25864	What is the best open source application for LANDSAT image analysis & land classification ?
25865	What is the best open source application (+ tutorials) for LANDSAT image analysis and land classification ?
25866	What were the good qualities Adolf Hitler possessed as a political leader ?
25867	Was Adolf Hitler a better leader than Winston Churchill ?
25868	Which is the best question you've read on Quora ?
25869	What was the best Quora question ever ?
25870	Can I transfer money from a Paypal account when that Paypal account is not connected to a bank account ?
25871	How do I link a bank account with my PayPal account ?
25872	What are some tips for getting into a final club at Harvard ?
25873	How do I get into a final club at Harvard ?
25874	What are fun things to do with a battery ?
25875	What are some fun things to do ?
25876	Which is best university that offers a distant learning program for a MSc in Mathematics ?
25877	Which university offers a MSc in mathematics with a distance learning mode in India ?
25878	Events (leisure) : What's the difference between a conference , a trade show , and a convention ?
25879	What are the exact differences between full paper , short paper , poster and demo in a conference ? Is there any universal rule for these four types of publications' length , style , etc. ? Do these terms differ depending on a journal or conference ?
25880	How do I start the travel life ?
25881	How should one start traveling ?
25882	Can you divide infinity ?
25883	What is zero divided by infinity ?
25884	What are the fastest ways to increase height ?
25885	Does Volkswagen Passat 2004 have the AUX port ?
25886	Does the 2009 Pontiac G5 have an aux port ?
25887	Which is the best gaming laptop in 60000 Rs ?
25888	What is #define in C ?
25889	What does #define do in C++ ?
25890	Where can I get a database of family offices in the U.S. ?
25891	Where can I get a database of U.S. family offices ?
25892	Can people sealion unintentionally or does it require intention ?
25893	How prevalent is sealioning in online communities ?
25894	How long does it take to get an answer on Quora ?
25895	How long do I have to wait to get answers to my Quora questions ?
25896	Why did Mahmud of Ghazni plunder 17 times for gold ?
25897	Invasions : What kingdom did Mahmud of Ghazni plunder 17 times ?
25898	Who is the best Ronaldo or Messi ?
25899	Who is better - Ronaldo or Messi ?
