487370	How would I make a computer in nature ?
487371	What are some good hip hop albums like The Infamous by Mobb Deep ?
487372	Dial * @ == 1-877-778-8969==@* Zoho Customer Service PhoneSupport Number USA ?
487373	What is it like to be on the TV show ` Taarak Mehta ka Ooltah Chashma' ?
487374	What is meant by set piece goals , and which player is expert in it ?
487375	How do I set my goals for day ?
487376	Is numerology true ?
487377	Why do you think numerology is true ? Or why not ?
487378	If the kinetic energy of a body is doubled , what is the percentage change against linear momentum ?
487379	If the kinetic energy of a moving body is doubled , how does its linear momentum change ?
487380	How does the Berglas Effect magic card trick work ?
487381	How does magic of playing cards work ?
487382	Were Trump's children born via IVF or did he actually inseminate a woman ?
487383	Did Nehru actually love children or was November 14 just a fake (but successful) act of immortalising himself ?
487384	What are the best inspirational novels written by Indian authors ?
487385	What are some cool transparent iPhone 5 cases ?
487386	What are some cool iPhone 6 cases ?
487387	What is the corporate culture like at Charming Shoppes ? How is the culture different than other companies ?
487388	What is the corporate culture like at Vitamin Shoppe ? How is the culture different than other companies ?
487389	Which is the best Instagram auto like photos and unlike photos bot ?
487390	What are male escorts ?
487391	How do I join male escort services ?
487392	Does having a masters degree in psychology then give you the right to use it to abuse an individual ?
487393	Are there some online-archives for history papers ?
487394	How long was MapleStory in development for before its first release ?
487395	How do I download MapleStory for Mac ?
487396	What are some uses for Vmax and Km ?
487397	Sexual Orientation : How many Quorans consider themselves asexual ?
487398	If two founders start a company (a Delaware C corp) and then ultimately that company is dissolved , can an original founder start another by himself ?
487399	I am starting a company . I eventually want to make it a certified B-Corp . Should I start it as a C-Corp , LLC , or a different setup ?
487400	Are prepubescent animals harmed by sexual contact (physical contact) with the adult animal ?
487401	Why do dogs make eye contact with people unlike other animals of its species ?
487402	How much does it cost to set up a TV channel in India ?
487403	How much would it cost to set up my own cable TV channel in Bangalore ?
487404	How can I get 1st rank in UPSC civil services examination 2017 ?
487405	How will be the ranking system in UPSC civil services ?
487406	What does it mean when someone says I am a Salesforce developer ?
487407	I am a fresher , and I am working as a Salesforce developer . Is it good for a long term career ?
487408	What if we couldn't feel pain ?
487409	Can I unsend a Hangouts message ?
487410	Where does the back up messages get stored in hangout ?
487411	Do people who go on sites like MyProAna really have anorexia ?
487412	How do you know that you are approaching your anorexia nervosa level ?
487413	Can I invest in gold ?
487414	Should I invest in Gold Co. . ?
487415	What is the most special you have done for this Diwali ?
487416	Why this Diwali is so special for you ?
487417	What does it mean when a phone rings twice and then goes straight to voicemail ?
487418	How do I deal with the office politics ?
487419	`` What is a plot summary of the poem'' `` Song'''' by Lady Mary Wroth ?''
487420	`` What is the poem'' `` Singh Song'''' about and who wrote the poem ?''
487421	What is database environment in simple explanation with examples ?
487422	Do ants sense the sugar on top building like 10th floor and come there too ?
487423	What are all the ways to enhance the disruption potential of hardware startups ?
487424	Should I buy a Pentium 4 or Core 2 Duo ?
487425	How do I know my debit card account number ?
487426	Can you determine an account number from a debit card ?
487427	Would a flight between Helsinki , Finland and Los Angeles , California be profitable ?
487428	Why are there no direct flights between Helsinki to Los Angeles ?
487429	What is the difference between ceiling fan and wall fan ?
487430	Who is the bravest person on earth ?
487431	Why there is One Surgical Strikes by India ?
487432	How do I understand the periodic table in detail please . Actually I can't understand how to answer questions ?
487433	What are smelfies ?
487434	Is changing my lease accounting considered a change in accounting principles ?
487435	I am changing my major to accounting . Is that a good choice and in demand for workers ? Could I get a job easily ?
487436	How hard would it be to run iOS on a Android phone ?
487437	Is DBS Bank legal in India ?
487438	How can I contact DBS bank customer care ?
487439	What is the difference between the Los Angeles Police Dept (LAPD) and the Los Angeles Sheriff's Dept ?
487440	Where could I buy the clothes like what Dulquer Salmaan wears in the Malayalam movie Charlie ?
487441	Can anybody help me to become a friend of Dulquer Salmaan ?
487442	Is Gramblast.com the best place to buy Instagram followers ?
487443	Is a rhetorical question a question ?
487444	Is there a way to farm photogenic resins for 3D printers from plants (grow and process) ?
487445	What is an open source 3D printer ?
487446	What are some tips on making it through the job interview process at Coherent ?
487447	What are some tips on making it through the job interview process at Yahoo ?
487448	Are cross body bags also hand bags ?
487449	What are some pros and cons of voter ID in the US ?
487450	How can we address the Voter ID controversy ?
487451	Should drugs be decriminalised ?
487452	How can I verify the labor ethics of a company I'm buying from ?
487453	Which programming language that you used had the sexiest syntax and attractiveness ?
487454	Is a programming language all about syntax ?
487455	Which milk is best for a newborn baby , Friso , Similac or Aptamil ?
487456	What are the emerging technologies in IT , which promises a good salaried and early job ? And how many days of training are required to get command over it ?
487457	What is a privacy policy ?
487458	What is the privacy policy of Paytm ?
487459	Why would someone in Cupertino send their kids to Challenger for school ?
487460	Where do Asian kids in Sunnyvale go to school ?
487461	What do mainland Chinese think of Indonesia ?
487462	What do Mainland Chinese girls think of American Born Chinese ?
487463	Which is the best site for downloading anime ?
487464	What is the best site to download anime torrents ?
487465	What are the universities which offer Phd in Analytics ?
487466	Is China's CX-1 a threat to India ?
487467	How can I convert 120 ppm salycylic acid in 600 nanomoles ?
487468	How do I make real Thor's Hammer ?
487469	Is there an inpatient Drug and Alcohol Rehab Center in Plumas County California ?
487470	Is there an inpatient Drug and Alcohol Rehab Center in Mendocino County California ?
487471	What do you do about recruiters that consistently miss your scheduled phone meetings and don't get back to you ? Assuming you want the position they are advertising ?
487472	Which one is basic feature of prokaryotic cell ?
487473	What is the earliest mobile phone which would still work on one of today's cell networks ?
487474	What does TMZ stand for ? How did the show get its name ?
487475	What can I name my tv show ?
487476	Can I register online to become a teacher in Hong Kong ? Please help ?
487477	What is the difference between patience and passivity ?
487478	I have very shaky hands . Is there a camera that can reduce the amount of blurry shots I take ?
487479	Indonesian : Do our government really didn't make a simple research before make someone a minister ? Or they just simply didn't understand the law ?
487480	Where can I get fnb question papers of gyne n obs ?
487481	How do I attach my car in uber ?
487482	How and where do I contact the Uber Cabs office to attach my car with them ?
487483	Which is the most underrated English sitcom ?
487484	Which are the most underrated sitcoms ?
487485	How do I add a background image (located in the computer) in a HTML page using CSS ?
487486	Is it possible to add multiple CSS navigation bars on one HTML page and if yes , how ?
487487	What is the importance of the Southwestern Energy Company ?
487488	`` Star Wars (creative franchise) : How could Princess Leia remember her'' `` real mother'''' a'' `` little bit ,'''' when Padmé Amidala died in childbirth ?''
487489	What are the most interesting products and innovations that RCS Capital is coming out with in 2016 ?
487490	Have you ever felt called to ministry or a specific job by God . What did it feel like and how did you know for sure it was the right decision ?
487491	If I have $ 250 . How can I turn that money into $ 5k in 2 months ?
487492	How do you deal with temptations ?
487493	What are some ways to train the human mind to resist certain temptations ?
487494	Will there ever be a preferred energy source ?
487495	What are different sources of energy ?
487496	What is the difference between a company and a corporation ?
487497	Can we make a complete and functional brain using bioengineering and stem cells or similar ?
487498	What is Kinematic chain ?
487499	What is Kinematic pair ?
487500	What is the role of process executive-voice in cognizant ?
487501	What is the Cognizant One Portal test process ?
487502	`` What Xbox 360 games are'' `` not to be missed'''' ?''
487503	What Xbox 360 game should I buy ?
487504	What are the most played party songs in 2016 ?
487505	I'm not unhappy in my relationship but I want to end it , is this wrong ?
487506	What could Texas lawmakers do to lessen the mentally ill population in jails ?
487507	Can chikungunya be detected without blood test ?
487508	What are full grown blue heeler/beagle mixes like ?
487509	What is the worst thing about being an indian student ?
487510	What are worst things about being an Indian ?
487511	`` What is the best answer for the interview question'' `` Why should I not I hire you ?'''' ?''
487512	What are some fancy ways to order a drink at a bar ?
487513	What are the pros and cons between Prestashop and Magento for a simple marketplace site ?
487514	What are these brown spots on my skin ?
487515	What are the 3 biggest obstacles to world peace ?
487516	Why does my phone charge so slowly ?
487517	What are some subscriber related signaling functions ?
487518	How many subscribers are using WhatsApp in India ?
487519	How does Uber and Lyft ensure the safety of the drivers ?
487520	Is it correct to use the following sentence , we will keep you updated once we receive an update from team ?
487521	What the sentence should I use in the mail if I forgot to provide the update or communicate to someone in any matter since last many days ?
487522	What is black hat view count building technique for youtube ?
487523	Do you believe all rich people deserve to have more money than poor people ?
487524	How do I check my remaining Internet balance ?
487525	What's the best wireless sound bar for a TV ?
487526	Why is Detroit in such ruin , and is it really that bad to live there , or is it just media hype ?
487527	What is like to live in the city of Detroit in 2014 ?
487528	Why do people claim to stand for government by the people , but bash a non-government agent running for president ? It sounds 2-faced .
487529	Why is it easy for some people to answer a question in writing but not face-to-face ?
487530	What is the meaning of ULK in BMW ?
487531	How do I deploy web application in a private cloud open nebula ?
487532	What is refrigerant ?
487533	What is refrigeration ?
487534	Who is the best free website builder for online store ?
487535	Can a convicted criminal own a firearm in the USA ?
487536	Is there any hope for a INFP type of person in this world ?
487537	I love my childhood friend who is happily married . How do I move on ?
487538	I'm secretly in love with her . She's married to a childhood friend . I'm at the end of my rope . What should I do ? (See comments)
487539	Why did the Indian government reward surrendered Indian generals for saving their own life without firing a single shot in the India and China war in 1962 ?
487540	I am an Indian girl from a middle class family . I am going to be 28 years old next month . Currently , I am working as assistant professor in an engineering college , but I want to work in corporate . I am postponing my marriage for this sake and trying to get a job there . Should I stick to my decision , or for the sake of pressure from society and concern of my mother , must I get married ?
487541	Is there any problem if menstruation cycle completed before the exact period ?
487542	Why was child labor used ? How can this be stopped ?
487543	Some people consider me a shy person , but I don't think I am . Is that because of my introversion , or am I really shy ?
487544	Why do I feel good on 5 hours of sleep ?
487545	Why is it that I feel more awake and alert from sleeping 4 hours than I do when I sleep 6 hours ?
487546	What is the meaning of hello and why do people start a conversation on phone with hello ?
487547	`` How do I say'' `` hello'''' in Yakut ?''
487548	What are your biggest challenges as an IT consultant ?
487549	How can I love a dog ?
487550	How much can you love a dog ?
487551	Which type of nose I have ?
487552	What type of nose do I have ?
487553	`` What does it feel like to'' `` wife swap'''' with someone else ?''
487554	How does a man feel when his wife finds out he cheated ?
487555	If I , an adult man , can belt/strain up to C# 5 in my chest voice without mixing , am I a good tenor ?
487556	When tenors sing higher notes , are they USUALLY doing it in chest voice or mixed voice ?
487557	How do I solve this Rails problem ?
487558	Arrear fee in SRM ?
487559	What is the difference between chemotactic and chemotaxic movement ?
487560	What will be my basic pay from July 2017 after getting II MACP , presently my basic pay is Rs .68000 ?
487561	What are the health risks in losing 20 pounds in 4 days ?
487562	How do I contact PM of India ?
487563	Do DJs pay for the rights to play music ?
487564	Where and how do the DJs find and choose the proper music to play ? They're sometimes playing music from another producer or DJ .
487565	`` Where was'' `` Moonrise Kingdom'''' filmed ? How did that affect the movie's setting ?''
487566	`` What is exactly the theme behind'' `` Moonrise Kingdom ?''
487567	What did we learn about the movie `` xXx : Return of Xander Cage'' from the first trailer released in July 2016 ?
487568	What is the difference between TTA (JE) and JTO in BSNL ?
487569	Is BSNL JE (or TTA) a good job for a fresher ? What makes it better than an IT job ?
487570	When will the next edition of Introduction to Algorithms (CLRS) be fully published ?
487571	What was the hardest chapter to write in the Introduction to Algorithms book by CLRS ?
487572	Why is Donald Trump the only presidential candidate who refuses to release his taxes ?
487573	Who is Roald Dahl ?
487574	Who are some of Roald Dahl's influences ?
487575	Should I tell my best friend that I love her ?
487576	How do I mix video files in n automated way ?
487577	What should I choose bcom from styawati evening or bcom from aurobindo evening ?
487578	Can you guys identify this object ?
487579	Why do Democrats think it is alright to interfere in foreign country's elections , but are horrified when foreign countries interfere in the US ?
487580	Is the universe infinitely large ?
487581	How do I enroll for RHCSA exam ?
487582	How do I register for the RHCSA and the RHCE exams ?
487583	When you cough while smoking marijuana , does it really get you more high ?
487584	How is Duck Dynasty filmed ?
487585	Where was The River filmed ?
487586	What is the difference between Camel Blue and Camel Lights cigarettes ?
487587	What are the new Camel Crush made of ?
487588	Why does everyone in college sleep so late ?
487589	Do identical twins hit puberty at the same time ?
487590	What are the strongest majors in terms of job prospects and what are the weakest majors at Penn ?
487591	How do I learn Javascript at freecodecamp ?
487592	How will Donald Trump deal with Russia ?
487593	My favorite shows are Glee , Switched at Birth , and Pretty Little Liars . What other shows would I like ?
487594	What changes has to be done in Indian education system so that Indians can get medals in sports ?
487595	Does ginger really help to fight hair loss ?
487596	Does hair loss therapy really help prevent hair loss ?
487597	Which is more acidic : HClO4 or HClO3 ?
487598	Is there any way to download YouTube videos to watch later on an iPad while not connected to WiFi ?
487599	How can I download Facebook videos directly on my mobile device ?
487600	Why do SSD drives come with a low capacity compared to HDD although there is a big difference in price ? Is it worth going for it ?
487601	How much faster is the SSD Drive than a conventional HDD in actual use ?
487602	How long does it take to travel 1 km by bus ?
487603	I had sex the day before my expected period start date . I have yet to start my period 4 days later . How soon could I take a pregnancy test ?
487604	What is the best gift I can give my mom ?
487605	What does it mean if your friend dog follows u every where even home ?
487606	If you had a dream where your friend is offering you sex , does it mean anything ?
487607	What statistical testing/method can be used to test population medians ?
487608	How much do toucans eat in a day ? What do they eat ?
487609	Why do girls look at me and smile ?
487610	What did Dropbox offer to Guido Van Rossum ?
487611	What are benefits of listening Indian classical music ?
487612	What are the benefits of listening to classical music ?
487613	Is there a church like Redeemer NYC in the San Francisco Bay Area ?
487614	What are the best photography spots in the Bay Area ?
487615	How can I prevent myself from getting depressed by my father's views ?
487616	How do I prevent myself from getting depressed ?
487617	Why didn't the AAP win a single seat in Delhi ?
487618	How many calories are burn in stair climbing 150 stairs ?
487619	How many calories do you burn climbing 125 stairs ?
487620	Why does OAuth server return a authorization code instead of access token in the first step ?
487621	How do I make an OAuth 2.0 provider that doesn't need to store the authorization code and token ?
487622	What are Ferrero Rocher chocolates ?
487623	What is the best way to eat Ferrero Rocher chocolates ?
487624	Is Kerala a good place to visit during June ?
487625	Can a flip phone be hacked ?
487626	Would you get a flip phone ?
487627	On Lululemon's website , why are so many pants modeled together with New Balance shoes ?
487628	Are there any other pants like Lululemon ?
487629	How can we delay ejaculation ?
487630	What are the strongest majors in terms of job prospects and what are the weakest majors at the University of Bridgeport ?
487631	What does the ~ symbol mean in dialogue ?
487632	How do I get a job if I have a Microsoft certification ?
487633	How do Microsoft certifications like MCSE or MCS aid in getting a technical support job at Microsoft ?
487634	What do you call a person that is born with a penis and a vagina ?
487635	Is there any way of saving yourself from getting detained in college exams ?
487636	How do you stop yourself from panicking in exams ?
487637	How effective is ninjitsu in a street fight ?
487638	How effective is Aikido in today's street fights ?
487639	Why is Shanghai the center of the world ?
487640	Why is Shanghai not the center of the world ?
487641	`` What does this quote mean :'' `` The details are not the details . They make the design .'''' - Charles Eames ?''
487642	What are some of the coolest automotive design details you have seen ?
487643	How do you avoid making greasy potato chips ?
487644	What makes potato chips unhealthy ?
487645	What is so wrong with me ?
487646	What's the purpose of a protective tariff ? What are some example ?
487647	What's the purpose of a protective tariff ?
487648	Can you eat chicken left out overnight if you microwave it before you eat it ?
487649	If Allah is merciful then why would He burn sinned humans with fire for eternity in hell ? Cant' He show mercy ?
487650	Why doesn't Jackie Shroff do movies in the U.S. ?
487651	Why doesn't the U.S. call for a nuclear-free Middle East ?
487652	How can I stop thinking about the man I am so infatuated with who doesn't even care for me ?
487653	What are the trending topics in 2015 ?
487654	What are the trending topics ?
487655	What was your personal experience of McCarthyism in America ? What do you remember about this experience ?
487656	What time we can register SBI internet banking ?
487657	How serious is racism in Poland ?
487658	How serious is racism in Germany ?
487659	Can orthodox Jews be atheist ? Are there examples of debates about the existence of G-d in the Talmud ?
487660	How can I be sexy for my girlfriend ?
487661	What do you find sexy on your girlfriend ?
487662	Have you experienced Astral projection ?
487663	How can I become a cricketer in Canada ?
487664	How does the Russian SU-25 compare with the American A-10 ?
487665	Why isn't India joining the Syrian war ?
487666	How long can a milkshake last out of the fridge ?
487667	How are the rates calculated for unemployment benefits in Maryland and how is the process different in Vermont ?
487668	What are some concrete ways behavioral economics can help people become better investors ?
487669	What is the smallest increment of time ?
487670	Planc constant is the smallest what ?
487671	What do young people find attractive about joining ISIS ?
487672	What is NEET phase-1 and NEET phase-2 ?
487673	Are you appearing for NEET phase 2 ?
487674	What do you do if you want to get a law degree ?
487675	What is the shallowest reason for you to choose not to date someone ?
487676	Is Crocin an antibiotic ?
487677	Probability of tossing 5 coins ?
487678	If three coins are tossed , what is the probability of getting at least 1 head ?
487679	Solution of damped harmonic oscillation ?
487680	`` What does the'' `` each subject'''' in NDA previous year cut off signify ?''
487681	What are some new topics in computer science and engineering for seminar in final year ?
487682	What are the tips to get selected in AIIMS ?
487683	Can plants grow without sunlight ?
487684	How can we calculate oxidation states ?
487685	How can I learn to have good manners with everyone ?
487686	How do I approach a girl who is a stranger to me as I'm quite shy ?
487687	Which are the life-time top 10 songs ?
487688	What are the three main causes of unemployment in Asia ?
487689	What is it like to study abroad in Paris as a college student ?
487690	Why is it important for college students to study abroad ?
487691	Why is the keyboard alphabets are not in order ?
487692	Why is the keyboard not arranged in alphabetical order ?
487693	Which is a suitable solar panel installation provider near Sedona , Arizona AZ ?
487694	What made you so handsome ?
487695	How can Syrian refugees acquire driving license in turkey ?
487696	I am 16 y.o studing in 11th CBSE (commerce) lacking having good teachers and feeling depression thinking about my current studies . What should I do ?
487697	What Audio or Music Equipment/Device has the best quality ?
487698	How often should one eat at restaurants ?
487699	How many Instagram users are there in France ?
487700	How long can one survive in an airtight room of say 12 cubic feet ?
487701	Lets say that Roman Empire somehow avoided collapse and survived to this day , what would it look like ?
487702	How can we make computer think creatively ?
487703	What do I do if I have a long flight and I snore really loud ?
487704	What is the right way for a flight attendant to handle a person who is loudly snoring on the plane ?
487705	What is fourier transform and why we dont use Laplace transform instead of fourier both are having function of frequency ?
487706	Why is the Fourier transform still dominant till now despite featuring Z-transform and Laplace transform ?
487707	Which is the best 7-seater car in India under 20 lakhs ?
487708	Which are the best used cars under 10 lakhs in india ?
487709	Was Genghis Khan Chinese ? If yes , how and why did he convert to Islam ?
487710	Given the negativity of 90 % of questions and answers on Quora about Donald Trump , what % of them are posted or answered by Clinton's cyber army ?
487711	How can I get approval from fassi ?
487712	When you are agitated , would you prefer to just sit & close your eyes or switch off the light & lie down , to cool off and relax ? Why ?
487713	Why did Poland receive so much historic German territory after the world wars ?
487714	Did Poland have a navy at the time of the second world war ?
487715	I am in 10th grade , living in Central Europe , and want to move to the US . I am crying every day because I hate where I live . What do I do ?
487716	I am in second year of graduation but I don't like my course or life in this city (Delhi) . Should I return to my hometown and join college ?
487717	How much is $ 1.5 million in 1974 worth in 2016 dollars ?
487718	What are some good Hindi songs for annual function of kids ?
487719	What are some good Hindi songs for annual function of school ?
487720	How does thyroid hormone affect protein turnover rates ?
487721	How does my metabolism affect my heart rate ?
487722	Has crowdfunding ever worked in india ?
487723	Who decides on the seating arrangement of world leaders at global summits ?
487724	What are the rules that decide the seating arrangement of world leaders in a big summit ?
487725	Will there be any problem if both the husband and the wife are of the same blood group (B +) ?
