test-615399	How many seats will AAP win out of 21 if bypolls are held? If AAP performs poorly, will this have any impact on Punjab or Goa elections?
test-615400	How can we sell homemade food in India online?
test-615401	Why is nobody selling Thai street-food in India?
test-615402	What is the sweetest thing a kid has done for you?
test-615403	What is the sweetest thing your mother does for you?
test-615404	Where can I find luxury footwear for men in Sydney?
test-615405	Where can I found luxury designer men's shoes in Sydney?
test-615406	What is the scope in Australia after masters of physiotherapy in sports in India?
test-615407	What are the future opportunities for production and industrial engineers?
test-615408	I deleted Facebook and whatsapp to focus, but I spend a lot of time on Quora and Stack Overflow now. Is it equally bad?
test-615409	Why would the pill clear your skin just by preventing ovulation, even if your blood-hormone levels were normal?
test-615410	What can I do after being charged a fee for farting in an Uber?
test-615411	My gre score is 302 v-140 q-162 awa-3 want to apply for ms in statistics please give me a list of university which adjust with my profile?
test-615412	What should I eat if I'm 24 years old?
test-615413	Practising law in hongkong as international lawyer?
test-615414	How do I install Windows 10 on my Asus laptop while having a free DOS?
test-615415	I wasn't able to download AutoCAD on my Windows 10 laptop. What should I do?
test-615416	How do I overcome erectile dysfunction due to over masturbation?
test-615417	Can erectile dysfunction due to smoking be cured?
test-615418	What are the best design suggestion for Indian ecommerce website such as pokyshop.com?
test-615419	What are some of the best designed ecommerce websites?
test-615420	How do I have sex for a long time?
test-615421	What I do for long sex time?
test-615422	How do you overcome being shy?
test-615423	How should I overcome my shy nature?
test-615424	Which is the best networking training institutes in pune?
test-615425	Which is the best networking training institute in Jaipur?
test-615426	Whats the best way to loose weight?
test-615427	What are the best way to lose weight and remain healthy?
test-615428	Which is the best university for distance education for MBA in Bangalore ?
test-615429	Which is the best university for an MBA in correspondence? NMIMS, Symbiosis or any other?
test-615430	What is/was your favorite class in high school and why?
test-615431	What are the best classes in high school?
test-615432	What are some metaphors embedded in The Life of Pi - The Movie?
test-615433	Should I read Life of Pi?
test-615434	Why do planets have gravity?
test-615435	What is the cause of earth's gravity?
test-615436	How does the HP OfficeJet 4620 Airprint compare to the HP DesignJet T520 36-in Printer?
test-615437	How does the HP OfficeJet 4620 Airprint compare to the HP LaserJet Enterprise 700 Printer M712dn?
test-615438	What's the penalty for driving a right-handed car in the US?
test-615439	Why do USPS vehicles have right hand drive?
test-615440	What should I take IIT Tirupati CSE or BITS Goa CSE?
test-615441	What should I choose between IIT Mandi civil and Bits Goa Cse?
test-615442	If I block people on WhatsApp, can they see my display picture?
test-615443	Can the other person see my DP on whatsapp after I've blocked him?
test-615444	Why don't we use satellites more than undersea optical fibre cables?
test-615445	Can you merge fibre optics cables, like two roads merge into one? What happens if the diameter of the fibre optic cable changes?
test-615446	How do you start a blog?
test-615447	How do you start a blog and make it popular?
test-615448	How long can you keep homemade vegetable soup in the fridge?
test-615449	How long can KFC be kept in the fridge for?
test-615450	What does it mean when a man says, I think I finally found the one?
test-615451	What does one really mean when they say that beauty is only skin deep?
test-615452	I got 126 marks in JEE MAINS and 95.4 in IPE will I get seat in sastra university?
test-615453	Is it weird to find someone unattractive because he chews with his mouth open?
test-615454	What are some examples of non-solvents?
test-615455	What are some examples of nonprotic solvents?
test-615456	Can banks buy treasury bills?
test-615457	What is a treasury bill?
test-615458	"What is the difference between ""Hearing Handicapped"" (HH), ""Partially Deaf"" (PD) and ""Fully Deaf""?"
test-615459	What is it like to be the only Deaf person in a hearing family?
test-615460	Did JFK really sneak Marilyn Monroe in the White house?
test-615461	Did the Clintons really steal items from the White House when they left?
test-615462	To Men: Do men still hand out their number and ask you to call them? Old school chivalry or obvious player?
test-615463	Do you think polygamy for men would prevent them from cheating and would make a healthier family by giving men a chance to get out of boredom?
test-615464	Would the world be a better place if there were less people?
test-615465	Would the world be better off without religion?
test-615466	What's the difference between a 110 outlet and a 120 outlet?
test-615467	What happens when a 15 amp outlet is used on a 20 amp circuit?
test-615468	Why didn't Sasuke have the normal pair of Rinnegan? What's the difference between the one he has and the one possessed by Madara and Hagoromo and Nagato?
test-615469	What does Zetsu mean by saying that Madara was his will? Wasn't Zetsu created by Madara?
test-615470	What is the best way to invest 100$?
test-615471	What is a good way to realistically invest $100?
test-615472	Why is the price of petrol different in different cities in the same country, specifically India?
test-615473	Why are petrol prices rising in India?
test-615474	How do I know whether I should use PostgreSQL or a graph database like Neo4j?
test-615475	Which companies use Neo4J?
test-615476	Which approach is better to solve dynamic programming related questions in coding interviews, top-down or bottom-up?
test-615477	How do I find an Euler Circuit in a graph in linear time?
test-615478	Why do gods exist instead of not existing?
test-615479	Is there a God?
test-615480	How can I write argumentative essay in poetry?
test-615481	What is the best way to write an argumentative essay?
test-615482	What are the best methods to learn a new language?
test-615483	Which are the best methods to learn a language?
test-615484	Life Lessons: How powerful is our subconscious?
test-615485	People say what we see in our dreams is actually our subconscious wandering. Do the repetitive occurrences of certain life forms like lions, tigers, snakes or rivers or mountains, etc. have some symbolic message to convey?
test-615486	I found out that other guys are flirting with my girlfriend, and she is allowing them to continue to do the same, even though I know she loves me a lot. What should I do?
test-615487	I love a girl how do I know if she feel same way to me even if we see each other and talk everyday?
test-615488	I drove through an EZ Pass toll on I-95 North in Maryland. My account was in good standing, my transponder was working properly. Why is it my responsibility to pay the tolls if the EZ Pass sensors fail to read my transponder?
test-615489	Will an EZ-Pass toll road transponder (RFID device) work anywhere inside of a vehicle?
test-615490	Which coaching center is the best for the Pg medical exam? What about Hyderabad IAMS?
test-615491	How good will be satellite coaching for medical pg entrance exams?
test-615492	What is attractive to guys?
test-615493	Why do some people look more attractive than others?
test-615494	How do hackers hack a network?
test-615495	How do hackers hack banks?
test-615496	Which one is better - Mechanical at MIT, Manipal or CSE at UPES, Dehradun?
test-615497	Between MIT, Manipal and UPES, Dehradun which is better for chemical engineering?
test-615498	How can I make money via YouTube?
test-615499	How can we earn money on YouTube?
test-615500	How can I masturbate as a transgender woman?
test-615501	How can I masturbate as a transgender woman without feeling bad?
test-615502	Hypothetical Battles: If every nation in the world allied and attempted to invade and conquer the United States, would they succeed?
test-615503	How would you invade the United States?
test-615504	Why are iPhone software updates so large in terms of file size?
test-615505	Why don't the iPhone app updates show the file size?
test-615506	What is the difference between whiskey, bourbon, scotch and rye?
test-615507	What is the difference between wheated bourbons and other bourbons?
test-615508	Is water a compound or an element?
test-615509	Is water a compound or a molecule?
test-615510	What are some best Pokemon Go cheat codes?
test-615511	What are some of the best Pokemon Go hacks?
test-615512	What is the best gift for a teenage girl who loves makeup?
test-615513	What are the gifts that are good to give to the teenage girl I really love?
test-615514	Why do people drink alcohol in a brown bag in America?
test-615515	Where in America are you allowed to drink alcohol in public/on the streets?
test-615516	Is Narendra Modi changing India?
test-615517	Is Narendra Modi capable of changing India exactly like what he did for Gujarat?
test-615518	How do I stop getting stretch marks from weight lifting?
test-615519	How can I remove stretch marks caused by weight lifting?
test-615520	Since Modi and Indian government has declared to void 500 and 1000 notes, how would this affect Indian economy and real estate?
test-615521	What will be the effect of banning 500 & 1000 rupees notes on the real estate?
test-615522	How do you really know the difference between love and lust in a relationship?
test-615523	How do you know if is that just a love or lust?
test-615524	How do I Financial Projections and Analysis?
test-615525	What are all the files that we can identify in trace file?
test-615526	Why is the sea water salty?
test-615527	Why is sea water salty but not lake and river water?
test-615528	Could this universe be inside a black hole?
test-615529	Can there be an universe inside a black hole?
test-615530	What is the best advice you can give to an 18 year old?
test-615531	What is the best advice you can give to a 17-year-old girl?
test-615532	How do I stop feeling like an embarrassing wreck?
test-615533	Who are these mathematicians/authors referred to in the jokes `Proofs that p'?
test-615534	What is the name of the tool used to measure mass of an object?
test-615535	What are the tools used to measure mass?
test-615536	I have a film story.How should I legally register it to avoid producers stealing my Idea?
test-615537	Can mania cause you to panic?
test-615538	What are the best websites and apps to know about marathon/running?
test-615539	Where can I find free source to learn more about digital marketing?
test-615540	What books should we prefer for IES?
test-615541	What are some recommended books for IES?
test-615542	What is the best way to increase revenue online?
test-615543	How can I increase my revenue?
test-615544	How much money does the owner of slither.io make?
test-615545	How does that game slither.io work?
test-615546	What is Avatar: The Last Airbender about?
test-615547	How does Avatar: The Last Airbender end?
test-615548	Why do most people want to be rich but don't do anything about it?
test-615549	Why do super-rich people want to get richer?
test-615550	Who is the inventor of C programming?
test-615551	Who is the inventor of the engine?
test-615552	What is the most racist thing you've heard from a non-White?
test-615553	What's the most unintentionally racist thing you have ever said or done?
test-615554	How do I prepare for Google Summer of Code (see details)?
test-615555	What should be procedure to prepare for Google Summer of Code?
test-615556	Which post can 12th pass apply for MNC companies in Mumbai?
test-615557	How do I reply to an employer that delayed my start date?
test-615558	Is it possible to hack someone's linkedin account?
test-615559	How can I hack into someone's live.com account?
test-615560	If you had to choose between being intelligent and being kind, what would you choose?
test-615561	How do I practice for logics and solve ioi problems?
test-615562	"How is the word ""accosted"" used in a sentence?"
test-615563	"How is the word ""calumny"" used in a sentence?"
test-615564	Do you know if Proofpoint/Cisco IronPort have the capabilities to stop and prevent massive defamatory emails?
test-615565	What is Cisco IOS?
test-615566	Who are these actors and what movie is this? (img here)
test-615567	Who are these actors and what movie is this? (img included)
test-615568	What are all the lane disciplines that we can follow on a NH in India?
test-615569	What are the measures to be taken so that we can make India a developed country?
test-615570	What is the reservation criterion in UPSC exam?
test-615571	What is the criteria for appearing for a UPSC exam?
test-615572	Which is best camera phone under 15000?
test-615573	Suggest me a Good Camera under Rs.15000?
test-615574	I am already using Reliance Jio SIM card. How to check data usage on the same ?
test-615575	How can I procure a Reliance Jio sim card for Moto X Play?
test-615576	How should I prepare for PSAT?
test-615577	What are the best ways to prepare for the PSAT?
test-615578	What is the English translation of the Hindi phrase “Aao Naa” ? Is there an English equivalent of the often used “Naa”?
test-615579	Who have received mail regarding fasttrack program from Infosys?
test-615580	How are lions and tigers crossbred?
test-615581	How genetically similar are lions and tigers?
test-615582	How do I increase Gre score FRom 294 to 310 + in 3 days?
test-615583	Hypothetically, what would happen if all of the currency in the world became equal overnight?
test-615584	What if my girlfriend still talks to her ex?
test-615585	What should I do my girlfriend talks with her ex boyfriend?
test-615586	Can a husband sacrifice his wish for the wife?
test-615587	Why indians get bald when they migrate to uk?
test-615588	What are the best places to manufacture wood product?
test-615589	How can I best care for a solid oak wood table? Are there any recommended products?
test-615590	When can Indian Army officers go for higher studies?
test-615591	How much does an officer in the Indian Army earn?
test-615592	Which is the first Kannada ‘padya’(Poem) and ‘gadya’(Prose)?
test-615593	How do I learn Kannada easily?
test-615594	What does anal sex feel like?
test-615595	When two men have anal sex, does the one receiving it feel orgasm?
test-615596	"Is the ""The Flat Earth Society"" right in saying that the world is flat?"
test-615597	Is the Earth flat?
test-615598	Is modern computer technology too great for our attention spans?
test-615599	"Do you like my Nick name ""ZHK Blue Rose""?"
test-615600	"Is there any particular word to describe the action of an insect rubbing its ""hands""?"
test-615601	Flies: Why does a housefly appear to be rubbing its hands shortly after it has settled on a surface?
test-615602	How was this differentiated?
test-615603	How do I differentiate something like this?
test-615604	What are the important aspects to keep in mind before you hire mobile app developer?
test-615605	What is the determination of Young's modulus for a material?
test-615606	If I turn my phone on Airplane Mode, will I receive any SMS messages that were sent to me, when I turn it back on?
test-615607	"If you call someone's cell phone number, and they have their phone set to airplane mode, will you receive a message saying, ""The number you are dialing is not valid.""?"
test-615608	How can I get over breakup?
test-615609	Dating and Relationships: How can I get over a break up?
test-615610	I got 1606 rank in JEE advanced 2016, what are the options for me?
test-615611	I got 25799 rank in JEE advanced 2016, are there any options for me?
test-615612	Which food gives most strength to my bones?
test-615613	How do you uninstall FrostWire from your PC? What are some examples?
test-615614	When was the last time you laughed, really laughed?
test-615615	When was the last time you laughed and why?
test-615616	Where can I find a database (table (for example a .xls)) with all the monuments/landmarks in Europe and their addresses (or GPS coordinates)?
test-615617	Is there a public or commercial database of GPS coordinates of landmarks, such as monuments, parks, tourist sights etc.?
test-615618	How did critics react to the ending of La La Land?
test-615619	Why did Damien Chanzelle choose to end La La Land they way he did?
test-615620	Is AlCl3 a covalent or ionic compound?
test-615621	What kind of chemical bond is CaCl2? Is it ionic, covalent, or both?
test-615622	What is the pk box office calculation?
test-615623	What is the Baahubali box office calculation?
test-615624	Exam Form not filled for CPT DEC 2016 and Want to appear the same?
test-615625	Which quality of mine do you love most?
test-615626	How do I improve my English communication skills?
test-615627	How can I improve my English communication skill?
test-615628	Can I go to heaven if I sinned?
test-615629	Why don't sinners go to heaven?
test-615630	Is an iMac good for gaming?
test-615631	What is the best iMac for gaming?
test-615632	What is Scala?
test-615633	What is Scala used for?
test-615634	What is the relation of body temperature and metabolism?
test-615635	How is the heart rate related to the metabolism?
test-615636	What are the subjects in civil services examination?
test-615637	What are the optional subjects in civil service?
test-615638	How can I play when encountering a tie or a slur on the piano score?
test-615639	Is this a tie or a slur?
test-615640	Why do people tell me to be more like my friend?
test-615641	How do I tell my friend I like him as more than a friend?
test-615642	How can I attract a white guy if I'm a black girl?
test-615643	What tips/advice would you give a black girl looking to attract white guys?
test-615644	What things are required in hostels of HBTI Kanpur?
test-615645	What are the hostel rules at HBTI Kanpur?
test-615646	How long does it take for someone to recover after surgery?
test-615647	How long does it take to recover from surgery for cervical radiculopathy?
test-615648	I recently came into some money, but why won't the dealer sell me a Ferrari?
test-615649	I won't get money until wednesday, and I am totally broke. What can I do to not starve?
test-615650	How can I improve my spoken English?
test-615651	How do one improve communication skills in English?
test-615652	How much is saved by tdd?
test-615653	What is the best instructions to make a page in Facebook for an offline company to achieve more benefits for the company?
test-615654	Why are there so many religious holidays between November and January?
test-615655	Which programming language is FLICKR written in?
test-615656	What is the best to impress girl by the way of profile picture?
test-615657	What is the best way to impress a girl?
test-615658	What do native English speakers think when talking to someone who cannot speak English very properly?
test-615659	What do English native speakers think when non-native speakers make grammatical errors?
test-615660	Why does it sometimes feel like my car is speeding up when I brake?
test-615661	Why is my car not picking up speed after a complete stop?
test-615662	When is it appropriate to decorate for fall?
test-615663	Fall is here and that means new decor! What is the best way to pull off a wreath like this for the front door and how do I make one?
test-615664	How can I increase my penis?
test-615665	How do I enlarge your penis?
test-615666	What are some genuine job consultancies in Chennai, which deal with the aeronautical domain?
test-615667	What are some genuine job consultancies in Chennai, which deal with the automobile domain?
test-615668	How is Wipro GIS and choosing career like as a project engineer at Wipro?
test-615669	What is Wipro GIS?
test-615670	What are the differences between Two-way data binding vs. reactivity?
test-615671	How do I communicate between two HTML pages?
test-615672	What is the best way to invest 500K, for a 53 years old, with no job qualification?
test-615673	What is the problem a person can face if he is the only son of his parents?
test-615674	Why Indian flag is called 'Tricolor' when it actually has 4 colours (Saffron, White, Blue & Green)?
test-615675	If blue is for sky and green for grass then, why do we have the colours black and white for?
test-615676	What should I do to learn English fast?
test-615677	How can I be perfect in English language?
test-615678	How do you delete a private message which failed to send on Snapchat?
test-615679	If you delete your account on Snapchat, will the conversations you had be deleted? Can I delete my account entirely so they can't see the saved messages?
test-615680	What are linear and non linear elements?
test-615681	What are linear and non-linear physics?
test-615682	Is Modi government a failure already?
test-615683	What are the failures of the Modi government?Why dont his supporters accept this?
test-615684	Why do people ask questions on Quora before checking on Google?
test-615685	Why do so may people ask questions on Quora that can easily be found by a simple Google searh?
test-615686	What is the best pop up or pop under ad network?
test-615687	What are the best pop ad networks?
test-615688	Do all hermit crabs have small and big claws?
test-615689	Why do hermit crabs have small and big claws?
test-615690	If humans aren't meant to eat animal food, why are we able to digest it?
test-615691	If we aren't supposed to eat meat why can we digest it, absorb its nutrients and find animals tasty?
test-615692	"Why is my WhatsApp saying: ""unable to connect, error occurred while opening""?"
test-615693	Whatsapp opened a blank chat with someone saying this chat is encrypted. Can my contact view said chat on his phone if I did not start a conversation?
test-615694	How does barium nitrate and sodium hydroxide react?
test-615695	How does acetic acid react with sodium hydroxide?
test-615696	How do telomeres protect chromosomes?
test-615697	How can human telomeres be protected?
test-615698	Will my parole officer find out that I was pulled over and no ticket was issued?
test-615699	Will my probation officer find out I was involved in a traffic stop if no ticket was issued?
test-615700	"In French, how do you say ""I love to dance""?"
test-615701	How do I say I will always love you in French?
test-615702	The Chicxulub impactor must have produced a huge earthquake. If we were to estimate it's magnitude. How much would it be?
test-615703	Can daughter claim share on her fathers ancestrol property? And how can prove that property is ancestrol property? (I am an indian muslim)
test-615704	Is the mafia still powerful in the USA?
test-615705	Which is the most powerful mafia in USA?
test-615706	How do you know when someone really loves you?
test-615707	How would one know if love is real?
test-615708	Can bread flour be used for baking pancakes?
test-615709	Can you make pancakes without flour?
test-615710	How do I start anchoring a cultural event?
test-615711	What are the recent events that reflect the culture we live in? (India)
test-615712	What are some famous movie scenes including sunglasses?
test-615713	What are the best opening scenes in film history?
test-615714	Where is the wrench icon on Google Chrome?
test-615715	Why is the Google Chrome icon blurry in Mac?
test-615716	How do I improve my vocabulary of english?
test-615717	How do you improve your English vocabulary?
test-615718	Which country is generally thought to have the most attractive men and women: England, France or Germany?
test-615719	What are top 20 business listing sites in india?
test-615720	Where can I get some good online marketing case study competitions?
test-615721	What Should You Do If Someone Threatens To Sue You?
test-615722	Does falling in love with a person of the same sex make me gay, even if there is no desire for sex?
test-615723	Is it possible to love a person of the same sex even though you are straight?
test-615724	How can I unfollow everyone I'm following on Instagram?
test-615725	How do I know why I was blocked from Instagram?
test-615726	How do I claim house of Marley warranty in India×?
test-615727	Why is Bob Marley famous in India?
test-615728	Is www.socialtrade.biz a scam?
test-615729	Is amazonsecrets a scam?
test-615730	Is rusting an exothermic reaction? Why or why not?
test-615731	Why is neutralization an exothermic reaction?
test-615732	Is there a way to upload planned Google maps routes (planned online) to Endomondo?
test-615733	How can I manually lock the iPhone in Endomondo app?
test-615734	What are your views on the Rs 500 and 1000 notes scrapping decision taken by PM Narendra Modi?
test-615735	What do you think will be the effect of Modi Government's decision of invalidating the RS 500 and RS 1000 notes?
test-615736	Does Cambridge still look at UMS (module grades)?
test-615737	Which college other tha gb pant will be nearest from Faridabad?
test-615738	Is it OK to drink water right after eating sweets like ice cream or chocolates?
test-615739	Is it OK to drink carbonated water during a heavy workout instead of plain water?
test-615740	What is the best option for BiPC students other than an MBBS?
test-615741	What are the best courses for bipc students?
test-615742	Has someone ever cured premature ejaculation?
test-615743	How do I cure premature ejaculation?
test-615744	What are some alternatives to library.nu?
test-615745	What will be the best alternative to Library Genesis, now that Library Genesis is under legal trouble?
test-615746	What is the corporate culture like at GAIN Capital? How is the culture different than other companies?
