27062	What are the changes made in elliptical trammel from it's beginning to end ?
27063	What is the best conclusion for why marijuana shouldn't be legalized ?
27064	What's the best argument AGAINST legalization of marijuana ?
27065	What are the best sites to buy Twitter followers ?
27066	What is the best service to buy Twitter followers ?
27067	How many people do not believe in the moon landing , space travel , satellites , the ISS , the ball earth , evolution ?
27068	How can you prove the images of the Apollo Moon landings were really taken on the Moon , and not on Earth ?
27069	How much catfish is safe to eat during pregnancy ?
27070	How safe is eating catfish during a pregnancy ?
27071	How did Enlightenment thinkers influence the ideas of the Constitution ?
27072	What Enlightenment ideas can be found in the United States constitution ?
27073	How do I start coding in C ?
27074	Are entrepreneurs born or made ? What's your reasoning or evidence ?
27075	How did you decide to become an entrepreneur ?
27076	What are your views about the recent decision of the government to bring new notes of 500 and withdraw the old notes of 500 and 100 ?
27077	Who are the most successful self-taught tech founders ?
27078	Who are the most successful sole founders of tech companies ?
27079	What is the story behind Rahul Gandhi's statement ` Khoon Ki Dalali' about Prime Minister Narendra Modi ?
27080	Why is Rahul Gandhi accused Narendra Modi for ` Khoon Ki Dalali' ?
27081	Can Jio barcode can be generated twice ?
27082	Will Reliance jio work without the barcode ?
27083	Which martial arts should I learn to beat 3-4 muscular at same time ?
27084	What are some good office plants that require no sunlight ?
27085	Why would a person go insane ?
27086	What causes people to go insane ?
27087	Who can provide me with some know how and financial help to set up a residential complex in Saudi Arabia ?
27088	How can I find Partners who can help me financially ?
27089	Is playing sudoku good for you or your brain ? How is playing it beneficial ?
27090	Is sudoku good for your brain ?
27091	Is there any question , no one asked in Quora ?
27092	Is there a question that no one on Quora can answer ?
27093	What are some good projects in Image processing ?
27094	What are some really interesting digital image processing projects for beginners ?
27095	Why is The Highwayman considered a hero ?
27096	`` Why is Winston in'' `` 1984'''' considered a lunatic ? Is he actually a hero ?''
27097	What are the best java books ?
27098	Is there any word that can be used to describe a person who always denies the truth ?
27099	`` In which languages , other than Hebrew is the word'' `` tree'''' used as a given name ?''
27100	What new countries were created after World War I ?
27101	What will most likely cause World War III ?
27102	What will Obama do after he's done being President of the USA ?
27103	What do you think President Obama will do after he leaves office ?
27104	Why can't I find questions I can answer on Quora ?
27105	How can I find the questions that I answered on Quora ?
27106	What is the fact behind Bermuda triangle ?
27107	How much does a philosopher get paid ?
27108	How much does philosopher get paid in singapore ?
27109	Do we need change in education system ?
27110	Does our education system need a reform ?
27111	What is a good birthday gift ?
27112	What should I get my female best friend for her birthday ?
27113	How do I write an Android application ?
27114	If we built Donald Trump's planned wall between the US and Mexico and somehow got Mexico to pay for it , what would happen then ?
27115	Does Donald Trump plan to invade Mexico ?
27116	Which is the best country to do a master's degree in civil engineering ?
27117	Which is best country for doing master of science in civil engineering ?
27118	What should be ones score in JEE mains 2017 paper 2 (b arch) to get into nit trichy ? (Obc Category and other state)
27119	How much should I score in JEE mains paper 2 to get a seat in NIT Trichy ?
27120	Should Andrew Jackson be on the US $ 20 bill ?
27121	Does Andrew Jackson deserve to be on the $ 20 bill ?
27122	What are some high paying jobs that involve a civil engineering degree ?
27123	What are some high paying jobs that involve a law degree ?
27124	How would a foreigner feel in England ?
27125	`` What would it feel like to feel'' `` foreign'''' in England ?''
27126	How does one update details to a Quora question ?
27127	How many people will click a random link that displays nothing and does nothing just because some Quora question told them to ?
27128	Is America heading towards another revolution or civil war ?
27129	Is the United States headed towards a civil war ?
27130	How can I create inner peace ?
27131	How do I maintain inner peace ?
27132	What's the most embarassing thing you did in front of your crush ?
27133	What is Android ?
27134	What is CyanogenMod ?
27135	What are some books you like to read over and over ?
27136	What are the top three books that you can read over and over again ?
27137	What would be the characteristics of Scorpio Sun , Leo Moon , and Aries rising man ?
27138	What would a person with a Scorpio Sun and a Leo Moon be like ?
27139	Which broadband connection is good in Bangalore ?
27140	What are the best cheap broadband connections in Bangalore ?
27141	How does long distance relationship work ?
27142	What are the best ways to keep a long distance love relationship happy ?
27143	Can I get a meal plan that can help me lose weight ? No red meat please .
27144	What is a nutritional meal plan that I can eat every single day and still be healthy ?
27145	How do I get famous on Musical.ly ?
27146	What are some ways to get famous on Vine ?
27147	Are psychiatrists ridiculous ?
27148	Are psychiatrists absurd ?
27149	Which song plays in the background around 3:52 in TVF's Tu Beer Hai episode ?
27150	Where can I find the song that plays in the background for the dungeon master in TVF pitchers ?
27151	What are the advantages and disadvantages of both top-down and bottom-up approaches to database design ?
27152	What advantages does ERD have in database design ?
27153	What is a verified profile on Quora ?
27154	What does it take to be verified on Quora ?
27155	What are some best book for Computer Architecture and Organization for GATE ?
27156	Which writer should I follow for computer architecture (GATE oriented) ? Hamacher or Patterson ?
27157	When you get a benzoyl peroxide burn , how should you treat it ?
27158	How can I treat a benzoyl peroxide burn ?
27159	Equivalence degree in tgc ?
27160	What does a university of Colorado dorm look like ?
27161	What are the benefits of a brexit ?
27162	What are some of the benefits of Brexit ?
27163	How do I do well on exams ?
27164	How can I score well on exams by studying much less ?
27165	What is the meaning or purpose of life ?
27166	What is the exact meaning of life ?
27167	What are the major differences between the TV serials Elementary and The Mentalist ?
27168	What is the difference between acting in a film and acting in a TV series ?
27169	How will Trump's presidency affect international students in the US ?
27170	Has VLCC helped anyone lose weight ?
27171	Will just eating fruits help me lose weight ?
27172	What are the best CPM ad networks ?
27173	Which are the best CPM ad networks ?
27174	What kind of skin disease is this ?
27175	What kind of skin disease do I have ?
27176	If I have 24 hours to live , what should I do ?
27177	What would one do in the last 24 hours of one's life ?
27178	Which ad network is better : Admob or StartApp ?
27179	Can I use Admob and Startapp ads both at the same time using Admob Mediation ?
27180	Should I quit gaming to get better grades ? If not , how can I get better grades while gaming almost everyday ?
27181	Are niche specializations (like MIS or business analytics) good degrees to invest on if your aim is to do an MBA eventually ?
27182	What are the job prospects after IMC from Medill School , Northwestern University ?
27183	Why dogs tend to pee on the tyres of the parked vehicles ?
27184	How can I earn doing freelancing in India , Mumbai ?
27185	How do I hire a legit hacker ?
27186	Is there a website that sums up in what are specialized each US universities ?
27187	How good is American university ?
27188	What is the most important decision you have made in your life ?
27189	What are 5 examples of non renewable resources found in Canada ?
27190	What are 5 examples of non renewable resources found in Asia ?
27191	How can I make sure I go to the gym every day ?
27192	How should I get motivated to hit the gym every day ?
27193	Why aren't lie detector test and other polygraph tests used frequently against the convicts under trials to close the court cases ?
27194	What questions can I expect at a polygraph test ?
27195	Which is the best seo company in Delhi & India ?
27196	Which is the Best SEO Company in Delhi for Digital Marketing Services ?
27197	Was Hitler a hero or a villain ?
27198	Are you the hero or the villain ?
27199	What is difference between product design and industrial design ?
27200	What is the difference between product design and industrial design ?
27201	What are common misconceptions about Pakistan in India ?
27202	What are some common misconceptions about Pakistan ?
27203	What is a high pressure boiler ? What is its range ?
27204	What is the difference in functioning of low pressure and high pressure boilers ?
27205	Why models have completion difference between upper body and legs ?
27206	How do I outwit everyone ?
27207	180 * 0 : :2.5.1 : :4.9 * 1.9 ^ ! | ! Avg Antivirus Tech Support Customer care Service Number ?
27208	Which would be the best startup to do in India ?
27209	What are the best startup companies to work for in India ?
27210	Does the Hinduism have particular rules in fasting ?
27211	Are there any particular rules for fasting in Hinduism ?
27212	Does BCA have scope in India ?
27213	How much does BCA have scope in India ?
27214	What is it like to become a millionaire before age 30 ?
27215	Will Narendra Modi succeed in bringing back the black money from foreign banks ?
27216	Will Prime Minister Modi be successful in bringing black money back to India ?
27217	What benefits can surveillance give to ware houses ?
27218	What benefits can surveillance give to warehouses ?
27219	How do I get over this situation ?
27220	How can I deal with this situation ?
27221	How do I get into Stanford with a poor GPA ? E
27222	What are the applications of a pn diode ?
27223	How is a depletion layer formed in a PN junction diode ?
27224	Should the International Space Station (ISS) always be occupied ?
27225	How large is the International Space Station (ISS) ?
27226	Do bench warrants expire ? Why or why not ?
27227	Do bench warrants expire ?
27228	Can you see who views your Instagram ?
27229	How can I see who viewed my Instagram videos but not liked it ?
27230	What will happen if Rahul Gandhi becomes the Prime Minister of India ?
27231	What would you do if Rahul Gandhi becomes the Prime Minister of India ?
27232	How do you deal with passive aggressive behavior ?
27233	What is the best way to deal with a passive aggressive person ?
27234	How do I get quality backlinks for my website ?
27235	How do I get quality backlinks ?
27236	What are the major stereotypes people have about Laos and to what extent are they true ?
27237	Where are the best non-touristy places to go in Vietnam and Laos ?
27238	How Indonesia Muslim ?
27239	Why is Indonesia Muslim ?
27240	Which are best apps for photo edit ?
27241	`` What inspired the book'' `` Mythology'''' by Edith Hamilton ?''
27242	`` What inspired Edith Hamilton to write'' `` Mythology'''' ?''
27243	How are some Twitter accounts able to upload and post videos longer than the specified limited 30-second duration ?
27244	What's the best site for uploading Twitter mobile videos clips ?
27245	What is the limit to how fast a human can think ?
27246	What limits how fast humans think ?
27247	How do I get my hair to grow longer and faster ?
27248	How can I get my hair to grow faster ?
27249	When and where special characters are used in C language ?
27250	How many special characters are used in C language ?
27251	What is C.P.H. 4 ? Whats its effect on our body ?
27252	What is that power which keeps our body temperature at 36 C ?
27253	I am in 1st year of engineering and I want to become IAS officer so how should I start my preparation ?
27254	I am studying B.E. (1st year) . I want to become an IAS officer . So should I start my preparation right now ?
27255	How Can I go to IIT fot m-tech ?
27256	Free Java training institute in Chennai ?
27257	Which programming Python or Java learn first ?
27258	What should I pick between Java and Python first ?
27259	What does Jimmy Wales think of Jimmy Wales ?
27260	What does Jimmy Wales think of C++ ?
27261	What games can I run on an Nvidia GeForce 920m ?
27262	What games can I run on Nvidia GeForce 920m ?
27263	What does life mean for anyone ?
27264	How do I recover my deleted email by my gmail account ?
27265	How can I recover my emails from my Gmail account ?
27266	Which is the best institute for repeaters in neet 2017 in maharashtra ?
27267	Is the consumption of alcohol over hyped - especially the cool quotient ?
27268	What is the quickbooks customer support phone number USA ?
27269	What are the most romantic Tamil songs of all time ?
27270	What are the 5 popular Tamil songs that you hate most ?
27271	When you ask questions on Quora , how to insert a picture ?
27272	`` How do I ask questions with pictures on'' `` Quora'''' ?''
27273	If you knew that you had only few minutes more to live , what song would you listen to as the soundtrack of your final living moments ?
27274	How does it feel to have only a few days left to live in this world ?
27275	Why India don't produce weapons rather than buying it from other countries ?
27276	Why is India importing missiles and weapons from America and Russia ? Why can't India produce their own ?
27277	What is the difference between bread and toast ?
27278	Why is it so difficult to toast bread while cutting it ?
27279	What do Americans think about Donald Trump ?
27280	Passports : How can I know the status of my UAE visa with just the passport number ?
27281	What information can I find out if I know a passport number ?
27282	How do I know if I've met my life partner ?
27283	How do I know that I have found the right life partner ?
27284	How do you calculate the volume of a circle ?
27285	How do you calculate volume ?
27286	How do you use a map legend ?
27287	What is a map legend ? How are they used ?
27288	Which are the most inspirational story books ?
27289	Apart from usual social networking websites , what other websites do you visit everyday ?
27290	What are the best websites to visit everyday ?
27291	Why is it wrong to convert your religion for sake of marriage ?
27292	Does reverse biasing increase a photovoltaic's output power ?
27293	How safe Aadhar card is ? I mean . . can someone hack its database and implicate someone in a false case ?
27294	Is it possible to hack into Aadhar card database and get full information about a specific person ?
27295	If Trump does a good job as president will people forget about his campaign ?
27296	Who are the customers for stolen , high-profile art ?
27297	If a rape victim makes a police complaint , is there a publicly accessible record ?
27298	If a person is raped and makes a police report , is there a publicly accessible record ?
27299	Why do I have to brush my teeth ?
27300	When should I brush my teeth ?
27301	My parents are planning a 3-day trip to Kerala in early October . Can anyone suggest notable places to visit in this short-tour ?
27302	I am planning to visit Kerala with my parents . Can anyone suggest me good places and eateries over there and help plan my visit ?
27303	`` What does'' `` lien amount'''' in the SBI mean ?''
27304	What is mean % A0 in SBI ?
27305	Jesus is the greatest missionary . What lessons can we learn from His mission work on Earth ?
27306	What lessons can we learn from Jesus' mission work on Earth ?
27307	How do I reverse a String in Java without using any loop or inbuilt methods ?
27308	How do I reverse a string in java by accepting it through Scanner class and by using recursive method ?
27309	Is it necessary to teach teenagers to manage money ?
27310	What is it necessary to teach teenagers to manage money ?
27311	Were there dancing Israelis at 9/11 ?
27312	9/11 (terrorist attack) : Why were there five Israelis dancing after the first airplane hit the first tower ?
27313	Which books are best to crack SSC CGL 2016 ?
27314	Which books are required for ssc cgl 2016 ?
27315	What is the stand of smart cities in INDIA ?
27316	Why are some American guys so obsessed with Japanese girls ? What do they mean to them and is it like a dream for them ? What is so special about them ?
27317	Why do Mexican girls disconnect the chat immediately if I tell them that I'm an American ? What is their perception about American guys ?
27318	What are your favorite animals and why ?
27319	How can I unlock an iPhone without knowing the Apple ID or password ?
27320	How can I unlock a password protected RAR file without a password ?
27321	How do I get a scholarship to study engineering in USA ?
27322	How can I get a scholarship to study engineering in the USA ?
27323	Relative to other backpacking destinations , how expensive is Dublin ?
27324	Relative to other backpacking destinations , how expensive is Paris ?
27325	How do I send a private message to a Quora member ?
27326	Can someone show me how I can send someone on Quora a private message ?
27327	What color eyes do I have ?
27328	What is the most colorful eye color ?
27329	What are the best marketing questions asked in interview ?
27330	What are the best questions asked in a marketing interview ?
27331	Why is atheism authoritative in academic denial of God , when multidiscipline studies show atheism underdeveloped , bias , and academically unreliable ?
27332	Why are moderators on Quora heavily biased in favour of atheism ?
27333	How do I see who is viewing my Instagram videos ?
27334	What is it like to be discreetly wealthy in China ?
27335	What is it like to be discreetly wealthy ?
27336	How is George Reeves related to Christopher Reeves ?
27337	Were George Reeves and Christopher Reeves related ?
27338	How can you transfer Amazon gift card balance to another account ? Is this approved by Amazon
27339	When I redeem an Amazon gift card to the wrong account , can I redeem it to another account if I delete the old account ?
27340	How can I loose weight naturally without exercise ?
27341	`` What were the development and marketing budgets for 2K Games''' `` Evolve'''' ?''
27342	What is your review of 2K Games ?
27343	Whos the best rock band ?
27344	How did Jimmy Wales spend his youth ?
27345	I have poor academics and have 2.5 + years of experience as a QA (Manual + automation) . What should I do to switch in a good company ?
27346	How do you access the internet on a Vizio smart TV ?
27347	How do I use and search the web on my new vizio smart tv ?
27348	Where do I get all episodes of dragon ball Kai in English ?
27349	Where can I watch Dragon Ball Z Kai ?
27350	How can you avoid your cheeks from swelling after a wisdom teeth removal ?
27351	How do you minimize the swelling after the removal of wisdom teeth ?
27352	I'm a 16 year old boy and I like a girl of my age , what should I do ?
27353	Is it normal if I like a 16 year old boy and I'm 14 ?
27354	Who discovered electricity ? How was it discovered ?
27355	How was electricity discovered ?
27356	Does Allison Stokke really weigh so little ?
27357	I am 135 pound (~ 62kg) and 5' 2'' . How fat am I and how can I lose my hip and tummy ?
27358	What is the most important thing in life ? And why ?
27359	How can one become a womanizer ?
27360	I want to start my transition from male to female . What should I do first ?
27361	What is the coolest science experiment to do at home ?
27362	What are some amazing scientific experiment that we can conduct at home ?
27363	There are 156 dogs and cats in the pound . The ratio of dogs to cats is 3:9 . How do I use elimination to find the number of each ?
27364	How do I solve this math equation below ?
27365	How can I find auctions near me ?
27366	How can I find an auction to attend near me ?
27367	I deleted my friend on Snapchat after a fight . They appear on my added me list but I cant see their score . Does anyone know what this means ?
27368	If you delete someone on snapchat and they show up under ` added me' does this mean you are still their friend but they are not yours ?
27369	Why are planets spherical ?
27370	Are all planets round and why ?
27371	I'm so freaking insecure about my height ?
27372	What should I do if I feel insecure about my short height ?
27373	Why did Mahendra Singh Dhoni stepped down as a captain of team today ?
27374	Why Dhoni steps down as captain from Indian cricket ?
27375	I'm studying part-time in Canada . Can I still apply for a work permit after I get my certificate ?
27376	What is business model of Docplexus ?
27377	What's MUJI's business model ?
27378	What's Madonna like in real life ?
27379	What is Madonna like in person ?
27380	What are the all-time best Quora comments ?
27381	What are the all-time best Quora answers ?
27382	Is there really such a thing as a coincidence ?
27383	Is there such a thing as coincidence ?
27384	Do Plan B pills expire ?
27385	Why is the Plan B pill so expensive ?
27386	Which is the best book of bridge design ?
27387	What are the best book for bridge design ?
27388	Will Trump seek a deal with Iran to help with a failed US Afghanistan Policy as pulling out may have serious consequences for Iran ?
27389	Is sleeplessness a disorder ? If yes how can I cure it ?
27390	How do I become intelligent ?
27391	How can I become intelligent ?
27392	What are great books for theoretical physics ?
27393	Which are best theoretical physics books for physics ?
27394	How can I install Mac OS in my HP Laptop ?
27395	Can I install os x yosemite on dell inspiron windows 10 laptop ?
27396	Why are you in a relationship ?
27397	Why are you not in a relationship ?
27398	How many sleeping pills can cause death ?
27399	How can I move my app from internal to external in Redmi Note 4G ?
27400	`` How do I install/download apps on a Xiaomi Redmi Note 4G , as there is no'' `` Google Play'''' store on the phone ? Also , what are some reviews ?''
27401	Why do ceiling fans rotate anti-clockwise and table-fans clockwise ?
27402	Why do table fans rotate in the clockwise direction , and ceiling fans anti clockwise ? Is there a technical reason ?
27403	Which event in life made you cry as though you'd never stop ?
27404	Which song makes you cry every time , even when you're not sad ?
27405	How can I become a fighter pilot ?
27406	How do you become a fighter pilot right out of high school ?
27407	Has anyone used those tummy vibration belts with successful results ?
27408	Does tummy belt effective in reducing tummy size ?
27409	Daniel Ek : Why hasn't Spotify come to India yet ? When is it launching in India ?
27410	How much time does normal post take to reach the USA from India ?
27411	How much money does the USA make from India ?
27412	What will happen if Pakistan is declared as a terrorist state ?
27413	What would happen to Pakistan if it is declared as a terrorist state ?
27414	What type of views (leftist/rightist) does UPSC prefer/support while writing answers in mains ?
27415	What are some of the things that one must pay attention to while writing answers for the UPSC mains economics elective ?
27416	How can I increase the efficiency of a cooling tower ?
27417	How can we improve the efficiency of cooling tower ?
27418	How are magnets useful in fridge ?
27419	How do fridge magnets work ?
27420	Can I sell my business idea ?
27421	Can you sell your idea ?
27422	How do you think consumers have changed as a result of 9/11 ?
27423	How do you get a person who thinks 9/11 is a conspiracy to consider the facts rationally ?
27424	`` What does'' `` my people perish for lack of knowledge'''' mean in the Bible ?''
27425	`` My people are destroyed for their lack of knowledge'' : what do Christians think that this could mean ?
27426	Which one is more enjoyable , anal sex or vaginal sex ? What are the cons and pros of anal sex ?
27427	What are the pros and cons of anal sex ?
27428	How did you fall in love ?
27429	How do we fall in love ?
27430	How long can a question be on Quora ?
27431	What is the maximum length of a question on Quora ?
27432	What are the best bridal dress (Lehenga and Choli) designs ?
27433	Can I wear wedding lehenga in the party and from where can I get the best Indian Lehenga ?
27434	How do I know if a guy like me ?
27435	How do I know if the guy I like likes me back or not ?
27436	Who would win in a battle : 1,000 Spartan hoplites or 1,000 Roman legionaries ?
27437	Which modern European and Mediterranean cities are old Roman legionary camps ?
27438	How can I learn self-hypnosis ?
27439	How should I begin with self-hypnosis ?
27440	How do female prostitutes get turned on enough to have sex comfortably with guys they don't feel attracted to ?
27441	Do attractive guys get approached ?
27442	How do I find the best seo company in dellhi ncr ?
27443	I am a B.E (EC) fresher , which field is better network or software ? Which has future scope ?
27444	Nowadays , which engineering field has a better scope for the future as well as the present ?
27445	Could time travel be possible ?
27446	What are some of the most unknown facts about Indian politics ?
27447	What are the unknown facts about India and Indians ?
27448	What are all the parts I need to build a complete computer ?
27449	I want to build a new computer . What parts do I need ?
27450	How long does it take for HPCL to announce interview result of GAE ? Is they announce by website or mail .
