test-248889	How many times one can attend AMCAT exam?
test-248890	What are the features/characteristics of a duopoly market structure? What are its pros and cons?
test-248891	What is the market structure for Amazon?
test-248892	How does a catalyst affect the rate of reaction?
test-248893	How does the catalyst affect the rate of reaction?
test-248894	How does Briexit effect India?
test-248895	Effect of brexit in India?
test-248896	What is the World Bank?
test-248897	What is the World Bank? What is its main function?
test-248898	What is the meaning of Mantra Mangalya?
test-248899	What is the meaning of the Gayatri mantra?
test-248900	What are the best home-based jobs?
test-248901	What are the best home based jobs in India?
test-248902	Why do we write abstracts?
test-248903	How do I write an abstract?
test-248904	What is the highest score in JEE Advanced 2016 so far?
test-248905	What is the highest score in JEE Main 2016 so far?
test-248906	Can I still be pregnant?
test-248907	How can I never be pregnant?
test-248908	What is the best mobile phone below Rs. 25000?
test-248909	India: What is the best phone to buy between (Rs, INR) 12-15k?
test-248910	Why do spanish people look Indian?
test-248911	Do Indian girls look at boys?
test-248912	What are the best trance songs of 2016?
test-248913	What is the best songs for teens 2016?
test-248914	How does the 'Report' system work on Quora?
test-248915	How do Quora Credits work?
test-248916	Why are other satellites not visible in ISS time-lapse of earth?
test-248917	Why is the time-lapse of earth from ISS not affected by motion blur?
test-248918	If there is life on other planets, will it also be carbon based?
test-248919	If alien life was discovered, is it possible that it would be non-carbon based?
test-248920	Are there any cheap (< $10) USB flash drives with a physical write protect switch?
test-248921	How do I convert excel adresses to kml?
test-248922	How do I clear recent usage history in Jio app?
test-248923	Can we use the Jio TV app using JioFi?
test-248924	What is the best crm for financial services?
test-248925	What is a good CRM for a Vending Company?
test-248926	Can anime exist in a parallel universe?
test-248927	Can anime exist in a parallel universe/multiverse?
test-248928	What is an idea?
test-248929	What is your idea?
test-248930	Sir may I able to know what will be starting package offered to student pursuing DESD from CDAC Pune?
test-248931	Can a person be a sociopath without having had a traumatic childhood?
test-248932	How is it like to study production engineering from COEP or VJTI?
test-248933	What is production engineering like at VJTI?
test-248934	Is it worthwhile for someone to move to Australia at the afe of 42 years although they might be well settled in India?
test-248935	What are the best earphones for listening to any genre? SONY XB50AP or ROCK ZIRCON or any one of yours? PS:The price should be below 3000 rupees
test-248936	What's the best thing that's ever happened to you?
test-248937	What's the best thing that happened to you today?
test-248938	Which is the best dental clinic in Chennai?
test-248939	Which are the best dental clinics in Mumbai?
test-248940	What is the difference between NFSv3 and NFSv4?
test-248941	What is the difference between bash and zsh?
test-248942	How can I contact Hotmail to help recover my account?
test-248943	Is there a Hotmail helpline or support I can call if I cannot access my account?
test-248944	What are the factors of a perfect competition?
test-248945	What are the advantages of perfect competition?
test-248946	How can I stop feeling lonely, depressed?
test-248947	How do I stop feeling so lonely all the time?
test-248948	What are some organizations that help poor students in India?
test-248949	What can we do to help kids to go to school in poor countries?
test-248950	Is tony Blair corrupt?
test-248951	What was the political Third Way of Tony Blair?
test-248952	Is there any opportunity for an Indian guy in Russia?
test-248953	What are Russia Visa charges for Indian citizens?
test-248954	Why do we yawn? Is it required by the body?
test-248955	Why do mammals yawn and stretch?
test-248956	Who is South India's number 1 hero?
test-248957	Why is South India hiding jewels?
test-248958	Why would a magnetized particle rotate in a magnetic field?
test-248959	Why do magnets have a magnetic field around it?
test-248960	What is the difference between sterling silver and solid silver? How are they alike?
test-248961	What is the difference between silver and sterling silver?
test-248962	How long does it take the average man to achieve orgasm?
test-248963	How long does it take a woman to get pregnant after sex?
test-248964	What are the best books about the history of Mathmatics?
test-248965	What are some of the best books about history of philosophy?
test-248966	What colors compliment orange?
test-248967	What are complementary colours to orange?
test-248968	Which orbitals form sigma bonds and how?
test-248969	What are sigma bonds?
test-248970	Why do western people eat rice with forks? Not a spoon?
test-248971	How can one correctly eat using knife, fork, & spoon? Does one has to go for his preferred way like between spoon and fork, & knife and fork?
test-248972	When is the best time to set up a Patreon for your blog?
test-248973	When is the best time to set-up Patreon for your art?
test-248974	Who is a better player between Sachin Tendulkar and Virat Kohli?
test-248975	Is Virat Kohli the best after Sachin Tendulkar?
test-248976	How do you watch Games of Thrones season 4 online?
test-248977	How do I watch Game of Thrones season 5?
test-248978	I am an Indian male (my eating habits are based on Indian cuisine) weighing 90+ kgs. I hate going to gym, but I enjoy jogging/walking/playing outside. What kind of exercises can I undertake to primarily lose weight? Should I follow any special diet?
test-248979	"I'm 5""4 and my weight is 70 kg. I want to shed all my weight in the next 2 months. What should be my diet chart?"
test-248980	How do I easily make friends?
test-248981	How easily can I make friends abroad?
test-248982	What is the purpose of life?
test-248983	What is life? What are we doing on earth? What is the purpose of all this?
test-248984	What are the most runs ever scored in one inning?
test-248985	In baseball, how many runs score in an inning with bases loaded and no outs?
test-248986	What was Edward Snowden like in university?
test-248987	What is it like to be Edward Snowden?
test-248988	What is adventitious ventilation?
test-248989	What is ventilation air?
test-248990	How do you overcome your biggest fears?
test-248991	How can I overcome my fear?
test-248992	Has anyone tried the stronger workout by Niki Holander?
test-248993	Why is the difference in the number of votes between Trump and Clinton so tiny?
test-248994	How can I volunteer for comicon Delhi?
test-248995	Does indori silencer increase the mileage in royal Enfield?
test-248996	Who is your favorite living movie director?
test-248997	Who is your favorite movie director, and why?
test-248998	How many videos on YouTube have over 1 million views?
test-248999	What kind of video get over 5 million views in a week on YouTube?
test-249000	How many questions may I ask on Quora?
test-249001	How many anonymous questions have I asked on Quora?
test-249002	Can homeopathy be really effective?
test-249003	Which is more effective: homeopathy or allopathy?
test-249004	Can Jio sim works in Huawei Power-Fi E8231 dongle?
test-249005	Can I use Jio SIM in iPhone 5s?
test-249006	How is irony used in To Kill a Mockingbird?
test-249007	"What's the alliteration used in ""To Kill A Mockingbird"""
test-249008	Wordpress vs. Blogger which one is better?
test-249009	I want to create my own blog. Which one is better? Wordpress or Blogger?
test-249010	I have a green card, but I haven't been back to the US for over 2 years without a re-entry. However, I have a upcoming business trip to the US next week, will I be able to enter the country? And in what consequence?
test-249011	Can green card holder study abroad (not in US) and back only in summer for 5 years? And what about reentry passport?
test-249012	Why was the 1947 speech by Jawaharlal Nehru given in English?
test-249013	Why did Nehru give his famous Independence Day speech (Tryst with Destiny) in English?
test-249014	How can I book cheap domestic flights in India?
test-249015	What site is best for booking cheap domestic flight and bus tickets in India?
test-249016	Why did Kareena name their first child Taimur in spite of Timur being hated throughout Indian history?
test-249017	Why did Saif Ali Khan name his son Taimur?
test-249018	Why is it faster to develop websites in Golang than in C++?
test-249019	How do you dock a Boston Terrier's tail?
test-249020	What are the 4 best ways to lose weight?
test-249021	What is the best way to lose belly fat quickly?
test-249022	What happened to Vijayakanth?
test-249023	What will happen to TamilNadu when Vijayakanth becomes the CM?
test-249024	How do I fix my laptop fan if it's making a grinding noise?
test-249025	How do I fix noise from laptop fan Lenovo Yoga 300?
test-249026	How do I know if I've been muted on whatsapp?
test-249027	WhatsApp: Is it possible to know what someone is doing on WhatsApp beyond just their login and logout times?
test-249028	What is the best way to start learning Japanese?
test-249029	What is the best way to learn Japanese by yourself?
test-249030	Is there a cloud build server which builds native iOS apps?
test-249031	What is a cloud server?
test-249032	How can you deactivate an AOL email account?
test-249033	Is 140 lashes a death sentence?
test-249034	What are some advantages and disadvantages of the social learning theory?
test-249035	What are the advantages and disadvantages of constructive learning?
test-249036	Will machines become conscious?
test-249037	What is the biggest scam that every Indian must be aware of?
test-249038	What does an IQ score of 122 mean?
test-249039	What do the scores on a classic IQ test mean?
test-249040	How can I disable a Google account lock from the previous owner
test-249041	How can I stop a previous owner of a Samsung Galaxy Active S5 from tracking me or locking down the phone that I bought from someone?
test-249042	How can you get yourself removed from a Chinese/Japanese/Korean website if the website copied from your CrunchBase profile which you have deleted?
test-249043	I have a website with lot of unique things. How can I prevent others from copying my idea?
test-249044	How do I take control on masturbation?
test-249045	How can I control the feeling of masturbation?
test-249046	Will my video get banned if I buy YouTube views?
test-249047	How do I buy YouTube views effectively?
test-249048	"How do I use ""inurl:~"" in Google search?"
test-249049	What font does Google search use on its results page?
test-249050	What are the traits and behavior of borderline personality disorder?
test-249051	What are some examples of Borderline Personality Disorder behavior?
test-249052	How can I improve my Quora questions and answers?
test-249053	How can Quora improve answer quality?
test-249054	What are the ways to stay fit in this hectic life?
test-249055	What are some simple ways to stay fit in your life?
test-249056	How do people become iOS developers?
test-249057	What are good ways to become a senior iOS developer?
test-249058	How do I view the latest answers for a question on Quora?
test-249059	Where can I view the latest questions posted on Quora?
test-249060	What is your favorite board game?
test-249061	What is your favorite board game and why?
test-249062	When is Shadow Fight 3 releasing?
test-249063	Does shadow exist?
test-249064	Is it good to learn SQL and PL/SQL or to learn Oracle DBA from an institute in Hyderabad?
test-249065	What are some good Oracle Database PL/SQL institutes in Bangalore? Is it worth to do such course or we can learn database on our own?
test-249066	Are people of the Jewish Faith permitted to drive motor vehicles on the Sabath?
test-249067	What is the best way to self-study AI?
test-249068	What is a good alternative to Filemaker Pro that is hosted in the cloud, and doesn't require coding to set up or maintain?
test-249069	How do you set up cloud hosting?
test-249070	Why is chocolate bad for dogs?
test-249071	Is asparagus bad for dogs? Why?
test-249072	What are good open source projects in golang to contribute to and start learning go language?
test-249073	What are some interesting open source projects to learn from?
test-249074	Is TIME Travel really possible? What should I know before doing it?
test-249075	Will backwards time travel ever be possible?
test-249076	Do Russians like Italian people?
test-249077	Are Cherokee people similar to Italian people?
test-249078	What problems do Indian people are facing ?
test-249079	What are the most problems which Indian people face in India?
test-249080	What was your most romantic experience?
test-249081	What are some of your most romantic experiences?
test-249082	"My son plays Minecraft on the computer. The other day he was playing online and someone asked him ""d or t."" What does this mean?"
test-249083	Did Notch play Minecraft 1.4?
test-249084	My friend said waxing makes the hair grow thicker and darker. What is the best way to have smooth skin without hair?
test-249085	I want to dye my hair pink but my hair is naturally brown. Are there any dyes out there that will dye my hair without me getting it bleached first?
test-249086	What clubs in Ahmedabad have reasonable membership fees and lots of events happening in the club?
test-249087	How do I get club memberships in Bangalore?
test-249088	Where do I catch a Pikachu in Pokémon GO?
test-249089	How do I catch more Pokémon in Pokémon GO?
test-249090	Did Milkha Singh ever have an Australian girlfriend as shown in the movie 'Bhaag Milkha Bhaag'?
test-249091	Did Milkha Singh look back before completing his race in Rome Olympics? Did that cost him the race? More importantly, was he leading then or at any point in time in the race?
test-249092	How could degree programs in biochemistry prepare students better for careers?
test-249093	How could degree programs in chemistry prepare students better for careers?
test-249094	How do companies manage their brand portfolio?
test-249095	How are companies managing their brand on the web?
test-249096	Which is one of the best coaching institute for GATE/ESE Civil Engineering: MADE EASY or IES MASTER?
test-249097	Which coaching institute is best for Civil Engg, IES in Delhi, IES Masters, or MADE Easy?
test-249098	How do I hide my likes and comments from my friends on Facebook?
test-249099	How can I stop friends from seeing notifications when I comment on other Facebook pages?
test-249100	What exactly is the concept of infinity?
test-249101	What is concept behind infinity?
test-249102	How do you get a free PSN generator with no surveys?
test-249103	How can I get a free account on Netflix?
test-249104	What should I read before The Meditations of Marcus Aurelius?
test-249105	What was Marcus Aurelius' book Meditations about?
test-249106	Saraswati is Godess of knowledge then why has She always veena with her?
test-249107	Which one should I choose between UPES and CUSAT?
test-249108	I asked a girl out for a coffee, she said yes but ill let you know, what does that mean?
test-249109	"A girl loved a guy for 3 years but the guy never reciprocated in the same manner. She asked the reason, he replied.""I would have fallen in love with you, but I never let that happen"". The gal asked why, he said, ""there is only one reason, because you are not beautiful"". Gal said nothing. What should she have done?"
test-249110	Do you ever have a war between truth and lies? I mean do you struggle to know whether the thing is true or fake?
test-249111	What if truths came out that everything we knew was a lie? How would mankind initially adapt? Would we take the high ground or create more war?
test-249112	What is a list of programming languages ordered from easiest to hardest to learn?
test-249113	What programming language do I have to learn in order to start coding an app like Instagram or WhatsApp?
test-249114	What was the average weight of a Roman soldier?
test-249115	What was the height and weight of the average Roman soldier?
test-249116	How can I get back my Facebook account that I forgot its password?
test-249117	Is it possible to login to Facebook without password?
test-249118	Which is best for hacking : Kali Linux or Ubuntu?
test-249119	Which is the best free VPN for Kali Linux ?
test-249120	How do I improve grammar?
test-249121	I am poor in English grammar so how should I improve my grammar?
test-249122	How will demonetization of Rs 500 and 100 currency notes help in curbing black money, fake currency and corruption?
test-249123	How will demonetizing the ₹500 and ₹1000 notes help in curbing black money in the form of green money in foreign banks, land, fake shares, etc?
test-249124	What is the most crucial lessons life has taught you?
test-249125	What is the most crucial lesson life has taught you?
test-249126	I am an Undergraduate in Electronics and communication engineering. What are all the possible Career options in core domain after graduation?
test-249127	What are the career options after a B.Tech and an M.Tech in electronics and communication engineering?
test-249128	How many distinct binary search trees can be created out of 4 distinct keys?
test-249129	How do I Create a binary binary search tree for the data - 10, 8, 15, 7, 3, 6, 12, 5, 9,17 ? Plz give reference of where I can read more about it
test-249130	What are some creative ways to learn Chinese every day?
test-249131	What is the most effective way to learn Chinese characters?
test-249132	What is the scope of computer engineering other than in the computer field?
test-249133	What are the career opportunities after studying computer science engineering?
test-249134	Should I buy a 14 inch laptop or a 15.6 inch laptop for coding?
test-249135	Which are the good laptops to buy with main requirements being an i5 processor and 15.6-inch screen on a budget of £500?
test-249136	What is the best way to deal with writer's block?
test-249137	What should a writer do for inspiration when they're experiencing writer's block?
test-249138	If you worked for a large accountancy firm and you had £100,000 and 100 part-time volunteers what ambitious charity projects would you do?
test-249139	How can I work by myself to make 100,000$ per year?
test-249140	Have you ever willingly worn clothing meant for the opposite gender and why?
test-249141	Which kind of clothes do you like on the opposite gender and why?
test-249142	Who will be India's next president?
test-249143	Who will be the next India President?
test-249144	Who named earth?
test-249145	Why is earth called earth?
test-249146	How much money do top YouTube channels make off merchandise sales?
test-249147	How much are YouTubers paid a month?
test-249148	What will be the best free journals to publish our research paper?
test-249149	What are some good journals which publish research papers free of cost?
test-249150	What are the best sounding headphones under $100?
test-249151	What are the best headphones under $100?
test-249152	Why does barely anyone take someone else's recommendations?
test-249153	How many books should one read in a week, month or year?
test-249154	How does the HP OfficeJet 4620 Airprint compare to the HP Color LaserJet Professional CP5225dn Printer?
test-249155	How does the HP OfficeJet 4620 Airprint compare to the HP LaserJet Enterprise M605dh?
test-249156	Why money is important in our life?
test-249157	Is the money really important in life?
test-249158	How long does it take to grow out a buzz cut to long shoulder length hair for men?
test-249159	How long will it take my hair to grow to shoulder length (the sides were shaved and my top is quite long and it's starting to look quite dumb)?
test-249160	Who is the most fake Bollywood actor/actress?
test-249161	Who is the most hated actor and actress in Bollywood? Why are they hated?
test-249162	What would you do for America and their people and also for the black people?
test-249163	Should I aim for TU9 even with a low GPA?
test-249164	Why don't modern aircraft livestream blackbox data to a ground server through sattelites as an additional backup?
test-249165	Where can I find a list of all Countries of the world’s Capital and Currency?
test-249166	How can I find out if my husband is using dating apps?
test-249167	How can I find out if my ex is using dating sites?
test-249168	Why isn't Putin declared a war criminal by the Hague tribunal and Russia the aggressor country of the war waged against Ukraine?
test-249169	What do you think Putin's next moves will be in Russia's war with Ukraine and the West?
test-249170	What book should I use for learning data structures using C?
test-249171	Which is the best book to learn about data structures using C?
test-249172	How do you create a Rocketmail account?
test-249173	How can you create an account on RocketMail?
test-249174	I (28) want to be a programmer (make apps, sites…) and live in a developed country outside Brazil. What path should I take to accomplish the goal?
test-249175	Why are obsidian blades used in cardiac surgery?
test-249176	What research works you would advice me to do before setting appointments with investors for my startup ?
test-249177	Why do brides wear white wedding dresses on their big day?
test-249178	Is Hinduism an accepting religion?
test-249179	Is Hinduism a 'reasonable' religion?
test-249180	What is the scope of a Ruby on Rails developer to work at Flipkart in 2014?
test-249181	A friend of mine working in Pune is trying to switch over to Gurgaon. She is a Ruby on Rails developer. Who is hiring in that region?
test-249182	"Is ""I just wake up"" a grammatically correct sentence?"
test-249183	Did everybody wake up? Is this sentence correct or not?
test-249184	Has anyone got any concrete documents/references that pinpoint to the exact transformaton saga of Tejo Mahalaya to Taj Mahal?
test-249185	Was the Taj Mahal a Shiva temple?
test-249186	How much time did you take to learn guitar?
test-249187	How much time does it take to learn chords on a guitar?
test-249188	What is a list of programming languages ordered from easiest to hardest to learn?
test-249189	What is the hardest programming language for a 8 years C++ programmer to learn?
test-249190	What are some nursing care plans for meningitis?
test-249191	What are some nursing care plans for schizophrenia?
test-249192	Which iPhone should I buy: iPhone 6S or iPhone 7?
test-249193	Should I buy the iPhone 6s or wait for the iPhone 7?
test-249194	How do mosquito repellent liquid vaporizers work?
test-249195	What is the best way to repel mosquitoes at home, in an AC ROOM?
test-249196	Is Skype video calling and WhatsApp calling is supported by Samsung Z2 (Tizen)?
test-249197	Can I make video calls on Skype with 64 KB of bandwidth?
test-249198	Can I harvest button mushroom in Bhubaneswar?
test-249199	When copying atrade signal in mql5 , do I have to keep computer active?
test-249200	Is there a way to search for all the Knowledge Prize questions on Quora?
test-249201	How can I search only Quora Knowledge Prize questions?
test-249202	Did the Germans really hate the Jews or not?
test-249203	Why did the Nazis hate Jewish people to the point of committing genocide?
test-249204	Is there a way for time travel to be possible?
test-249205	What way is the most possible one to time travel?
test-249206	What are best Hollywood movies ever?
test-249207	What are some of the movies of Hollywood that you must watch?
test-249208	Is the Philippine drug war legitimate?
test-249209	"In the Philippines, is Duterte’s ""drug war"" being used to settle scores having nothing to do with drugs?"
test-249210	What do Americans think about Vietnamese Americans?
test-249211	What does Americans think of Vietnamese people?
test-249212	Does ethanol have a taste?
test-249213	What is the worst food in the world?
test-249214	What are some of the best horror and thriller movies?
test-249215	Which are best brainy thriller movies?
test-249216	What is the process used to make an image URL?
test-249217	In war, are you allowed to run over enemy with Tank and other Armored vehicle?
test-249218	How good is systra project management?
test-249219	Is invoicera a good project management software?
test-249220	Can anyone help me with this physics problem?
test-249221	Can someone help me with this physics problem?
test-249222	How will Modi's decision of obsoleting 500 and 1000 notes effect the Indian economy?
test-249223	What are the repercussions of 500 and 1000 rupee notes not being legal tender anymore?
test-249224	How can I learn English?
test-249225	What are the best way to learn english?
test-249226	How can you shrink cotton?
test-249227	How do I shrink my cotton pants?
test-249228	How do I get an admission in any college of DU for MBA?
test-249229	What are the job opportunities in abroad after completing b.com from Bangalore university?
test-249230	How did you learn to make an iOS game?
test-249231	How can I develop games for iOS?
test-249232	Weddings: What are some good replacements (or alternatives) for engagement rings for a gay couple?
test-249233	Where can I buy an engagement ring of a good quality and for a reasonable price in Europe?
test-249234	How does the Fitbit tell the difference between climbing stairs and taking the elevator?
test-249235	How does Fitbit know when I'm taking a step?
test-249236	Can you leak while wearing a tampon?
test-249237	Can tampons leak?
test-249238	Recently I started downloading DOTA 2 from Steam (it's my first encounter with Steam). I downloaded about 600MB/6.8GB, then I paused it and shut down my PC after exiting Steam. The next day when I restarted it, it started from 100MB. Why is this happening?
