364535	Is Made Easy handwritten notes enough for the GATE exam ?
364536	What is the best way to send money from United States to Colombia ?
364537	I am doing M.Sc maths from IIT Bombay , but I do not feel like doing research in mathematics . What are the good career options that I can explore ?
364538	I have got 98 marks in maths of the 12th HSC boards . I am deeply interested in mathematics . What are the good career options in maths ?
364539	How realistic would it be to lose 40 pounds in 3 months ?
364540	Is it possible to lose 40 pounds in 5 months ?
364541	How are AC and DC produced ?
364542	What is AC ? And DC ?
364543	Where can I get best mobile DJ services in Sydney ?
364544	How do I impress girl in the first meeting ?
364545	Where should I buy a domain name from ?
364546	What is the Special Needs Trust in Texas ?
364547	What is a special needs trust ?
364548	I have my resume on the Naukri site , but I am not getting any response . Why ?
364549	I need to prepare a resume for a job . I need it to look like a web site . How does this thing get done ?
364550	Jobs and Careers : Is there an entry level job opening for an economics graduate in India ?
364551	I'm a student doing economics major . I need an entry level job in India . What are some good companies to apply to and any other miscellaneous pieces of advice ?
364552	Do bridges move ?
364553	What is Bridge of Spies based on ?
364554	Besides our star being called Sol , what is it's call letters and numbers ?
364555	What are the best colleges for an MBA in Andhra pradesh and Telangana ?
364556	What type of hacking is crime/illegal ?
364557	Is hacking a game illegal ?
364558	Is it true that there are only Muslim terrorists in India and rest of the world ?
364559	My height is 176cm , is this short for men ... ?
364560	Why is my height so short ?
364561	What is the basic difference between constant and uniform velocity ?
364562	If power is constant , what is the force versus velocity graph ?
364563	Out of Polish , Czech and Hungarian which language is easiest for an English speaker to learn and why ?
364564	Is GRE Bible software fake ?
364565	Where can I get GRE software for free ?
364566	How much time do you get for a free KeyShot trial ?
364567	How to make Bertucci's chicken domani ?
364568	What are some of the mind blowing tech hacks ?
364569	What are some mind-blowing facts about Elon Musk ?
364570	What are some real-world applications of continuous compounding ?
364571	What are the real life applications of array ?
364572	Who developed Jetsetter.com ?
364573	Who developed justbuylive.com ?
364574	What are some good culinary uses for monosodium glutamate (MSG) ?
364575	Someone redeemed my JIO coupen code how can I get my code back to have my sim card ? Someone help me ?
364576	I'm a first time home buyer about to close . Tell me something educational , funny , nightmarish about your first 6-12 months living in your house ?
364577	My parents aren't supportive about my future . How can I raise money to fund my MBA education from a good college in 6-8 months' time ?
364578	When should I use unsigned integers (positive only) in C++ & C ?
364579	What are the advantages of using C over C++ ?
364580	What is C++ Abstract Syntax Tree ?
364581	How can I use C++ to create a binary tree ?
364582	`` In my opinion , the Roman Empire never really'' `` fell'''' but rather was more absorbed by the Byzantines . Does anyone have an opinion on whether they agree or not and why ?''
364583	I am a very shy person and people think that I am weird because I don't talk much . How can I improve my confidence and become more sociable ?
364584	I am a talented good looking and honest person . But I am too shy to explore who I am and have difficulties making friends . How do I become confident ?
364585	Has anyone ever sued the US Federal Government ?
364586	Has anyone sued the government and won ?
364587	I am planning a trip to Goa with my boyfriend.Can anyone suggest economical guest houses within the range of rupees < 1k per night ?
364588	Do I have to pay income tax if I have taken a student loan ?
364589	What can I do after age 60 ?
364590	How much sleep do I need after being 60 years old ?
364591	Why can't woodchucks chuck wood ?
364592	When asking a girl to prom , what do you say or do if she says no ?
364593	What can I do when she says no to my proposal ?
364594	How can I get to know god's love ?
364595	Rule of thumb for PhD candidates ?
364596	How do you write an application for a leave of absence for school ?
364597	Which posts are in mpsc ?
364598	Why most people do not prefer DySP in MPSC ?
364599	How can you explain trigonometry in the easiest way ?
364600	Why air gap length is small in induction motor than synchronous motor ?
364601	Can a synchronous motor run as an induction motor ?
364602	What is an Alcubierre Drive ?
364603	What is the most economical way to convert an old sata hard drive into an external drive ?
364604	How do I unblock someone on imo ?
364605	How do I become a politician ?
364606	How do I become a politician in Germany ?
364607	Retargeting : Is it possible to target remarketing ads to visitors of competitor sites or interest group sites ?
364608	Is there a site like Zillow for commercial real estate ?
364609	What is data inconsistency ?
364610	What does data inconsistency mean ?
364611	`` What is the story of movie'' `` Tamasha'''' ?''
364612	In the movie Tamasha , did the director Imtiaz Ali actually mean for Ranbir's character to be bipolar or just a very imaginative and constrained person ?
364613	When will Trump be impeached ?
364614	Does expensive mean better quality ?
364615	Why are excellent quality goods not manufactured as a norm ? Why do we have to buy expensive brands to get quality stuff ?
364616	Why do some smartphones have a non-removable battery ?
364617	Should I get a phone with a removable battery or non removable ?
364618	Should I go to the military college or travel the world and see later what to do ?
364619	What do people generally wear in San Diego in December with 65/70F ?
364620	What are some ways to increase . NET speed ?
364621	How do I keep myself updated about internship available for students ?
364622	Is fish flesh easier to digest than pork or beef ? Why ?
364623	What is the relationship between a US State's Secretary of State and a US County's Election Office ?
364624	What are my chances of attending UC Berkeley with GRE score 290 ?
364625	What is the cheapest way to send a package from the US to Canada ?
364626	How do I send a dog from the US to Canada ?
364627	`` Looking through startup internships , I see'''' no equity'''' in their description . Some have a salary range and still say that , and some just say that . What does that mean ?''
364628	What is it like to use Apache Spark in production ?
364629	How can the balanced chemical equation for respiration be obtained ?
364630	What is the easiest way to balance chemical equations ?
364631	How much do Bollywood actors and actresses actually earn from their movies ?
364632	Are there any Bollywood actors/actress who pay insiders of the industry to get a good role in a movie ?
364633	What are some job opportunities for an aerospace engineer with an Masters / Ph.D in aerospace engineering ?
364634	What is role of a chemical engineer at CFMRI Dhanbad as a project assistant and what facilities are provided by them ?
364635	What are the best ways to utilize free time ?
364636	What is the best way to utilize free time for an IT professional ?
364637	Which physics journal publishes the fastest ?
364638	How hard is it to publish a SAE journal ?
364639	How do I solve the differential equation [math] y = x \ frac {dy} {dx} + \ frac {dx} {dy} ? [/ math]
364640	Why is Baahubali given a 9.4 / 10 on IMDb ?
364641	Is the IMDb's 9.5 rating of the Baahubali movie the highest ever ?
364642	JEE droppers : What was your marks in JEE before and after a year ?
364643	What are the most interesting products and innovations that Spark Therapeutics is coming out with in 2016 ?
364644	How do Jeff steinhauer built a virtual black hole ?
364645	Why isn't my shareit app working ?
364646	What is the proper way to use and dispose of an omamori ?
364647	What is the proper way to brew Japanese green tea ?
364648	What are emailers ?
364649	What's an email ?
364650	Cloud certification ?
364651	How do you show whether 2 ^ n +5 ^ n +2 ^ (n +1) +5 ^ (n +1) is divisiblev by 3 ?
364652	How can you find underground artists ?
364653	How can underground artists be marketed ?
364654	How does an overactive amygdala affect the mind ?
364655	Is it possible to get acceptance into an Ivy League college with a GPA lower than 3.0 ?
364656	Will my deep understanding of programming help me to get accepted into Ivy League colleges ?
364657	How do I concentrate while studying ?
364658	I am planning my honeymoon in January 2017 . Planning to visit Krabi , Phuket , Bangkok with veg food . How do I go about planning this ?
364659	Am travelling with my friends to Thailand between Jan 8 - Jan 15 from Bangalore . Can you tell me how do I plan with visiting Bangkok , Pattaya and Siem Reap ? I would like to know about visas and budget as well .
364660	Why is Gautamiputra Satakarni not that familiar in the Andhra region ?
364661	Why there is no 3g service by Tata docomo in Andhra region ?
364662	Could Avatar : the last airbender work as a live-action TV drama then a Hollywood film ?
364663	What is your review of Avatar : The Last Airbender (creative franchise) ?
364664	How many passengers travel daily in the Delhi metro ?
364665	How can I stop all stinky poor indians from traveling in metro in Delhi/NCR ?
364666	Where can I buy a Dell PowerEdge R805 server ?
364667	Where do I buy Dell PowerEdge server ?
364668	Would not it be better if people start sorting out their own differences by talking rather than posting questions on Quora and then following some random advice given by some random person which is exactly equivalent to living life according to others ?
364669	Do you randomly A2A people on Quora ? Or do you ask based on the person and their answers ?
364670	Whats wrong with my chocolate cake ? (watery batter , coming out undercooked . Tried adding more flour and leaving in longer in the oven to no avail)
364671	Needs More Information : Should I use the no contact rule with my ex girlfriend or try and reach out to her ?
364672	On the 15th I am going to Germany , but this is my first time travelling alone . I am very nervous because I don't know anything like boarding . What is the step-by-step boarding procedure from Delhi International Airport T3 ?
364673	What do I need to know in advance if I am going to travel by plane first time ?
364674	Why do diet sodas have more caffeine ?
364675	Does diet soda have caffeine ?
364676	Which telugu movie has most heart touching climax ?
364677	What are some of the most real and touching movies ?
364678	If I insert a Reliance Jio sim in a 3G phone , will I be able to access the 3G network and surf at 3G speeds ?
364679	What are the limitations of a GPU to work as a CPU ?
364680	Should one invest in CPU or in GPU for CGI rendering ?
364681	How can an average looking guy improve his looks ?
364682	What is the best restaurant at Whistler ?
364683	What are the best restaurants in sacramento ?
364684	Can I use an iMac 21.5 4K (retina) as an external monitor connected to a Windows laptop with Thunderbolt 3 port ?
364685	How do infrasonic and ultrasonic sound waves differ ?
364686	Why can't we hear ultrasonic and infrasonic sound waves ?
364687	When will state merit rank coming out for neet ?
364688	I have scored 478 in NEET 2016 . My gen rank is 11969 and my OBC rank is 4285 . Can I expect any college under state quota ? I am from Bihar .
364689	What is the best HTML and CSS software ?
364690	What is your review of Io.js ?
364691	What is your review of iOS 7 ?
364692	What is the proper pronunciation of the word ` Sidhe' ?
364693	`` What is the proper pronunciation of the word'' `` celtic'''' ?''
364694	There's a girl I like and I told her but she said she's not interested in all this . I want to talk to her , but I hesitate because I'm afraid I will fall in love with her , so I don't talk to her at all . Am I doing the right thing and how can I get over her ?
364695	`` Is the Aryan invasion theory a myth ? Was there no mention about the word'' `` Arya'''' in Hindu sacred texts ?''
364696	What is your review of Aryan Invasion / Migration Theory ?
364697	How do you get a paper receipt from American Airlines ?
364698	How do I deal with a person that tells the same divorce story from 30 years ago over and over ?
364699	How do I set boundaries and earn respect from people that get too comfortable with me over time because I am a friendly and open person by nature ?
364700	How safe is China for students ?
364701	Why can people in China not drive safely ?
364702	What is the meaning of your surname ?
364703	What does your surname mean to you ?
364704	What are the best headphones under $ 75 ?
364705	What is special about students who gets placement over 1 crore at IITs ?
364706	What is special about students who gets placement over 1 crore ?
364707	What were the political views of Charles Dickens ?
364708	Was Charles Dickens a true realist himself ?
364709	What is success ? How can you be successful ?
364710	How can I be successful ?
364711	What is some of the best quality thought-provoking intellectual content online ?
364712	How do you unblock energy flow in our body that flows through our meridians ?
364713	What is your favorite coffee shop in Bay Area and why ?
364714	What is your favorite pastry shop in the Bay Area ?
364715	Is migraine a severe disease ?
364716	What should businessman do with 1.5 million ? Open new business or put into unit trust and use 80 % of the yearly dividend to cover overhead expenses ?
364717	What different tactics can be used to make sure that every businessman in India (small and large scale business) also pays his part of tax ?
364718	How many people sleep with a fan on ?
364719	Why did Pakistan censor Rajnath Singh's speech ?
364720	Why can't we create security that keeps hackers out ?
364721	What tax filing software can I use if I am a US resident living in the US with significant foreign income ?
364722	For a US Citizen , will his foreign interest income and foreign house property income be taxed under the USA tax law ? If yes , under which section ?
364723	How can we have a Direct Democracy system ?
364724	How has direct democracy evolved ?
364725	How can magnesium's first ionization energy be calculated ?
364726	How is potassium's ionization energy determined ?
364727	Is a scientific calculator allowed in the WBCHSE computer science exam ?
364728	Is the use of a calculator allowed in the CAT exam ?
364729	What is it like to experience sexual tension with your sibling ?
364730	What are the different types of communication media and what are some examples ?
364731	How do I get my battle video on Clash Royale TV ?
364732	How do I get one Million Clash Royale gems for free ?
364733	What is a daily life for an author ?
364734	My husband is applying for an H1B visa . What is the procedure to get the stamping date together ? Are two DS-160 forms required ?
364735	Is there any issue with `` dual intent'' when I go for F1 visa stamping since I was on H1B before that ? I didn't apply for Green card etc. while on H1B .
364736	How can a 13-year-old son please his mother ?
364737	Can a 13 year old start a multimillionaire company with his/her mother and receive an investment ?
364738	Aliens sighting in odisha ?
364739	I am an 18-year-old . I find certain older women very attractive , and when they act friendly with me , I do not show a very positive response , however later on I lustily fantasize about them . Is this very wrong ?
364740	I am 28 year old male and I feel I am attracted only to older women is it normal ?
364741	Why are there only 17 languages on Indian currency notes ?
364742	Should Nehru and Indira's potraits be printed on Indian currency notes ?
364743	What are some venture capital firms that focus on early stage investments in Hungary ?
364744	Is capitalism doomed ?
364745	How can I buy a legit social security number and a fake passport ?
364746	How valuable is the CBIP (certified business intelligence professional) certification from The Data Warehouse Institute (TDWI) ?
364747	Can anyone name any reputed CBIP (certified business intelligence professional) certification ?
364748	Future are the possibilities endless with nanotechnology and AI ?
364749	Which field has a better future : nanotechnology or biostatistics ?
364750	Why do we have fuzzy shadows ?
364751	What casts shadows ?
364752	How did dog become man's best friend ?
364753	`` Why are dogs called'' `` man's best friend ?''''''
364754	Should I feel jealous that my boyfriend wants to hang out with a girl alone even though I let him ?
364755	My boyfriend can not let go of my past . I cheated 6 years ago ; he is still bitter . I love him and want it to work , but feel hopeless . What can I do ?
364756	Does Darth Vader know that Princess Leia is his daughter ?
364757	How many Pakistani Punjabis are originally from Indian Punjab ?
364758	When will Pakistani Punjab unite with Indian Punjab ?
364759	What do branded polarized sunglasses like from Maui Jim , Oakley , Ray Ban , etc. provide that the Costco and Wal-Mart polarized sunglasses don't ?
364760	What are some sunglasses and cooler brands ?
364761	What is the most effective way to promote mobile app for Android and iOS ?
364762	While deriving formulas for delta to star conversion , why is the equivalent resistance between A & B Ra + Rb (for star) ? Why it is independent of Rc ?
364763	`` How do animals react to the'' `` psychopath's stare'''' ?''
364764	How do psychopaths react to drugs ?
364765	The screen replacement for the Moto X phone costs Rs 12,000 / - while the current price of the phone itself is Rs 18,000 / - . Is this reflective of the actual cost of the screen relative to phone cost or a pure example of corporate greed to maximize profits ?
364766	What is the cost of the Moto G (2nd gen) screen replacement ?
364767	What does OUT FOR DELIVERY mean - Snapdeal ?
364768	Is snapdeal making profit ?
364769	What caused the decline of boxing in Korea ?
364770	Is North Korea the best Korea ?
364771	Why do you like your parents ?
364772	How do I understand concepts clearly while doing self study ?
364773	How do i discuss problem while preparing gate examination by self study ?
364774	How safe is it logging into a bank account through a personal finance site like Perfios and allowing automatic updates ?
364775	How secure is Perfios to let it handle all the account details ?
364776	What are some lesser-known sights to see when visiting Ambarnath , India ?
364777	What does RPM in the Power Rangers series means ?
364778	How do I become a topper in engineering ?
364779	How do I not dream ?
364780	How do I study Organic Chemistry for JEE Advanced ?
364781	What are some lines about interesting things which manage to make those things look boring ?
364782	Which book is better for practicing aptitude for ibps po ?
364783	Which book should I prefer for SBI Bank PO Exam ?
364784	Can either Romney or Obama speak Spanish ?
364785	Where can I find an unbiased view on Obama and Romney ?
364786	What causes blackheads in the ears ?
364787	What is the best privacy guard for smartphone ?
364788	What is the best privacy guard for android ?
364789	Is there an efficient way to integrate Yammer and Basecamp ?
364790	What is the DARPU for Yammer ?
364791	How do snipers avoid getting bitten by dangerous animals when they're lying down ?
364792	What does it mean when you find pennies everywhere you go , almost every day ?
364793	Where can I find old pennies ?
364794	Why am I too shy to flirt with guys ?
364795	How do I solve the given question ?
364796	How do I solve for x in the given question : (12 ^ x) + (27 ^ x) = 2 * (8 ^ x) ?
364797	How do I start my acting career in Bollywood ?
364798	Is smoking cigarettes in moderation still very bad for you ?
364799	I eventually started smoking cigarettes , but I feel bad because my best buddy hates cigarettes . What should I do ?
364800	NRI TRANSFER money TO WIFE AND SHE DEPOSIT in TO FIXED DEPOSIT in THIS SINARO WILL IT BE TAXABLE for TOTAL money ?
364801	Why India do not have different Time Zone like USA ?
364802	Can dogs eat cooked celery ?
364803	How do you save VEVO videos ?
364804	How can I study for class 11th biology ?
364805	How can I study for class 11th ?
364806	Slope of the line represented by the parametric equations , [math] x = 2t +1 [/ math] and [math] y = t-1 [/ math] is ?
364807	A line represented by [math] y = 3x − 1 [/ math] and a line perpendicular to it intersect at [math] R (1 , 2) [/ math] . What is the equation of the perpendicular line ?
364808	How would you describe a woman with Sun in Cancer , Gemini Venus and Aquarius Moon ?
364809	What are the traits of a Cancer Sun , Gemini Moon and Taurus Venus woman ?
364810	Can machine learning predict stock prices ?
364811	Which ANN algorithms can predict stock prices closely ?
364812	I recently saw a conversation between my guy and his ex and it was pretty flirty . She clearly hasn't moved on and he enjoys the clinginess . How do I get him to fully commit to our relationship ?
364813	My Brahmin friend was close to a non-Brahmin guy . She never realized that she was getting too attached to him . He has become a part of her life now . But when she got to know that he is getting married , she lost herself . She went mad and is not able to accept this fact . How can this be fixed ?
364814	Did Jesus like bananas ?
364815	Why is Jesus named Jesus ?
364816	How can I get a replacement Social Security Card without any form of ID available ?
364817	Can I take protein powder without prescripton ?
364818	What kind of health care should I buy before I move to US ? (My wife and me and two kids)
364819	What should I say to wife who is always trying to manipulate me to choose between my kids or my parents ?
364820	How do I get credit card If salary is less than 12,000 INR ?
364821	How much electricity would one need if humans would run on electricity ?
364822	Why does Blu-ray use so many layers of digital rights management ? Does it restrict usage of the discs ?
364823	How do I use the Samsung Wi-fi adapter for my Blu-Ray player ?
364824	What's a good book to read on self-improvement ?
364825	Is Lucas Perez a good signing for Arsenal ?
364826	Quotes on loving yourself after a separation ?
364827	How does one transfer WhatsApp backup cross platform from BlackBerry 10 to iOS ?
364828	What are some good websites to learn French well ?
364829	What are good learning resources for old French ?
364830	How do I pay with a RuPay card on IRCTC or Tatkal booking ?
364831	Why do people ignore silent and shy people ?
364832	Why do people make fun of shy a person ?
364833	What are the best books on Islamic philosophy ?
364834	How do I measure my IQ at home ?
364835	How do people born blind and deaf think ?
364836	What are the arguments against affirmative action ?
364837	Is affirmative action a form of discrimination ?
364838	Where can someone find models of atomic structures on the Internet ?
364839	Is there a course on Business Model ?
364840	How can an international student learn German ? Is German a tough language to learn and interpret ? How long does it take to prepare my basics ?
364841	Is German one of the toughest languages to learn ?
364842	Does B.tech in IT comes under graduation in Science ?
364843	What are some tips for playing Minecraft on a PC ?
364844	Is it legal to include someone's full email , not their email address , to you in a published book of yours without his or her permission ?
364845	How else can I market my web design business ?
364846	What are the best ways to productize a web design business ?
364847	Do girls like to have sex with virgin guy ?
364848	Do girls like virgin guys ?
364849	What are some good undergraduate courses for commerce students abroad ?
364850	Which course is best for commerce students to pursue if they want to go abroad ?
364851	How come millets became so popular in India now for its health benefits which was not so just a couple of years ago ?
364852	I am a dentist . Six years ago I moved to UK from India . Now , in my 30s , I am looking for a change in my career . Is this a good idea ?
364853	What are some good examples of advance birthday wishes ?
364854	Why does Trump wear the end of his ties below his belt line ?
364855	Why are there a lot of Indians on Quora ?
364856	Does my friend still like me ?
364857	Why do my friends still like me ?
364858	How do I see a deleted comment on Instagram ?
364859	Where can I download the font San Francisco ?
364860	What are some fonts like San Francisco ? I have heard it's nearly identical to Roboto . Roboto isn't everywhere , but Segoe UI looks similar .
364861	Which is a better cost wise in the long run , a hybrid or gas car ?
364862	What is an example of a bad trip on shrooms ?
364863	What happens if you eat melted plastic (ice cream bowl kind of thing) ?
364864	What causes foaming at mouth ?
364865	What causes bleeding to come out of your eyes , nose , ears , mouth , navel , and head ?
364866	Who is the creepiest person you ever met ?
364867	Who is the wittiest person you've ever met ?
364868	Do Indian men marry white women ?
364869	`` Why do we say'' `` on the team'''' but'' `` in the club'''' in English ?''
364870	'''' `` The reason why ... is because ...'''' I heard that this is common usage for English-speaking people . What is the correct grammar and what do people usually say ?''
364871	Has KTM Duke 125 launched in India or is it going to be launched in 2016 ?
364872	Https://www.change.org/p/https-w ... ALL TORRENTS USERS NEED TO SIGN THIS PETITION TO RENABLE TORRENTS ?
