488774	How do I downgrade iOS ?
488775	How do I see a sunrise in Goa ?
488776	Where are some good locations in San Francisco to see the sunrise ?
488777	Does the government benefit from student loans ?
488778	Is there any benefit to paying off $ 180k in student loans that have defaulted ?
488779	What universities does American addiction Centers recruit new grads from ? What majors are they looking for ?
488780	What's the whole process for registration in miss India contest and what basic eligibility or criteria is required for that ?
488781	Where can I learn SPSS in North India ? What are the eligibility criteria and fees structure ?
488782	I met a person on Instagram talking to me all day but from a fake account . Is there any way to know who exactly the person is ?
488783	What do you mean of terms of trade ?
488784	`` What is the meaning of the term'' `` trade fire'''' ?''
488785	Do all current day African Americans trace their ancestry back to slavery ?
488786	What's the best way to earn Rs 10000 in one month ?
488787	How long does it take to die from being burned alive ?
488788	If you get shot , how long would it take to die ?
488789	If three non-HIV couples have unprotected sex among themselves , do they have a risk of developing HIV/AIDS ?
488790	Does having unprotected sex automatically lead to HIV/AIDS ?
488791	How do you stop people from following you on Quora without blocking them ?
488792	How can I remove a follower on Instagram without blocking them ?
488793	What is the best option to pursue after 12th if I'm interested in Maths and why ?
488794	What are your thoughts about Kevin Owens WWE Universal title winning moment ?
488795	Why do I keep having dreams with my ex boyfriend in them ? Is it because he is thinking of me ?
488796	How can a solo traveler get laid ?
488797	I am a wannabe solo girl traveller from Chennai . What are the reccomended places to travel solo ? I am eager to travel and explore but safety matters
488798	How does a boy get a girl ?
488799	Why can't we see Mercury and Venus despite these two planes being in between the Sun and the planet Earth ?
488800	If a planet orbited between two suns would it's equator be cold (and poles be warm ?) ?
488801	At what age do kids learn the difference between male and female genitals/genitalia ?
488802	Why do pheromones work ?
488803	How do pheromones work ?
488804	Gunda (1998 movie) : Where can I watch it with English subtitles ?
488805	How is junior college in Singapore compared to India ?
488806	How can one be sure that a person is really sleeping or pretending to be , without letting him know if he is pretending and without waking him if he is really sleeping ?
488807	Which are the best universities in UK for computer engineering ?
488808	Which is the best university in UK for Automotive engineering ?
488809	Why does black-on-black crime go unnoticed ?
488810	Similarities between law and morality ?
488811	Who are more successful in life in terms of well-being , judgers or perceivers ?
488812	What happened to the Anonymous feature on Quora ?
488813	Is the anonymous feature in Quora permanent ?
488814	What is the most interesting job for foreigners in Japan/Tokyo ?
488815	First time in Japan : where should I stay in Tokyo ? Hotels ? Ryokan ? Other ?
488816	I was reading Warren Buffett's book The Snowball . What is intrinsic value and margin of safety ?
488817	Are the ancient Norse a hoax ? Or not ?
488818	How is your first job experience ?
488819	What is activated complex ?
488820	What is organized complexity ?
488821	What is my internet connection type ?
488822	What type of facilities to connect to the Internet are there ?
488823	How many guerrillas are there in Libya ?
488824	What kind of future and job opportunities await students pursuing bsc physics in India ? What should they do for successfully life ahead ?
488825	How much does it cost to create a speakeasy in a box-truck ?
488826	What universities does Global Indemnity recruit new grads from ? What majors are they looking for ?
488827	What universities does Erie Indemnity recruit new grads from ? What majors are they looking for ?
488828	Why did Vishnu and shiva fight ?
488829	Iraq would support India or Pakistan ?
488830	What will be the ramifications of Osama bin Laden's death ?
488831	Why aren't more people bothered by all the celebratory hoopla surrounding Osama Bin Laden's death ?
488832	How is the Internet speed at SVNIT , Surat ?
488833	What is your review of SVNIT Surat ?
488834	What is your review of The Sims 2 ?
488835	What is your review of The Sims 4 ?
488836	When did Dylan tried LSD ?
488837	Which exam is needed to study an MS abroad ?
488838	How famous is Tamil Actor Vijay around the globe ?
488839	What is a good product to buy and sell ?
488840	Can a body moves in a frictionless surface ?
488841	A force is exerted at the edge of a wheel on a frictionless surface . Is the net force equal to that force even if wheel doesn't move translationally ?
488842	What is the use of . arxml file in AUTOSAR software development ?
488843	Which is best online community to learn AUTOSAR software ? And to solve doubts related it ?
488844	Who was India's worst Prime Minister ?
488845	Are Soap Web Services Stateless or Stateful ?
488846	Can someone master all of the functionalities of Microsoft Dynamics 365 ? How can you do that and what's the scope ?
488847	What do final year students feel ?
488848	How do I make a 3D printer as my final year project ?
488849	What characteristics make for a good data scientist ?
488850	Is INTP good at becoming a data scientist ?
488851	Tomorrow is the result of my 12th board exam and I'm getting restless . How do I calm myself down ?
488852	How do I get journalism experience ?
488853	What if a girl never did masturbate ?
488854	Why was the Battle of Wounded Knee fought ? Who won the war ?
488855	Why was the Battle of Wounded Knee fought ?
488856	Is track bias a major factor in handicapping greyhound races ?
488857	Is there a formula to win in a horse race ?
488858	How are the hostel accommodations on VIT Chennai campus ?
488859	How is the VIT Chennai campus ?
488860	How can I reduce international roaming charges ?
488861	How do I avoid international roaming charges ?
488862	How can I choose my career ?
488863	How could I choose my career in modelling ?
488864	Is there a comprehensive list of the top 100 news websites in the world ?
488865	What are some of the top U.S. news websites ?
488866	Which self-discipline should we maintain while studying the 2nd year of electrical at the IIT ?
488867	I am a 2nd year student from IIT BHU studying material science . What does one need to do if he/she wants to get a job in a computer science company ?
488868	What does it mean to sweep someone off their feet ?
488869	What is the best way to sweep someone off their feet ?
488870	Which are the best countries to study law ?
488871	With Google , Facebook , and the rest , why would a VC want to invest in any other ad-based web company ?
488872	Is it free to consume alcohol in the campuses of Google , Facebook or any other tech company ?
488873	What could be the reason for an extreme chest pain that happens like once every 2 months or more ?
488874	My girlfriend has been touched (boobs) severally by a relative and there has been 2-3 incidents where someone else touched her boobs . Is she slut ?
488875	How did you get admitted to MIT ?
488876	Where are Google photos stored and how do I move them ?
488877	How do Litmus and E-mail on Acid compare ?
488878	Is there any comparable free version of litmus.com email newsletter testing viewer ?
488879	What is the easiest way to understand differential equations ?
488880	How does one stop taking everything personally ?
488881	Has anyone ever had sex with his sister ?
488882	What's the next big thing in social media marketing ?
488883	I'm a 3rd year B.Tech CE student . How will I prepare for the GATE examination ?
488884	I am an ECE 3rd year student . How can I prepare for the GATE without any coaching ?
488885	Any experience of Hampta Pass trek in Mid-September especially with Youth Hostel YHAI and is there any chance to see patches of snow ?
488886	What was the first known skirmish , tussle , tense confrontation , or outright attack to have happened between European settlers and native Americans ?
488887	What is retrograde motion and how can it be measured ?
488888	Do Muslim men need the permission of his first wife to marry a second wife ?
488889	Does a Muslim man need to ask his Christian wife for permission to marry a second woman ?
488890	Who is the least intelligent person ?
488891	Who is the most intelligent person according to you ? Why ?
488892	Which countries have the tradition of taking off shoes before you enter a home ?
488893	Only Asians take their shoes off when entering a house ? How about the other counries such as America ?
488894	How was Neil Menon's talk at TEDx MSRIT ?
488895	Is there a possible way to attend only Neil Menon Sir's talk at TEDx MSRIT ?
488896	How do I convince my parents to let me go for a picnic ?
488897	We are a 3-year-old IT firm trying to expand our business and get some more clients . How can we break into new markets ?
488898	Is more value destroyed by large companies trying to expand into new non-core areas than is by startups focusing on these areas ?
488899	Why do we have buttons on suit sleeves ?
488900	Is it okay to wear a short sleeve button up beneath a casual sports coat ?
488901	Why do Muslim women believe in Islam when there are so many articles in it that discriminate against them ?
488902	What is the difference between the degree and order of a differential equation ?
488903	How do I factorize a differential equation of first order and higher degree solvable for p ?
488904	Which countries have 2-day weekend and why ?
488905	What is the mystery of Timbuktu ? Why is it too popular in public imagination ?
488906	What did Timbuktu look like at its peak ?
488907	How can you determine the percentage of a standard deviation ?
488908	How do I calculate standard deviation ?
488909	Are women attracted to men on date with other women ?
488910	Are feminine men attractive to men and/or women ?
488911	What documents do I need when I pitch venture capitalists or angel investors ?
488912	When neutral and ground wires get interchanged , there is flickering in the tube lights . Why ?
488913	Are NCERT books enough for preparation for the Manipal engineering entrance exam ?
488914	Which books should I prefer to prepare for manipal medical entrance exam ?
488915	What is the difference between scheduled caste (SC) and scheduled tribe (ST) ? How government has classified tribes and caste into it ?
488916	Are there any good free site to learn meditation ?
488917	Where can I learn to meditate ?
488918	How do I get facial hair i.e. beard faster ?
488919	What do king parrots eat ? How do they adapt to their environment ?
488920	Ratio of salary of Sagar , riya , and mayank is 9:8:7 and ratio of expense is 12:11:10 is it possible to determine who will save the highest ?
488921	How many questions must be soved from irodov for JEE ?
488922	Which are the most important questions of IE Irodov for JEE Advanced ?
488923	`` Who was the most famous'' `` Elvis'''' before Elvis Presley ?''
488924	How can the landforms of the Canadian shield be described ?
488925	Does my power bank need the flashlight on to charge ?
488926	What is the prescribed book for Mechanical engineer students to clear the ISRO scientist/engineer SC exam ?
488927	What is the prescribed book for CS students to clear the ISRO scientist/engineer SC exam ?
488928	Is it true that after joining TCS , it sends some employees to USA for about 5 Years ?
488929	Can someone help me figure out international shipping for a Kickstarter card game project ?
488930	Are there any global statistics on professional photography ?
488931	Which are some professional photography jobs ?
488932	How much is the minimum wage in Chile and how much does it take to live well in Santiago ?
488933	What is the minimum wage to live in Singapore for a family ?
488934	What are some of the key aspects of biodiversity ?
488935	What is it like to be a corporate lawyer in India ?
488936	How much are lawyers in India paid ? What is the starting ? Also , particularly how much do corporate lawyers earn ?
488937	Is this grammatically correct ?
488938	`` Why has the successful YouTube channel'' `` Vice'''' stooped so low as to create a series of videos with young children telling dirty/mature and sexually explicit jokes ?''
488939	How do I upgrade my PC scanner ?
488940	What should I upgrade on my PC ?
488941	`` What is the difference between'' `` to'''' and'' `` into'''' ?''
488942	Sheryl Sandberg : Have you taken nootropics or any other cognitive enhancers ?
488943	What is it like to take Ritalin as a nootropic to enhance cognitive performance , rather than for ADD ?
488944	Which is better for mechanical engineering : Srm Modinagar or Satyabhama University Chennai ?
488945	After I lift I play basketball for a half hour and don't feel sore at all , but when I lift without playing I feel sore ?
488946	Is it useful to read poetry ?
488947	What is it like to be an attractive person ?
488948	Is fish red meat ?
488949	Is bacon red meat ? If not , why ?
488950	How can I make hard water from distilled water ?
488951	How can I convert hard water to soft water ?
488952	What are some of the best TV series to watch as of January 2015 ?
488953	Is the latest system update for Lenovo K3 note good ?
488954	Which are the few best and trusted immigration consultants for Canada in Kolkata ?
488955	Is it easy to end your own life ?
488956	What cars do rich people really drive (or get driven in) ?
488957	How can I design a reinforced concrete beam subjected only to an impact load ?
488958	Can people with myasthenia gravis donate organs ?
488959	Does salt make water boil faster ?
488960	Which is the worst product you bought in 2016 ?
488961	Are products bought from Paytm 100 % genuine ?
488962	Is it possible to switch from a service based company to a product based company ?
488963	How long does it take chlorine to off-gas from city tap water ?
488964	Why do legs itch after shaving ?
488965	Why does my face itch after a shave ?
488966	+ + + Instant calling @ 1877 ^ @ | 778 ^ @ | 8969@++ for KASPERSKY antivirus Tech Support Service ?
488967	What sectors of the job market are the most competitive in Boston ?
488968	If the Republicans historically were opposed to slavery and pro civil rights , why do African Americans tend to support Democrats ?
488969	Is it possible mod/crack all android apps ? What knowledge is needed to mod/crack apps ?
488970	What's the best android app to easily crack wifi passwords , in the Android Market ?
488971	What is the best way to spend 10 Lakh INR with a fairly decent risk liability ?
488972	A dishonest dealer sells goods at 30 % of profit but uses only 800 grams in the place of a kilogram weight . What is his real gain percentage ?
488973	In Tolkien's universe , is a powerful being more synonymous with an intelligent being than a being of physical/military might ?
488974	Do employees at Citizens Business Bank have a good work-life balance ? Does this differ across positions and departments ?
488975	What are some high voltage electric shock device ?
488976	Why do we get electric shock ?
488977	What does a cockroach infestation smell like ?
488978	Why do some people hate San Francisco ?
488979	Do people break into cars in San Francisco ?
488980	Lord of the flies why does piggy die ?
488981	What are the benefits of acrylic solar nails ?
488982	Can you tell me what you know about Buddhism ?
488983	Can you tell me what you know about Zen Buddhism ?
488984	How to prepare for IITJEE 2017 with class 11 portion also to cover ?
488985	What is the best way to help with the Nepal disaster ?
488986	Will Uber replace the car industry ?
488987	How can you get your partner to admit they are lying ?
488988	What is it like to work in KPMG ?
488989	What is it like to work at KPMG Bangalore ?
488990	Where can I get previous year CT question papers of SRM university ?
488991	How can I get Pre-IAS in Kolhapur's previous years question papers ?
488992	Can we use articles before gerunds ?
488993	`` When do I put the article'' `` the'''' instead of'' `` a'''' ? When do I not use an article at all ?''
488994	What is my Wi-Fi password ?
488995	What does the number' 786' actually indicate as per the religious beliefs of the Islam ?
488996	What are good examples of an email to send when an IT platform is scheduled to be unavailable because of an update ?
488997	Is email marketing a good option for inviting people to use an app ? Where can I get examples of a custom email ?
488998	Have you won a lottery ?
488999	What would you do if you won a lottery ?
489000	Your phone number has been banned from using WhatsApp . Does anyone know how to work your way around this and why this would have happened ?
489001	Why did Roman Saini resign from IAS ?
489002	How did Roman Saini feel when he visited his mother place for the first time after becoming IAS ?
489003	Why some websites show noticeable lag when scrolling down ?
489004	My site loads slow , How can I speed it up ?
489005	What have you learnt during your CA articleship period ?
489006	I think this guy likes me , but I'm not quite sure . Is there any signs in text messages that could make it more clear if he likes me or not ?
489007	Are their other creatures in the universe other than humans ? Something like aliens
489008	I broke up and now he is threatening saying he will never let me go to another guy . And if we go to police , he will leak our kissin pics/videos . Help ?
489009	Why am I always stressed and depressed ?
489010	How can electronics engineering help in the banking sector ?
489011	How can CS engineering help in banking ?
489012	Are black holes portals ?
489013	Rajiv Gandhi said 15 % of money for poor reaches them . Which money was he talking about ?
489014	Which is the best magazine for CAT ?
489015	Aesthetics : Is birdsong actually music or just a sound ?
489016	Is demonetization of Indian currency even legal ?
489017	What does Starbucks symbol really mean ?
489018	What are some ways to double an investment ?
489019	What was the longest sex you have had ?
489020	Which are the leading men's T-shirt brands in India ?
489021	What are some best brand of cotton T-shirt and shirts for men in range of Rs 1000 ?
489022	. o (. (9yease km ?
489023	Did Mark Zuckerberg take adderall ?
489024	Should I take Adderall to study ?
489025	How do I increase the fan speed of a cooling pad ?
489026	Does the number of fans in a laptop cooling pad matter much ?
489027	What is the most important question in life ?
489028	What should I include in my graphic design portfolio other than university assignments ?
489029	Can I take Hortonworks data platform certified developer exam second time ?
489030	How do I remove Facebook friends from my friend list that blocked me ?
489031	What are the tax implications for a resident Indian receiving equity in a US-based privately held company in return for services rendered ?
489032	How does it feel working at PlayStation America ?
489033	How does PlayStation Now work ?
489034	Adam D'Angelo : What makes a startup attractive to talent in its earliest stages ?
489035	Why do so many people follow Adam D' Angelo ?
489036	How do all the top public research universities in the U.S. (Berkeley , Michigan , Washington , Wisconsin , UCLA , UCSD) all compare with each other ?
489037	What does IT stand for ?
489038	What is ` Muharram' ? What does it stand for ?
489039	Can I crack IIT JEE with 5-6 months of preparation ?
489040	Can the IIT JEE be cracked in 7 months ?
489041	What is the salary of a drug inspector ?
489042	How do I become food and drug inspector ?
489043	What is the best programming language to develop a bookings website like Booking.com ? And why ?
489044	Is Google Go ready for production use ?
489045	Is Google using Go for any major projects ?
489046	What are the side effects of being a dedicated UPSC aspirant ?
489047	Are likability and empathy tied together ? Is it possible to be likable if you don't care about others , or do you have to take caring ?
489048	What are Tamil people great habits ?
489049	What are some great Tamil lyrics you've heard ?
489050	Why do people judge things they don't understand ?
489051	What would happen if a button battery is dropped into water ?
489052	Why is water added to lead acid batteries ?
489053	Why are white surfaces not mirrors ?
489054	If you had a magic wand to solve just one of your problems as a high school guidance counselor , what would that problem be and why ?
489055	What is the difference between contaminating and contaminated ?
489056	What is the difference between contamination and pollution ?
489057	What did the Roman Empire trade ?
489058	What is it like to study health economics ?
489059	What motivates people to study Health Economics ?
489060	What are the steps to be followed to create my own penetration test lab for free ?
489061	Why don't we use a plane mirror instead of projection screen ?
489062	`` Is a 5.5'''' penis too small ?''
489063	Is an 8 1/4 inch long and 6 inch in girth penis too small for a girl ? I am 15 , by the way .
489064	Rooting Samsung Galaxy S4 sm-975L ?
489065	Why there is a need to take a Java thread dump and heap dump , and what do they do ?
489066	How do I dump a java program into a micro controller ?
489067	What is the liter volume of an H tank of oxygen at 2015 psi ?
489068	What volume of oxygen is present in 1 RBC ?
489069	Email : How can I write an email to top executives that will most likely get a response ?
489070	Who in the world would you most like to email ?
489071	My WhatsApp web is not working . I'm using the Chrome browser on my Windows 8.1 laptop , and the internet speed is decently good . I opened web.whatsapp.com and the QR code doesn't load up at all . It just keeps going round and round . How can I fix this ?
489072	When will Zoos be banned ?
489073	Why don't Muslim countries intervene in Myanmar ?
489074	Why do I get so nervous ?
489075	If Hillary Clinton wins the presidency , do you think she will win a second term and if not , who in the Republican Party is likely to succeed her ?
489076	My notice period is two months in my current company , but I have some good offers for another company . They need me to join in one month , but my current company is not relieving me . What should I do in that case ?
489077	I got a good offer from a Malaysian company and they told me to join in one month . I am currently working at a company in India , I have a 3 months notice period and I am in my first month . What should I do ?
489078	Are there Hindu Private Schools in America ?
489079	How does America's private school system work ?
489080	If you want to start a start-up , what do you do and why ?
489081	Where do you start if you want to start a start-up ?
489082	Does fuel sensors ?
489083	How do I make Quora feed interesting ?
489084	How is technology changing the culture of Switzerland ?
489085	What is the shortest PhD thesis in economics ?
489086	What are some obscure benefits of being raised in America ?
489087	What is the best card trick to teach a beginner magician ?
489088	What are the best magic card tricks ?
489089	Which are some helpful coaching centre in Pune for UPSC ?
489090	What is used to measure the size of your potential audience ?
489091	How is bolt size measured and what are some examples in how it is measured ?
489092	Why is it that so many teachers come into the job idealistic and sweet and leave sour , miserable , hateful old prunes ?
489093	`` What is the tone of'' `` The Oval Portrait'''' by Edgar Allan Poe ?''
489094	What consequences can I face If I deposit someone else money in my account ?
489095	Are there homeless people in Denmark ?
489096	What is the history of threads in operating systems ?
489097	Why is the world in so much debt ?
489098	I have waffle looking rash on my back , what can it be ?
489099	What is the best way to keep waffles warm ?
489100	Why do restaurants in the US not swipe the credit card post-tip ?
489101	In Indian restaurants I have seen some folks write the tip amount on the slip that you have to sign on after you swipe your card . Does that really work ?
489102	What do people who believe in god do when they have doubts over his existence ?
489103	Why do some fairly intelligent people believe in God without ever doubting his existence ?
489104	Why did Bombay turn Mumbai , Calcutta turn Kolkata ?
489105	Which city is better to live in : Kolkata (Calcutta) or Mumbai (Bombay) ?
489106	What are some good bollywood movies after 2005 ?
489107	What are some good Bollywood movies from 2011 ?
489108	Are GM foods sterile ?
489109	Why do the usually good NGOs start spreading rumours about GM food sources , ignoring the evidence for it ?
489110	Use of ap in daily life ?
489111	Do Amtrak trains get delayed when there is a snowstorm ?
489112	How do I recover pictures from SD card on MAC ?
489113	What inspired The Boondocks (TV series) ?
489114	Why is The Boondocks (TV series) considered an adult show ?
489115	My sister and I had life-threatening accidents the exact same day . Did god try to punish us ?
489116	How much does dentist earn in the Cayman Islands ?
489117	How much does a dentist earn in Dubai ?
489118	How can I connect a 1TB HDD to Sony Bravia TV which has an HDMI port ?
489119	Does DC flow through conductor ?
489120	I don't know if my problems are real or made up . Sometimes I do exaggerate them so I can continue going to therapy and feel special . What should I do ?
489121	Is starting an organic egg poultry farm in India a viable business opportunity ?
