200940	What does it take to be a stand-up comedian ?
200941	How can I master coding ?
200942	How much air is escaping into space in a year ?
200943	How much air escapes earth's gravity every year ?
200944	Why is DC excitation used in a synchronous alternator instead of AC excitation ?
200945	Why is DC excitation used in a synchronous alternator instead of AC ?
200946	Is Mumbai a good place to live ?
200947	Is Mumbai a good place to settle ?
200948	As an ex Christian did you speak in tongues was it real or you faked it ?
200949	As a former Christian , did you speak in tongues ? Was it real or were you faking it ?
200950	What would happen if everybody in world were to shout at same time ?
200951	What are some facts about Canada ?
200952	What are five facts about Canada ?
200953	What are some good project topics for learning natural language processing ?
200954	What are some good topics for learning natural language processing ?
200955	What is devolution ? What are examples of this ?
200956	What are examples of devolution ?
200957	What are your favourite British tv shows/sitcoms/series ?
200958	Which is the best institution for CAT preparation in Hyderabad ?
200959	How should I plan for marriage stuff before 1 year ?
200960	How do I plan for my marriage stuff 1 year before ?
200961	Why do Indians keep deleting the true and factual comments about India in Quora ?
200962	Why do Indians keep deleting factual and true comments about India in Quora ?
200963	What it is being of your age ?
200964	What is it like to be your age ?
200965	How would the world change if all mosquitoes suddenly died ?
200966	Would the extinction of mosquitoes change anything in our ecosystem ?
200967	How is vegetable oil refined ?
200968	What is the process of vegetable oil refining ?
200969	What are some of the best psychological horror films ?
200970	What is the function of prokaryotic cells ?
200971	What are the functions of prokaryotic cells ?
200972	Is there a free download for Microsoft Windows 7 ?
200973	How can I download Microsoft Windows 7 for free ?
200974	What are the types of microcomputers ?
200975	What are the best high-quality Android games ?
200976	Which are the best high graphics Android games ?
200977	What are good free alternatives to Microsoft Word ?
200978	What are free word processing alternatives to Microsoft Word ?
200979	Why is Nostradamus so famous ?
200980	What is Nostradamus famous for ?
200981	What is transcription and translation in cells ?
200982	What are transcription and translation in a cell ?
200983	`` In Freemasonry , Why was the letter'' `` G'''' in the middle of Square & Compass deleted in some jurisdictions ?''
200984	Australian deserts can reach over 40 C but Australia is still not one of the hottest countries in the world . Why is it not ?
200985	Why is Australia not one of the hottest countries in the world ?
200986	I want to start my own watch company . How can I begin ?
200987	How can I start my own watch company ?
200988	Why is Apple removing the gun emoji and replacing it with a water gun ?
200989	Why did Apple change the gun emoji ?
200990	Is the European Union project destined to fail ?
200991	Which is the best web designing services in Hyderabad ?
200992	Who provides the best Web designing services in Hyderabad ?
200993	What is the difference between democratic socialism , and social democracy ?
200994	What's the difference between democratic socialism and social democracy ?
200995	What are the differences between faith , belief , hope and trust ?
200996	In religious context , are there any differences in faith , belief , trust and hope ?
200997	What is the price of a tinnitus masker in India ?
200998	What is cost of tinnitus masker in India ?
200999	Which are some of the best fiction books written in first person ?
201000	What are some good fiction books written in first person ?
201001	Donald Trump said his father gave him a small loan whereas Hillary Clinton said it was in the millions . Who was right ? Was it a loan or not ?
201002	Was Donald Trump or Hillary Clinton right about the size of the loan Trump's father gave him ?
201003	How long did it take you to get a job after graduating ?
201004	How long did it take you to get a job after graduation ?
201005	Is there actually a pay gap between men and women ?
201006	Is there a pay gap or an earnings gap between men and women ? Either way , can anyone prove it's mostly because of sexism ?
201007	Where can I buy good henna powder ?
201008	Where can I buy good henna ?
201009	What is the average weight of a 14 year old ?
201010	What's the average weight for a 14 year old ?
201011	Do atheists fear dying ?
201012	Are atheists are afraid of dying ?
201013	'''' `` Which is better One Plus Three or Samsung Galaxy A7 (2016) ?''''''
201014	Which is better smartphone to buy : Samsung Galaxy A7 (2016) or Oneplus 3 ?
201015	How is MGM medical college for mbbs ?
201016	How is MBBS at MGM Medical College , Navi Mumbai ?
201017	How do I enhance my communication and soft skills ?
201018	How do I enhance my Soft skills ?
201019	What is some information about Pushpak Vimana found in Afghanistan ?
201020	Recently I have read in newspaper about ancient vimana found in afghanistan ? But it didn't given good depth information , if one can give please I have so much interested
201021	What are some interesting facts about dogs' psychology ?
201022	What are some interesting dog's psychology facts and instances of real life ?
201023	What is meant by biasing a diode ?
201024	What is the purposes biasing of diodes ?
201025	Can colourblind people dream in colour ?
201026	Do colourblind people dream in the way they see colours ?
201027	What do men find attractive in women ?
201028	Why does life get complicated once you grow up ?
201029	Why does life becomes complicated as we grow up ?
201030	Which glue is best for repairing a cricket bat ?
201031	What do you think of gravity as an entropy issue ?
201032	What do you think of gravity as an entropy effect ?
201033	Why does Venice have so many canals ?
201034	How was Venice built ?
201035	Is Obama really going to give away control of the internet ? How and why is this a good idea ? Won't this threaten free speech ?
201036	Should Obama give away the Internet ?
201037	Who was William de Burgh ? Is he related to Edmund Burke the English politician ?
201038	Who was William de Burgh ?
201039	How did China became a manufacturing powerhouse ?
201040	Why is China such an economic powerhouse ?
201041	How can counterfeit currencies ruin a nation's economy ?
201042	If you could enter the reality inside a movie , which movie universe would you choose , and what would you do ?
201043	What are the best English TV series ?
201044	Can we see light , or do we see objects that reflect light ?
201045	Can we see light ?
201046	What is the best , or most interesting question on Quora ?
201047	What are some of the main organs of the digestive system ?
201048	What are the the major organs of the digestive system and their functions ?
201049	What was it like to cosplay as a mermaid underwater ?
201050	What was it like to cosplay as a mermaid swimming underwater ?
201051	How do you convert kilowatts to megawatts ?
201052	How do you convert an hour of kilowatt use to megawatts ?
201053	How should I make myself wake up early ?
201054	If you were the last person on Earth , what would you do ?
201055	What would you do if you were the last living person in the universe ?
201056	What are some amazing facts related to pharmaceutical fields ?
201057	What are some amazing facts related to pharmaceutical field ?
201058	How do I deal with a rejection ?
201059	How to deal with rejection ?
201060	Blogs : How do I design a professional blog ?
201061	How should I design a professional blog ?
201062	Do Psychopaths have microexpressions ?
201063	Should India have more states ?
201064	Will India benefit from smaller , more manageable states ?
201065	Is Mexico City dangerous ?
201066	Why is Mexico City dangerous ?
201067	What are the Air Force bases in the US ?
201068	Where are all of the U.S. Air Force bases ?
201069	How rich is Trump ?
201070	How wealthy is Donald Trump ?
201071	What is formwork ?
201072	What is the formwork ?
201073	What is a capacitor bank and why is it used ?
201074	What is your dream job ? Are you already doing it ?
201075	What is your dream job ?
201076	What will David Cameron do after he relinquishes his job as Prime Minister ?
201077	What will David Cameron do after his resignation ?
201078	How do I find female cofounder for my startup ?
201079	How do I find a female cofounder ?
201080	Which questions do you never want to see again on Quora ?
201081	What are the questions you hate to see again and again in Quora ?
201082	Why are there so many faking things in the world , including the fake UN tribunal in Hague ?
201083	Where are the best beaches in Puerto Rico ?
201084	What are the best beaches in Puerto Rico ?
201085	What is the fastest production car in 2016 ?
201086	`` What are some of the most'' `` perverse'''' questions (unexpected , shocking) in Quora ?''
201087	What is the most shocking question one could ask on Quora ?
201088	What factors differentiate Usain Bolt from others that make him run so fast ?
201089	Is drinking orange juice good for your immune system ?
201090	Why is orange juice a good option for you when you have the flu ?
201091	What is the black box and white box perspectives of systems ?
201092	What is the difference between black box testing and white box testing ?
201093	What's your favorite retro console ?
201094	What is your favorite Retro console ?
201095	If human population growth is gon na continue at high rates , is it better that the growth happens in developing countries or in developed countries ?
201096	If human population growth is going to continue at high rates , is it better that the growth happens in developing countries or in developed countries ?
201097	How do I start learning about artificial intelligence ?
201098	How can I make myself more attractive as a girl ?
201099	How can I make myself more attractive to girls ?
201100	If you were designing a tank for urban warfare what would it look like ?
201101	How would be the life of IAS officer ?
201102	Are corporations more powerful than governments ?
201103	Do corporations have more power than the government ?
201104	What is the way to get rid of poverty ?
201105	Why is the world crazy about Game of Thrones ?
201106	Why is everyone going mad about Game of Thrones ?
201107	Why we need to study ?
201108	Why Nepal was never made a British colony ?
201109	What are the best European football clubs ?
201110	What is the best European football club and why ?
201111	With which character of Friends do you closely associate yourself with and why ?
201112	Which Friends character do you relate to the most ?
201113	Which actor/actress plays their character the best in Game of Thrones ?
201114	What is the mystery behind Bermuda ?
201115	What is mystery behind the Bermuda triangle ?
201116	What is cavity ?
201117	What is a cavity ?
201118	`` What are some books similar to'' `` To Kill a Mockingbird'''' ?''
201119	`` What are some books similar'' `` To To Kill A Mockingbird'''' and why are they similar ?''
201120	What is the best logo design ?
201121	What is a good logo design ?
201122	Does ` nt reservation violates right to equality ?
201123	Is reservation in India against the right to equality guaranteed by the constitution ?
201124	How can I deal with jealousy ?
201125	Is 1 a prime number ?
201126	How do I overcome from the nervousness during interviews ?
201127	How do I avoid nervousness during interviews ?
201128	How can Latin be used to exorcise a demon ?
201129	Why is Latin used to exorcise demons ?
201130	What are examples of fixed interval schedules ?
201131	What is a fixed interval schedule ? What are some examples ?
201132	Why is Tim Dees now not allowing comments ?
201133	Why does Tim Dees not allow comments on his answers ?
201134	How can I become part of the 1 % ?
201135	How can one become part of the 1 % ?
201136	What you should do when you are jobless ?
201137	What should you do when you are completely jobless ?
201138	Why do dogs like to smell other dogs' butts ?
201139	Why do cats and dogs smell each other's butts ?
201140	Is there a medical insurance system in Turkey ?
201141	Is there medical insurance system in Turkey ?
201142	How long would it take for Microsoft to respond after an onsite interview for internship ?
201143	How long does it take Microsoft to respond after an on-campus interview ?
201144	What should I do when a girl I like has already a boyfriend ?
201145	What should I do girl I like already have a boyfriend ?
201146	What are the opportunities of intercultural ?
201147	What are the opportunities of intercultural communication ?
201148	Which is the best organic chemistry book for JEE ?
201149	How do I cheat in an exam and not get caught ?
201150	How can I cheat in exams ?
201151	What would a nuclear war between Russia and the US look like ? Which side would surrender first ? What would be the aftermath ?
201152	What if nuclear war broke out between the US and Russia ?
201153	How much can Crime & Investigation Network or any other network pay for episodes from another country ?
201154	Why does my head hurt when I study ?
201155	Why does my head hurt when I try to study ?
201156	What are some cultural differences between China and Taiwan ?
201157	What kind of government is Russia governed by ?
201158	What kind of government does Russia have ?
201159	How do I verify Facebook page in India ?
201160	Do aloe vera products have a long-lasting effect ?
201161	Do aloe vera products have long lasting effect ?
201162	Is Taylor Swift a bad example for teenage girls ?
201163	In what ways is Taylor Swift a good / bad role model for young women ?
201164	If the devil asked God to forgive him , being that God is all forgiving , would he forgive Lucifer and let him return to the kingdom of heaven as an angel ?
201165	What are some stereotypes people have about Turkey ?
201166	What are the major stereotypes people have about Turkey and to what extent are they true ?
201167	Is it possible to clear the CAT if I start preparing from today ?
201168	Will I be able to clear CAT if I start preparing from today onwards ?
201169	Who is Azor Ahai in Game of Thrones ?
201170	What is Azor Ahai ?
201171	Why was the Cold War fought ? Who was involved ?
201172	Where and why was the Cold War fought ?
201173	What is the best compliment you have ever got from a stranger ?
201174	What is the best compliment you have ever received by a stranger ?
201175	How can we learn all the trigonometric formulae with Euler's formula ?
201176	How can we learn trigonometric formula with Euler's formula ?
201177	Examples of sole proprietorship ? The
201178	How will Hurricane Matthew affect the presidential election as Florida is a key state ?
201179	What are tips for starting your own cleaning service ?
201180	What are some tips for starting up a cleaning business ?
201181	Who is the best band ever ?
201182	What does it feel like in space ?
201183	What is it like in space ?
201184	What is the first moment you remember in your Life ?
201185	What are ways to ease my mother's regret of not attending school ?
201186	What are ways I can ease my mother's regret of not attending school ?
201187	Have you worn an unused plastic garbage , trash , bin bag/liner as clothing ?
201188	Will you wear an unused plastic garbage , trash , bin bag/liners as clothing ?
201189	How should one ask for an internship ?
201190	How should I ask for an internship ?
201191	How much power do prime ministers/presidents really have ?
201192	How can I deal with depression and low self-esteem ?
201193	What squat routines can help you lose weight ?
201194	Why aren't women treated at par with men in the Indian Armed Forces ?
201195	Why doesn't the Indian Army treat men and women as equals ?
201196	What happens on a pre-employment background check if you have hospital bill dept ?
201197	What happens on a pre-employment background check if you have hospital bill debt ?
201198	How do you remove coffee stains between my teeth ?
201199	How can I remove coffee stains from my teeth ?
201200	Where can I find various large foam mats in Australia ?
201201	Where can I get various types large foam mats in Australia ?
201202	Do eyebrows grow back ?
201203	What is the use of rational numbers ?
201204	What are applications of rational numbers ? How are they used ?
201205	What happens if we shampoo our hair daily ?
201206	What happens to our hair if we shampoo everyday ?
201207	If you committed suicide would you still go to heaven ?
201208	How do I deal with back pain as a teenager ?
201209	Is attestation required for admission in IGNOU ?
201210	Is attestation required for admission IGNOU ?
201211	What is the correct way to live life ?
201212	How can you fix the ringer of an iPhone ?
201213	How can I fix the ringer on my iPhone ?
201214	Which is best android phone under INR 7000 ?
201215	Which is the best android phone below 7000 ?
201216	Which are the best drama movies of all time ?
201217	Why is Pakistan denying that Indian army crossed LOC in Indian surgical strikes ?
201218	What is the difference between a laser printer and an inkjet printer ?
201219	What is the difference between a laser printer and an inkjet printer ? How are they similar ?
201220	Will Obamacare be repealed now that trump won ?
201221	Will Obamacare be repealed / shut down soon ?
201222	How can I get a cure for headache ?
201223	What will be the scenario if humans disappear from earth ?
201224	Hypothetical scenarios : What would happen if humans disappeared from Earth ?
201225	What is the age when a person should ideally retire ?
201226	Which according to you is the best innings played in ODI Cricket ?
201227	Which is the greatest innings in ODI cricket according to you ?
201228	Which is the best place to study ?
201229	Where is the best place to study ?
201230	Can Tesla coil be used to transmit electricity wirelessly to a specific object ?
201231	Is tesla coil the only device so far invented for transmitting electricity wirelessly ?
201232	How we could see black colour which has no wavelength ?
201233	How do I prepare to get an internship ?
201234	Which is the best service lg washing machine repair center in hyderabad ?
201235	Which is the best service lg washing machine service center in hyderabad ?
201236	How can I remove tar from my carpet ?
201237	What is the best way to remove tar from carpets ?
201238	Why do some successful people commit suicide ?
201239	Why successful people commit suicide ?
201240	When do we get an update for lollipop for htc 820g + dual ?
201241	Will there be lollipop or marshmallow update for HTC DESIRE 820G + DUAL SIM ?
201242	What are the best custom essay writing services ?
201243	What is the best custom essay writing services ?
201244	Why don't space shuttles create a sonic boom ?
201245	Do space shuttles create sonic boom ? If no then why ?
201246	What is the worst customer service you've ever experienced in India ?
201247	What is your worst experience of customer service in India ?
201248	How long can white wine last after it has been open ?
201249	When will the housing bubble burst in the Bay Area ?
201250	When will the housing bubble in the Bay Area burst ?
201251	What are some ways to get in contact with someone in jail ?
201252	How do you contact someone in jail ?
201253	Why can women have multiple orgasms and keep going while men can not ?
201254	My doctor misdiagnosed a broken rib as costochondritis for 2 years . Can I sue him for the 2 years of pain , and possibly causing more damage ?
201255	Can I sue a doctor for misdiagnosis of a broken rib for 2 years ?
201256	Which are the upcoming residential projects in Mumbai ?
201257	What are some upcoming residential projects in Mumbai ?
201258	Which person came the closest to ruling the world ?
201259	Is it possible to develop apps for iOS using a Windows/Linux PC ?
201260	Is it possible to develop apps for iOS using a Windows or Linux PC ?
201261	What are the names of other solar systems found ?
201262	What are the names of other solar systems ? How were they discovered ?
201263	`` What are some movies which are as good as'' `` The Man from Earth'''' ?''
201264	Is there movies similar to The Man from Earth ?
201265	What should the Labour Party do to win the next general election ?
201266	How can Labour win the next general election ?
201267	What is an inanimate object ?
201268	What is an inanimate object ? What are examples of inanimate objects ?
201269	What can we learn from Donald Trump ?
201270	What can people learn from Donald Trump ?
201271	What are hookah pipes used for ?
201272	What is a hookah and what is its origin ?
201273	How do I make my study interesting ?
201274	What would you do if you caught your child watching porn ?
201275	You walk in on your teenager watching child porn . What do you do ?
201276	How does a 17 year old make money without working ?
201277	How can I improve myself and figure out what should I do with my life ?
201278	What could be the max speed with 72V , 70 amp and 2000 watt motor ?
201279	What could be the max speed of my bike with this specs (72V 70 amp with 2000 watt motor) ?
201280	Where can I learn Hadoop from ?
201281	Where should I learn Hadoop ?
201282	Which app changed your life ?
201283	How do I get a individual telephone calling list ?
201284	`` How does one develop'' `` game'''' ?''
201285	How do you develop a game ?
201286	How do I locate someone with just a picture ?
201287	How can you find someone with just a first name and a picture ? Is it possible ?
201288	What song is played in the comedy central ad for the Season 4 of The Mindy Project ?
201289	What song is played in Comedy Central's for Season 4 of The Mindy Project ?
201290	Why don't some peoples answers have a place to comment ?
201291	Why don't some answers on Quora allow comments ?
201292	What precautions are to be taken before and after gall bladder removal surgery ?
201293	What precautions one must take before and after removal of the gall-bladder through surgery and for how long ?
201294	How hard is it to get into IIMA ?
201295	How tough is it to get into IIMA ?
201296	What is Zika virus and how is it transmitted ?
201297	How is Zika virus spread ?
201298	Do you think Bollywood actors doing Sikh roles need help of Turban Training Centres for best turbans just like in Punjabi movies ?
201299	Do you think Bollywood actors doing Sikh roles need help of professional turban trainers from Punjab ?
201300	How can you cure a knocked up pink eye ?
201301	Will Hillary Clinton participate in the next elections of presidency in 2020 ?
201302	Do plants respond to music ?
201303	Are plants affected by music ?
201304	Do you put faith in horoscopes ?
201305	Do you put any faith in horoscope signs ?
201306	What Quora user would you most like to have lunch with ?
201307	If you could have lunch with a Quora writer , who would you choose ?
201308	How well do you need to prepare yourself to score a rank in CA IPCC ?
201309	How do I score a rank in CA - IPCC ?
201310	Which websites do you frequently visit ? Why
201311	Which websites do you frequently visit ? Why ?
201312	What are all the colleges in south India good for biotechnology ?
201313	Who is the super master astrologer ?
201314	Who is the real super astrologer ?
201315	What are the components required to build a mobile jammer ? Request
201316	Why do I get jealous of other people ?
201317	What happened in 1492 with Christopher Columbus and the Native Americans ?
201318	Can somebody explain to me on what happened with Christopher Columbus and the native Americans ?
201319	Which college shall I choose between VNIT Nagpur and NSIT Delhi for CSE ?
201320	Which is better : NSIT Delhi or VNIT Nagpur ?
201321	What is your favorite athlete ?
201322	Who is your favorite professional athlete , and why ?
201323	Why don't people think someone will become a trillionaire ?
201324	Is it possible for someone to become a trillionaire ?
201325	What is the most valuable food for a body builder ?
201326	Food for body builder ?
201327	Where is the centre of gravity ?
201328	How can you get rid of bullies ?
201329	How can you get rid of a bully ?
201330	Difference between heat and temperature ?
201331	What is the difference between temperature and heat ?
201332	What is a good idea for an artificial intelligence project ?
201333	What is life like as celebrity ?
201334	What is life like as a celebrity ?
201335	What is the best MacBook laptop ?
201336	What is the best MacBook ?
201337	What metals can you take to a scrap yard ?
201338	What's the ending of the tv show lost , I don't get it can some one explain it to me ?
201339	My GPA is 2.9 , I took 163 hours and still have 31 hours is it possible to reach 3.0 ?
201340	Can I raise my GPA from 2.9 to 3.0 knowing that I took 163 credits and still have 31 credits to have ?
201341	What's the definition of a sociopath ?
201342	What is the definition of sociopathic ?
201343	How can I get out of suicidal depression ?
201344	How do I stop suicidal depression ?
201345	Can you change your eye color by hypnotizing yourself that you have a different eye color ?
201346	Can I change my eye colour using hypnosis ?
201347	Is Coolpad a reliable brand ?
201348	Is Coolpad a reliable brand ? Which is more reliable , Coolpad or Micromax ?
201349	Is tax money being spent to finance President Obama's extensive campaigning for Hillary ?
201350	Is taxpayer money being used for Obama to campaign for Hillary ?
201351	How does Quora decide that a particular answer has been viewed ?
201352	How does Quora calculate views on a particular answer ?
201353	What is c programming language for today still work ?
201354	How is C programming language still used today ?
201355	What are some good ways to get out of a rut ?
