368218	Why are steam condensers operated at the vacuum?
368219	What is a critical vacuum in condensed steam turbine?
264312	What are the differences between impact wrestling and WWE wrestling?
264313	What are the differences between WWE and impact wrestling?
171647	Why is hot water heavier than cold?
425523	What is the difference between single beam and dual beam osciilloscope?
425524	What's the difference between a single and double beam oscilloscope?
86985	How can I replace my Apple headphones?
86986	How do I replace Apple earbuds?
490738	Where can I legally watch the Ghost in the Shell animes online? Is the original Shirow manga available online anywhere?
490739	Is ghost in the Shell anime worth watching?
102219	How can you know that someone is using your instagram account?
114851	What language is used in operating systems?
448111	Are there any hacks in clash of clans to become co leader or leader?
448112	How do you become a union leader?
88739	Is voice data streamed out of a Google Home or an Amazon Echo device before “Alexa” or “Hey Google” is spoken?
88740	What can I do with Alexa/Amazon Echo that can't be accomplished with a Google search?
280956	How can I get a scholarship when in college?
229107	Have you ever had any problems with people just because you were walking your dog even though the dog is well behaved and did not bother the person?
229108	I need some profitable YouTube video marketing niches?
390363	How badly doomed I am if I scored 2nd division in my 12th boards (CBSE)?
136356	Do crop circles damage crops? How?
43678	Why does the Catholic church discriminate against gay people?
480146	What is it like to be on a one night stand with a celebrity?
499528	How can I become a good blogger?
192601	What's going to happen between Russia and Turkey now the Russian ambassador is dead?
192602	What will happen now that Russian ambassador was killed in Turkey?
362401	How can I fix a broken computer screen?
362402	How can you fix a damaged computer screen?
417748	"In French, how do you say ""welcome""?"
18016	What is the Crush Card Virus card in Yu-Gi-Oh?
484778	Can digital technology cut down our carbon footprint?
534008	What universities does Atrion recruit new grads from? What majors are they looking for?
532172	What is a feminist?
481288	As a gay man, am I supposed to shave my armpits?
307356	Is there such thing as asking a stupid question?
307357	Is there such a thing as a stupid or a dumb question?
521865	Why did Estonia withdraw from the 2015 Sledge Hockey B World Championships?
521866	What is AA hockey? How is it played and how is it different from regular hockey?
285390	What is an intervening certificate?
285391	Does OCJP certificate considered as global certification?
54080	What are the best solutions for a global team to share files?
104474	How hard would it be to run iOS on a Android phone?
510595	How are junction boxes used?
510596	Why are junction boxes used?
212634	What's the argument for the electoral college?
180756	Is dragon ball an anime?
180757	My girlfriend birthday is on Monday. How can I plan it and make it the best birthday of her life?
317231	How do I control sexual urges as a student?
317232	How do I control my sexual urges in the classroom?
125992	If you are given a chance to become some celebrity what will be your choice?
337788	Does change.org really work in India?
390902	How do you as a newbie get into aerodynamics and drone creation and understanding?
390903	How can I get the parts if I want to make any drone or robot?
409224	What is shell scripting in linux?
535184	What is this type of optical machine readable code called?
535185	Are there humans who code in machine language?
479021	What are the programs in a school annual function?
479022	What are the programs in a school annual day?
115121	"If you were to remake the film ""Sholay"", which present-day actors would you cast to do justice to the film's characters? Why?"
145834	Is it ok to attend a US visa interview with a shaved head?
516866	What is YOUR strategy for gaining a loyal audience for YOUR blog?
439210	What is the best tool for deploying .NET applications?
439211	Which book best net for GS?
334930	"Is ""Signs"" based on real events?"
235057	I'm planning to apply for a job that is totally different from my college major. any advice?
235058	Which state in india has mbc community?
456589	What is the best AngularJS IDE?
365984	I had unprotected sex (but he didn't cum) on Dec 23 and my period came on Jan 3, am I pregnant? (my last period was on December 3)
337784	What are some interesting one liners?
43793	What are the steps that I can take to stop marriage hall nuisance operating next to my house causing too much sound from music and chattering etc?
43794	What movies have a scene where a prisoner, locked in his cell, is burned alive?
7759	What is meant by overfitting?
7760	What is overfitting?
57290	What is real love and fake love?
385768	What are some unexpected things first-time visitors to Uganda notice?
260071	Can convincing someone to commit a crime be a crime?
260072	Are you committing a crime by telling someone else to commit a crime? A specific crime?
359898	How can I know about my past life.?
359899	How do I know if I have a past life?
519397	What is your transformation story?
303510	Do Muslims spit in the food before serving it to others?
303511	Would people like to get sanitation options from hotels and restaurants before the food is served?
379916	Which is your favourite sport and why?
412455	What are some ways to sand down concrete?
412456	How do you sand concrete yourself?
289459	What will you do if one day all the restrictions were removed and all resources were given to you for free?
289460	What would you do if you were given a day and all the resources needed to do whatever you wanna do?
499091	What are the best horror stories books to read?
338000	Can you suggest me any inspiring movies like Pursuit of Happiness?
84690	How do you overcome feeling emotionally drained?
297164	What are some good classic books?
487006	Why is Forex so popular in Nigeria?
487007	What is wrong with Nigeria?
125614	How much will it cost to take a trip from India to Tomorrowland?
125615	What would it realistically cost to go to Tomorrowland?
449019	How do I transform myself from an amateur web designer to an excellent one in 6 months?
449020	What are the opportunities for chemical engineering students to be a scientist after completing B.Tech.?
303512	What if everything is a wave, and there are no particles?
428181	Does stringing together element symbols from square patterns on a periodic table make secure passwords?
428182	If it requires a supernova to create elements with a higher atomic element than Fe, Iron, how on Earth (pun intended) do we create elements that are much further up in the Periodic Table of Elements?
314550	Is it a good idea to learn Vim and Programming at the same time, so I can get used to code on Vim?
314551	Should I learn programming and Vim at the same time so I can get used to code on Vim?
441745	When will the states of the USA begin seceding to form nations?
441746	How do I get the binary code of any file?
200782	Why are sharks scared of dolphins?
334527	Do employees at Nike have a good work-life balance? Does this differ across positions and departments?
116440	Where in Bangalore is The Hobbit: Battle of the Five Armies played in HFR 3D?
116441	How was Gandalf imprisoned at the end of The Hobbit: The Desolution of Smaug and the beginning of The Hobbit: The Battle of the Five Armies?
153511	What is the hot water (kind of tea) that is given in Chinese restaurants in USA instead of water?
376465	How do I sign into my Facebook with a new cell number and stop the code from going to other?
376466	My new mobile number is linked to the Facebook account of an unknown person. I'm getting unintended messages from Facebook. How do I solve this issue?
278896	Which is better WD Passport Ultra 2TB or Seagate Backup Plus slim 2TB?
109268	How much time does a load balancer take?
199248	What is Islamic banking?
199249	What is Islamic banking all about?
321066	Do arranged marriages happen outside of India?
469164	How can I root my Sony xperia Miro?
469165	How do I root Sony Xperia Z2 6.0.1?
328074	What does it need to become a fashion blogger?
328075	What do I need to do to become a fashion designer?
432603	Is it possible to convert a car with a turbo diesel engine into a naturally aspirated petrol engine?
432604	Is it possible to convert a natural aspirated diesel engine into a turbo engine?
402426	Which mobile is best either redimi note 3 or Le 2?
402427	How can I get some videos about KPOP girl group I.O.I?
171172	How are Koreans and Japanese different?
115865	How would a psychopath/sociopath deal with a physically abusive partner / family member?
115866	I am getting 150 approx out of 250 in wbjee. will I get any government college?
377009	Can I eat banana at night?
377010	Can we eat bananas at night?
333103	Which are the best masters programs for Computational Science in the world?
333104	What are the best Masters programs in Computer Science?
131823	Can WhatsApp messages be deleted once sent?
375247	What is the best possible cheap way to reach Tolani Maritime Institute from pune by public transport?
375248	Compare the life of a marine engineer at tolani maritime institute to that of a IITian graduating from CSE dept. in old IIT?
95115	Does Rahul Gandhi laugh at Pappu jokes?
171811	What is the scariest thing that ever happened to a Google Street View mapping vehicle?
171812	How do Google Street View cars work?
71312	What is the name of some top sensor manufacturing companies?
71313	How do you cope when your lover starts loving someone else and you even see him sad for the other girl?
417039	Why do we laugh when we get tickled?
417040	Why don't we laugh when we tickle ourselves?
459551	Is there any law in India which stops companies from making female employees wait in office till very late at night?
459552	Is there any law in India which stops companies from making female employees wait in office till very late at nigh?
70556	What is the bussiness model of reliance geo?
70557	Why can't the government be more transparent/accountable for U.S mass surveillance?
305341	Is there a way to remove a US president if s/he is proved to be too radical/harmful (for US) in his work as a president?
313725	What is your review of Rab Ne Bana Di Jodi (2008 movie)?
313726	Why is Rab Ne Bana Di Jodi (2008 movie) so underrated?
108541	How can I talk in English?
153092	How can I send text messages to cell phone numbers from my desktop computer or my iPad?
153093	How do I determine if a phone number is a Google Voice number?
71003	Do others agree that The Walking Dead has become boring and repetitive?
71004	Do you think that The Walking Dead has gotten very boring lately?
280959	What is the best way to promote a Kindle book?
280960	How does one promote their Kindle Books?
390597	Which one is the best coaching institute in India?
390598	What is the best coaching institute in kota for medical?
411624	What is hawala business?
529045	How many calories a day should I burn?
24744	What type of barbell should be used for a snake-eye tongue piercing?
24745	How do you clean and care for a tongue web piercing?
480128	How should i study for my 12th class board exams if i need to get atleast 95%?
337261	What is the SCP Foundation? Is it real?
337262	What are some horror writing tips we can get from the SCP Foundation website?
527421	Who's your least favorite teacher? Why?
325810	Would Paul Dano make a good Ignatious in film version of A Confederacy of Dunces?
237022	Where can I watch Boruto (Naruto the movie) with Japanese audio and not Korean or English dubs?
155301	Why are Yorkie/Corgi mix puppies coveted among breeders?
79382	What do you think about indonesian politic?
69428	How can I start a career in advertising fraud?
69429	What is the best way to start a career in advertising?
303197	How does the appraisal system work in Cognizant?
303198	I want to work for Cognizant Technology Solutions. What should I do?
360079	Which programming languages are commonly used by mobile app developers?
360080	Which programming languages are used for the development of the different operating systems for mobile?
328264	What are the benefits of using GitHub?
513521	What are some very beautiful chemical reaction mechanisms?
513522	What are some of the most beautiful chemical reactions?
516183	What is the difference between partners and collaborators?
516184	How do partners in big 4 bring business?
144889	Which PDF generator library does Amazon use to generate invoices/documents in PDF format?
144890	What is the best Python library to create PDF documents?
64406	Is it OK to give dogs rib bones? Why or why not?
64407	How long should you boil a beef rib bone before giving it to your dog?
280364	Which one is more elastic in their property Elastic material or Brittle material and how?
280365	What is a Bearded Clam?
459907	How does aging affect someone's EEG power spectrum when alert?
459908	Does aging affect neural firing rates?
170767	Why do many Tamil brahmins refer to themselves as Tambrahm instead of just as a Tamilan?
214081	Which is best coffee machine?
483719	Why do I feel like dying? I am balding
401618	What are some good topics for a research paper about horses?
401619	What is a good topic for a research paper regarding city and university?
475881	What is the smartest, weirdest, most elegant coding solution to a problem you've ever come across?
475882	What are some simple looking yet thought provoking codes (programming codes) you have come across?
273956	"Why are certain Quora ""Top Writers"" almost always in my feed despite me following neither them nor the topic of the question they are answering?"
33277	What are the most active music communities online?
33278	What are some active groups/communities related to Fight Choreography? (Online or not)
206363	Do I need to use conditioner after using baby shampoo?
82246	What is the correct pronunciation of 'gentry'?
408697	Why is life shit and so hard?
276563	Can I play WWE 2K16 on Intel i3 (5th Gen) 4GB RAM with Intel HD 5500 Graphics?
276564	Can I play WWE 2k16 on intel HD 5500 graphics?
390995	For learning PHP how many programming languages must be known?
180833	What is the best security camera sytems?
180834	What are some good security camera systems?
185921	I have a 15mm kidney stone. Is it possible to dissolve it using medicines with no operation?
185922	How do I eliminate kidney stones?
191498	What are the products of yeast fermentation and how are they used?
191499	For what products is the yeast fermentation needed?
476306	Have you ever scammed a scammer?
194077	How do Australians feel about Asians?
251894	What will happen if we take marijuana for a long time?
321464	Why doesn't America just nuke the countries supporting Isis?
535849	What is the Black Death and what were the effects?
535850	What is the black death?
500080	How it is like to kill a terrorist?
500081	What is it like to be a terrorist?
241611	What happens if my cat eats raw pork?
176719	What's the best gaming PC I can build for under $600?
176720	What is a good gaming pc build for around $950?
212871	How can I trace my stolen Fitbit?
289041	If Donald Trump and Hillary Clinton are both so historically unpopular in the U.S, then how come they won their respective parties nominations?
367963	How would you solve algebra problem?
367964	What is the best way to solve algebra problems?
497953	Why should we live in this world?
461849	How did Anchorage, AK get its name?
461850	What is it like to live in Anchorage, AK?
343599	How is a oily and dry face be prevented?
254543	What has your experience been like working at Google as a TVC Temp Contractor?
412233	What are the best quality of our Prime Minister?
412234	I'm an undergraduate and want to work as a content writer. Can anyone suggest some real online jobs?
133317	If you had 3 years to live and $3 billion to spend, what would you do?
68494	When was the last time you have felt loved?
68495	When is the last time you felt like you were the happiest person in the world?
285764	How do I promote my music and make money?
285765	How do I promote my SoundCloud music and make money?
110971	Which is the best free VPN 2016 to download Torrents?
363161	How would one go about doing topic modeling using deep neural networks (not deep belief networks)?
363162	How does one do topic modelling using which deep learning algorithm?
72387	Should one address a Thai professor by his first name or his last name?
72388	My father's middle name is Kumar. But in his 10th mark sheet only his first name and last name are written. Will there be any problem while processing his passport?
525854	A plant and a poisoned barrel of wine
267733	How much money would Bernie Sanders' proposal to provide free college tuition cost?
409349	Who is the real hero in Nepal rescue operations, Modi Ji or the rescue teams?
249731	Which is the most widely used database among relational and non-relational databases used in applications and devices?
249732	Which relational database is the most widely used?
323841	How can I intern at Snapchat while in high school?
323842	How can I become an intern at Snapchat?
37988	Are some people born more evolved/closer to enlightenment than others?
37989	Do enlightened people get angry at those who cause suffering?
236943	What should be my diet plan for fat loss without getting my health weak?
144651	How do I download players in laptop?
144652	How can I download c++ for my laptop?
64231	What are the traits of a person with an omega personality?
64232	How do you know if you are an omega personality?
276918	Which exams can a chemical engineering final year student write for getting a job (like Gate for PSUs)?
47684	What happens after you lodge a police complaint on women’s grievance cell w/o giving your address details, will action be taken against the culprit?
47685	What is the Process of Lodge a Complaint against an Inspector In Charge, who mis behaved because I have not greeted before entering into the Police Station?
473301	What are the promotion opportunities for a bank so it officer?
473302	What is the scope of promotion for specialist officers in banks?
107771	How do I get good grades in College? I want to get better grades in the following semester. Please give me tips..
107772	What are the ways to get good grades in college?
419649	How do I convert PSD to HTML?
198014	What do I do, if I like someone and I think they like me back?
198015	How do I get over someone not liking me back?
133049	Is it worth moving to New Zealand leaving a well settled software engineer life in India?
133050	Is New Zealand 3-5 years behind in software engineering technology trends?
358963	"Are the team behind ""The One Minute Manager"" still working and writing?"
358964	What is that makes oneself work hard when one has all the resources required to succeed?
187308	Have Snapchat glasses achieve the sales goal or not? What's Snapchat glasses sales goals?
187309	Adviceable to quit job for 3 month notice period?
514111	If a Bollywood movie were made on the life and career of Pravin Kalyan Amre, what would be its opening scene?
514112	If a Bollywood movie were made on the life and career of M.S. Dhoni, what would be its opening scene?
373907	"With the rapid expansion of social media and organizations such as Facebook & Twitter building new server farms to meet the demand of its users, does anyone know the ""carbon footprint"" (now / projected) of social media, for both providers and users, globally?"
373908	How can we attract user for our new social media platform? Should we wait for social response or go for marketing? Suggestions please.
345545	What is the best public sector bank to join in IBPS PO?
345546	What are the best bank options in IBPS exams?
185171	What is it like working for the asian development bank? Are you happy? Why or why not?
327993	What do Apple employees think of the Note 7 problems?
327994	How much math do I need to learn game theory?
460103	Does IIFT take admission through CAT scores apart from IIFT's own test? If yes, what are the cut-offs?
459872	How do I align my sales and marketing team?
459873	How do you fix the alignment between the sales and marketing teams?
94860	What are the benefits of a billing software?
94861	What is the benefit of billing software?
222769	What are some “non-cubicle” jobs for MBA graduate?
222770	How long can I keep my car AC on while my engine is running but car is parked?
355111	Can I continue my studies even if I didn't get admitted to any college because of cut-off marks?
431644	How do I make and iOS and Android app for my Django website?
159993	How much should be my income at the age of 27?
159994	How much is the average income per age in the U.S.?
183760	What is the best way of investing money in India?
476669	What is the name of the plant?
361278	What is the pixel density (PPI- pixel per inch) of a 40-inch full HD (1920x1080) TV screen?
361279	What are the differences between WXGA and HD?
366838	Is astral travel safe if some one does it through meditation?
397682	I'm from north india and want to travel solo. Is it safe for a girl to travel alone? If yes then suggest some places.
308586	In a 800m race P beats Q by 35 seconds and Q beats R by 15 seconds while P beats R by 160m. What is the time taken by P to complete the race?
510697	I am 12th class non medical students. I want to be an IAS. What should I do after 12?
177011	What is Devry University's mascot and why?
151442	Are humans only body and soul, or is there more? What is the nature of our soul? Do animals have souls?
151443	Do animals have souls?
289796	What are good projects on GPU computing that can give you a publication?
26057	Is there an encyclopedia of the imaginary?
26058	Package in HCL for fresher?
520683	Which is the best way to prepare for the 1Z0-862 test?
397459	Can someone make $1m in a week? How?
343514	What are the best and fastest ways to increase vocabulary for CAT level?
343515	What is the best and easy way to learn vocabulary for the CAT exams?
197543	What are some book recommendations on the British Industrial Revolution?
179324	Can i get the waiver on late fee on my HDFC bank credit card?
290076	What should be and shouldn’t be stored in a database?
290077	What item(s) should be sold in a convenience store near you that aren't?
370541	What are some easy methods to get Flipkart and Amazon shopping vouchers?
370542	What are some sites where I can get free Flipkart and Amazon shopping vouchers?
273819	How do you form a coalition government?
189591	What is a coalition government?
536236	GATE 2016 Chemical Engineering: What could be the highest marks and cutoff rank for psu?
536237	I am expecting around 50 or 52 marks in GATE chemical engineering 2016. What rank can I expect?
313436	Do you generally like clowns, why or why not?
286210	What are some examples of romantic Korean dramas that are popular in the West?
286211	Are Korean dramas popular in the west?
133527	Linked representation of queue?
133528	Are there any useful resources (preferably e-books/links) of unbiased representation of indian freedom struggle post revolt of 1857?
68951	How do 2-way speakers work?
68952	What are two-way speakers? How do they work?
86075	How much of a difference does a consistent sleep schedule make?
86076	How does the time of sleep (not hours of sleep) affect us? Would sleeping 7 hours starting from 2AM or starting from 11PM make a big difference?
375164	Does high school or college prepare you for real life and real work in the field of computer science?
335850	Who is better in concert -- Taylor Swift or Katy Perry?
335851	Which singer is better, Taylor Swift or Katy Perry?
272478	Why does my email keep getting hacked? How can I fix this?
272479	What can I do if my email keeps getting hacked?
59112	Where can I purchase wholesale clothing?
216574	Where can I buy wholesale clothing online?
247798	Which is the best way to propose my crush on WhatsApp?
206313	My ex boyfriend moved on so quickly in one week. Now he is making me jealous because he has a new girlfriend. He sends me pictures of them both. What should I do?
508981	Do employees at Great Western Bank have a good work-life balance? Does this differ across positions and departments?
42885	How can you make your mobile app viral?
505644	Why is WordPress's SEO better than a custom made site?
505645	How do I optimize a WordPress site for SEO?
267414	What are cold hearted crimes?
102399	My girlfriend says she loves me and I believe her. Every two or three days she starts little arguments with me and I don't think she values my emotions or personality like she used to. I want to leave her, but I can't because i still feel love for her. What should I do?
154411	How do I get more friends?
340598	What do you think about Snapdeal's biased survey by AIRLOYAL and paying people to trend a pro-Snapdeal tweet ?
340599	Is there a profit for Snapdeal by paying through cards?
51461	What causes eye color?
51462	What causes variations in eye color?
276267	Is there a web site to see all Political candidates info for state or local Govt positions in the USA?
309695	How many times should a sales person insist on calling a client to make a sale?
309696	What makes a good sales person?
19794	Is Donald Trump fact free?
19795	"Is Donald Trump ""fact free""?"
402176	What are all the types of chemical reactions?
402177	What are the five types of chemical reactions?
482722	What does code sharing means?
70584	What is shadow wage rate?
197950	What is the difference in age when someone becomes a 'sir/madam' to you?
197951	Does love become less enjoyable as we age?
343556	How are men supposed to accept pay equality when women at Princeton are prostituting themselves?
343557	How do I deploy PostgreSQL on VM? Manual says it's not recommended.
111527	How long does a tan last?
