484468	My daughter has been treating her horse very strangely lately . I'm really creeped out . What do I say ?
484469	Whenever I ask a friend if they want to hang out , they say that they're busy . Are they really busy , or am I creeping them out ?
484470	Can an obc get into an NIT (other state) with a rank of 280000-300000 ?
484471	Can an ST get into an NIT (other state) with a rank of 280000-300000
484472	Why do I feel unwanted even with my closest friends ?
484473	What is the craziest or most creative (and non-violent) way in which you have gotten back at an ex - for wronging you ?
484474	`` When your grown adult children say derogatory statements about something you no longer want to argue over ; is it okay to say'' `` well , you must know'''' ? ... my grandmother used this phrase to stop the arguments in our family , I think it's perfect , my kids'' `` hate'''' it .''
484475	How can I keep my composure when someone is about to say/do something I know I don't want to deal with ?
484476	If changing from $ 1 bill to coins would save $ 4.4 billion over the next 30 years , why isn't the change made ? What is the disadvantage of having $ 1 coins ?
484477	What would be the best African country to retire in ?
484478	When should one join internships ?
484479	When should we work on internships ?
484480	Who are some good couple counselors in New York ?
484481	How should I react if my mom tells me that I am not a lady and if my mom gets angry when someone gives me a compliment ?
484482	How competitive is the hiring process at Home Properties ?
484483	How competitive is the hiring process at Post Properties ?
484484	Why there is no strip club in India ?
484485	Are there any legal strip clubs in India ?
484486	What are 10 things to do in dhanbad ?
484487	How can I become more playful as an adult ?
484488	What are some ways to become more emotional ?
484489	What should I do that makes me Unique in any ordinary gathering ?
484490	What is your Vision of Bhartiya Janta Party without Sh . Narendra Modi ?
484491	What is the basic difference between Arabic and Urdu ?
484492	Game of Thrones Season 6 Episode 4 : What did the High Sparrow tell Tommen in secret that he repeated to Cersei ?
484493	In season 6 episode 7 of GOT can someone tell me why people think what Tommen did was bad ?
484494	Who invented Kleenex's running-out peach tissues concept ?
484495	How do the PM and Prez get women ?
484496	I worked for 1month and absconded from accenture within bond period will they take any legal action?will it effect when joining other company ?
484497	How do I tighten my loose belly skin after pregnancy ? -
484498	How can I tighten my skin after pregnancy ?
484499	Is liberalism a moral intuition ?
484500	How much weight do I need to lose to get lean ?
484501	What is the difference beer , wine , whiskey , vodka , rum and any other such categories ?
484502	When is the next hearing on triple talaq case in supreme court India ?
484503	As a first time dropper which batch should i choose alchievers last batch or leader last batch at allen kota for neet 2017 ?
484504	How do I get my pictures from iCloud ?
484505	When did One Piece episode 452 originally air ?
484506	How should I buy Xiaomi Redmi note 3 in a flash sale ? Today the window closed within a minute .
484507	Why was ` Avatar : The Last Airbender' better than ` The Legend of Korra' ?
484508	In Avatar the Last Airbender and Legends of Korra , what do you believe are the limits of each type of bending ?
484509	Can anyone have friendship with a boy/girl without falling in love with him/her ?
484510	How can I be friends with a girl without falling in love with her ?
484511	What principles do successful people uphold ?
484512	What is the use of external crystal oscillator in microcontroller ?
484513	Why do we need to use oscillator in microcontroller ?
484514	What is acetic acid medium ?
484515	How can we tell apart Raymond mill and high pressure mill in grinding plant ?
484516	What is a barite grinding plant ?
484517	What happens when you unlock a phone that's locked to a carrier ?
484518	What are the best examples of Christmas photographs ?
484519	What makes a startup mentor great ?
484520	What makes a great mentor for a tech startup ?
484521	From birth , what are the odds of a person living until at least 70 years old ?
484522	How much do people change from thirty years old until old age ?
484523	Will artificial intelligence take over the human workforce ?
484524	What are good examples of Human-Artificial Intelligence cooperation ?
484525	What route should I take from Frankfurt to Prague if I want to visit a few interesting cities and towns along the way ?
484526	How do you deal with the nastiness of the world ?
484527	What is apertheid ?
484528	WHICH IS the best phone in ASUS ?
484529	Who are most prominent Carnatic musicians in the SF South Bay Area ?
484530	Who are the most prominent musicians in the SF South Bay Area ?
484531	If someone dies while his family is on vacation abroad , how long until they know ?
484532	How long do royalties of musicians get paid to families after they die ?
484533	What is conceptual understanding ?
484534	How should a parent react if they find their 14-year-old vaping ?
484535	Why do people at 15 years old smoke ?
484536	Why should I NOT build an email list ?
484537	When will I be able to sign up by means other than Facebook ?
484538	What service can I use to send huge (100 GB) files ?
484539	What do the file sharing services still lack ?
484540	Can we install windows 8.1 from a memory card ?
484541	We are a part of this hypocrite Indian society , where love marriage is all about caste and love is something called a crime . Do you agree ? If yes , why ? If no , what is your experience ?
484542	Why is groping so prevalent on trains in Japan ?
484543	Have you ever been fondled in public ?
484544	What do Americans / Europeans think about Filipinos ?
484545	What do South Koreans think about Filipinos ?
484546	When is to expect admission decision for fall in canadian universities ?
484547	Should Advanced Placement (AP) classes be used by selective colleges and universities as a significant factor in admission decisions ?
484548	How are PlayStation games created and which languages do developers use to build them ?
484549	Who is the founder of zero ?
484550	Food : Can you eat canned salmon right out of the can ?
484551	Is it safe to eat canned salmon ?
484552	How many ZZZquil pills should you take ?
484553	Is it possible to overdose on caffeine pills How many would you have to take ?
484554	What is ISO 9001 standard ?
484555	What are bacteria of decay ?
484556	Why are bacteria so small ?
484557	Does Bradley Cooper say `` pour manger'' in this French audio clip at 10:33 ? Yes or no ?
484558	What are some remedies to improve the sun in a horoscope ?
484559	What is Justin Trudeau's attitude towards China ?
484560	How much faith do you have in Justin Trudeau ?
484561	How can I get back whatsapp deleted messages ?
484562	How do I prepare for an interview for an internship as a software developer at Jack in the Box ?
484563	Are there any drawbacks in Digital India ?
484564	How long does the glaze for donuts last in the refrigerator ?
484565	Is it human nature to be condescending ?
484566	Is it human nature to be hypocritical ?
484567	What were the origins of languages ?
484568	What were the origins of the first languages and what were these languages ?
484569	What is middle school ?
484570	What is it like to be in middle school in 2015 ?
484571	What was the The Catcher In The Rye all about ?
484572	What did you think about The Catcher in the Rye ?
484573	Why does the bottom left side of my stomach hurt ?
484574	Why does the bottom of my stomach hurt ?
484575	Why should school uniforms become compulsory ?
484576	What will be the effect of Donald trump victory on IT sector ?
484577	What effect will Donald Trump's victory have on Quora ?
484578	What photo sharing site allows advertisement on porn sites ?
484579	Is Amazon itself allowing Snap-deal to advertise on their site ?
484580	What are some great/epic/ingenious lines from ASOIAF that are not so well known ?
484581	Can a bank depositor charged me if he deposit money under my name but intended for another person ? Am I liable ?
484582	How do saber tooth tigers differ from lions ?
484583	If a pregnant woman eats a particular food and the woman is repulsed by it , will it have any effect on the baby's preference for that food ?
484584	`` Are most evolution'' `` skeptics'''' illogical or are there actual reasons for their stance ?''
484585	If aliens were watching us right now , what would they think is the most illogical thing humans do ?
484586	What happened to the periods in the U.S.A. ?
484587	What is karyomorphology ?
484588	Which company is better for fresher-TCS or Capgemini ?
484589	Which company is better for freshers : TCS or CSC ?
484590	Is America ` fascist' for making a fuss out of someone sitting through the National Anthem ?
484591	How do I make a distinction between the mocking of the Canadian National anthem and supporting the anthem ?
484592	How do I rotate a video ?
484593	How do you rotate video on a Mac ?
484594	Is Ash Ketchum an anti hero ?
484595	Why is Lord Karthik referred to as the ` Tamil God' ?
484596	Velocity of air at the outlet of air conditioner , maybe say , 1.5 Ton split AC . ?
484597	Can I replace core i3 first generation with a core i5/i7 for newer generation without changing motherboard ?
484598	Why were Germany and Korea (a Japanese colony) split between the Allied Powers at the end of World War II , but Japan and Italy were not ?
484599	Which loan should I pay off first , home loan or bike loan ?
484600	Which loan pay off first home loan personal loan or gold loan ?
484601	Why my phone says full storage even if it has some space left ?
484602	Do employees at CDW have a good work-life balance ? Does this differ across positions and departments ?
484603	What is the procedure to sell bluray/dvd movies in Bangalore India ?
484604	How do I convert VCR Tapes to DVD in Bangalore ?
484605	How are polychromatic colours made ?
484606	What colours make gold paint ?
484607	What is the difference between webservice call , API calls and asynchronous calls like AJAX in web development . How and when to use them ?
484608	What is the daily API call limit on Last.fm
484609	How do I prepare for IIFT Entrance 2016 in 3-4 months only ?
484610	Is it possible to crack IIFT exam when you have only 3 months for preparation ?
484611	Is it possible to read the log file of App1 by App2 in android (non-rooted android device) ?
484612	Is western dance form is more difficult than Indian dance form ?
484613	Which is the most difficult classical Indian dance form ?
484614	Did anyone get continuous OTP (One Time Password) from SBI without your Intervention ?
484615	Can I create a virtual credit card for an SBH debit card ?
484616	What are some cool innovative things you can buy on Amazon ?
484617	How do I win the papyrus pacifist fight ?
484618	Who would win if The Lich King and Sauron fought ?
484619	Who is the most important philosopher of the 20th century ?
484620	What are some nick names of famous sportspersons ?
484621	Who are some famous people named Howard , and what are they famous for ?
484622	Which is the best career option after mechanical engineering ?
484623	In what ways can taking itraconazole long term affect the liver ? If it does ?
484624	Can you train your brain to process images faster in order to react faster & see things in slow motion , on command ?
484625	How can I process things faster ?
484626	Is ex playing mind games ?
484627	Why do we play mind games ?
484628	What effects do item songs have on youth ?
484629	How do half sizes work with UGG boots ?
484630	Do you buy boots that are half a size up from your regular shoe size ?
484631	How did Theodore Roosevelt help regulate big businesses ?
484632	I fell in love with a Pakistani guy after few hours of meeting him , is that true love ?
484633	What are practical/real life/industrial applications of Dijkstra , Kruskal , and Prim's Algortithm ?
484634	What are differences between Disc Brake and Drum Brake ?
484635	Car & Truck brakes . Disc brakes have almost completley replaced drum brakes on cars . Why hasn't this also happened on large trucks ?
484636	How can you teach the importance of why we must recycle ?
484637	If time travel was possible how would the universe remember the moment ? Would the universe be like a computer ? Would time travel be like hacking ?
484638	What are the pros and cons of Myntra/Flipkart mobile app filters UX-wise ?
484639	What are the pros & cons of Myntra and Jabong in India ?
484640	How is your relationship with your mother in law ?
484641	I have just 2 months my board exams are here how can I concentrate o my studies ?
484642	Can I enroll one more ug degree course like BA . if I'm already enrolled in 2015 for b.com is it possible ?
484643	How can I get rid of dark eye circles ?
484644	What do African Americans think of Black Lives Matter movement ?
484645	What are some tips for buying a used DSLR ?
484646	How can I buy a used DSLR in India ?
484647	How do I recover photos from the app vault ?
484648	Is there any scientific evidence for gou mutra chikitsa (cow urine therapy) ?
484649	If cow urine has so much benefits then why not human urine is safe to drink ?
484650	If I reactivate Facebook just to get lingering messages , how long will it take to deactivate it again ?
484651	What is the best , mathematically sound method to create a weighted Facebook Engagement rate ?
484652	What is life like as a black person in China ?
484653	What is the nutritional value of tofu ?
484654	How do I compute the fourier transform of switched cosine or right sided cosine ?
484655	Recommendation Systems : How do I get the source code and dataset of collaborative filtering techniques using similarity (correlation-based/cosine based) computation between users and prediction (aggregation) formula's implemented either in Matlab or Python or PHP or R Language ?
484656	Why does the Firefox browser keep disconnecting itself from the Internet even when there is Internet ?
484657	Why does my wireless internet keep disconnecting ? How can I fix it ?
484658	Can I actually depend on my home security cameras ?
484659	How do I change career after working as Oracle Forms developer for 10 years ? How do I get into management now ?
484660	Are web developers considered programmers ?
484661	Where in Boston should a single white girl who has just turned 21 go to meet an attractive wealthy man in his late 20s / early 30s ?
484662	Is ovotestis particular to all hermaphrodite beings ?
484663	Can humans be natural hermaphrodites ?
484664	What does Freedom mean to you in your personal and professional life ?
484665	Why Indian families search for Government Servant only for their daughters ?
484666	What is ` Here East' in East London ?
484667	How can I stop being afraid of psychopaths ?
484668	I ran a half-marathon in 1:50:00 with no training . Is this a good time ?
484669	Why would someone like Walter White teach at a high school instead of a uni or a research institute ?
484670	What will happen during divorce counselling at a family court in Bangalore ?
484671	How will the court decide on marriage expenses claimed by my wife during the divorce process ?
484672	Is it possible for a child to have a O - blood type when the parents are both A + ?
484673	What is scanf in c ?
484674	`` What is the difference between scanf ('''' % d'''' , & x) ; and scanf ('''' % d'''' , & x) ?''
484675	My mobile Nokia 2690 is asking for a security code which I have forgotten . How shall I reset my code ?
484676	Do you have a HTC EVO 3D ?
484677	Why do celebrities with knock knees still carry it about without undergoing a surgery ?
484678	What's the problem with knock knees for children ?
484679	I'm preparing my own first thesis about semantic web . I read tons of articles , but I am really confused . What would you suggest ?
484680	I'm feeling exhausted after marriage , and also feeling an insecurity of my life . How can I overcome it ?
484681	What are some of your street smart stories ?
484682	What is street smart ?
484683	Is my family normal ?
484684	Why is my family not normal ?
484685	Does VMWare hire computer engineering freshers in India as members of the technical staff or as software engineers ? Which of the two is better paid ?
484686	Is oxygen laser therapy effective ?
484687	How effective is red light therapy for eczema ?
484688	Does split ends slow down hair growth ?
484689	Does braiding hair and then folding the ends upside speeds up hair growth ?
484690	Can I become a good electronics engineer if my physics of class 11 & 12 is not good ?
484691	Can I become a good mechanical engineer if my physics of class 11 & 12 is not good ?
484692	How can I see when someone started following someone on Instagram ?
484693	Can I follow someone on instagram without my friends see in the person in my following list ?
484694	What is it like to minor in physics at Caltech ?
484695	How do I get rid of VASP ?
484696	What percentage of india's export revenue is from Information Technology ?
484697	Why China don't want to follow United nations tribunal court decision but advocate international laws when it comes to other country ?
484698	What is the opposite of inverted ?
484699	Are opposites interchangeable ?
484700	Why do people make fun of Nuzzly Pokemon ?
484701	Why do people make fun of Pokemon ?
484702	What is the best app to filter blue light in windows phone ?
484703	How do I change/correct name in TOEFL registration ?
484704	How do I register for the TOEFL with multiple given names ?
484705	Where is eduardo saverin now ?
484706	Where could a person feel the maximum gravity on earth ?
484707	How strong is gravity on earth ?
484708	How can I make Ui changes all over the multi-page website from just one piece of code ?
484709	How CAN I ORGANIZE MY PHD life ?
484710	Is there a site similar to Reddit but for porn ?
484711	What are the best porn sites featuring saliva porn videos ?
484712	`` If I take an education loan from'' `` Union Bank'''' , Is it necessary to enroll into their life insurance scheme , as proposed by them and pay a 1 time fee ?''
484713	Union Govt . has launched HRIDAY and PRASAD Schemes to boost up economy as well as employment via tourism . Why to have 2 schemes for 1 purpose ?
484714	What is the best generalization statement about clowns ?
484715	What are the best songs about being a king ?
484716	How can I focus on studies when I live in a noisy place ?
484717	How will the health sector and insurance sector in India after banning 500 and 1000 rupee notes ?
484718	Will the ban on 1000 and 500 rupee notes affect the UP and Punjab election ?
484719	What should I play when someone asks me to play them something on the guitar ?
484720	How do you play Take Me To Church on guitar ?
484721	What is the real difference between hand cream and facial cream , or body lotion , or is it just a tactic for businesses to sell more ?
484722	`` What's the difference between body'' `` milk'''' and body lotion ?''
484723	What are good books on persuasion ?
484724	Is cost of debt ever higher than cost of equity ?
484725	Is cost of equity just dividend ?
484726	How does Google make money with Flights and how much do they make ?
484727	How much money does Physics Forums make ?
484728	Why do hot foods taste better than cold foods ?
484729	Why does food taste good when it's hot ?
484730	How should I respond to a beggar who confronts me for money ?
484731	How do you respond to beggars who confront you and ask you for money ?
484732	`` What do you say to'' `` thank you for your support'''' ?''
484733	Who murdered Peruvian tycoon Luis Banchero Rossi on new years eve 1972 ?
484734	What does it feel like to murder someone ?
484735	What does a human penis look like ?
484736	I like a girl , but I don't know how to tell her that ?
484737	How do I tell a girl that I don't know , I like her ?
484738	Has a quarter back ever won a Super Bowl with more than one team ?
484739	Which is a good inpatient drug and alcohol rehab center in Audubon County IA ?
484740	How do I boot in safety mode from uefi and secure boot on in.windows 8_8 .1 ?
484741	I want to register a trademark for online business related to handicrafts . Under which class do I have to register it ?
484742	Why are some Google Chrome pages unresponsive ?
484743	Why is Google Chrome so unresponsive on Android ?
484744	Is having lots of crushes bad or good ?
484745	Is having a crush bad or good ?
484746	What is your favourite Kannada word/phrase ? Why ?
484747	What will the difference between the Tesla Model 3 and the Tesla Model S be ?
484748	Could a Tesla Model S be used as a taxi ?
484749	How can I make sure , if something ever has to happen to me , my parents are taken care of ?
484750	How can I take care of my old parents living afar ?
484751	Which criteria should be used for Nobel Prize in economics ?
484752	How should I start importing products from China and selling them on Amazon.CA ?
484753	What is the current status of the DMIC (Delhi Mumbai Industrial Corridor) ?
484754	What do you think about DGWHyperloop's Mumbai to Delhi corridor ?
484755	How did Golf players earn so much money ?
484756	How is Tiger Woods so rich , and how do golf players earn so much money ?
484757	I received a bone allograft in my foot a week ago . How long must I wait before I can donate blood ?
484758	I just broke a bone in my foot . Is it worth spending $ 500 to get an ultrasound bone stimulator ?
484759	Can landlord downgrade appliances ?
484760	How do I become a private landlord ?
484761	Will I be admitted into BITS Dubai even if I don't meet eligibility criteria ? What is the fee structure ?
484762	How is the BITS Dubai for an undergraduate B.Tech ? What is the admission criteria and the fee structure ?
484763	What life lessons does Romeo and Juliet teach ?
484764	How was Romeo & Juliet received during Shakespeare's life' ?
484765	What are the most widely-used Chinese fonts ?
484766	What are some of the most common fonts used in web design today ?
484767	Can a person having two homes in India enroll for two voter IDs and vote twice ?
484768	I am staying in Mumbai , and I have my voter ID . Where I can vote ?
484769	What does the #aboutlastnight hashtag mean ?
484770	What do the hashtags in Quiz groups mean ?
484771	Which books should I read to prepare for Allen ASAT ?
484772	What are the best books to read in preparation for travel in Southeast Asia ?
484773	What exactly is the q point of a diode ?
484774	How exactly is a diode used and why ?
484775	Is it normal for a nose piercing to sink in and disappear during the healing process ?
484776	How harmful can smoking a cigarette once in a month or so be ?
484777	What is your guiltiest pleasure ?
484778	What is pleasure ?
484779	Can you learn the piano as an adult ?
484780	Can learning the piano help adults ?
484781	What are the consequences of having a glucose level of 108 ?
484782	What are fast-growing marijuana plants ?
484783	Which payment gateway is best for transactions in India ?
484784	Which Indian Payment gateway is best and support international transactions ?
484785	I had a bad day on the very first day of the new year 2017 . Will my whole year go bad ?
484786	What cue-card software keeps time-stamped logs of every attempt ?
484787	How old is vegetarianism ?
484788	Is Samsung Galaxy s7 the complete smartphone one can get ?
484789	What is doping ?
484790	How are semiconductors actually doped ?
484791	How much space does Simplenote use ?
484792	How much space will 5GB hold ?
484793	People are only spending 3 mins a month on Google + . Why is Google + so unsticky and what can Google do to keep people on the site for longer ?
484794	Can I send a backdated email via Gmail ?
484795	How can I send emails to every user of Gmail ?
484796	`` How critical is it to address a'' `` low tire pressure'''' problem in a car quickly ?''
484797	Can a low car battery cause the horn to stop working ? Engine is starting without any problem .
484798	How am I gaining weight when I barely eat ?
484799	Am I in starvation mode and If I start eating will I gain weight ?
484800	Is it ok to watch porn with boyfriend ?
484801	Which country has more jobs in IT , Australia or Canada ?
484802	How long is a jar of baby food good after opening ?
484803	How can I know about the accommodation in Bhopal hotels ?
484804	I can't remember the title of a book about two girls in a boarding school in 1920s (?) NYC . They both fall in love with the same guy they meet out one night and one girl runs off with him and eventually falls ill and they all reconnect . Any ideas on the title ?
484805	What can be a good research topic under IOT (Internet of Things) ?
484806	If Ernest Hemingway were alive what might his beliefs about the world be ?
484807	Which is the maximum mark required to step into AIIMS ?
484808	What is the value of 1 + 1 - 1 + 1 - 1 ... infinity ?
484809	How many comments are made on reddit each day ?
484810	How many page views and unique users do Reddit and Digg have ?
484811	Why is methane called a marsh gas ?
484812	Why is methane also known as marsh gas ?
484813	Why are iPhone 6s and HuaWei Acsend Mate 7 unable to record any higher video resolution than 720p on their 5-Megapixel front cameras ?
484814	I was in an abusive relationship . He beat me with an object , threatened me with a weapon and held me against my will I left . Why do I want to go back ?
484815	What are the differences between in nationality and ethnicity ?
484816	Why do people (Palestinians) claim Israel doesn't belong to the Jews , wasn't it given to them in 1948 by the British after the holocaust ?
484817	Can we expect RBI assistant prelims 2016 result today ?
