test-252407	How is the job market of civil engineering in US? Is it a popular major? Is there any report that can help me know its history?
test-252408	Why do Black-Americans hate Africans?
test-252409	Why do Africans from Africa hate African Americans?
test-252410	How many number of positive integer n are there such that n+9,16n+9,27n+9 are perfect square?
test-252411	Is there a positive integer, n, such that no n-digit number is a perfect square?
test-252412	What are the best Tamil blogs which get updated frequently with good articles?
test-252413	What is the best way to get articles for a blog?
test-252414	What's the difference between the Z-series, B-series and H-series motherboard?
test-252415	Exactly how much worse are Thinkpad L series, compared to Thinkpad T series?
test-252416	How do I create passback tags in DFP Small Business?
test-252417	How do I implement a passback in DFP?
test-252418	What are the chances of pregnancy with this case?
test-252419	What is the chance of pregnancy during menses?
test-252420	How did you honestly feel finding out you had been cheated on and has it changed you?
test-252421	Marriage: How does it feel to find out your wife cheated on you, 10 years later?
test-252422	Do I need boat insurance if I own a boat?
test-252423	How much does it cost to own a boat on Long Island?
test-252424	Can Instruction manuals be copyrighted?
test-252425	Are math problems copyrighted?
test-252426	Who is hotter, Hermione Granger or Emma Watson? Why?
test-252427	How beautiful is Hermione Granger according to the books (not considering Emma Watson)?
test-252428	Why do women wear athletic shorts over spandex when they go to the gym?
test-252429	I am already going to the gym 3 times a week. How can I impress women? Should I do more?
test-252430	How can I raise my self esteem?
test-252431	How do I improve self confidence?
test-252432	Who are your Top five favorite characters in Game Of Thrones?
test-252433	Who is your favourite character in Game of Thrones? And, why?
test-252434	When did the first name, father's name & surname method start in India for identifying people? Who started it?
test-252435	Why we cannot end casteism by removing surnames and people be known by their father/mother/spouse names in place of their surnames?
test-252436	What's the average conversion rate for offline retail shops?
test-252437	What is the average conversion rate for online apparel retailers?
test-252438	How do I evaluate [math]\displaystyle\int_{-1}^{5} |x-3|\, dx[/math]
test-252439	How do you evaluate [math]\int_0^1\frac{x-1}{\ln x}\, dx[/math]?
test-252440	How can I upload photos to iCloud from my iPhone?
test-252441	How do you sync iCloud with your iPhone?
test-252442	Why are some men insecure about their height?
test-252443	What made you feel insecure about your job?
test-252444	Why are there so many irrelevant and frankly stupid questions on Quora?
test-252445	Why do people ask dumb questions on Quora?
test-252446	What causes stomach ulcers?
test-252447	What can I do to fix stomach ulcers?
test-252448	Do you feel bad after saying no?
test-252449	Do you feel bad after betrayal?
test-252450	What's the funniest thing that ever happened to you in the classroom?
test-252451	What is the funniest thing that ever happened to you at work?
test-252452	How do you earn 10 dollars in 3 days, once every month?
test-252453	What free stuff do I get when I get hired by apple?
test-252454	Will starting a successful startup in High School increase my chances of getting accepted by Harvard, Yale, Stanford, Wharton etc?
test-252455	Where should I get my MBA from: Harvard, Wharton or Stanford?
test-252456	When did Chicago begin with a “C” and end with an “E”?
test-252457	What's a 3 letter word meaning Cat?
test-252458	What is the difference between you and I?
test-252459	What is the difference between you and me?
test-252460	What are examples of enzyme substrates?
test-252461	What are some examples of enzymes?
test-252462	Is Robinhood a good company to use to trade penny stocks?
test-252463	How safe is the free stock trading platform and app Robinhood?
test-252464	How much is the cost to build a shell corporation in the Virgin Islands in order to hide your money and in order to avoid paying taxes?
test-252465	Why do we pay corporation tax?
test-252466	I like to ride on my husband's penis during intercourse but I get so wet that it keeps slipping out of my vagina. What do I do?
test-252467	Do men like it when a woman cums on their penis during intercourse?
test-252468	How do I know if someone blocked my Yahoo email?
test-252469	How can I check my block list on Yahoo Messenger?
test-252470	How do you get shorter in height?
test-252471	How can I get shorter in height?
test-252472	What is the difference between paneer and cheese?
test-252473	How different is feta cheese from goat cheese?
test-252474	What is the tenure of Chief Justice of India?
test-252475	Why did Chief Justice TS Thakur break down in front of PM Modi?
test-252476	Why is our faeces yellow in color?
test-252477	Why is urine yellow?
test-252478	Why did M.F.Hussain buy a Bugatti Veyron?
test-252479	Which hypercar will be faster on a single lap around Monaco twisty street circuit? Bugatti Veyron Vitesse or Koenigsegg Agera R?
test-252480	Can I use the present perfect tense and the simple past tense interchangeably, except for the meaning of past-to-present continuative actions?
test-252481	What is the difference between present perfect tense and simple past tense?
test-252482	What is the bright star I see in the western sky at night (Arkansas in October)?
test-252483	Why does it appear that the moon and stars move in the sky?
test-252484	F = ma. F also = kx. If I were to push a spring stuck vertically to the face of a surface to the same extent (assuming I could accurately control the force exerted by my muscles) at different speeds, how would I calculate the Force exerted by me in these two different situations?
test-252485	If an object experiences two forces of magnitude F in opposite directions, why is the stress not equal to 2F/A? What if there's only one force F?
test-252486	Which technology is best for launching peer to peer business?
test-252487	How does the Death Star travel having no apparent engines?
test-252488	Which is best featured laptop under 25000 Rs, in any brand?
test-252489	Which is the best laptop for around 25000?
test-252490	What skills does a Business Analyst need to succeed in the San Francisco Bay area?
test-252491	How can I find and apply for a job in the San Francisco Bay Area?
test-252492	Why wouldn't America and Russia unite and eliminate ISIS?
test-252493	If Donald Trump disappeared without a trace, how would you feel?
test-252494	I’m really intersted in gadgets.I'm good in maths and chemistry. which engineering is best for me?
test-252495	Which I have to take, CAT or GATE? I have 9.5gpa and confused of those both, which to join?
test-252496	How is the current placement scenario for civil engineering mtech students at IITs?
test-252497	What is the placement scenario of a PG in Mining Engineering from IIT Delhi?
test-252498	"What does the Spanish phrase ""que asco"" mean?"
test-252499	"What is the meaning of the Spanish phrase ""que es eso""?"
test-252500	Which contestant of the singing reality show ‘The Voice India Kids’(2016) is most entertaining?
test-252501	Which singer, according to you, will win The Voice India Kids-2016 (The singing reality show)?
test-252502	How do I recover a Gmail account without a recovery phone?
test-252503	How do I change my gmail account password when I don't have access to my recovery email address or my phone or computer?
test-252504	How does one become a person of consequence?
test-252505	How do I become personable?
test-252506	When was Marilyn Monroe famous? Why was she famous for?
test-252507	Why is Marilyn Monroe so famous?
test-252508	How do I market my work at office? I work in an IT company in the US.
test-252509	How do I work for companies in the US?
test-252510	Why my crush avoided me when I got jealous of her talking to another guy?
test-252511	Why does a guy stare at me but is talking to another girl?
test-252512	Is Tom Walker hog hunting with guest hunters in 2016?
test-252513	What is the closest you've ever come to poverty, directly or indirectly?
test-252514	Can more British actors pull off an American accent than vice versa? If so, why?
test-252515	Is it harder for a British actor to do a convincing American accent, or vice versa?
test-252516	What does the Holy Water represent?
test-252517	How do I know if I have Sinus Infection?
test-252518	Which according to you is the best movie of all time? Select only one choice.
test-252519	What is the best movie ever made?
test-252520	Is MoveOn.org a for profit corporation?
test-252521	Is Rally.org a for profit corporation?
test-252522	General santos citities latest issue?
test-252523	What is the difference between American and European football seasons?
test-252524	What makes our life simple?
test-252525	Life Advice: How can I make my life simpler?
test-252526	Is my annual assessment a good time to ask for a promotion?
test-252527	My annual assessment is soon. Is this a good time to ask for a promotion?
test-252528	Why are so-called black people labelled as black when in fact their skin is not black?
test-252529	Why do people normally like white skin and black cars?
test-252530	How can we stop war?
test-252531	How can we stop the wars?
test-252532	Does Steve Jobs use social media like Twitter, Facebook, etc?
test-252533	Is Steve Jobs on Twitter?
test-252534	Where are the best burritos in The Mission?
test-252535	What is the best ramen in The Mission?
test-252536	How can I make notes for IAS?
test-252537	Can someone guide me on how to make notes for IAS prepration?
test-252538	How do I mirror my Android's screen to my TV without a HDMI cable?
test-252539	How can I cast my mobile screen on my tv using data cable and no software?
test-252540	How can I reduce love handles and thigh fat?
test-252541	How do I reduce belly and chest fat?
test-252542	Should kids wear high heels?
test-252543	Why do people wear high heels?
test-252544	What does it look and feel like to lose a toenail?
test-252545	What is a full set manicure at a nail salon?
test-252546	What are the contributions of Abdul Kalam as a scientist?
test-252547	If India is so good why do Indians leave India?
test-252548	What are the steps our government taking to prevent our planet from the pollution and other harmful causes?
test-252549	Are modular smartphones better than other smartphones?
test-252550	Why does Quora allow the edit of question details only after the question has been posted?
test-252551	Why doesn't Quora allow users to add question details simultaneously with a question?
test-252552	Is the marriage age, of 25, same in all other countries? Or it is just India?
test-252553	What is the exact age for marriage in India?
test-252554	What is a forever stamp?
test-252555	What are Forever Stamps in the US?
test-252556	Why is it so hard for me to lose weight?
test-252557	Why is it so hard for me as a former athlete to lose weight?
test-252558	How many mobile developers are there?
test-252559	How many mobile developers are there in Vietnam?
test-252560	How smart is Jaime Lannister in Game of Thrones?
test-252561	Does Jaime Lannister remain a thorough bad guy in the Game of Thrones books?
test-252562	What are some advantages and disadvantages for selecting a room on a higher or lower floor for a hotel stay?
test-252563	Why do Chinese hotels often ask if you want a room on the fourth (4th) floor?
test-252564	Why is Snapchat charged as photo messaging as opposed to data on my cell phone bill?
test-252565	How do you spy on Snapchat on a Samsung?
test-252566	Copyright of translated audio recording?
test-252567	What was the most precious thing you sacrificed in your life for greater good?
test-252568	Is oasis tymk company is a trustable company??
test-252569	What is the biggest scam that every Indian must be aware of?
test-252570	UPSEE result declared. Got a shocking 4900 rank on 416 marks. Any government college possible at this rank?
test-252571	Leonardo DiCaprio is not 6 feet! He is like 5'8?
test-252572	What would happen to society and the economy if everyone were to be paid $25 an hour?
test-252573	What would happen to the world economy if everyone's bank accounts were equalized to the same figure e.g. $1000000?
test-252574	How do I hire a legit hacker?
test-252575	How can I hire an hacker?
test-252576	What is the difference between a Software Architect and a Solutions Architect?
test-252577	What is the difference between a Chief Software Architect and a Principal Software Architect?
test-252578	What's the energetic inspiring song which you like to listen when you feel down or in the morning to stay in the right mood everyday?
test-252579	I feel so energetic at late night and I feel drowsy throughout the morning. So I opted not to wake up in the morning. Is it good?
test-252580	How do you cook ramen in a microwave?
test-252581	How can you cook dal in microwave?
test-252582	"What should I do if I receive a ""corrupted statistics"" warning from PostGreSQL?"
test-252583	What is the best free GUI PostgreSQL client for Mac OS X?
test-252584	How will Brexit affect Singapore?
test-252585	How would Brexit affect Japan?
test-252586	How to succeed in exams?
test-252587	How can you succeed?
test-252588	How many people with Down Syndrome have an IQ of more than 70?
test-252589	Can people with Down's syndrome have a high IQ? Explain.
test-252590	How do I catch a Pokémon?
test-252591	How do you catch Pokémon in Pokémon GO?
test-252592	Which is more in demand, NIT Warangal metallurgy or NIT Jamshedpur computer science branch?
test-252593	How is the computer science department at NIT Warangal?
test-252594	What are the baleen whale's natural predators?
test-252595	What are meerkat's natural predators?
test-252596	What are the best frameworks to conduct qualitative market research?
test-252597	Which market research firms are the best in online qualitative methods?
test-252598	Can I become a doctor with only using one hand?
test-252599	Why are U-turns illegal in front of fire stations?
test-252600	Which is the best cricket team of all time?
test-252601	Which is the best cricket team?
test-252602	Why was Moriarty in the prison in the last scene of season 2 episode 2 of Sherlock?
test-252603	"In the popular TV series Sherlock, in season 2 episode 1 ""Scandal In Belgravia"", when Sherlock is about to be hired by the British Royalty, what does Mycroft mean when he says ""I'll be mother"" to which Sherlock replies ""and there's the whole childhood in a nutshell""?"
test-252604	What are the names of the actors on the BuzzFeed videos on YouTube?
test-252605	How does a BuzzFeed Video staff interview look like?
test-252606	If you could have only 3 guitar pedals, what would you choose and why?
test-252607	What was your first guitar pedal?
test-252608	Vijayawada, Andhra Pradesh, India: Who is Vangaveeti Ranga and what is the actual story behind his death?
test-252609	What is Hyderabad's relationship to Andhra Pradesh?
test-252610	What are the best courses to be done after completing mechanical engineering?
test-252611	What are the best courses to study after completing mechanical engineering to get a good job?
test-252612	The sin 45° is correct in unit circle of trigonometry?
test-252613	What are the different ways of submitting a Request for a Disability Hearing?
test-252614	Is IEX a national stock exchange?
test-252615	Who are the promoters of National Stock Exchange?
test-252616	Why is Microsoft acquiring LinkedIn?
test-252617	What is the business reason or strategy behind Microsoft buying LinkedIn?
test-252618	What is the Universe expanding into?
test-252619	If the universe is everything, and scientists say that the universe is expanding, what is it expanding into?
test-252620	Where can I get best surface cleaning services in Sydney?
test-252621	Where can I get best windows deep cleaning services in Sydney?
test-252622	How do I know if my WhatsApp account has been hacked?
test-252623	WhatsApp: Is it possible to hack my friend's Facebook account and WhatsApp?
test-252624	Why does the alarm work when the phone is switched off?
test-252625	Why are phones switched off in aeroplanes?
test-252626	What are the main story arcs in Bleach?
test-252627	When will bleach final arc episodes will release?
test-252628	Quant Funds: What trading platforms do institutional traders typically use?
test-252629	How do institutional traders differ in methodology from retail traders?
test-252630	What is the best TV series that never was?
test-252631	What is the best-written TV series ever?
test-252632	What is the best way to spend a weekend traveling in New York City?
test-252633	If you had one day in NYC what would you do?
test-252634	Who has used the OYO hotel service to stay with their girlfriend? Is it safe?
test-252635	What are some safe and affordable hotels in Chandigarh to stay in with my girlfriend?
test-252636	What are the best water purifiers in India, and where can I purchase them online?
test-252637	How do I choose a water purifier in India?
test-252638	How rich was Stalin?
test-252639	Was Stalin fascist?
test-252640	If 1 = Single, 2 = Double, 3 = Triple, 4 = Quadruple, what are 5, 6, 7, 8, etc. called?
test-252641	A man has 53 socks in his drawer. They are 21 identical blue, 15 identical black and 17 identical red. The light went off and he is in complete darkness. How many socks must he take out to be 100% certain that he has a pair of black socks?
test-252642	What is the difference between Board, Council, Committee, Commission and Tribunal in India?
test-252643	What is the difference between commission, committee and council?
test-252644	How does one become a police detective in Canada?
test-252645	How does one become a police detective in the US?
test-252646	What does it mean when a guy looks deeply into your eyes when you talk?
test-252647	What does it mean when a girl plays with her hair while talking to a guy?
test-252648	How can I slowly lose weight?
test-252649	What is the most effective way to lose weight?
test-252650	What's it like to visit Iran as a first or second generation Iranian-American?
test-252651	Can Iran's leaders be trusted?
test-252652	Role Of The Teacher Inside The Classroom With Special Reference To Testing Of Previous Knowledge?
test-252653	What should I do in my last semester (there are no subjects but only project & lot of leisure time)?
test-252654	If you once struggled with failure due to laziness, lack of motivation, and depression, how did you turn your life around?
test-252655	How do I come out of failure depression and be confident among successful people all around?
test-252656	How do I search for good hotels in Bhopal?
test-252657	Where can I find best hotel in Bhopal?
test-252658	What is the price of a German Shepherd dog in India?
test-252659	Why do German Shepherds make good police dogs?
test-252660	When will the Android 7.0 Nougat update be out for Samsung Galaxy j7-6 (2016) running on Android 6.0 Marshmallow?
test-252661	Will Samsung J7 2016 get the Android 7.0 update?
test-252662	Are my parents being too strict?
test-252663	My parents are really strict, what do I do?
test-252664	What is your weirdest birthday memory?
test-252665	What is your worst birthday memory?
test-252666	What are the things which we should do to make our tour to Pondicherry full of enjoyment and adventures, when we are in a group of 8 people inculding both girls and guys ? And when is the best time for the visit?
test-252667	We are a group of guys visiting Goa for the first time this December. What are the must do things and places to visit there? A brief of the party culture too would be appreciated.
test-252668	Is there any one running online eCommerce store or site?
test-252669	One must have blind faith in supernatural powers?
test-252670	Can rice oil make hair grow longer faster?
test-252671	How do you make hair grow longer faster?
test-252672	What's Amazon's return policy on used electronics?
test-252673	Given that the Boule and Nomothetai of ancient Athens was selected by sortition, is it still correct to call ancient Athens a direct democracy?
test-252674	How would you describe Santa Ana unified school district as a school district?
test-252675	How do you describe the Santa Ana unified school district?
test-252676	Are MediaTek processors better than Snapdragon? What about MediaTek Helio X10 (MT6795) Vs Snapdragon 810 SoC?
test-252677	Why should I chose Snapdragon over Mediatek, Intel and Exynos processors?
test-252678	Why does the United States have a problem with other countries' nuclear weapons?
test-252679	Is it possible to solve the United States' problem with Iran by getting a hold of their nuclear weapons via diplomacy?
test-252680	What are the best Bollywood movies of 2013?
test-252681	Which is the Best Bollywood movie in 2015?
test-252682	How can one become a badass?
test-252683	What are some good ways to become a badass?
test-252684	What is it like to be a data scientist at Amazon?
test-252685	How does Twitter hire data scientists?
test-252686	How do cement and concrete differ?
test-252687	How are cement and concrete made?
test-252688	Can I make 100 million as a sport bettor?
test-252689	Can I make 100 billion as a sport bettor?
test-252690	Is it possible to be like Tina Dabi?
test-252691	Is Tina Dabi on Quora?
test-252692	Why do people love to watch Game Of Thrones? Isn't it incest+politics?
test-252693	Why do people like fantasy fiction like Game of Thrones?
test-252694	How do you ask questions on Quora?
test-252695	How do I post something in Quora?
test-252696	"Is the Hebrew word ""shalom"" the same as the Arabic word ""salam""?"
test-252697	What is the classical Arabic word for 'million'?
test-252698	What is the best practice for setting session timeouts for mobile apps in Google Analytics?
test-252699	Should you use only Google Analytics for tracking activity in your mobile app?
test-252700	How are cricket pitches made? What is the whole process?
test-252701	Which is the best cricket pitch in India to play Test Cricket?
test-252702	I am 14. How do I become a multibillionaire by 25?
test-252703	I am 25. Is it too late to become a doctor?
test-252704	How can a person get selected in Google Summer of Code?
test-252705	How do I prepare for the Google Summer of Code (GSoC)?
test-252706	What happens when you overpay your credit card bill?
test-252707	Can I pay ICICI credit card bill at a physical bank?
test-252708	What kind of insurance do you need to drive for Uber?
test-252709	What insurance should I get to drive for Uber?
test-252710	What is the corporate culture like at athenahealth? How is the culture different than other companies?
test-252711	What is the corporate culture like at 8x8? How is the culture different than other companies?
test-252712	What are college timings of SRM KTR for Mechanical engineering?
test-252713	What are the college timings at SRM KTR?
test-252714	1 TB= how many GB?
test-252715	What's the difference between 32GB eMMC and normal 500Gb, 1 TB, 320 GB hard drives? Does it mean, that only 32 GB space is available to store data? What makes eMMC so special?
test-252716	What is the difference between coconut oil for cooking and for hair?
test-252717	I recently coloured my hair blonde. Can I apply coconut oil on my hair? Will it damage the colour?
test-252718	What were General Shang's wife's last words in Arrival?
test-252719	"In ""Arrival"" (2016), was the alien ""spaceship"" actually an ""object""? Were there really twelve of them, or were they all actually the same one?"
test-252720	What is your purpose of life and How you found it?
test-252721	How do you find your life's purpose?
test-252722	Would Elizabeth Warren be a good VP running mate for Hillary Clinton?
test-252723	Have you considered Elizabeth Warren as a running mate?
test-252724	Is an 18 year old brain fully developed?
test-252725	Which parts of my brain has not been developed yet as an 18 year old?
test-252726	Have you ever found a photo of you used in an unexpected way?
test-252727	Is there a way to use Flickr as a photo service in Twitter for iPhone?
test-252728	Can I learn Japanese and German at the same time?
test-252729	How can I learn Japanese with Russian at the same time?
test-252730	What are the functions of LIC?
test-252731	Does Satan cause us anger or uses people to get hurted by words?
test-252732	How do European women compare to USA women in style and frequency when it comes to sex?
test-252733	How many women in the USA have BPD?
test-252734	Are there foods that successfully block DHT to reduce hair fall? Which ones?
test-252735	What are the diet, food, medicine or methods to reduce the DHT level in the blood?
test-252736	What is the clear difference between tautology and pleonasm?
test-252737	"Is the term ""atomic transaction"" a pleonasm?"
test-252738	What is the maximum temperature that a pyrometer can measure?
test-252739	Thermodynamics: Is there a maximum temperature?
test-252740	What are some of the easy to pick up and learn hobbies/skills that are also pretty cheap
test-252741	I am learning a new skill and it is hard and frustrating. Should I give up?
test-252742	Give me information about Gujarat's business with China? Also telling me a worth?
test-252743	I nearly don't have any information about mechanical engineering. Can someone tell me about this major and also about mechatronics?
test-252744	Do electron clouds touch when two objects touch?
test-252745	Email for salary negotiations?
test-252746	A girl asked me to ask her out for dinner. How is that different from asking me to dinner? Is it just a clever way to say I have to pay?
test-252747	I have a crush on this girl and asked her out, but she keeps on rejecting me. What can I do?
