361422	Is Xiaomi free SMS service available in India ?
361423	How much marks do I need to get under the 1000 rank in JEE Main 2017 ?
361424	How is Manipal University for architecture ?
361425	How is the undergrad Architecture program at Manipal ?
361426	How can one be a chess grandmaster in India ?
361427	How would one solve this physics work (mechanics) problem ?
361428	Songs : How can I learn to sing like Arijit Singh ?
361429	How much do singers like Arijit Singh earn by singing one song ?
361430	What is scientific name of vitamin A ?
361431	What's the scientific names of all the vitamins ?
361432	What is the function for the serie 15 , 0 , 1 , 14 , 3 , 12 , 13 , 2 , 7 , 8 , 9 , 6 , 11 , 4 , 5 , 10 ?
361433	What is the evolutionary significance of democracy and how has it changed modern society ?
361434	Optics : Is it feasible to listen to a voice conversation from orbit ?
361435	What is optics and its field ?
361436	What are the various factors responsible for affecting corrosion ?
361437	What are the factors in engineering system so that it can affect response ?
361438	WikiLeaks : Who is Jacob Appelbaum ?
361439	Is what Wikileaks does a crime ?
361440	How Google Pixel's camera is better than any other phone even iPhone ?
361441	What are the best French animated movies ?
361442	Is using vicks vaporub really healthy ? I heard it has many disadvantages .
361443	What equipments should I buy to set up professional studio ? I'd like to know the equipments on studio rack mount only .
361444	How can I learn to read Quran understanding its meaning ? The fastest way ?
361445	What is the best place to see rocket launching ?
361446	What is the best option to view a rocket launch at KSC as a tourist ?
361447	Why do Sunni Muslims condemn Shia Muslims' depiction of prophets and imams in Iranian Islamic historical movies ?
361448	I have an iPhone . I don't have English songs . Should I die , according to your society ?
361449	What do people think of the movie Requiem for a Dream ?
361450	What was the movie ` Requiem for a Dream' all about ?
361451	What are the keys to kissing a woman's neck ?
361452	What does it mean when your boyfriend kisses your cheek , then your lips , then your neck ?
361453	What is Mint's cost of acquisition per customer ?
361454	What is the Cost of Customer Acquisition for Ebay ? Amazon ?
361455	What are the best eyeglass brands in 2014 ?
361456	What are the coolest / most fashionable eyeglasses brands these days ?
361457	How can I unzip torrent files and why should I do it ?
361458	The old people disrepect the young ?
361459	Why can't i connect my realplayer plus 15 to the internet ?
361460	According to Indian mythology , who are the seven immortals ?
361461	Where are the eight immortals of Indian mythology now ?
361462	Where can I get some high quality weed (marijuana) in Gurgaon ?
361463	Where can I get some high quality weed (marijuana) in Pune ?
361464	What are some institutions of modern day sophistry ?
361465	Are there modern-day hippies ? Where are they and how do they live ?
361466	Can we say that the UN is an NGO and an NPO ?
361467	Do the UN get paid ?
361468	`` What is the translation of the word'' `` market'''' to Latin ?''
361469	`` What is the translation of the word'' `` mind'''' to Latin ?''
361470	What is the best programming language to learn if you want to work on the blockchain ?
361471	I am 12 and I want to work for Google when I grow up . What programming languages are the best to learn ?
361472	What is the origin of the word hadra , χαντρα , that means bead in Greek . It is an Arabic root or transformation of word denoting the Egyptian Blue Stone ?
361473	What IS the BASIC CONCEPT for UPSC study ?
361474	What are the national games of different countries ?
361475	Which is the best country to learn genetics ?
361476	What are some protections against DDOS attacks ?
361477	Who are the major providers to protect against a DDoS attack ?
361478	How does it feel not to love someone knowing that they truly love you ?
361479	How mutually intelligible are Farsi , Dari and Pashto ?
361480	What is the difference between Farsi (Persian) and Dari ? Are they mutually intelligible ?
361481	How does true caller application works ?
361482	What is lvalue and rvalue in C ?
361483	What are lvalues , rvalues , etc. . in C and C++ ?
361484	Investment Advice : I have Rs 20,000 now , how can I invest it to get Rs 4,00,00,000 ?
361485	Message sent but wasn't delivered on Facebook does that mean they haven't logged in yet ?
361486	Will a future colonist of Mars see the same constellations in the planet's night sky as those seen from earth ? What will a Pluto explorer see ?
361487	Why haven't the constellations , that we can see in the night sky , changed between now and the time they were first recorded ?
361488	What is the definition of critical temperature ?
361489	What is the definition of critical pressure and critical temperature ?
361490	Do horoscopes have a placebo effect ?
361491	What is the impact of the placebo effect ?
361492	Who are the 10 most cruel emperors in Indian history ?
361493	What were some of the most infamous cover-ups in Indian history ?
361494	Do EPFs in India have any APIs for the purpose of checks and balances ?
361495	What is the equivalent of $ _ POST (PHP) in Java ?
361496	Will US & Japan issue a joint statement to call Australia to recognise the legitimacy of the private Tribunal as Australia has denied the legitimacy ?
361497	Is the news that Australia will be playing with 10 men as a tribute to Phil Hughes , against India in the first test of the upcoming series true ?
361498	In Chrome , is there a way to change the ugly folder icon in the bookmark bar to something cuter ?
361499	I want to change the profile icon for my user profile in Google Chrome . How can I do this ? I'm using Chrome on an OSX iMac .
361500	Which industries are covered under the Factories Act for maintaining the humidity register ?
361501	Why would any girl fall in love with me ?
361502	What is asexual reproduction ? What are the pros and cons ?
361503	Why did things evolve to require two to reproduce ?
361504	Is an employment bond legal in India ?
361505	When will KTM release Duke 200 with abs in india ?
361506	I'm going to fail my CPT December 2016 . I'm attempting again in June 2017 . What are the changes in the syllabus ?
361507	I am going to appear for CPT in June 2017 . Is the new syllabus applicable to me ?
361508	Are there any high performance phones with at least 5000 mAh battery ?
361509	Are there any high performance tablets with at least 5000 mAh battery ?
361510	How does life change after divorce ?
361511	What is the easiest way to friendzone a girl ?
361512	Does Fernando Muslera feel himself Uruguayan or Argentine ?
361513	Practical real life use of maths ?
361514	Are there any railway rules which dictate at what time the middle berths can be put down on Indian trains ?
361515	What is some witty name for a 24hours food joint ?
361516	What is the best way to get rid of flies in a hotel room ?
361517	Why does Indian TV shows always sticks to regressive topics why can't they make shows which would identify with the present generation like us ?
361518	I have some short scripts/themes for a TV show in mind . What is the procedure to make a TV show in the US ?
361519	What are some tips for caring for a Corgi/Husky mix ?
361520	What are some tips for caring for a Chihuahua Corgi mix ?
361521	What is LTE frame structure ?
361522	How do I get rid of the greasy feeling after fatty or oily food ?
361523	Why some of my mkv video files don't have thumbnails in Windows Explorer ?
361524	How do I burn video files in AVI , MP4 and MKV on to a DVD through my PC ?
361525	Low pressure turbine in Reheat cycle ?
361526	Is it true that President Eisenhower was alarmed to hear that half the U.S. population had below average intelligence ? Or is it a myth ?
361527	`` What are some sentence examples using'' `` simile'''' ?''
361528	`` What are some sentence examples using'' `` allegory'''' ?''
361529	How do I use remote desktop over RTSP ?
361530	How do you restart a remote desktop service ?
361531	Will there be any difference in battery consumption of a dual sim Mobile phone if single sim or both sims are put in into it ?
361532	What are the dual sim dual active Mobile phones available in Indian market ?
361533	How do I become an income tax officer ?
361534	What women size (s) is equivalent to men's size 36/38 pants and XL/XXL shirt ?
361535	What is the size zero figure for men ?
361536	What does it take to become a partner at Goldman Sachs ?
361537	What do partners at Goldman Sachs do ?
361538	What are the symbols and insignia used by the Order of the British Empire ? What do they mean ?
361539	`` What does it mean when someone says that ,'' `` You're very judgemental .'''' ? If it is a wrong trait , then how do I resolve it ?''
361540	What is the best way to tell a person to keep quite during a funeral ceremony ?
361541	What is the best way to tell someone you cant make it to their wedding ?
361542	Is there any cure for ankylosing spondylitis ?
361543	What is the best way to cure Ankylosing spondylitis ?
361544	Is OrangeHRM a widely used open-source program big in demand ?
361545	Where can I get a free iPhone in India ?
361546	What is global inequality and what are the negative effects in society ?
361547	`` Is there a correlation between the formulation of the Object-Oriented programming paradigm and the platonic idea of the'' `` composition of objects'''' ?''
361548	What is the best genealogy service for research ?
361549	How do you obtain a free genealogy test ?
361550	Can I get direct admission in to CSE 2nd year after the completed of bsc 1st year ?
361551	What is the backend of MS Access software ?
361552	Is Keynote better than Power Point ?
361553	What are pros and cons of Keynote vs PowerPoint ?
361554	What is the name of the J.B theme song in the end of movie skyfall ?
361555	Why is the movie End of Watch named like that ?
361556	What are main reasons for using Adobe Photoshop instead of , or in addition to Lightroom , even though it distort images that can't be recovered ?
361557	I failed thrice in my BBA examination . What to do in life ?
361558	Roman Empire : What was so great about Julius Caesar ?
361559	What are some personal details about Julius Caesar ?
361560	Why do disc brakes in cars do not have holes ?
361561	Why do disc brake have holes ?
361562	Why do South Indian & Tamil movies have a fast beating song where a dusty group of people dance aggressively along with the actor/actress ?
361563	Common Sense : Why is it that people believe more in visualizations than the realities ? For eg : say hero fighting a 1000 in a movie .
361564	What is the cost of CT Scan in Mumbai ?
361565	What is the cost of CT Scan Abdomen in Mumbai ?
361566	How do I root samsung galaxy j1 6 sm-j120H ?
361567	Which car services are available in Honolulu ? How good are they compared to taxis and relative to each other ?
361568	How can I decide which are the best running shoes for me ?
361569	What is difference between copywrite and patent ?
361570	How do copyrights , trademarks and patents differ ?
361571	Does Groupon have competitors ?
361572	Who are the groupon competitors ?
361573	What is JNU issue ?
361574	What is the JNU issue of 2016 ?
361575	Which is the best field for an MBA ?
361576	How is junior college in Singapore compared to Pakistan ?
361577	Y Combinator : Are there teams who went through YC , secured funding (or not) but failed to get a visa to stay in the U.S. afterwards ? If yes , what happened ?
361578	Will I have to buy FIFA 16 or a cracked version that will come out a few days after its release ?
361579	Does FIFA 16 crack has come out for pc ?
361580	Are Star Wars and Star Trek related ?
361581	Which is better and why : Star Wars or Star Trek ?
361582	Is C# by E. Balagurusamy a good book for a beginner or not ?
361583	Is C++ by E. Balagurusamy a good book for a beginner or not ?
361584	What are the best shops to get a dropped 2tb Seagate hdd repaired in Delhi ?
361585	Which model of seagate back up plus 1 TB is the best ?
361586	How much backwash goes back into your drink after every swallow ?
361587	Can we drink water right after we work out ? And how much time after a workout can we take a shower ?
361588	Who ordered the RBI to print more money ?
361589	What are some good books / websites that improve spoken English and reduce grammatical mistakes ?
361590	What are the best websites to buy books in india ?
361591	What is the difference between B. Sc . (H) Comp . Sc . and B. Tech . (C.S.) ? Which is better ?
361592	Royal Enfield Motorcycles : What are the best quotes/one liners for riders ?
361593	Is an old or new Royal Enfield bike best ?
361594	What is the syllabus and important subjects for upcoming BEL Examination on 6th July ?
361595	Which subjects from electronics and communication engineering are important for the BEL recruitment examination ?
361596	What is the Pin Code of Chandigarh ?
361597	Which free email service do you use : Gmail , Yahoo! Mail , Microsoft Outlook , or iCloud ? Why ?
361598	Is HDFC providing any credit cards against fixed deposits now ?
361599	Can we have two HDFC credit cards ?
361600	How many dollars did the store owner lose in the following scenario ?
361601	If a car is stolen and the stolen vehicle burns gasoline on which the original owner has already paid gas taxes , should the owner get a rebate ?
361602	Should I upgrade from the iPhone 4 to the iPhone 5s ?
361603	Should I get the iPhone 5s or the iPhone 6 ?
361604	Can Utopia really exist ?
361605	What was the sequence of events that led to World War 1 breaking out in 1914 ?
361606	Why are most communist countries very conservative ?
361607	What is a good algorithm to calculate the calories burnt from walking ?
361608	Companies that helps in reducing traffic issues ?
361609	If people invest less in mortgages and instead rent homes wont that help reduce inflation ?
361610	Why do I have to let her go ?
361611	Should I let her go or not let her go ?
361612	I am 25 years old and still not finished my engineering degree . I still two more years remaining . What should I do ?
361613	I have a nice personality , I'm 26 years old , I have a lot of bucks , I am software engineer , and I'm planning for my own business . How can I find a girlfriend (still searching) ?
361614	`` Is the word ,'' `` vegetables'''' , singular or plural ?''
361615	How do I color bleached hair ?
361616	What song plays over the end credits to the 2002 movie Alive ?
361617	Why is Cricket called Cricket ?
361618	Why is cricket called a ` gentleman's game' ?
361619	What is export payment ?
361620	What is an ` export' ?
361621	Planning to prepare for GMAT , Is it good to go with TIME ?
361622	Can a student of engg get back his docs if he leaves his institute.wat if the institute is not giving his docs back ? My college is affiliated to VTU . ?
361623	Mobile development compaines in hyderabad ?
361624	How do I obtain a Janta meal on Indian trains ?
361625	What universities does Graham recruit new grads from ? What majors are they looking for ?
361626	What universities does IGATE recruit new grads from ? What majors are they looking for ?
361627	What is fake , or scripted , about Survivor , and what is real ?
361628	What is it like to host Survivor ?
361629	Is there a Netflix premium account in which I could stream episode 1 of season 4 of Sherlock ?
361630	How was your experience with Tinder in India ?
361631	How thorough and invasive is the background check process for joining Infragard ?
361632	Are company pay scales conducted thorough background checks ?
361633	Should middle-aged people go back to primary / secondary school ?
361634	Is 23 a bad age to go back to college after high school ?
361635	What is your review of Agile Web Development with Rails 4 (2013 book) ?
361636	Is ruby on rails a good choice for a career in web development ?
361637	How can I test for all parasites ?
361638	What is the easiest way to be tested for parasites in the USA ?
361639	Why is Corona considered a Mexican beer ?
361640	What are some experiences with blogging ?
361641	Who is the greatest Marvel character and why ?
361642	Where can I get an Asian family office database ?
361643	If I got a 5.4 CGPA in the SA1 10 class , then can I get 10 in the CGPA or 90 % in the SA2 ?
361644	Is there anyone in TCS who got 3 consecutive ` A' bands ?
361645	What are bands in TCS ?
361646	How do I get my boyfriend to show more emotion and to open up more ?
361647	Does it look horrible to quit Amazon SDE 2 role after 10 months ?
361648	What does a refurbished phone mean ?
361649	How do I know if my phone is new or refurbished ?
361650	How did you get in shape ?
361651	What's the fastest way to get in shape for a race ?
361652	What are some mind-blowing gadgets tools for cars that most people don't know about ?
361653	Can music be without counterpoint ?
361654	Is eating oats healthy for lunch and dinner ?
361655	How do I lose 3kg weight in one week ?
361656	What are some examples of modern monopolies in the US ?
361657	What are examples of modern monopolies ?
361658	Where can I get Instagram followers for free ?
361659	What would you suggest , based on your personal experiences of the industry and academia , as areas to concentrate during an MS in statistics for somebody who does not want to stay in academia ?
361660	Can the federal attorney general be indicted ? If so , who convenes a jury and who arrests him or her ?
361661	How do I counter Huskar in Dota 2 ?
361662	How do I counter Pudge in DotA 2 ?
361663	`` Just ran Cat 5e cable through house ... wired in'' `` A'''' configuration ... now will not make a full connection despite getting flashing green lights at modem ?''
361664	Why is the book value of aerospace companies , such as Boeing and Lockheed , usually very low ?
361665	Why is the stock market BSE going down these days ? What will be the low/high margin next week ?
361666	Are automatic OTF knives actually used in tactical environments ?
361667	Do soldiers use combat knives ?
361668	What is the formula of magnesium carbide ?
361669	`` What is the difference between'' `` war'''' and'' `` terrorism'''' ?''
361670	Is the War on Terror a war against Islam ?
361671	How do I create an alert in Adwords that emails me every time a conversion occurs ?
361672	Why are indian IT companies misusing visa L visa category ? I am sure not all the tech workers are managers or executives
361673	'''' `` Hillary Clinton ; A Career Criminal'''' is a viral YouTube video that'' `` exposes'''' the Clintons . What part of it is true and what are conspiracies ?''
361674	What is the difference between Black hat SEO and Grey hat SEO ?
361675	What's the difference between black hat SEO and white hat SEO ?
361676	Which car services are available in Philadelphia ? How good are they compared to taxis and relative to each other ?
361677	Chess : What do you do if you are a 1300-1400-ish rated player and find that your ability to climb up has saturated ?
361678	How can I learn to like chess more ?
361679	Can you get high off cough drops ?
361680	`` What is a good speech about'' `` laughter is the best medicine'''' ?''
361681	Why is laughter the best medicine ?
361682	What is the script behind the website Flipkart ?
361683	What is the script behind this website ?
361684	What are some things new employees should know going into their first day at Aaron's ?
361685	How do I make conference calls using JIO4GVoice app ?
361686	Is it possible to transfer the data of khu x (NA) to khux (JP) ?
361687	`` What do you mean by'' `` beat'''' in AXI data transfer ?''
361688	What are the consequences of having a blood sugar level of 185 ?
361689	What are dangerous blood sugar levels ?
361690	Which is the best hair transplant clinic in Udaipur ?
361691	What are the differences between Website , Web Application and Web Service ?
361692	Is it ironic that cities that lean Labour/Democrat are also the most expensive ?
361693	What are some natural obligations of chicken ?
361694	Is developphp.com the best site for learning web designing ?
361695	Which is the best site to learn web designing and development ?
361696	What is the different between punk rock and metal and hard rock and all of that type of music ?
361697	What are the main differences between rock and soil ?
361698	Is it too late for a 2015 batch B.Tech CSE graduate to start his career in September 2016 as a fresher ?
361699	I have done B.Tech (CSE) in 2013 batch . What are the minimum chances to get into MNCs like TCS , Infosys as a Software Developer (Fresher) ?
361700	What are the best romantic places in and around Bangalore ?
361701	How will the customer and operator information be sent from Lync Server to SFDC , if we use Lync Server and not Lync client ?
361702	How will customer and operator information get sent from Lync Server to SFDC , if we use Lync Client and not Lync Server ?
361703	What are the best soft Bollywood songs ?
361704	What is the corporate culture like at Rudolph Technologies ? How is the culture different than other companies ?
361705	Is there any scope in India for social psychology ?
361706	Why did Tom Hardy cheat on Rachael Speed , and how did it affect their relationship ?
361707	What is Tom Hardy personally like ?
361708	What should I do if I can't access my Yahoo email ?
361709	How can I lose 20 lbs super fast to audition for a small role in a movie ?
361710	How is going to kindergarden at Eisenhower Elementary in the Cupertino Union School District these days ?
361711	Which are good elementary schools in cupertino ?
361712	How do you activate a Twitter account ?
361713	How can I activate my Twitter account in China ?
361714	Which player is better in Inazuma Eleven series , Victor Blade or Axel Blaze ?
361715	Does Orchidopexy affect fertility for the male child ?
361716	Which is the best brand for air-conditioners and why ?
361717	What air conditioner brands are know to be the best quality ?
361718	What technical specifications should I look for in my next laptop , keeping in mind that I would be using it mainly for big data analysis / data science projects ?
361719	How is Data Science different from Big Data Analysis ?
361720	What are the differences between sesame oil and toasted sesame oil ?
361721	Which is the best way to pass the 70-668 exam ?
361722	How do I clean the irremovable ear pads on my headphones ?
361723	What are your favorite albums and favorite songs on those albums ? (Write as many or as few as you wish)
361724	How can I start for peta ?
361725	What's a good excuse to use in a financial aid appeal letter ?
361726	Where do Japanese people go on holiday ?
361727	Is leaking coolant an expensive fix ?
361728	What does it feel like to live through a war and return to society ?
361729	Are we able to live in a world without war ?
361730	What are some lesser-known sights to see when visiting Pécs , Hungary ?
361731	What are some lesser-known sights to see when visiting Toronto , ON ?
361732	Do you prefer blonde or brunette girls ?
361733	Which do you prefer : blonde , brunette , or red ? Why ?
361734	What song plays over the end credits to the 2002 movie Spun ?
361735	What is Ethices ?
361736	How I can overcome thought that I was used by my GF ?
361737	Why Mirae Asset Mutual Fund AMC is not listed on mfuonline.com ?
361738	I place the mutual fund redemption order today at 10 AM through AMC website . When will I receive the funds in my a/c (bank a/c ECS is already setup) ?
361739	Secretary Clinton , as a Middle East resident , why should I prefer that Americans Elect you given your support of the Iraq War and its consequences ?
361740	How hard is it for people in general and Indians in particular to get into Wharton or university of Columbia for an MBA ?
361741	What is the difference between being defensive and being offensive ?
361742	What are self defense techniques ?
361743	How can I block websites even in incognito mode ?
361744	What are the best ways to train for climbing Mount Kilimanjaro ?
361745	Why do dogs rub the side of their face against things (such as my leg or furniture) , right after they've eaten ?
361746	Which is the best way to get practical knowledge about civil engineering ?
361747	What is the limit of our brain ?
361748	Is the attic theory true ? Can our brain store only a limited amount of data ?
361749	On Amazon , how do you delete your order history ?
361750	What was the first book ever ordered by a customer on Amazon ?
361751	Google Play Store : how to merge 2 published apps ?
361752	Is there a Farmville 2 app on the Google Play Store ? Why ?
361753	Should I start IAS preparation now at age of 28 ?
361754	Cpv vs CPM in Facebook ?
361755	What is the pay scale for a manufacturing engineer in India ?
361756	How do I play a DVD on PS4 ?
361757	Can we play online using an Xbox One vs a PS4 ?
361758	What percentage of net profits at gas stations come from the sale of fuel ?
361759	How are INTJs and INFJs similar ?
361760	Can INFJs get paranoid like INTJs ?
361761	Do girls like foot massages ?
361762	Why do people enjoy getting foot massages ?
361763	Can Windex leach through aquarium glass ?
361764	What do saltwater aquarium eels eat ?
361765	How do the best Super Smash Bros. players practice ?
361766	How do the best Super Smash Bros. . Melee players practice ?
361767	Can driving and travelling be a hobby ?
361768	How can I recover my iPhone 6s restriction passcode ?
361769	How do I recover my passcode for an iPhone 4 ?
361770	Is there a technical reason for Whatsapp's ` must update' policy ?
361771	When does WhatsApp last seen get updated ?
361772	How do you develop the muscles in your hand ?
361773	How do I developed muscles ?
361774	How safe is investing in index funds in India ?
361775	Has anyone tried Woodsplash.pl for video illustration ?
