test-446879	How is school changing in the 21st century in Portugal?
test-446880	Rich stay poor by living like they are broke. Broke stay broke by living like they are rich! How many agree with this, can't you call it aspiration?
test-446881	Is Xender and SHAREit earn money? How much?
test-446882	Why do deep sea divers wear boots made out of lead? Why is it important?
test-446883	Are all those alleged videos of ufos to be believed? Some, such as giant moving lights hovering over north American cities seem to solid to dismiss.
test-446884	What is the difference between electronics and electrical engineering?
test-446885	What is the basic difference between electrical and electronic s?
test-446886	Which is the highest peak of India; K2 or Kachenjungha?
test-446887	Which is the highest mountain peak in India, Kanchenjunga, Nanga Parbat or K2 (Godwin Austin)?
test-446888	Why are guards with the Prime Minister always wearing black sunglasses?
test-446889	How many times, a person can become a Prime Minister of a Country?
test-446890	I want to join IIM or FMS for an MBA executive course, but the fee is too high, beyond my limit. How can I do this course?
test-446891	What is the fee structure for an MBA/PGDM course in NMIMS?
test-446892	Can I link two mobile numbers which I have given to different banks like SBI,SBM,etc to the same BHIM UPI app?
test-446893	Why are no banks have launched UPI apps on iOS?
test-446894	Which elements on the periodic table are unreactive?
test-446895	What is the least reactive element on the periodic table of elements?
test-446896	What are the salaries of IAS, IPS and IFS officers?
test-446897	Is being an army/navy/air force officer more respectable or an IAS/IPS/IFS etc?
test-446898	Why do people drink water?
test-446899	Why do people drink water before having tea?
test-446900	How can I find out if someone is online on Facebook?
test-446901	I messaged someone on Facebook and it's been sent, not delivered. The problem is, the person has gone online. What is going on?
test-446902	Difference between joining army through tgc and cdse?
test-446903	Why credit card companies charges hefty amount for advance cash as processing fee and interest too?
test-446904	Why don't we see evil Indian men in American movies?
test-446905	What movies make men cry?
test-446906	What would have happened in India if it hadn't been partitioned in 1947?
test-446907	Had the British not left India, how different would India have been today from what it is at present?
test-446908	What are the pros and cons of breakwaters?
test-446909	What are the pros and cons of doing a pros and cons list?
test-446910	What kind of economic system does Cuba have? What impact has it caused to the country's economy?
test-446911	What is advance landing ground?
test-446912	How do l get 10 CGPA in class 10?
test-446913	How do I get 10 cgpa in class 10?
test-446914	Which MBA college is better, SIBM Pune or IMT Ghaziabad?
test-446915	Which is better, IMT, Ghaziabad, or symbiosis for distance MBA in HR?
test-446916	What are the best books to learn about the stock market?
test-446917	What is the best way to learn about stock markets?
test-446918	Why aren't Girl Scouts Boy Scouts and Eagle Scout taken seriously by their peers who haven't joined the organisation?
test-446919	Should I quit boy scouts?
test-446920	Wouldn't it be too hot for people in the Middle East to wear their daily cultural clothing?
test-446921	Why do people like to wear designer clothes?
test-446922	It's my weird friend?
test-446923	What is the best jock strap?
test-446924	Why is no one talking about the impact the Microsoft acquisition will have on LinkedIn Talent Solutions?
test-446925	What strategic advantage will Microsoft get by the acquisition of LinkedIn?
test-446926	I always want to lick my girlfriend's pussy, but she gets wet very quickly and after that liquid comes from her vagina. Because of this, her pussy smells bad and has a salty taste. What should I do?
test-446927	My girlfriend isn't very touchy but I am. She forgets I want kisses or something like that. What's a good way to gently remind her of that?
test-446928	How did you set up the relationship with you best friend or friends that are trustworthy?
test-446929	How did you set up the relationship with your best friend or friends that are trustworthy?
test-446930	About how many messages should a guy exchange with a girl on Tinder before asking to meet?
test-446931	I started talking to a guy on Tinder. He asked me where I work and what I do. Should I tell him?
test-446932	"What is the correct response to the question ""How do you do""?"
test-446933	Is this question correct in grammar: “Where will I be admitted to?”
test-446934	Who can share 300-370 VCE dumps and PDF dumps?
test-446935	Animation: Are managers usually artists?
test-446936	How would the Catholic church react if it was discovered that Alien life exists?
test-446937	If we discover and obtain proof of alien life, how would different world religions react?
test-446938	Does Gary Johnson have a chance?
test-446939	Is there any chance of Gary Johnson winning the 2016 elections?
test-446940	Is it true that peanuts won't sprout once contaminated by aflatoxin-related moulds?
test-446941	Many say that long distance relations won't work. Is it true or false?
test-446942	You have mentioned that you study AI's history and trying to extrapolate its future, what does the future look like?
test-446943	One of my friend suddenly vomited with blood on late midnight of Tuesday & he has hidden this incident from family members. Should he consult Doctor?
test-446944	What is the simplest way to hack a Facebook account?
test-446945	How do you hack a Facebook account?
test-446946	Life in the Universe: What is the likelihood that there exists a life form in the universe whose intelligence and technologies far surpasses our own?
test-446947	Would you chat with an alien?
test-446948	How does the weather work in Melbourne, Australia? How can it fluctuate from so cold to so hot and back so quickly, and why?
test-446949	Where can I get quick counselling in Melbourne Australia?
test-446950	"Rock musicians are often cited as having ""been classically trained."" What does this mean, why is it important, and do we ever really see the results in their playing or compositions?"
test-446951	Who have been the greatest musicians of classical music?
test-446952	Do married people have a secret bank account?
test-446953	What do I have to do, in order to get my accent sound more like one from the West Coast? (+ recording sample)
test-446954	Who are the service providers providing per minute inbound outbound calls in India?
test-446955	Can u provide any links for breathing exercises videos on YouTube which I can follow for anxiety?
test-446956	How do I join DRDO after my B.E. in electronics and communication engineering?
test-446957	How do I join DRDO after B.Tech in chemical engineering?
test-446958	"How do you say ""good night"" in Punjabi?"
test-446959	"In Hindi, how would you say ""good evening""?"
test-446960	How long does it take a woman to get pregnant after sex?
test-446961	Can I get pregnant after I had menstruation?
test-446962	How should I prepare for medical entrance when I have only 3-4 hours to self study?
test-446963	How should I prepare for a medical entrance exam within 3 months?
test-446964	Where can I buy Shield of strength Necklace?
test-446965	How much knowledge can a human being acquire?
test-446966	What are some things new employees should know going into their first day at Donegal Insurance Group?
test-446967	What are some things new employees should know going into their first day at Safety Insurance Group?
test-446968	Can a 12 year old have sex?
test-446969	What kind of underwear should a 12 year old use?
test-446970	What are the best mobile advertising agency in philippines?
test-446971	What are the best and biggest mobile advertising agencies in the world?
test-446972	It's my boyfriend's birthday and we're in a long distance relationship. What is something special which I can do for him?
test-446973	What are reasonable things to demand from one's boyfriend when in a long distance relationship?
test-446974	Does masturbation cause you to lose your virginity?
test-446975	Does masturbating lose virginity?
test-446976	What are some ways to learn how to play guitar?
test-446977	What are the best ways to learn guitar at home?
test-446978	Is there any chance for India to became a tough competition for China?
test-446979	I got eligibility for admission into electronics and communication engineering at NIE mysore and sathyabama university, chennai. Which college to join?
test-446980	Which is the best IAS coaching in Pune?
test-446981	Which is the best coaching for IAS in Mangalore?
test-446982	What is it like to be a K-pop star?
test-446983	What is it like to be a Japanese pop star?
test-446984	Did the divinity leave the humanity alone during the crucifixion?
test-446985	How does the relative position of centre of gravity change with density?
test-446986	How often are police officers in the USA drug tested?
test-446987	What legal options are available when me & the police officer find the robber that robbed my phone in USA?
test-446988	What universities does Johnson Outdoors recruit new grads from? What majors are they looking for?
test-446989	What universities does Clear Channel Outdoor recruit new grads from? What majors are they looking for?
test-446990	Can Tim Cook maintain Apple's success post Steve Jobs legacy?
test-446991	Was Apple Watch still initiated by Steve Jobs or already by Tim Cook?
test-446992	Can I get admitted in Jaypee Noida with 95 marks in the JEE Main?
test-446993	I've got 97 marks in JEE Mains and 83 percent in CBSE board. Can I get CSE or IT in JayPee Noida sector 62? If not, where should I apply?
test-446994	Is it theoretically possible to launch an object to orbit around the supermassive black hole, inside an event horizon, so it won't collapse too fast?
test-446995	Is it possible to orbit a black hole inside the event horizon?
test-446996	What does a bear look like?
test-446997	What are bearings?
test-446998	Is eating cow more ethical than eating dog? Why?
test-446999	Why do we love dogs, eat pigs and wear cows?
test-447000	Who are some of the best professors at NSIT?
test-447001	Who are the best professors at NSIT?
test-447002	How should I become intelligent?
test-447003	What can I do to become smarter?
test-447004	Is donald trumps hair real?
test-447005	Is Donald Trump's hair real?
test-447006	What is the meaning of Coldplay's song 'Yellow'?
test-447007	"I would like to play my boyfriend a song on the guitar for his birthday present. I'm not sure if it's appropriate because the lyrics say ""I love you"" and I'm not ready to say that yet. It's ""Yellow"" by Coldplay. Is it ok or not?"
test-447008	How do I develop my personality?
test-447009	How do develop my personality?
test-447010	How can I help my six month old kitten survive a persistent high fever? He is in the hospital, blood and poop tests have not revealed anything yet.
test-447011	How do I get my 2.5 month old kitten to calm down?
test-447012	What color is a woman pubic hair if she has orange hair?
test-447013	What color are woman pubic hairs on the vagina?
test-447014	Does every dog has rabies?
test-447015	Would I die if my dog bit me one week following 3 rabies vaccinations I had last week?
test-447016	What does it mean to be vulnerable, emotionally? How does it feel to be vulnerable to someone?
test-447017	Does hiding feelings for someone mean that they are trying not to be vulnerable?
test-447018	Is totally clear face texture mandatory for flight attendant?
test-447019	The U.S. wants to break the international norm set by him, while China and other countries uphold the norm on India's entry to NSG, Why?
test-447020	What is the difference between SAP MM, SAP SD AND SAP BO? Which one is better?
test-447021	Which companies use SAP MM in india?
test-447022	In FMA: Brotherhood why didn't Hohenheim use Xerian warrior souls in his stone as extra troops by binding them to armor?
test-447023	What are the top benefits of life insurance policies?
test-447024	How practical is it to own a parrot while doing a Ph.D. program?
test-447025	How practical is it to own a dog while doing a Ph.D. program?
test-447026	How do I win a battle royal in h1z1?
test-447027	How did college educated white women vote in 2016?
test-447028	What is the difference between lipstick and lip gloss?
test-447029	What kind of lipstick would cause me to have the same color lips as I have right after I eat blackberries?
test-447030	What are the driving rules in Georgia versus Illinois?
test-447031	What are the driving rules in Georgia versus California?
test-447032	"Why is period blood ""dirty blood""?"
test-447033	What is ear blood?
test-447034	What is the meaning of the title song of Suits? Can anyone explain?
test-447035	"What is the meaning of Laura Marling's song ""Ghosts""?"
test-447036	What exactly is time travel and is it possible?
test-447037	Is Time travel possible under known physics principles?
test-447038	What is the difference between fund of funds and hedge funds?
test-447039	What is the difference between an investment fund and a hedge fund?
test-447040	What is the best gift to give on rakshabandhan?
test-447041	What is the best gift one can give to his/her mother?
test-447042	Which one is better for your health, biscuits or chocolates?
test-447043	Is chocolate good for your health?
test-447044	Which is the best site to learn python?
test-447045	What are the best websites for learning C++?
test-447046	Who is your least favorite Harry Potter character and why?
test-447047	Who is your favourite Harry Potter character? And why?
test-447048	What is most embrassing moment of your life?
test-447049	What is the most embarrassing moment of your life? By vivek
test-447050	What are some best universities for computer science in canada?
test-447051	What are the best universities for Master in Computer Science in Canada?
test-447052	What are the factors that influence depreciation in the value of Indian Rupees?
test-447053	How is the value of the rupee decided with respect to the dollar?
test-447054	How should I earn money online at home? What are some proper ways?
test-447055	What are the best ways to earn money from home?
test-447056	What does it mean when you keep dreaming about your ex?
test-447057	What does it mean when you dream about someone?
test-447058	Do you think people worship God because God is the winner and we are told by our elders to worship God and we all want God to forgive our sins? Do we all pray to God to ask for a bunch of gifts? Are we all selfish?
test-447059	Should you pray ask God for cash/money instead of working?
test-447060	How much money does Bill Gates make per second?
test-447061	How much money do music directors make per movie?
test-447062	Is it true that the flag at the Jagannath Temple, Puri flies in the opposite direction of the wind?
test-447063	What are some of the lesser known facts about the Puri Jagannath Ratha Yatra?
test-447064	What is a discrete GPU?
test-447065	If a CPU can act as a GPU, can a GPU act as a CPU?
test-447066	Which college is best for chemical engineering in Gujarat?
test-447067	Which is the best college for a BTech in chemical engineering in Maharashtra?
test-447068	Why did swedish house mafia break up?
test-447069	Why isn't Swedish House Mafia breaking up?
test-447070	Which is the best dhaba in Nagpur?
test-447071	Which is the best place in Nagpur?
test-447072	What would the universe be like if light and sound travel at the same speed?
test-447073	What happens if light and sound travels at same speed?
test-447074	What can be a good farewell gift for our seniors in college in the range of Rs. 200?
test-447075	What all can be written in the farewell message of a graduating senior?
test-447076	What are the best websites to download pop songs?
test-447077	What is the best website for downloading songs?
test-447078	What are the best places to visit on a 3 day trip in and around kerala?
test-447079	What are the best tourist spots in Kerala?
test-447080	How probable is it that a third world war will break out?
test-447081	What would be the cause of world war 3?
test-447082	How can an ordinary person make the world a better place?
test-447083	"What are some things the ""average"" person can do to make the world a better place?"
test-447084	What is your most embarrassing moment at night?
test-447085	What is your worst stage embarrassing moment?
test-447086	What is the different between love and like?
test-447087	What's the difference between love and like?
test-447088	How do I save a picture on WeChat?
test-447089	Why do some people post twits or pics in WeChat and then delete them about a week later?
test-447090	Does VPN hide your browsing information from your employer, your internet service provider, or the websites you visit?
test-447091	Do internet service providers (ISPs) care what websites we visit?
test-447092	Work environment in fiserv?
test-447093	Will Mance Rayder escape Ramsay and winterfell and help Jon somehow?
test-447094	What are some really cute Malayalam words (with their meanings)?
test-447095	What is the most difficult word in Malayalam?
test-447096	How can I open my bank account in Bank of America?
test-447097	How do you close a Bank of America account?
test-447098	How do you make an edible fruit arrangement?
test-447099	How do you make a fruit arrangement?
test-447100	Why is online shopping market the best?
test-447101	What online shopping market is the best? Why?
test-447102	Who takes charge of the state in the absence of the governor in india?
test-447103	India: In a war, if Delhi is destroyed with no parliamentarian alive, what will happen next? Who will take charge? How will the Indian army act?
test-447104	Where can in Bangladesh I find rilutek?
test-447105	How are the teachers and students of Stella Maris, Chennai?
test-447106	What are the pros and cons of ecotourism?
test-447107	What do you see as the main pros and cons of ecotourism?
test-447108	What should the president of a university do?
test-447109	What does a President of a university do?
test-447110	Is hair oil necessary for men?
test-447111	Do girls prefer guys with a beard or clean shaved?
test-447112	Should the Oxford comma be eliminated?
test-447113	How did Cicero punctuate clauses?
test-447114	How do I access root system files from an Android device using a PC without having to root the device?
test-447115	Is there any file browser for Android works without root access?
test-447116	Am not starting big? How can I make $1000 per month online?
test-447117	What are ways to make money online?
test-447118	Why have most leaves evolved to be green instead of black?
test-447119	Why are plants green instead of black?
test-447120	What functions do pollen grains serve in plants?
test-447121	What are nodules in plants? What functions do they serve?
test-447122	Who are the tallest quarterbacks in the NFL? Does their height give them an advantage over their shorter peers?
test-447123	What are the primary drops for NFL quarterbacks? 3-step, 5-step?
test-447124	What are best jobs for control system engineer?
test-447125	What are the top jobs for a mechanical engineer with a controls background?
test-447126	Why doesn't PayPal have two-factor authentication like Google and Facebook?
test-447127	Is there a way to apply external authentication methods to Moodle, like a two factor authentication program developed by me?
test-447128	How can a woman tell if a shy guy likes her?
test-447129	Can a girl tell if a guy likes her?
test-447130	What is the difference between a simulacrum and a simulation?
test-447131	If words represent concepts, and a simulacrum is a representation of a concept, is language an example of simulacrum?
test-447132	How can I contact a genuine hacker?
test-447133	How do I hire a hacker?
test-447134	Is Daenerys on the way of becoming an antagonist in the series?
test-447135	Will Daenerys become an antagonist in Game of Thrones?
test-447136	What are some ways that men can tie long hair?
test-447137	Do men ever regret growing their hair long?
test-447138	How much does it cost to get a safe deposit box at Bank of America?
test-447139	What banks in Palo Alto rent safe deposit boxes to non-customers?
test-447140	Theoretically, can someone who was born in a foreign country become a MP in the UK Parliament?
test-447141	Can a foreigner become a UK policeman/woman?
test-447142	What should every traveller know in order to not be totally ignorant about Tbilisi?
test-447143	What should every traveller know in order to not be totally ignorant about Madrid?
test-447144	"What happens if you check the ""I know about..."" box on Quora topic biographies?"
test-447145	"When changing your Quora topic bio, what does checking the box ""I know about X"" do?"
test-447146	Is Confucianism against capitalism?
test-447147	Is Confucianism incompatible with capitalism?
test-447148	How can your tongue go numb?
test-447149	Why does my tongue go numb?
test-447150	Why do people ask Quora questions instead of just searching google?
test-447151	Why do people ask questions on Quora when they can easily find the answer for it on Google?
test-447152	I love travel, so I want to make my career based on that. What can I do?
test-447153	I love wanderlust and I want to make travel as my career, how can I make it?
test-447154	When will be Pokemon go available in App Store of India?
test-447155	When will the Pokemon Go Android game release in India?
test-447156	What is exciting in your life now?
test-447157	I'm 5'3 and 14 years old. How do I grow tall? Will I grow more? What supplements or tricks should I practice to grow tall at this point?
test-447158	What should you expect from your life?
test-447159	What you expecting from life?
test-447160	How was your UPSC prelims 2016 experience?
test-447161	How was UPSC prelims this year 2016?
test-447162	What are some of the most hilarious jokes you've heard or read?
test-447163	What is the funniest joke you've ever heard or read?
test-447164	Are there superheroes that were born with powers but are not X-men?
test-447165	Is the cast of Naruto closer in power level to the Avengers or the X-Men?
test-447166	Why do people of Kashmir hate the rest of India so much?
test-447167	What is the Kashmir issue?
test-447168	Can we get any job in indian army if we completed engineering?
test-447169	If EU fell apart, would some countries reduce privacy regulations inherited from EU?
test-447170	Why do we have to charge a battery for a long time after we buy a new phone?
test-447171	Is it possible to charge a phone for a short time with a 100mAh battery?
test-447172	Is it true that most of the mechanical engineers from IITs end up in low paid jobs?
test-447173	Can a mechanical engineering undergrad. end up with a computer/software related job?
test-447174	What did Diaspora do with the $200k it raised? Why does it need more money now?
test-447175	How can I raise money for my tech company?
test-447176	Why do share prices of the same company differ in BSE and NSE?
test-447177	A company is listed in both BSE and NSE but at a different value in each. If it's the same company, why isn't the value same in both?
test-447178	What exactly is the difference between internal energy of a system and enthalpy?
test-447179	What is the difference between energy and enthalpy?
test-447180	Does God exist?
test-447181	Does God really exist? What are your opinions?
test-447182	What kind of jobs I can get with major in mathematics and minor in CS? Is it worth it?
test-447183	I have a CS major now. I want to go back and get a degree in either Marketing or Management. Is it worth it?
test-447184	What is the difference between managers and entrepreneurs?
test-447185	Have you ever been at a company when multiple employees quit at the same time?
test-447186	How do I convert my blog into a website?
test-447187	Is it possible to merge two different blogs into one?
test-447188	Why am I a vegetarian?
test-447189	Why am I not a vegetarian?
test-447190	What's the most useful thing you've learned on Quora?
test-447191	What is the most useful fact that you've learnt from Quora?
test-447192	What is Danville, VA like compared to Jamestown?
test-447193	Auto renew pricipal and repay?
test-447194	Europe tour expreience?
test-447195	Why are there SO MANY idiotic questions about The Beatles on Quora?
test-447196	What are some natural obligations of chameleons?
test-447197	What are some natural obligations of scorpions?
test-447198	How did Priyanka jha, Dhoni's ex-girlfriend look like in real life?
test-447199	How can I meet MS Dhoni?
test-447200	How do you measure effectiveness?
test-447201	How do you measure the effectiveness of Salesforce?
test-447202	nazer kurkkoli: How do I change/update my mobile number for both SBI online banking and SMS alerts?
test-447203	Why does State Bank of India boast about online banking when they dont have the facility to change your mobile number online?
test-447204	Who is more racist - Hillary or Trump?
test-447205	Who is most American, Hillary or Trump?
test-447206	What is the best free PDF reader for large documents?
test-447207	Where can I get online PDF or EPUB versions of books?
test-447208	Can cuddling causes pregnancy?
test-447209	In literature, what is the meaning of evocative description?
test-447210	"How do you pronounce the word ""havaianas""?"
test-447211	"How do you pronounce the word ""Matsushita?"""
test-447212	Is there a free, easy-to-use program like GeoGebra that doesn't require an Internet connection?
test-447213	Which program could I use, that is free, to disable users on my WiFi and also can tell what device is connected to the WiFi?
