test-611880	What are the characteristics of a person who has Taurus Sun, Scorpio Moon and Pisces rising?
test-611881	What is the personality of someone with a Pisces sun sign, Scorpio moon sign, and Libra rising?
test-611882	What are the courses available after 10th?
test-611883	What are the courses available after 10th in Chennai?
test-611884	In what way can I burn 1900 calories a day?
test-611885	What is the best way to burn 100 calories a day?
test-611886	What color are my eyes?
test-611887	What color is your eye?
test-611888	If I start No Man's Sky offline and get far in the game, can I continue in online?
test-611889	What are the best SEO practices for 2016?
test-611890	Do investment firms hire entry level engineers?
test-611891	Would you hire an entry level programmer with an entire sleeve of tattoos?
test-611892	Is it possible the only photo of Billy the Kid is a fake?
test-611893	How can we be certain that the only photo of Billy the Kid is really Billy the Kid?
test-611894	What are the things I need to build a drone from scratch?
test-611895	What do I need to know to build my own quadcopter?
test-611896	OnePlus 3 or Nexus 6P?
test-611897	Is it possible to tie WOL to my Minecraft server running on Linux that shuts down after a period of time?
test-611898	Why is there such hatred of the Clinton family, and Hillary Clinton in particular?
test-611899	What is project loon? How it works?
test-611900	How do I overcome the fear of anything?
test-611901	How could we overcome our fears?
test-611902	"Why do I get the log message ""To honour the JVM settings for this build a new JVM will be forked"" when I tried to run my Android studio project?"
test-611903	What are some of the rights protected by the 5th amendment?
test-611904	What are the chances of giving birth to twins?
test-611905	How do I give birth to twins?
test-611906	How can you find companies that hire junior developers for remote jobs?
test-611907	Do companies hire junior developers for remote jobs?
test-611908	Which is the best song of Kailash Kher and why?
test-611909	What is your favourite song of Kailash Kher and why?
test-611910	How much does a decent motorcycle cost?
test-611911	Why do some motorcycles cost so much?
test-611912	Where, if anywhere, in the Qur'an does it say that non-believers must be killed? In what context?
test-611913	Is there any religion in the world that does not say that non-believers will go to hell?
test-611914	How rare are new questions on Quora?
test-611915	Is there any way to browse through just newly-asked Quora questions?
test-611916	What is a presentation software application?
test-611917	What do you guys think about my website portfolio?
test-611918	What Migos song has the best lyrics?
test-611919	What is the best song by Migos?
test-611920	Why are men's and women's zipper slides on opposite sides?
test-611921	Why are zippers normally at the back of women's clothes?
test-611922	How will LCA tejas perform if it is upgraded with a thrust vectoring engine?
test-611923	Is Tejas or the JF 17 better?
test-611924	What can you do on a first date to increase your chances of a second date?
test-611925	What am I doing on a first or second date that never leads to a third?
test-611926	Is MS Dhoni always underrated?
test-611927	Who is Mahendra Singh Dhoni?
test-611928	On Snapchat, why does someone I deleted from friends appear under the added me menu saying added you back?
test-611929	Someone deleted me on snapchat, so I deleted him & now he appears in my Added me section, but I cannot see his score. Does this mean he added me back?
test-611930	What is calculus and how is it useful?
test-611931	How is calculus used in statistics?
test-611932	How can I start preparing for UPSC 2017 while I'm Working?
test-611933	How should I start preparation for UPSC?
test-611934	Why don't we see further instances of shadow baby of Melisandre?
test-611935	Why wouldn't Stannis use Melisandre's shadow baby to kill off all his enemies?
test-611936	Is China rich or poor? Why?
test-611937	Whose gap between the rich and poor is wider, China or the US?
test-611938	Who is your favorite actor/acttress & what movie?
test-611939	Who is your favorite actor?
test-611940	How did the arrival of Arab traders influence life in Eastern Africa?
test-611941	Was the expansion by trade and missionaries not conquests in parts of Africa, North aside, a foreign policy of Muslim Arabs or just a consequence?
test-611942	What are some good hotels in Nagpur where unmarried couples can stay for the night?
test-611943	Which is the best 5 star luxury hotel in Lucknow?
test-611944	How many watts are equal to 1 unit in an electricity bill?
test-611945	How many amps does a 700 watt microwave use?
test-611946	Is it a good time to buy property in prague?
test-611947	Is it a good time to buy property in the philippines?
test-611948	What is your favourite healthy food?
test-611949	What are your favourite healthy foods to keep on hand?
test-611950	What is a daily ritual you adopted that turned out to be really efficient?
test-611951	How would you compare HDFS and S3 in terms of cost and performance for cloud-based Spark analytics?
test-611952	What are some of the reasons why people drink alcohol?
test-611953	Are commerce students without maths eligible to appear in NDA?
test-611954	What is Uber's minimum viable product?
test-611955	What is Lyft's minimum viable product?
test-611956	What is the annual fee for mbbs in Pvt medical colleges in uttar pradesh?
test-611957	Get respect in company?
test-611958	How I could learn some martial arts at home?
test-611959	How can I learn martial arts in my home?
test-611960	How do Komodo dragons hunt their prey?
test-611961	How does the Komodo dragon kill its prey?
test-611962	Where do you have your bucket list?
test-611963	What's your bucket list?
test-611964	Which IS codes civil engineer should have in hand?
test-611965	Why do so few people (it seems) don't know how to use Google properly?
test-611966	Which thing I should know before investing to stock market?
test-611967	What are the things to be noted before investing on share market?
test-611968	Is my myopia severe?
test-611969	What is it like to have severe myopia?
test-611970	Why is homosexuality illegal in India?
test-611971	Why is practising homosexuality a crime in india?
test-611972	Why www.thefreethoughtproject.com website grows commonsense in many people?
test-611973	Vector group of for the group DY5?
test-611974	I'm having belly and can I get six packs in six months?
test-611975	Can you get a six pack in a month? How?
test-611976	While writing quickly, why do we miss some words unintentionally?
test-611977	Can I write the word naiveness?
test-611978	What the difference between the aerospace engineering and the aircraft engineering?
test-611979	What is the difference between electronics engineering and aerospace engineering are they similar in any ways?
test-611980	How do you encourage creative thinking within a corporate organization?
test-611981	After how many days the corporation bank gives the joining?
test-611982	Can we time travel anyhow?
test-611983	Can I time travel?
test-611984	What is a good diet after?
test-611985	What is the best diet for healthy living?
test-611986	How can I stop being afraid of working?
test-611987	How can I stop being afraid of doing what I want?
test-611988	What is the meaning of tamil word kumki?
test-611989	"What is the meaning of the Tamil word ""Saar""?"
test-611990	What is the best way to find the genre of a song?
test-611991	What is the best song of all time? From any era and genre from anywhere in the world?
test-611992	What is the best background check company for startups?
test-611993	What are the best background check companies for startups?
test-611994	Will there be a world war three?
test-611995	Do you think we are on the verge of World War III?
test-611996	How do you convert .txt files into .srt format?
test-611997	How do I convert an ebk3 file to a txt file?
test-611998	What is the best place to see in Oslo?
test-611999	What are some good sites to see in Oslo?
test-612000	We are looking for a full-time maid in Bangalore after my delivery in January 2016. What is an authentic maid agency?
test-612001	What is the job title of a male maid?
test-612002	What are the skills the flight attendant need?
test-612003	What technology or website will be the first stop in 2017 for people looking at cars for sale and why?
test-612004	How can I stop being afraid to be myself?
test-612005	How do you stop being afraid of everything?
test-612006	What gases are dissolved in liquids? What are some examples?
test-612007	What are examples of diffusion in gases?
test-612008	What are the things that lasts forever?
test-612009	What is forever?
test-612010	How can you determine the Lewis structure for SF5?
test-612011	How can you determine the Lewis structure for NO?
test-612012	How do I view older messages on Kik?
test-612013	I get Kik messages from Kik team members saying I won certain prizes. Is this really true or is this a scam?
test-612014	How can I attract a guy and make friends?
test-612015	How do you get a girl to like you?
test-612016	If [math]2A = 3B[/math] and [math]4B = 5C[/math] then what is the ratio of [math]A:C[/math]?
test-612017	What is Singapore Math?
test-612018	How do I get scholarship for studying abroad?
test-612019	Can I get scholarship to study abroad?
test-612020	What is the best way to visualize square footage?
test-612021	What is best way to sell my old house?
test-612022	What happens when you dont drink water for 3 days?
test-612023	What happen when you dont drink water for a day and you eat a salty potato chips in evening?
test-612024	What will be the impact of demonetization in India?
test-612025	How will demonetization impact property market?
test-612026	What was the Monroe Doctrine? Why was it announced? What was its significance?
test-612027	What caused the Monroe Doctrine?
test-612028	What do I need to know about learning violin?
test-612029	What do I need to know in buying a new violin for a beginner?
test-612030	Which is best book for Quantitative Aptitude, especially for cracking Banking exams high grade like RBI and NABARD.
test-612031	What aptitude book is best for cracking interview aptitude round in companies which visit IITs?
test-612032	How many people who work on the Large Hadron Collider (LHC) at CERN in Switzerland are atheist?
test-612033	How was the Large Hadron Collider built?
test-612034	Medical School: Is it better to go for USMLE or NEET?
test-612035	What was the hardest thing you had to go through in medical school?
test-612036	What did you learn from that person you least expected to learn from?
test-612037	Business intelligence engineer interview questions?
test-612038	How should I preapare for GSoc 2017?
test-612039	What is the way to get selected for google GSOC 2017?
test-612040	What did someone do that made you think that they were really smart?
test-612041	What was something that someone did that made you think they were really smart?
test-612042	"What does the expression, ""Child is the Father of Man"" actually mean?"
test-612043	What are the means of self-expression?
test-612044	Is Latin a phonetic language?
test-612045	Is the Romanian language a Latin or Slavic language?
test-612046	Why can't I connect Facebook to my Pearl's Peril game?
test-612047	Is it against Facebook T.O.S. to announce a contest winner on your Page Wall?
test-612048	How many types of Olympic Games are there?
test-612049	Who won gold in boxing in the 1928 Olympic Games?
test-612050	"Why do people say ""period"" after the end of a sentence to stress upon its importance?"
test-612051	I always see people writing the same sentence twice, as if to stress a point; e.g. Am I right? Or Am I right? What really is its use?
test-612052	Why do some think that capitalism is better than communism?
test-612053	Which one is better, communism or capitalism?
test-612054	How can i grow taller after puberty?
test-612055	Is there any way to grow taller during puberty?
test-612056	How do I get the owner's details from the vehicle registration number in India?
test-612057	How can we get the details of the number of vehicles of a particular type and brand sold in a particular city in India?
test-612058	How do I treat someone who I know talks trash about me behind my back?
test-612059	What do you do if your parents talk about you behind your back?
test-612060	What are the best reference books for gate chemical engineering?
test-612061	What are the best books for chemical engineering?
test-612062	Where can I find a Diablo 2 LOD v1.13 hero editor?
test-612063	Which is the best carry hero in Dota 2? Which hero is the best for getting the most kills?
test-612064	Why do we prefer to drink water in silver utensils?
test-612065	How can I get myself to drink more water?
test-612066	What are the characteristics of Hogwart's houses in Harry Potter? What is their role and what do they represent?
test-612067	What house was Cornelius Fudge in at Hogwarts?
test-612068	What's the difference between a cow and a bull?
test-612069	How do you tell the difference between bulls, cows, steers and heifers?
test-612070	If one understands Mormonism enough and believes it, would they want to be Muslim before they would want to be an evangelical?
test-612071	If one understands Mormonism enough and believes it, would they want to be Jewish before they would want to be an evangelical?
test-612072	How does subconscious mind work?
test-612073	How does the mind work?
test-612074	I have an idea and want to build a website would it be wise to hire website consultant?
test-612075	Does anyone offer 100% financing for a franchise startup?
test-612076	What is CSS4? Should I just learn it now?
test-612077	What can I learn right now in an hour that could be useful for the rest of my life?
test-612078	How can you hack into somebody's bank account?
test-612079	How do you hack into someone's account?
test-612080	What can be a good farewell gift for our seniors in college in the range of Rs. 200?
test-612081	What is the best farewell gift a set of juniors can give to the set of outgoing senior batch?
test-612082	What is the meaning of ketai?
test-612083	What is the meaning of meaning?
test-612084	What is the time difference increment between sunrise and sunset per day?
test-612085	Amazing facts about wikipedia?
test-612086	What's the health benefits of drinking sorrels?
test-612087	What are health benefits of drinking beer?
test-612088	In the event of a complete engine faliure will an aircraft fall off the sky instantaneously?
test-612089	In the event of complete engine faliure will an aircraft fall off the sky instantaneously?
test-612090	"When you delete someone off Snapchat do they appear on your ""added me"" list?"
test-612091	I deleted my friend on Snapchat after a fight. They appear on my added me list but I cant see their score. Does anyone know what this means?
test-612092	Is Internet of Things really the future?
test-612093	What is the future of the Internet of Things?
test-612094	How easy is it to get rich by investing in stocks?
test-612095	How do I get rich from stocks?
test-612096	Why choose an electric kettle over a traditional stove-top model?
test-612097	How do I cook a spicy rice dish using an electric kettle?
test-612098	How much clearance do you need between gas logs and a firebox?
test-612099	How do you find out how much gas a car uses?
test-612100	How many reviews do you have to write to be accepted into the Amazon Vine program?
test-612101	What is your review of BB Ki Vines?
test-612102	Is it ok for your boyfriend to go away with a female friend?
test-612103	"Is it ok for a female friend to address her female friend as ""bro""?"
test-612104	Which are the best portals for jobs in embedded domain?
test-612105	What is the value of angle of contact for pure water?
test-612106	Love marriages or Arrange marriage? Which is better
test-612107	What do you prefer: love marriage or arranged marriage?
test-612108	I rejected my crush because I freaked out when he said he liked me now his quiet help me?
test-612109	What kind of food is this?
test-612110	Who is the best mobile app developer in the Bay Area?
test-612111	Who are the best mobile app designers in San Francisco Bay Area?
test-612112	Why do we have negative axis in the Cartesian coordinate system? Why don’t we plot all points in positive axis?
test-612113	What is the difference between subsidence and convergence?
test-612114	What is the fastest way of killing yourself?
test-612115	What is the fastest way to kill yourself?
test-612116	Why won't Instagram refresh anything?
test-612117	Instagram asks me to verify my phone number, but I'm unable to get a verification code. What should I do?
test-612118	Does not open?
test-612119	I am a cyclist moving to Houston. If I could only take one bicycle, road vs. mountain, solely for recreation, which should I take?
test-612120	How can I overcome depression of ignorance?
test-612121	How can one overcome depression?
test-612122	Why are some Americans opposed to the Affordable Care Act (Obamacare)?
test-612123	Obamacare (Patient Protection and Affordable Care Act): My insurance costs my employer $12k yearly. Since the penalty is only $2k per employee, would my employer save money by paying the penalty?
test-612124	Why is sex a taboo?
test-612125	Why is sex such a taboo in Africa?
test-612126	How many times in a day are the hands of a clock in a straight line but in the opposite direction?
test-612127	"What is the reason behind clocks’ hands moving in a ""clockwise"" direction? Why wasn't ""anticlockwise"" accepted as the “right way round"" for time?"
test-612128	Is it possible to lower the floor of my garage without damaging the foundations?
test-612129	What is floor test?
test-612130	What's the difference between Marlboro Red Label and Marlboro Red?
test-612131	Is there a difference between Marlboro Reds in USA and India?
test-612132	What is the best open source code to build marketplace?
test-612133	What is the Best open source marketplace script?
test-612134	Am I a normal teenage girl?
test-612135	Am I normal?
test-612136	What are the fee of Vardhman Mahavir Medical College, New Delhi?
test-612137	What are the future prospects of Vardhman Mahavir Medical College, New Delhi?
test-612138	How do you open a JetForm file?
test-612139	How do you open a .ddf file?
test-612140	How was the sanitation system in the Victorian era?
test-612141	What was the sanitation like during the Victorian era?
test-612142	How do I sabotage my parents Netflix account?
test-612143	Which food supplement is best and organic. for. every one?
test-612144	What are the emerging trends in Healthcare?
test-612145	What are the emerging trends in the agriculture sector?
test-612146	What is the relation between the Mongrel Complex and Plantation Mentality in Brazilian middle to upper classes?
test-612147	"Why do Brazilians have the ""Mongrel Complex""?"
test-612148	Does Pizza Hut have the best chain pizza?
test-612149	Is the Hawaiian pizza from Pizza Hut good?
test-612150	What`s an efficient way to overcome procrastination?
test-612151	How can one overcome procrastination?
test-612152	Why do people on Quora ask silly questions about the facts which can be googled very easily?
test-612153	Why do people post questions on Quora when they can find the answer quickly with a Google search?
test-612154	How can I increase my Page ranking in Google? My site is: www.dirtyandthirty.com
test-612155	How do I increase the page rank of my blog?
test-612156	"How do I resolve a ""requested timed out"" when pinging?"
test-612157	What is a constant ping command?
test-612158	What is spiritual about 3 a.m.? Why do people wake up especially at this time?
test-612159	What are the best words to wake up to? I'm starting a wake up call service.
test-612160	What is the life of a US marine engineer and naval architecture like? Ship engineer?
test-612161	What is the life of a marine engineer like?
test-612162	How much does bone marrow transplantation cost in India?
test-612163	How much do braces cost in india?
test-612164	What are the results of doing push-ups daily?
test-612165	What are the results of doing push ups?
test-612166	How a official signature should be look like?
test-612167	What does your signature look like?
test-612168	Where should one with 4 little kids live in the research triangle (North Carolina) area? We just moved here & our chief target is the best kids life.
test-612169	Which are the best and affordable resorts near Mumbai for a one day trip?
test-612170	"English (language): What are some different, creative ways to say ""good morning""?"
test-612171	What are some different ways to say goodnight?
test-612172	What should I do in my one sided love story?
test-612173	What is your one sided love story?
test-612174	"What do I tell my 15 year old daughter who came home with a ""hickey"" on her neck?"
test-612175	How would you feel if you had a 15-year-old daughter who got pregnant?
test-612176	Is there an easy way to learn french?
test-612177	What are the best ways to learn French?
test-612178	Are women still interested in men?
test-612179	Why do some Caucasian men prefer Asian women?
test-612180	Who is Donald Trump's base? Why is he popular? Why are people voting for him? Why do people like and support him?
test-612181	Why do people like Donald Trump?
test-612182	How do I stay energetic?
test-612183	How can one be energetic?
test-612184	How do I over come from negative thought?
test-612185	How do I come over negative thoughts?
test-612186	How do I become assertive person?
test-612187	How do I become more assertive without feeling like I'm being mean?
test-612188	I am getting 2324 rank in aiims 2016 ug in general category, and have percentile more than cutoff, will I be called for any counselling?
test-612189	If I get 400 rank in aiims general category then will I be called in 1st councelling or 2nd councelling?
test-612190	Which countries are allied with the US?
test-612191	What are the primary US allies?
test-612192	How do I prepare for the IELTS exam at home?
test-612193	How can I prepare for the IELTS exam for free?
test-612194	How do I forget someone I love very deeply and how do I get rid of one sided love?
test-612195	How do I forget the one you love the most?
test-612196	What is the difference between the green Superfeet insoles and the orange ones?
test-612197	How do you teach a toddler the difference between left and right shoes?
test-612198	What is the best way to do forex trading?
test-612199	What's the best way to learn about Forex Trading?
test-612200	What are the practical applications of deep reinforcement  learning? What are all the major areas/fields?
test-612201	How will majoring in physics help you to start a career in Deep Learning/AI?
test-612202	Where can I catch a Ninetales in Pokémon GO?
test-612203	Where do I catch a Vaporeon in Pokémon GO?
test-612204	How did the different types of haircut fades originate?
test-612205	Biomolecules class 12 notes?
test-612206	What is journal bearing?
test-612207	What is journal in bearings?
test-612208	How do single men who use surrogate mothers to become fathers feel about their choice?
test-612209	What is it feel like to be raised by a single father?
test-612210	What skills should you require to study master of science?
test-612211	Is it good to start learning about Node and MongoDB for the future?
test-612212	What are the best colleges in India to study Masters of defense studies?
test-612213	What are some of best colleges in India to study B.pharm? And how to get admission in it?
test-612214	Why does Facebook messenger say invite friend to install messenger when they already have it installed and have chatted with me before?
test-612215	What is the logic behind how Facebook Messenger lists out active friends?
test-612216	Why does Android eat up all my internal memory despite installing just a few apps?
test-612217	What is the best cricket game in play store?
test-612218	What is a apple?
test-612219	What is an apple?
test-612220	Which is the best exercise to cut-off tummy fat?
test-612221	What is the best exercise for belly fat?
test-612222	Does blocking someone from Instagram cause them to be deleted from your follow/unfollow after unblocking?
test-612223	If someone blocks me on Instagram would I still appear as following them?
test-612224	Why Hinduism is considerd to be the oldest religion?
test-612225	Despite such an old religion, why hinduism is still less popular and spread than Islam and Christianity?
test-612226	What are the best 3D architectural rendering companies in the world?
test-612227	Which is the best 3d product design and modeling company in the world?
test-612228	Where is the best honeymoon destination in April 2017?
test-612229	What are the best honeymoon destinations for 2015?
test-612230	What is the cut off for coep in 2016?
test-612231	What is the cut off for nift 2016?
test-612232	The cell division involves in gamete formation is not of the same type in different organisms?
test-612233	I touch my sister like rub her over her diaper, I was 15 and I'm a girl, was that abuse?
test-612234	What are the examples of improper nouns?
test-612235	What are examples of proper nouns?
test-612236	What is Volkswagen's mission statement and vision?
test-612237	Is Volkswagen Polo a good car to buy?
test-612238	Why did India not sign the Non-proliferation treaty?
test-612239	Has China signed non proliferation treaty?
test-612240	What are new business ideas?
test-612241	What are some of the new business ideas for a startup?
test-612242	Did you vote for Donald Trump? Why?
test-612243	Why did you specifically vote for Donald Trump?
test-612244	How long does a woman's orgasm usually last?
test-612245	What penis size do women prefer?
test-612246	How many hours do you read daily?
