test-314895	What are some social traits of people with lower IQs?
test-314896	What is my old password to google+?
test-314897	What is my old password on Facebook?
test-314898	Which is the best branch in engineering to choose after 12th for an average student?
test-314899	What Engineering branch should I choose?
test-314900	Which is the best movie of year 2016?
test-314901	Which one is the best movie in 2016?
test-314902	What is the income tax on a salary of Rs.4.5 LPA in india and how can i reduce it ?
test-314903	What is the income tax on a salary of Rs.10.25 lakhs per annum?
test-314904	How do I solve [math]87^{x−9} = 72^{x-6}[/math] using logarithms ?
test-314905	How to calculate 0.8^10 using logarithm table?
test-314906	What kind of projects do mechanical engineers work on in the oil and gas industry?
test-314907	What is the best project for an mechanical engineering for the oil and gas field?
test-314908	"My Amazon application status reads ""submitted; under review"". What does this mean, especially for the few applications that are more than a year old?"
test-314909	"What does ""considering"" status on job application mean?"
test-314910	Why do I feel sleepy while studying?
test-314911	How do I not feel sleepy while studying?
test-314912	What causes a car to have a low idle at a stop?
test-314913	What might cause excessive exhaust while idle?
test-314914	What are sites with arrangements of pop music for woodwind trio (fl, cl, bssn)?
test-314915	What is the difference between rock and pop?
test-314916	How can I get redeem code?
test-314917	How do I get redeem code number?
test-314918	What is the function of the urea cycle?
test-314919	What IUPAC name does UREA receive?
test-314920	Did my anxiety attack cause me to lose interest in my girlfriend?
test-314921	Am studying all the day for competitive exam..and having tense if I fail again.. how my friends and neighbours and family will react?
test-314922	Who/What are those famous people or places on the currency notes of your country?
test-314923	What is the best dirty joke you have heard?
test-314924	How many people are born/die every day in the world? What is birth to death ratio in the world?
test-314925	How many people die every day on Quora?
test-314926	What's a good TOEFL score? Asking for a friend who scored 102.
test-314927	Do universities in the UK ask SAT scores for admissions? Or TOEFL? Or both?
test-314928	Which program hack facebook account?
test-314929	What is the easiest way to hack Facebook account?
test-314930	Is it okay to go on a long run at 5am, if I had dinner at 11pm?
test-314931	Similarities between verbal &nonverbal communication?
test-314932	What is located in the nucleus of an atom? How does a nucleus of an atom function?
test-314933	How does one successfully use the briefcase technique in a job interview ?
test-314934	How do I regain confidence after failing my first exam?
test-314935	How do I get self confident after a successive fail in a quiz?
test-314936	Is quarry mining a profitable business to be in India (Karnataka)?
test-314937	Where do marine life get water from?
test-314938	What if I fly a helicopter and keep it steady at stratosphere in the space for say 12 hours. Will I be on the opposite side of the earth?
test-314939	If a helicopter hovers at its maximum height, does the earth rotate under it or does it rotate with the earth?
test-314940	What happens when I send a message WhatsApp to a contact who has deleted me?
test-314941	How can you determine a liar from an honest person?
test-314942	What makes Quora better than AskReddit?
test-314943	Is Quora better than AskReddit?
test-314944	What are the best laptops for programming, 3-D design, modeling, and big data projects?
test-314945	What is the best software for 3D modeling?
test-314946	What are some alkaline foods?
test-314947	What are acid and alkaline foods?
test-314948	Which is the best illegal way to earn money online?
test-314949	What are best illegal ways to make money online?
test-314950	Was this IPL 9 finale a setup?
test-314951	Was the IPL final fixed?
test-314952	What is the procedure to check your PF balance?
test-314953	What is another name for the balance sheet?
test-314954	I am getting Shaheed rajguru college of applied science Delhi college for studying BSc instrumentation. What is scope of this course?
test-314955	What are some Hollywood movies that are heartbreaking?
test-314956	If I struggle how can I get a 4.0 GPA in high school?
test-314957	How can I maintain a 4.0 GPA in high school?
test-314958	Which is the best phone to buy in India under 20000 right now?
test-314959	What is the best phone under ₹20,000 in India right now (2016)?
test-314960	Are there any flaws in the entire Harry Potter series?
test-314961	What are some flaws in the Harry Potter series?
test-314962	How can I concentrate more on my studies and career?
test-314963	How can I learn to concentrate on my studies when I cannot sit still for more than 1 hour 15 minutes at a time?
test-314964	Which is better for Android: Android Studio or Xamarin?
test-314965	Do apps made in Xamarin studio lack some features as compared to apps made in Android studio?
test-314966	How should one prepare for afcat exam in a short period of time?
test-314967	How do I prepare for AFCAT exam in short period of time?
test-314968	Who are some actors with hairy chests? How has the appeal of chest hair changed throughout history?
test-314969	What are the benefits of chest hair removal for a man?
test-314970	Is JECRC college a good college for Btech in CSE?
test-314971	Is JECRC University a good college for Btech in CSE?
test-314972	Does Iran support ISIS?
test-314973	What countries support ISIS?
test-314974	Can I mention url of my site while asking questions on Quora?
test-314975	Is it allowed to mention a URL in questions that I ask on Quora?
test-314976	Where can I get very affordable fire and security protection service in Sydney?
test-314977	Where can I get very useful fire protection services in Sydney?
test-314978	What's your favorite word; why?
test-314979	Words: What's your favorite word and why?
test-314980	With actual proof and sources, is Donald Trump a racist, bigot, xenophobe, and islamophob like the media says?
test-314981	What are some actual reasons why people think Donald Trump would be a bad president, not including his appearance/wealth?
test-314982	Why are colleges liberal?
test-314983	Why are most college students Liberal?
test-314984	What are some strengths and weaknesses of spiritualism?
test-314985	What is your strength and weaknesses?
test-314986	Which branch can I get in UPES Dehradun after scoring a 11416 rank with a tie of around 400 students at the same rank?
test-314987	Which branch can I get in UPES Dehradun with the rank 3964 in UPESEAT?
test-314988	Who built the Ajanta and Ellora caves?
test-314989	How much time it would have taken to carve a temple in stone like those in Ajanta and Ellora?
test-314990	What's the difference between love and like?
test-314991	What is the difference between liking and loving?
test-314992	"Why is ""Japan's Marine Day"" unknown in Grenada?"
test-314993	"Why is ""Japan's Marine Day"" unknown in Cyprus?"
test-314994	How has our understanding of quantum mechanics changed over the years?
test-314995	What are some applications of quantum physics in everyday life?
test-314996	How do I round off to the nearest 1000 in Excel?
test-314997	How do I switch axis in Microsoft Excel?
test-314998	What are some good internships in mechanical engineering for a sophomore in the IITian?
test-314999	Is it possible to play games on PC using Xbox 360 controller via play and charge kit? How do I connect it?
test-315000	What's the best gaming laptop under $700?
test-315001	What's the best gaming laptop under $2000?
test-315002	Which branch is more related to CSE: EEE or ECE?
test-315003	Which branch is the most logical of the three: CSE, EEE or ECE?
test-315004	How does Muslim or Christian think about Buddhist when s/he denies strongly the existence of God?
test-315005	What do I wear to a job interview at Rubios?
test-315006	What is life really like in Africa?
test-315007	Do grades (GPA) really matter to make it big?
test-315008	Are there any plugins for Woocommerce to determine sales tax?
test-315009	How are domain sales taxed?
test-315010	What are the health benefits of olive oil?
test-315011	Can you use olive oil instead of vegetable oil?
test-315012	What would happen if Britain was invaded by India?
test-315013	What would happen if Britain was invaded today?
test-315014	What are the types of railway tickets in Indian railways?
test-315015	Indian Railways: What are the chances of Tatkal waiting ticket to get confirmed (if it is only 10)?
test-315016	What's the best product to export to UAE?
test-315017	What is the best product to export to Dubai?
test-315018	How much cash is a person allowed to carry in an international flight?
test-315019	How much cash can you have on a US domestic flight?
test-315020	What are the best Hollywood movies?
test-315021	Which is latest best Hollywood movie?
test-315022	How much salary does a couple need to earn for an average/good lifestyle in mumbai?
test-315023	How much salary does a couple need to earn for an average/good lifestyle in Ahmedabad?
test-315024	How do you track a US priority mail package without a tracking number?
test-315025	What is an example of a UPS tracking number?
test-315026	Is it wrong to go and watch a movie alone?
test-315027	Is it alright to watch a movie alone in a theater?
test-315028	Why women don't have equal rights in Muslims religion?
test-315029	Why Muslims women have few rights compared to Muslim men?
test-315030	How many countries are there in world?
test-315031	What is the total number of countries in the world?
test-315032	Which is the best laptop I should buy under Rs.60000?
test-315033	Which laptop should I buy within 60000?
test-315034	If you could only eat one food for the rest of your life, what would be the most nutritionally balanced option?
test-315035	If you could only eat one meal for the rest of your life what would you choose?
test-315036	What is the growth path like for a business intelligence (BI) business analyst?
test-315037	Which has a better growth path: an IS manager or a business intelligence analyst?
test-315038	What is the calorific value of liquefied natural gas?
test-315039	What is the future of liquefied natural gas and natural gas?
test-315040	From where can I learn programming?
test-315041	What are the best websites to learn programming?
test-315042	How do I ask questions on Quora?
test-315043	What is a good way to ask questions on Quora?
test-315044	How do I tell if a guy from salsa class is attracted to me or just wants to dance?
test-315045	How can I tell if a guy is attracted to me?
test-315046	"What is the meaning of ""dichlorination""?"
test-315047	"What is the meaning of ""what's up""?"
test-315048	How can I share Google Photos album with selected people only?
test-315049	My girlfriend posted our holiday photos to her friends only. Should I make a separate photo album on my Facebook page?
test-315050	Which is the best coaching institute for the GATE?
test-315051	Which is the best gate coaching institute for CS-IT branch in India?
test-315052	What is Paris Hilton like in person?
test-315053	Is Paris Hilton single?
test-315054	What are some things new employees should know going into their first day at Lexington Realty?
test-315055	What are some things new employees should know going into their first day at Federal Realty?
test-315056	What is conclusion about demonetisation in India?
test-315057	What are the positive effects of demonetization?
test-315058	Should I charge my phone by computer using a USB or directly to the wall?
test-315059	How can I use USB light using OTG to Android phone?
test-315060	Most of the time I don't understand what I read in a college and university text books. How do I improve my understanding skills?
test-315061	Will I be able to understand the book- a brief history of time? (I have read just 1 astronomy book.)
test-315062	What is non-verbal communication sign language?
test-315063	What is non-verbal communication?
test-315064	Does re-publishing our content to other places like Medium, LinkedIn or other websites harm our SEO?
test-315065	Why are the bees dying in the United States?
test-315066	Where do I download GTA 5 PS3 image file so that I can play it using the PS3 emulator?
test-315067	How do I download GTA 5, the PS3 version, for playing on a PC using a PS3 emulator?
test-315068	Who are some alumni from BESU doing quality research in India/Abroad?
test-315069	What is the kind of research that has been done on traffic and its impact in India or abroad?
test-315070	What are some good excuses to get out of doing something?
test-315071	When you have something that takes you out of life, how do you get back to normal?
test-315072	How does one meditate?
test-315073	How do you start a meditation habit?
test-315074	What happens when you clear chats? Will the senders receive any notification about their messages being deleted?
test-315075	How do I know who turned on notifications on a post in Facebook?
test-315076	What is a good conversion rate for a website?
test-315077	What is a good conversion rate for a blog?
test-315078	I guess my bro has sexual feelings for me.He even grabbed my breast.Does anyone have experienced this?How should I take care of it?
test-315079	How come I feel like no one cares for me, not even my parents?
test-315080	What is the difference between polygamy and bigamy?
test-315081	Do you agree with practicing bigamy and polygamy? Why or why not?
test-315082	What are some ways to bypass YouTube's copyright infringement rule from taking down your videos?
test-315083	If a YouTube video is taken down for copyright, will you still get paid for monetization?
test-315084	Do the British like Chinese American Food?
test-315085	How high of an ACT score is required for an Indian student to get a scholarship?
test-315086	Which is better CSE at NIT Surat or NIT Durgapur or NIT Jaipur?
test-315087	Which is better: CSE in NIT, Durgapur or metallurgy in NIT, Warangal?
test-315088	Can blood deprivation cause brain damage?
test-315089	What causes brain damage?
test-315090	When can one expect the new Nvidia GTX 1080 graphics card to be available on Newegg?
test-315091	When can one expect the new Nvidia GTX 1080 graphics card to be available for purchase on New Egg?
test-315092	Are we potentially born with all the emotional qualities to love someone and something or is it what and how we live that teaches us to love?
test-315093	How does Forrest Gump represent or reinforce the idea that we are all part of something bigger?
test-315094	Which is the best book for advanced control systems?
test-315095	What is the simplest book for studying control systems?
test-315096	Where can I get high quality weed near Ghaziabad or Delhi?
test-315097	Where can I find some quality weed in Ghaziabad?
test-315098	Why are toilet seats for businesses u-shaped (with a cutout in the front) and toilet seats for homes are round or oval with no cutout in front?
test-315099	"What is the informal meaning of ""put the toilet seat down""?"
test-315100	Why did Britain/the Allies lose Singapore to the Japanese in WW2?
test-315101	Could Germany have won World War II if they did not attack the Soviet Union?
test-315102	Is wealth inequality in U.K getting better or worse from 2000 to 2016?
test-315103	Is wealth /income inequality in UK getting better or worse from 2000 to 2016?
test-315104	Will I be receiving a physical copy of the Aadhar card after the address change is updated online? How long does it take to receive? What is the procedure?
test-315105	How many times you can update address in aadhar?
test-315106	Will it cause any harm for my future pregnancy?
test-315107	I keep popping my fingers, toes and even my spine. Is it bad to do so? Will it harm my health in the future?
test-315108	Why does $500 trillion rich Rothschilds are not on Forbes richest people list?
test-315109	Why are the Arabs not on the richest persons list if they are so rich?
test-315110	What are polyuria, polydipsia and polyphagia? How are they related to diabetes?
test-315111	How are diabetes and pancreatitis related?
test-315112	WhatsApp: How do I start a worldwide friendship group on WhatsApp?
test-315113	What is the best way to crash a WhatsApp group?
test-315114	What would be the impact of Brexit on India?
test-315115	What are the effects of 'Brexit' on India?
test-315116	How do prokaryotic and eukaryotic cells differ?
test-315117	How do eukaryotic and prokaryotic organisms differ?
test-315118	What 2+2 sports cars can be bought used under $25,000?
test-315119	What 2+2 Sports cars with side vents are being sold for under $20,000?
test-315120	What is a Forex Trading?
test-315121	What is online Forex trading?
test-315122	What do the different colors of lights in an Ethernet port mean?
test-315123	How is the WAN/Internet port different than the rest of Ethernets in a router?
test-315124	Why can't they just release Fifty Shades of Grey in India?
test-315125	When is Fifty Shades of Grey releasing in India?
test-315126	What is better, Core i3 with a 8GB RAM or Core i5 with a 4GB RAM?
test-315127	Which is better, 5 GB RAM with core i3 or 2 GB RAM with i5 processor for Android studio?
test-315128	What is unusual or different about the food and cuisine in China?
test-315129	What is unusual or different about the food and cuisine in Pakistan?
test-315130	What's the best way to know what other people really think of you?
test-315131	What are the best ways of knowing what others think of you?
test-315132	How do I make my boss appreciate me and recognise my work as an employee?
test-315133	How do I get recognised at work?
test-315134	What mobile credit card payment systems are available in Australia?
test-315135	How can I apply for a credit card in Australia?
test-315136	Should I learn the Hebrew cursive or printed alphabet first?
test-315137	How do I ask in Hebrew “do you speak Hebrew”?
test-315138	Which is better as a developer career, .NET or PHP?
test-315139	Which is better as a development career: PowerBuilder or .NET?
test-315140	What is the difference between a hen and a chicken?
test-315141	What is the difference between a monkey?
test-315142	How can I encourage myself to workout everyday?
test-315143	Should one workout everyday?
test-315144	How do I get rid of my addiction to Facebook?
test-315145	How do I get over my addiction to Facebook and WhatsApp?
test-315146	Where are Poké Stops in amritsar?
test-315147	Where can I find poke stops in Panna, M.P.?
test-315148	What does it mean when a girl always text but never calls?
test-315149	If you're texting a girl you like and she calls you dude/homie/bro, does that mean she only sees you as a friend?
test-315150	Can I use Machine Learning algorithm to rank search result when using ElasticSearch?
test-315151	How machine learning algorithm can be used for network security in absence of threat data?
test-315152	What is the difference between a psychopath and a narcissitic psychopath?
test-315153	What's the difference between a psychopath and a sociopath?
test-315154	What's the meaning of integrity project in schools?
test-315155	What Actually developing of project objectives means in project management?
test-315156	What is a basic SQL injection?
test-315157	Wat is SQL injection?
test-315158	Is Angelholm a good commuter town to live in if working in Malmo?
test-315159	Is Hassleholm a good commuter town to live in if working in Malmo?
test-315160	Who is the best striker overall Suarez or Ibrahimovic?
test-315161	Who is the best Striker in 2015?
test-315162	Why use Quora when we can find all answers through Google?
test-315163	What are the advantages of using Quora over Google?
test-315164	Is it bad that I want to have sex with my daughter?
test-315165	My 16-year-old daughter wants to get an auricle piercing. Is this a sign of trashiness, and bad morality? Should I let her do this?
test-315166	How can i find foreign buyers for exports?
test-315167	How do I find foreign buyers from india to sell my product globally?
test-315168	Any doctors here can diagnose my condition? (CBC results included)
test-315169	How is tetanus diagnosed?
test-315170	What is more important, knowledge or marks?
test-315171	What is more important while answering on Quora? Knowledge or Confidence (right or wrong) of knowledge of the answer? And why?
test-315172	I'm gender fluid and only like girls. What is my sexual orientation?
test-315173	Gender: What is it like to be genderfluid?
test-315174	Why have you opted out of Quora?
test-315175	Is there a way we can opt out of Quora?
test-315176	What do you call vector multiplication where each component of one vector is multiplied by each component of another vector?
test-315177	Can the components of a vector also be a vectors?
test-315178	Why is it that house flies land repeatedly in almost exactly the same place on one's body and even after being shooed away seem able, and determined, to land exactly where they were before?
test-315179	Why do non-biting house flies land on me? What do they want?
test-315180	How do you find what you love?
test-315181	How can I find my passion in life?
test-315182	Where can I get complete residential locksmith services in Sydney?
test-315183	Where can I get a full range of locksmith services at Sydney CBD?
test-315184	Is romantic love without sex (or lust) possible?
test-315185	How do you know if you're in love?
test-315186	What are the consequences of lodging a FIR (First Information Report) in India?
test-315187	If an FIR is lodged in India in a police station, then does that FIR automatically get uploaded on a website?
test-315188	What are the effects of demonetization in Kerala?
test-315189	What is the effect of demonetization on property in Mansarovar, Jaipur?
test-315190	What are the simplest, easiest ways to lose more weight?
test-315191	Which are the best ways to lose weight?
test-315192	What will happen if I use petrol in diesel engine or diesel in petrol engine?
test-315193	What will happen if diesel is used in petrol engine?
test-315194	How can I get more upvotes on my Quora answers?
test-315195	How do you vote anonymously on Quora?
test-315196	When I ask a question on Quora, I am limited to a relatively short number of characters. How do some people write a paragraph after their question?
test-315197	How can some people write such long question details on Quora, while I have word limitations?
test-315198	What percentage of deer hunters have harvested at least one Boone and Crockett buck in their lifetime?
test-315199	What are things people should do at least once in their life?
test-315200	Who is the Creator?
test-315201	Who is the creator of the Earth?
test-315202	What topics are taught in mechanical engineering?
test-315203	What are important mechanical engineering topics?
test-315204	What are your seven wonders of the world?
test-315205	What are the 7 wonders of the world?
test-315206	What do the terms 'Crores' and 'Lakhs' in Indian English stand for?
test-315207	Why can't PM Modi speak in English at least in international forums like the BRICS?
test-315208	"Can you comment upon the fact ""JUSTICE DELAYED IS JUSTICE DENIED""?"
test-315209	What are Swisher Sweets papers made of?
test-315210	Are wholesale computer markets really cheap?
test-315211	The account format that displays debits, credits, balances, and headings?
test-315212	How soon can you retreat a cat for worms?
test-315213	How soon can I retreat my cat for fleas? Why?
test-315214	How do you fix an iPhone that won't charge?
test-315215	How do I fix a phone that won't charge properly?
test-315216	What were Martin Luther King, Jr. contributions?
test-315217	What are some mind-blowing facts about Martin Luther King Jr?
test-315218	What Is that action most batsman do when they come to crease like they show 2 or 3 and ask something to someone in cricket?
test-315219	Why do some batsman duck to a yorker in cricket?
test-315220	What would happen if a car made of diamonds drove really fast into a wall made of diamond?
test-315221	Diamonds: What happened to dodaq?
test-315222	"Why all ""Enduro"" cycling jerseys dont have a full frontal zipper or backpockets?"
test-315223	What is the best kind of soccer jersey?
test-315224	Why do some developers use and like Grunt?
test-315225	"Why do developers use weird names for products such as ""bower"", ""gulp"", ""grunt"" or ""yodoctor""? What's the story behind these names?"
test-315226	There were two biggest commandments in the Bible（Luke 10：27） How could I do to reach to the two commandents?
test-315227	What did God have in mind when he gave Moses the tenth commandment for the people? Why was this commandment important for Israel?
test-315228	What's the best way to write a research paper?
test-315229	What is the best way to read scientific papers?
test-315230	Is it possible to find out a freight train schedule?
test-315231	Do freight trains have schedules?
test-315232	What is the best career for a non medical student?
test-315233	What are the best non medical careers for a medical student?
test-315234	What are the best books to prepare for NTSE?
test-315235	Which is the best book for ntse?
test-315236	Can any one tell me the truth behind the area 51?
test-315237	What's really happening in Area 51?
test-315238	What are some adjectives describing teachers?
test-315239	What are adjectives to describe earth?
test-315240	If a non-alpine rock climber switches to alpine rock climbing, will the climber have to adjust or is it the same thing except on a mountain?
test-315241	How is alpine rock climbing different from non-alpine rock climbing?
test-315242	Where can I sell an old Indian rupee note to get a higher value for it?
