362806	Why am I so emotion less ?
362807	Why am I so emotionally disturbed ?
362808	I'm attempting the CA final with zero knowledge in 2 months . Is it possible to pass ?
362809	Do you think hiding in your safe space will dam you one day ?
362810	How were utensils invented ?
362811	What are some major differences between Java 7 and 8 ?
362812	I am strong as a rock , but one word can destroy me , what am I ?
362813	`` How would you tell'' `` do not disturb'''' in one word ?''
362814	How do I debug VBA code ?
362815	How much do strippers make at Scores ?
362816	How much do strippers make ?
362817	Who runs the Irish Mob in 2016 ?
362818	What are some good Irish songs ?
362819	Are you going to think in a foreign language if you live there long enough ?
362820	Language Learning : Is it enough to understand only English as foreign language nowadays ? Why ?
362821	Is it true women don't like short men ? How do they feel about them ?
362822	How is Flipkart's firing rate in Bangalore ?
362823	What are some examples of monopolies in India ?
362824	What are some examples of a monopoly ?
362825	Is there going to be a Quora meetup in Allahabad anytime soon ?
362826	Is there going to be a Quora meetup in Bangalore anytime soon ?
362827	What kind of financial support can I get if I want to do an MS in Germany as an international student ?
362828	Can I get into UC Berkeley if I am an international student and need financial aid ?
362829	What causes fatigue headache sore throat ? How is it treated ?
362830	The MS Excel's insert column option is disabled , after right clicking . I have tried using Excel options , but it's not working . How do I enable it ?
362831	Why is Buddhism not the most popular religion in India ?
362832	Who is the most popular journalist in India ?
362833	Is Xiaomi Redmi Note 3 rooted ?
362834	Are security Patches done on your servers as they become avaiable ?
362835	If things got bad enough for him , would Mike Pence resign as the R VP candidate ?
362836	Is police brutality a general overall problem in the United States , or an isolated problem of a few bad seeds ?
362837	What have majority White Congressman did so far to address the problem of Police brutality against black ? Is there any debate held in the Congress
362838	Do you believe that you have an adequate remedy at law or in equity if your injured by the federal government or state government ?
362839	Does HTC 816 support reliance jio ?
362840	What is the difference between cardio , strength training and HIIT exercises ?
362841	Is it healthy to combine Strength training with HIIT cardio ?
362842	What was Bilbo's birthday speech in the book The Lord of the Rings by J. R. R. Tolkien ?
362843	Which is more important , Press Release or Social Media ?
362844	If you need help in binary on how to trade and strategy or lost funds feel free to contact via Google mail @ laurettaelmer216 ?
362845	Why is the US debt in dollars greater than the number of stars in the galaxy ?
362846	Biogenic XR - Does penis Enlargement Work ?
362847	How can I give up my addictions and get a good job ?
362848	What is the historical relationship of jallikattu and Tamilnadu ?
362849	What are some very creepy historical events ?
362850	Which Neko Atsume remodel should I get ?
362851	What are some of your favourite cartoon/comic strips ?
362852	I am joining family business as an accountant and have done B.com . What knowledge or training should I have with me ?
362853	Why is it easier to wash dirty dishes when we soak them overnight ?
362854	Is there any harm in not rinsing dish soap off when washing up ?
362855	What gets you upset about being a leader ?
362856	My boyfriend gets upset when I tell him that I feel a certain way about our relationship . What do I do ?
362857	How much Oxygen does an average person need in a year to live ?
362858	How can I run a program (HTML5 game) on Github ?
362859	What is the definition of potential ?
362860	Why didn't Edmure Tully just command the Freys to let Rob Stark's army pass through since House Frey is a vassal of House Tully ?
362861	What are the best mobile advertising APIs ?
362862	What are all the different career paths that a Linux administrator can take ?
362863	Is it better to struggle and fail than to succeed with ease ?
362864	Do products like Cogniq work ?
362865	Does CogniQ work ?
362866	How do I become a programmer when I don't know anything about programing ?
362867	How do I get a placement in HP as a B.Tech engineer in the electronics branch ?
362868	Which branch will I get with a 2600 rank in BVP CET for B.Tech ?
362869	I don't believe in God . Why ?
362870	I find a man's life easy and my life , as a woman , complicated , any solutions to break this pattern of beliefs ?
362871	How do I get a Android Junior developer job in America ? I have experience but I'm not from the USA .
362872	What are common problems faced by women who marry geeks or nerds ?
362873	What are the common problems a newly married girl faces ?
362874	Is the movie Philadelphia with Tom Hanks based on a true story ?
362875	Why do Kannadigas believe they are being treated unfairly in the Cauvery issue ?
362876	Why do south Indians have bad English accents ? I know it's an unfair generalization . However , I tend to believe that majority of south Indians have not-so-good English accent except Kannadigas . Is there any linguistic reason behind this ?
362877	Why is my dog biting me ?
362878	`` What is the best budget smartphone by an'' `` Indian Company'''' ?''
362879	What is the best non-Chinese budget smartphone ?
362880	Is there a way to copy pages (folder structure intact) between open CS6 Fireworks files ?
362881	How do I change the grid size in Adobe Fireworks CS4 ?
362882	What skills are the most valuable on selling ?
362883	How does one know it's a friends with benefits relationship ?
362884	When does the value of a painting go down ?
362885	Does the value of a plastic model go up or down after it has been assembled and painted ?
362886	What will future energy look like ?
362887	What is future of energy ?
362888	How can I buy an unlocked iPhone 5 in the US ?
362889	What did Arnold H. Glasow accomplish in his lifetime ?
362890	How many books has Igor Markov read in his lifetime ?
362891	What are the best poses for selfies for guys ?
362892	What are the best selfies of a daughter with her father ?
362893	What is the best way to learn electronics for a computer engineer ?
362894	What is the best way to learn the basics of electronics ?
362895	I am very interested in electronics and I want to become an entrepreneur and I want to learn electronics deeply from my heart ?
362896	How can the evaluation process influence in a theory ?
362897	Have you ever crossed borders between left hand drive and right hand drive on road ? Is it even possible to cross these borders in an vehicle ?
362898	What was different between a British WW1 soldier and a WW2 one in terms of uniform , equipment and training ?
362899	Who is a famous Australian soldier who served in WW1 ?
362900	I can't log in to my Instagram account on my phone , but I can on my computer's web browser . On my phone it says that my account is disabled , but clearly it isn't . What can I do ?
362901	Why does my jaw pain cause a headache ?
362902	What causes headaches and a dry throat ?
362903	My girlfriend says she misses her ex . It bothers me a lot , and last night she even told me I should leave her . What should I do ?
362904	What are the most interesting products and innovations that Boston Scientific is coming out with in 2016 ?
362905	What's changed in your life after releasing a successful app ?
362906	Which colour should I buy for the Samsung Galaxy S7 edge ?
362907	Should I buy Samsung Galaxy S6 edge or S7 (NOT edge) ?
362908	I got two dogs , how do I house train them ?
362909	How do I write code ?
362910	How do I write code for apps ?
362911	What is average cost per couple to travel Bhutan from AHMEDABAD ?
362912	What are my chances of getting into an Ivy ?
362913	What are the most interesting science and technology Youtube channels ?
362914	Which TV series did you grow up watching ?
362915	How do modern day nomads get their food ?
362916	How do the Navajo get food ?
362917	What desserts go with pizza ?
362918	Where did Pizza Hut go from Powai ?
362919	How can one get a job in big MNCs in India and what is the future opportunity in foreign countries for MBA marketing freshers ?
362920	How big is the Indian fresher sales job market size ?
362921	Should you list hackathon achievements on your resume if you are no longer a recent graduate , but are moving from another industry into tech seeking an entry level software engineering role ?
362922	What can be the ideal time for applying to entry level software engineering jobs if I plan to graduate in May 2017 ?
362923	Why do some cats have webbed toes ?
362924	What is the best way to die without suffering ?
362925	What painters are similar to Bob Ross ?
362926	How do I stop my email from appearing in my junk mail ?
362927	How do animal cells make energy ?
362928	How are plant cells able to make energy ?
362929	What is the procedure followed by the Indian Railway for giving stoppage at a station ?
362930	What would it have been like to visit New York in the 1950s ?
362931	What would it have been like to visit London in the 1950s ?
362932	Is it possible to use the enrollment slip of the Aadhar card as an ID proof in the airport ?
362933	Can Adhaar card be used as ID proof and ADRESS Proof in ACCENTURE Bangalore ?
362934	How safe is it to travel to Dominican Republic ?
362935	How safe is Dominican Republic ?
362936	Is Stevie Wonder married ?
362937	Is Elizabeth Holmes married ?
362938	How do I solve cubic ecuations if I am only allowed to use windows calculator and a piece of paper ?
362939	Let A be real symmetric matrix of order 3 with eigenvalues 1,2,2 . Vectors corresponding to 2 are (-1,1,0) & (-1,0,1) . What is answer to the question ?
362940	How do I write a two minute speech on mystery ?
362941	Can you write a two minute speech on Christopher Nolan highlighting his greatness ?
362942	What is the corporate culture like at Minerals Technologies ? How is the culture different than other companies ?
362943	How can I prepare for the UPSC exam ?
362944	Is it possible that the entire universe could be a super-nano/miniaturization technology based in a laboratory of an highly advanced specie ?
362945	Did anyone ever try to engineer a new species of organism from an existing species in a laboratory applying controlled natural selection pressure ? If so , what is the new species called ? Did they get the Nobel Prize for it ?
362946	What is weight loss hypnosis program ?
362947	Research : What are the topics in which currently groundbreaking research going on ?
362948	Research : What are some of the research areas/topics/problems that Prof. Ben Y. Zhao is currently working on ?
362949	Which is the best custom rom for coolpad note 3 lite ?
362950	If a married couple both get arrested and sent to prison , will they ever get to see each other before they are released ?
362951	What are the best pictures that showcase Politics ?
362952	What are the best pictures that showcase the earth ?
362953	Why would you need an excuse letter for school ? Who do you get it from ?
362954	Why is everything impermanent ?
362955	Is there anything that is not impermanent ?
362956	Does the subject of authentic leadership is trending know for a PHD ?
362957	My face looks very thin . To get some flesh , I started eating more food . Now my hips , buttocks , and thighs are getting fat . How can I avoid this ?
362958	Do these symptoms indicate sesamoiditis ?
362959	What do you know about Multi story composite agriculture habitat designs for transitioning urban areas to post oil age ?
362960	What are the best activities to do with children when visiting Chardzhou , Turkmenistan ?
362961	`` Does the sentence'' `` I don't want to get myself too much emotionally involved in this relationship'''' make sense in English ?''
362962	Can I get pregnant 5 days before ovulation ? Why or why not ?
362963	How can we get permanent residency in Poland ?
362964	What are the main differences between theoretical and actual yield and how are they calculated ?
362965	Is muscle atrophy from years of inactivity reversible with exercise and weight training ?
362966	What are some weight and training exercises that are safe for women suffering from postpartum muscle separation ?
362967	What turns you on sexually as a woman or girl ?
362968	What should be my individual subject scores in NEET 2017 ?
362969	Is Intel Xeon CISC or RISC based processor ?
362970	How does `` the black sharpie challenge'' work ?
362971	What is the most challenging part of your work and how do you deal with it ?
362972	Why doesn't the mainstream media report anything about Myanmar killing Muslim people in their country ?
362973	Why do Muslim extremists believe killing innocent people in Western countries will improve their own situations in their own countries ?
362974	How long does a cop have to pull you over after clocking you for speeding ?
362975	If you videotape a cop when being pulled over can he legally tell you to turn the camera off ?
362976	What are some easy non-programming jobs you can get as a Computer Science graduate and without work experience ?
362977	I'm a computer science and engineering graduated student . I have a little knowledge of Java programming . How can I get a job in the city of Bangalore ?
362978	What attracts some young women to date old men ?
362979	`` What does'' `` danza kuduro'''' mean in English ?''
362980	`` What does'' `` bon appétit'''' mean in English ?''
362981	What are the benefits of having a fan page over a Facebook page ?
362982	How immediately come frog in rainy day ?
362983	Is Quora Turing-Complete ?
362984	Am I Turing complete ?
362985	Among all the actors who have played Batman on screen , who is the best Batman of all ?
362986	I have got 7.4 CGPA in Class 9th SA1 . Can I get overall 10 CGPA in Class 9 ?
362987	I have got 9.8 CGPA in Class X SA1 . Can I get overall 10 CGPA in Class X ?
362988	PM Modi has abolished 500 and 1000 Rs notes to check black money . Is it a sign that Modi is the best and the greatest Prime Minister India till now ?
362989	Internet Advertising : Are there equivalents of the US Ad Council in other countries or regions for national and international NGOs ?
362990	What is the best thing you have done for your country ?
362991	Why does Britain not always have snow ?
362992	Why does America have brilliant extreme snow storms compared to Britain ?
362993	Can I ever stop emotionally abusing myself ?
362994	Could my diagnosis of schizophrenic paranoia really be just a deep anxiety ?
362995	How does social media affect our lives ?
362996	How can social media change our lives ?
362997	How do you teach your dog new tricks ?
362998	Can being bullied or having less sleep cause social anxiety ?
362999	What causes social anxiety ?
363000	What are the most intellectually stimulating TV series ?
363001	Is Quora a good stimulant of intellectual activity ?
363002	How do I make my hair straight naturally ?
363003	`` What should I do if my Windows 8.1 computer is stuck on the'' `` we couldn't complete the updates'''' screen ?''
363004	What's the best blogging platform for a freelance writer - Tumblr , Blogger , Or WordPress ?
363005	What is stenography ?
363006	What is stenography exam ?
363007	Were Events like the Plaque , world wars , etc. population equalizers ? Also can global warming be considered a population equalizer too ?
363008	Was World War 2 a fake to boost the economies of countries , and also to boost industries in less populated areas ?
363009	What types of expenses are appropriately included in demobilization costs ?
363010	What are the types of estoppels under law ?
363011	How should I crack a National Talent Search Examination at stage 1 ?
363012	What do U.S. presidents typically do after their two terms are over ?
363013	I got 35 marks in the JEE and 75 in the boards . I'm in the Gujrati quota . Will I get a CS in KJ Somaiya ?
363014	I got 35 marks in the JEE and 75 in boards . I'm in Gujrati quota . Will I get CS in KJ Somaiya , Mumbai ?
363015	What are the top three SEO strategies ?
363016	What sort of pets do possums make ?
363017	Would a rescued possum make a good pet ?
363018	How do Punnett squares work ?
363019	What is the best site for downloading Kannada films in torrent form ?
363020	What does it mean when I dream about somebody dying ?
363021	Why are there much fewer male actors compared to female actresses in the Japanese Adult Video (JAV) industry ?
363022	What is it like to take CS 229 (Machine Learning) at Stanford ?
363023	Is the class CS 229T at Stanford useful to take ?
363024	I am still preparing for my GRE exam . If I give my exam by the end of August , will I be able to take an admission in this Fall 2015 ?
363025	What Bible app can be used without an internet connection ?
363026	Is it possible to watch a movie on an ipad without internet connection ?
363027	What is difference between Infp-T and Infp-A ?
363028	How loyal are INFPs ?
363029	Is a sleep a source of energy ?
363030	What books should I read for CCNA ?
363031	Which of these sentences are grammatically correct ?
363032	What is Crisco made of ?
363033	How is paprika made ?
363034	What is it like to have a parent with depression ?
363035	Iphone - why , update UI always on Main Thread ?
363036	How do I implement a card UI in iOS ?
363037	Will Barack Obama be remembered as one of the all-time best Presidents of the United States of America ?
363038	I am a 21 year old man how can I become a billionaire within the next decade ?
363039	How can CA work in Australia ?
363040	How is it working a part time job in Australia ?
363041	What are big brothers good for ?
363042	What do you think about Russia ?
363043	Will gaining muscle mess up my tattoo ?
363044	How can I gain muscles fast ?
363045	How do I move Apps to SdCard in Micromax P702 4G Tablet ?
363046	Can we move apps in SD Card Micromax Spark 2 Plus ?
363047	How do I identify infinitives , past tense , and past participle ?
363048	Why Indian writers mix love stories even in good science fiction books like 2024 Man on Mars , a great science fiction but mix with love story ?
363049	Is there anything we can do to stop the killings in Aleppo ?
363050	Is there any need to join class for spoken English ?
363051	What is the evolutionary significance of socialism and how has it changed modern society ?
363052	What's the difference between deep web and shadow web ?
363053	What is a good salary for expats working in Lagos , Nigeria ?
363054	Is working in Oil & Gas industry for an expat (say from India) in an African Country is dangerous (say Nigeria) ?
363055	How can we make a variable capacitor ?
363056	How to make size of super-capacitor small ?
363057	If everybody started driving electric cars powered by lithium-ion batteries , how long until we ran out of lithium ?
363058	Where can I buy lithium ion batteries for power bank ?
363059	Is there any good reason to eat milk chocolate bar ?
363060	How do I inform my comrades that I have changed my moral standards ?
363061	What is the most important thing that a person should have ?
363062	What's the most important thing in the personality of a boyfriend ?
363063	Is Shifu Shaurya Bharadwaj a serving or a retired army officer ? Which division or troops he is or was associated with and what was the last rank ?
363064	I feel person named Shifuji Shaurya Bharadwaj is trying to illegally relate himself with Indian army . Is he just a cheap opportunist ?
363065	What are some life hacks in the USA ?
363066	What is life hacking all about ?
363067	What are some good tips for maintaining my bike Apache RTR 160 ?
363068	Which bike is better , the Bajaj Pulsar 200NS or the TVS Apache RTR 180 ABS ? Why ?
363069	Can you develop a decent competency in distributed systems by your own on your laptop or do you need a a real distributed infrastructure to play with ?
363070	What calculus book should i use in a undergraduate physics course ?
363071	What is the current in the resistor if I add two voltage sources in parallel of the same voltage instead of one ?
363072	In network theory , we come across a concept that a voltage source in a series with a resistor can be replaced by a current source in parallel with the same resistor . Where can we find a current source ?
363073	What are the advantages of not being a competitive person ?
363074	Is being competitive a flaw ?
363075	What is this insect that I found in my house ?
363076	What is this insect found in the Peloponnese , Greece ?
363077	What are some cultural faux pas among farmers ?
363078	Can I work in the US on a student visa ?
363079	Mamta Banerjee saw Modi as CM , and now PM , is it this reason she is jealous and frustrated ?
363080	What are the advantages and disadvantages of airships versus airplanes ?
363081	How do airships control altitude ?
363082	What is your quarter life crisis story ?
363083	What does Quarter Life Crisis teach ?
363084	How do I contact malls and retail stores such as Zara , H&M , Uniqlo for a solution that can help them get more customers and sales ?
363085	How is cloud and mobile POS evolving to offer a more integrated solutions for merchants and retailers ?
363086	What are some real accounts of atheists converting to Islam ?
363087	Why and when we should use differentiation ?
363088	Why we use differential ?
363089	Why do people think T-Mobile is bad ?
363090	How is T-mobile coverage in Boulder CO ?
363091	Do duck eggs taste different from chicken eggs if so why ?
363092	What does thaachuko/thaachi mean in Tamil ?
363093	`` What is the etymology/word origin of the Tamil word'' `` Tamil'''' ?''
363094	How can I share my Facebook page on my TV ?
363095	How do I setup DC + + on a proxy server ?
363096	Why is circular reasoning a logical fallacy ?
363097	Is this an example of a circular reasoning fallacy ?
363098	Is muscular dystrophy considered a neurological disorder ?
363099	Get Jio sim is not coming in my redmi note 3 , How can i get it ?
363100	What is the most interesting movie ?
363101	Is it possible to create a solar energy generating system that operates continuously 24/7 ?
363102	What does a 7.5 kva solar system comprise of ?
363103	What blog should I start ? How do I start blogging ?
363104	Why do you think that I should start blogging ?
363105	What font is used in the Luke Cage title sequence ?
363106	What font is used in Kickstarter logo ?
363107	What is the maximum number of devices that can be concurrently watched on Netflix ?
363108	If someone blocks me on Snapchat how does it appear in my messages ?
363109	`` In what contemporary movies do the'' `` bad guys'''' (antagonists) ultimately win ?''
363110	Do animals fight wars and if so what was the largest war ?
363111	Is Attack on Titan more of a horror anime or a drama ?
363112	How come my Samsung Galaxy Tab S2 8.0 / a. 8.0 does not have a fingerprint sensor even though the box says it does ?
363113	Where are the best places to approach girls where it's less awkward ? Both On campus and off campus are fine
363114	Is it possible for Bluetooth 4.0 device to connect with Bluetooth 2.0 ?
363115	What is the corporate culture like at Abraxas Petroleum ? How is the culture different than other companies ?
363116	Is it okay for a girl to watch porn ?
363117	What are some lesser-known sights to see when visiting Holguin , Cuba ?
363118	What are some lesser-known sights to see when visiting Camagüey , Cuba ?
363119	Is it possible to be genetically immune to the effects of caffeine ?
363120	Is it possible to become immune to the effects of caffeine ?
363121	Which are the best company secretaries institute in Bangalore ?
363122	Which is the best company secretaries institute in bangalore ?
363123	How can I prepare for the AP French course ?
363124	Can I stay for another year in high school to do AP courses ?
363125	Do you enjoy paying your income tax ?
363126	Do I have to pay income tax ?
363127	What are the major algo trading/HFT companies in India ?
363128	`` What is'' `` algo trading'''' ?''
363129	What should it cost to fix a 1 foot key scratch on a car door ? It is far from the other panels so should not cause blending issues .
363130	Is it easier to get away from the police on foot or by car ?
363131	What is the difference in responsibilities between CEO , president and chairman ?
363132	What is it like to realize that you are asexual ?
363133	What is it like to be a married asexual/asexual in a committed relationship ?
363134	What are some fruits that start with a b ?
363135	What fruits start with d ?
363136	If I deactivate my WhatsApp account and then reactivate it later , will my contacts still be able to see me in their WhatsApp's contact list ?
363137	Are eggs good for health or not ?
363138	Why are scrambled eggs good for you and what benefits do they provide ?
363139	How do I create a linkedin profile ?
363140	What is the maximum altitude for a drone ?
363141	What PageRank is good ?
363142	What is PageRank ?
363143	How is carbon dioxide used by humans ?
363144	Was Nawazuddin Siddiqui really high during some scenes of Ganges of Wasseypur-2 ?
363145	Did nawazuddin siddiqui actually smoked marijuana in gangs of wasseypur ?
363146	`` Why is the Newspaper'' `` The Hindu'''' is biased against'' `` Hindus'''' in general ?''
363147	What is Maidentales.com ?
363148	When people hurt me again and again , should I forgive them and continue being their friend ?
363149	Why don't third party candidates have a realistic chance in U.S. Presidential elections ?
363150	What food have serotonin in it ?
363151	What are natural ways I can increase serotonin levels ?
363152	What do you view as the difference between Liberal and Progressive ?
