403316	What happens when you fall in love with someone in a short amount of time?
278960	What are the products of combustion reaction?
278961	What is the product of the reaction of cumene with KMno4? How do I predict the product?
94379	How many times can an examination for discover hearing in Canadian civil court be postponed by the defendant?
112014	Is it considered civil rights violation if a lawyer intentionally lies to clients about their case and the case is damaged by the lie?
353828	Chi-squared kernel gives a valid gram matrix for any non-negative features. So can it also be used for non-histogram features given they are non-negative, if the obtained performance is good?
277590	How do I build a complex matrix of features using scikit-learn?
443145	What is the New 52 Superman?
443146	Who would win if New 52 Superman and She Hulk fought?
478408	Am I pregnant or not?
3224	"What is the word for ""luck"" in Japanese?"
3225	What does Mr. Moon say in Japanese in Sing (movie)?
447391	Does the Bible still have an effect on English literature?
487733	How often are Caltrain tickets checked?
487734	Why don't they check tickets on Caltrain often?
95602	If psychopaths and sociopaths don't experience emotions, how do they enjoy life? What, do they do for, fun? List things they do?
363726	I'm 35 years old with $100,000 in savings. What's the best way to invest it?
363727	I'm 33 years old and recently hit my goal of saving $100,000. Rather than leave it in my savings account, what would be a good course of action?
460813	What are Moroccans like, and how does their culture compare to Ethiopia's?
462572	What does the USC look for in the student's application for its computer science graduate program?
462573	What does Caltech look for in a student's application to its computer science graduate program?
393030	What does the check mark on Facebook messenger mean?
45291	Why is karma called a bitch?
45292	Is Karma a bitch?
239615	What is the main purpose of a microscope's diaphragm?
32826	How is a microscope diaphragm used and how is it made?
389964	How many views do you have on your answers on Quora?
462765	Can your mind really focus on two things at once?
462766	How do I achieve focused state of mind?
305441	What's the point in hating gay people?
127865	How do the numbers of police officers shot on duty in the U.S. annually compare to the number of African-Americans shot by police?
127866	What is it like to be an African-American police officer?
123298	Which has sold more copies, the Bible or the Koran?
123299	Are the Bible and Koran monarchical?
461525	How do I raise my chances of meeting classy, well-brought-up women?
461526	What's the biggest conflict a man can face when both women he is seeing meet up?
88912	Why is human cloning considered unethical?
88913	Why is cloning considered unethical?
156781	What are the transaction charges of BHIM?
156782	Are the State Bank associates's transactions available on the BHIM app?
372236	Whenever I enter my e-mail id in Google play store it show Google play service has stopped in Moto g 1 St gen?
372237	If someone has hacked your Gmail account and changed all the security recovery options, how can you regain access to your account?
228224	"What are the differences between ""manipulate"", ""influence"" and ""control""?"
228225	What's the difference between influence and manipulation?
393781	What are the hourly parking charges at Bangalore Metro stations?
393782	Why is there no metro station in Georgetown in Washington, DC?
151440	To which address should I send the application of officer entry for the Indian Navy?
151441	How can I join Indian Navy as officer?
259449	Which version of Linux does Linus Torvalds use and why?
259450	How many computers does Linus Torvalds have and what distro is he using?
488451	How do I integrate f(x) =x^2-1/x^2+1?
288352	What are the best humorous Hindi poems?
145861	What are the useful software for electrical engineering?
145862	What are the softwares that I will use in my BTech electrical engineering?
253117	Why is sex before marriage forbidden in Islam?
253118	Is sex before marriage prohibited in Islam?
105764	What is an Android TV box?
73692	What are psychological factors and what are some examples?
73693	What are some examples of psychological factors?
168937	Why didn't Cersei Lannister order the knights to kill them all as soon as she finished the walk of shame across the bridge?
168938	Game of Thrones (TV series): Was Ygritte going to kill Jon Snow just before she got killed? What did it mean when they smiled at each other just before her death?
467861	How can or will EMS accommodate those on the Autism spectrum?
467862	10th-9.2 CGPA, 12th- 82%,graduation-72%,graduated in 2016,No work ex.starting my job in Dec. How will it affect my selection in CAT (if I get that far)?
466150	F.R.I.E.N.D.S or The Big Bang Theory: Which one is more comical and why? Also which is the one that can be watched with family.
485682	Is Adolf Hitler respected in Germany?
485683	Is Hitler respected or revered in Germany?
216601	Which are Bollywood's best thriller(genre) movies ever?
64216	What is the best and safest country for Indians to pursue their higher studies?
64217	Why do most Indians pursue higher education from foreign universities?
533333	Is heaven a really nice place?
447898	What is the logic behind printing the map of India in C/C++ programming?
447899	What is the logic behind the printing of number series in C programming?
68163	What happens if you can't pay your credit card bills?
68164	What will happen if we do not pay credit card bill?
127875	What games require only 1-2GB RAM and only 1GB graphic card?
446802	How can I increase my height and weight at the age of 21?
160782	Why are whites called racist for being proud of their heritage but other races aren't considered racist for doing the same?
516167	Does Imperial MSc Risk Management and Financial Engineering have better reputation than MSc Financial Math at UCL, KCL? Which one has best structure?
516168	Is the MSc in Physics at UCL a good course?
344364	Why can't I find any newer pretentious movie reviews videos? Did Biswa Rath and Kanan Gill stop making them?
344365	Why does Biswa Kalyan Rath look so frustrated and grumpy?
417131	What are the best quotes?
466023	Is the Imperial College London hard to get into?
466024	How hard is it to get an engineering degree at Imperial College London?
292392	How do I lose weight?
94686	Solve (_+_+_=30) by using 1,3,5,7,9,11,13,15?
94687	Which is the best suited university for MBA after completing my CA?
453292	How do you determine time using velocity?
453293	How do you determine time using velocity and angle?
332643	What are the best topics for giving a seminar?
522272	What is the first and the last book everyone should read?
293847	Why is Chrome called Chrome?
413852	What should be done to cure the intestinal swelling?
413853	What are symptoms of intestinal swelling?
289498	How can I be realistic in life?
289499	How does one become more realistic in life?
60920	What happens if you do not pay your utilities bill?
137969	What is the chemical formula of silver? How is this determined?
431257	How can I submit picture here?
431258	Can I submit a picture here?
212829	Is the married life really so hard as shown in movies?
261366	Why is med school so expensive?
261367	Why is medical school so expensive?
502467	What's the difference between the American pit bull terrier and the American Staffordshire terrier?
502468	What are the differences between a pit bull and an American Staffordshire Terrier?
459051	What does it really mean to be married?
459052	What does it mean to be married?
199206	Which is a suitable solar panel installation provider near Santa Ana, California CA?
149248	How do I get admission in Cambridge?
149249	How do I take an admission in Cambridge?
409227	Why do I still feel stressed out even though I'm done with my exams?
409228	I’m attracted to both genders. My fantasies are always of naked women, but I have only had sex with men. Is it possible for me to become straight?
201859	Is it possible to find out what time the post office delivers the mail for any arbitrary address?
55572	How do I start an acting career?
55573	How can I start an acting career?
96641	Is the Canon 60D a good camera for pictures?
96642	Is the Canon 60D a good camera for video?
200970	What are the trigonometric ratios?
200971	What does trigonometric ratios mean?
530207	Do you know any news that has a foundation in reality but is being used to send a false message?
530208	What is the best site to download WWE 2k17 free?
380237	What are some examples of injustices of the world?
319673	What do NASA engineers and scientists think about Kerbal Space Program (KSP)?
319674	What do people knowledgeable about NASA/aerospace think of Kerbal Space Program?
212565	What do you think about Anonymous?
456637	What beverage would go well mixed with a vanilla flavored protein powder?
456638	Does Andhra Pradesh deserve special status?
415291	What is the easiest country for immigrants to receive welfare benefits?
415292	What is the best & easiest country to immigrate to make money?
169531	How do I raise a puppy?
110655	Why is the chi square distribution skewed?
110656	Why is chi-square a right-tailed test?
279605	How do I keep my mind stable forever?
403759	What are some examples of informational reports?
403760	What are some examples of informal reports?
301519	What should I talk about when I hang out for the first time with a girl?
407702	What is a Central Processing Unit (CPU) and Random Access Memory (RAM)?
155178	What is RAM, CPU, and ROM?
225751	Is there any scientfic evidence for psychic ability?
316768	Is it true that not all black girls wear weaves?
267822	Should I be going to college if I don't exactly know what I want to major in?
267823	How do I know what college I want to go to if I don't even know what I want to major in?
59915	From where to learn linux?
128076	Why do people always complain?
161108	Why do people always complain about everything?
139807	What would you regret not doing?
139808	What do you regret not doing in your youth? 
267508	How is mechanical energy produced?
267509	When is mechanical energy produced?
277104	What is the impact of the Magna Carta on Today's world?
438036	Is the Magna Carta still used today?
311369	Porn torrent sites?
311370	Can I learn C++ by myself?
2280	What was the first music video ever produced?
2281	Has a fan made music video ever been released as the official music video for a song?
173168	Can tiger kill a lion?
181463	What is the difference between line of credit and grant?
181464	Is there any hack to use credit card smartly?
382231	How accurate is Neil deGrasse Tyson's Cosmos?
382232	Who is Neil deGrasse?
526332	Should everyone become vegetarian?
80191	Should I become a vegetarian?
187411	What are differences between CEO and CFO?
187412	What is the difference between CEO and CTO?
505243	Where do I get computer technical support in Vancouver?
505244	How do I get into QA from Technical Support?
205285	Where can I find more information about the spacing between magnetic field lines?
205286	What is the magnetic field lines of a disc magnet look like?
422338	How secret are military secrets?
422339	How secret is Secret?
206209	What is the future of fast food?
206210	What is the future of fast food markets?
395764	What should I do at age 15?
485311	SAP fico free online practice?
485312	Why is sloganeering allowed inside the Indian Parliament?
211495	What is the ideal time and number of hours one should sleep?
281290	I want to start a channel on youtube for whistling. I am very good at it. How should I proceed?
256040	What should be a employee discount in a restaurant?
480728	What are some things new employees should know going into their first day at Wesco International?
480729	What are some things new employees should know going into their first day at Wesco Aircraft?
440080	Why are Sikh girls with turbans rare?
440081	Can a Punjabi Sikh marry or be in a relationship with a girl who has the same surname as he has?
290481	What is IPv4?
290482	What are IP address prefixes (in IPv4 & IPv6)?
31675	So as of now, who is most likely to start a MAJOR world war?
247184	What do Bangladeshis think about India and Indians?
247185	What do Bangladeshis think of India?
125327	I wonder who create whom? God create us or we create god?
455410	How would you cure cancer?
455411	How can I cure cancer without a doctor?
64372	What if I download movies from torrent websites?
64373	What are some website where I can download movies other than torrent?
474349	What should I do?
181325	What should I do to make my penis strong?
119130	If a house wife who is income tax payee deposits Rs 2.5 lacs in her a/c, will this income is exempted?
119131	IBall C20 Webcam only shows a white screen on Windows 8/7, shows loading sign on Skype, inbuilt mic working fine but no Video Output. What's wrong?
238623	Usp of iPhone?
238624	Are any books that can help to me to become a better person by thinking more clearly?
445154	Who is the best fictional character?
445155	Who are some of the best fictional characters and why?
525072	Is Polymer harder to learn and use than React?
525073	What are the best resources to learn Polymer 1.0?
419909	What font are the letters on iPhone phone keypad?
175385	What is the cheapest way to transfer money from Europe to the U.S.?
469426	In which scene of Furious 7 there is the real Paul Walker?
289507	How can I design a bolt of 8.8 Torque?
289508	How much force (not torque) is require to push a 5 lb wheel, with a radius of 8 inches and a friction coefficient of 0.6, at a speed of 8 inches a second?
389604	I found out my ex is with the girl he told me to never worry about. I can't stop crying. How can I cope with this betrayal?
389605	My new boyfriend has been with many girls before me, but he says he has never liked anybody as much as me. Still, I can't stop thinking about the girls he has been with. What should I do?
466621	How do music festivals compare around the world? Is there a cultural difference between European festivals and the ones in US or Australia?
466622	Which is the best dance music festival in the world?
173897	If the black box flight recorder is never damaged during a plane crash, why isn't the whole airplane made out of the stuff?
173898	If the black box remains undamaged during a plane crash, why isn't the entire plane made by the same material?
200810	My girlfriend broke up with me for her ex. What should I do?
519401	What's the difference between Bills and Receipts in the Wave App?
519402	What is the real reason that Google decided to shut down Wave?
67282	How do you tame a marmot to keep it as a pet?
67283	Can you have a marmot as a pet? Why or why not?
394191	What is your craziest sexual experience?
394192	What's the craziest sexual experience you've had?
12070	What is the list of legit wholesale suppliers of the Apple iPhone 6 Plus worldwide who accept payments through PayPal?
19806	How do you train your dog?
19807	How can I train a dog at home?
520695	Is iOS development easier than Android?
520696	Do you think learning iOS development is easier than Android development? If so, why?
286100	What stores do not require CVV?
95067	How do you stand your ground in a world full of opinions?
95068	How ballistic missile works?
359388	Who is the Prime Minister of India?
52062	Which online forum(s) can one find the most rational, productive and insightful discussions on the planet?
52063	What Internet forums have the highest quality of discussion? And which ones have the most intelligent people?
425542	Why do we allow the so-called jews to be alive or buried?
425543	Why are the so-called jews allowed to be alive or buried?
332464	What are some advanced high school chemistry experiments I could do within a couple of days? Looking for topic help on an IB chem project
493049	Did Captain America protect Bucky too much in Civil War?
493050	Why did Captain America: Civil War seem so much funnier than other comic book movies?
39161	What happen when we touch hydrogen?
39162	Why does alcohol act as both an acid and a base?
484002	Can I take an unopened Leatherman on an airplane in my carry-on?
484003	Can I take my Leatherman Skeletool on an airplane?
122692	How do you initialize an array of two pointers that point to functions in C?
122693	How do you define three integer variables, and than initialize an array of three pointers that points on these variables in C?
226368	Is it possible that zombies exist?
226369	Do zombies exist?
302263	How many combination of 6 numbers can you make in 49 numbers and there is 1 to 49?
347991	How do you remove coffee stains between my teeth?
278122	Why is the divorce rate increasing in India?
520300	What is the best place to buy ZBrush in the US?
520301	What is the best place to buy ZBrush online?
528347	Why does Dhoni not hit the helicopter shot anymore?
154336	Why is there no planning phase in the SDLC?
440307	What is safe box features in LEO Privacy Guard?
440308	How can I change the theme in Leo Privacy Guard lock?
318363	If Donald Trump became President, could he disband congress and take over as a dictator?
318364	How Donald Trump became President of United States?
20376	What's it like being an optical engineer?
20377	What is it like to be an optical engineer?
381899	Is it a good idea to drive a new Tesla S across country? Not concerned about charging, just wondering about potential issues/repairs with the car.
346235	What are the best ways to microwave noodles?
346236	What are the best ways to microwave ramen noodles?
535885	How can one become a genius in physics?
158029	What is e-court?
158030	What is the court of God?
79371	What should I do after PhD in mathematics?
79372	What should I do after getting a PhD in Mathematics?
211678	How doeswe can stop female foeticide?
211679	How does we can stop female foeticide?
397059	What are some of the best business ideas in India?
397060	What are the best business ideas for rural India?
41599	What lessons can we learn from Jewish success?
353790	Can someone go from a extrovert to a introvert?
238420	I study hard, 16 hours a day, but still I can't get good grades. What should I do?
418326	How do I crack AIPMT/NEET 2017?
157850	How many neurons in our brains die every day?
157851	What happens to your brain if you watch tv all day every day?
217888	How do I root Android KitKat 4.4.2 without downloading any software?
123361	I have a salary account in ICICI bank and am not using it for last few months. Will this account Close automatically?
123362	What happens to my ICICI Privilege Banking Salary account if I am quitting my job and going abroad?
295220	Is being a sociopath effective, professionally or in business?
295221	Is there value in being sociopath in business?
139736	How do I get money from you?
249535	How do I get money?
192644	Do you think that Indian girls are getting uglier, darker and greasier slowly with time and are starting to look just like men?
342100	Where can I find the most impressive jigsaw mats in Belmore?
342101	Where is PPAP from?
33579	How do I get rid of fat in my tummy since it makes me look pregnant ?
1813	How do you cancel USAA auto insurance?
1814	Auto insurance Broker fee in CALIFORNIA?
239436	What are some good baby boy names?
492618	Why I do things which I know are and will always be bad for me? Why are short term pleasures overpowering my long term vision?
416402	What is the difference between trading and investing?
224554	How is the working experience in Code Brew labs Chandigarh?
224555	What is to like work at Infosys Chandigarh?
449336	What are some alternatives to Canva?
226768	How can I take PhD degree?
226769	What is the fastest way to finish a PhD degree?
205752	How do we ignore hurtful comments from family?
205753	What is the cheapest time to buy flights to Australia from the UK?
309675	Where can I download byjus class videos for Class VIII?
309676	How do I make videos like Coding Rainbow or Byju’s classes?
26913	What would have happened if Ned Stark hadn't been beheaded?
193756	What would have happened if Cersei Lannister sent Ned Stark to the Wall instead of executing him?
419626	Do black holes really exist?
401265	How do you ask out a co worker who is never alone at work?
401266	How do I ask a co-worker out for a date?
469517	How is school changing in the 21st century in Myanmar?
140971	What is the difference between deterministic and probabilistic models? What are the examples of each?
140972	How social trade company is earning?
96418	What is the best torrent site for movies?
120897	What is the best torrent sites for sports?
35936	Why is Africa underdeveloped?
35937	Why is Africa still so underdeveloped?
278561	What software is available to display information on an HD TV in a lobby?
278562	Without any it course can I join it?
209047	How do I make money while studying?
209048	Is there anyway to make money while studying?
61033	How do you know that girl likes you?
490481	I have an extension running on my computer (Chrome browser) that send desktop notification, but is there any way I get that notification on my iPhone?
490482	Is there any quick way to figure out the number of Chrome extensions? Also for other browsers and app stores
194279	Where can I find DJs for a party in Sydney?
184614	If Clinton gets elected, how long before her student loan refinancing plans go into place?
184615	Why do people of Japanese and Chinese look similar?
136010	"How is the word ""indomitable"" used in a sentence?"
136011	What are career opportunities after entering into FMCG as sales guy and what are the hikes one used to get?
470009	Which is the worst feeling?
479409	Could I put $10 million in a bank with 1% interest and live off the $100,000?
479410	If I put $100,000 in the bank will the money grow in the account every year?
255674	What makes chicken tikka masala orange?
255675	Should I feel guilty for eating chicken tikka?
251800	What would the observable universe look like if light speed was infinite?
251801	How would the universe differ if the speed of light was infinite?
230471	My fiance is travelling on a J1 visa. I want to apply for an L2 in the near future. Would there be any issues while applying for the L2 visa?
230472	My fiance is travelling on a J1 visa. I want to apply for an L2 dependent visa while she is here on J1. Is that possible?
469159	Is it Ramayanam real?
469160	Did mahabaratham and ramayanam happened in real? Or they are just myths??
303980	How heavy is a full grown elephant? How is this determined?
303981	How heavy is a full grown elephant?
532189	While eating spicy food, why does the spiciness (i.e., the burn) magnify as the meal progresses?
320688	Why is it bad to be a perfectionist?
320689	Is being a perfectionist a strength or a weakness?
486849	How can I join CRIS?
486850	"Why did IRCTC add a ""shop on Amazon"" link on their homepage?"
439251	How can I know what happenned to an old man in Houston, Texas, USA? I am in Vietnam.
439252	How do I apply for pan card online, please read details?
358455	Is it safe to visit srinagar in September 2016?
358456	Is it safe to visit Srinagar in this coming September?
130287	How do you stay safe in Israel?
315295	Are Muslim women happy wearing burqas in the winter?
315296	Are Muslim women happy wearing burqas in summer?
218917	What are the beneficial things that could happen for the poor and middle class under Hilary Clinton?
218918	What are some good things you can expect under Hillary Clinton as president?
130214	How do I use Jio SIM in Asus Zenfone 5 T00J?
410390	Which material is used for making helicopter blades?
410391	What helicopters were used in WWII?
461594	How can I prevent my dog from licking herself constantly?
461595	How can I prevent my dog from getting fleas from my hedgehog?
304765	How was Mount Everest formed?
304766	Where is Mount Everest?
217428	Why do we need yellow light in a traffic signals?
398362	Can I downgrade my Xperia z3 to 5.1.1 from 6.0.1?
90664	How do you see who liked/likes your tweet on Twitter?
90665	Can I see who likes my tweets?
412858	Can I download Red Hat for free, legally?
412859	Where can I download Red Hat Enterprise Linux 7 free for a PC?
259248	What are Elon Musk’s political beliefs?
335972	How do sailboats sail against the wind?
335973	How do sailboats travel against the wind?
291825	What are the challenges facing NGOs working at a grassroots level in India?
291826	Do you really think that NGOs in India are working the way they should?
85916	Can we stay healthy without eating fruit at all?
85917	What fruits should we eat to stay fair and healthy?
128727	How do I motivate student ambassodors?
348307	In what jobs can a person make use of his creativity?
348308	What would you suggest, if a person wants to make each of his days worthy?
93616	What is the best way to learn animation as a beginner? And what are the recommended books, sites, software that may help?
93617	How can I learn hand-drawn animation?
170978	How do I believe?
505443	How can I believe in my self?
471898	What is cement made of?
485101	Why aren't Michael Jordan's sons in the NBA?
485102	Are Michael Jordan and Wilt Chamberlain the 2 greatest NBA players of all time? (I saw both of them in their prime.)
444208	What is your most valuable lesson learned from your first job?
444209	What is your most valuable lesson learned?
127555	Which Hollywood movie is most over rated in your opinion?
470698	What is the difference between plinth level and formation level?
470699	What is Difference between plinth area and roof slab area?
512464	Was Flappy Bird an addictive game?
512465	Is Flappy Bird one of the most addictive games?
422095	How do I get a perfect score on the new SAT?
196012	When was the last time we had someone in the White House who was a grandfather?
196013	What is the work done by friction and gravity in moving an object up the incline?
