282000	Which one is better IBM GBS or TCS BPS ?
282001	What is the similarity and dissimilarity between Gandhiji and Mandela ?
282002	What are the similarities between Donald Trump and Kim Jong-un ?
282003	What are some unusual aspects about politics and government in Switzerland ?
282004	What are your favourite 10/10 Hollywood movies ?
282005	What's a day in the life of a Cotton College student like ?
282006	What happens at the first day of most Indian colleges ?
282007	Why is it CMYK and not CMYB ?
282008	How do I get bright colors in CMYK ?
282009	Will atheists become the future extremists ?
282010	Is India becoming an extremist state ?
282011	What are the possible scenarios when a code warning can create problems ?
282012	I have a problem in my android app . I have used the following code to create the database and perform the log in and sign up process . Is it right ?
282013	How can you look more italian ?
282014	I am a woman but I look masculine . How can I look more feminine ?
282015	Which is the most upvoted answer on Quora ?
282016	How should I propose my girlfriend mathematically ?
282017	What are some trekking and adventure groups in Chennai ?
282018	What are the best trekking places around Chennai ?
282019	How do we politely tell someone we're talking to that he/she has bad breath ?
282020	How do I politely ignore someone who talks too much ?
282021	Hollywood : Did Hollywood ever copy any Indian movie ?
282022	Why are most Indian movies a copy of Hollywood ?
282023	Does a black hole affect neutrino ?
282024	Does dark matter affect black holes ?
282025	What is the Hindi word for politeness ?
282026	`` What does the Hindi word'''' लंडूरे'''' mean ?''
282027	Why isn't the United States a member of the International Criminal Court ?
282028	How effective is the International Criminal Court (ICC) in serving justice ?
282029	What should I do to overcome this fear ?
282030	Is it worth to pay a traffic fine if a driver is unable to drive and will not have plans to renew their driver's license in the future ?
282031	If one moves between states , should one get a new ID card or driver's license in the new state if one doesn't plan to drive ?
282032	What are the procedures for a MBBS degree holder to get admission and study PG / ND/MS in the USA ?
282033	How can I study medicine in USA ?
282034	Can we do free business listing in www.prokerala.com ?
282035	Can we do free business listing in www.thelearningpoint.com ?
282036	Which is a suitable inpatient drug and alcohol rehab center near Randolph County AL ?
282037	Which is a suitable inpatient drug and alcohol rehab center near Bullock County AL ?
282038	I am a Muslim female and I want to marry a Hindu boy . I am a Pakistani national . What can I do ?
282039	May one take Nimulid , Metrogyl and cetirizine tablets in an emergency ?
282040	What tablet can I take to get my chums faster ?
282041	Why was Jimi Hendrix so attractive to women ?
282042	Was Jim Morrison known to have met the Beatles or Jimi Hendrix ?
282043	Any updates on Baahubali - The Conclusion ?
282044	What is it like to be pretty ?
282045	What are some of the most beautiful palaces and castles in the world ?
282046	What is the fee structure of TIME Institute for CAT classroom training in Chennai ?
282047	Who pays san francisco city income tax ?
282048	I want to get into the cybersecurity and ethical hacking where do I start ?
282049	What is the role of icon designing for promotion of business ?
282050	How can I increase and promote fashion designing business if the work is done from home ?
282051	Is there possibility of life on other planets ?
282052	What is steering wheel ?
282053	What is a tilt steering wheel ?
282054	What are the correct English terms for Sarjana , D1 , D2 , and D3 ?
282055	What is Prasad in an English term ?
282056	How are manipal main campus guys?Are they hot ?
282057	How is IT in the Manipal main campus ?
282058	What is the first picture you see when you look up your name ?
282059	Why does 900mhz band used for 2g and 3g ?
282060	What is it like to watch a movie at a movie premiere ?
282061	What is the best thing to say to your wife right after she gave birth to your child ?
282062	I always wanted to have a son , but my wife gave birth to a daughter . How can I cope up with this disappointment and love my daughter ?
282063	Comparing Xperia X , X performence , XA and Z5 , which will you choose and why ?
282064	Will a Sony Z1 flip cover fit a Sony z5 dual ?
282065	How can I make 100 $ a month with a side business ?
282066	What are the commonalities between Bengalis , Kashmiris , Punjabis and Sindhis ?
282067	What is common between the Sindhis and the Punjabis ?
282068	Where can I get best servicing and designing service for commercial refrigeration in Sydney ?
282069	Where can I get best lock repair services in Sydney ?
282070	Which is more humiliating , a striker tackling a defender or a defender dribbling a striker ?
282071	Why do people think a whistleblower is bad ?
282072	Why do some people hate whistleblowers ?
282073	What does tuition fee mean in US ? Do PhD aspirants really need to know this while applying for graduate schools in US ?
282074	Axis passing through Centre and perpendicular to disc plan ? Explain ?
282075	Which dishes are famous in jaipur ?
282076	Which dishes are famous in jodhpur ?
282077	Rounds in wellsfargo ?
282078	What are the most unrealistic parts of Rogue One ?
282079	How plausible is MJOLNIR armor and energy shielding from Halo ?
282080	What is armor penetration ?
282081	How can you prepare homemade dog food for a 3 month old puppy ? What solid food would be safe to administer ?
282082	I have a two month old cat and I feed it dry food . Is this enough ?
282083	How do I get rid of chickenpox ?
282084	Does head shape affect IQ ?
282085	How does IQ affect programming skill ?
282086	If I delete my Twitter account , will my friends still be able to see DMs I sent them previously ?
282087	How do I get back lost DMs in Twitter ?
282088	What do I wear with these shoes ?
282089	What can I wear these shoes with ?
282090	Do you know university degrees which are for people who like sports ?
282091	`` What's the most secure Google Docs style cloud-based document suite that provides'' `` real-time'''' or'' `` live'''' collaboration or editing among selected users ?''
282092	Typing : Which thumb is the proper one to hit the space bar ?
282093	I have learned to type with home-row shifted left (left index finger on D , right index finger on H) . Should I try to learn regular home-row typing ?
282094	Is Rohit Sharma engaged with Yuvraj Singh's sister ?
282095	Have the Delhi DareDevils made a mistake in buying Yuvraj Singh at such a high price ?
282096	Is there such thing as chairs for people with scoliosis ?
282097	How is scoliosis and hip pain treated ?
282098	What is the DHP vaccine for dogs for ? Is it necessary ?
282099	Can rabies vaccine for humans be used for dog ?
282100	What is the difference between l menthol and dl menthol in applications , flavor and aroma ?
282101	How does menthol produce its particular smell ? How does our perceive it ?
282102	What do people who know UX think of the Interaction Design Foundation ?
282103	Which one of these is a better option?Thinkful or Interaction Design Foundation for learning UX ?
282104	Why Sony stop making laptops ?
282105	Can I replace the processor in my Sony VAIO laptop ?
282106	`` How can I solve this probability question ?'' `` There are 500 misprints in a book of 500 pages . What's the probability that a given page will contain at most 3 misprints'''' ?''
282107	What is the probability that the Wiki Game will be possible for any 2 pages within 3 spaces ? 5 spaces ? An arbitrary number ?
282108	Why do we use high voltage to transmit electrical power ?
282109	Why does LVDT use high voltage ?
282110	What makes a Husky/German Shepherd puppy such a loyal companion ?
282111	What is the name of the flowers at the bottom of this photo ?
282112	What is the name of the flower in this tattoo ?
282113	What are the steps that I can take to stop marriage hall nuisance operating next to my house causing too much sound from music and chattering etc ?
282114	What movies have a scene where a prisoner , locked in his cell , is burned alive ?
282115	Who is Hillary Clinton ?
282116	What are some good movies which depict friendship ?
282117	Which department of IES get posted in major cities ?
282118	What posts we can get after giving IES exam ?
282119	Say what you mean and mean what you say ?
282120	How can we be sure that what you say is what you really mean and that you are not merely saying it to appease/convince your voter base ?
282121	Am alone and happy , 1-2 hours a day . What should I do in that time ? Going out is good but dont have anyone to accompany . I am at Ahmedabad , India .
282122	I am doing engineering . I am addicted to masturbation . I do it at least 2 times a day . I am getting weak and dumb . What should I do ?
282123	How do I determine the required cross section of the screen for the MV cable (say 6kV) ? IEC defines some cross section but , how can this be verified for a double earth fault phenomena ?
282124	My computer screen is shadowing does this a fault of cable or port ?
282125	Why are eggs perfectly white in the United States ?
282126	Poultry : How did brown eggs become a standard market choice over white ones in the UK ?
282127	How can men feel an orgasm without ejaculating as women can feel it by a gynecological examination or an operation ?
282128	Why would a man not be able to reach an orgasm ?
282129	What is your reaction on the second trailer of Hrithik Roshan's Kaabil ?
282130	What is your reaction on the trailer of Hrithik Roshan's Kaabil ?
282131	Do you shop online ?
282132	How do I summarize the Wolf of Wall Street movie to a friend ?
282133	Why do so many people believe the police framed Steven Avery but not OJ Simpson ?
282134	Is impractical jokers scripted ?
282135	How much of Storage Wars is scripted ?
282136	Did ancient generals really vituperate their enemies before fighting ?
282137	What is the target market for pearl jewelry ?
282138	Should we use momentum method in full batch gradient descent ?
282139	Why are optimization techniques like natural gradient and second order methods (L-BFGS for eg .) not much used in deep learning ?
282140	When can I get an offer letter for an off-campus drive in August 2016 at CTS , Gurgaon ?
282141	I got recruited in the Feb 2015 TCS off campus drive . When will I get the call letter ?
282142	Am I the only one who wants to get away from home at the age of 24 ?
282143	Am I the only one who always want to be happy but end up at the opposite ? And what should one do to be happy ?
282144	What is the traditional dress of Colombians ?
282145	What is the traditional dress of Hondurans ?
282146	Recently , I started to buy pure Aloe vera gel and blend it with some natural oils like jojoba oil , vitamin E oil , and evening primrose oil . The result is a creamy gel that I apply on my face two times a day . Is that enough for my skin to avoid wrinkles , given that I am 35 years old ?
282147	What if I put aloe vera gel on my face overnight ?
282148	Why do dogs react differently to some dogs than others ?
282149	Why do some single women like cats better than dogs ?
282150	What are useful 9th grade science fair project ideas ? How can it be done ?
282151	Do T.V. shows get revenue from their own channels on YouTube ?
282152	Getting a new iPhone 6 under warranty , when nothing is wrong with your existing iPhone 6 ?
282153	How can I get free music on an iPhone 6 ?
282154	How can you tell if someone is pretty ?
282155	How can you tell if you like someone ?
282156	Why did President Obama wait so long to show a birth certificate ?
282157	Why is the Black Sea so important to Russia if its access is controlled by Turkey at the Bosphorus ?
282158	Why does Pakistan love Turkey ?
282159	When will the next Android version be released ?
282160	What does this mean in English ? 这是被战火践踏过的土地 ， 从今天起 ， 我们要缅怀那片长满鲜花的草地 。 ?
282161	What's the mystery behind Tanjore temples ?
282162	How can I get MOOC/E-learning through online web and video courses related to dental surgery developed by Indian professorial/professors ?
282163	How can I know if I don't have a soul ?
282164	How do you know if you have a soul ?
282165	Is it illegal to post private texts on Facebook without the senders consent ?
282166	SMS spoofing : Is it still possible to send text sms with number of another person without revealing any info of the actual sender ?
282167	What is your review of Indian Revolutionary Movement ?
282168	What is your review of Indian Revolutionaries ?
282169	What are the myths about Balkan countries ?
282170	What are the myths about modernity ?
282171	What are some of the best questions (already) asked on Quora in 2012 ?
282172	Why do dolphins use Sonar ?
282173	Does hipmunk make money ?
282174	How does Hipmunk make money ?
282175	What inspires you to sing ?
282176	What song inspires you ?
282177	What are all the advantages a schedule caste has in India ?
282178	Are there any courses that explain the book Introduction to Algorithms by Cormen ?
282179	What is the hardest exercise problem in the Introduction to Algorithms book by CLRS , according to Thomas Cormen ?
282180	What is prison like in China ?
282181	What does the phrase ` the resemblance is uncanny' mean ?
282182	What does this phrase in English means ?
282183	`` How do you pronounce'' `` Dohnányi'''' ?''
282184	What are the frequently asked basic and complex queries (SQL) during a tech interview ?
282185	Which are the frequently asked interview questions for my SQL ?
282186	My skills are OFSAA and I want to switch my job . I have job offers from Accenture Pune and KPMG mumbai which company should I join ?
282187	What job PPSM department does in Accenture Mumbai ?
282188	What is real hip-hop ?
282189	Is hip hop less real without profanity ?
282190	How do I make money on porn if I have a few unique porn videos ?
282191	What makes people enter the porn industry ? Is it easy money ?
282192	Should I start to prepare for UPSC ?
282193	What is the best way to start preparation for UPSC ?
282194	Who originally said ` the enemy of my enemy is my friend ?
282195	How did you convert an enemy into a friend ?
282196	How many of you think Gandhiji may have smoked weed ?
282197	Has Adrian Lamo ever smoked marijuana ? What are his thoughts about it ?
282198	Where can I find a Swiss family office database ?
282199	How many of Batman's foes end up in asylums and how many in prison ?
282200	Do you care if God exists or not ?
282201	Does the amount of lives saved by products of innovation fuelled by wars surpasses the amount of lives lost in said wars ?
282202	I'm Taurus ascendant . My Venus is in 10th house along with Saturn , Mercury and Moon . Mars being in 9th house with Sun . Is that called Sannyasa Yoga ?
282203	I'm Taurus ascendant . Mercury is in the tenth house with Jupiter , Mars , Sun and Ketu . Saturn is in the eleventh house . Is that called Sannyasa Yoga ?
282204	`` Is'' `` Nutrilite ® Protein Powder'''' good to use with milk every day in the morning instead of a usual breakfast ?''
282205	Why does income tax exist ? Shouldn't people be taxed only on the basis of the amount they consume rather than that which they earn ?
282206	Does California receive more income from income taxes than sales taxes ?
282207	What is a typical daily class schedule for a high schooler in the Netherlands ?
282208	How effective is video trainings , can you recommend good ones for soft skills ?
282209	How do I earn 5 -10 K per month from home ?
282210	How can I join AAI JE in IT ? Because I'm a B.E computer science student .
282211	What is the slope of a constant enthalpy line on a T-S plot ?
282212	Why do teen girls (and women in general) allow their boyfriends to take naked pictures of them in this day and (digital) age ?
282213	What happens if you were born out of a wedlock in Malaysia ?
282214	Why can't the govt of India print enough money to meet the tide ? Is it broke ?
282215	What is MS Word used for ?
282216	How accurate was the Imitation Game as opposed to Alan Turing's actual involvement in the Enigma machine ?
282217	What are some historical inaccuracies in The Imitation Game ?
282218	Is OMSCS at Georgia beneficial for getting jobs in India ? I can't go to US neither for studies nor for job . Kindly suggest .
282219	Can a foreigner studying in india get a job ?
282220	How can I download music in my iphone ?
282221	How do I download music on Chrome ?
282222	Does watching a streamed video consume less data than downloading the full video ?
282223	Which uses more internet data : buffering a video to watch it or downloading it and then seeing it ?
282224	What are the arguments for and against the existence of DID ?
282225	What are some arguments against the existence of pure objectivity ?
282226	Which is best book for Quantitative Aptitude , especially for cracking Banking exams high grade like RBI and NABARD .
282227	Which books are best for phase II of RBI grade B exams 2016 ?
282228	Which MacBook should I choose ?
282229	Which MacBook should I buy ?
282230	Why wouldn't you invest in Quora ?
282231	Would you invest in Quora ?
282232	When is Calcutta university B.Com honors 2nd year 2015 examination beginning ?
282233	Is there any student of DAVV University , Indore who can tell me when were the 5th sem exams for b.com held last year (2015) ?
282234	What is the average profit margin attained by bars and/or restaurants on the sale of alcoholic beverages ?
282235	How Much Money Was Spent on X ? : What is total annual revenue generated from alcohol sales in bars , restaurants and nightclubs in USA ?
282236	What is the modern theory of incidence in public finance ?
282237	What are the positions of the modern cell theory ?
282238	What are the responsibilities of Adulthood ?
282239	Does amazon deliver appropriate cosmetics ?
282240	What kind of profile is required to get admission in fully funded PhD programs in Business / Finance in US / Canada / EU / Australia ?
282241	I want to do PhD in Canada or US ? What are the essential requirement and procedure ? Tell me about funding too ?
282242	Uber in 2015 : What is the difference between UberPOP and UberX ?
282243	UberX : I have been driving for Uber for almost 10 days now . I have received statements via email for my payments but I don't have direct deposit or anything set up . How do I get paid ?
282244	Can I leave my cat alone for 3 weeks ?
282245	Can I leave my cat alone in the house for 48 hours ?
282246	How many mux are there in a half adder , in general ?
282247	Which is the best college for pursuing Ph.D. in Madhya Pradesh ?
282248	What are the most INTP-friendly Columbia courses ?
282249	How do people find new friends at Columbia ?
282250	How do you prepare for bank exams in a smart way ?
282251	Will there be further counselling for spot admission into NIT/GFTIs for JEE 2016 ?
282252	What are the differences between porcelain , ceramics and China ?
282253	What is the difference between ceramics and porcelain ?
282254	Is Amazon421xs scam ?
282255	Where can I buy Supra Skytop 2 shoes in Pune ?
282256	Is it true that Dubai is the most expensive city in the world ?
282257	Which city in the world is most similar to Dubai in terms of demography and psychography ?
282258	Do AP exams cost money ?
282259	How much does it cost to take AP exams as a private candidate in Singapore ?
282260	What could be a topic for a paper combining socialism , religion and capitalism ?
282261	Is God in favour of socialism or capitalism ?
282262	What is the best programming language to self study for a beginner ?
282263	I am going to smoke weed soon with my friends . I have no tolerance because it's my first time . How much should I smoke to get high ?
282264	How would you use the word ` ascribe' in a sentence ?
282265	I have an MBA in operations management with 3 years experience in channel/distributor sales . I'm planning for a shift to a career in SCM . Will the industry accept this profile change and consider my experience in sales ?
282266	Why do faucets websites give out free bitcoins to the visitors ?
282267	Why do website force visitors to request demo instead of just having a great recorded demo ?
282268	Why does Neil DeGrasse Tyson hate philosophy ?
282269	Title for * scientist ?
282270	What is the difference a good Bard player and a great one ?
282271	What are the top ten speech recognition APIs ?
282272	What are some good voice recognition APIs ?
282273	What are some of the best works of psychedelic art ?
282274	What are the best psychedelic rock songs and how do they effect our mind ?
282275	Do you have Asian eyes ?
282276	`` Do I have'' `` Asian eyes'''' ?''
282277	How do I become self taught singer ?
282278	How can I become a self taught accountant ?
282279	What should I do to change jobs after 8 yrs of exp . working in not-so-good technology . like LDAP and Unix (compared to java.net) ?
282280	Why do you watch we raw or what was your high point ?
282281	What can USA learn from the Middle East ?
282282	How do I self-train myself in marathon ?
282283	Is India really developed ?
282284	What are the steps to be taken to become a good TopCoder ?
282285	Where does TopCoder Petr work ?
282286	Does seafood taste the way it smells ?
282287	Why does seafood smell the way it does ?
282288	Do employees at Castle Brands have a good work-life balance ? Does this differ across positions and departments ?
282289	Do employees at Prestige Brands have a good work-life balance ? Does this differ across positions and departments ?
282290	How do I train my hands to work independently from each other ?
282291	At a conference , 13 members shook hands with each other once , before and after the meeting . How many total number of hand shakes occured ?
282292	Are there modern-day descendants of the Mayans ?
282293	Which modern day people are descended from the vikings ?
282294	What is Muzic.io ?
282295	What is Omoto.io ?
282296	Why do Western countries such as the U.S. , UK and Australia secretly legalise doping for their athletes to win medals in global Games ?
282297	Why is there a strong hatred for Indian men in the U.S and Western European countries ?
282298	How should I become billionaire in 1 week ?
282299	What is America's best chocolate milk brand ?
282300	What is the best chocolate brand according to you ?
282301	Is there a way to decrypt . crypt12 WhatsApp files without the key ?
282302	How can I read WhatsApp database messages (crypt8) without rooting my phone ?
282303	What are the broad cultural differences between North Indian and South Indian ?
282304	In this age of women empowerment , why do we have all men and all women cricket , football , etc. teams ? Why don't champions of gender equality demand mixed teams ?
282305	What is the significance of Elodin asking the same question as Manet about the number of spades played ?
282306	The Kingkiller Chronicle : What series are similar to Patrick Rothfuss's Name of the Wind ?
282307	How much salary is given after 5 years as a system verilog verification engineer ?
282308	What is the scope of testing engineers after 5 years ?
282309	What are the famous places for coworking space in Bangalore ?
282310	Intellect : What is the difference between being intelligent and being intellectual ?
282311	Where does the intellect in life form come from ? Be it in the form of evolution or intelligence that humans/animals have ?
282312	Do you feel empowered or cowardly when you carry a gun ?
282313	How often do you feel insecure due to the fact that anyone can be carrying a gun in parts of the USA ?
282314	Why does Shadow the Hedgehog skates instead of running ?
282315	What sort of cage should you get for a pet hedgehog ?
282316	In the Harry Potter world , which house of Hogwarts school do you think will produce the richest graduates if they go out to work in the real world ?
282317	My sister is always seeing number 44 after our father died . Why ?
282318	Are there any antihistamines that are not anticholergenic ?
282319	Are there any drugs you can not take with antihistamine ?
282320	If you can start to see your upper four abs individually but there is still some fat/subcutaneous fluid above them , what body fat percentage are your probably at ?
282321	Is Vox reliable ?
282322	What is the Vox Media CMS and how do I use it ?
282323	What is the easiest thing you ever do in your life in hardest way ?
282324	What is the hardest things & easiest things to do in life ?
282325	What is difference between islands and different types of arcs ? What is the difference between seamount and mid oceanic ridges ?
282326	What's the difference between reference and inspiration ?
282327	What are some Vietnamese inventions ?
282328	Why is Vietnamese food popular ?
282329	Interesting story for some people life ?
282330	How much do you make as a full time day trader in India per month on average . What is your capital and number of trades that you take per day ?
282331	If total energy in universe is constant then how much energy is there in the universe ?
282332	Is the energy of the universe constant ?
282333	Why do they spend to have people like Siddhu Paaji in shows like Kapil Sharma show ?
282334	What are some ways of using Microsoft Excel that people don't usually know or get confused about ?
282335	Is it possible to get into UCSB with a 3.5 UC GPA ?
282336	Can I get my GPA to a 3.5 at the end of senior year ?
282337	What individuals and events in history are a source of pride for Sudan ?
282338	What are the best resources for learning PivotTable.js ?
282339	What are the best resources for learning to learn ?
282340	Is there a medication which will permanently prevent me from dreaming ever again ?
