test-250637	What do people think of my6sense.com?
test-250638	How is nuclear power used to produce electricity?
test-250639	How can you make electrical energy with nuclear energy?
test-250640	How will banning 500 and 1000 currency will help to reduce corruption?
test-250641	How effective is scrapping 500 and 1000 rupee notes? Will it reduce black money?
test-250642	How can I stop my mind deviating from studie?
test-250643	How do I divert my mind from business and focus it into studies?
test-250644	Are the ingredients in XS Energy drinks any good/unhealthy?
test-250645	What are the different Red Bull can sizes?
test-250646	What are your thoughts regarding Nokia?
test-250647	I am a 22-year-old that want to invest 50k in stocks. What are some suggestions on how do I get started?
test-250648	Is it posible to make money unintentionally?
test-250649	Is it possible to make money, unconditionally?
test-250650	How do I find Lord of the Rings books online?
test-250651	How can I get Jio barcode in iPhone 5s?
test-250652	How do I hack my husband phone?
test-250653	How can I do to hack my husband's phone?
test-250654	What's the scariest thing you have ever experienced?
test-250655	What is the most scariest thing you have ever encounter?
test-250656	What makes you different from others?
test-250657	What traits do you have that make you feel very different from most others?
test-250658	What are the black stains you always see on sidewalks?
test-250659	How do I solve this circuit?
test-250660	Why do owls have good night vision?
test-250661	Why do horses have good night vision?
test-250662	My boyfriend says he loves me but he is distant, doesn't express much, and at times I feel very annoyed with him. What should I do?
test-250663	My boyfriend is not expressive. He doesn't share things with me. What should I do?
test-250664	If you ate bacon for a whole day and pooped at the end of the day, would your poop taste like bacon?
test-250665	Who is the father of education?
test-250666	Why is there so much hype about roses?
test-250667	Why is there so much hype about Beyoncé?
test-250668	Do some people answer on Quora just for earning credits?
test-250669	Do some people on Quora write answers only to get upvotes and earn credits? If so, why?
test-250670	How do I learn Hindi in 2 or 3 months?
test-250671	How do I learn Hindi in 1 month?
test-250672	How can I use LinkedIn to search for jobs in India?
test-250673	How Do You Use LinkedIn to search Jobs?
test-250674	How can I start to learn Android?
test-250675	How do I learn android development?
test-250676	What are the various iteration cut off of different branches at all campuses in bits?
test-250677	What are the Cutoffs of BITSAT 2016 for the different branches, in different campuses?
test-250678	Where should I invest Rs.10000 monthly so as to get maximum return in a year only?
test-250679	How can I get maximum returns by investing Rs 25K in a year?
test-250680	What does the USA want from Afghanistan?
test-250681	How important is Afghanistan for the USA?
test-250682	What are the advantages of buying a Bosch washing machine over an IFB washing machine?
test-250683	Which is the better brand among top loading fully automatic washing machines? Is it LG, Samsung or IFB?
test-250684	How do we define normality?
test-250685	"How does one define ""normal""?"
test-250686	I am a 2nd year maths hons student.I want to prepare for IAS . When should I start preparing for it?
test-250687	Currently I am in my 2nd year of electrical engineering. I want to start preparation for the IAS. Is it the right time to start preparation? If yes, how do I start intially?
test-250688	What are some things new employees should know going into their first day at Republic Bank?
test-250689	What are some things new employees should know going into their first day at Bank of Hawaii?
test-250690	What is the best mobile ad networks in japan?
test-250691	What are the best mobile ad networks for 2015?
test-250692	What is the psicologic connection between incoming and outcoming?
test-250693	What are the causes of diarrhea and shaking in a dog?
test-250694	How can I  stop smoking?
test-250695	How can I leave smoking?
test-250696	Are web languages the easiest to learn?
test-250697	Which websites are the easiest to learn a programming language from?
test-250698	Why are women unwilling or afraid to show interest in the man they have attraction for?
test-250699	Are women or girls interested in sex. if yes then why they can express it?
test-250700	What is pipe design?
test-250701	Which is best in pipe design or pipe stress analysis?
test-250702	Does IBM have partners?
test-250703	Who are the partners of IBM?
test-250704	Who is the most likely to win the 2016 UEFA Champions League?
test-250705	Who will win the final of UEFA champions league 2015/16?
test-250706	How one should prepare for GATE?
test-250707	How and when should one get start to prepare for the GATE exam?
test-250708	What are the list of gadgets given to all ZS Associates Employees?
test-250709	Given there are 310 employees and each month I have to give away 171 awards, at the end of one year, what is the probability that all 310 employees got the award at least once?
test-250710	How can I jump start my new blog?
test-250711	What's the easiest way to start a new blog?
test-250712	If you delete photos from your iPhone, will they be deleted from Google Photos?
test-250713	How can I delete all photos from my iPhone at once?
test-250714	How can I remove a device from being connected to my gmail account?
test-250715	How can I remove my Gmail account from a device?
test-250716	Why is jagruti chasmawala such a self bragging bitch?
test-250717	What is a bitch?
test-250718	What is the longest chemical formula for a chemical substance?
test-250719	What is the chemical formula of sweat?
test-250720	How can I apply for private counselling sessions for Neet 2016 ?
test-250721	Which private colleges should I apply for counselling of NEET 2016, given that I have 64653 rank scored 355/720 in general category all over india?
test-250722	Why do so many people in James Bond films have risqué names?
test-250723	What is James Bond's middle name/full name?
test-250724	Is Lebanon a good holiday destination?
test-250725	What are some things to know before visiting Lebanon?
test-250726	"What are you doing to ""be the change you want to see in the world""?"
test-250727	Are you truly willing to become the change you want to see in the world?
test-250728	Did Capgemini Recall the terminnated peiple who are all Not ckeared the training Exam?
test-250729	Do psychopaths have the desire to feel emotions?
test-250730	As I was using my calculator my phone said unmounting SD card and factory reset is in process how do I recover all my photos that have been resetted?
test-250731	Have you ever recommended something to someone then later regretted it?
test-250732	How do hedge fund manager decide what stock to buy?
test-250733	How do hedge fund managers decide how to compensate themselves?
test-250734	What is the connection between history and government?
test-250735	What is the difference between Mythology and History?
test-250736	Do some women really like swallowing semen? Why or why not?
test-250737	Can swallowing of semen during oral sex lead to pregnancy?
test-250738	What is the difference between JEXPO & VOCLET?
test-250739	What's the difference between the CBEST and the CSET?
test-250740	I sleep too much. Am I lazy or ill?
test-250741	Is sleeping too much a bad sign of health? Is it something to be worried about?
test-250742	What are the best black metal documentaries?
test-250743	What blood test do they run when you go to the emergency room?
test-250744	"""How to"" know bank nps account in google?"
test-250745	What exercises are necessary to play badminton as a player?
test-250746	"How should we reply to the question ""Who are you""?"
test-250747	"What is an interesting reply to the question ""what are your hobbies""?"
test-250748	My boyfriend broke up with me. He says I'm a wonderful girl but I deserve better, and that he will always think of me and be there for me. He blamed himself a lot for making me lose my independence and being rational. Can a man love someone that much to let go or are they excuses?
test-250749	I love this guy so much and he used to love me too but lately he says he feels different about loving me. What could be the problem?
test-250750	What are the chances of seeing Hyperloop in India in the near future?
test-250751	Will the caste-based reservation system come to an end in India?
test-250752	How does a woman prepare for anal sex?
test-250753	How would you convince your partner if he/she considers anal/oral sex a taboo?
test-250754	Where does the water from the Great Lakes come from, and how does these lakes wildlife compare to Randsfjorden?
test-250755	Where does the water from the Great Lakes come from, and how does these lakes wildlife compare to Mjosa?
test-250756	What will be Hillary Clinton's strategy for India if she becomes US President?
test-250757	What will Hillary Clinton's India policy be if she becomes President?
test-250758	Why doesn't Virginia have any major professional sports teams?
test-250759	Why don't more of the major U.S. professional sports leagues and teams offer the ability to watch games online?
test-250760	For how long does WhatsApp keep messages available? How much time can I go back to load earlier messages?
test-250761	Can a WhatsApp message go from two to one tick? I swear it just happened.
test-250762	Why does the United States government allow China to place a huge import tax on American goods and yet let them flood the American market with cheap low quality goods?
test-250763	Are Americans letting Trump (and the media) blind them with his Cabinet media circus so that people don't focus on the important issues?
test-250764	Where do the films in The Man in the High Castle come from?
test-250765	Why is Amazon's adaption of The Man in the High Castle so boring?
test-250766	Can albino people tan?
test-250767	Do albino people have clear blood?
test-250768	How can I reduce love handles and thigh fat?
test-250769	How can I reduce my belly fat? I do crunches everyday.
test-250770	How should you spend your 20s if money isn't a concern?
test-250771	What is the best way to spend your 20s?
test-250772	Is time travel possible and if yes can we travel only in past or future or both?
test-250773	Is Time travel possible under known physics principles?
test-250774	Is there Any chance of getting a seat in PES University with 4414 rank in PESSAT 2016?
test-250775	Will I get Mechanical in PES with a rank of 2197 in PESSAT 2016?
test-250776	What is wedding gift etiquette? How much should you spend?
test-250777	How much should the gift that you give to your friend on his wedding be worth?
test-250778	How do I get incoming and outgoing call details of a particular prepaid number here in India?
test-250779	How do get my incoming postpaid call details?
test-250780	What is the complimentary breakfast like in OYO Rooms?
test-250781	What is the average package offered by OYO Rooms?
test-250782	Why does my mom shout at me?
test-250783	Why does my mom hate me?
test-250784	What is the best epub reader for windows?
test-250785	What is the best way to read EPUB on a Windows?
test-250786	What would happen if you took 3000 mg acetaminophen at once?
test-250787	What would happen if I took 6000 mg of acetaminophen?
test-250788	What are some symptoms of OCD?
test-250789	What are symptoms of OCD?
test-250790	What is an azad visa for Dubai and how is it different from other visas?
test-250791	How do I get a Hong Kong visa from Dubai?
test-250792	What constitutes harassment?
test-250793	What constitutes sexual harassment?
test-250794	Where can I study cosmology in india?
test-250795	What are the prospects of studying and doing cosmology in India?
test-250796	What are some examples of democracies that have failed?
test-250797	What are some examples of democracy failing?
test-250798	Why is social security considered a form of socialism?
test-250799	Is a Social Security system a form of socialism?
test-250800	What is the use of doing mba?
test-250801	What is the use of MBA?
test-250802	How can I improve my communication skill in english?
test-250803	What should I do to improve my spoken English?
test-250804	How many hours did Steve Jobs work per day?
test-250805	How were the last days of Steve Jobs spent?
test-250806	Are there any reliable IQ test websites that give accurate results (free)?
test-250807	On which website can I test my IQ and get a reliable result?
test-250808	Is there any standard/common ratio between the size of erected and normal penis?
test-250809	If you have a dream about a person finding out a secret about you does it come true?
test-250810	Why did Wales vote to leave the EU?
test-250811	[Before Brexit vote] What are the pros and cons of Britain exiting/staying in the EU?
test-250812	Should I use Swift or Objective-C to learn iOS development?
test-250813	What is the best language to learn after iOS (Objective-C and Swift)?
test-250814	Somebody hit my rear bumper, but there's no visible damage. Should I file a claim with insurance?
test-250815	 I didn't file a police report for a car accident that happened over a month ago. My insurance company won't pay for damage, what do I do?
test-250816	What is the easiest way to improve my vocabulary?
test-250817	What is the best way to increase your vocabulary?
test-250818	I'm so disgusted. I want to study film but I've been rejected by every college I've applied to. What should I do?
test-250819	I have been rejected by all the colleges I have applied to. What should I do now?
test-250820	What do you think about the future of the IT industry in India?
test-250821	What is the future of the IT sector in India?
test-250822	Admission to university of Michigan?
test-250823	In the future, when people think of Aleppo, will the city be remembered for its rich history or will that be overshadowed by conflict?
test-250824	Will the Samsung Galaxy J7 get Android N (Nougat)?
test-250825	When the Samsung j7 will get the marshmallows (Android M 6.0) update?
test-250826	What's it like for a celebrity to meet another celebrity?
test-250827	What is it like to party with a celebrity?
test-250828	Are all five Trump kids going to have Secret Service protection?
test-250829	Is the Trump Tower protected by the Secret Service?
test-250830	Which books should I buy in BDS 1st year. In anatomy bdc or anands. In biochem vasudeva OR satyanarayan. In physio ak Jain OR sembulingam?
test-250831	Is there an Iyengar Yoga centre in Bangalore? Where?
test-250832	I'm passionate about animals but do not have the math and science skills it takes to be a vet. What career can I do?
test-250833	How do I choose my career when I'm not really completely passionate about anything?
test-250834	Does practising Surya Namaskar (Sun salutation) help in reducing belly fat?
test-250835	Does surya namaskar help reduce belly fat?
test-250836	How do you learn Hebrew?
test-250837	What is the best way to learn Hebrew (for Arabic speakers)?
test-250838	When an airplane crashes and kills all of its passengers, what specifically causes the people to die?
test-250839	How does it feel to survive an airplane crash?
test-250840	What should I do? How can I be happy?
test-250841	How did you become happy?
test-250842	How does Southern Italian cuisine differ from Northern Italian cuisine?
test-250843	What was Italian cuisine of the 14th century like?
test-250844	Which is more difficult to use for web development, python or php?
test-250845	Why should I use Python for web development when PHP is so easy to deploy?
test-250846	What makes an element isoelectronic? What are some examples?
test-250847	What makes an element isoelectronic?
test-250848	How can a skinny guy gain weight and develop a fit body?
test-250849	I am a little skinny guy. How much time will it take to make my body gain weight, provided I exercise-and-eat well enough?
test-250850	Why men should respect women?
test-250851	Why are women not respected as men are?
test-250852	"What's it like to attend a high school that includes ""intelligent design"" in the science curriculum?"
test-250853	How is the CSE faculty at MUJ?
test-250854	How do I learn PHP?
test-250855	I am a front end developer.What is the best online resources to learn PHP?
test-250856	How can I get gold and food faster in Clash of Kings?
test-250857	How do you get Netflix on Xbox 360 without Gold?
test-250858	Is it possible to get malware from a infected computer on the same wifi?
test-250859	How can I get rid of malware in my computer?
test-250860	How do you fall out of love?
test-250861	How does one fall out of love?
test-250862	How can I improve in English?
test-250863	How can I improve my communication skill in english?
test-250864	If I change my location on Tinder plus, will I still be shown on my previous location?
test-250865	If location is visible on Tinder and the app is deleted, what does that mean?
test-250866	Can gated communities or neighborhoods have restrictions on association such that community members can be ejected for membership in gangs, etc?
test-250867	What are the applications of natural resource economics?
test-250868	What is the standard size of a logo for websites and blogs?
test-250869	I need a logo design for my business, Can anyone help me?
test-250870	What are the best colleges to do MS in automobile engineering abroad?
test-250871	Which are the best colleges to do MS in industrial engineering?
test-250872	"What is a ""nonpolar molecule""? What are some examples?"
test-250873	What are some examples of polar and nonpolar solvents?
test-250874	Which is the Best iit foundation school in vijayawada?
test-250875	Is IIT Kanpur the best?
test-250876	Do you like Paris Hilton Look?
test-250877	What is Paris Hilton like in person?
test-250878	What are qualities in a good boyfriend?
test-250879	What are the qualities of a good mother?
test-250880	Is the Facebook app not working for you on Android right now?
test-250881	Has the Facebook app on kindle gone awry right now?
test-250882	Is it possible to learn programming irrespective of the languages in a month?
test-250883	Is it possible to learn programming in a month?
test-250884	Have someone in the past tried to change the electoral system in USA? (Majority of national votes instead of colleges)
test-250885	Why is the credibility of Quora writers not verified/ checked?
test-250886	What are the most interesting products and innovations that Marathon Oil is coming out with in 2016?
test-250887	What are the most interesting products and innovations that Oil-Dri is coming out with in 2016?
test-250888	How to gain weight ?
test-250889	Ways to gain healthy visible weight in 30days?
test-250890	What's the best job to work for as a 16 year old girl?
test-250891	What is the best job to have as a 16 year old?
test-250892	What is the difference between lint and fibre?
test-250893	What does dryer lint consist of?
test-250894	Is there any chance of Gary Johnson winning the 2016 elections?
test-250895	What would be required for Gary Johnson to win?
test-250896	Is the IBD/TIPP poll really the most accurate?
test-250897	I have £600 to invest, how can I increase it by 10% in 6 months?
test-250898	How do I get free UPSC coaching as I am from OBC and resident of karnataja?
test-250899	I am from OBC category and I have already dropped 1 year. How much mark I need to score to get civil branch in NIT Rourkela?
test-250900	How do I get over my boyfriend with whom I broke up after finding out he is ashamed of me because of my religion?
test-250901	I am an unborn fetus. Am I too late to start programming?
test-250902	What is the hardest thing(s) about raising children in Switzerland?
test-250903	What is the hardest thing(s) about raising children in Japan?
test-250904	What are the best dance school for kids in greater noida near beta 2?
test-250905	Does Rolaids or Ranitidine lowers blood pressure?
test-250906	What are the reasons to learn Latin?
test-250907	Is there any point in learning Latin?
test-250908	How do I get a notification when a specific WhatsApp contact goes online on Android or iOS?
test-250909	Why is Whatsapp for iOS and Android platforms different functionality-wise?
test-250910	Is David Icke insane, or is there anything he could possibly be right about?
test-250911	Satire: Is David Icke actually a satirist?
test-250912	What are the different type of business can start in dubai?
test-250913	What are the different new type of business that I can start?
test-250914	Is citric acid classified as a weak or strong acid?
test-250915	What is the difference between strong acid and corrosive acid? Why aren't some strong acids highly-corrosive but some weak acids are highly-corrosive?
test-250916	What are the most loved novels of our time?
test-250917	What are some really well-written novels of our time?
test-250918	Why is America great?
test-250919	What is America great at?
test-250920	What is the episode where The Doctor gives River Song his sonic screwdriver?
test-250921	"In ""The Big Bang"" episode of Doctor Who, how does River Song remember to give her diary to Amy when the Doctor has been wiped out of everyone's memory?"
test-250922	What is the difference between software engineer and staff software engineer?
test-250923	What is the difference between a software engineer and a software architect?
test-250924	What are the places visited by foreign tourists in Tamil Nadu, India?
test-250925	What are the technologies with less learning curve and become productive in minimal time? One thing that strikes to my mind is informatica.
test-250926	How much caffeine is there in Lipton with citrus green tea?
test-250927	Is Lipton green tea with citrus good for you?
test-250928	Is water considered polar or nonpolar? Why?
test-250929	Is water nonpolar or polar?
test-250930	Is RBAC implementation suitable to build feature based platform?
test-250931	How do you start building a platform like Tumblr?
test-250932	Bioinformatics: What are the workplaces/areas with the highest density of bioinformaticians in the world?
test-250933	What are the origins of bioinformatics?
test-250934	What rank should I expect in JEE advanced 2016 with a score of 240 out of 372?
test-250935	What rank will I get with 185/372 marks in JEE advanced 2016?
test-250936	How can I help my gifted child become a fulfilled and socially well adjusted adult?
test-250937	Clinical data management or pharmacovigilance?
test-250938	Which are the best dental clinic in Singapore?
test-250939	Which is the best dental clinic in Chennai?
test-250940	In the movie Inception, when Cobb and Mal were in limbo, why was only Cobb aware to return to the reality and Mal wasn't?
test-250941	What is the impact of the Great Leap Forward on China?
test-250942	What is mole concept?
test-250943	What is the mole concept?
test-250944	Which sex position is good for beginners?
test-250945	I am having a moral crisis of whether to visit a prostitute. I am a 26-year-old virgin. What should I do?
test-250946	"Who will be the first member of Congress to shout, ""you lie!"" during Trump's first State of the Union Address?"
test-250947	In 2017, when the new President delivers his or her first State of the Union Address, will Congress stand and clap (and not boo) the customary amount?
test-250948	How can you get rid of flying termites in a house?
test-250949	How can I get rid of flying termites?
test-250950	What are the cons of GST bill?
test-250951	What is GST bill? What are its pros and cons?
test-250952	Can I change from offline to online for the JEE Main paper?
test-250953	Do JEE Mains change greatly from year to year?
test-250954	Which president of the United States kept the most promises during his presidency that he made during his campaign and which kept the least?
test-250955	Which Presidents of the United States have actually kept all of the promises that they made during their elections?
test-250956	How do I prepare for the Wiskunde T entry exam for Delft University of Technology?
test-250957	Why is my Airtel 4G/3G suddenly not working on my iPhone?
test-250958	How can I submit a question simultaneously with its details in Quora?
test-250959	Is there anyway to create a question and its details at the same time before it's published on Quora?
test-250960	After complitication of diopama is there any chance to get seat in the ISOFE?
test-250961	My rank is 400 in CLAT 2016. Is there any possibility that I might get admission into WBNUJS under Domicile Quota?
test-250962	What are the pros and cons of being old?
test-250963	Why don't older people wish to be younger?
test-250964	How do I recreate this icon in Photoshop?
test-250965	With what movie villain/antagonist can you most sympathize and identify?
test-250966	Is it possible to create synthetic gold?
test-250967	Is it possible to turn lead into gold?
test-250968	How can I cancel my equinox membership?
test-250969	What is the price of a single membership to Equinox (gym)?
test-250970	How soon should one eat breakfast after waking up?
test-250971	What is your morning ritual?
test-250972	What is the future scope for logistics and supply chain management in India & abroad?
test-250973	What is the scope of logistic and supply chain management mba?
test-250974	Which is the best website for nagpuri video songs?
test-250975	Which is the best website to download video songs?
test-250976	What is underwater hockey?
test-250977	What are some underwater games?
test-250978	What are best ways to cut down expenses?
test-250979	What are some unusual yet effective ways of cutting down on household expenses?
test-250980	Which coding style of “if else” is recommended in Java?
test-250981	Is Google C++ Style Guide heavily influenced by Java coding practices?
test-250982	How could the Stuxnet malware damage/destroy the Bushehr nuclear plant?
