test-16480	What are your best moments in graduation?
test-16481	What are the best memories from your engineering college life in India?
test-16482	Is it suitable that more young people hold important positions in government?
test-16483	Why is religion more important to people than love and peace?
test-16484	When did you write your first poem?
test-16485	How can I write a poem about a blue bird?
test-16486	Should jam be refrigerated?
test-16487	Why is jam mostly made of strawberries?
test-16488	What is the normal broker fee for renting an apartment in NYC?
test-16489	What is the average broker fee in NYC?
test-16490	How can I give more concentration on study rather than my phone?
test-16491	What should I do to focus on my studies rather than Quora?
test-16492	What are the rankings according to marks in the GATE in EE?
test-16493	Up to what AIR rank in the GATE EE stream can any PSU call for an interview (for OBC)?
test-16494	Who will win the 45th match between U Mumba (Mumbai) and Telugu Titans in Pro Kabaddi Season 4 2016?
test-16495	Who will win the 16th match between Bengal Warriors and U Mumba (Mumbai) in Pro Kabaddi Season 4 2016?
test-16496	What are the effects of Brexit on india?
test-16497	How will Brexit affect India?
test-16498	How should a 12 year old invest his money?
test-16499	How should a 22-year-old invest his/her money?
test-16500	Which is best detachable laptop under ₹30k?
test-16501	"How did the characters die in ""And Then There Were None"" by Agatha Christie?"
test-16502	Micheal Jackson, Metallica, and Joseph Stalin: Who made the best music?
test-16503	How do I move BPO to Hr and talent development?
test-16504	What does RSVP stand for?
test-16505	What does FOAR stand for?
test-16506	"What does the Chinese word ""女漢子"" mean?"
test-16507	"What does the Chinese word ""煥森"" mean?"
test-16508	What are symptoms of a hormonal imbalance?
test-16509	What is hormone imbalance?
test-16510	Can you get pregnant on high fertility days?
test-16511	What are the best ways to get pregnant during your fertile days?
test-16512	How can I manage my exam anxiety before and during state exam period?
test-16513	How can I overcome anxiety before examinations?
test-16514	What are some odd, interesting, or important U.S. Supreme Court cases?
test-16515	How do U.S. Supreme Courts affect laws?
test-16516	Do thoughts face existential crisis?
test-16517	Is it harder for introverts to lose weight?
test-16518	Is a black suit with black shirt and a formal grey tie professional attire for an interview?
test-16519	What color shirt and tie should I wear with a gray suit to a wedding?
test-16520	What is the best time for exercise, before breakfast or after breakfast?
test-16521	When is the best time to workout, before or after a breakfast?
test-16522	Given coordinate of a polygon and a point. How do I compute if the point is located inside the polygon?
test-16523	Given the coordinates of n polygons, how can I find out how many polygons are contained inside an i-th polygon?
test-16524	What would happen to the world if all forms of technology disappeared for one day?
test-16525	If the Earth had a capital, what would it be? And why?
test-16526	Where can I found very safe and secure house painting services in Brisbane?
test-16527	Where can I get affordable Interior home painting and Exterior House painting services in Brisbane?
test-16528	How probable is that Trump might chose Milo Yiannopoulos as Press Secretary?
test-16529	How consistent are Estes B6-4 engines?
test-16530	How did Russia become so powerful?
test-16531	Which country has paramount power, the USA or Russia?
test-16532	How can I get good grades?
test-16533	How do I get good grades in MS?
test-16534	What is it like to be a college cheerleader?
test-16535	What is it like being a cheerleader?
test-16536	How do I increase my cock size?
test-16537	How can I increase girth of my penis?
test-16538	If Hillary Clinton win, would Bill Clinton live in the White House again as first husband?
test-16539	If Hillary Clinton is elected President will Bill move into the White House with her?
test-16540	What is a cunning smile and how does it look?
test-16541	What will a girl think if I look at her and smile casually?
test-16542	If we evolved from monkeys, why are there still monkeys?
test-16543	If we didn't evolve from monkeys, what did we evolve from?
test-16544	What is a difference between a small bank and a payments bank? And the need for it?
test-16545	What is the difference between consumer/ commercial and retail banking?
test-16546	Who can share valid Microsoft 70-331 PDF Dumps and 70-331 VCE Dumps as 70-331 exam preparation?
test-16547	Why do we sleep?
test-16548	What are the advantages of using RandomForest Regressor?
test-16549	What are some namesof hair gain tonics?
test-16550	How does a girl shows some hints to the guy she likes?
test-16551	How do you give a guy hints that you like him?
test-16552	What is the best way to keep your phone aside and concentrate on studies?
test-16553	How do I keep my mind intact to do my studies?
test-16554	If Hillary Clinton is indicted before the Democratic convention, will super delegates move to Bernie Sanders?
test-16555	In the case that Hillary Clinton gets indicted before the convention, whom would be nominated?
test-16556	"Conversations: What is the best/worst answer you have heard to the question :""Aur bata kya chal raha?(What's up?)"" ?"
test-16557	Why do some people answer a question with a question? Is this really useful?
test-16558	Why hasn't Turkey acknowledged their part in the Armenian Genocide?
test-16559	Why hasn't Turkey acknowledged the Armenian Genocide?
test-16560	Does the OnePlus 3 dailer support video calling? Is there any other way to make regular video calls?
test-16561	How do I make a video call?
test-16562	What is the best treatment to a chronic disease?
test-16563	What is the best treatment for a chronic migraine?
test-16564	Which are the most unbaised english newspapers in India?
test-16565	India: Why does the Indian newspaper The Hindu use standard English, not simple English?
test-16566	"What is the meaning of the ""Lemon Tree"" in a song written by Fool's Garden?"
test-16567	What song has you obsessed right now?
test-16568	Dominion (card game): What are some good Explorer strategies?
test-16569	Dominion (card game): What are some good Mine strategies?
test-16570	What is the mht-cet score needed to get into MIT, Pune for UG in mechanical engg.?
test-16571	Is there any way to get into MIT, Pune without the MHT-CET / JEE Mains score for UG in mechanical engineering?
test-16572	Is Donald Trump really a democrat who is trying to get Hillary Clinton elected as president?
test-16573	Is Hillary Clinton secretly paying Donald Trump to throw the election?
test-16574	How can I attain orgasm without ejaculating?
test-16575	How does one ejaculate without achieving orgasm?
test-16576	Which is the best hollywood movie I can ever watch?
test-16577	What are the best Hollywood movies?
test-16578	What are some factors that affect a computer's performance?
test-16579	How is human health affected by computers?
test-16580	Which is the best earphone without mic under Rs 1000?
test-16581	Which are the best earphones with mic (truebass) under Rs. 1000?
test-16582	I'm getting 31.20 marks in XAT 2017. What will be my percentile near to? Is there any chance of I getting a call for HRM?
test-16583	How much percentile can one expect with an overall of 28 marks in XAT 2017?
test-16584	How do I convert PAYBACK Points to money?
test-16585	How do I turn PayPal money into cash immediately?
test-16586	What do I do if I want to kill myself but don't have the courage?
test-16587	I have no desire to do anything. I don't enjoy my life at all. I am not depressed, but I just don't want to do anything. What do I do to regain myself?
test-16588	Which is the best faculty of Mathematics for JEE Prep & how can I avail their lectures?
test-16589	Which is the best faculty of Chemistry for JEE Prep & how can I avail their lectures?
test-16590	Why do male and female athletes wear such different styles of clothing?
test-16591	Why do males love female clothes?
test-16592	What framework of JavaScript will be in most demand over the next couple years?
test-16593	What are the javascript frameworks that are likely to be popular at least until the year 2017?
test-16594	What is your favourite startup? Why?
test-16595	Which is your favorite startup and why?
test-16596	Which stock market analysts have had the most accurate predictions over the past five years?
test-16597	What would be the topic of poster NID 2017?
test-16598	How much time does it take to ride the NYC MTA 'L Train' from one end to another?
test-16599	What is it like taking a train from Scranton to NYC?
test-16600	What were the major contributions of the political leaders during WW1, and how are the compared to the ones during the Second World War?
test-16601	What were the major contributions of the political leaders during WW1, and how are they compared to the ones during other major armed conflicts?
test-16602	What are some good project ideas which can be done within one month for an HCI (human-computer interaction) course by using modern interfaces and virtual reality drones like Oculus Rift?
test-16603	What does Facebook plan on doing with its oculus rift acquisition? Can we expect more virtual and augmented reality from Facebook in the near future?
test-16604	How do I get rid of acidity and headache?
test-16605	How do I get rid of half headache?
test-16606	How can you check your SBI account?
test-16607	How do you check your SBI account number?
test-16608	What is candid?
test-16609	What is a candid picture?
test-16610	What are the causes of increase in height after the age of 18?
test-16611	How can you increase your height?
test-16612	Why is it that if I masturbate a lot my left testicle has some pain, but never my right?
test-16613	Why is the left testicle lower than the right?
test-16614	How do I recover a hacked instagram?
test-16615	How do I hack and retrieve Twitter and Instagram account?
test-16616	What is distributed system?
test-16617	What is a power distribution system?
test-16618	What is register file?
test-16619	What is register in c?
test-16620	How can Quora count the views as long as when anyone click on the question all the answers appear?
test-16621	How does Quora count views?
test-16622	If two blocks having mass (m1) and (m2) are pushed with a force F on a frictionless surface and begin moving with a uniform acceleration 'a', what would be the force between the two blocks?
test-16623	If friction is equal to the applied force, is the body at rest or in uniform acceleration? If the object is at uniform acceleration, it's moving. How will the object move if the applied force is not greater than friction?
test-16624	Do you think legalization of prostitution will make things better for women?
test-16625	Does legalizing prostitution help or hurt women?
test-16626	What do people across the world think of British people?
test-16627	Do I need to learn Linux and terminal if I want to become a developer?
test-16628	How do you get platinum from a catalytic converter?
test-16629	Besides platinum+rhodium for NOx reduction and platinum+palladium for CO reduction, which catalyst can be used in catalytic converters?
test-16630	What do you need to immigrate to Canada?
test-16631	If I wanted to immigrate to Canada, what do I need to know?
test-16632	How could I teach my “not so tech savy” mother to use a touch screen mobile phone?
test-16633	Why is energy released or absorbed?
test-16634	How did Life (2017 movie) get greenlit? What's the backstory of how the movie got made?
test-16635	How did Jumanji (2017 movie) get greenlit? What's the backstory of how the movie got made?
test-16636	What made Lionel Messi to retire from International football?
test-16637	Why is Lionel Messi retiring from Argentina's national team?
test-16638	What are your favorite 20 movies of all time?
test-16639	What are your favorite movies and why?
test-16640	I forgot my password and the email address I used to create my Snapchat account. How can I log in or at least change my email address or password?
test-16641	What can I do if I forgot the email address to access my Tumblr account?
test-16642	Why am I afraid of authority?
test-16643	Why am I afraid of telling my boyfriend I love him?
test-16644	Is Fairy tail (manga/anime) nearing to its end?
test-16645	Where in the manga does the last episode in Fairy Tail 2014 end?
test-16646	What changes did the AAP bring after winning?
test-16647	What has changed in Delhi after AAP came to power in 2015?
test-16648	What are the best C# books for beginners?
test-16649	Which are the best books to learn C?
test-16650	Why is milk served on a wedding night?
test-16651	Why do Indians drink milk before the wedding night?
test-16652	What is the best kind of Patron tequila?
test-16653	Is buying Patron Tequila worth the cost?
test-16654	How should I deal with a bad neighbor?
test-16655	How do I deal with bad neighbor?
test-16656	I am a voice actress posting my records on sound cloud, so how I can increase my followerse?
test-16657	What is best place to sell phone in cuttack?
test-16658	What were the major contributions of the political leaders during WW1, and how are the compared to the ones during the Russian War?
test-16659	What were the major contributions of the political leaders during WW1, and how are the compared to the ones during the Polish Succession?
test-16660	"What are some synonyms for ""looking forward to""?"
test-16661	What are synonyms used for?
test-16662	What are the names of these flowers?
test-16663	What is the name of this flower?
test-16664	Which is cheaper, Airtel prepaid or postpaid, including calls and internet usage?
test-16665	Is it possible to get my own call records for a prepaid number from airtel?
test-16666	The way Kashmir is being handled, can India be called a democratic country ?
test-16667	Why is India a democratic country?
test-16668	What are the different password encryption methods?
test-16669	How do I manage password storage of administrators and users on the website? Should they be stored in different tables or the same? What algorithms should be used to encrypt them?
test-16670	What are some interesting stories about the rivalry between Dr Rajkumar and Dr Vishnuvardhan?
test-16671	What is the best thing you can do in Bangalore?
test-16672	How do I divert my mind from Quora to studies?
test-16673	How can I concentrate in studies and stop my mind from distractions?
test-16674	Which side would china take if the Korean war continues today with preemptive strikes on the North's nuke facilities?
test-16675	Why is China supportive of North Korea?
test-16676	Does a girl really prefer an intelligent guy over a physically attractive guy?
test-16677	Do Asian girls like black guys?
test-16678	What kind of guys do girls fall for?
test-16679	What kind of girls do guys fall for?
test-16680	WhatsApp: How do I use WhatsApp on a desktop/laptop?
test-16681	Are any of the WhatsApp desktop clients any good?
test-16682	How do I avoid food poisoning?
test-16683	How can I avoid food poisoning in China?
test-16684	Can dogs see spirits or sense the supernatural?
test-16685	Can dogs sense bad spirits? Why or why not?
test-16686	What are Virat Kohli's education qualifications?
test-16687	Why is Virat Kohli so abusive?
test-16688	What were your reeasons for getting divorced?
test-16689	What are the reasons to divorce?
test-16690	Which is better for EC vlsi PEC vs NIT kurukshetra?
test-16691	Which one is better: CSE in PEC or CSE in NIT Kurukshetra?
test-16692	What is the dumbest question you ever read on Quora?
test-16693	What is the most stupid question and answer(s) on Quora?
test-16694	How is iPhone 6 made?
test-16695	How was the iPhone made?
test-16696	How can I port from Vodafone postpaid to prepaid?
test-16697	Which is better idea prepaid or postpaid?
test-16698	"What is the correct pronunciation of ""bruschetta""?"
test-16699	"What is the correct pronunciation of ""Thais""?"
test-16700	Is conditioner good for your hair?
test-16701	What is hair conditioner for?
test-16702	Fish Roe: What is the difference between caviar, tobiko, and ikura?
test-16703	How do you make Texas Caviar?
test-16704	How much gravitational force does the earth have? How is this determined?
test-16705	When will the earth lose its gravitational force?
test-16706	Why do mobile batteries drain faster when we are travelling?
test-16707	What consumes less battery on a smartphone - WiFi or 3G? Why?
test-16708	What is a movie that defies Newton's Third Law of motion?
test-16709	Is Newton's third law of motion followed everywhere?
test-16710	What does anal sex feel like?
test-16711	What is it like for a guy to have sex for the first time?
test-16712	What are the best places to visit at bhopal?
test-16713	What are the best places to shop in Bhopal?
test-16714	How can I improve on my social skills as an introvert?
test-16715	How can I improve my social skills?
test-16716	What is a layman’s description of how Brexit can affect India?
test-16717	How would the outcomes of Brexit affect Indian Economy?
test-16718	What do you think about cabbage?
test-16719	What do you season cabbage with?
test-16720	What is the best smart phone for a teenager?
test-16721	Which is the best smartphone ?
test-16722	Where can I get inflatable castles for hire in Sydney?
test-16723	Where can I get a very easy online booking system for jumping castles in Sydney?
test-16724	What is directional and non-directional bonding?
test-16725	What is in the future of chemistry?
test-16726	I am currently working with IBM and has 2.8 exp. I got offer from Infosys 4.8 lpa with 3a band and my current package is 3.5lpa. Should I switch?
test-16727	How can I make my life philosophy into a business?
test-16728	What is your review about MS Dhoni trailer?
test-16729	What are your thoughts on Batman v Superman: Dawn of Justice Trailer 2?
test-16730	Which novel should I read?
test-16731	How do I decide which novel I should read?
test-16732	Why have we never found Jesus's body?
test-16733	As Jesus was a rabbi, and in his day that meant he had to be married to be one, why is this never mentioned?
test-16734	What does life mean to you in one word?
test-16735	What does life mean to you?
test-16736	How many players play on a soccer team and what are their positions?
test-16737	How many starting players are on a soccer team? What are their positions?
test-16738	What's are your resolutions for 2017?
test-16739	What will be some of the most productive new year resolutions for the year 2017?
test-16740	How many times Arms workout should be done?
test-16741	Indian army strength 2016?
test-16742	Do boys sometimes show attitude to girls they like?
test-16743	What kind of attitude do boys have to maintain while chatting or talking with girl?
test-16744	I am 17 years old and I always feel lonely in my life. I don't know why it's happening . What is the cure of it?
test-16745	I am thinking of living my life alone. I am 15. Is that a good idea?
test-16746	What is better to use: a waterfall model or Agile?
test-16747	What are some good ways to do agile modeling?
test-16748	What is the minimum rank I should get in AIPMT for admission in AFMC, Pune?
test-16749	Apart from ToELR and interview what are other criterion for admission in AFMC, Pune ?
test-16750	How can I stop daydreaming of my future?
test-16751	Is there a tendon that goes across the arm bone?
test-16752	GOI bans 500 and 1000 rupee currency notes, what will be the implications of it on Indian economy?
test-16753	Will the value of Indian rupee increase after the ban of 500 and 1000 rupee notes?
test-16754	Are werewolves technically undead? If yes, can werewolves still be strangled/die of drowning? They seem to breathe.
test-16755	If I was born 10,000 years ago and was time traveled to the present, would I still die before the age of 30?
test-16756	I want to name my design studio, what should be it's good name with good meaning?
test-16757	What pressure should my Worcester boiler be at?
test-16758	League of Legends: How do you effectively play Nidalee in the jungle?
test-16759	League of Legends: How do you effectively play against a jungle Nidalee?
test-16760	Why are black people more likely to get killed by a cop than white people ?
test-16761	Why did white people enslave black people?
test-16762	What are some good substitutes for butter beans?
test-16763	What are good substitutes for clarified butter?
test-16764	How do Check Into Cash places work?
test-16765	How do check cashing places work?
test-16766	Which one is better for data manipulation in python: Pandas or SFrame?
test-16767	Which is better for data analysis: R or Python?
test-16768	Is it possible to enlarge penis?
test-16769	Is it possible to enhance penis?
test-16770	What are the best settings in Photoshop to get a high-quality animated GIF in a small file size?
test-16771	What are the max file size and dimensions for animated GIFs on Google+?
test-16772	Why do dey call 5k or 10k instead of 5000 or 10000?
test-16773	Where can one raise funds for an online service? ($5k-$10k)
test-16774	Android (operating system): How do I install Gujarati language in a Moto G 2nd generation (Android 5.0.2)?
test-16775	I have a Moto G with an Android version 4.4.4. Do I need to buy a new phone to use the new Lollipop version 5.0?
test-16776	What does an IQ score of 137 mean?
test-16777	My IQ score is 67. What does that even mean?
test-16778	How do I become buff with bodyweight training?
test-16779	How can a really skinny guy get buff?
test-16780	Why white people trend to be Pedophile than other races?
test-16781	Can you use nicknames in quotes on Quora?
test-16782	How can I earn enough money to purchase home in Noida or Gurgaon?
test-16783	A quack charged me rs.400 just for a refractive pwr test. I told him that m also a mbbs student . he didn't cared about the ethics. What should I do?
test-16784	How much do you need to start a restaurant?
test-16785	How much investment do I need to start a restaurant in Canada?
test-16786	Why do so many people suspect the effectiveness of Chinese medicine?
test-16787	Why do so many Asians believe in the effectiveness of Chinese medicine?
test-16788	"In ""Macbeth"", why does Macduff go to London?"
test-16789	In Macbeth, why does Macduff flee to England?
test-16790	What were some of the bad things about the British Empire?
test-16791	Why did the British and French Empires find it so hard to defeat the Nazis during WW2 despite Germany being comparatively minuscule in size?
test-16792	Where is the hard drive on Xbox 360?
test-16793	Does the Xbox 360 come with a hard drive?
test-16794	How many days are given to unfit candidates to appeal in ssb?
test-16795	What are the tips to crack the SSB interview?
test-16796	When I turn my head I get a sharp pain in my upper back—what can I do about it?
test-16797	I have severe upper back pain due to a golf swing. What can I do?
test-16798	What would be the best credit card for a responsible teenager?
test-16799	What is the best credit card for young adults?
test-16800	What is the meaning of glycolysis?
test-16801	What is glycolysis? What is the purpose of it?
test-16802	Which coaching institute is best for IAS?
test-16803	Which is the best coaching institutes for IAS?
test-16804	How much time does it take to download OS X Mavericks?
test-16805	How do you install OS X Mavericks on an AMD PC?
test-16806	What should I study for being a cyber security expert?
test-16807	What should a high schooler do to become a cyber security specialist?
test-16808	How can I cool my face?
test-16809	How can I be cool?
test-16810	What is the future after SBI PO?
test-16811	What is difference between SBI SO and SBI PO?
test-16812	Why Tata replaces Cyrus Mistry as chairman with Ratan Tata?
test-16813	Why was cyrus mistry sacked?
test-16814	Is the Bhagavad Gita overrated?
test-16815	Is reading the Bhagavad Gita worth it?
test-16816	What are the best 10 Hindi Bollywood songs having funny English translations?
test-16817	Why do Bollywood movies mix English and Hindi?
test-16818	What do women know about men that men don't know about themselves?
test-16819	What should women know about men?
test-16820	Where can I get best quality Fire Alarm Panels in Sydney?
test-16821	Where can I get best quality fire alarm system in Sydney?
test-16822	Are there Mac beauty products in raipur?
test-16823	I got into GNLU. Is there anything I should know before coming there?
test-16824	Are there marine aviators who can land on aircraft carriers?
test-16825	Could the space shuttle land on an aircraft carrier?
test-16826	How long did it take for Uber to reach 1M downloads?
test-16827	How long did it take for Uber to reach 1M users?
test-16828	How can you treat an infected rook?
test-16829	How can I treat an infected conch piercing?
test-16830	What does className (1, 0).method() return in Python? Or should it always be objectName instead of className?
test-16831	Why does -1**(even_number) return -1 in Python?
test-16832	"What is ""cancelled without prejudice,"" rubberstamped on a US visa?"
test-16833	I have an approved H1B visa till 2018, but not yet stamped. Can I apply for a tourist visa and travel to US? Will that cancel my H1B?
test-16834	How long has Barack Obama been the United States President?
test-16835	Is there anyone in the United States more powerful than Barack Obama?
test-16836	How much money in US dollars is 1 crore rupees?
test-16837	What is the INR equivalent to 1 billion USD?
test-16838	What is the capital city of Syria? Is it Raqqa or Damascus? I came across with these two names while reading newspapers!
test-16839	Was Georgia O'Keeffe a champion mud wrestler?
test-16840	How there are videos out there on YouTube with 100 views and 150 likes, is this an error?
