test-17910	Should I let my dog sleep in my bed? Why/why not?
test-17911	What should I do before going to bed that will help me sleep better?
test-17912	Why did the US joined WW2?
test-17913	Why did the U.S. join in WW2?
test-17914	Cable and Wireless Worldwide: How will Vodafone best use the assets of its newest acquisition C&WW?
test-17915	I am using Vodafone but I am facing call drops? Is there any other provider?
test-17916	How is the word 'idiosyncrasy' used in a sentence?
test-17917	How is the word 'inarticulate' used in a sentence?
test-17918	Why am I angry with everyone?
test-17919	Why am I so angry?
test-17920	"When do Americans say ""Oh boy""? What does it mean?"
test-17921	"Can I say ""oh my god"" if I don't believe in God?"
test-17922	Does god exist?
test-17923	Is there a God or not?
test-17924	What is the current CRR?
test-17925	What percentage the CRR is after raising it by RBI?
test-17926	Am I delusional for thinking that my friends with benefits has feelings for me?
test-17927	I am professionally more successful than most of my close friends. Most of them are struggling, and this makes me feel bad. What should I do about it?
test-17928	With Eden Hazard nearing the end of his productive career, is it now time for Aaron Lennon to take his place as one of the world's best attack minded forwards?
test-17929	Why did Steven Gerrard waste his career at Liverpool?
test-17930	Is it true that germans and russians people have similar accent while speaking Hindi?
test-17931	How can I use Spanish accent while speaking Hindi just to have some fun with the words?
test-17932	I am using Moto g4 plus. I am getting a background display of the last app I've used for a long time. I can see them on the app running.what should I do?
test-17933	Can a medical student give the CAT?
test-17934	How do I upload files to SFTP server using Java?
test-17935	How do I create 1gb file using python, C,JAVA?
test-17936	What is the best website to buy auto parts?
test-17937	What is a legit website to buy auto parts for a Ford?
test-17938	What is it like to be part of a 1%er Biker Gang?
test-17939	What is the most famous gang?
test-17940	What can cause throbbing in the head with little to no pain?
test-17941	What does it mean when you have a throbbing pain in your head?
test-17942	What are some phrases to express condolences in Italian?
test-17943	"Phrases: Are there any alternatives to the expression ""to kill two birds with one stone""?"
test-17944	Which are the highest mountain passes in the world?
test-17945	Which is the highest peak of the world?
test-17946	What is the best age to get married for a woman?
test-17947	Which age is the best age to get married?
test-17948	Will China start a war in the South China Sea?
test-17949	In what ways could the South China Sea conflicts lead to a world war?
test-17950	What are the differences between Nordic and Mediterranean culture?
test-17951	What is difference between Slavic people and Nordic people in terms of appearance?
test-17952	How is the word 'perfidious' used in a sentence?
test-17953	"How can the word ""reputation"" be used in a sentence?"
test-17954	What does it feel like to have an extremely perverted husband/boyfriend?
test-17955	I have extreme lust for a girl who has a boyfriend. And I think she has no feelings for me. What to do?
test-17956	"Why in ""honest"" the ""h"" is silent and in ""horse"" the ""h"" is not silent?"
test-17957	"Why is it written like ""an"" MVC not ""a"" MVC, when ""M"" is not silent?"
test-17958	How do I start trading commodities at first?
test-17959	How can a beginner start trading in the commodity market?
test-17960	Did the prophet Muhammad suffer from psychosis or some other mental disorder?
test-17961	Was Muhammad a psychopath?
test-17962	Who is better between Hillary Clinton and Donald Trump as a US president?
test-17963	Why hillary Clinton is better than Donald trump?
test-17964	How do I take screenshots on a Huawei Ascend y520?
test-17965	How do you take a screenshot on a Coolpad Mega?
test-17966	If Sasquatch/Bigfoot was real (he's totally out there), where would he be located (state, area, country, etc.)?
test-17967	How come they ask you to not believe in ghosts and bigfoot and its okay, but when you don't believe in 9/11 or space travel, suddenly they complain?
test-17968	What is the difference between static and dynamic theory of economics?
test-17969	What is the difference between an MBA in economics and a Master’s in business economics?
test-17970	How does it feel to be old (60+) in Western society?
test-17971	Is western society a selfish society?
test-17972	If a cell contains a certain text (Eg: Apple), how can I return the entire row to the same row on another Excel sheet?
test-17973	How do I number rows automatically in Excel?
test-17974	What is best Android app for dictionary?
test-17975	What are some good dictionary/thesaurus apps for Android?
test-17976	How do I register to the Eudyptula challenge?
test-17977	What are the limitation of using register variables?
test-17978	Which are the best books to learn the programming for games?
test-17979	What's the best book for learning to program?
test-17980	Given that touching other people is often considered inappropriate, why do people visit crowded places where they inevitably touch lots of strangers?
test-17981	Why is a Red American Staffy a good pet for children?
test-17982	How can I calculate revolutions per minute of a tire at a certain speed?
test-17983	Can speed of 5 km per hour cause a fracture?
test-17984	Which sim card to buy while travelling to japan?
test-17985	Who was the creator of InfoCentral software ( which later became CorelCENTRAL )?
test-17986	What is the difference among Brazilian Jiu Jitsu and Karate?
test-17987	What are the differences between Jiu Jitsu and karate?
test-17988	Is there really something called sex addiction?
test-17989	What is sex addiction?
test-17990	What is continental food?
test-17991	How good is the continental food in the Rajdhani train?
test-17992	Which is the best hollywood movie I can ever watch?
test-17993	Which are the best Hollywood movies of all time?
test-17994	Game of Thrones (TV series): Could wildfire be employed against the wights and White Walkers?
test-17995	Can wildfire be used by The Night Watch to kill zombies and White Walkers?
test-17996	Do Indians know that India is the poorest place on Planet, even far behind of Africa economically?
test-17997	Do Indians know that Indians are much poorer than Africans, although African are poorer in the world?
test-17998	Is Jack Dorsey on Quora?
test-17999	Does Jack Dorsey code?
test-18000	How do I delete installed updates in android?
test-18001	How do I add an icon in Android Action Bar?
test-18002	Is white noise harmful?
test-18003	How is white noise harmful?
test-18004	How many cell phones have you destroyed?
test-18005	How many cell phones exist?
test-18006	What are the skills that hackers should have in order to be a hacker?
test-18007	What skills do I need to learn to become a computer hacker?
test-18008	Where can I watch and download Big Bang theory online on my iPhone/iPad?
test-18009	Where can I find all the parts of The Big Bang Theory with English subtitles?
test-18010	What are good examples of unconventional online customer service?
test-18011	What is a good example of phenomenal customer service?
test-18012	How did Bleed for This (2016 movie) get greenlit? What's the backstory of how the movie got made?
test-18013	How did Allegiant (2016 movie) get greenlit? What's the backstory of how the movie got made?
test-18014	Is Quentin Tarantino arrogant?
test-18015	Is Quentin Tarantino overrated?
test-18016	Which POS swiping machine has the lowest fees in India?
test-18017	Can I swipe my credit card with my brothers POS machine?
test-18018	How do I burn fat of hands?
test-18019	What is the easiest way to burn fat?
test-18020	How did Alan Turing's Bombe machine work?
test-18021	What is a Turing Machine?
test-18022	Is death by hanging painful?
test-18023	What would be in the mind of someone who is going to be hanged till death?
test-18024	What things you should share?
test-18025	What things can be shared?
test-18026	Why does my BF leave me alone crying when I need him most?
test-18027	I made my BF mad at me. How do I get him happy again?
test-18028	What is Kvar in electrical?
test-18029	Do semiconductors conduct electricity?
test-18030	Is the USA the biggest terrorist in the world for the sake of their weapons business, so they don't want peace in the world?
test-18031	Is USA the biggest terrorist country?
test-18032	When will IBM GBS give an offer letter after selecting in an interview in Hyderabad for 2014?
test-18033	How much time IBM GBS Bangalore does take to release the offer letter?
test-18034	What's the most realistic WWII movie?
test-18035	Why are there so many WWII POW movies?
test-18036	How do I find Stocks to trade?
test-18037	Where do you find stocks to swing trade?
test-18038	How do I motivate myself to study medicine?
test-18039	How can I motivate myself to study even if I'm not interested in education?
test-18040	If a 5'11'', 500 pound man and a 170 pound, 5'11'' man jumped out of a plane at 20,000 feet who will hit the ground first? Why?
test-18041	Is it possible to lose 20 pounds in 5 days?
test-18042	Write an html code for college application form using check boxes, radio button, submit button and dropdown menu?
test-18043	How do I link a submit button to another webpage using HTML?
test-18044	Why would Trump make a good president?
test-18045	Do you think Donald Trump will make a good U.S. President?
test-18046	Who would win in a wrestling match, George W. Bush or Bill Clinton?
test-18047	Who is George Bush?
test-18048	After getting into B.Tech. for CSE into a Tier 1 college what should be my next step?
test-18049	What is it like getting into IITs or IISc after graduating from a Tier 3 Engineering College?
test-18050	Has anyone done the Isha Yogasana program? What are the reviews and benefits of it?
test-18051	How can I write a no harassment legal note for my husband and his family before divorce?
test-18052	What should I invent?
test-18053	What should be re invented?
test-18054	Is it too late for me to learn c++ at the age of 30?
test-18055	Is it ever too late for someone to learn how to program?
test-18056	I have a MD and I'm not sure if I will be matched for residency. What graduate degree would be more helpful to me in the future, MPH or psychology?
test-18057	I will be graduating in computer science from an elite U.S. university this week. I have got good programming skills, but I can't land a job. I have a medical condition and I'm embarrassed about it and I'm not sure how the interviewers would see me. I believe that I'm a smart guy. What can I do?
test-18058	During which phase does crossing over occur?
test-18059	"What is ""crossing over"" and when does it occur?"
test-18060	Are the Chinese Renminbi CNY and CNH parallel currencies?
test-18061	What is the difference between CNY and CNH currencies?
test-18062	Which is the best laptop under 60k INR for gaming?
test-18063	Which is the best gaming laptop to buy under 60k?
test-18064	How and from where do stock investing websites fetch real time stock price data? How can I provide a similar functionality on my webpage? Does it have an associated fee?
test-18065	What real-time stock prices websites would you recommend?
test-18066	How do you connect a Bluetooth headset to the Xbox One?
test-18067	Is there bluetooth on the xbox one?
test-18068	"What does a ""Match Day"" in football mean?"
test-18069	What is the Match of the Day?
test-18070	What is SAP software used for in companies?
test-18071	What are SAP softwares used in businesses for?
test-18072	Do spirits actually exist?
test-18073	Does ghosts, demons, spirits and other supernatural beings exist?
test-18074	I'm addicted to smartphone games, is there a way to get rid of this addiction?
test-18075	How do I get rid of a gaming addiction?
test-18076	How do I integrate [math]\dfrac{1+x}{x^2 + 3x + 1} \mathrm{d}x[/math] ?
test-18077	What is the integral [math]\dfrac{x-1}{x^2+x+1}?[/math]
test-18078	I want to start a blog and develop it over time. How should I go about and what are some tips for blogging?
test-18079	How do I start blogging? What are some tips?
test-18080	Is leaving toothpaste on your teeth after brushing good or bad for you?
test-18081	When brushing my teeth, I leave the tap running and continue brushing. Can someone explain why I do this?
test-18082	Can any one suggest the best rear tyre for Honda Unicorn every month I drive 1500kms?
test-18083	What can be the problem with my new Honda Unicorn 160 engine, it auto stops in every 4-5 mins as if it is low on fuel?
test-18084	How do I get famous on Musical.ly?
test-18085	How do I get more fans and likes on musical.ly?
test-18086	How do I make more money on Youtube?
test-18087	How can we make money through posting videos on YouTube?
test-18088	"What inspired Moby to write the song ""Bring Sally Up""?"
test-18089	"What inspired the Jason Mraz song ""I Won't Give Up""? How did he write it?"
test-18090	What are advantages of diploma engineering over degree?
test-18091	What is a better option, diploma after 10th and then a degree in engineering or a degree after completing 12th through entrance exam?
test-18092	What is the view of Buddhism about Equality?
test-18093	Cannot bring myself to finish a TV series?
test-18094	What is signal power?
test-18095	What is a signal?
test-18096	I'm 32 years old and want to become Prime Minister of the United Kingdom. How?
test-18097	How can I become Prime Minister of the UK?
test-18098	How do you flatten transparency in Adobe Illustrator?
test-18099	"What is the ""flatten transparency"" option used for in Adobe Illustrator?"
test-18100	Why HubSpot is not profitable?
test-18101	Is there a zap to create a deal in hubspot?
test-18102	Is Kel from Goodburger really Waka Flocka Flame?
test-18103	Are famous actors mostly lucky, or very talented?
test-18104	What are the advantages of living in Nevada?
test-18105	In B-theory of time, does time act as a vector?
test-18106	Way for preparation of g.k. current affairs for ESE exam?
test-18107	IIT JEE all India rank is same as gate all India rank: Is it true or not?
test-18108	What are the best online shopping sites in Sweden? Do you know if any of listed ones use live chat in their customer service? How popular is to have live chat option on your site in Sweden?
test-18109	What is the best part about living in Sweden?
test-18110	When men fantasize about their wife having sex with someone else, what turns them on?
test-18111	Should I cheat on my wife on the grounds that she refuses to have sex with me?
test-18112	What is water rice?
test-18113	Why is rice planted in water?
test-18114	What page number is this quote on “Most men lead lives of quiet desperation and go to the grave with the song still in them.”?
test-18115	My course is completed please give me some final revision tips to follow for iitjee 2017?
test-18116	Where and how to buy inexpensive but quality men sunglasses?
test-18117	Where can I get really high quality t-shirts printed?
test-18118	How can I develop deep concentration skills while studying?
test-18119	When is the best time to study? How can I increase my concentration while studying?
test-18120	What is an incident that changed your life?
test-18121	What is the one incident that made you redefine your life? What changed the way you looked at it & lived?
test-18122	Permanent Member of the UN Security Council. Will India be able to achieve it?
test-18123	Will india get a un security council seat?
test-18124	What song plays over the end credits to the 2002 movie The Eye?
test-18125	What song plays over the end credits to the 2002 movie Saathiya?
test-18126	Is the DJI phantom 3 standard drone durable for crashes? Is it able to withstand many crashes and not break?
test-18127	Is the DJI Phantom 3 standard drone Able to withstand crashes? I have a blade 180QX now. It is very durable. Are these comparable in durability at all
test-18128	What is the melting point of glass?
test-18129	What is a diamond's melting point?
test-18130	What is the difference between an integer and int in Java?
test-18131	What are some major differences between Java 7 and 8?
test-18132	Can a psychopath turn into a sociopath?
test-18133	Can a narcissist turn into a sociopath?
test-18134	Why doesn't snorting my drugs work anymore?
test-18135	Why don't my Xanax work anymore?
test-18136	Can I get the owner's name from an account number?
test-18137	Is it possible to find a bank name from an Indian account number?
test-18138	What would happen if you put the live end of a mobile phone charger in your mouth?
test-18139	Can I use 5.2V 1.35A charger for my mobile phone instead of its original 5.0V 0.85A?
test-18140	Some people says that it is hard to sifting gears in classic 350 is it true ?
test-18141	How do I find energy required to change the speed of electron from rest?
test-18142	Will I get MSc Physics in BITS Goa with a score of 286 in 2016?
test-18143	Is 326 (BITSAT 2016) a good score for admission in MSc physics at BITS Goa?
test-18144	"What is the meaning of ""cepstrum""?"
test-18145	What is the meaning of meaning?
test-18146	What are some words that end with the letter C?
test-18147	Is there any word that ends with the letter Q?
test-18148	Is modern education really designed to enhance student's critical thinking?
test-18149	Nazi vs US?
test-18150	Does WorldQuant's Web-Sim challenge require extensive knowledge of programming?
test-18151	Does embedded systems programming require knowledge of circuits and design?
test-18152	What do Americans think of Australian people?
test-18153	What does Americans think of Vietnamese people?
test-18154	What is the difference between mp4 and mp4v2 containers?
test-18155	How do I split a MP4 file?
test-18156	What are some main differences between introvert and extrovert?
test-18157	What is the difference between extrovert intuition (Ne) and introvert intuition (Ni)?
test-18158	What are the chances of there being a zombie apocalypse? How can I prepare myself for one?
test-18159	What are the chances of a zombie apocalypse in the future?
test-18160	How can I get answers to a question posted by someone else from Quora?
test-18161	How do I receive answers from the question asked by me from Quora?
test-18162	Why do we use matrices in math?
test-18163	What math do I need for elementary calculus with matrices?
test-18164	Is it possible we are someone's computer simulation?
test-18165	Are we living in a computer simulation?
test-18166	Which kind of training plan would prepare to me to run the Berlin Marathon 2016 under 3h 30min?
test-18167	Is it true that if a person can run 6 miles, they can train for a marathon?
test-18168	How do I calculate cos, sine, etc. without a calculator?
test-18169	How do I do a trigonometry question without a calculator?
test-18170	How important is a logo for startups?
test-18171	How important is a well designed logo for a startup?
test-18172	What is your review of Game Of Thrones season 6 episode 6?
test-18173	"What is your review of Game of Thrones Season 6 Episode 6 ""Blood of my Blood""?"
test-18174	What do contemporary philosophers think of Alan Watts?
test-18175	Did Alan Watts do drugs? Why?
test-18176	What do you say when a girl asks what are you doing?
test-18177	Should guys ask out girls or do girls ask out guys?
test-18178	Is it appropriate for a 16-year-old to go to the gym? If yes, which exercises should be prohibited for proper growth of height?
test-18179	Can a 15 year old go to the gym?
test-18180	What is the shortcut key of subscript and superscript in Excel?
test-18181	Microsoft Excel: Why isn't there a keyboard shortcut for toggling between superscript/subscript?
test-18182	Which news channel is best in India?
test-18183	Which is the best news channel in India and why?
test-18184	I have completed Andrew Ng's Coursera class on Machine Learning. What should I do next? What *can* I do next?
test-18185	Andrew Ng: I am weak in Algebra & Calculus. Is there other ways I can learn the basic maths required to complete the machine learning course?
test-18186	Is it common for someone who has antisocial personality disorder to have been sexually violated in early years of development?
test-18187	Which is good indira college or ness wadia?
test-18188	Can I get into the IIIT Delhi with a JEE Mains rank of 15800 in OBC outside Delhi?
test-18189	What should my rank be in JEE Main to get CSE in IIITD if I'm OBC of Delhi region?
test-18190	What is the best time to give the CPT, June or December after your HSC exam?
test-18191	I am a CA CPT student and I have my CPT in June 2016. How should I manage both HSC and CPT? What's a suggestion for a perfect time schedule?
test-18192	What should program course fill in educational qualification box of upsc prelimns?
test-18193	How do I help my 2 year old nephew who was just diagnosed with Autism Spectrum disorder?
test-18194	Why did Oswald Cobblepot, choose to be a affiliate of the Red Hood Gang?
test-18195	"How do you say ""nightclub"" in French? What are some other useful going-out words and phrases?"
test-18196	What are some things a visitor to Japan absolutely should not do?
test-18197	What are some of the things you can only buy in Japan?
test-18198	What's more profitable? Dealing cocaine or meth?
test-18199	What profits more: selling cocaine or crystal meth?
test-18200	How can I see what is trending on Facebook?
test-18201	What are the latest Facebook trends?
test-18202	What Assassin's Creed games aren't worth playing?
test-18203	I want to play 'Assassin's Creed' but I have only 240MB RAM, how can play the game?
test-18204	What are some iconic images of California?
test-18205	What are some iconic images of books?
test-18206	"In 'His Last Vow', what does Mycroft mean by saying ""East wind is coming Sherlock, it's coming to get you""?"
test-18207	In Sherlock, Jim Moriarty says he's an actor hired by Sherlock to be his arch enemy. Why would this not work in a real court case?
test-18208	What is the best coaching institute in Kolkata for cracking the IIT JEE?
test-18209	Which are the best coaching institutions for the IIT-JEE?
test-18210	How can I convert plain text into binary?
test-18211	What is the best way to convert plain text to ciphertext?
test-18212	If I sell my company (founder's shares) in California, what effective tax rate can I expect to pay on the LT capital gain?
test-18213	What are the tax laws in California around reinvesting short term or long term capital gains in a small business?
test-18214	Is there a word or expression for something done in error and yet intentionally?
test-18215	What is the difference between intent and intention? They're both derivative of intend. Why does it have two words?
test-18216	How can you lose weight really quick?
test-18217	What are some easy ways to lose weight in a short amount of time?
test-18218	Is there an unselfish rational reason to be kind?
test-18219	Is there a rational reason to abhor idolatry?
test-18220	How much marks should we score in SSC CGL 2016 Tier-2 to get selected?
test-18221	How much marks should we score in SSC CGL 2016 Tier-1 to get selected ?
test-18222	Why is Pokémon much more popular than Digimon?
test-18223	Why is Digimon less popular than Pokémon in the US?
test-18224	What are some things new employees should know going into their first day at Ariad Pharmaceuticals?
test-18225	What are some things new employees should know going into their first day at West Pharmaceuticals?
test-18226	Do you think usertesting.com is costly?
test-18227	Why doesn't Google promote Google Contributor?
test-18228	Is there any model from Gunnar glasses specifically for blocking blue light or do they all offer the same blocking level?
test-18229	Which is better in a relationship, 2 people on a similar path, or 2 people with very different careers?
test-18230	What are the best places in India to buy a toy/fake gun to be used as a prop for the purpose of Filmmaking?
test-18231	Which is the best honeymoon destination for couples in India?
test-18232	What are the first steps to invest in the Indian stock market?
test-18233	How do I start investing in the Indian stock market?
test-18234	If god created everything did he create himself?
test-18235	Did God create himself?
test-18236	Where is the best bar in Manhattan to celebrate my 21st birthday?
test-18237	Do Bars open on the New Year's Day in New York?
test-18238	What are my chances of getting a job in industry if I get a PhD in physics?
test-18239	If I want to get PhD in quantum physics, is it ok to minor in physics? Will it decrease my chances of getting into a program?
test-18240	How do I get over the fear of being raped?
test-18241	How do I get over my fear of being raped?
test-18242	Who was the first pianist to record the complete works of haydn?
test-18243	Who was the first pianist to record the complete works of Rachmaninov?
test-18244	What is the limit of downloads of an Android app after which Google pays money for each download?
test-18245	Does a free Android app having a large number of downloads earn money for a person?
test-18246	Do NFL players get paid fully if they are injured?
test-18247	What do NFL football players do on Saturday nights?
test-18248	Is the Earth flat?
test-18249	"Is the ""The Flat Earth Society"" right in saying that the world is flat?"
test-18250	How does one start a country?
test-18251	How would you start a new country?
test-18252	"How do you say ""see you later"" in Korean?"
test-18253	How do you say I hate you in Korean?
test-18254	Who are the commercial architects in pune?
test-18255	Who is the residential architects in Pune?
test-18256	Why do necks flush when nervous?
test-18257	Why do people's necks flush red when they are nervous?
test-18258	How do I avoid procrastinating?
