202196	What is better , Microsoft or Apple ?
202197	Which is better : Microsoft or Apple ?
202198	In what format the pictures taken by a satellite or spacecraft sent to earth and how is it processed as image that are published by space agencies ?
202199	If a bird had never seen a nest , would it know how to build one ?
202200	How do birds know how to build nests ?
202201	What is the use of enlightenment ?
202202	The girl I like smiles at me every time she notices me looking at her . Does it mean she likes me or just likes the attention ?
202203	Why do I fail at dating all the time ?
202204	Why is dating so hard ?
202205	What are the differences between self esteem and ego ?
202206	Which MBA course I must do after computer engineering ?
202207	Which MBA should I do after computer engineering ?
202208	What is the difference between Twitter and Facebook ?
202209	Should I continue being friends with my ex ?
202210	Drowning In Debt ?
202211	What is drowning in debt ?
202212	How hard is it to practice water polo compared to boating ?
202213	How hard is it to practice water polo compared to sailing ?
202214	How does drop shipping work exactly ?
202215	How can I join the Facebook network ?
202216	How do you join a Facebook network ?
202217	What are some ways you can identify the theme of a book ?
202218	How can you find the theme of a book ?
202219	Do you really have faith in humanity ?
202220	Do you have faith in humanity ?
202221	What are some of the best states to incorporate an online business ?
202222	Which is the best state to incorporate an online business ? Why ?
202223	I have 2 year career gap recently in 7 yr IT career . ? How do I explain about career gap ?
202224	Career Advice : How do I explain one year gap in an interview ?
202225	What are some uses of Punnett squares ?
202226	What is a Punnet square ? What are some uses of Punnett squares ?
202227	What do you admire about the people you admire ?
202228	What are the pros and cons of gargling hydrogen peroxide ?
202229	What are the benefits from gargling with hydrogen peroxide ?
202230	What is chlorophyll and how does it help the plant ?
202231	What is something you find annoying on Quora ?
202232	What annoys you on Quora ?
202233	What exactly is Yelp and how can Yelp help grow my business ?
202234	How can Yelp help benefit your business ?
202235	What are some diseases of the respiratory system ?
202236	What are the diseases related to respiratory system ?
202237	What is the minimum marks required to get any college for either MBBS or BDS in NEET ?
202238	How many minimum marks are required to get any MBBS college through NEET ?
202239	Why did the Roman Empire fall ?
202240	How did the Roman Empire rise and fall ?
202241	What race do Persians (Iranians) belong to ?
202242	What are some interesting things about Earth ?
202243	Why's playing snooker by myself (with other people playing) on other tables different to playing on a table with just myself ?
202244	Why's playing snooker by myself (with other people playing) on other tables different to playing on a table with just myself ? Hm
202245	What does a tiger versus a dragon tattoo mean ?
202246	What does the dragon vs. tiger tattoo mean ?
202247	Why don't I like my family sometimes ?
202248	What if i don't like my family ?
202249	If a person laughs at his own jokes , does it make his jokes less funny ?
202250	If a person puts smiles after his own jokes , does it make his jokes less funny ?
202251	If a girl played with troll dolls back in the 80's , what toy did a boy play with during that era ?
202252	What toy did a boy play with in the 80's if a girl played with troll dolls ?
202253	How do I apply false eyelashes ?
202254	What is the easiest way to apply fake eyelashes ?
202255	How do I create a social networking app ?
202256	What are some torrent downloading sites ?
202257	Can I use my smartphone during charging ?
202258	Can we use a smartphone during charging ?
202259	Has the world always been so fucked up ?
202260	Why is the world so fucked up ?
202261	How can you tell the gender of A bearded dragon ?
202262	How do you tell the sex of a bearded dragon ?
202263	`` Are there instances when it doesn't matter whether you choose'' `` affect'''' or'' `` effect'''' in a sentence ?''
202264	What are your quirks ?
202265	What are some of your quirks ?
202266	Who won the third debate ?
202267	How to convert mbox to pst file ?
202268	How can you convert MBOX to PST file format ?
202269	Why did Marathas fought third battle of panipat ?
202270	What are your chances of getting an STD ? How can you reduce those chances ?
202271	How can you reduce your chances of getting an STD ?
202272	How do I create a messaging app like whatsapp ?
202273	How do I create an app like WhatsApp ?
202274	If Trump loses the election this time around , can he try and run again in 2020 against Hillary ?
202275	After Donald Trump loses will he run again in 4 years ?
202276	What existed before the Big bang or the Universe ?
202277	Why didn't Apple build its own search engine ?
202278	Why doesn't Apple have its own search engine ?
202279	How can I cope with bipolar disorder ?
202280	What are ways to cope with bipolar disorder ?
202281	How do I retrieve old chats after deleting a WhatsApp account from a device ?
202282	How do I retrieve whatsapp chats from my old phone ?
202283	Should I believe in love ?
202284	Should one believe in love ?
202285	What are your thoughts on the new iPhone 7 ?
202286	How could I be a good friend to any girl ?
202287	How could a boy become a good friend of a girl ?
202288	What are the requirements to join the Canadian Army ?
202289	Which are the best quotes from How I Met Your Mother ?
202290	What are some of your favorite quotes from How I Met Your Mother ?
202291	How much does it cost to buy a laptop with this configuration : i5 , 8gb ram , 1tb hard disk , 2 GB graphic card ?
202292	What are your 10/10 movies ?
202293	I want to assemble a PC for gaming purpose , what would be the best configuration for a budget of 60K ?
202294	What is anal sex ?
202295	What is meant by anal sex ?
202296	What to say to someone who has lost a loved one ?
202297	What do i say to someone who lost a loved one ?
202298	Is it hard to be honest ?
202299	Why is it so hard being honest ?
202300	What are the best wedding websites that you have ever seen ?
202301	What are some of the best wedding websites you've seen ?
202302	How can I reduce my websites' bounce rate ?
202303	How many air craft carriers do India presently have ?
202304	Which is the best antivirus for Android ?
202305	Which is best antivirus and launcher for Android phones ?
202306	What are the most recognized flags in the world ?
202307	Which 10 flags are the most recognisable in the world ?
202308	What are the top 5 most dangerous cities in the United States ? How did they become so dangerous ?
202309	Which is the best mind games ever ?
202310	Which is the best mind game ever played ?
202311	Should we lower the age for voting to 16 ?
202312	Should the United States lower the voting age to 16 ?
202313	How can I apply to join Accenture ?
202314	What are the qualities of a successful entrepreneur , and a failure ?
202315	What are the qualities of a successful entrepreneur ?
202316	On what basis do people choose to be atheists ?
202317	How do I get through high-school that I don't like ?
202318	How can I get through high school successfully ?
202319	What are some of the interesting facts about Bollywood personalities ?
202320	What was your biggest culture shock while living in Japan ?
202321	What are the biggest culture shocks people face when coming to Japan ?
202322	`` What does'' `` net worth'''' mean ?''
202323	What does net worth mean ?
202324	Is Gangs of Wasseypur based on true story ?
202325	What's the benefit of eating protein powder ?
202326	What are the benefits of me starting to use protein powder ?
202327	Listing is not visible on Yelp search result ?
202328	Will prostitution ever be legal in all the U.S. (not just Nevada) ?
202329	Will prostitution ever be legal in the united states ?
202330	How do you send and receive invoices on eBay ?
202331	How does Ripjaws eat his food underwater in Ben 10 ?
202332	How does Ripjaws eat food underwater in Ben 10 ?
202333	What are the best mixers for Jack Daniel's ?
202334	Is it possible to self teach yourself to sing ?
202335	Can you teach yourself how to sing ?
202336	How does it feel for a guy to fall in love ?
202337	What it is like for a guy to fall in love with a girl ?
202338	Why didn't Eiffel Tower light up in Bangladeshi Flag color after the terrorist attack on Bangladesh ?
202339	Why didn't Eiffel Tower lit up with Turkey , Bangladesh or Iraqi flag ?
202340	What is the best book to learn basics in finance ?
202341	Which is the best book to learn finance basics ?
202342	Is the Chinese Communist Party going to collapse ?
202343	What is the best food in Pune and where do I get it ?
202344	What is the best food in Pune ?
202345	For what reasons have you been edit blocked on Quora ?
202346	If you've never been edit blocked on Quora , to what do you attribute that ?
202347	If you have a felony conviction , can you still get a passport ?
202348	Can someone with a felony get a passport ?
202349	How do I fire someone ?
202350	How do I fire people ?
202351	Which is the Best Packers and Movers in Bangalore ?
202352	Which position do women prefer in sex ?
202353	What is the best way to fry chicken ?
202354	How do you make the best fried chicken ?
202355	What is the best way to study for a Level 2 Financial paper in accounting (NCEA) ?
202356	What is the most beneficial way to study for a Level 2 Financial paper in accounting (NCEA) ?
202357	How do I become a better Christian ?
202358	How do billionaires from private companies gain liquidity to fully ` use' their billionaire assets , especially if the companies are unprofitable ?
202359	How do billionaires from private companies (Koch , Bloomberg) gain liquidity to fully ` use' their billionaire assets ?
202360	How do I tell someone I have herpes ?
202361	How do you tell someone that you have Herpes ?
202362	How do I know if I was block from Instagram ?
202363	What is the easiest way to overcome a panic attack ?
202364	How does sex feels ?
202365	Why will Lord Shiva be under Devi Kali's foot ?
202366	Why is Lord Shiva under the feet of Devi Kaali , after Devi kaali killed the Asura Raktabija ?
202367	How does Tinder work ? What is it used for ?
202368	`` What do you understand by the term'' `` experience'''' ?''
202369	What do you understand by the term experience ?
202370	How do I start a startup if I have an idea ?
202371	How do I start a startup business if we have an idea ?
202372	How can you tell the difference between a sore throat and strep throat ?
202373	What is the difference between sore throat and STREP throat ? What causes strep throat suddenly ?
202374	Why do people get so crazy about selfies ?
202375	What practical uses does the Laplace transform have ?
202376	Which is better , CSE in BP Poddar or Chemical engineering in HIT-K ?
202377	Which one is better cse in bp poddar or chemical engineering in heritage ?
202378	How can we solve log base 3 of 28 without calculator ?
202379	How can I solve log base 3 of 28 without calculator ?
202380	What are some good tips to live to be 100 ?
202381	Could The President pardon himself if he committed a crime ?
202382	Why interest rates so low in US and other countries but not in India ?
202383	Why are the interest rates in the Unites States so low compared to those in India ?
202384	Which is the best face wash ?
202385	What are some of the best face washes ?
202386	Where can I learn about stock trading from the start ?
202387	What are the best books about stock trading ?
202388	How was upsc prelims 2016 ?
202389	Why wont my iPhone's lock button work ? How can it be fixed ?
202390	What happens when a batsman hit a shot and ball hits the spidercam ?
202391	In cricket , what happens if the ball accidently touches the Spidercam ? What would be the decision ?
202392	What are some examples of antonyms ?
202393	What are antonyms ? What are some examples ?
202394	How do I prepare for NEET in the last 6 months ?
202395	How do I prepare for NEET 2017 in 6 months ?
202396	What are the best hacking movies ?
202397	`` What are some of the best'' `` hacking'''' movies ?''
202398	What do Steve Jobs children do ?
202399	What are Steve Jobs' children up to ?
202400	What were the causes of WWI ?
202401	What are the causes and effects of WWI ?
202402	Why are police lights red and blue ?
202403	Why are police lights red and/or blue ?
202404	I've planned to buy a TV . My budget is 35 -- 45k . And I'm interested in branded TV . Can you suggest a good TV ? 40 inch will be better .
202405	Can you suggest a good 40 to 43 inch LED Smart TV/UHD Smart TV at a budget price 30k ?
202406	What is the best kids Shows ?
202407	What are some of the best kids shows of all time ?
202408	Can anyone patent a business idea ?
202409	Can I patent a business model in India ?
202410	How can I be a succesful YouTuber ?
202411	What's your review on Infosys ?
202412	What is your review of Infosys ?
202413	How do you fly ?
202414	How much data does Facebook Messenger use ?
202415	How much data does Facebook messenger use if you are only sending messages ?
202416	Why do some people label themselves and others ?
202417	Why are people so keen to use labels to describe themselves or others ?
202418	Why are we so easily distracted ?
202419	Why am I so easily distracted ?
202420	Which are the 2 stroke bikes ?
202421	Which bikes are 2 stroke ?
202422	Has SBI written off loans of 63 defaulters ?
202423	How can SBI afford to waiver off defaulters' loans ?
202424	How do you tell someone that you don't like them ?
202425	How do you tell someone that thinks you like them , that you don't actually like them ?
202426	What is the best way to start off an essay ?
202427	Which hospital in India is best for treatment of chronic kidney disease ?
202428	How hard are Google's software engineer job interviews ?
202429	What should I expect in a Software Engineer interview at Google and how should I prepare ?
202430	What color can describe people's fears ?
202431	What is the color of fear ?
202432	What's the difference between strategy and tactics ?
202433	What is the difference of strategy and tactics ?
202434	How can you contact Summit Entertainment ?
202435	How do I contact Summit Entertainment ?
202436	What is the present scenario in us after doing MS ?
202437	How suggestable is to do ms in us considering the present scenario ?
202438	What are the main parts of brain and how do they function ?
202439	When and how did you become an atheist ?
202440	When did you become an atheist ?
202441	Where is largest zoo in india ?
202442	Which is the largest zoo in india ?
202443	Are there Aliens from other planets already on Earth ?
202444	Is there an embassy for aliens on a business trip to planet Earth ?
202445	What are your favourite slack integrations ?
202446	What are your favorite slack integrations ?
202447	I'm a teen , how can I make some money online ?
202448	How alike are capitalism and communism ?
202449	What do you enjoy most about Christmas ?
202450	What do you like most about Christmas ?
202451	If you could make a movie for Hollywood today , what would it be about ?
202452	If you could make your own movie , what would it be about ?
202453	How do I write query for linked server ?
202454	How do I write the query for linked server ?
202455	How can I get answers for my questions ?
202456	How do I get my questions answered ?
202457	Which kingdom is composed of eukaryotes which are mostly unicellular that can be heterotrophs or autotrophs ?
202458	Which kingdom is composed of eukaryotes , which are mostly unicellular that can be heterotrophs or autotrophs ?
202459	What were the crazy conspiracy theories that were actually proven to be true ?
202460	Does Sony Xperia XA Dual have a fingerprint sensor ?
202461	Does Sony Xperia xa dual has fingerprint sensor ?
202462	Is journalism dead ?
202463	Is journalism is dead ?
202464	What is the best ride in Disneyland ?
202465	What are the best rides at Disneyland ?
202466	Is Tally software becoming old compare to SAP or ORACLE ?
202467	Is Tally software be coming old compare to SAP and oracle ?
202468	How can lose 29 pounds in 2 months without affecting my health ?
202469	What should I do make my life worth living ?
202470	How can I make my life worth living ?
202471	How do I get to be a people person ?
202472	How should I be a people person ?
202473	Was Hillary Clinton a good Secretary of State ?
202474	What are the facilities provided to an IES officer ?
202475	What has been Barack Obama's greatest achievement so far as President ?
202476	What are Barack Obama's greatest achievements as President ?
202477	What's the different between heart , soul and mind ?
202478	What is the difference between the heart , the mind and the soul ?
202479	What can you do with Bachelor of Business Administration degree ?
202480	What can you do with a Business Administration degree ?
202481	Is it possible to catch fleas from a dog ?
202482	Is it possible for humans to catch fleas from their dog and how can you prevent this from happening ?
202483	How long can I drive in California with a Philippine license ?
202484	How long can I drive in California on my foreign license ?
202485	What is the best fishing bait to use ?
202486	What is the best bait I can use for fishing ?
202487	Epilepsy : What is it like to have an epileptic seizure ?
202488	If you point a gun at the sky and shoot , will the bullet reach outer space , fall back down to Earth , or burn up in the atmosphere ?
202489	If you shoot a bullet upward into the sky , will it fall back down eventually , or float up into space ?
202490	How can I be a singer ?
202491	What is the word for the small plastic tip at the end of a shoelace ? What is it used for ?
202492	What is the word for the small plastic tip at the end of a shoelace ?
202493	What are the best places to visit with friends in Texas ?
202494	Which are the top places to visit in Texas ?
202495	Is hacking a Facebook account in India a crime ?
202496	Is hacking fb accounts a crime ?
202497	What are the major differences between an IIT and a non IIT Civil Engineer graduate ?
202498	How can I make women smile at me in a flirting way ?
202499	How can I make women smile at me in a flirting way ? If I'm A stranger ?
202500	How do criminal lawyers sleep at night even when they know their client is guilty ?
202501	How do I stop eating unhealthy and loose weight ?
202502	How do I stop myself from eating unhealthy stuff ?
202503	If it's impossible to have zero (no) energy , how it is then quantized and non - continuous ? Wouldn't it be continuous and infinite ?
202504	If it's impossible to have zero (no) energy how it is then quantized and non continous ?
202505	What are the best online or offline dictionary for chines people to learn English ?
202506	Is there any good online or offline dictionary for chines people to learn English ?
202507	How do I catch Charizard in Pokmon GO ?
202508	How do I catch charizard on Pokemon Go ?
202509	Can you drive your parents' car without insurance ?
202510	Why is it illegal to drive a car without insurance ?
202511	What keeps satellites in orbit ?
202512	What keeps satellites propelling ?
202513	Why is there a Nataraj statue at CERN ?
202514	Why there is statue of Nataraj at CERN laboratory ?
202515	How and why is the universe expanding ?
202516	Is the universe infinite or just infinitely expanding ?
202517	How should you treat a mouse bite ?
202518	How do you treat a mouse bite ?
202519	What was the best motivational story you have ever heard ?
202520	What are the best programming blogs about java ?
202521	What are organic macromolecules and what are some examples ?
202522	What is a organic macromolecule ? What are some examples ?
202523	Is it true that the new Indian Rupees have a chip which can track any 2000 & 500 notes ?
202524	How good is the NOTS for the NEET ?
202525	How good is the NOTS for preparing for the NEET ?
202526	What is difference between fork (-RRB- and vfork (-RRB- ?
202527	What is the difference between fork and vfork ?
202528	How do you create marketing materials if you are given inaccurate/incomplete buyer personas ?
202529	How do you create marketing materials if you are given inaccurate personas ?
202530	What would happen if Israel goes to war against Turkey to support Bashar al Assad Government in Syria ?
202531	What would happen if Israel declared a war on Turkey to support President Bashar al Assad Secular Government of Syria ?
202532	Are the Russians happy with the fact that Donald Trump is elected as the president of America ?
202533	According to Islam , what are the signs of Qiyamah (Day of Judgement ?)
202534	What are signs of the Judgement Day according to Islam ?
202535	Who was Confucius and why was he important ?
202536	Who was Confucius ? Why was he important ?
202537	As infinite virtual particles can appear , is (total) energy infinite ?
202538	If infinite virtual particles can appear , is (total) energy infinite ?
202539	Which is the best coaching for CLAT preparation in Delhi ?
202540	Which is the best institute for CLAT preparation in Delhi ?
202541	How do I play . RAW camera files on TV ?
202542	How can I play raw files on my TV ?
202543	How long does weed stay in your urine ?
202544	What was the biggest contributing factor of the fall of Rome ?
202545	What are some of the reasons behind the fall of Rome ?
202546	How can I unlock Android phone ?
202547	How can I unlock android phones ?
202548	If I don't turn off my mobile phone on a plane will it really interfere with navigation systems ?
202549	Is it really necessary to turn your mobile phone off on a plane ?
202550	What was your first job and what did you think about it ?
202551	Camgirls do you live a lucrative lifestyle ?
202552	Do CamGirls live a lucrative lifestyle ?
202553	Which is that one incident which made u feel God exists ?
202554	What's one incident which made you believe that God exists ?
202555	Should I smoke weed ?
202556	What was the first question you asked Quora ?
202557	What is the first question you've asked on Quora ?
202558	What are the best companies to work in Chennai ?
202559	What's the best company to work for in Chennai ?
202560	What is the state of eligibility for the JEE-Mains ?
202561	What is the state of eligibility for the JEE - Mains ?
202562	Which is the best country to pursue an MS in mechanical engineering ?
202563	What are some examples of saturated and unsaturated fats ?
202564	What are saturated and unsaturated fats ? What are some examples ?
202565	How do you create a second Facebook account ?
202566	What have we gained from demonetization ?
202567	What are the positive impacts of Demonetization ?
202568	Can a bound morpheme be more than one syllable in length ?
202569	How do I GET MY money BACK FROM QNET after 1 MONTH ?
202570	How can I get my money back from qnet ?
202571	Why did God (or whoever created life on this planet) create only two genders ?
202572	Why did God created only two main genders , male and female ?
202573	Who will be on the Iron Throne at the end of Game Of Thrones ?
202574	How do you know if someone cares about you ?
202575	How can you see if someone cares about you ?
202576	How can I stop from getting junk in my mailbox (real one , not e-mail) ?
202577	How can I stop getting junk mail ? Is there some trick I could use that would stop the junk mail ?
202578	When is the right time to start competitive coding ?
202579	What is the best time to start competitive coding ?
202580	What are ethical considerations ? What are some examples ?
202581	What are ethical considerations ?
202582	Is everybody good at heart , just misunderstood ?
202583	Do bad people exist ? Or are they just good people making mistakes ?
202584	What do you mean by boasting ?
202585	What does it mean to boast ?
202586	Why is Facebook successful ?
202587	Why is Facebook so successful ?
202588	Which is your favourite time of the day ?
202589	What is your favourite time of day and why ?
202590	What kind of projects should someone put on GitHub ?
202591	What does god think about killing with drones ?
202592	What does God think about a country that kills with drones ?
202593	How is Sanskrit and Mathematics related ?
202594	How Sanskrit is related to mathematics ?
202595	Should I tell my future husband I am not a virgin ?
202596	I am not virgin , should I tell my future husband about it ?
202597	What are the 6 business strategies ?
202598	What are some business strategies ?
202599	Why do you yawn when you are tired ?
202600	Why do we yawn when we are sleepy ?
202601	How was language created ?
202602	How are languages created ?
202603	How do you know if you're a sociopath or not ?
202604	How do you know if you are a sociopath ?
202605	What is the function of a fuel pressure regulator ?
202606	What is the function of the fuel pressure regulator ?
202607	Who according to you is the most beautiful sports woman in the world ?
202608	Who , according to you , is the hottest sports woman ?
202609	Which is the best way to learn c++ ?
202610	What's the best way to learn C/C + + ?
202611	Do you think education system of India is good ?
202612	Do you think the education system in India is good ?
202613	What are the best pranks ?
202614	What are good pranks ?
202615	How do you make Quora a better place ?
202616	What makes Quora a better place ?
202617	What is in pepperoni ?
202618	What are the ingredients in pepperoni ?
202619	How do you make homemade nail polish ?
202620	How do you make a nail polish ?
202621	What are some good Android app development courses ?
202622	What's the scariest insect/arachnid you've ever seen ?
202623	What is the scariest insect you have ever seen ?
202624	How can I find my passion career ?
