368717	How do I reset a Toshiba laptop ?
368718	How do you unlock a Toshiba laptop ?
368719	Can I get any mobile number of of my choice if the number had not been allotted yet in India ?
368720	How can one get a toll free number in India ?
368721	Do people in China still hate Japan for WW2 ?
368722	Was it possible for Japan to conquer China during WW2 ?
368723	How does one cast a double to an integer ?
368724	Is this over sensitivity or low self esteem or just down to my parenting ?
368725	Should one marry a woman with low self-esteem ?
368726	What are some interesting contemporary topics that would make for lively discussion subjects with students of English in China ?
368727	What is the best online service to generate Terms and Conditions and Privacy Policy for SaaS product ?
368728	What are some good Terms of Service and Privacy Policy generators ?
368729	Have you ever cheated on your partner even when you had no reason to ?
368730	Is it normal to have cheated in a relationship even though you wouldn't tolerate that behavior from your partner ?
368731	I imagine stabbing people in the throat all throughout the day . How can I ignore this ?
368732	Where online can I track how the California propositions are doing throughout election day today ?
368733	Is there anything living that doesn't die ?
368734	What is a good side dish to serve with cabbage rolls ?
368735	My teacher is always making fun of me in front of the whole class . What can I do without her getting mad at me and giving me lower grades ?
368736	Where is the red light area in Jaipur ?
368737	How is life in Jaipur ?
368738	What are the facilities given to teachers in Army Public School Ferozepur ?
368739	Does anyone has a review of Army Public School Ballygunge ?
368740	What are the most competitive competitions for websites around the internet ?
368741	How do you update the graphics driver on your computer ?
368742	What is the top rated karaoke machine for home use ?
368743	What is a good option for $ 100 or less dual-wireless microphone set for home karaoke ?
368744	If I move to Russia and learn the language , would I ever be considered Russian ?
368745	Among Spanish , German , and Russian , which language is easiest to learn , considering the fact that I am fluent in English ?
368746	What is the caste of the surname mogadati ?
368747	Can You tell me in which caste do I belong , provided that my surname is Das , Barujibi and Gautama gotra ?
368748	I interviewed at Oracle through a consultancy.HR results were due in 15days . But its been 20days . no organization are responding my call.Can it be fake ?
368749	Can I wear a shirt without tucking it in with blazer ?
368750	Why do Millennials dislike Hillary Clinton ?
368751	Are millennials voting for Hillary Clinton ? If so , why ? If not why not ?
368752	How we can print full ascii table on output screen in c++ ?
368753	What is the Cat Stevens song where he sings about a husband and wife who are getting into fights and at the end the wife dies ?
368754	When I watch a movie or television show , is all the dialogue and sound I'm hearing dubbed in after the fact ?
368755	How would you describe your life in a poem ?
368756	What is a foolproof way to know when an egg is perfectly boiled ?
368757	What is the best way to hard boil an egg ?
368758	Invention and Inventions : How could we reinvent the wheel ?
368759	What are the best restaurants to try when visiting Koulikoro , Mali ? What should you try while you're there ?
368760	What are the best restaurants to try when visiting Sgou , Mali ? What should you try while you're there ?
368761	What's the answer to question 42 of The Impossible Quiz ?
368762	What is the job description of IT officers (specialist officers) in banks ?
368763	Which post is better in a bank-specialist officer or probationary officer ?
368764	Can you recommend me a 2 days full body workout ?
368765	I'm unable to understand magic methods in Python , please help with sample code ?
368766	What's the differences between sublimation paper and heat transfer paper ?
368767	Which is best heat transfer paper for long durability ?
368768	What are the best websites to learn spoken hindi (from basics) ?
368769	What is the best and easiest way to learn spoken Hindi online ?
368770	What is a gun's purpose ?
368771	Why is Google play services not working on my phone ?
368772	Do I need Google Play services for my Android to work fine ?
368773	What can cause back pain when you cough ? How is it treated ?
368774	What can cause a painful lump under my jawline ? How should it be treated ?
368775	Girls , how do you feel when someone presses your boobs ?
368776	Why is gravitational force dependant on mass ?
368777	What does the force of gravity depend on ?
368778	What does ; . ; mean in Java ?
368779	What course should I take on from here ?
368780	Why is Scoopwhoop website against Modi and instigating fallacious belief in people ?
368781	What are some good books (fiction and non-fiction) that are about the dot-com bubble ?
368782	How can I unlock an Iphone with an icloud id which was not mine ?
368783	Did indian muslims support pakistan in 1971 war ? From where can I get the evidences if yes ?
368784	Did indian muslims support pakistan in 1971 war ? Where are evidences if yes ?
368785	Does high school or college prepare you for real life and real work in the field of computer science ?
368786	How do I improve my learning and understanding capabilities ?
368787	Most accurate iPhone traffic app ?
368788	What is the most popular To Do list app for iPhone ?
368789	Memorise the entire Quran ?
368790	HIT Anti Roach Gel is effective ?
368791	How can I become a charming girl ?
368792	Which one is better CAT or XAT ?
368793	What is Mucolite used for ?
368794	What is Aniracetam used for ?
368795	Name a company that was stupid towards their customers like W.T. Grants was ?
368796	How is it that the company that manufactured Extenze is still in business after it was found the founder was a fraud and embezzled money from customers ?
368797	Which books of the Bible did Peter write , and what makes them distinct ?
368798	What is a good book to help study the bible ?
368799	Do Turks have a genetic similarity with Greeks ?
368800	What do Greeks think of Turks ?
368801	Why does the government print money ?
368802	Who gets the money that governments print ?
368803	What are the best Android apps for IAS preparation ?
368804	Which is the best mobile Android app for the IAS and for other competitive exam preparations ?
368805	Can any one suggest strength training moves to do at home ?
368806	If you are looking for an apartment and plan to do intense cardio or strength exercises at home (like P90X or Insanity) , is it better to rent a room on the first floor so that no one will hear you jumping and moving ?
368807	What happened with Lehman Brothers ?
368808	What happened to the Lehman Brothers employees ?
368809	How do I delete someone from messenger app ?
368810	What is meant by C.D.S. ?
368811	What is meant by O.C.S.I.D. ?
368812	What are reviews of the 2015 Jeep Wrangler Unlimited ?
368813	What is your review of Jeep Wrangler ?
368814	What is Himalayan pink salt ? Why is it better ?
368815	What Himalayan salt is the best , and why ?
368816	Why are macadamia nuts bad for dogs ?
368817	Which nuts are bad for dogs ?
368818	Does dandruff cause hair loss ?
368819	My MacBook Pro won't turn on . The light on the charger flashes orange/green . What should I do ?
368820	What is the purpose of the green lights on the side of a MacBook Pro ?
368821	`` Comebacks (replies) : What is a good response when someone retorts'' `` What do you want from me ?''''''
368822	How can I get the details of Snapdeal sellers because I start a photography services for e-commerce ?
368823	What are the possible ethical implications of aging reversal (assuming it will ever become possible) ?
368824	What's that device on umpire's arm ?
368825	How does the economy of IPL work ? How come players are paid so well ? What do team owners profit from ?
368826	What is your song about ?
368827	What are your favorite songs about spring ?
368828	My gf thinks we've lost our connection . What should be done to rekindle the connection ?
368829	What are some unusual connections you've made between things ?
368830	How good is the MS in CS program at University of Florida in terms of ranking , RA/TA funding , cost of living , fees , co-ops and job opportunities ?
368831	Did the University of Florida close their MS in CS program ?
368832	How much better will the JWST be than Hubble ?
368833	How is it God's plan to end the life of a young 11 year old boy ?
368834	`` What part of speech is'' `` then'''' ?''
368835	I'm a girl . My best friend (guy) that I've known 7 years is ignoring me because his girlfriend is jealous of me for no reason . Should I forgive him ?
368836	What are stereotypes about the United Kingdom ?
368837	What do Americans think about the United Kingdom ?
368838	Who was the best candidate in the 1992 election ?
368839	Who was the worst candidate in the 1968 election ?
368840	Why is there no democracy in Muslim countries ?
368841	How did Albania become a Muslim country ?
368842	Comparing living standard , immigration policy , and crime rates between the U.S. , Canada and Australia , do some Indians feel they made a wrong choice moving to the U.S. ?
368843	Did Teri Horton's Pollock sell ?
368844	What are the famous YouTube channels that every mechanical engineer should follow ?
368845	How much money per hour do Uber drivers make in Tijuana ? What's the most a person can reasonably make per month ?
368846	Why wasn't the planet Proxima Centauri b discovered earlier if it's so close to Earth , while other planets further away were discovered earlier ?
368847	How close to Earth would Proxima Centauri have to be for it to be seen by the naked eye ?
368848	Can anyone provide the list of best video lecture of world and Indian history for preparation of UPSC ?
368849	I think that the Kota is the best for IIIT JEE preparation , and I hear that some coaching institute provides Online video lectures , which is the best ?
368850	How do I manage diarrhea while on a college tour ?
368851	Why is NASA and SpaceX's agreement no funds transferrable ?
368852	What kind of projects get big tech companies' attention ? (Microsoft , Apple , Google , Amazon , IBM , Dropbox)
368853	Are open source contributions less impressive than personal projects to big companies like Microsoft , Amazon , Google , Facebook , Apple , IBM , etc. . ?
368854	What is the suitable temperature for humans in hill stations ?
368855	Which is the hill station where I can go with a budget of 3-4k ?
368856	What is a good review paper or book on visualization techniques in sports psychology ?
368857	Is sports psychology fun ?
368858	Why do we need receipts ?
368859	Why did it seem Hitler also hated black people ?
368860	Is it worth switching from Gmail to iCloud for email ?
368861	How is blade commerce controlled in Vermont compared to Louisiana under the knife legislation ?
368862	What is the best contact management software for iPad ?
368863	What are some good birthday gift ideas for a 13-year-old ?
368864	Can a patent really cost up to 10,000 dollars ?
368865	What is the story behind the alleged affair of SRK and Priyanka Chopra ?
368866	How is Priyanka Chopra as a person in real life ?
368867	If I apply for a green card and switch jobs after stage 1 , what will happen ?
368868	Whether i should apply green card or switch company ?
368869	How do I make girlfriends ?
368870	Why do alot of Moroccans have Iranian names ?
368871	How does a fingerprint scanner work on a smartphone ?
368872	Who is the most enigmatic Game of Thrones character ?
368873	How do I create a Hana database ?
368874	How do I create database and tables in AWS ?
368875	`` What are some examples of sentences using the word'' `` rancorous'''' ?''
368876	What will happen if I have two ebay accounts and delete one ?
368877	How do you learn to hack ?
368878	If I have a bachelor's degree in Biology , how can I get a job in USA ?
368879	What types of jobs can I get with a Bachelor of Science in Biology ?
368880	What does it feel like to be rejected from every Ivy League university ?
368881	What's it like to be a member of an Ivy League university's secret society ?
368882	What does Bryan Caplan think of Singapore ?
368883	What does Bryan Caplan think of Japan ?
368884	What are the 24 countries in the Montreal protocol ?
368885	Are most Haitians the descendants of slaves ?
368886	Why making roti is so important ?
368887	Tennis : What is it called when you win a game from 40-0 ?
368888	In tennis , why isn't 30-30 called Deuce ? And 40-30 (or 30-40) called Advantage ?
368889	Why does my dog lick herself ?
368890	What is the difference between a solar battery and a tubular battery ?
368891	What are the differences between smf battery and tubular battery ?
368892	How can I accelerate my personal growth ?
368893	Need help with my femdom addicition ?
368894	My gre score is 321 and my awa score is 3.0 . Does awa will hamper my chances in top 30 universities for ms in cs ?
368895	Is there any legal or reserved authority to use red ink for company stamp ?
368896	Does most of the ink contained in pens never get used up ?
368897	How is the Fayol's principle of management followed by Domino's Pizza ?
368898	I am working with Domino's Pizza for 24k as Assistant Manager . How can I convert my pay to 35k ?
368899	Why does sound travel faster in water than air ?
368900	Is sound travels faster when it is just on the border of two mediums than in those two mediums ? Or sound energy decreases slowly on borders ?
368901	Why are genetic algorithms not used ?
368902	What area or city in the US is likely to increase most in real estate values in the next , say , 5 years ?
368903	Why does Prince Caspian have to leave ?
368904	Who will have a better Bollywood career : Alia Bhatt , Shraddha Kapoor , or Kriti Sanon among actresses ; Varun Dhawan , Siddharth Malhotra , or Arjun Kapoor among actors ?
368905	What is your review of Kriti Sanon (actress) ?
368906	What is produced by the dehydration of 4-methylcyclohexanol ?
368907	What does the dehydration of 3-methylcyclohexanol produce ?
368908	Is pursuing law after economics hons a good option ?
368909	Is it a good option to pursue an LLB after graduation from an economics program ?
368910	Can we drink milk and beetroot mix juice ?
368911	Is it good for health to drink milk , fruit juices at night before going to the bed ?
368912	How successful is duodater.com ?
368913	How successful is fundingcircle.com ?
368914	How ItemStream interface is a maker interface in Spring batch 3.0.7 ?
368915	How intuitive are drag-and-drop interfaces ?
368916	Why is the United States compared , on the scale , as Europe , a continent ?
368917	Why don't cumulonimbus clouds form during the winter ?
368918	Which is the best WordPress theme that can be installed in blogger.com ?
368919	What should I know before buying an online franchise ?
368920	What are the foods that I should avoid to lose weight ?
368921	What is the single most effective food item to avoid eating in order to help lose weight ?
368922	What is research objective ?
368923	What is subjectivity and objectivity in research ?
368924	How do I get in a blood gang ?
368925	Where do seeders upload in the swarm in peer-to-peer network in torrenting ? What if all the seeders are offline while I download a torrent ?
368926	What is the most ridiculous thing you got grounded for ?
368927	Where can I find good clothing manufacturers in China ?
368928	Where can I find good clothing manufacturers in India ?
368929	Are small hands unattractive on a guy ?
368930	`` I went from being unnoticed and unattractive to being called'' `` close to perfection'''' by a guy . How do I not let this go to my head ?''
368931	How do oncologists feel about the rising incidence of cancer ?
368932	Does working at McDonald's give you a better opportunity to get hired in a job in the future ?
368933	I punch walls very hard with all my strenght and I Dont feen pain is it normal ?
368934	What was intrinsically wrong with the concrete apartment high-rises that went up in Britain of the 1960's ?
368935	What are the changes in land reforms that are to be taken by the Indian government for a better use of this valuable resource ?
368936	Is this true ?
368937	Do you think this is true ?
368938	`` Are there any billionaires out there who want to save'' `` polaroid pack-style film'''' that was recently discontinued by Fuji ?''
368939	How much data does Skype use per minute ?
368940	How much data does a Skype audio call usually consume ?
368941	How do websites store credit card numbers ?
368942	How do I encrypt a credit card number ?
368943	What reasons are there to use Go (programming language) ?
368944	What reasons are there to not use Go (programming language) ?
368945	How are fingerprints made ?
368946	What are fingerprints made of ?
368947	`` Do all physicists suscribe to the notion that , because time is relative , what we see as past , present and future events are , in reality , events that are happening simultaneously , or'' `` frozen'''' in time ?''
368948	Is Ada a dead language yet ?
368949	What does a Jew make of , or explain Paul's conversion to , acceptance of Christianity ?
368950	Why don't Orthodox Jews accept non-Orthodox conversions ?
368951	What's the difference between homologous and analogous organs ?
368952	What's the difference between a gland and an organ ?
368953	Why do all people thinks their opinion is important ?
368954	Why do people think it is important to go to prom ?
368955	What are the qualifications of Dr.Subramanian Swamy and what good has he done in Indian politics ?
368956	Who is/was the most badass Indian politician of all time ?
368957	What is your height ? Are you satisfied with it ?
368958	Why are things satisfying ?
368959	How do I calculate A+B - C * D$ E ?
368960	How can we calculate ((a ^ b + c ^ d) / m) % n in c++ ?
368961	Do you guys think that a building can boost the economy of country ?
368962	How do I convert Android mobile into Bluetooth headset ?
368963	How ? Can I gate call details
368964	What are the cutoffs after 6th Round at IIIT Bhubaneswar ?
368965	Is it necessary to forget your first love ?
368966	How do I understand flow charts ?
368967	What's the best way to make an interactive flow chart ?
368968	How do I install things on Linux ?
368969	How do you install XPlanner + in Linux ?
368970	What are the top product design schools around the world ?
368971	What are the top product design schools in India ?
368972	Why did Johanna Mason strip naked in front of everybody within the elevator in Catching Fire (the movie) ?
368973	Why does there seem to be such tension between Katniss and Peeta from the opening moments of The Hunger Games : Catching Fire (2013 movie) ?
368974	I am so emotional that I almost end up in tears while sharing my problems with people . How do I overcome this ?
368975	What's it like to live in Tallaght , Ireland ?
368976	What is the reason behind sudden drying of vagina while masturbating ?
368977	How do I get rid of a dry vagina ?
368978	How do you solve this equation ? [math] \ sqrt {x} - \ sqrt {x +3} + 1 = 0 [/ math]
368979	How do we solve this equation for x ? [math] \ ln \ sqrt {x} = \ sqrt {\ ln x} [/ math]
368980	How do you know a person is not lying to themselves when speaking to you ?
368981	How do I get into UC Berkeley for undergraduate ?
368982	Lost faith in humanity . Can you tell me how to stop letting all the bad things in the world from getting to me so much ?
368983	How can I have one telephone number that people can reach me all around the world (without getting ruined) and also to let me make cheap international calls ?
368984	Why does the longest wavelength of light bend less ?
368985	Why a shorter wavelength bends more than the longer wavelength when a ray of white light passess through a prism ?
368986	What did sources say regarding the refund of canceled Tatkal tickets ?
368987	How do you turn into an LLC ?
368988	Is ACA a cult ?
368989	Is Messianic Judaism a cult ?
368990	What is the best way to prepare for CFA level I exam ?
368991	Where can I meet new people ?
368992	Why do some Android apps need access to my photos and other media ?
368993	Why do some android applications require access to my contacts , photos , SMS messages , calls etc ?
368994	Does compulsory voting strengthen or weaken democracy ?
368995	How can I cast my vote via post ?
368996	How come fibre reinforced composites behaviour depends upon the direction of loading ?
368997	How do I calculate the fraction of energy being absorbed individually , when a composite (ceramic + foam) is subject to impact loading ?
368998	What are some of the most interesting courses on iTunes U ?
368999	What are some of the most interesting iTunes U courses or collections for beginners in any given discipline ?
369000	What are some of the real life applications of probability ?
369001	How does real life probability work ?
369002	I want use the Google Apps Email Audit API in my web portal for auditing emails . How can I implement this ?
369003	What mixes well with vodka ?
369004	I am a college graduate and decided to start my own business online with my friend , how can I persuade him to join me ?
369005	Business School : I've just completed my B.Tech with a very poor percentage . I've a dream . I started loving finance , specifically banking . I am going to join the Indian public sector bank . How much experience , and which educational course and college , can get me into IMF or W.B. ?
369006	Are there good PhD programs for Second Language Acquisition in Europe and the UK ?
369007	Can I get into a good business PhD program ?
369008	If you have two photons with equal wavelengths and one has a bigger amplitude , what would that mean , would the photon have more energy ?
369009	How can you change the energy of a photon ?
369010	How do I convert system verilog codes to vhdl ?
369011	Where can I buy a leather jacket in Delhi ?
369012	Where can one buy classy , casual , cotton jackets in New Delhi , India ?
369013	Is it successful to use garlic juice to regrow one's hair ?
369014	Approximately how much money do music artists make from 1 song ?
369015	How do you elaborate a kite for the Makar Sankranti kite festival ?
369016	How can I look good like Ashton Kutcher ?
369017	I have to join a new organisation within 3 days and now suddenly my work visa gets approved . How do I decline them in polite way ?
369018	If my mind was replicated on a computer and I died , would the computer ` me' be actually me or just a clone who happens to have all of my memories ?
369019	Is there a way to prevent my shoe soles from wearing out unevenly ?
369020	How do we get a shoe-bite ? Is there any way in which we can prevent shoe - bites ?
369021	What are good ways to impress in an interview for Product Management ?
369022	What are some of the best Hindu baby boy names starting with an M ?
369023	What is the difference between toxic and neurotoxic venom ?
369024	Why do men always flaunt their desirability amongst women ?
369025	What is the simplest method to kill an ant without having its blood smudged all over the place ?
369026	How is Meerut Institute of Engineering & Technology in terms of campus and academics ?
369027	Why is it so much easier to indulge in sadness than in happiness ?
369028	How can you stay happy in a world with so much misery ?
369029	If I'm no longer seeing gains by microloading weight and have hit a plateau by doing 10-13 reps , should I start lifting heavier weights for less reps ?
369030	If I hit a plateau in my workout where I am microloading and doing 11-13 reps , should I start lifting heavier for less reps ?
369031	Why do I have untanned parts of my body darker than others ?
369032	What part of your body is part of you ?
369033	Which is a suitable inpatient drug and alcohol rehab center near Meriwether County GA ?
369034	Are we being slaves to money ?
369035	What is the purpose of comments ?
369036	Which is the best app/website to get knowledge about world politics ?
369037	Is there any app or site through which I can get detailed knowledge about banking terms in hindi language with authenticity ?
369038	If a contract exists with 3 signees and one of them broke the contract , is this contract null and void ?
369039	Does a contract need to stipulate how it can become null and/or void or can it depend on outside causes ?
369040	What is expected cut off for SSC CGL 2017 ?
369041	Is ICICI Bank a good place to work ?
369042	What is the simple meaning of AD Networks ?
369043	How do ad network send traffic ?
369044	Is it possible to get buff without the use of protein powder or such ?
369045	How can I build a IA bot that can do things like IBM Watson ? (ie : summarize a website to find a cure to cancer , inventing a new recipe ...)
369046	How can I remember all the method and interfaces of servlets ?
369047	How do I write my CV as fresh computer engineer interested in software development ?
369048	I want to buy a small piece of land for my house in Norway , is that possible ?
369049	I want to buy land and build a plaza . How do I do this ?
369050	What are the side effects of Ibuprofen ?
369051	Any good web resources / books on SystemC ?
369052	Where can one get best resources for systemc and tlm ?
369053	Which are the most important airsoft fields in Colorado ?
369054	If I transfer money through Paytm to another non Paytm register mobile number then how can I use that money ?
369055	`` Why do people say'' `` the powers that be'''' instead of'' `` the powers that are ?''''''
369056	Why would Trump have the cheek to say the establishment is against him after he had used the establishment to avoid serving in Vietnam ?
