480000	Site is showing broken images from wp-content after switching to catalyst . How do I fix or can I add a redirect through ht.access ?
480001	In a war between Iran and an Egypt/Saudi Arabia alliance , which other Middle Eastern states/entities would be involved , and on which side ?
480002	What is the historical background of Chinese workers in Australian gold mines , and how does gold production compare to production in Indonesia ?
480003	What are the differences between Asia and Africa ? What are the similarities ?
480004	What is difference between Cableway and Ropeway ?
480005	How do you get anthrax ?
480006	How do I record a WhatsApp video call ?
480007	Do celebrities or politician use their social media accounts or someone else ?
480008	Diamond in loops c++ ?
480009	Should I leave my girlfriend ?
480010	How do I leave my girlfriend ?
480011	Astrology : What are the effects of Rahu Mahadasha ? How can the bad ones be mitigated ?
480012	Why is pewter so expensive , and how does its properties compare to those of silver ?
480013	Why is Thumbtack better than Redbeacon ? Does any of them have a sales team ?
480014	How does the lead score help the sales teams ?
480015	Michael Jackson died and now Prince . Will we ever see their equal again ?
480016	Does YouTube pay per video or channel ?
480017	Will I have another grow spurt Will I hit 5'10 I'm 5' 7 or 5' 8 male 17 year old my mom 5' 5 dads 5' 10 ?
480018	I am a BE E&TC student preparing for CAT with only 3 months remaining . How much should I score to get into IIMs . Also I am a SC candidate ?
480019	How can you solve [math] x ^ 2 + y ^ 2 - 12x - 4y = 0 ? [/ math]
480020	What is the angle of intersection of the curves [math] x ^ 2 = 4y [/ math] and [math] y ^ 2 = 4x [/ math] at point [math] (0,0) [/ math] ?
480021	Do health and social care services promote learned helplessness ?
480022	I like a girl from another department in my college for the past 2 years but I'm clueless of how I should initiate the conversation.How should I ?
480023	How much will a salary hike after the 7th Pay Commission for someone currently working at the basic pay scale of 15600 ?
480024	How can one form a new language ?
480025	How is a new letter formed and is it possible for a new letter to be in the English language ?
480026	Why do people say Barack Obama has done a bad job ?
480027	How do you evaluate the integral [math] \ int \ frac {5 +6 \ sin x} {\ sin x (4 +3 \ sin x)} \ mathrm dx [/ math] ?
480028	How do I evaluate the integral [math] \ int \ frac {1} {(1 + x ^ 3) ^ 3} dx [/ math] ?
480029	What is [math] \ frac {d} {dx} (x \ sin (x)) [/ math] ?
480030	What is [math] \ frac {d} {dx} | x | [/ math] ?
480031	How do ear buds work ?
480032	Which is a better option mba from guru nanak dev University or MS from canada ?
480033	What will be the most powerful countries in 2020 ?
480034	How accurate is Donald Trump's claim that his personal financial disclosures are more thorough and helpful to the voting public than tax returns ?
480035	How do you know if someone truly likes / loves you from the goodbye ?
480036	Why are there too many policewomen in the USA ?
480037	What are the engine materials for honda CB shine 125cc ?
480038	Do you prefer buying Honda shine SP to Hero glamour and other 125cc bikes ?
480039	Why is the book The Alchemist so popular ?
480040	How do I view a private Instagram ?
480041	What are the best treatment for acne ?
480042	If Trump and Clinton are so silly/wanting as candidates then why are they the only choices we have (the only 2 people that could actually win) ?
480043	What is the actual definition of maturity ? If age is the only thing that matters , then why do we keep using such words as moron ?
480044	What is digital testing ?
480045	How can speed of light constant for moving and stationary source in vaccum ?
480046	`` The clock paradox states that if one clock would stay without movement and the second moves , the moving clock will go slower that the stationary one . As we know all bodies in space are moving constantly , how can we decide which clock is'' `` stationary'''' and which is moving ?''
480047	What are the things I must watch out for before starting with FundsIndia ? And is it secure and good enough to start investing through it ? And what happens if it shuts down ?
480048	I am 21 and currently invest $ 200 per month into a mutual fund . Is there a better way to start out with investing ?
480049	Which is the best place to learn baking in Mumbai ?
480050	Which is the best site to learn baking like a pro at home ?
480051	What would be the temperature during different season if earth had no tilt ?
480052	If Europe unified itself and reorganized/rebuilt its military to the fullest , could it defeat the United States ?
480053	What is the best TV I can buy for # 600 which is at least 49 inches and suitable for playing emulated games ? Should I be looking for a 4k 10 bit HDR ?
480054	Do guys get turned on in your presence because they are attracted to you ?
480055	Jupiter is a gas giant . Could you fly a rocket through Jupiter and out through the other end ? (excluding gravity)
480056	Some gas giants show the atmosphere blended to a near-uniformity , while Jupiter's clouds are an endless churn indicating distinct chemicals refusing to form an emulsion . Why is this different ?
480057	How do I solve explorer.exe error in windows 10 ?
480058	What are the best satiricial and comical plays to stage that is an hour long ?
480059	What shall I speak when I am asked to speak for a minute ?
480060	What is the scientific consensus on 9/11 ?
480061	What is a scientific consensus ?
480062	What is the best way to improve your writing style ?
480063	What are some mind-blowing facts about comibatore ?
480064	What are some mind-blowing facts about ` Thirukural' ?
480065	How does law deal with infinities and paradoxes ?
480066	Suggest Good Book of European History ?
480067	Was this an IQ test ?
480068	What's the hardest major at Columbia University ?
480069	How valuable is a PhD from Columbia University ?
480070	What can I do to improve my family's condition ?
480071	How do I improve ourselves at home with family ?
480072	When naming your business , what is the most important aspect to take into consideration ?
480073	When is it a good idea to name your business after yourself ?
480074	Who is the first man of the world ?
480075	Who is the first women & first man in the world ?
480076	Can the Holy spirit be seen ?
480077	What does the blue tick mark beside the names in Instagram mean ?
480078	What is the connection between Pink Floyd and Alice in Wonderland ?
480079	What is the connection between Pink Floyd and the Illuminati ?
480080	What are the places to visit around IIT Guwahati ?
480081	Why are we not using thorium energy ?
480082	What is meant by thorium being a fertile material ?
480083	Why do people honk so much in Bangalore when honking is a far no solution to traffic jams ?
480084	What is long term solution to save Delhi from traffic jam in the future ?
480085	How can I get HSN code of works contract for VAT registration ?
480086	What is the procedure of getting VAT and CST number ?
480087	How would it be to start career in IT industry in the application performance management or monitoring ?
480088	Is the ice cap in Antarctica getting thicker or thinner ? Is Antarctica getting colder or milder ?
480089	Is Hillary Clinton a criminal mastermind or completely innocent ?
480090	Is Hillary Clinton a criminal ?
480091	In Minecraft , if I plant some seeds and go away do they grow ?
480092	Which OS is more used : Ubuntu or Windows or Mac ?
480093	How often can you use egg mask on your face ?
480094	What kind of facial mask do you use on your face ?
480095	What is legal formality in food dipartment in ahembdabad ?
480096	What sideway certifications could add value to the job prospects of a newly qualified ACCA member ?
480097	What does Google do with all the leftover free cafeteria food at the campus ?
480098	What does Facebook do with all the leftover free cafeteria food ?
480099	What are the different purposes of the US Air Force ?
480100	What is the scope of BSc in India ?
480101	Which Holy Roman emperors had the most authority over the members of the Holy Roman Empire ?
480102	How can I find a band to join as a guitarist ?
480103	How do I find a guitarist ?
480104	What is your review of Markandey Katju (former Chairman , Press Council of India) ?
480105	According to Mr. Markandey Katju : 56 of 86 SDMs in U.P. selected in P.C.S. in the last 3 exams belong to one caste . Is this fact correct ? If yes , is this a coincidence or what ?
480106	Which European countries are the easiest for Americans to immigrate to ?
480107	What is the solubility of acetone in water ?
480108	By Registering and paying for XAT 2017 , am I eligible for XLRI and other Associate Member Institutes ?
480109	I appeared for JEE advanced first time in 2016 and year of passing 12th is 2015 . So am I eligible for JEE advanced 2017 ?
480110	What organization can impose a recall election in a country ?
480111	How can you reduce the heat and sound energy wasted from the electric lift ? Scientifically
480112	What do you do when your parents show favoritism towards your younger siblings ?
480113	Why do some first borns have internal rage issues and antagonism towards their younger siblings ?
480114	Why was discontinuing of 500 and 1000 rupee notes done so abruptly ?
480115	How do I start a small scale manufacturing business in India ?
480116	How do I start a small scale business without any investment ?
480117	Do I need to be 21 for me to be eligible to appear in TISSNET 2017 ?
480118	Which Smartwatch is preferably better under 10000 / - ?
480119	What is CIF in the Army ?
480120	What causes my car to loose power ?
480121	What is the difference between structural steel and normal carbon steel ?
480122	Which is the most corrupt service in UPSC ?
480123	Which is the least corrupt service in UPSC ?
480124	Why the world is so mad ?
480125	Do you think the world is mad ?
480126	How to round of 0.196 to nearest the hundredth ?
480127	What are some every day uses for confidence intervals in statistics ?
480128	How can statistics be used in day-to-day life ?
480129	What tools are used by professional traders in their daily work ?
480130	Are professional traders better at investing than non-professional traders ?
480131	How do I burn fat in the morning ?
480132	Why can't astronauts eat normal food -- like a bowl of spaghetti and a salad ?
480133	Why do smaller people eat less food ? Don't they get hungry ?
480134	To SNL - - shall you apologize to Trump for showing him using a computer ?
480135	What went wrong with other telecom companies which favored to reliance jio ?
480136	What are the most affordable advanced digital marketing courses around online now ?
480137	What is the best way to protect endangered species ?
480138	What is the difference between a salamander and a newt and toad ?
480139	What is the difference between a salamander and a newt ?
480140	What are the best cars to buy in Dubai ?
480141	I am from India and am visiting Dubai during DSF . Where can I buy a good , genuine laptop and car audio accessories for the main unit with international warranty ? Will there be a price difference compared to India ?
480142	How do I sleep well with a cold ?
480143	What if one clears tier 1 of SSC CGL and fail in tier 2 ? Do i have to give tier 1 again ?
480144	How did DeviantArt get started ? What was their initial user acquisition strategy ?
480145	How do I get initial users for my book rental startup ?
480146	How is Christianity different from Judaism ?
480147	I was recently hired at Accenture in the Netherlands in technology consultancy . I was hired at level 11 analyst with 12 months at this level . How much time will it take me to get my first promotion to consultant ?
480148	My career level in Accenture is 11 . How will I get promoted , and the salary increment if I work for lifetime ?
480149	If I wanted to become an assassin , how would I start ?
480150	How end customer can suggest more use cases to established startups , that might interest the founders/management ?
480151	How can I learn to be an effective product manager at an IT startup where I am one of the co-founders , however with no previous work experience ?
480152	What are trusted credentials ?
480153	What trusted credentials are real for android ?
480154	Who created Uber's black and silver design language ?
480155	How long is the queue for uber black at lax ?
480156	Is realvision worth the cost ?
480157	Is Nutanix worth the cost ?
480158	Who is the ideal wife from your (a male) point of view ?
480159	What are your expectations of marriage , from a personal (male or female) point of view ?
480160	Is there awareness of whey protein in India ?
480161	I have always have acne but now the blemishes have increased . What can I do ?
480162	Why are so many Australians and English inducted into the ICC Hall of Fame instead of better Indian players ?
480163	Are there any surviving original gas chambers from the Holocaust ?
480164	What sort of gas did the Nazis use in the holocaust gas chambers ? Why ?
480165	How good are Insignia subwoofers ?
480166	What would you do with a million dollars ?
480167	Why do I always feel the need to tell someone what am I doing at the moment or what I've done ?
480168	I just completed my graduation . I have good friends . I got an awesome job at a beautiful place . But still I am always sad because I don't have someone I want . Why can't I stay happy from all the things I have ? What can I do ?
480169	What is virtual lab ?
480170	Is reality virtual ?
480171	What are DIMM slots in my motherboard ?
480172	Should I have a dual processor motherboard ?
480173	What are the environmental impacts of the tourism industry and how does it negatively impacted Singapore ?
480174	What caused the fall of the Weimar Republic ?
480175	What are the achievements of the Weimar Republic that were not destroyed during the Third Reich ?
480176	Why does my dog get angry when he sees me looking in the mirror ?
480177	How do growth and development contrast ?
480178	How can we control the behaviour of a computer ?
480179	What are the appications of computational neuro science ? How can we apply this to a thought controlled wheel chair ?
480180	Is there any technology that can cause a psychopath to feel emotions ?
480181	Parents : Would you rather your young , able-bodied child died or lived with severe , disabilities while retaining most , but not all , cognition ?
480182	Would you rather be born with incredible amounts of knowledge without being able to learn further or would you rather be born with absolutely no knowledge (even innate) but be able to consume endless amount of knowledge during your life ?
480183	Want to know MBA is better or PGPM ?
480184	Is IBS Pune good to pursue MBA/PGPM ?
480185	Is the same commercial grade of Shell Advance Ultra engine oil used in Ducati's MotoGP Bike ?
480186	Which is better engine oil for my Activa 3G , shell engine oil or Honda oil ?
480187	A person named Kirti Ambani was accused of eliminating Nusli Wadia ? Were is he now ? What is his relationship with Ambani family ?
480188	How did Anil Ambani graduate from Wharton ? Is he really so intelligent ? Or there it because he was an Ambani scion ?
480189	How many people read comics online ?
480190	How do you determine the formula of the square footage of a circle ?
480191	How do you find square footage area of a circle ?
480192	Can you advice me some Irc channels where I can find and share support for php , html , css , javascript , ruby on rails development ? Or also if you know a different platform instead Irc , let me know , but it should be in real time (as a chat) .
480193	What are the gems every Ruby on Rails developer should know ?
480194	How can I get drivers for Windows 7 if I want to do recovery ?
480195	Is liquefaction analysis possible in abaqus ?
480196	Diamond is a paramagnet?paramagnet
480197	How does it feel to get first goodies from online coding contests held by popular sites like : Codeground.in , Codeforces , or HackerRank ?
480198	`` Should I be worried about the stuff that I see around the'' `` dark/deep web ?''''''
480199	Can you name 10 hidden gems in Berlin that absolutely can't be missed ?
480200	If there lived a sentient alien species in the universe would they be at or around the same intelligence as us ?
480201	What kind of exercise should be done before playing a game of badminton so that there is no pain in the hand after playing ?
480202	Shall I join SAP Labs ?
480203	Should I join SAP Labs or Informatica ?
480204	What kind of (odorless) alcohol should you drink before a job interview ?
480205	From where do they pick up questions for CAT ?
480206	Can India be corruption free ? How and how much time will it take ?
480207	Is it true that the human lips are made of the same material that surrounds the human anus ?
480208	What is the true significance of human life ?
480209	How much should I score in TMISAT 2016 ? I have scored 86.3 % in PCM ?
480210	Should Lokpal Bill be passed ?
480211	Has the Lokpal Bill passed ?
480212	I always feel sleepy when I start studying . What can I do ?
480213	Ihave Lenovo A6000 bymistake delite some data now I canot save my contact no alwase showing contact is being update ?
480214	What does this mean in English : 莫斯科郊外的晚上 。 一个静悄悄的无风之夜 。 ?
480215	How much is a 1915 Canadian penny worth ?
480216	How much is a 1978 Canadian penny worth ?
480217	Where can I find startup advisors ?
480218	How can i find Advisors who can help me with startup incorporation ?
480219	If I still have a mark on my skin due to a cut from over five months ago , is it a scar ?
480220	I accidentally cut off pea sized skin from scalp while shaving , will it cause scar or hair wont grow there again ?
480221	Does sterling silver turn black ?
480222	What are some suggestions for buying sterling silver and handmade silver jewellery online in Australia ?
480223	What are some great uses of imagery in rap lyrics ?
480224	What are super powers ?
480225	Must every tenant on a residential lease have a background/credit check according to NYC law ?
480226	How do optical telescopes work and what are they used for ?
480227	Is corruption human nature ?
480228	Should Jack Ma help this poor man ?
480229	Is Melbourne a safe city for an Indian student ?
480230	Is Georgia a safe place for Indians students ?
480231	Can a snake kill an elephant ?
480232	Am I the only one to consider or feel Rockstar is one of the best movies of Bollywood ?
480233	In a job interview , how do I explain leaving my last position because of a toxic work environment ?
480234	My co-worker , a narcissist , is created a toxic work environment . Before I leave the company , how do I determine my legal options ?
480235	How is the Maldives for business ?
480236	How is maldives ?
480237	Why do people cry for no reason ?
480238	Why do some people like crying so much ?
480239	How is twin flame journey ?
480240	What are some cool things to do in NYC ?
480241	Can one smoke up and board flight ?
480242	Is there an immigration check when I leave UK as I enter UK or they take data from the airlines ?
480243	How long did it take to get your uni offer from UCAS ?
480244	Is an advance paid to a hotel refundable ?
480245	Is Google Pixel XL available in Athens , Greece ? Which shop ?
480246	How is RSS (Rashtriya Swayamsevak Sangh) different from other organisations ?
480247	How do I get prepared for a Google interview ?
480248	If I update my iPhone 4s to iOS 8.2 , will I still be able to play music from it via the dock connector in my 2009 Toyota ?
480249	Will Gevey sim work on my iPhone 4S updated to iOS 7 ?
480250	How can your location be identified by your IP address ?
480251	Now that McDonalds serves all day breakfast , will they now serve lunch before 10:30 ?
480252	What can be served with parfait for breakfast ?
480253	Which are the best institutes in Mumbai for SAP FICO training ?
480254	What universities does Farmer Brothers recruit new grads from ? What majors are they looking for ?
480255	What universities does toll Brothers recruit new grads from ? What majors are they looking for ?
480256	Why do some people not use the internet ?
480257	Why do people use internet for hours ?
480258	Who according to you is the most evil superhero comic-villain ?
480259	Who is the most unlikable movie villain ?
480260	Is smoking Marijuana more harmful than consuming edibles ?
480261	How do I prepare for entrance exam for event management IIEM delhi ?
480262	Is it possible to stand still in outer space ?
480263	Why can't we use kerosene as a fuel in engines though it's calorific value is nearer to diesel ?
480264	Why did MithaiMate , the online mithai store , close down ?
480265	What is the best online scooter store ?
480266	Does Donald Trump have leadership experience ?
480267	What is the # 1 obstacle stopping you from being more productive ?
480268	What are top fashion brands in the world 2016 ?
480269	What are the main issues that France needs to address to set it on the best path for continued progress and prosperity ?
480270	Is is right to say , he wrote to me or he wrote me ? And I sent an email to him or I sent him an email ?
480271	I sent an email in a hurry to my recruiter , but mistaken her with him . Should I be worried ?
480272	How should I manage time in 1st Year MBBS to study everything that I study in uni everyday ?
480273	What are some of the coolest / most unusual / strangest jobs ?
480274	Will Mumbai Indians win 2016 IPL ?
480275	I am having first attempt score 46 % in VTU belaguam . Is it eligible for govt jobs ?
480276	Which one is better , hard work or smart work ?
480277	How does one get to have many sexual partners ?
480278	Is it possible to have a prolong period and test positive for pregnancy ?
480279	How could you lose weight as fast as possible ?
480280	Documents for Indian passport ?
480281	Where can I find the implementation of accept system call in Linux kernel source ?
480282	When robots are available will retrieving gold from old technology become more popular ?
480283	How can I match two patterns in same grep command , one is number and second is date ?
480284	Is there a country less racist than the United States ?
480285	Is it true that The United States has invaded more countries than any other since WWII ?
480286	Why is my pinky finger numb ?
480287	Why is my pinky finger itchy ?
480288	Is there a quora clone site ?
480289	What is the clone site ?
480290	How can I make a decision about going out with a hookup or going to my aunt's New Year afterparty ?
480291	Is bitcoin legal in India ? I want to buy some bitcoin
480292	Catchy dance slogans ?
480293	Which s the best book for IBPS it offcer ?
480294	Which is the best book to learn Japanese ?
480295	Who is the greatest ` minor' composer , say including the likes of Czerny , Clementi , Hummel , Cramer , and Arne maybe ? (or any other)
480296	What's your opinion on Czerny Op. 299 ?
480297	What is the best alternative to Deviantart for illustrations ?
480298	How good are the Renault Cars ?
480299	Why don't we have 2 seater cars like Renault Twizy in India ?
480300	Why do developing nations still embrace democracy ?
480301	Why doesn't the democracy in India work compared to other developed democratic nations ?
480302	Are these good photos ?
480303	Is there any good AM FM Radio Set with Bluetooth available in India ?
480304	2012 Summer Olympics in London : What happened to Stephanie Rice in the 400m individual medley ?
480305	2012 Summer Olympics in London : Why do Olympians on Team USA have to pay taxes on the medals they win for the country ?
480306	Which currencies are backed by gold as of 2016 , and what about Indian economy ?
480307	Do any countries back up their currencies with gold and why ?
480308	What are the hardest adjustments to make when visiting Syria ?
480309	What are the hardest adjustments to make when visiting Poland ?
480310	Why is it a turn off for some women because a guy care for his mother ?
480311	How do I find my iCloud security code ?
480312	Did Muhammad really exist ?
480313	What are the advantages and disadvantages of consumerism ?
480314	What are the defining characteristics of consumerism and the concept of the Consumer ?
480315	How can one crack a job interview ?
480316	How do I crack embedded job interview ?
480317	How can I restore old photos and save vintage prints and family pictures from wear and tear ?
480318	After pulling out I still made her take unwanted 72 due to precum . Is there still any chances of pregnancy ?
480319	Who is best physics teacher for IIT JEE in Kakadev Kanpur ?
480320	Which is best book for the physics problem solving for IIT jee ?
480321	What is the share price ?
480322	What is the share price of Flipkart ?
480323	What role can a bioengineer play in the Indian Army ?
480324	What is the role of an engineer in the artillery arm of the Indian Army ?
480325	What are the hazards of sipping whiskey ?
480326	I'm a very reserved person and I have no social life and very few friends . What should I do to have a better social life ?
480327	Is it true that more friends you have in Facebook makes you very social person in life ?
480328	Where is the fan located on the Macbook Pro ?
480329	What is the ethnic background of the majority of the people from Jalisco , Mexico ?
480330	How can I use the stock market to profit from Trump winning the presidency ?
480331	How many airport's does America have ?
480332	What are best apps using YouTube ?
480333	What are non linear dielectrics ?
480334	When does Infosys Mysore start its next batch after August 2016 ?
480335	When would we expect the next batch from Infosys after august 29 2016 ?
480336	Why do people think a ninth planet exists ?
