test-613631	Could we terraform the moon?
test-613632	Is the Blackfish really dead?
test-613633	Where is the Blackfish now?
test-613634	How can I invest in international funds?
test-613635	How should one invest in a fund?
test-613636	How was your UPSC prelims 2016 experience?
test-613637	How can I learn to code/program an online banking app/website?
test-613638	Why is it customary to pour milk into a teacup before pouring in the tea?
test-613639	Is it healthy to drink milk tea daily?
test-613640	How anonymous is anonymous on Quora?
test-613641	How anonymous is an anonymous post on Quora?
test-613642	Where do you get injected from when using anabolic steroids?
test-613643	What would Howard Zinn's reaction to Trump be?
test-613644	What's the average speed that clouds move?
test-613645	What is the average lifespan of a cloud?
test-613646	Can two apps have the same name? If I name my app the same thing will I get in legal trouble?
test-613647	Can I get an app in Android that has same function as VLC of PC?
test-613648	Which is the best degree: a BBA or a BCom?
test-613649	I want to do an MBA. What's better, a B.Com or a BBA?
test-613650	If you want to sum up your life in 10 words or less, what words would you use?
test-613651	What is one word you would use in regard to how you handle your life? And why?
test-613652	What are the pros and cons of centrally planned economy?
test-613653	What are the pros and cons of a cashless economy?
test-613654	How is the word 'avaricious' used in a sentence?
test-613655	How is the word 'wistful' used in a sentence?
test-613656	How should I reduce my belly naturally?
test-613657	How do I reduce fat?
test-613658	How many dates should I eat a day?
test-613659	How many days it will take to purify blood if we eat garlic cloves?
test-613660	Can I get IT in manipal main campus with rank of 5536 (muoet 2016 ) ?
test-613661	Can I get IT in Manipal main campus with a rank of 5190?
test-613662	What is the best programming language to know overall?
test-613663	What are good programming language to start with before I advance?
test-613664	What is the price of Hydraulic cone crusher?
test-613665	Is there a mobile cone crusher for sale in Botswana?
test-613666	For frying, what is the healthiest oil I could use?
test-613667	What's the healthiest oil for deep frying?
test-613668	What is positive leadership?
test-613669	How would you define great leadership?
test-613670	What should I do after getting rejected by a girl?
test-613671	What should I do after getting rejected by 3 girls in a row?
test-613672	Is eating the same thing every day healthy?
test-613673	Since I stopped eating meat my skin cleared up, I feel better, and have more energy. Why? I thought meat was good for us.
test-613674	How should you prepare for NID 2017 entrance exam?
test-613675	Which are the best coaching classes to crack nid entrance exam?
test-613676	Why American wages are stagnant?
test-613677	The GDP per capita in Australia adjusted for inflation is 2x what it was in 1980. If we're so much richer as a country, what excuses does the previous generation have for why they saddled today's youth with massive student debts, soaring house prices and stagnant wages?
test-613678	What's so bad about a highly unequal concentration of wealth?
test-613679	Philosophy: Is the concentration of wealth a good or bad thing?
test-613680	How do I find topics and answers that I've bookmarked on Quora?
test-613681	Can I only bookmark the answers that contain my 15 topics of interest in Quora?
test-613682	What is it like to attend Nanyang Technological University?
test-613683	What is your review of Nanyang Technological University?
test-613684	What are the advantages and disadvantages of a city life?
test-613685	What are the advantages of city life? What are the disadvantages?
test-613686	What could happen at the end of this Game of Thrones Season?
test-613687	What happens to Daenerys at the end of Game Of Thrones Season 5?
test-613688	What is the elastic limit of steel?
test-613689	What is an elastic limit?
test-613690	What are the requirements to start a social media agency?
test-613691	How can I start working in social media content analysis?
test-613692	Where can I find a nice guy in Hyderabad?
test-613693	"Who is a ""nice guy""?"
test-613694	Is affiliate marketing expensive?
test-613695	Is affiliate marketing really profitable?
test-613696	How can I become fluent in Spanish?
test-613697	How did you become fluent in Spanish?
test-613698	What are some of the good movies based on Mythology?
test-613699	What are the best movies that are based on novels?
test-613700	How do I open a SBI account?
test-613701	How can I select the branch in online account opening in SBI?
test-613702	How do you build a bookshelf from scratch?
test-613703	How do you build a bookshelf?
test-613704	Do deaf people think in sign language or text? Explanation in details.
test-613705	If a person is born deaf, which language do they think in?
test-613706	What is the average living cost in Nairobi, Kenya?
test-613707	What are the things to do in Nairobi, Kenya after 4 pm?
test-613708	What are some examples of aerobic bacteria and anaerobic bacteria?
test-613709	How can I adopt a child not in the foster care system?
test-613710	Why is it so hard to learn swordsmanship?
test-613711	I found a tiny lump, about the size of a curled up ant, on one of my testes about 4 years ago. Besides cancer, what could it be?
test-613712	What are the best ways to improve my memory?
test-613713	What is the best way to develop your memory?
test-613714	Is it a good choice to buy a MacBook pro 2015 instead of the 2016 version?
test-613715	Now that MacBook Pro 2016 is released, what will the price of MacBook Pro 2015 be lowered to?
test-613716	If I am storing my JSON Web Token in a httpOnly cookie, what is the best approach to persist the user session on the client side?
test-613717	What is your favourite experience at IITH?
test-613718	Are there ladies on Quora who have experienced dp (double penetration) and would like to share their experience?
test-613719	What does it feel like for a woman to have an orgasm?
test-613720	Why do you use Pinterest?
test-613721	What do you use Pinterest for?
test-613722	Is Adam Levine, the lead singer of Maroon 5, able to hit unusually high notes for a guy or does he just sing well?
test-613723	How do you sing high notes?
test-613724	If I accept a seat allotted to me in the first round of the JoSAA counselling, then, when I have to get admission and when to pay fee?
test-613725	Why don't movie makers make their 'now playing' movies available in flights on pay per view basis during the flight?
test-613726	Does MDMA make you horny?
test-613727	Does mdma make girls horny?
test-613728	What are the top 6 Lightsaber users who don't have the Force?
test-613729	What is a matriculated student and why is this so important to education?
test-613730	What are the best indian army war based movies which every Indian must watch?
test-613731	What are the best movies every youngster must watch?
test-613732	What is the best way to watch porn?
test-613733	How do I watch porn in Pakistan?
test-613734	Mother is O+ and father is RH- what is the child's blood type?
test-613735	What blood type can be found if a mother has type AB blood and the father has type A blood?
test-613736	How do I answer something anonymously?
test-613737	I am new to Quora. How can I answer a question anonymously?
test-613738	Could you list the different ways in which people can make money online?
test-613739	How do I earn more money from online?
test-613740	What is the Bermuda Triangle?
test-613741	What is the truth behind the Bermuda Triangle?
test-613742	How can I improve my english?
test-613743	How can learn English?
test-613744	What are all the relativistically invariant properties?
test-613745	What is relativistic invariance?
test-613746	How do I know if an Android device is running on ARMv7 or ARMv6?
test-613747	Will Blackberry devices like Q10 and Z10 ever run Android OS?
test-613748	Is listening to music through headphones/earphones harmful?
test-613749	What do I do if I hate listening to music through headphones or earphones?
test-613750	Koreans, how did you become fluent in English?
test-613751	How can one become fluent in English?
test-613752	Which one I should choose?
test-613753	Which one should I choose?
test-613754	How do I root android 5.1.1 lollipop without pc?
test-613755	How do I downgrade xperia z1 lollipop 5.1.1 without rooting?
test-613756	If I have to go in NDA by arts, what are the subjects in arts?
test-613757	Can I start my own venture if go into networking rather than development?
test-613758	What have been the best episodes on New Girl, and why?
test-613759	"In the show ""New Girl"", why did Jess have to stay away for a month in the ""Jury Duty"" episode?"
test-613760	What platform was Snapchat's MVP on? How much did it cost them to get it up and running?
test-613761	How much does it cost to run a zoo? What are the biggest expenses?
test-613762	What is the difference between gearing and leverage and debt to equity ratios?
test-613763	In regards to PE investments in companies that aren't yet profitable, how does PE secure debt? What are the interest rates? What is ratio equity/debt?
test-613764	How can I earn money through internet?
test-613765	How do I earn more money from online?
test-613766	Is it possible to get 100% funding for a new business from an investor, based solely on a business plan?
test-613767	How do I get funding from investors for my business idea?
test-613768	"What is meant by the phrase ""appointment by the President by a warrant under his hand and seal""?"
test-613769	"What is meant by the phrase ""you are so corny""?"
test-613770	What is the difference between broadcast and telecast?
test-613771	What is the difference between cable and broadcast?
test-613772	What is the best way to lose weight at home/office?
test-613773	What's the best ways for obese people to lose weight?
test-613774	After researching the Salem Witch Trials, what motivation could you ascribe to the accusers?
test-613775	How do you think the internet has changed the world negatively?
test-613776	When will the EUR go up again against the USD?
test-613777	Though it is illegal in India to trade EUR or USD. Is there any other way to trade EUR or USD?
test-613778	Best Things About X: What is the best thing about Brussels?
test-613779	Best Things About X: What is the best thing about Chicago?
test-613780	What does the Large Hadron Collider do?
test-613781	Who turns on the Large Hadron Collider?
test-613782	In how many ways can 4 letters be posted in 5 letter boxes?
test-613783	2 red balls, 2 white balls, 2 black balls in how many ways they put in the 4 box such that no same color balls put in consecutive box?
test-613784	What is the cost of brazilian jiu jitsu in cebu philippines?
test-613785	Is there a market for brazilian jiu jitsu in cebu philippines?
test-613786	As an extremely experienced user of R, what limitations do you find with the language and where would you like to see improvements?
test-613787	Who is the best jazz guitarist?
test-613788	How do I convince myself that God exists?
test-613789	How do I believe that God is exist?
test-613790	What are examples of good strategic sourcing solutions?
test-613791	What is the perspective of strategic sourcing?
test-613792	How do I stop receiving emails from Quora?
test-613793	How do I stop email notifications from Quora?
test-613794	"What are some sentence examples using ""ecsastic""?"
test-613795	"What are some sentence examples using ""into""?"
test-613796	How much download is normal for a free game?
test-613797	How do download free games for PSP Go?
test-613798	How should I delete aisle account?
test-613799	How do I contact james franco?
test-613800	What will bring instant death, shooting in a heart or head?
test-613801	Why are people afraid of dying?
test-613802	What are the major companies that have made a pivot strategy?
test-613803	What are the most successful companies most people haven't heard of?
test-613804	I am 17 want to earn so Google it found some sites . is it all true (which include add seeing) LEGALLY?
test-613805	I am sixteen and cant sleep more than 6-7 hours every night. Is this a problem and what should I do?
test-613806	"Why are the programming languages named ""Delphi"" ""Oracle"" and all Greek things?"
test-613807	What is the importance of the Oracle of the Delphi?
test-613808	How can you enhance the LTE mode in a Moto G3?
test-613809	Which would be a better buy, Moto G3 or Moto G Turbo?
test-613810	What are reason for revolt of 1857?
test-613811	What is 1857 revolt all about?
test-613812	Why are some people so gullible in believing what they are told?
test-613813	My friend told me that there are 60 million people in Dhaka, Bangladesh on a given day. I find it hard to believe. Is it true?
test-613814	How many riders can join an Uber Pool ride?
test-613815	Why do I get charged the same price on Uber Pool irrespective of whether or not someone joins me during my ride?
test-613816	Why do Indian kids raised in USA look Hefty?
test-613817	How big of a deal is Paul Manafort's resignation as Trump’s campaign chairman?
test-613818	HR situation… Any HR specialists here?
test-613819	I bought a magnetic car mount for my smartphone. Is it wise to use a magnet to hold my smartphone in place?
test-613820	How ethical would it be to use artificial methods to terraform Mars to make it possible for humans to live on?
test-613821	What are some tips to recuperate a dropping credit score?
test-613822	How do you convert yards to miles?
test-613823	How do you convert miles to yards?
test-613824	How can I quickly learn to speak English fluently?
test-613825	How I can speak English with fluency?
test-613826	Why was NORAD created? What is its importance?
test-613827	In your opinion, which would be a better career path? Risk Management or Digital Marketing?
test-613828	"Can blind people see the ""colors"" in phosphenes?"
test-613829	If a person is born blind, what do they see in their dreams?
test-613830	When was the transistor invented?
test-613831	Who really invented the transistor?
test-613832	Why does Flipkart & Snapdeal have better apps than Amazon ?
test-613833	From where I should buy a YU Yuphoria smartphone: Amazon, Flipkart or Snapdeal? My question is based upon the quality of phone rather than price
test-613834	What universities does Cubic recruit new grads from? What majors are they looking for?
test-613835	Admission procedure after getting MHT CET Result?
test-613836	What are the latest trends in web design?
test-613837	"What are the latest ""trends"" in web development?"
test-613838	Which private college/university for BJMC in Delhi/NCR is the best?
test-613839	Which is the best law college in Delhi-NCR after graduation?
test-613840	Which is best smartphone under 10k?
test-613841	Which smartphone is the best in India under 10k?
test-613842	When I'm extremely nervous, people think I have problems with them and fight them or intimidate them?
test-613843	What is a facilitated transport? What are examples of facilitated transport?
test-613844	Is there any chance that there are some good hackers who help others to learn hacking?
test-613845	Are there any advisors (real or fictional) who analyze data in order to help others succeed?
test-613846	Is there any situation or circumstance that can justify any act of self-harm? Are pressure tactics another version of manipulation?
test-613847	What is it like to live with self harm scars…?
test-613848	Is Tejas is world's best fighter plane in the segment?
test-613849	Is tejas fighter is good?
test-613850	How important is it to do 4 years of foreign language in high school for college admissions?
test-613851	What years of high school are the most and the least important?
test-613852	How do I prepare for cracking SBI Specialist officer?
test-613853	Is there any chance of cracking SBI IT specialist officer in 3 months prep? If yes, then how?
test-613854	Why is there a limit on question details?
test-613855	Why is Quora worried about the length of question details?
test-613856	What is the corporate culture like at The Container Store Group? How is the culture different than other companies?
test-613857	What is the corporate culture like at XL Group? How is the culture different than other companies?
test-613858	"How do you respond to ""have a great day""?"
test-613859	Texted Tinder match for two and a half weeks every day, I asked her to hang out and she stopped responding. Why is this?
test-613860	Are the mobile and laptops brought from customs officer illegally are safe?
test-613861	Is it safe to buy a laptop on Paytm?
test-613862	What should I prefer CSE at NIT Bhopal or ECE at IIITH?
test-613863	Which is better: CSE at MIT Manipal or ECE at NIT Bhopal?
test-613864	As a civil engineer, fresher, what's the best skill set to have for the next 5 years?
test-613865	What skills should I master to become a top best developer & get a best salary in next 5 years ?
test-613866	What are the best nude scenes of Hollywood movies?
test-613867	What are the best hollywood movies post 2010 with some great action scenes?
test-613868	How do startups like Quizup generate revenue?
test-613869	How do the apps like QuizUp get profits?
test-613870	Why is it difficult for some people to emotionally attach to someone?
test-613871	How do I not get emotionally attached to a guy?
test-613872	How is imagery effective in literature and poetry?
test-613873	How does imagery affect tone in literature?
test-613874	What is marketing management?
test-613875	What is fashion marketing and management?
test-613876	What will happen if I practice Surya-Namaskar (sun salutations) in night? Is it allowed to practice it in night?
test-613877	What is polar night? Why does it happen?
test-613878	Are there any open-source alternatives to Gitlab that work on Windows?
test-613879	How do people FIND open source projects to work on?
test-613880	Who deserves the UEFA Euro cup 2016?
test-613881	Who will win the UEFA Euro Cup in 2016?
test-613882	Why are professional ethics important?
test-613883	How important are ethics and values in the MBB? Do they add value?
test-613884	What is the application of a timer?
test-613885	What are the applications of electronic timers?
test-613886	What types of drugs that Dustin Diamond took which led to violate his probation?
test-613887	What types of drugs did actor Dustin Diamond took, which violate his probation, and was it for his AIDS or absolute sobriety or what?
test-613888	What is your philosophy in life?
test-613889	What do you think is the point of your life?
test-613890	Is purple a gay color for a man?
test-613891	How do I date a gay Mexican man?
test-613892	What are some things new employees should know going into their first day at Resource Capital?
test-613893	What are some things new employees should know going into their first day at AXIS Capital Holdings?
test-613894	Where is the best place to find a liter to millimeter converter?
test-613895	Where is the best place to find a gallons to liters converter?
test-613896	What are some medical bills?
test-613897	What is medical billing?
test-613898	What are pointers in R?
test-613899	What is pointer to pointer?
test-613900	How quickly can I get my PAN card?
test-613901	What should I do now to get my PAN card?
test-613902	What's your review of Game of Thrones season 6 episode 7?
test-613903	What is your review of Game of Thrones Season 3?
test-613904	Are Ahmadiyya muslims allowed to enter the Al-Aqsa mosque and pray there?
test-613905	Are muslims allowed to enter Al-Aqsa mosque and pray there?
test-613906	Which laptop should I buy if I am a first year computer science student?
test-613907	Which laptop should I buy as a Computer Science programmer?
test-613908	"Is the phrase ""little do you know"" grammatically correct?"
test-613909	"Is the phrase ""in regards to"" ever grammatically correct?"
test-613910	"What is your interpretation of these lines by Thoreau ""Aim above morality. Be not simply good; be good for something.""?"
test-613911	Is it moral doing something that is good for you in a relationship but bad for the other person?
test-613912	What is the movie with the most number of sex scenes?
test-613913	What are the most badass movie scenes of all time?
test-613914	Why is white mold dangerous?
test-613915	When is mold dangerous?
test-613916	What are some delicious non-vegetarian dishes of South India?
test-613917	Which are some good non-vegetarian South Indian dishes?
test-613918	When will redmi note 4 launched in India?
test-613919	What is the best site to sell mobile phones in India?
test-613920	Where can I buy liquid nitrogen in Mumbai?
test-613921	Where can I buy liquid nitrogen in Bangalore?
test-613922	Why do families go to either airport after a plane crash?
test-613923	What is the process for cleaning up the remains of a crashed plane off the runway?
test-613924	What is the procedure to get seat in ANDHRA UNIVERSITY?
test-613925	Who would be interested to acquire MailChimp?
test-613926	What are the best book for learning calculus?
test-613927	What are the concepts I should know in order to start learning calculus? What resources/books do you recommend?
test-613928	What is white label?
test-613929	What is White Label Crowdfunding?
test-613930	How does neoliberalism explain the rise of China's economy?
test-613931	Will the rise of China lead to a rise of communism around the world?
test-613932	Does sex feel better for uncircumcised men?
test-613933	Who enjoys more sex men or women?
test-613934	What exactly happens when a wire transfer is made?
test-613935	Can humans be transfered to a new place through a wire?
test-613936	Where can I watch or download full episodes of The Vampire diaries without sign up or registration?
test-613937	What is the best place to watch vampire diaries online without pop ups or registration?
test-613938	I tried to add money to my Paytm account twice but both times the transaction failed and the money was debited from my bank account (that is 2600 twice). After an hour, I received notifications that the money has been credited to my Paytm wallet, but I didn't receive the money in my Paytm wallet. What should I do?
test-613939	How much does it cost to transfer money from the bank to e-wallets like Paytm, PayUMoney, etc.?
test-613940	What is the actual name of Sunny Leone?
test-613941	When you are traveling to another country and meet people from your country there, how would your reaction be like to find them there?
test-613942	How do I choose best laptop for programming?
test-613943	Which laptop is good for programming?
test-613944	What are some essential skills required for a designer?
test-613945	What are the essential skills required for a web designer?
test-613946	Is the site gadgetstoreltd.com genuine?
test-613947	Is buffersales.com a genuine site?
test-613948	Why do Vietnamese girls hate black guys?
test-613949	Do Indian girls date black guys?
test-613950	Why can no soccer team leave France during the European tournament?
test-613951	How it is like to study environment management or engineering in Sweden?
test-613952	What is the best image viewer for OS X?
test-613953	Which was the best release of OS X, and why?
test-613954	What are the best movies to watch on Blu-Ray?
test-613955	Can I watch Blu-ray movies on my MacBook from an external Blu-ray drive?
test-613956	Why has no one managed to kill Bashar al-Assad?
test-613957	Should the west let ISIS take over all of Syria and drive President Bashar al-Assad from power?
test-613958	How energy is transferred if electron change its position?
test-613959	Why is lanthanum element considered as the first element of lanthanide series eventhough there is no electron in its 4f orbital?
test-613960	Which country has the most healthiest food?
test-613961	Which country has the cheapest food?
test-613962	What are some quotes that are very captivating while listening to them?
test-613963	I can copy/write while listening to songs but cannot learn/study while listening to songs. Why is it so?
test-613964	How are human beings selfish?
test-613965	Are all people inherently selfish?
test-613966	Was Josip Broz Tito a brutal dictator?
test-613967	Is a king considered a dictator?
test-613968	How can I score good marks in Andhra University semester exams?
test-613969	What marks should one score in the IMU exam to get into a good college?
test-613970	Is abortion wrong? If so, why?
test-613971	How is abortion wrong?
test-613972	Can somebody help me with function of restriction endonuclease?
test-613973	Is software considered intellectual property?
test-613974	Who can share valid Cisco 350-018 Exam Dumps/350-018 Exam Questions/350-018 PDF Dumps/350-018 VCE Dumps as 350-018 Exam Preparation?
test-613975	Physics: What is force?
test-613976	What's the best Android app to download magazines via Torrent?
test-613977	What is the best app for Android to download good books for free?
test-613978	How is the color of a country's passport (cover) decided?
test-613979	How do expired passports affect U.S. green card holders?
test-613980	Why do so many teenage girls claim to be sociopaths when they obviously aren't? It's insulting in my opinion
test-613981	Why do so many teenage girls claim to be sociopaths when they obviously aren't? It's insulting in my opinion.
test-613982	Why do England spectators love watching a cricket test match for 5 days?
test-613983	When is the day/night test match cricket starting?
test-613984	How do I create a WiFi hotspot using Tata Photon Plus (USB modem)?
test-613985	Is there any way to use a USB wifi modem as a wireless device to connect to a wifi router?
test-613986	I have frequent digestive system related problems. Does regular yoga help in the long run? To reduce the problem?
test-613987	How are 2016 placements in raipur nit for csc?
