test-415695	How different are the judicial systems in India and America?
test-415696	"Why is ""Japan's Marine Day"" unknown in Bahrain?"
test-415697	"Why is ""Japan's Marine Day"" unknown in Ireland?"
test-415698	What is globalism?
test-415699	What does global warming mean?
test-415700	What do gymnasts wear under their leotards?
test-415701	When you wear stockings with a garter belt, do you wear your panties under it or over it?
test-415702	Would my shoulders be considered narrow or broad?
test-415703	How can I make my shoulders more broad?
test-415704	In Game of Thrones season 5, episode 6, what happens to Sansa?
test-415705	What happened at the end of Game of Thrones season 6 episode 5?
test-415706	"How do you translate the Portuguese word ""lindo"" to English?"
test-415707	How would you translate this Portuguese sentence to English?
test-415708	How do I deal with sexual frustration?
test-415709	How can I deal with sexual frustration which really distracts me from my work?
test-415710	How can I make a simple program in Python that writes information about flights to a file so that details can be retrieved about each flight?
test-415711	What do I need to do to write a simple blackjack program? Please see comments for details.
test-415712	How do I woo a girl who has a boyfriend?
test-415713	How do you get a girl to like you?
test-415714	Why can't I redeem a silver certificate dollar bill?
test-415715	What is the value of a 1851 silver dollar?
test-415716	What are the differences between Disneyland Paris and Disneyworld Florida?
test-415717	What would life be like without television?
test-415718	Why do The Economic Times costs Rs 10 on weekends and Rs 3.5 on weekdays?
test-415719	Why is The Economic Times priced Rs 10 on weekends and Rs 3 on weekdays?
test-415720	"What does ""damn right"" mean?"
test-415721	"What does one mean by ""rightly so""?"
test-415722	How do I improve self confidence?
test-415723	How can I get self-esteem and confidence?
test-415724	Is it true that oranges sold in the U.S. often get injected with dye to make their color more uniform?
test-415725	What is the color of an orange?
test-415726	Could anyone spare me an invite to FFFFOUND?
test-415727	How do you get invited to FFFFound?
test-415728	Can I use Machine Learning algorithm to rank search result when using ElasticSearch?
test-415729	What algorithm do slot machines use?
test-415730	Why don't you believe in love?
test-415731	Do you believe in love?
test-415732	Is it better to focus more on class struggle issues or race struggle issues?
test-415733	Is there a class struggle in the modern US? Why?
test-415734	What is the best gift for a girl who codes?
test-415735	What is the best gift for a code lover boyfriend?
test-415736	Can you feel cancer cells dying?
test-415737	"Is it correct to say that cancer cells are normal cells that have ""forgotten"" how to die?"
test-415738	What questions aren't on Quora that should be?
test-415739	What questions have never been asked on Quora?
test-415740	How do I avoid sleep during night studies?
test-415741	What are some ways to avoid sleep?
test-415742	What are different types of power plant cycle?
test-415743	Which type of fluid is used as coolant in condenser of thermal power plant?
test-415744	Is this toxic shock syndrome?
test-415745	What are the symptoms of toxic shock syndrome?
test-415746	Is Illuminati thing real?
test-415747	Does the illuminati exist in the US?
test-415748	How do I manage my time in work?
test-415749	What are the most effective and proven time management techniques?
test-415750	What is the standard cost of living in Malaysia?
test-415751	How much does the Digi Sim card cost in malaysia?
test-415752	What is the dump and why is it called that?
test-415753	What's the difference between afterlife and reincarnation?
test-415754	Are there any notable favors in using a framework like LibGDX instead of game engines?
test-415755	Are there any big data use cases for choosing products like SciDB or VoltDB over a Hadoop framework?
test-415756	Why India is not prepared to sign NPT?
test-415757	Why doesn't India sign NPT?
test-415758	Who is the luckiest Indian cricketer? Why?
test-415759	Who is the luckiest cricketer? Why?
test-415760	Which is the best Smartphone under INR 15000 ?
test-415761	What is the best phone under ₹20,000 in India right now (2016)?
test-415762	Why does my boyfriend want to have a family?
test-415763	Why doesn't my boyfriend want me to be close to my family?
test-415764	What are the disadvantages of smoking weed?
test-415765	What causes throat pain after smoking weed?
test-415766	What's your new year resolution for 2017?
test-415767	What will be some of the most productive new year resolutions for the year 2017?
test-415768	What is the major difference between C programming and Assembly language programming used in microprocessors and micro controllers?
test-415769	Chrome is written in C++, Assembly and Python. How were they able to write three different languages and come up with one product? What is the method used to merge programming languages to create software?
test-415770	Should I quit my job and just go out and travel?
test-415771	Can I quit my job and go travelling for few months?
test-415772	Is religion doing more harm than good?
test-415773	Would the world be better off without religion?
test-415774	Which Google font looks most similar to Nyala?
test-415775	What Google Font looks most similar to Neutraface Text?
test-415776	How we can calculate burden of current transformer?
test-415777	What does the 5A for a current transformer mean?
test-415778	Which mutual funds are one of the best with good returns via SIP?
test-415779	Which are the best mutual funds to invest with SIP?
test-415780	I am Bachelor an got a expat job in KL for RM10000 per month. Would I will be able to live comfortably and will I be able to save too?
test-415781	What are the best jobs for Bachelors to work over weekend in India?
test-415782	What should I do after b.com to settle abroad?
test-415783	What are the career options after B.com?
test-415784	How do you get a story book started, that would catch the interest of George Lucas?
test-415785	I'm a finance major that is interested in valuing early-stage companies. I would like to work as an analyst in the finance side of a venture capital firm, but don't really know how to get started. Are internships the way to go, and if so how do I go about contacting these firms?
test-415786	"What does it mean when someone says ""You're dead to me""?"
test-415787	What does it mean when someone says I miss you?
test-415788	Which products I can sell from Sri Lanka on eBay?
test-415789	How do I find a product to sell on Amazon/eBay?
test-415790	What do most Canadian whites think about Asian immigrants?
test-415791	What do South Asians think about East Asians?
test-415792	How is the life at BITS Pilani from the eyes of a girl?
test-415793	How is life at BITS Pilani Hyderabad Campus?
test-415794	What are some good diss raps?
test-415795	What is the best diss record of all-time?
test-415796	How do male pornstars prevent premature ejaculation?
test-415797	Is there such thing as a premature ejaculation fetish?
test-415798	How do I apply for an internship in ISRO?
test-415799	How can I apply for an internship at the ISRO as a CSE student at SASTRA University?
test-415800	How can someone use my debit card without a pin number?
test-415801	Is it possible to do a transaction using a credit card without a CVV or pin number?
test-415802	Why do I admire guys who do well inside a class?
test-415803	Is militancy back to the levels of 1990s in Kashmir?
test-415804	What is IBM Bluemix?
test-415805	What is the IBM Bluemix?
test-415806	Who wrote the Ramayana and Mahabharatha?
test-415807	What are the strongest evidences that suggest the battle of Mahabharata actually happened?
test-415808	How can I improve self-confidence?
test-415809	How do I improve on my self-confidence?
test-415810	Which is cooler, Adidas or Nike? Why?
test-415811	How can I sell my tshirt designs to Nike or Adidas or Puma?
test-415812	How can I score 98 percent in 12th boards in commerce stream?
test-415813	I scored 74.6 percent in the state board in 12th. Am I still eligible to write the JEE Mains?
test-415814	Which site give the best mocks for CAT?
test-415815	Which is the best website to give CAT mock sites?
test-415816	How can I write question anonymously, answer anonymously and ask to answer anonymously with Quora mobile app?
test-415817	How do I answer a question anonymously in Quora?
test-415818	What are some tips for having more views and upvotes on Quora?
test-415819	How can I get more views and upvotes on Quora?
test-415820	How can I  stop smoking?
test-415821	How do I quit smoking? How?
test-415822	What are possible reasons for having bumps in my left testicle?
test-415823	What could be some bumps in my left testicle?
test-415824	Why are blue and red neon lights illegal or restricted for commercial uses in Mexico?
test-415825	Why are blue and red neon lights illegal or restricted for commercial uses in Peru?
test-415826	Who is the most beautiful Bollywood actress?
test-415827	Who is the most beautiful actress to have appeared in a television series?
test-415828	Does the double tap to wake up feature consume more battery?
test-415829	What are all the features I should have in a new laptop?
test-415830	How are the copies of the UPTU test checked? On what basis are marks given or taken?
test-415831	How do I get good marks in physics in uptu exams?
test-415832	What are the most common injuries in Brazilian Ju Jitsu?
test-415833	What's the difference between Brazilian and Japanese jiu-jitsu?
test-415834	Would you marry a completely blind-deaf woman?
test-415835	Would you marry a blind woman?
test-415836	What is a Chief Product Officer?
test-415837	What's the difference between product manager and chief product officer?
test-415838	Why is orange jam called marmalade?
test-415839	Do orange Tootsie Pops have orange seeds in them?
test-415840	How do I make my status visible to only one person in whatsaap?
test-415841	Why does France intervene in Africa and the Middle East?
test-415842	How do I track my husband on kik messages without him knowing?
test-415843	Can you spy on someone's Kik messages?
test-415844	Is forever a lie?
test-415845	What is a lie?
test-415846	What is GRE exam? What are the topics asked in the exam? How do you prepare for it?
test-415847	What is the procedure for preparing for the GRE exam?
test-415848	What are ways by which I can concentrate more on my studies?
test-415849	I am 13. I waste a lot of time. What should I do to concentrate on my studies?
test-415850	French: How will you describe your family in French in about 100 words?
test-415851	"In French, how do you say the word ""number""?"
test-415852	I recently got my HDFC credit card, but I didn't receive a PIN with it. Is my credit card PIN the same as my debit card's?
test-415853	How can I get HDFC credit card pin in US if I have obtained credit card in India? Also to generate pin using OTP, there is no HDFC ATM nearby
test-415854	Have you seen the secret message in grand theft auto 3, behind the wall.?
test-415855	"What is the ""K factor"" in flow measurement?"
test-415856	How will the 500 rupee and 1000 rupee note ban change the rupee's value internationally?
test-415857	How can the ban of 500 and 1000 rupee notes increase the Indian economy?
test-415858	How do you discover oil?
test-415859	How did we discover 'π'?
test-415860	Are all five Trump kids going to have Secret Service protection?
test-415861	How would the US Secret Service feel to serve the to-be POTUS Mr. Trump & his family?
test-415862	Is a Master’s in International Business from University of Melbourne worth it?
test-415863	Are there any 'vocabulary audio books'?
test-415864	What are some free web hosting providers that don't cheat?
test-415865	What is the best free web hosting provider?
test-415866	Where can I get AutoCad free?
test-415867	Do civil engineers need AutoCAD?
test-415868	How do I make new friends on WhatsApp?
test-415869	How do I make new friends in india?
test-415870	Can hummingbirds fly backwards?
test-415871	How is the hummingbird the only bird that can fly backwards?
test-415872	How do I start making money online without a capital?
test-415873	How can I make money online without a business?
test-415874	As an undergrad doing research with a math/physics professor during the school year, how many hours should I expect to put into research a week?
test-415875	How many hours per week do researchers spend doing/working on their research project?
test-415876	What are the leading theories in developmental psychology?
test-415877	Can A-B-A design for psychology be applied to testing any theory?
test-415878	How Change my Samsung J 2 Hardware check?
test-415879	Which is a better aim to have: winning the Nobel or becoming PM of your country, assuming you have the talent to do either?
test-415880	What are some things that are simple in appearance but indescribably complex after consideration?
test-415881	What kinds of things appear to be simple but are rather complex in the deeper sense?
test-415882	What music does Bill Gates like?
test-415883	What music does Bill Gates enjoy?
test-415884	Which kind of API will be good for create a new online recharge website?
test-415885	I need to create a new resume with my one year of experience for my IT company interviews. Which website can I follow to create my new resume?
test-415886	Is it better to transfer money abroad using Bank Transfer (SWIFT) or Money Remittance Operator, such as Western Union or Money Gram?
test-415887	How can money be transferred from Brazil to Africa through Western Union and be received? What bank does that, because I have been transferred money on some occasions but was unable to get it?
test-415888	If I manage to never scratch an itch again, will I get used to it/become immune?
test-415889	If I manage to never scratch an itch again will I get used to it/become immune?
test-415890	Is a virus considered prokaryotic or eukaryotic?
test-415891	Are viruses considered eukaryotic or prokaryotic? Why or why not?
test-415892	What is the most emotional picture you've ever seen?
test-415893	What is the most touching picture you've ever seen?
test-415894	How is University of North Carolina at Charlotte for MS in Computer Science compared to California state University, Sacramento?
test-415895	How is University of North Carolina Charlotte for MS in computer science? And how are the job prospects?
test-415896	"Do lesbians experience the same ""ticking biological clock"" phenomenon that straight women experience?"
test-415897	How? To be a football hero?
test-415898	How do I unblock whasapp?
test-415899	How can I unblock someone on Facebook messenger?
test-415900	What is the importance of Catholic Sacraments?
test-415901	Why do many Catholics consider the Sacrament of Confirmation so important?
test-415902	How do I start my own business?
test-415903	How do I start my own IT company?
test-415904	What is human poverty?
test-415905	How do I sympathetically say no to a homeless person asking me for money, when I don't have any in my pocket?
test-415906	What are examples of elements and compounds?
test-415907	What are examples of heterogeneous elements?
test-415908	What can be used as an alternative to aluminum foil?
test-415909	How can I make hydrogen gas using aluminum foil?
test-415910	Which is the best long term coaching institute for IIT in Hyderabad?
test-415911	Which is the Best long term college for iit in hyderabad?
test-415912	What are the benefits of playing chess?
test-415913	What are benefits of playing chess?
test-415914	How can I deactivate a WhatsApp account from the system when my mobile is lost?
test-415915	Why did you deactivated WhatsApp?
test-415916	"What is the French translation for ""me neither""?"
test-415917	"What is the French translation for ""we miss you""?"
test-415918	"Why is ""Japan's Marine Day"" unknown in Samoa?"
test-415919	Why is Japan's Marine Day unknown in Singapore?
test-415920	What are the most beautiful latex templates for scientific presentations?
test-415921	How do I add a page Cambridge Phd Thesis Latex Template v2?
test-415922	Can feeling inferior or incompetent also considered Dunning-Kruger effect?
test-415923	What does it feel like to be an incompetent CEO?
test-415924	Why are there so many dumb questions asked on Quora?
test-415925	Why are there so many dumb, easy questions on Quora?
test-415926	Have you ever witnessed a real life example of lack of common sense and lack of presence of mind?
test-415927	Is the life of a dermatologist more time consuming and stressful compared to other doctors, such as plastic surgeons and orthopedic surgeons?
test-415928	How do I repair damaged hair because of straightener?
test-415929	How do you repair damaged hair from bleaching?
test-415930	Should I buy a MacBook Pro with or without the Retina display?
test-415931	Should I buy a MacBook Pro with or without a Retina display?
test-415932	At age 50, would you end a 5 year relationship because your partner does not have any retirement savings?
test-415933	I'm 21. If I work for 50 years and save 3.5 million dollars, what will my life be like at age 72?
test-415934	Which is the best book to start learning Sanskrit using Hindi as medium of instruction ?
test-415935	How good are NCERT books for learning Sanskrit?
test-415936	How bad is the legal job market for new lawyers?
test-415937	Is It a good time to become a lawyer, or is the job market saturated?
test-415938	How much of the media is controlled by the government?
test-415939	How does the government of India control the media?
test-415940	What are some interesting games you can play with your family during the Christmas vacation?
test-415941	What are some fun and entertaining games we can play at a family reunion?
test-415942	What is a god?
test-415943	Who is God?
test-415944	Star Wars (creative franchise): Why couldn't Master Yoda sense that Emperor Palpatine was a Sith?
test-415945	Star Wars (creative franchise): Why can't the Jedi detect that Palpatine is a Sith Lord?
test-415946	Pokemon go release date in India?
test-415947	When is pokemon Go releasing on India?
test-415948	How is your one night stand experience?
test-415949	What's the best way to have a one night stand?
test-415950	What are some examples of job-street pitches that can assure me that I will get the job which I am applying for?
test-415951	Can I get paid for applying to jobs?
test-415952	What is a good book about Artificial Intelligence?
test-415953	What are some good books on Artificial Intelligence?
test-415954	How much does it cost Disney to run Disneyland per day including California Adventure and Downtown Disney?
test-415955	How much did it cost to build Walt Disney World?
test-415956	How can I download j.d lee PDF for free?
test-415957	Where can I get online PDF or EPUB versions of books?
test-415958	Why do we use transmission gates instead of pmos pass transistor?
test-415959	What does Bill Gates think about management consulting?
test-415960	What is the year-over-year growth numbers for the OpenStack ecosystem?
test-415961	Is the Android market saturated? If not, how will the growth be foreseen in the next ten years?
test-415962	Why do people get breast implants? What does it do for them?
test-415963	Where can you get spare parts for an Ameda Breast Pump?
test-415964	What must be my score in JEE mains if I have 91.2% in my 12th boards to get into NIT Trichy with CSE?
test-415965	Trap flag in 8086 microprocessor?
test-415966	What is exactly is digital marketing?
test-415967	What is global digital marketing?
test-415968	I eat junk food how could I overcome and eat healty food regularly?
test-415969	How do I avoid eating junk food on the streets?
test-415970	Is it possible that flossing is unnecessary, but in itself creates more substantial gaps between teeth that do then need to be flossed?
test-415971	What is it return?
test-415972	What are the admission statistics for top schools in computer science, information science and computer engineering?
test-415973	What are the top 10 colleges for computer engineering in the US? What about computer science?
test-415974	How many miles on average do golfers walk playing a round at Augusta National?
test-415975	Golf: How many rounds do I need to play for a free round on GOLFZING?
test-415976	How do I find a Guru in my life?
test-415977	What are the best ways to find guru in your life?
test-415978	What is the best way to gain healthy weight?
test-415979	Is it just me or are all gay guys teeth really big?
test-415980	I am skinny 18 year old boy, how can I gain 15 Kgs weight in 2 months?
test-415981	"How do I gain weight as a teenager? I am fairly skinny for my age, 100 pounds and 5'6""."
test-415982	"Initial Public Offerings (IPOs): Facebook S1 Dev addendum state: ""..FB charges to Zynga at any given time to redeem Facebook Credits shall be [*] 30% per each Facebook Credit redeemed [*]."" - Wonder whether zynga has implicitly a better advertising deal b/c they switched to credits?"
test-415983	"Facebook S1 Dev addendum state: ""..FB charges to Zynga at any given time to redeem Facebook Credits shall be [*] 30% per each Facebook Credit redeemed [*]."" - Wonder whether zynga has implicitly a better advertising deal b/c they switched to credits?"
test-415984	How does it feel to kill someone for the first time during war?
test-415985	What did war veterans feel on their first kill?
test-415986	"What does it mean when some one response with "" no problem…""?"
test-415987	Is it morally biased that some people oppose eating dogs but have no problem eating other animals?
test-415988	Is Elon Musk a visionary?
test-415989	Is Elon Musk charismatic?
test-415990	"What is the meaning of ""Chunavi Aachar Sanhita""?"
test-415991	What unethical means does political parties use in order to win?
test-415992	What happens if a neutron is removed from an atom?
test-415993	What happens if you removed all the electrons from an atom?
test-415994	Has the rapper Eminem ever met his father?
test-415995	Why did Eminem name his Relapse album that?
test-415996	What is the secret of your happiness?
test-415997	What is the secret of happy couples?
test-415998	"What is the purpose of ""/etc/localtime"" file on Linux Systems?"
test-415999	"What is the purpose of ""/proc/irq/default_smp_affinity"" on Linux Systems?"
test-416000	What is the importance of discipline in a student's life?
test-416001	What's a great piece of advice for teachers?
test-416002	What are the basic requirements to start a staffing company?
test-416003	What are the basic requirements to start a production company?
test-416004	How can I get a job as a quant researcher/trader after PhD in pure math?
test-416005	Why did the 2008 recession happened? How did this impacted the world?
test-416006	What are the best CPC ad networks to promote CPA offers?
test-416007	What are the best CPA ad networks?
test-416008	Why should I not vote for Hillary Clinton or Donald Trump?
test-416009	Who would you vote for: Donald Trump or Hillary Clinton?
test-416010	What is it like to work in Finland or The Netherlands?
test-416011	What's it like to live in Finland?
test-416012	What are some tips on improving writing skills?
test-416013	What do I have to do to improve my writing skills?
test-416014	"Android (operating system): How can I solve the ""Unfortunately, android.process.media stopped"" error in my Android 4.2 version Micromax mobile?"
test-416015	How do I upgrade my Micromax A110Q to Android Kitkat version 4.4?
test-416016	Where can I get top-quality wardrobes in Sydney?
test-416017	Where can I get a huge choice of wardrobe items in Sydney?
test-416018	How can I get asshole ex-boyfriend back and punch him in the face?
test-416019	Does my boyfriend's ex girlfriend want him back?
test-416020	Why is Jupiter's Great Red Spot turning Orange?
test-416021	What makes Jupiter's red spot red?
test-416022	How do I calculate normality?
test-416023	What is normality and how to calculate equivalent mass?
test-416024	What is the difference between infinity and infinite?
test-416025	What's the difference between infinity and reality?
test-416026	Why do companies follow a pyramid organization structure?
test-416027	What is organic structure?
test-416028	Review of Suriya's 24: How is Suriya's 24 (Tamil movie released in 2016)?
test-416029	Which is the best 2016 summer movie? Theri or 24?
test-416030	What space is the universe expanding into?
test-416031	If the universe is everything in space and time, what is is expanding into? Will we ever actually know everything about the universe?
test-416032	What is it like working for Donald Trump, if you can speak honestly?
test-416033	For anyone who has worked with Donald Trump firsthand, what is he like?
test-416034	What are the pros and cons of having Type O negative blood?
test-416035	What blood type will a child have if both parents are O positive?
test-416036	If one day is not exactly 24 hours and is in fact 23 hours 56 minutes, shouldn't the error add up, and shouldn't we see 12 midnight becoming 12 noon at some point in time?
test-416037	A clock is set right at 10 AM. A clock gains 10 minutes in 24 hours. What will be the true time when the clock indicates 3 PM the following day?
test-416038	How do you know if a girl wants to have sex with you?
test-416039	How can you know a girl really wants to have sex with you?
test-416040	Is it okay if I'm remembering most of my memories in a third person's point of view?
test-416041	Why do I always see my memories in a third person view?
test-416042	Are physical tests compulsory in Physical Education?
test-416043	How can I score 60+ in physical education?
test-416044	What is the kindest thing a pet has done for you?
test-416045	What is the cutest thing your pet has ever done?
