85484	Are we good people who sometimes give in to bad, or are we bad people who sometimes manage to resist our own nature and do good?
503892	What is the easiest, simplest and cheapest way to learn Japanese?
503893	What is the easiest and cheapest way to learn Japanese?
384109	How do I build software development experience on my own time?
488982	Which are some high profile murder cases in India which involved big politicians?
488983	What do you think of the Mirna Salihin murder case?
215438	What are the ways by which you were ditched in friendship?
215439	How have you recognised toxic friendships? What were the signs?
383701	What is the total cost (hostel+fees) at the Amity University in Noida?
383702	How good is Amity University Noida for B.Tech in CSE and what about its other campuses?
304751	What causes bumps on the tongue? How should they be treated?
304752	What causes a lie bump on your tongue? How do you treat it?
197455	How can I save my favourite Quora answers or questions for my own use?
444730	Is there good and evil?
454453	How is Li-Fi implemented?
454454	What is Li-Fi?
27943	Why can't I think clearly when talking to people?
24930	Why does it feel like TV ad sales/marketing control professional sports?
24931	Why is it always sales & marketing and not marketing & sales when marketing comes first to sales?
353995	Is it true that we cannot use pens instead of pencils while giving GRE?
82377	How do I tell my crush that I like him and it not be awkward?
184879	To what extent is Manny's inability to speak or even understand Spanish in Modern Family a realistic portrayal of young Latinos in the US?
184880	Do Phil and Claire in the TV series Modern Family represent typical US parents?
140708	How do I build character in my kids?
140709	How can I help my kid build up confidence?
466870	What are the names of some structural analysis software programs?
441247	What is the most common addiction?
70103	What are valence electrons?
193481	What are some popular comics similar to Tintin and Asterix?
506948	How can the traffic problem be solved in Mumbai?
506949	What is the solution of traffic problems in Mumbai?
145164	How are FedEx packages delivered?
457724	What is the credit risk ratio?
457725	Does a total return swap hedge against interest rate risk or credit risk?
10036	How can we practically improve the indian education system for better india?
236768	What is the best way to understand fathers?
236769	What is the best way to understand mothers?
439733	Where do hackers learn to hack?
96726	How is a Master of engineering management at UTS Sydney?
96727	How is masters of engineering management masters of business administration at UTS Sydney?
49107	What type of questions are asked in bank jobs interview of BBA students?
30965	What are good gifts for a foreign visitor to bring when they're invited to someone's home in Anguilla for the first time?
388396	Why is exporting nuclear waste into the sun a bad idea?
388397	Can we send the radioactive wastes from a nuclear plant into the Sun in rockets?
225839	Which are the best universities for pursuing a MS in MIS or MIM?
249624	Conquest: Of all peoples, why was it that only the British were able to rule the world?
249625	Why did the British lose supremacy after ruling the world for so long?
119984	Who are the most famous people in the world aged 90 or over?
490897	What do the majority of Iranians think of the LGBT+ community struggling in their daily life in Iran?
490898	Do majority of Iranians support secularism?
511391	What is your review of Dual Brand Strategy?
511392	What is your review of Brand Strategy?
348382	What type of questions are asked in delhi school of economics interview?
348383	What type of question I may be asked in human resource training interview?
428622	How I get admission in Indian Institute of Engineering Science and Technology, Shibpur?
428623	My general rank is 40000 may I get admission to Indian Institute of Engineering Science and Technology, Shibpur?
325498	What are these tiny little black bugs?
325499	What are these tiny bugs?
32287	Is it easy to predict a recession?
161303	What is the best teen love story?
161304	Relationship: Me and this guy like each other but I can't date till I'm 16. How should I tell my parents that I want to date him and he wants to date me?
370065	What is the difference between truthfulness and honesty?
411023	Does honesty really matter?
41630	How much need to pay for TV advertisement in India?
41631	How much does a 10 Sec TV advertisement cost in India?  Also how much would a company be willing to spend to target one viewer? I just need the cost of airing, not production.
426351	"What does it mean ""to be true to one's self""?"
426352	Is conscience our true self?
186103	Where can I download ScHoolboy Q Blank Face LP album zip?
186104	Where can I get link to download ScHoolboy Q Blank Face LP Full album?
332659	Is she lying about loving me? Why? How?
332660	How do I know if my boyfriend is lying about loving me?
449961	Who's interested in a Hong Kong Quora meetup on Sept 19-20?
449962	Who is interested in a Quora meetup on June 20, 2014 in Hong Kong?
391289	How do I get answers to my question?
354170	How beautiful is your life, and why?
490066	What is the psychology of consumption in consumer behavior?
1408	Why we don't feel sympathy towards everyone?
1409	Why don't I feel like talking to anyone?
486615	Is Java is a open source?
486616	How is Java open source?
146238	For those of you who believe Bollywood was far better in the 80's and 90's ..why do you think so?
146239	Is there a reason why some people can learn song lyrics faster and retain them longer than others can?
221858	What is the best way to teach yourself how to sail a boat?
221859	How do I learn to sail when I don't have a boat?
470015	Which company's shoes are better: Nike or Puma?
336805	I am angry with people who did me wrong. How can I deal with it?
336806	How do I deal with people who make me angry?
30601	What types of cigarettes are there?
30602	What are the type of cigarettes and their effect?
50508	Why do I run faster on a treadmill than on the road?
50509	Why do I run faster on a trail than on the road?
467154	"Is the Aryan invasion theory a myth? Was there no mention about the word ""Arya"" in Hindu sacred texts?"
467155	What is your review of Aryan Invasion / Migration Theory?
60079	When is Sword Art Online III coming out?
71716	In your childhood ，how do you spend Children‘s Day？
71717	How did you spend your childhood?
402708	Why is there no democracy in Muslim countries?
402709	How did Albania become a Muslim country?
489312	How much would a cure for cancer be worth?
206583	How do you read a non-fiction book effectively? (I don't mean for the purpose of studying because one is forced by examinations to remember facts.) There are times when I finish a non-fiction and I realise I can't talk much about it because the tiny details are lost on me. The most I can do is choke up one or two ideas that I feel for and the whole sharing just ends there. Is there a way to structure your mind as you read along so as to grasp, understand and remember the important parts of a book in the best way possible?
260662	How can one view statistics on his/her Spotify usage?
260663	How do I see total views for a song on Spotify?
332514	Buy or rent in San Francisco?
332515	How much is the rent in San Francisco?
302136	How many times per day is too many times to brush my teeth?
59602	A Song of Ice and Fire (book series): What happened to Renly's Kingdom?
446235	Can you gain 0.3 pounds in a day?
1758	Is there any online software available for calculating the time and space complexity of a Java program in Big O?
371168	How do you remove a friend from you blocked list on Facebook?
256114	Which non-smart Nokia phones have WhatsApp?
256115	Where are the images downloaded located on a Nokia phone running WhatsApp?
170350	Does The Coca-Cola  Company own Santa Claus?
152246	I'm a Software Engineer with an H1-B working in a top Internet company. With my H1-B expiration coming soon, what are my options to stay in the US permanently?
152247	I am currently on a valid H1-B working in the US. Is it legal for me to publish free mobile apps?
355160	How does it feel to have an IITian girlfriend?
468338	What does it mean when your friend's boyfriend touched your leg a few times and put his hand on your lower back?
156283	I have changed into an introvert, after my breakup 4 years ago is that right but it seems that I am enjoying my life?
156284	Is there a Quora Notifier Chrome extension similar to the Notifier for Reddit?
410195	What are some social class markers in China?
506867	What is the difference between financial debt and economic debt?
506868	What is the difference between public debt and external debt? For example, the level of debt-to-GDP is 104% in US. Is it a public or external debt?
121723	Why is the revamp for Twitter taking so long?
417209	Why does the FBI arrest people in the early morning?
417210	Does the FBI pay well?
181059	How do I make friends in Bangalore?
181060	What is the best way to make friends in Bangalore?
506464	I'm recently separated casually seeing a married man. Am I crazy?
506465	I sent a man an email saying I love you. Seeing him comforted me, but I only talked to him once. Am I crazy?
248232	I am planning to buy Harley Davidson street 750 very soon. What about it's after sale service, after some years performance, prons & cons (problems) n mileage? Should I go for it with full confidence or not?
248233	What's the cost of a Harley Davidson 750?
337508	17 year old boy?
432783	How many solar panel can charge 6 100Ah batteries?
432784	Is there an English version of Baidu?
90153	Why don't cameras use IR instead of white LEDs for flash?
183944	Is IIIT Bhubaneswar a government college?
183945	How is a day in iiit Bhubaneswar for a girl?
101196	Even after 1 year, I suffer from what I have indirectly witnessed and it even follows me in my dreams, why can´t I just forget about him?
101197	Even though I'm not dating him, why can't I seem to get him out of my mind? I think about him every day! Is it love or just a desire of having him
480117	What are the pros and cons of an LLC?
480118	What are the pros and cons of a series LLC?
419696	What are the effects of US elections over India in terms of employment?
24268	My daughter need to make a chart on community helpers. (police, doctor, plumber, electrician) I am out of ideas. It would be useful for me if any one of you give me any helpful ideas.
212744	Does all the questions get answered in Quora?
212745	I got placed in CTS and confused whether I should work or go for MCA?
18089	I have failed to qualify the JEE Mains and some other entrance exams. Should I drop a year and prepare to try them again or not?
18090	I just scored 85 marks in the JEE-Mains 2015. Should I drop one year? Will I recover from 85 to clearing the JEE-Advanced in 2016?
225719	What does rancid chocolate taste like?
530971	Does restarting the xinetd service on a Linux server affect the SAP system mounted on it?
530972	What is LUN and how it is being USED in Linux server. What is the diffrence between LUN and NFS Mount?
485594	What are some best offices at the management consulting firm Strategy& other than New York City, Chicago and LA/San Francisco?
485595	Which uni would you choose for top 5 management consulting (à la M/B/B, Strategy& etc.): Berkeley, Uni Chicago or University of Texas (Austin)?
317211	How Indian economy different from American economy?
317212	How does the American economy affects Indian economy?
334318	What should I do if I find a dead cat?
334319	What can I do with a dead cat?
471214	What is a normal waist size for a women?
471215	Guys, what would you choose between the a 24'' waist and a D-cup size?
359266	Which is the best city to live in Australia?
441474	What can I do to find the LMIA in Ottawa?
441475	What are some good places to live in Ottawa, Canada?
212817	If the AC current becomes zero 120 times per second (for 60 HZ), Why does my PC not shut down?
212818	How can I convert a single phase 220 V (50 Hz) supply to single phase 120/240 V (60 Hz) output?
190009	What are examples of closed source software?
190010	Is there any way to get access to source code of a closed source software?
355844	Where is floating market in Indonesia?
355845	Is there racism in Indonesia?
333605	What are some of the Indian laws that control Indian media's misuse?
333606	What are the prerequisites required for a Java EE developper to be able to work on a Blockchain-based application?
411560	How do I open a petrol bunk in Karnataka?
138621	If you didn't get the job do most employers call you back to tell you that you didn't get the job after the interview?
162233	What does it mean when an employer tells you to call back if you don't hear from them in a week? Do I have any chance of getting the job still, or is this just a courtesy call?
329932	Why am I afraid of everything?
275295	Can I get a job in IT without a CS degree?
275296	Can I find a programming job without a CS degree?
279050	What type of benefits do you have if you join the army in US compared to the benefits of joining the army in Uruguay?
132383	What process does Facebook use to verify pages?
537117	What would happen if India qualifies for the FIFA World Cup?
311886	How popular is the FIFA World Cup in India?
417980	How karna was killed?
417981	Who was karna?
120710	How does one really move on from a break-up?
21622	"What are the attributes that define an ""average American""?"
242163	How do I can use TensorFlow in speech research?
286276	Who is the highest paid non-manager in the world?
91429	Who's the highest paid employee in the world?
511851	Is sleep paralysis unhealthy?
357535	Did you visit Vietnam?
326235	Why should I and shouldn't I visit Vietnam?
423479	How easy or tough is it for an international student to get a job in Australia after their post - graduation (especially in advertising industry)?
423480	My mind is fucked after learning the law of attraction (and something similar), attracting too much shit that I don't want plus causes over thinking?
825	What is the syllabus for ICSE 2017 geography map?
518056	How do I remove oil stains from my clothes?
469874	I am getting 198 marks in wbJEE 2016. What will be my rank?
469875	I am getting 60/200 in wbJEE 2016. What should be my rank?
302782	I'm an experienced programmer considering quitting my job in 6 months. What should I start doing now to avoid working for someone else again?
302783	Which are the best companies to work with in Gurgaon?
489538	How did you get funded?
489539	How can I get funding?
362628	How do you flirt through text message?
440167	What are some of the best schools to learn plastic surgery?
440168	Has Kylie Jenner had plastic surgery?
290829	How much is viralmost.com worth?
290830	How much is Minds.com worth?
338396	Is it worth to go into 6 new IIMs than others?
338397	As 5 new IIMs are going to be set up. Do you think it will be easier than before to get a call from any IIM? Will cutoffs of non-IIM college decrease?
513127	Has The Big Bang Theory (TV show) ended?
463733	What is science?
369976	Does Creatine increase body weight?
369977	Can creatine increase body weight?
362601	Who is your Ballon d'Or winner this year?
351043	How can I learn coding in c faster?
227653	I have wasted 4 years of my life and in these 4 years I have done nothing how can I start again and achieve something in my life? I am 23 years old?
227654	Where should a 23 year old be in life?
284118	Is there a difference with the acceptance of dating interracially (black and white) more in the UK or in the US?
310566	How do former Presidents of the United States travel?
310567	Should military service be a prerequisite for serving as President of the USA?
354739	Why isn't Adithi active on Quora?
401011	Is it worth going to TISS Tuljapur for a BA-MA integrated course in social sciences?
401012	Is TISS Tuljapur's integrated BA MA in social work a good course?
135637	What are some examples of bad acting in great movies?
135638	What are some bad movies with great scenes?
190379	How would do you describe a person has ate all kinds of category food in words?
190380	If a person in the middle ages saw a doll made of plastic how would they describe it? What words would they use?
322330	How do I prepare for a Java Hibernate interview?
386986	Which is a better ball pen, Parker, Cross, or 045 Reynolds?
492044	What are the problems in samsung galaxy s7?
26162	How do I make account for freelancing as a web developer?
26163	Is China capable of attacking US mainland? How much damage can they make?
101686	"How can money be ""laundered"" in Vegas?"
217188	Why is stock market data delayed by 20 minutes (NYSE, NASDAQ) to the general public?
217189	Which NASDAQ stocks are transfers from NYSE?
187838	How can I train my cat to use the toilet?
187839	How can I train a cat to use sand as toilet?
12941	When is the best time of year to drive across the United States?
127428	What are some data analytics courses?
127429	What are the courses in data analytics?
340212	What would be a good and creative name for upcoming chain of international schools?
340213	Every time I see rice I am disgusted and want to throw up. What should I do?
210703	How much do guests on shows such as Morning Joe and Hardball get paid for their comments and opinions?
360878	Is a passport needed to get into Jamaica?
212236	"When a car sales person said - ""I barely make no money to sell this car to you but I am gonna do that"", how likely is this? In general, what is the minimal profit would make they feel comfortable to sell a car to you?"
471394	How does Brock know or feel that Walter is a bad guy which is clear from his aversion of Mr White quite a few times in the series?
485768	What is spin in physics?
210550	What is spinning?
159047	Can anyone help me with C programming (library catalog)?
159048	Can anyone help me with my library catalog C program?
315833	What is the suitable mother board for my Intel Core i3 second generation processor?
315834	What is the role of processor and RAM size for doing a data analytics course? (I have an Intel core i3 processor and 4 GB RAM.)
238252	What does behavioural finance do?
171616	What is an economical accommodation near the American Consulate in Hyderabad?
171617	What are the best summer places to visit near or in hyderabad?
386110	What are the ways of getting free internet?
386111	What are the ways to get free internet access?
254593	Do Indian pariah/desi dogs make good pets?
254594	What are some special cares for a baby otter?
397923	What are some of the apps with kiip?
397924	Did Kiip have competitors upon launch?
34671	There are alot of theories regarding evolution, but has anyone been able to prove that a single cell will evolve into an organism given the chance?
34672	Did humans evolve from single celled organisms?
167041	Article 370 has failed and should be removed, What are your views?
167042	What are effects of article 370?
161042	Development Practice: Have you ever worked on a successful water project in urban Latin America? What made it successful?
280229	What are the best programming summer internship opportunities of 2017 for a high school student?
280230	What are the best programming summer internship opportunities of 2016 for a high school student?
135780	What is the syllabus of SSC?
306586	A dishonest dealer sells goods at 30% of profit but uses only 800 grams in the place of a kilogram weight. What is his real gain percentage?
306587	"I'm 34 years old 6'1"" and 150 lbs, all my life I have been this weight, what can I eat to gain weight?"
399072	Which industry would need to break (literally) aluminium the most?
399073	How many RS-28 Sarmat middles has Russia built?
479949	Which is the best health insurance company in India?
153630	Do any substances (except water) exist in more than one form (solid, liquid, gas) at particular temperature and pressure?
153631	How a substance occur in all three states (solid, liquid and gas) simultaneously at triple point?
537802	Do I need Xcode to publish a book in apple store or not?
499096	How should Klout measure influence on Quora?
499097	If Klout is there to measure your social network influence, what is there to measure your matrimonial influence?
492114	Can yoga poses increase height?
492115	Is it possible to increase height after 21? Through Yoga
404144	"If I drink a gallon of water a day and I urinate more than 8 times day is that considered ""frequent urination""? Could that be linked to a possible case of diabetes?"
404145	Most of the day I have a dry mouth and am sometimes thirsty. Is this normal or am I suffering from Type 1 Diabetes? Or should I drink more water?
248478	Which is better LTPS LCD or IPS LCD?
248479	Is an IPS LCD costlier than AMOLED?
410778	How is this database programming question solved?
410779	Why do people like me even though I'm always quiet?
412849	I'm with a company for 2 months already. However, I am now entertaining interviews. Should I tell them that I am currently employed?
63291	Is the importance of Magna Carta overstated?
63292	Do smartphone companies deliberately release software upgrades that worsen the performance of older models, right around the release of a newer model?
55484	What do you think about iOS 8.3?
55485	What do you think about iOS 7?
343819	What are the last 2 digits of [math]117^{513}[/math].?
343820	What are the last 2 digits of 43^43^43?
72539	How can I invest in a startup in India?
72540	How can I fund a startup in India?
310283	Why there is a sound when we crack our knuckles?
310284	What makes the sound when we crack our knuckles?
157419	"What is the song, ""I'm an Albatraoz"" by Aronchupa, about? I get it is a mouse named Laurie, but does is mean something else?"
157420	"What is the actual meaning of the song ""Say something, I'm giving up on you""?"
403196	What if North Korea launches an sudden all-out attack to the South Korea?
403197	What would the rest of the world do if North Korea attacked South Korea?
169438	Which account in Bank of Baroda is good for an NRI?
312614	What are the biggest mistakes you can make when learning the guitar?
312615	Does learning to play guitar make it easier to learn other musical instruments?
274309	How much memory taken by variables in python?
274310	How does python figure out the type of the variables in a function?
403412	What are the differences between a flying squirrel and a sugar glider? What are some examples?
403413	What are the differences between sugar gliders and flying squirrels? What are some examples?
124618	What are some bars in NYC that do not card?
124619	How much money does a wine and food bar make in NYC?
287111	How much do managing directors at Accenture make?
287112	How much does Managing director in Accenture make?
256567	How is Babybel cheese made?
256568	Where does feta cheese come from? How is it made?
231512	Are submariners allowed to take a bath?
194977	How often are submariners allowed to take baths?
355898	What is the property tax rate in Granville, Ohio? How is it compared to the one of Utah?
363424	Do sociopaths know when someone is on to them?
346073	What is a tender?
170735	"What does it mean when a girl says, ""We don't fit each other""?"
170736	My girlfriend is insecure. She says that I can't find other girls beautiful and throws a fit even if I mention something like complementing an actress. What should I do?
440424	We can't study everything as it keeps on evolving so what should we study ?
440425	Is there any good Ayurvedic/homeopathic treatment for child epilepsy in India? Any suggestions?
490402	What happens to all the blood after a person dies?
490403	What happens after a man or woman dies?
347687	What is the opinion of Indian Muslim women on centre's affidvit to Supreme Court on banning triple talaq and polygamy?
156358	What is HushHush.com?
483678	Is there really any advantage of walking 2.5km daily?
483679	What is the advantage of walking in the path or shape of an 8?
243996	What are some good topics to make a PowerPoint presentation on?
506238	How do you take a screen shot?
145659	What percentage of people are psychopaths / sociopaths?
145660	Why is Zeus such a psychopath/sociopath?
28175	How do you delete your Quora primary email address?
28176	How do you delete your Qupra primary email address?
109542	How do I Get my Will power back?
109543	How do I get my powers back?
251340	Could Florida voter registration => public records dissuaded enough people from voter registration as to have turned the 2000 presidential election?
251341	Do I have to put my phone number on my voter registration form?
144266	I'm going to buy a car off craigslist. How do I drive it home with no paper tags or anything?
144267	My Indian fiance is nice, but I feel uneasy about his family. What should I do?
328786	What is the role of mechanical engineer in ISRO?
169855	Where can I get very affordable conveyancing solutions across the Sydney?
240504	Where can I get very affordable conveyancing quotes in Sydney?
236557	What is the salary for a junior software developer at Microsoft Engineering Center in France?
236558	Atheists: Are religions nothing more than self-perpetuating systems of lies, deception, self-deception covered by emotional manipulation?
465184	What is the significance of Ethiopia in the bible?
465185	Why is Ethiopia mentioned in the Bible?
224021	I feel uncomfortable when someone praises me or even says thank you to me. Why do I feel this way and how should I respond?
479496	What are some imperfections in the human body?
479497	What are the imperfections in the human body?
484990	Do GTA 5 run in my i5 4gb ram. 2gb graphics. Laptop?
484991	Why is my seagate Backup Plus external hard drive keep having a beeping tone and not detected in Window 10?
209597	What's the best way to learn malayalam?
209598	How can I learn Malayalam in 3 months?
