test-316616	CGI in Movies : How can I start learning VFX or animation? What are some good books for starting? Should I learn MAYA to get into VFX?
test-316617	I am interested in VFX and want to learn it. Where should I start?
test-316618	Why did you accept Islam?
test-316619	Why did you convert/revert to Islam? This question is not for born-muslims.
test-316620	Can I make a PayPal account at 13?
test-316621	How do you make a PayPal account?
test-316622	"YouTube message saying ""There was a problem playing the video, touch to retry"" How do I fix this?"
test-316623	Does Sunni Identity politics drive support for ISIS?
test-316624	Where we will get latest news about IoT?
test-316625	What is the latest news about apple?
test-316626	What are over damped, critically and under damped systems?
test-316627	What is meant by underdamped, overdamped, and critically damped oscillation?
test-316628	What casues an early period after intercourse?
test-316629	What causes a period to start after intercourse?
test-316630	What is a good explanation of Latent Dirichlet Allocation?
test-316631	What is a latent variable?
test-316632	Where can I create my online store easily?
test-316633	How do I start an online store website?
test-316634	Why Muslims are against uniform civil code?
test-316635	Are there any Muslims who support the Uniform Civil Code?
test-316636	Why is a German Shepherd/Australian Shepherd mix a good family pet?
test-316637	Why do healthcare portals have low visitors after August 2016?
test-316638	Did Quora take away the ability to anonymously comment on answers to your own question?
test-316639	Can you add a public answer or comment to your own anonymous question?
test-316640	What are best YouTube learning channels?
test-316641	What are the best channels YouTube for learning?
test-316642	What are the bnefits of two digit gate rank?
test-316643	What is the round trip cost from Moscow to Vladivostok by Trans-Siberian Railway in economy class?
test-316644	How do I access Marianas web?
test-316645	What is the Marianas web?
test-316646	What is difference between Profitability and financial stability of commercial bank?
test-316647	What kind of Skype coaching does 100K factory Revolution provide?
test-316648	Can you wash suede shoes in the washing machine? If not, what's the best way to wash them?
test-316649	What is the best way to wash clothes by hand?
test-316650	Is windows 10 a failure?
test-316651	Why is Windows 10 successful?
test-316652	What is the etymology of the word ploy?
test-316653	What is the etymology of the word ruthless?
test-316654	How can I continue the game shadow fight 2 in my new phone?
test-316655	Why does my phone have 2 IMEI?
test-316656	What is the approximate cost of shipping a motorcycle from US to the UK?
test-316657	How much does it cost to ship a car from New York to California?
test-316658	Why is Doc Mcstuffins childish?
test-316659	Why is Doc Mcstuffins hideous?
test-316660	How many degrees did Dr. B R Ambedkar earned?
test-316661	How famous is Dr. B. R. Ambedkar outside of India?
test-316662	Would it be possible that you could jump very high if you'd lived in a planet with a high gravity and then transported to earth? No spacesuit?
test-316663	I sweat a lot post running 5kms on a treadmill and followed by badminton, will this result in hair loss?
test-316664	How do I find my social security number online for free?
test-316665	How do you find your social security number online?
test-316666	What is the purpose of your life?
test-316667	What is the purpose of our life? ..
test-316668	How much cash is allowed on a flight from India to Dubai?
test-316669	How much rollers I can take to Dubai from India?
test-316670	What are some good blogs to read about current happenings in handicraft industry?
test-316671	Do I need to pay separately for 5 WordPress websites for the hosting?
test-316672	What is the difference between Solid wood, Sheesham wood and Teak wood?
test-316673	Is wood a pure substance?
test-316674	Does HackerRank support JavaScript? If yes, how and where do I select the language?
test-316675	Can I add my own questions on hackerrank? If yes then how?
test-316676	What is the best technology of the present?
test-316677	What are the best technology?
test-316678	Being socialy anxious and not really confident, what can I do to become more social?
test-316679	What can I do to become more bold and confident?
test-316680	Does the Day Trader Pattern Rule affect Forex trading?
test-316681	What are two facets of socially desirable responding, which include ____________ which means seeing oneself in a positive light and ______________?
test-316682	How to force your hyper active mind to concentrate on studies?
test-316683	What are ways by which I can concentrate more on my studies?
test-316684	"Where did the phrase ""get the lead out"" come from? What does it mean?"
test-316685	"Where does the phrase, ""If you build it, they will come,"" come from? What does it mean?"
test-316686	Why are parlay bets not games of skill?
test-316687	Gambling: Which are the market leaders in online skill based betting?
test-316688	Why do electrons emit photons and not nuclei?
test-316689	Why do electrons emit photons?
test-316690	What is the best way to prepare for SSB?
test-316691	What is the best way for preparing AMCAT?
test-316692	Laziness: Why should I go for MBA?
test-316693	Why should someone do MBA?
test-316694	Which could be the best day of your life?
test-316695	Can you describe the best moment or the best day in your life?
test-316696	What's the worst thing that's ever happened to you during a job-interview but still you got the job?
test-316697	What's the worst thing that's ever happened to you during a job-interview?
test-316698	Why do we use the different types of mirrors?
test-316699	Did the President before President Obama really shove a cigar into the butt of his intern?
test-316700	What are some brain hacks that a neuroscientist or a psychologist knows that most people don't?
test-316701	What are some things that forensic psychologists know but most people don't?
test-316702	What are the advantages of a JFET over a BJT?
test-316703	What are the advantages of MOSFET over BJT?
test-316704	Error
test-316705	My life is falling apart, what can I do?
test-316706	What is the best way to get a student visa in Australia?
test-316707	I am a student in India. How can I get the tourist visa/ visitor visa to Australia and New Zealand?
test-316708	What is resource planning?
test-316709	What is enterprise resource planning (ERP) and why is it so important?
test-316710	How good is Arch Academy of Design?
test-316711	Aside from Hitler, which other historical figure came close to exterminating the Jews?
test-316712	Why do people ask questions on Quora before checking on Google?
test-316713	What are the advantages of using Quora over Google?
test-316714	Can I get a brief explaination about what happened in brexit?
test-316715	Can I get a general overview of what Brexit is? The hows, whys and what’s next?
test-316716	How can I make my Quora answers go viral?
test-316717	How do things go viral on Quora?
test-316718	What are some facts that foreigners do not believe until they come to Mongolia?
test-316719	What are some facts that foreigners do not believe until they come to Bangalore?
test-316720	If a girl has sex during her period and bleeds the next day, is she pregnant?
test-316721	Can my girl become pregnant if her period ends and I have sex with her the next day?
test-316722	What can a computer science undergrad do to solve real life problems in India?
test-316723	How can India solve its electricity problem?
test-316724	Can I really make 800,000 a year as a poker player?
test-316725	Can I make 50 million as a poker player?
test-316726	Is Hillary Clinton going to be indicted for the email server?
test-316727	Speaking from an objective standpoint, how great are the chances that Hillary Clinton will be indicted for her email scandal?
test-316728	How profitable are you in Day Trading?
test-316729	How can I make 500 rupees daily from the Indian stock market if have only 10000 rupees to invest?
test-316730	"Chinese (language): What is ""yirongfu""?"
test-316731	What do native Chinese speakers think of Chinese language?
test-316732	What was cut off marks in IBPS 2015 pre and main exam for obc?
test-316733	What will be the expected cut-off of the GS Paper 1 for the UPSC 2015?
test-316734	Do organic fruits and vegetables contain more carcinogens than their non-organic counterparts?
test-316735	Why are some fruits/vegetables cheaper than few others?
test-316736	What is the best way to accept payments from Indian companies if my company is outside of India?
test-316737	What are some unique characteristics of armadillo teeth?
test-316738	What is the best way of finding out your true passion?
test-316739	What is the easiest way to find out what your passion is in life?
test-316740	How difficult is it to learn a new language fluently?
test-316741	How difficult is it to learn a language isolate?
test-316742	Can Kaspersky, the giant Moscow-based antivirus company, be used as a cyber weapon against us if relations with the Russian govt continue to deteriorate?
test-316743	What can US companies do better to prevent cyber attacks?
test-316744	Why did you change your name?
test-316745	Why do people change names?
test-316746	What are type lenses?
test-316747	What are some of the applications of convex lenses?
test-316748	Can happiness exist without sadness?
test-316749	Can we retain happiness without experiencing sadness?
test-316750	"What is the correct pronunciation of ""beignet""?"
test-316751	"What is the correct pronunciation of ""Worcestershire""?"
test-316752	What is the difference between product planning and new product?
test-316753	Is Product Design new age Product Management?
test-316754	What is the worst team name for any pro team in sports?
test-316755	Could I play for a team in pro sports because I am the owner?
test-316756	Why hasn't Taco Bell opened in Thailand?
test-316757	Where can I find Taco Bell store numbers?
test-316758	How do I get into a good college for postgraduate studies?
test-316759	What can I do if I don't get into a good college for undergraduate studies?
test-316760	Who is the most beautiful girl( appearance wise) in all of IITs?
test-316761	Who is the most beautiful girl of iitb?
test-316762	"What is Android doing when, after an upgrade, it tells you it's ""optimizing"" the apps?"
test-316763	Should I back up settings, apps, etc. before I upgrade to a new version of Android?
test-316764	What is the most pitiful thing in the world?
test-316765	What is the most delicate thing?
test-316766	What are the Big Bang Theory characters' positions at Caltech?
test-316767	"Where do the characters in ""The Big Bang Theory"" work?"
test-316768	What kind of jobs can I apply for in the United Nations after completing an MBA in finance/marketing?
test-316769	What would be the job opportunities after completing graduation in chemistry and MBA in marketing and finance? Is it possible to get a job in Google?
test-316770	What are the real cost of making a sunglasses as some of it are really pricey?
test-316771	What are some of the awesome things that you or someone else did as a student to liven up college life and make it productive and useful?
test-316772	How do I use lucky patcher without rooting the phone?
test-316773	What is the best way to root an AT&T LG Optimus phone without a computer?
test-316774	Where can I get best quality Fire Alarm Panels in Sydney?
test-316775	Where can I found advanced fire alarm system in Sydney?
test-316776	How much time does it take for a passport to arrive in normal?
test-316777	How much time before we can renew our passport before expires?
test-316778	What is your favorite patchouli perfume?
test-316779	Is Draymond Green overrated?
test-316780	Why can't Modi and A.K supporters think about India's first? Criticise when they are wrong so that may be party or leaders introspect?
test-316781	Open Culture: Why do indians consider kissing as a crime? Cause we are still living in a society who is so conservative and narrow minded that they think that a boy and girl  holding hands are commiting a sin that even god will not forgive The 70's generation seem to be so ignorant that they have killed the way of emoting the feelings.
test-316782	What advertisements in India taught you?
test-316783	How can we get our first funding (seed) in a month's time in India?
test-316784	"What is the etymology of ""archetypal""?"
test-316785	What is the etymology of Qijiang?
test-316786	Can I make money online and how?
test-316787	How can we earn money online in india?
test-316788	Why do babies have chubby cheeks?
test-316789	Why aren't Indian babies chubby?
test-316790	What will happen if am caught with some weed or joint in Pune?
test-316791	Have you ever been caught with weed by the police in India? What happened?
test-316792	How do you ask questions on Quora?
test-316793	How do I ask questions on Quora?
test-316794	What are some interesting applications of thermodynamics in our daily life?
test-316795	What is the single best application of an 80/20 rule in your daily life?
test-316796	Is there a phobia for people around the world towards Jewish people?
test-316797	Why did the Jewish people scatter all over the world?
test-316798	What is the pKa of NaOH?
test-316799	How can the moles of NaOH be calculated?
test-316800	How do you find derivatives at a point?
test-316801	Can a man transfer a cancerous HPV to a woman without feeling any symptoms? If there are no tests for men, how can one know to have HPV?
test-316802	How do I know a girl really like me?
test-316803	How can I tell if my girlfriend really loves me?
test-316804	What are the new business opportunity after demonetisation in India?
test-316805	What are the new business opportunities in India?
test-316806	What was your biggest investment mistake?
test-316807	What's the biggest mistake INDIA ever made?
test-316808	Which is better polytechnic or 11th ,12th?
test-316809	Which of the following is a better syllabus: ICSE or CBSE?
test-316810	What is the best airline flying from Singapore to NY?
test-316811	I am flying from Dallas to Kolkata in January '17. I have 180,000 Chase UR Points. Which airline will be the best one to transfer the points to?
test-316812	Has someone ever tried to scientifically prove/disprove the existence of a god?
test-316813	Why can't we ever prove or disprove the existence or non-existence of God?
test-316814	Who is the current education Minister of India 2016?
test-316815	What is the current state of education in India?
test-316816	Why Messi decided for retirement?
test-316817	What's the reason behind Lionel Messi retirement?
test-316818	What exactly happens on the international date line?
test-316819	What is the HTML code for new line?
test-316820	Why are covalent bonds directional?
test-316821	What are covalent bonds?
test-316822	What is Android?
test-316823	What is an android?
test-316824	What should I wear under my skirt?
test-316825	What does it feel like to wear a hoop skirt or tulle?
test-316826	What's a rapist enabler psychology like?
test-316827	What are the substantive differences between obtaining B.A. and B.S in Psychology?
test-316828	Which are the best places in Cuba for trekking?
test-316829	Which resort is the best in Cuba?
test-316830	Which SaaS companies have affiliate programs?
test-316831	Should I implement a Referral or Affiliate Program for my B2B SaaS company?
test-316832	Can you inspire me?
test-316833	How can I inspire you?
test-316834	Was Bruce Lee the only one to have ever done one finger pushups?
test-316835	Why do many movie directors only make one good film?
test-316836	Do all dreams mean something?
test-316837	Do dreams really mean something for real life?
test-316838	"What is ""moral decision""? What are examples of this?"
test-316839	What are some examples of an ethical decision?
test-316840	Was George W. Bush planning on invading Iraq prior to 9/11?
test-316841	Is it possible to defend George W. Bush's actions when he invaded Iraq? If so, how?
test-316842	Will kindle screen harm my eyes while reading from it? Just like any other LED screens?
test-316843	Is Kindle a good alternative to computer screens to read e-books without hurting my eyes?
test-316844	How can I know that I am in love with a girl?
test-316845	What is love and how do you know when you love someone?
test-316846	What does solubility mean?
test-316847	What is the solubility of hydrocarbons?
test-316848	How can I overcome anxiety before examinations?
test-316849	How do I overcome my nervousness before an exam?
test-316850	Does coconut oil makes your hair smell bad?
test-316851	Can coconut oil make your hair darker?
test-316852	What happen if you submit a college application in the common app way after the deadline? Will the university still receive it?
test-316853	Am I allowed to submit SAT scores after the deadline of a college?
test-316854	How do Americans possibly see Donald Trump as a better candidate than Hillary Clinton?
test-316855	Who will be a better president Donald Trump or Hillary Clinton?
test-316856	How comfortable is the Tesla Model S?
test-316857	Has a Tesla model S ever been put on a track?
test-316858	What CPU is better to choose AMD A12-9700P vs intel i7-6500U?
test-316859	Which CPU should I buy, an AMD or an Intel?
test-316860	When plants use sunlight to make food, the energy is?
test-316861	What do plants use sunlight energy for?
test-316862	If street slums does not have any address proof then how can Indian telecom operators provide mobile service to them?
test-316863	What is the best mobile service provider in Canada?
test-316864	Which is the best Sanjeev Kumar movie and why?
test-316865	What are the best Sanjeev Kumar movies?
test-316866	Why do I feel full but hungry?
test-316867	Why do I feel full when I feel hungry?
test-316868	What is the fuel capacity of an Airbus A380?
test-316869	How much distance can an Airbus A380 cover with its fuel tank filled to max level?
test-316870	What's the difference between a T-shirt, a top, and a blouse?
test-316871	What type of shirt is as comfortable as a t shirt but as stylish as a blouse?
test-316872	How much does the weight of the body reduce when submerged under water?
test-316873	Boiling water, under a pressure of 1.2 bar, is reduced to a pressure of 0.5 bar. How much steam forms per kg of water?
test-316874	How can I specifically improve my English?
test-316875	How can I improve my english?
test-316876	What are some inventive business cards that have both a practical and innovative use?
test-316877	What are some unique business card ideas?
test-316878	How do I make studying anatomy easier?
test-316879	What's the best way to study human anatomy?
test-316880	What are some movies made long ago that could've been made yesterday?
test-316881	What's the movie you're amazed has never been made?
test-316882	I just think of my boyfriend all the time. How do I concentrate on my studies?
test-316883	How do I just concentrate while studying and think of nothing else other than the respective subject?
test-316884	What are some sample images from Nikon's 18-55mm VR II kit lens?
test-316885	What is the difference between an 18-55mm IS II lens and an 18-55mm STM lens?
test-316886	How do I start menswear ready-made garments?
test-316887	How can I recover unsaved pictures from snapchat?
test-316888	How can I travel the world while having no money?
test-316889	How can I travel without an ID or money?
test-316890	Why is my Belkin N150 router blinking orange?
test-316891	What does an orange light on a Belkin router mean?
test-316892	What are some good songs to choose for pre wedding shoot?
test-316893	Which song would you like played at your wedding?
test-316894	Why did Donald Trump win the 2016 Presidential election?
test-316895	Even with so much criticism how did Donald Trump win the elections?
test-316896	How can I become an ambassador for a camera company?
test-316897	WHEN SOMEONE GIVES ME A TEXT TO READ, I PRETEND TO READ QUIKLY AND SKIM?
test-316898	How many horsepower do humans have?
test-316899	How many joints are there in the human body?
test-316900	Can President Obama become president of another country?
test-316901	What do non-Americans think of Obama's performance as president so far?
test-316902	How can I convince a boy to like me after he had his first sex adventure?
test-316903	Does NUS accept GRE scores electronically?
test-316904	What are the skin flakes in my ear?
test-316905	Why does aging skin sag?
test-316906	What body parts correlate best with penis size?
test-316907	What's the dirtiest part of the body?
test-316908	Why do good people like Avinash Dharmadhikari resign from one of the most reputed posts i.e. IAS?
test-316909	What are the lessons to be learned from the resignation of Roman Saini from IAS?
test-316910	Can we design a computer that gives set of tasks everyday to everyone on earth so we all can be peaceful and wealthy?
test-316911	Why do terror attacks in Europe seem to be happening more and more regularly?
test-316912	Is Brazil a nice place to live?
test-316913	What are some of the most bizarre places around the world which are less known to people?
test-316914	Harvard College Courses: What is general shopping advice for Korean classes?
test-316915	Harvard College Courses: What is general shopping advice for Government classes?
test-316916	"Why is ""Japan's Marine Day"" unknown in Fiji?"
test-316917	"Why is ""Japan's Marine Day"" very rare in The Philippines?"
test-316918	June 2016: What issues will Modi talk about in his speech to the US Congress?
test-316919	What are your views on Narendra Modi's speech addressing the joint session of USA Congress?
test-316920	What happens if you travel faster than the speed of light?
test-316921	What would happen if I went faster than light?
test-316922	What is the need of of cycloconverter?
test-316923	Do we need religion?
test-316924	What is the best way to deal with writer's block?
test-316925	What are some tips to get over writer's block?
test-316926	Stock size of pulsar 180 is 90/90-17 (front), 120/80-17 (rear), both are tubeless. If I want broader tyre, then up to what size will the rim support?
test-316927	Does the pulsar 150 2015 model is equipped with tubeless tyres?
test-316928	My most favorite cousin marriage is coming and Lahore is well known for best shopping zones from where can i do the best shopping?
test-316929	What is the best handicraft shop where I can purchase handicrafts from Orrisa?
test-316930	How do I write a letter of introduction for employment?
test-316931	How do I write an intervention letter?
test-316932	Is there any way to commit painless suicide?
test-316933	What is the cheapest, easiest, least painful way to commit suicide?
test-316934	How does the for loop work in Java?
test-316935	How does system.out work in Java?
test-316936	How do I stop being jealous of something or someone?
test-316937	How can I stop being clingy and jealous?
test-316938	How much is the down payment and monthly instalment for royal Enfield classic 350?
test-316939	How can I protect my Royal Enfield Classic 350 (silver) paint?
test-316940	How accurate/exact is iOS GPS in pinning/marking exact locations and getting directions back to those exact locations? Would anything cloud reception?
test-316941	Teleportation: How much computer memory would we need in order to record and reproduce the exact location of all the atoms in our body?
test-316942	What is the reason PETA trying to ban jallikattu instead of beef exports?
test-316943	What is your opinion on the Jallikattu ban? What are the actual reasons for this ban?
test-316944	What all things you should buy before going to US?
test-316945	From where should I learn Robotics and Wed designing if I am 1st year non IT n non CS Students and have interest in these?
test-316946	What exactly is left-wing nationalism?
test-316947	"""Nazism"" is the abbreviation of ""National Socialism,"" and socialism is a left-wing ideology, so why are Nazi and neo-Nazi political parties, particularly in Europe, considered far-right political parties?"
test-316948	How do I start direct selling of a product?
test-316949	If you want to start a business selling things, how do you get the products to sell?
test-316950	What are the examples of biotic factors in an ecosystem?
test-316951	What are some common examples of biotic and abiotic factors in an ecosystem?
test-316952	What does Jake Williams think about Adam Taha?
test-316953	Will Jake Williams downvote me?
test-316954	Is the male gene more dominant than the female gene?
test-316955	Why are Asian genes dominant?
test-316956	What is the career trajectory in data analytics?
test-316957	How do I build career in data analytics?
test-316958	How do I build self confidence What should I do?
test-316959	How do I improve self confidence?
test-316960	What do you say to a 3 year- old kid who killed his 6 month-old brother in the oven by error?
test-316961	How can I manage housework and taking care of my 3 kids one is baby only 6 months old?
test-316962	What is the best dedicated server provider in the India?
test-316963	What are the best Dedicated server hosting providers in India?
test-316964	What are the best ways to improve writing skills?
test-316965	Some good Tips for improving writing skills?
test-316966	How is marijuana detected in a blood test?
test-316967	Is marijuana detected in drug test?
test-316968	How do I pass 70-410 exam?
test-316969	How can I pass the 70-494 exam?
test-316970	What are some startup ideas for India?
test-316971	Is the idea of a drone startup company a good one in India?
test-316972	Which book is best for java learning?
test-316973	Which is the best book for java programming?
test-316974	"Clinton recently apologized for her ""deplorable"" statement. Should she have?"
