360000	How do you calculate the cross-sectional area of a pipe ?
360001	Does water filter carbon monoxide ?
360002	What's the future of DECT vs other wireless technologies ?
360003	What is wireless sensor network (WSN) technology ?
360004	What would be a good desktop computer for software development ?
360005	How do we find good software developers ?
360006	What should I do if a girl tells me that she deserves better than me ?
360007	Do I deserve a girl who is better than me in everything ?
360008	What is the pain of paying ?
360009	What is pain ?
360010	Second Amendment : Should people have a right to keep and bear fireworks ?
360011	Second Amendment : Should people have a right to keep and bear firearms ?
360012	How can one improve their typing skills ?
360013	Is a conservative or bourgeois socialist still considered a true socialist ?
360014	Why would Mexico be considered a socialist country ?
360015	I have to do a project for our OOP class . Can someone quickly give me a topic for the project ?
360016	What font is used to write legal documents ?
360017	Which is a suitable inpatient drug and alcohol rehab center in Bay County FL ?
360018	Which is a good inpatient drug and alcohol rehab center in Seminole County FL ?
360019	What are some of the best romantic conversations in a movie ?
360020	What is the best romantic conversation you can write ?
360021	What is the selection process for the Minerva Schools at KGI ?
360022	What should a student do to apply for the Minerva Schools at KGI ?
360023	Why do pennies exist ?
360024	How many pennies exist ?
360025	When it comes to affixing an Indian postal order with the RTI application to be dispatched , should I simply staple it with the entire lot , use a safety pin instead or can it be affixed using a glue ?
360026	Can I use Gorilla Glue on fabric ?
360027	Is it safe to get braces while having cavities ?
360028	Does it hurt to get braces ?
360029	Am in the CKWL 6 so is it possible to confirm the ticket so please advise ?
360030	What is the future of Indian badminton ?
360031	How do I get better in badminton ?
360032	What does it mean to live a simple life ?
360033	What can we continue to learn from the Voyager missions ?
360034	Could we ever go to the sun ?
360035	Why are there no prediction markets in India ?
360036	What is the prediction for monsoon in India in 2016 ?
360037	Have you ever been attacked by a great white shark ?
360038	Who would win a fight , a Great-white shark or a Dusky dolphin ?
360039	What makes banana bread so moist ?
360040	What is the best way to make moist bread ?
360041	How do I believe in myself more ?
360042	How can I believe in myself ?
360043	As of January 2016 , is Obama no longer the President of the United States ?
360044	What's a good workout program for me ?
360045	What are some good workout programs ?
360046	Why did PV Sindhu wear yellow clothes in Olympics ?
360047	Did Father Christmas used to wear green clothes ? If so , why was his clothing color changed to red ?
360048	Is there anyone who solved cube without learning its algorithms ?
360049	Is it possible to solve the second layer of a Rubik's cube without using any algorithms ?
360050	On what technicality did China stall the U.N. declaration of Masood Azhar as a terrorist ?
360051	Where do I get the refund if a made payment using credit card ?
360052	How do I make a credit card payment ?
360053	Is there an integrated M.Tech called electronic system design or VLSI design at IIIT-Bangalore ?
360054	How do I apply for a scholarship in IIM ?
360055	What are some examples of distributed computing ?
360056	How can I clear concepts of physics and maths experimentallt ?
360057	What is the best way to clear the concepts in physics and maths ?
360058	Are there any good secret places to smoke a cigarette on the Google campus ?
360059	How does Google/Facebook know I smoke cigarettes ?
360060	What are the best pornographic movies of all time , and why ?
360061	What are the all-time best movie lines ?
360062	I checked my grp ticket wth reference no . & last name but it didn't disclose flight Details . it displays only me & my friend name . what should I do ?
360063	Mothers ! What do you do for creating a relaxing life between work ? Home ? Kids etc ?
360064	What is the chemical formula for potassium phosphate ?
360065	What is the formula of potassium nitride ? How is it determined ?
360066	Why do some people get bored of sports ?
360067	Do people who live by the beach ever get bored of it ?
360068	Who will be the CM in Delhi ?
360069	Who is CM of Delhi ?
360070	Anniversary I am planning a party for my parents 45th anniversary , what are traditional colors , gifts , etc. of the 45th anniversary ?
360071	What is it like to be someone with Asperger's on MDMA (ecstasy) ?
360072	What does it feel like for someone with bipolar disorder to use MDMA ?
360073	Do you think Hillary Clinton's pneumonia will affect the election ?
360074	Why did the victorious Chinese Army suddenly retreat during the 1962 Indo-China War and declare a unilateral ceasefire ?
360075	Is having sex really important to a women in a relationship ? When is the right time to make a move ?
360076	What are the best Android apps you must have ?
360077	What are some of the best Android apps you have ever used , and why do you think of them as the best ?
360078	How is the principal component calculated every month for EMI in SBI Max Gain Home Loan ?
360079	How does a home loan calculator help me in determining my home loan EMI ?
360080	`` How do I get actual salary from these'' `` pay scale'''' and'' `` grade pay'''' like big words ?''
360081	How do I do a face clean up at home in India ?
360082	How do I clean old stains from kanchi silk safely at home ?
360083	I did not do good in high school and my first year of community college , but I recently decided I want to study computer science . Im a 20 year old female , Am I too late ?
360084	What is smart home platform ?
360085	What is a smart home ?
360086	How do I file for a patent ?
360087	Should I file for a patent ?
360088	What are some lesser-known sights to see when visiting Porto-Novo , Benin ?
360089	Durbin Watson table ?
360090	Why is OTG not working properly for hard disk on Android Nougat ?
360091	Can the external hard disk be accessed through mobile like OTG ?
360092	What are the differences between single and double displacement reactions ?
360093	What are some common uses of displacement reactions ?
360094	How do you say thank you in Arabic ? Does it depend on who you're speaking to ?
360095	`` How do you say'' `` I love you'''' in Turkish ? How does it vary depending on who is speaking or who is being spoken to ?''
360096	Do Republicans see Medicare as socialism and/or big government ?
360097	If Quora writers are so good , shouldn't they work as paid professional writers somewhere else ?
360098	What are the best strategies for winning Sid Meier's Civilization V ?
360099	If I'm new to Sid Meier's civilization , which one will I like most ?
360100	What is your Uber rating ?
360101	What's Uber T ?
360102	Is touch laptops worth buying for a student ?
360103	Are laptops worth buying ?
360104	`` What is the difference between a'' `` heuristic'''' and a'' `` cognitive bias'''' ?''
360105	What is the difference between cognitive bias and cognitive distortion ?
360106	In a world where we are overloaded by information , how do we find the correct choices to make in life ?
360107	What is communication system & use ?
360108	What are some common examples of non-vascular plants , and how do they compare and contrast to ferns ?
360109	Laura wants to cut a board into equal three equal pieces.The board is 5/8 feet long.How long will each piece be ?
360110	How can I cut a pie into x equal pieces , say , 7 ?
360111	How much it cost to set up a badminton academy ?
360112	Why is the Elixir programming language getting lots of interest in late 2016/early 17 ?
360113	What is easier to learn , if I already play electric bass : guitar or upright bass ?
360114	Why is heat transfer slower when it is close to the temperature of a substance's surroundings ?
360115	What universities does Splunk recruit new grads from ? What majors are they looking for ?
360116	Why is Mukesh Ambani more successful than Anil ?
360117	How is IKEA furniture made ?
360118	How is IKEA furniture named ?
360119	How honest should you be ?
360120	What is the best English to Chinese translation app ?
360121	What's the best English to Chinese translator ?
360122	What is the difference between forecast and actual sales ?
360123	What are the differences between sales and marketing ? What are some examples ?
360124	What are the major differences between working at LinkedIn and Microsoft ?
360125	What major differences are there between working at LinkedIn and working at Google + ?
360126	Will I get into MIT ?
360127	Could I get into MIT ?
360128	What do you know about treatment abroad in Germany , Switzerland ? Is it good enough for stem cell treatment ?
360129	What is the story behind Eric Koston cleaning toilets back in the day ?
360130	Which is the most circulated newspaper in south India ?
360131	What does it feel like to make love ?
360132	What should I do to to choose a career ?
360133	In the United States , how much of a difference is there between northern states and southern states ?
360134	What are the best visualizations for financial data , e.g. stocks ?
360135	What is your favorite financial software for data visualization ? Why ?
360136	Is there anyone here who joined a JEE coaching in August and got good marks in the half yearly exams ?
360137	I got 63/360 marks in JEE (Main) , that too after one year of coaching preperation . Do I have any chance getting in a good engineering college ?
360138	What is it like to be a womanizer ?
360139	What does it mean in Korean ?
360140	What does 됐어요 mean in Korean ?
360141	How do I get work in Dubai ?
360142	Do you like living in Alaska ?
360143	Is Ram Gopal Verma the best ever movie director of India ?
360144	What is Anurag Kashyap's opinion on Ram Gopal Verma ?
360145	Should I buy a Mi or an iPhone ?
360146	Should I buy an iPhone 5 or an Mi 4i if I have the option to buy both at the same price ?
360147	How can one become a data scientist after BCom ?
360148	What's the most secure iOS messenging app ?
360149	What is the most secured messenger app ?
360150	What are the best aspects of living in Puerto Montt , Chile as a young adult ?
360151	What is gravity ? What are the different theories about gravity ?
360152	What if we are all alone in the Universe ?
360153	How did Zeus rule his family and what kind of relationship did he have with Poseidon , his brother ?
360154	Who is julian assange actually ?
360155	Is being a data scientist intellectually stimulating ?
360156	How do I spy on my spouse without their knowledge ?
360157	How do I hire a private investigator to spy on my cheating spouse for me ?
360158	Why do I feel guilty if I succeed ?
360159	Why do I feel guilty ?
360160	As a beginner , is Yamaha F310 acoustic guitar suitable and can I go for it ?
360161	Which is the better guitar to buy between Yamaha F310 and Cort Ad810 ?
360162	How is the working experience in Code Brew labs Chandigarh ?
360163	What is to like work at Infosys Chandigarh ?
360164	What is the percentage load if KWH and HR are known for 250kva dg set in three phase load ?
360165	What is the technological difference between top load and front load washing machines ? Why are front loads better than top loads ?
360166	How do I make myself comfortable ?
360167	Cheast of bus ?
360168	What do you think about people who study political science ?
360169	How do people learn about politics ?
360170	What are good ways to find all the possible paths between two nodes in a directed graph ?
360171	How many ace cards are there in a 52-card deck ?
360172	What movies should I watch ?
360173	Are there other payment infrastructure providers that offer a similar offline/online matching API as CardSpring ?
360174	We wanted to use CardSpring but having trouble contacting them . What is alternative Gateway for this whose API we can use ?
360175	What are some things new employees should know going into their first day at The Habit Restaurants ?
360176	What are some things new employees should know going into their first day at Carrols Restaurant Group ?
360177	Where is the Maruti Suzuki Showrooms in Bhopal ?
360178	Where is the Maruti Suzuki Showrooms in Hyderabad ?
360179	Does Allen provide a handbook containing physics formulae in DLP ?
360180	Are Allen's DLP modules better than Allen's classroom modules for pre medical ?
360181	What are the non benefits of caffeine ?
360182	What are the benefits and disadvantages of caffeine ?
360183	What is the best python quantitative finance to workout of anaconda ?
360184	Books for preparation of DMRC HR exam ?
360185	How do you justify the exorbitant costs of Rolex or Omega watches when the primary purpose of a watch is to show time ?
360186	Which car services are available in Normal , IL ? How good are they compared to taxis and relative to each other ?
360187	Car Maintenance : How do you make windshield wipers stop squeaking ?
360188	Is there an alternative to windshield wipers ?
360189	How are the dormitories designed to support students' learning experiences ?
360190	How can I get a graphic design job at Upwork if I'm still a student with no experience in the design field ?
360191	What are the 5 best Cirque du Soleil songs and from which show do they come ?
360192	What is a day in the life of a performer in Cirque du Soleil ?
360193	Is Coinarch.com a scam ?
360194	What is this weird animal ?
360195	What is weird ?
360196	What is the difference between spaghetti and noodles ?
360197	What is the order in which to watch the Twilight movies ?
360198	If Twilight series is remade into Bollywood , then which actors will play in which roles ?
360199	Franklin Veaux : What are your thoughts on Chase Amante and his website (GirlsChase.com) ?
360200	I am an MBA fresher with international business and marketing specialisation , how should I choose the industry to work with ?
360201	`` What is the stanza form in'' `` A Psalm of Life'''' ?''
360202	Why did America make the UK dismantle their trading system in WWII ?
360203	What are the dancing types in bar or nightclubs ?
360204	How do I start interaction with a girl in dance bars ?
360205	Is it possible to heighten the bridge of my nose without plastic surgery ?
360206	If opponent concedes in hearthstone , will I get less experience points than if I defeated him ?
360207	When does a Senate motion require 3/5 vote ?
360208	U.S. Senators : Susan Collins has the best consecutive voting streak record . Who has the worst ?
360209	Suitable prefix to make opposite of loyal ?
360210	Why is my grandmother yelling and screaming at the cat for messing up the bed ?
360211	Should I go ahead and start working/uploading my comic book now or should I wait until my drawing skills are much better ?
360212	How can I escape from Mexico ? I need to start a new life in a different country , Mexico is suffering a terrible crisis and it is affecting us all . .
360213	How can I hide my active status on Facebook Messenger ? Is there a way to do this without restricting myself to see when others are active or not ?
360214	Why are there only six trigonometric ratios for a right angled triangle ?
360215	Are trigonometric ratios valid only for right angled triangles ?
360216	How can you not hate someone ?
360217	What is a codon and what does it represent ?
360218	What are triplet codons ?
360219	`` What does it mean when someone says'' `` saying nothing sometimes says the most'''' ?''
360220	Can I host my own website with my own Computer ?
360221	What happens if you left the fridge door open ?
360222	How do I contact Instagram to discuss a partnership ?
360223	What is the coolest thing I can buy on the internet for under Rs 2000 in India ?
360224	What is the coolest thing I can buy on the internet for under Rs 1000 in India ?
360225	What universities does Home Bancshares recruit new grads from ? What majors are they looking for ?
360226	What are the most interesting products and innovations that Akamai Technologies is coming out with in 2016 ?
360227	What job a memory of remembering names can get you ?
360228	How can I use Omegle on my iPod Touch and how is it compared to using 6 Rounds ?
360229	How can I use Omegle on my iPod Touch and how is it compared to using Badoo ?
360230	Is the planet earth moving close to the sun with every orbit ?
360231	How do I screen cast in Android without using Chromecast ?
360232	How can I cast my phone screen on tv without Chromecast ?
360233	Can Russia win a war against India ?
360234	How can I stop being pushy ?
360235	How do you stop being a coward ?
360236	Why aren't there any nude beaches in India ?
360237	What are some of the cheap and best restaurants in Kochi ?
360238	How does a police manage to withdraw a gun and shoot a criminal who has already pointed a gun at the police and ready to shoot the police ?
360239	Are there ways of increasing optic fiber Wi-Fi range ?
360240	Why is India insecure and scared of Pakistan's economic development projects & trying hard to sabotage them ?
360241	Why are there so many people from India and Pakistan that try to scam people ?
360242	Is Laurel Lance (Katie Cassidy) the most annoying character in the TV show Arrow ?
360243	How can I travel on my own ?
360244	Can I upgrade my phantom 3 standard drone to a phantom 3 professional drone ?
360245	Can I upgrade my phantom 3 standard ?
360246	Which gives me more chances : applying for Early Action to Harvard , Princeton , Yale , Wharton , MIT , Caltech or Stanford ?
360247	How was gold created ?
360248	How can we create gold ?
360249	Why do some people hit themselves when unhappy ?
360250	Why do people want to see others unhappy ?
360251	What do you think will be the 2017 New York Yankees everyday lineup , pitching rotation and total payroll ?
360252	I would like to know if there is any added advantage of a person studying marketing so that they can make it in SEO or Social marketing ?
360253	What is the correct way to pronounce ` Jalapeño' ?
360254	What should target SSC or UPSC first ?
360255	I am 28 , working in IT , targeting CSE 2017 . Planning to leave job , but cynical about upsc reducing age limit to 30/28 . Is my decision correct ?
360256	Why is Madara Uchiha so mean ?
360257	How soon can I deactivate instagram ?
360258	Can I deactivate Instagram ?
360259	What were the social effects of World War 1 ?
360260	What are some social effects of the World War 2 ?
360261	What is the difference between a black and blue brindle Pitbull ? What makes their coloring different ?
360262	What is a Brindle Pitbull and how do they look like ?
360263	What is AMO ?
360264	What is AMOS ?
360265	If your U.S. birth certificate is stolen , is your identity in danger ? If so , to what degree ?
360266	I want to ask my boss about my stipend . How can I write it in a formal email ?
360267	Why don't people grasp the difference between'' you're'' and'' your'' ?
360268	What is it like to be a business consultant ?
360269	`` What does the line'' `` Death inspires me like a dog inspires a rabbit'''' mean to you ?''
360270	How do I send 16-bit data to Arduino using Simulink ?
360271	How do I make a 4-bit calculator using LED in Arduino ?
360272	Why does Ubuntu use so much ram ?
360273	How many calories must be consumed in a day ?
360274	How many calories does a tree consume a day ?
360275	How can I become a distributor of your online products in my city which is rarely available for cash on delivery services ?
360276	Health-wise is it ok to eat more than one type of meat at once ?
360277	WHY DID 2GO CHAT OR MOST CHATS APP FAIL ?
360278	What are some of the ghost stories ?
360279	What are some true ghost stories ?
360280	μTorrent : How does VPN keep someone's identity anonymous when downloading torrents ?
360281	Who controls our feelings ?
360282	What is qualification to get job of network engineer ?
360283	What exactly is the job of a network engineer ?
360284	What is Jason Russell up to these days ?
360285	Did KONY 2012 have any effect on warlords in Africa ? Any at all ?
360286	Which SEO services are the best in Florida ?
360287	What are some common habits existing among billionaires ?
360288	Why does Quora Android app is not working ?
360289	Why hasn't Quora taken active efforts in improving their Android app ?
360290	Does placing a bowl of water in a room help humidify the room ?
360291	Will a humidifier help me with my dry skin ?
360292	What is the difference between a girl's ass and a guy's ass to straight guys ?
360293	I feel like I have wasted my life by watching anime and playing games . What should I do ?
360294	Am I wasting my life by watching TV ?
360295	How many admins can have access to one Instagram account ?
360296	If the modern state of Israel is predicated on a peoples' return to a land they were expelled from 1900 years prior , shouldn't we also make provisions for the American continent to be returned to Native Americans ?
360297	How can I reduce pre-college anxiety ?
360298	Where is Sri Lanka ?
360299	How is Sri Lanka ?
360300	Why does Misty as well as May leave Ash Ketchum on the Pokémon journey while Brock never leaves him ?
360301	In the third Pokémon movie , why did Ash and his mom leave Molly ?
360302	What's the name of the song that plays in the Deadpool movie trailer ?
360303	`` In the trailer for the movie'' `` Ted'''' , what song plays in the club scene ?''
360304	What is the best moment in our life ?
360305	How many people know hinduism at world level ?
360306	Is it best to drive a sports car with stick shift , paddle shift , or automatic ?
360307	What are natural numbers ?
360308	What is a natural number ?
360309	What is Salesforce's market share in the SMB space (for their sales cloud application) ?
360310	What is the current market share of enterprise applications in the USA ?
360311	Is a Tiger tank realistically as effective against Sherman tanks as shown in Fury ?
360312	What do current/former tank crewmen think about the movie Fury and its accuracy ?
360313	What is the difference between research and workshop ?
360314	Is schizoaffective disorder a form of schizophrenia ?
360315	Is schizophrenia a dissociative disorder ? Why ?
360316	Ramp signal even or odd ?
360317	How do i solve this computer science assignment ?
360318	What are some best dialouges from Hollywood movies ?
360319	How many stamps do I need to put on a card that I'm sending from Massachusetts to Canada ?
360320	How do a Indian marry an IDF woman ?
360321	In Jewish tradition is it permissible to use an alarm clock to wake up for Sabbath synagogue attendence ?
360322	What is the square root of 15,241,578,750,190,521 ?
360323	What is the temperament of a black Lab/Australian Shepherd mix ?
360324	Is it true that life at NIT Silchar is better than almost all the other NITs next to NIT Trichy ?
360325	How is NIT Silchar ?
360326	What are some rules of restaurant kitchen etiquette that most people don't know about ?
360327	What are some etiquette rules I should know about when eating in a restaurant in Russia ?
360328	What is the average weight , height and penis size for a 14 year old ?
360329	Is 10 inches a normal/average arm size for 14 years old boy ?
360330	`` English (language) : Which is correct ,'' `` He will come , will he not ?'''' or ,'' `` He will come , won't he ?''''''
360331	What is the difference between did he come and did he came ?
360332	Can FIFA 15 be played on Android offline ?
360333	Can I play FIFA 16 on my android tablet offline ?
360334	How can I Found My inner Soul to improve Myself ?
360335	How can I listen to my inner soul every time ?
360336	What is Shrinkage and how to calculate it in a BPO industry ?
360337	What is the growth of the BPO and KPO industry in the past ten years in India ?
360338	`` What are some examples of sentences using the word'' `` hospitality'''' ?''
360339	`` How is the word'' `` reverent'''' used in a sentence ?''
360340	`` How is the word'' `` revered'''' used in a sentence ?''
360341	What are some interesting ideas for a Youtube channel ?
360342	What are the generic job groups of engineering ?
360343	What's your take on relation of Modi and Yoga ?
360344	What are the reasons for World War 1 ?
360345	What is hybrid federalism and how is it significant to comparative asian politics ?
360346	What is the significance of political thought ?
360347	How do you create a drill to bore into the center of the earth ?
360348	Why do good human beings always have to face problems in their lives ?
360349	Does every human being have a problem with everyone they know ?
360350	How much money do sperm donors make in India ?
360351	What are the Night King's powers ?
360352	What is the Night King's weakness ?
360353	What is a suitable solar panel installation provider in Livermore , California CA ?
360354	I joined an IT company as a pre sales associate in International Business . Is there any scope to explore within the next 5 years ?
360355	Is there any exam for an internal promotion in SAIL ? How far can I get promoted after 5 years if I join as MT 2015 ?
360356	What determines whether a child gets an innie or outie belly button ?
360357	Are there any advantages or disadvantages of an innie or outie belly button ?
360358	Can we make tweet colorful ?
360359	How many tweet that the average user tweets a day ?
360360	`` I heard someone pronounce the'' `` NYSE'''' , as'' `` nice - e'''' . How do you pronounce it ?''
360361	`` How is'' `` Liu'''' pronounced in Chinese ?''
360362	Has anyone had a bad experience with a Disney cast member ?
360363	Are funds collected from US companies by a DE single-owner LLC , owned by a NRA , on quality control services performed outside USA taxable in the USA ?
