test-412480	What are some 'cool' campus/hostel facilities in NITs?
test-412481	I am staying in Haryana and I am going for coaching for IIT to Kota . from which school I should do my 12 class?
test-412482	What's the difference between a guy saying sweetheart/honey and things like babe/baby?
test-412483	If a woman starts calling you babe or sweetheart what does that really mean?
test-412484	How can I shorten a link with UTM tags?
test-412485	Is there a website or script in which I can drop a link with UTM codes in it to easily transpose them?
test-412486	Disadvantages of moral value?
test-412487	Can we use others fb, pages to like and share their contents images can we do at free will?
test-412488	"What is ""DailyStrength"" website?"
test-412489	What is this website?
test-412490	Can I create a clan in critical ops? If yes then how?
test-412491	How does Clash of Clans make money?
test-412492	What is the difference between a Psychiatrist and a Psychologist?
test-412493	What's the difference between psychiatrist and psychologist?
test-412494	How can I earn 10$ a day online?
test-412495	How can I make every day $10 online?
test-412496	Which is your favourite sports car and why?
test-412497	What's your favourite sports car?
test-412498	How long does standard shipping with USPS take to send a package from New York to London?
test-412499	How long does it take for USPS first class from New York City to Hong kong?
test-412500	What's the difference between a TF card and a Micro SD card?
test-412501	What is the different between a class 10 micro SD card and class 4?
test-412502	"What's the difference between ""How do you think"" and ""What do you think""?"
test-412503	What's the difference between s & 's at the end of a word?
test-412504	What is the minimum cost to hire a wedding planner in India?
test-412505	Is hiring a wedding planner an expensive decision?
test-412506	How do you get guys to ask you out?
test-412507	How do you get men to ask you out?
test-412508	Are you actually forbidden to leave the emirate of Dubai if you are in debt?
test-412509	Is it true that indebted people leave their cars at Dubai airports?
test-412510	What are the examples of non-Internet eCommerce?
test-412511	What are some examples of B2B ecommerce?
test-412512	What will Quora look like in 5 years?
test-412513	Users, where do you see Quora in 5 years from now?
test-412514	"Why is ""Dick"" a nickname for ""Richard""?"
test-412515	What were Frank Sinatra's nicknames?
test-412516	Why answers on Quora are too lengthy and not straight forward?
test-412517	Why are most Quora answers so long?
test-412518	What does relevant experience mean?
test-412519	What are things to keep in mind when you interview for a role in which you do not have relevant experience?
test-412520	When should one start preparing for the ISI MStat entrance exam?
test-412521	How do I prepare for the B.Stat/B.Math exam of ISI?
test-412522	What is it like to work at inshorts?
test-412523	What is it like to be an employee at inshorts?
test-412524	What does it feel like for a woman to have a penis inside her compared to having fingers inside her?
test-412525	I broke up with my girl. I am not able to forget her. It's killing me inside. What can I do?
test-412526	How likely is it to have caffeine in chocolate bars that advertise a coffee flavour?
test-412527	A de caffeine coffee brand in India?
test-412528	How do I convert adsl modem router to normal router?
test-412529	How can I convert my normal modem to wifi modem?
test-412530	In Reddit, what are the interesting words do you say instead of curse words?
test-412531	Which scheme should I take in science? Computer or informatics practices or economics
test-412532	African Americans have always been controlled, though slavery, Jim Crow and now mass incarceration. Why is the US then called the land of the free?
test-412533	In America why is it that slavery and Jim Crow laws are often justified in the name of Christ?
test-412534	What is the biggest Economic problem faced by India currently? Justify.
test-412535	According to you, what is the biggest Economic problem faced by India currently?
test-412536	If someone is not able to make decision what should he do?
test-412537	I am not able to make any decisions for myself, what can I do about this?
test-412538	How DOES life in REALITY WORKS?
test-412539	Could the British housing crisis be solved by building more flats rather than houses?
test-412540	What do boys think about girls who approach first?
test-412541	Guys: What is your opinion on girls who approach you first?
test-412542	What are some interventions for ineffective breathing patterns?
test-412543	What are nursing interventions for ineffective breathing patterns?
test-412544	Which is the best sector to invest after demonetization in India?
test-412545	Which sector is best for investment in india at present?
test-412546	Who are the top 14 contestants of Indian idol?
test-412547	How can I watch the Indian Idol Junior 2015 show live?
test-412548	What is the easiest, painless way to die instantly?
test-412549	What are the easily available ingredients for a recipe to die painlessly?
test-412550	What can I do to earn some money by online work while continuing my college?
test-412551	What can be done to earn money while studying?
test-412552	Does the sun whiten your teeth? I noticed after 1 week at the seaside that my teeth are much whiter. Or is it just an illusion?
test-412553	Are teeth whitening pens bad for you?
test-412554	Why doesn't Skype exit when we close the window and instead gets minimized? Is there any specific reason?
test-412555	Why doesn't Skype exit when we close the window and instead gets minimized? Is there any specific reason or skype application have any bug in code?
test-412556	What is the use of a roku?
test-412557	What is Roku?
test-412558	What are best places to travel near India?
test-412559	What is the best place in India to visit?
test-412560	What countries have very similar looking flags?
test-412561	Why is the flag of Italy looks like the flag of Mexico?
test-412562	USA Contact <<1%8%77%77%8%89%69>>Kaspersky Antivirus Tech support Phone Number?
test-412563	What is safe score in cet for mbbs in gvt clg in Mumbai
test-412564	How do I forget someone whom l love so much?
test-412565	How do I forget someone whom I truly loved?
test-412566	How do you know when a reader is reading good?
test-412567	Who do you know that is a good reader?
test-412568	Why do people use Quora to ask simple, dumb questions instead of just Googling it?
test-412569	Why do people ask stupid questions on Quora that could be easily answered by Google?
test-412570	Are women more likely to stay with a man who has a large penis?
test-412571	What's it like for a man to have a three-some with two women?
test-412572	Why does the indian/state government allow prominent red light areas like sonagachi in kolkatta to function in broad daylight? Why don't the authorities try and rehabilitate these women and attempt to bring them back into mainstream society?
test-412573	What has Indian government done to bring Vijay Mallya back to India?
test-412574	Why aren't American stores selling Muller yogurt anymore?
test-412575	I like somebody from work. And don't know what to do to show him am interested in him?
test-412576	How can I speak fluent English without stopping or thinking?
test-412577	How do I speak English fluently and clearly?
test-412578	What are some good books on problem-solving approaches?
test-412579	What are the best books on problem-solving in Java?
test-412580	In India, is it harder to get into a medical school or into IIT?
test-412581	How can I get into the Harvard Medical School for research purposes after completing my MBBS from India?
test-412582	How necessary is an all star voice cast for an animated film?
test-412583	What is the common rooms temperature and how many different ways could you measure it?
test-412584	What is notebook?
test-412585	What is the notebook 2?
test-412586	Toxicology: In polluted air does breathing through cloth, help? - If so how much?
test-412587	How do I avoid air pollution?
test-412588	What are the best and cheap earphones?
test-412589	What are the best brands for earphones?
test-412590	How do Iranian men treat women in relationships?
test-412591	Are Germans and Iranians related?
test-412592	What are some things new employees should know going into their first day at Lancaster Colony?
test-412593	What are some things new employees should know going into their first day at Colony Financial?
test-412594	"What does it mean when a Korean calls you a ""racial slur""?"
test-412595	What are the things you must know before hiring of packers and movers company?
test-412596	Why do I think about sex with my ex girlfriend?
test-412597	Why do boys always think about having sex with their girlfriend?
test-412598	What is the least painless way to kill yourself?
test-412599	How can I kill myself in the most painless way?
test-412600	What is the most complex or sophisticated thing created by a non-human species?
test-412601	What are the most complex things that humans have created?
test-412602	What is searching engine marketing?
test-412603	What is search engine marketing?
test-412604	Is React killing Angular?
test-412605	On what basis would you decide to use either react or angular?
test-412606	Why is Facebook addictive?
test-412607	Why is Facebook so addictive?
test-412608	How do I know if someone is watching me through the camera of my iPhone?
test-412609	How do I know if someone wanna get rid of me?
test-412610	Which are the top ten architectural firms of India? And why?
test-412611	What are the top ten colleges for a BTech in India?
test-412612	Who wants to live forever?
test-412613	Do you really want to live forever?
test-412614	Ias succes story?
test-412615	I have 9yrs of Gas turbine manufacturing exp as production engineer.What r my chances of provincial nomination for PR in Canada?
test-412616	What's the most romantic thing your lover had ever told you?
test-412617	What was the most romantic thing your girlfriend/boyfriend has ever told you?
test-412618	What are the top ten must-see places in Europe?
test-412619	What are the top 10 must visit places in Europe?
test-412620	How does Pearltrees get users?
test-412621	How many users does Pearltree have?
test-412622	How do I remove an emoji from saved photos?
test-412623	How can free tertiary (university) education for a developing country like South Africa be funded?
test-412624	Who can I get more traffic for a new website?
test-412625	How can I bring in more traffic to my new tech website?
test-412626	What's the difference between left and right wing politics?
test-412627	What is the difference between the left-wing's and right wing's ideology?
test-412628	What are some best options for online work in which I can earn a some money?
test-412629	What are best ways to earn money online?
test-412630	How fast is 128 kbps internet speed?
test-412631	Is 35 Mbps a fast internet speed?
test-412632	What are adjectives?
test-412633	What is an adjective for music?
test-412634	What do I do if I am 20 years old and cannot concentrate on my studies?
test-412635	What are ways by which I can concentrate more on my studies?
test-412636	What concepts or words of the Indonesian language would be good to incorporate into the English language as English seems to be becoming the world's lingua franca?
test-412637	How good is Google Translate in translating English sentences into Indonesian language?
test-412638	Is there a way to somehow influence or even control what you dream about?
test-412639	I had a really good dream about a specific situation. Is there actually a way to make myself dream about something similar again?
test-412640	What is it like to be a member of Trinity College Cambridge?
test-412641	What is it like to be a member of King's College Cambridge?
test-412642	Why do you create a blog?
test-412643	What is blogging and how can I start my own blog?
test-412644	Using regular expressions in Python, how can I match everything except a group?
test-412645	Why are we using regular expression in Python?
test-412646	Are all features on Leo Privacy free?
test-412647	What does LEO Privacy Guard app and features do?
test-412648	What is the difference between social science and natural science?
test-412649	Which of the following is a better syllabus: ICSE or CBSE?
test-412650	What are some alternatives to the Aryan invasion theory of Indian history?
test-412651	The Aryan Invasion Theory: What are the arguments given by its supporters and opponents?
test-412652	How do you track a lost iPhone?
test-412653	Can I still track my iPhone even if the SIM card is taken out?
test-412654	Can I use Machine Learning algorithm to rank search result when using ElasticSearch?
test-412655	What is the intuition for SVM-Rank and when should I use it?
test-412656	What is the best android emulator?
test-412657	Which is the best android emulator?
test-412658	What's the best methods to get into consulting? (Management consulting)?
test-412659	What are the top management consulting companies?
test-412660	What are the top 10 life lessons?
test-412661	What are 10 life lessons that you have learned in your life?
test-412662	What is the best way to practice public speaking?
test-412663	What are the tips for public speaking?
test-412664	How do I Score Weed in Colombo?
test-412665	Where can I get good quality weed in Surat?
test-412666	What are some unusual aspects about politics and government in Japan?
test-412667	What are some unusual aspects about politics and government in Finland?
test-412668	What is the physical significance of the moment of inertia?
test-412669	What is the cone moment of inertia?
test-412670	What are the best reasons to attend the University of Wisconsin - Milwaukee?
test-412671	What are the best reasons to attend the University of Wisconsin?
test-412672	How well might the USSR have defended against the launch of Operation Barbarossa if Stalin had allowed an immediate defense?
test-412673	What are the attributes of scientist by the name Sir Paul Adrien Maurice Dirac?
test-412674	What are some things new employees should know going into their first day at Verint Systems?
test-412675	What are some things new employees should know going into their first day at Adobe Systems?
test-412676	What is Allen Iverson's criminal record?
test-412677	Is Allen Iverson a top 10 all-time NBA player?
test-412678	What is the average monthly cost disribution for an IT employee in Bangalore?
test-412679	How much would it cost for a decent living in Bangalore for a family of 2 considering a monthly income of Rs. 50k?
test-412680	Organization Design: What are the key differences between a director, VP, SVP and the head of?
test-412681	How much does a VP at a top tech company make?
test-412682	How does alliance global in motion work?
test-412683	How many people work in the SaaS industry globally?
test-412684	How do I see who is viewing my shared documents?
test-412685	How do you convert an XLSX document to a Google Doc?
test-412686	I am shifting to Mumbai to pursue higher education. What all things should I pack?
test-412687	I am pursuing BBA. What are the other things or courses can I do along with?
test-412688	Why do I always have a feeling that I am missing out?
test-412689	Why do I always feel like I am missing something?
test-412690	Why is Quora worried about the length of question details?
test-412691	Why does Quora have a character limit in Question Details?
test-412692	How do I become an astronaut for NASA or SpaceX? (I'm from the UK)
test-412693	How do I become a part from Nasa?
test-412694	When did the US military start charging soldiers / sailors/ airmen for their meals?
test-412695	How can I join the US military quickly?
test-412696	What effect masturbation do on the health?
test-412697	Is masturbation safe for health?
test-412698	How did the crescent moon become the symbol of Islam?
test-412699	Should Agha Khan become the public face of Islam in the west?
test-412700	What is the best options of job opportunity for a computer science engineer?
test-412701	What is the best job for a computer science engineer?
test-412702	What is the difference between Masters of Science and Engineering?
test-412703	What is the difference between Masters of engineering: mechanical engineering or masters of science: mechanical engineering?
test-412704	What is Quora's business model?
test-412705	What is Quora business model?
test-412706	What are some highly underrated answers on Quora which you like most?
test-412707	Which are the most underrated answers on Quora?
test-412708	Are there any other website similar to Quora?
test-412709	Is there any website as good as Quora?
test-412710	"Why is ""Japan's Marine Day"" unknown in Brunei?"
test-412711	"Why is ""Japan's Marine Day"" unknown in Haiti?"
test-412712	What is the difference between a rooted and unrooted android?
test-412713	How do I root an Android phone without using a PC?
test-412714	"What are some sentence examples using ""vertex""?"
test-412715	How are fruits different from vegetables?
test-412716	What is shear force diagram?
test-412717	How can I draw a shear force diagram?
test-412718	My rank in Comedk 2016 is 9205. Will I get civil in Msrit or NIE or BMS or any other top college?
test-412719	I have scored 120/160 in COMEDK UGET 2016 and my rank is 2456. Will I get ECE in BMS or MSRIT?
test-412720	Which is good for cse, jiit noida, dit dehradun or amity noida?
test-412721	Which is better for Btech in CSE DIT Dehradun or Amity Noida?
test-412722	What can an employee do if he fails a drug test (420) for the first time after his manager told his employees it would result in counseling?
test-412723	I attended F1 Visa 3 times now going for 4th time by adding my paternal uncle name DS-160 what chance of getting visa?
test-412724	How is the word 'espouse' used in a sentence?
test-412725	"How is the word ""an"" used in a sentence?"
test-412726	Why do high pressure areas have good weather?
test-412727	Why do high pressure ares have good weather?
test-412728	How can I spy someone's Viber?
test-412729	How do I hack/spy on someone's viber chat?
test-412730	What is Localized Surface Plasmon?
test-412731	What is localized surface plasmon resonance?
test-412732	Do young Indians hate Pakistan?
test-412733	Do Indians hate Russell Peters?
test-412734	How to prepare for OCPJP Certification Exam?
test-412735	What is the CERT certification for lab and organization? Are there any good resources to prepare for it? What are the requirements to take the exam?
test-412736	Who is responsible for Muslims praying five times a day?
test-412737	Why do Muslims pray five times a day?
test-412738	How do I explain Islam to non-Muslims?
test-412739	What do know ?
test-412740	Is Google Drive safe enough to keep my credit card and bank details in there? If not, where can I keep all this information safely in the cloud?
test-412741	Is it safe to add a credit card to a PayPal account?
test-412742	If I want to learn how to program where do I start?
test-412743	Which is the best programming language to learn for hacking? What are some books for beginners?
test-412744	What is red room in deep web?
test-412745	Why is the deep web so large?
test-412746	What is a SaaS alternative to Wrike that includes billing and invoicing functionality?
test-412747	Project Management Software: Are there any free or cheaper alternatives to Wrike?
test-412748	Can I get into investment banking just after BBA (hons.) By persuing SIB Mumbai short term course.If yes then what average salary I can expect after?
test-412749	What is quantifying and prioritizing loss potential?
test-412750	If a girl acts like a man, she is called a tomboy. What if a boy acts like a girl?
test-412751	What do I do when a girl acts very rudely?
test-412752	What are the list of NCERTs that I need to study from class 6 to 12 for Civil Services?
test-412753	Where do I get the old NCERT from class 6 to 12?
test-412754	I have an iPad Air with cellular, will Reliance Jio Sim work on it?
test-412755	Does the call forwarding feature work in the Reliance Jio SIM?
test-412756	"Can I slap ""Forever"" stamps on a letter to Canada?"
test-412757	Why is it so difficult to get a stamp on an indigent letter?
test-412758	How is Reva University in Banglore for B.Tech?
test-412759	How is the B.tech in CSE in Bundelkhand university?
test-412760	What are some examples of kosher bread brands?
test-412761	I have a OP2 and a Jio sim. Jio has an app that supports VoLTE but requires permission to record my calls! Any alternatives that upholds my privacy?
test-412762	Can an employee be blacklisted in NSR?
test-412763	What is NASSCOM? Can any IT company blacklist any employee via NASSCOM?
test-412764	I'm interested in dating. However whenever a guy shows interest I panic and run in the opposite direction. I did come out of a LTR. Is this normal?
test-412765	I'm going out with a friend of mine. There's ambiguity about whether or not it's a date. How can I subtly show that I'm interested romantically?
test-412766	Which are the best universities in India for a PhD in Quantitative Economics?
test-412767	What are the best universities in India for PhD in tourism?
test-412768	Why do commercial contracts need legal binding?
test-412769	What are the essential elements that form a legally binding contract?
test-412770	How I can earn money using freelancer?
test-412771	How can I earn money by freelancing?
test-412772	Who is your favorite youtuber and why?
test-412773	Who is your favorite youtuber, and why?
test-412774	What are the best cinemas for couples in Mumbai?
test-412775	Where is the movie theatre for couples in mumbai?
test-412776	Should I buy the AMD A10 quad core or the Intel i5 laptop?
test-412777	What is the difference between AMD and Intel CPU is AMD A8 equivalent to Intel core i5 in speed and power consumption?
test-412778	What is the best social media platform to gain an audience?
test-412779	What is the best social media channel for marketers?
test-412780	Is it weird for a man to try his own semen?
test-412781	Hypothetical Scenarios: If a man were to eat his own stomach, would he be full?
test-412782	Why should article 370 be abolished?
test-412783	What would be the possible consequences if the Article 370 is removed from Jammu and Kashmir?
test-412784	Why is there so much struggle in life?
test-412785	What would you do with a life full of pain and struggle?
test-412786	How do Wikipedia, and Jimmy Wales, make money?
test-412787	How does Jimmy Wales make money?
test-412788	How can I speak English more fluently and effectively?
test-412789	How could an English learner speak fluently?
test-412790	As a medical doctor in the USA, what is your annual salary?
test-412791	How long does one have to study to become a doctor in the US?
test-412792	What is the importance of yoga in our daily life?
test-412793	What things we do in our daily life are underrated?
test-412794	What is the value of [math]\lim_{ x \to 0^{+}} \frac{\sin [x] }{ [x]} [/math]?
test-412795	What is the value of [math] \displaystyle \lim_{x \to 0} \frac{\sin^2 (x)}{\sqrt{1+x \sin x} - \cos x} [/math]?
test-412796	If there is a fight between Lion and Tiger, which animal would win?
test-412797	In a fight between a lion and a tiger, who would win?
test-412798	Why did Adolf Hitler hate Jews?
test-412799	Why did Hitler kill so many jews?
test-412800	Why do Americans have to love their country?
test-412801	Why do Americans love their country so much?
test-412802	Why do Muslims use Allah?
test-412803	Why do Muslims use the word 'Allah' instead of 'God' when speaking English?
test-412804	What is morally impermissible?
test-412805	What is morality?
test-412806	What is the origin of the University of Miami logo (The U)?
test-412807	How good is the University of Miami?
test-412808	How does the Fed technically raise interest rates?
test-412809	Why is it risky for the Fed to raise interest rates now?
test-412810	What will be the positive and negative effects of demonization of ₹500/1000 notes on Indian economy?
test-412811	Why did the Indian government demonetize the current 500 and 1000 rupee notes and replace them with new notes?
test-412812	Which is the best book on US history?
test-412813	What are the best books on Chinese history?
test-412814	What are some samples of the IELTS essay band 9?
test-412815	How can get a score of 7 in the IELTS?
test-412816	Is casting couch also prevalent in Indian Politics?
test-412817	Does the casting couch exist in the Bollywood industry?
test-412818	What is the diference between rationalism, realism and idealism?
test-412819	What is philosophical realism?
test-412820	Where can I get second hand books in Hyderabad?
test-412821	Where can I get diary of a wimpy kid second hand books in hyderabad?
test-412822	Mahaveer swami of ipu?
test-412823	What are some tips and motivation for Board Exams?
test-412824	Do I get a notification if my answer or comment is downvoted?
test-412825	Do we get a notification when our answers are downvoted?
test-412826	How can I make money through YouTube?
test-412827	How do I make money by uploading videos on youtube?
test-412828	How do I fix this Java error?
test-412829	"How do I fix this ""else without if"" error in JAVA?"
test-412830	Which bank in India pays the highest salary to its managers?
test-412831	Which government sector gives the highest salary package in India?
test-412832	What is it like to spend one's entire time in college without any close friends?
test-412833	What is like to spend one's entire time in college without any close friends?
test-412834	What are the differences between Al-Qaeda and the Taliban?
test-412835	Is the Al-Nusra front Al Qaeda?
test-412836	Where can I open a bank account for my online casino?
test-412837	Can I open virtual office in USA and bank account?
test-412838	Is GDP a good measure for the standard of living?
