164519	Are there infinities bigger than other infinities?
265470	Is South Africa a major location where sexual tourists commit crimes against children who have been forced into sexual slavery?
395690	Which coaching class is good for MPSC preparation in Mumbai?
151223	Can a narcissistic person be suicidal?
151224	What is a narcissistic person?
410548	"What should you do when you are being followed by a store employees who may be suspecting that you are a shoplifter or ""suspicious character"" because of your race or garb?"
410549	Is it racist to be extra nice to a stranger because they are probably of the same race as you?
142568	How do you incorporate a company in Singapore?
142569	How do I incorporate a company in Singapore?
451956	How do I find an option to connect to WiFi in Windows 8.1 pro?
508633	Can a person make separate identities?
508634	What do Millennials want in a new home?
213876	How many books per day does a one second hand book seller in Delhi sell (both in peak months and non-peak months)?
213877	Where can I buy second hand books online in Delhi?
81104	What is polymorphism in Java? Is there any other functionality besides method overloading and method overriding?
81105	What is polymorphism in Java?
54167	What is your viewpoint about Narendra Modi, the performance and vision of his government in the last one year and in the coming years respectively?
112965	What are the benefits of Apple getting rid of the headphone jack?
112966	Why is Apple getting rid of headphone jacks and other inputs? How is this a good idea?
440614	How did you become a successful writer?
94216	So is Julian Assange ''imprisoned'' in that embassy for the rest of his life?
94217	Will Julian Assange spend the rest of his life in the Ecuador embassy in the UK?
394683	What games are similar to Bloodborne?
394684	What are some games that are similar to PetVille?
149651	What can India and Indians do to attract more international tourists?
149652	What can India do to attract more international tourists?
459298	How can the asexual reproduction of starfish be described?
459299	How can the asexual reproduction in starfish be explained?
529155	What is the difference between the feeling of anal and vaginal penetration?
16511	How can, a high school student with a very high GPA from a very poor country in Europe, get an all inclusive scholarship in a good university?
16512	What is it like to be a poor student at a very rich university or high school?
106910	Does resetting Windows 10 help in giving better performance?
462464	Does the Secret Service vet and protect the President for ALL dangers?
124817	Why do I start sneezing every morning?
520559	Can you use salt beef brine twice?
520560	When should I add salt and pepper when I cook a beef steak?
347583	Why cant i tag people on instagram pictures on specifically my device?
470207	Are hens/cows more oppressed than roosters/bulls when viewed using the lens of intersectional feminism?
192713	I want to use affirmations but really find it really odd to talk to myself or in front of the mirror. How do I start talking to myself positively?
296589	Do women ejaculate?
296590	Do most women ejaculate?
48158	How can I sell my products on Flipkart?
48159	How do I sell products on Flipkart?
75375	How do I add videos in PowerPoint without using hyperlinks?
75376	How do you add a video to a PowerPoint presentation?
485831	What are the pros and cons of setting up a Freezone Company in the  Emirates of RAK, Fujairah, Sharjah vs. one in Dubai?
485832	Advise Only (company): What are the Pros and Cons of setting up a business in Sharjah?
441889	Why is zinc colourless in solution?
441890	How can zinc sulphate salt be prepared?
313912	"Does the contraction ""how're"" exist?"
313913	"Should we use ""it's"" or ""they're"" in this sentence and why?"
425103	What happens when ammonium chloride and calcium hydroxide react?
126745	How do I get rid of the worst past failure or guilt?
358001	What are deployment options for web based application in own web server?
358002	What is web based application?
301160	How do I run 4g sim on 3g phone?
301161	How can I yearn for success?
101803	What does 呵呵 mean?
54859	Does Hitler have any known living relatives?
369999	Can your phone get a virus from porn?
241111	How does a black hole have so much gravity?
32711	"How do you ""watch"" a movie?"
263928	What was your first memory?
263929	What is your very first memory?
200084	Why is it important to keep a good profile picture?
15433	"How is it possible to disable FaceTime's ""End Call"" button?"
288610	What are the prices for things at the Mu Shop?
288611	How can I join Mu Sigma?
406464	What are good hip hop songs with a powerful female vocal as the chorus? 
406465	What are some hip hop / rap songs about California or places in California?
127937	Does memorizing music lyrics improve your memory?
127938	What are the best methods for memorizing lyrics?
115488	Why do people include half laughs in the middle of words or sentences? What is the effect?
115489	Why do people always laugh at me?
264380	Why don't Sikhs like Sant Gurmeet Ram Rahim Singh Insan?
264381	Why did Sikhs raise controversy on dress of Gurmit Ram Rahim Singh, when Shivaji also wore similar dress and other medieval kings also did?
36262	Cleaning: What are some ways to get rid of vinegar smell?
176662	Which is the best cover making app for wattpad?
176663	What is the best process to make an app?
168211	What are the career options after an MA in social work in women-centred practice from TISS?
168212	What are the best career option after B.A. (Hons.) in Social Work with specialization in Rural Development?
77817	My spectacles lens power is -4D. What are the departments for which I am eligible in ESE (Engineering Services Examination)?
264324	Is Donald Trump right that we're in an economic bubble?
264325	I want to close HDFC bank Saving account but don't know whether I have to pay for non maintance or not. what is the best option?
112785	How should I come out as trans?
112786	I've just come out Trans, what should I do?
481636	Which books should I follow to crack civil services examinatíon?
535736	What's the difference between nite and night?
535737	What's the difference between night and nite?
444266	How dangerous is a Black Lab/Pitbull mix?
95772	How can you use FaceTime internationally?
93992	What are the objectives of environmental awareness?
93993	What is environmental possiblism?
365077	Is it enough to swim 500 meters daily to stay fit?
317539	Surgery: What exactly is the problem that could occur when a surgeon's glove rips, like it did in the 5th episode of Grey's Anatomy?
317540	What are the biggest differences between being a surgeon in real life and being a surgeon in Grey's Anatomy?
68480	What are some of the best custom software development companies?
68481	What are some good custom software development companies?
100627	I have to take coaching to crack NTSE?
269122	Why don't India wages war against Pakistan?
232428	Are startups overvalued right now?
232429	What are the most overvalued startups?
364366	How many litres of blood does a dog have?
217348	What are the most awaited movies of 2016?
244138	What it is like to work at NASA?
244139	How does it feel to work at NASA?
121195	How much computer science does an 8 year old US kid typically know or is taught in school curricula?  
121196	How much computer science does an 8 year old US kid typically know or is taught in school curricula?
425918	Are the diseases lymphopenia and granulocytosis related?
217663	How do speakers produce sound waves?
217664	Can glass be shattered by sound waves?
446817	Do you eat soup before salad or salad before soup?
90745	How do I fix a heating issue on an Asus Zenfone 5?
201512	Who was the best sensei amongst Kakashi, Tsunade, Asuma, Kurenai, and Guy?
201513	Who is Neko-sensei?
269930	Which statement is grammatically correct, 'I'd like to kindly ask you whether there are any this month' or 'I'd like to kindly ask you whether there will be any this month'?
269931	“The lawyer asked if it was worth to take the matter to court.” Is this sentence correct grammatically?
424451	Since there is no wind or atmosphere on the Moon, how can the US flag be flapping in pictures of the first Moon landing?
424452	Are the rumours about NASA faking to have landed on moon true?
85880	What marks should one get to receive a rank of 200 in the AIIMS MBBS exam?
85881	How many marks are needed to get around a 500 rank in the AIIMS exam?
266181	What causes infertility?
266182	What are the main causes of infertility?
426062	What's the best 'cameltoe porn' videos site?
432312	What is the best way to make a living online?
432313	How can we make a living online?
164963	What are the best philosophy podcasts?
164964	What are some good Philosophy podcasts?
326408	Can an intelligent officer take a bribe?
326409	How do I confront a police officer who is asking me for bribe?
464214	What was Alan Watts' personal life like?
464215	How did Alan Watts die?
331210	How can I improve my English skill as fast as possible?
438870	What have your worst experiences been in SD?
438871	What have been your worst experiences in SD?
488503	How do I learn Python from scratch without learning C?
27113	Are Uber drivers allowed to have a camera recording passengers?
27114	Ride-Sharing in 2015: Does Uber/Lyft pick up from SFO?
433254	Why is legal language so arcane and convoluted?
433255	Why is PredictIt legal?
157546	What are cathode rays? How are they produced?
492166	Are people allowed to go to the very top of the Burj Khalifa building in Dubai?
492167	How is the Kingdom Tower going to affect the Burj Khalifa?
491964	Are there any good free site to learn meditation?
491965	Where can I learn to meditate?
408386	What skills are the most valuable on selling?
307598	My Chorkie won't stop scratching, licking and hair falling out?
307599	Should I move my budgie nest to lower ground so the babies won't fall out?
196393	What score is needed to get a rank around 15k in JEE mains?
409507	Why do men sniff women's dirty panties?
409508	Why do men like to wear women's panties?
452004	Can I get rid of mice by turning off the heat?
452005	How can I get rid of the mice in my basement?
226853	What is a moral of bhagvad Geeta?
489334	Redmi note 3 vs Redmi 3?
436612	Why is MOSFET Voltage and BJT Current controlled?
240510	What are some useful programs for a TI-84?
311823	Which are the best institutes in Mumbai for GMAT coaching?
91028	Is it a common belief that Democrats rely less on lobbyists than Republicans?
91029	When a poster upload a long post in 9gag, why they always put a potato at the bottom of their posts? What does it mean?
82176	What does it feel like to get shot in the head?
82177	What it feels like to be shot in head?
45358	If you ever met your younger self what would your suggestions be to your younger self?
173580	Do you agree that there are too many gun owners on Quora and they are holding the site hostage?
173581	Do you feel there are too many trolls on Quora?
217900	Is there any good institute for differently abled child near Noida areas?
217901	How dose enter into international share markets?
27860	How do you know that you are deeply in love with someone or just like her/him and he/she likes you back?
27861	My best friend just got into a relationship with a girl. But he says he only likes her and doesn't love her. I'm sure I love him. What should I do to get him back?
9563	Does SAP certification matter a lot to fetch the first job ?
9564	How should I increase my chances of getting a SAP profile job (without having to get a certification as it is pretty expensive)?
106856	"Who said ""man is a political animal''?"
106857	"Who said, ""man is the talking animal""?"
220785	Why is the oldest oceanic lithosphere less than about 200 MA?
220786	Why have oceans been explored less thoroughly than space?
429394	Who was Nelson Mandela? What were some of his greatest accomplishments?
429395	What were Nelson Mandela's greatest accomplishments?
84091	How can we build motion capture suits using multiple MEMS sensors?
84092	We all have some kinds of fears? Like mine, I have the biggest fear of not getting admission in MBBS, how can we get rid of it?
215032	What are the earbuds with best mic?
337137	Why do people invest in brands and not in people?
182422	What individuals and events in history are a source of pride for Chile?
454384	How do you deal with the fact that most people are irrational and can't even follow a logical argument?
454385	What do you do when you can't win an argument using logic?
72098	Who will get to Mars first?
476036	If you saw a group of Hindus knocking your door and asking donations for the celebration of their festival, what would you do?
476037	If someone knocks on your door at 1:00 AM, who would you think the person is? Why?
431100	Why is It's Always Sunny in Philadelphia moving from FX to FXX for its upcoming season?
104832	Why is the woman hurdles 100m and not 110m?
104833	Why is the woman's hurdles 100m yet the men's is 110m?
221206	How do I meet and chat with gays online?
221207	What is a good way to meet guys offline and online for gay men?
315199	How common are the live-in relationships in Pune?
315200	How difficult is it for a live-in relationship couple to find a rented flat in pune?
62150	What does office of profit means?
62151	What is office of profit?
46043	What is the best website to help with a statistic online class course?
210725	When changing the social norms, are there any dangers that the society could go into the opposite extreme of that norm? Any examples?
515218	How do I make the most of my film school experience in order to avoid becoming an assistant?
515219	What is the most difficult job in film making?
243360	Can narcissism be healed?
243361	Can narcissism be healed? And if so, what methods are available?
394903	Do girls talk about their boyfriend to their girlfriends?
267678	How do I update GTA 5 on PS4 to play online?
264421	How is it like being a student at Harvard?
59346	How do I control a DC motor with an encoder using Arduino?
59347	How can I control the speed of 4v dc motor?
345163	When you are speaking English as your second language, do you think in your first language and then speak in the second one or otherwise?
187695	What is best Clash of Clans Town Hall 8 base?
317511	What changes we are going to see in your government policies towards india?
317512	Is it legal to convert a YouTube to MP3?
323434	How does the HP OfficeJet 4620 Airprint compare to the HP Color LaserJet Enterprise CP4025dn Printer?
388821	How many times do women orgasm during sex?
388822	How many times can women reach orgasm in a hour and what does it feel like?
186407	Which are the best horror movies in hollywood?
84183	Is it possible to fall out of love?
84184	How could you ever fall out of love with someone you once loved truly? How and why is it possible?
239360	What is an example of demand pull inflation?
239361	What are some examples of demand pull inflation?
115655	What is the ultimate goal of science (as of today)?
53402	What's your strongest point?
53403	What is the strongest base in the world?
381535	Could India's surgical strike in POK be an elaborate hoax or play?
295802	Why does my arm keep falling asleep?
226090	Why is New Zealand embassy in India so ruthlessly rejecting student visas even though many are genuine ones with valid offer letters?
226091	Is an Ayurvedic life style logical or scientifically based?
296115	How did Uber protect its idea?
415909	How long can a person live without food and water?
134114	Is Scion of Ishvanku a prequel to Immortals of Meluha?
134115	If I have a patent (as an inventor) on a medical device, does it give me brownie points in a Match (USMLE)?
217963	What are some ways to be a more mindful person in everyday life?
217964	What are your personal tips on becoming more mindful in everyday life?
251560	When will the shoe Adidas stellar X 16 come out?
123553	Why is CaSO4 (calcium sulphate) not soluble in hot water but soluble in cold water?
282850	Does damping effect velocity?
465155	What kind of insect is this?
465156	What kind of insect is on this photo?
188864	How can bees be protected as endangered species?
264034	How safe is to travel through Cebu Pacific Airlines?
264035	Why is the RSS anti-Gandhi?
201693	What's the idea behind Maserati's logo?
488098	"Where can I find some good research papers (or links to some work) done on complexity analysis of the popular game ""Unblock Me""?"
488099	What is the worst case complexity ([math]O[/math]) to find the median of a set of numbers coming sequentially. Is it possible to do it in less than [math]O(n\log_2 n)[/math]?
60842	How does it feel to meet Narendra Modi?
463468	Why is a sensitive man often seen as gay? Why are gay men often seen as sensitive people?
389760	What is the difference between yoga and tantra?
211003	Is robot a machine or mechanisms?
211004	Is robot a machine or a mechanism?
309318	What is best syllabus to teach spoken English?
309319	How do I start a business teaching spoken English or Polish over Skype?
251568	What powers the Voyager 1 satellite to push it 18,000,000,000 Km from the sun?
251569	What will happen when the Voyager 1s power source runs out in 2025?
421197	What does science say about space travel?
472782	What should I do to become gay?
205073	What is 4NF and 5NF in DBMS?
156960	I already bought from authorized dealers for my retail store. Can I sell on line?
228001	What are the good and bad deeds of Jayalitha in her tenure?
228002	What politician has done good deeds for India?
172946	Is eating fruits at night unhealthy?
172947	Is there any harm eating fruits at night?
306200	Where can I torrent all of the Dragon Ball Z series?
449299	What if btech complete in 5 years can stiil get in gre?
449300	How did bran the builder build the wall?
229957	What is the fastest way to reduce the redness in a sunburn and to even out weird sunburn lines?
229958	Is it bad to peal sunburns?
87190	Should big corporations pay taxes?
87191	How much taxes do big corporations pay?
6415	What is the most beautiful Linux distro?
69694	What and how does one prepare notes from the editorials of The Hindu for the CSE?
232236	What are some tips for managing my schedule better and studying?
364192	What English-English dictionary does Google use?
490495	What was Melania Trump's modeling career like?
350125	How can one hack a Facebook conversation on Android?
240753	Why do some mothers not want their sons to get married?
315006	Should I cancel my no-annual-fee credit card?
315007	Are credit cards with no annual fee good?
424747	When you have fiction ideas, should you put them on Quora and get people discussing them to arouse interest and to help you develop them through feedback, or should you develop them personally to avoid spreading the idea prematurely?
63590	Why did Steve Jobs recommend Tim Cook to replace him as CEO rather than Jonathan Ive or Scott Forstall?
63591	Would Steve Jobs have apologized over iOS 6 Maps as Tim Cook recently did?
118043	What are some proven, natural ways, to significantly raise your testosterone levels?
118044	What is the difference between raising your bodys testosterone naturally vs with synthetic testosterone
433439	What is the significance of the Harry Potter quote 'Turn to page 394'?
253612	Can I get a single room at 8.1 CGPA in VIT? If yes then which block should I prefer? (I am in first year)
253613	How good is N block in VIT Vellore? Can I get some pics of rooms in N Block?
16701	What are the side effects of antidepressants?
286405	Where is the smallest building in the world, where people live?
286406	Is there any craziest way to build a new world on the moon?
212531	How much profit can somebody make with youtube videos? For example KassemG has 500,000+ views a week per video plus Netflix and other sponsors.
515909	Which are the most successful Y Combinator companies?
333537	What is the process for the US President to replace a cabinet member?
340483	Does sleep deprivation cause brain damage?
340484	Can sleep apnea cause brain damage?
496875	What should I do if I have a spider on my head?
496876	What kind of spider is this with a brown body, black head, and black tipped legs?
223517	Which is the best institute for research and for a regular MBBS / MD / MS: AIIMS, PGIMER or JIPMER?
257709	How can I gain 30 kgs in 6 months?
257710	How do I gain 20 kgs in 6 months?
108554	What would happen to bones without calcium?
176956	What are bone cells made out of? And how do they fill up with calcium?
248573	Is House of Cards over?
486535	What does seal meat taste like?
70042	What are some psychological science fair project ideas?
70043	What are some ideas for a science fair project?
421798	How can I learn German in India?
530397	Is it ok to spend the night with my fiancé or does it go against God?
530398	What are the main differences between Vulnerability Assessment VA and Penetration Testing PT?
225799	Is astrology spiritual?
474428	What causes ear popping when chewing?
427852	How can we rationally convince a Hillary supporter that Hillary Clinton is not fit to become President? (How do you rationalize the irrational?)
328554	Should I listen to my parents or be myself?
328555	Should I listen to my parents?
431767	Which small business has created more millionaires than any other small business in the US?
286488	What are some useful ZeroNet websites?
286489	How do I make a website using website builder?
109973	What is the founding story of Ghirardelli Chocolate?
109974	What does chocolate taste like?
516439	How do I gently persuade my mom to lose weight?
516440	What can I do to persuade my mother to lose some weight?
170739	Did the universe have a beginning? And will it have an end?
170740	Does universe has a begining and an ending?
116162	What are some of the most underrated Indian movies?
245782	How would Cormac McCarthy write an essay?
245783	How do I convert a rsd number to binary number?
393353	What are the best woocommerce themes?
359471	What's it like to work at Cellular Biomedicine Group for your first job?
359472	Young people tend to watch nude pictures or ponorgraphic oftenly, how does this affect their mentality? Any psychological affection in it?
389856	Why does people who live in space age more slowly?
531888	Should you take more than one dose of probiotic a day if you are on antibiotics?
531889	Can you take more than 1 a day with nuvigil?
142635	Is the political system in the U.S. working?
104999	How did Jesus walk on water?
165878	What is the best smartphone setup for an elderly person?
165879	Which one is best smartphone for senior citizens in India, easy to use?
297689	One of my closest male friends needs to update his fashion style. How can I tell him this and offer some help without being offensive?
201668	What is prestige misty waters current rate?
201669	Why is current a rate quantity?
379706	Can we trust social trade biz?
379707	What are oppurtunities available to b.com graduate in Canada?
455727	Vichitra zawar: what u think about sex?
455728	Under Islamic System is it permissible to bargain while buying an animal for sacrifice during Eid Ul Adha?
368507	How do I write effective sales pitching emails?
368508	How can I write an effective sales pitch?
160076	Can a BE student be able to crack IAS exam?
342936	Do white people subconsciously support white supremacy?
342937	Do people eat white clay in Georgia?
72486	"Have you ever found someone you liked on Quora, followed them, then gone and read and ""Liked"" a huge amount of their posts, only to feel like a creep?"
72487	Why is Imo shows a contact or person which is not in my phone contact list?
413331	Is Stalin a hero?
413332	Was Stalin a hero?
151703	How can the Common Core be improved?
151704	What ways can we improve the Common Core standards?
214818	How do I open a portal to another dimension?
330258	How should I prepare for UPSC Prelims in 2 months of time?
330259	How can I prepare for UPSC prelims in 3 months of time?
214406	What is ArrayList?
34023	What data types do computer scientists use to find better values of irrational numbers like pi?
34024	What percentage of money that we (the average industrialized countries' citizen) spend on daily things (food, rent, everything else) goes to profits?
86829	What are some examples of digital product features that were removed after being launched? Either in the next version, or versions after that.
365230	When would I use tempera paint over acrylic?
143065	Are there hyenas in Nigeria?
143066	Who would win in a fight: American Wolf or African Hyena?
162595	What do women find attractive in men?
89725	Why did Karna not fire SUDDEN 2 Bramhashirastras on Both the armies from Base camp when he was not allowed by Bheeshma to fight in Mahabharat war?
495569	Do I have to use hair color after toner?
495570	How do you use hair toner?
237500	How often do police officers purposely alter the details of their confrontations while documenting the facts?
237501	Can I become a good police officer even if I try to avoid physical or verbal confrontation?
483973	Why is PB/WB/AIR in a same band for a multi-band radio?
483974	Is there any air band radio receiver that is small enough to be put in pocket?
314101	Where can I buy branded but defected/rejected clothes in Bangalore at cheap rates for boys?
213232	Is there any relation between Mukesh Ambani and present RBI Governor of India?
213233	Will Mukesh Ambani control the RBI?
10123	Is it safe to donate money to UNICEF monthly?
10124	Why do people accept to donate money out of pity?
400385	What are the part numbers of different logic gates?
497012	"Why is the symbol ""I"" used to denote current?"
415307	If someone has eye problems, either myopia or hypermetropia, and he uses a telescope without his goggles, would he be able to see things clearly or not?
450798	What dramatic changes will happen in the world if Donald Trump becomes president?
