test-318399	Which is the best place to learn iOS programming in Mumbai?
test-318400	What are the best clubs to start in highschool?
test-318401	What are some good clubs to start in high school?
test-318402	How much do bodybuilders spend on food per month?
test-318403	How much money do McDonalds' food lovers spend for it per month/per year?
test-318404	Gaphic design in ubisoft?
test-318405	Carding? And where can I find real carder
test-318406	Is it safe to boil eggs in the microwave?
test-318407	Can I make boiled eggs in the microwave?
test-318408	How can I improve my english?
test-318409	How can I improve my speaking skills in English?
test-318410	How many people use Google Now?
test-318411	How many people use Google?
test-318412	"Is there a wireless security system (i.e. Arlo, Nest, D-link) that has a ""record button"" not just record 24/7 or record by motion or sound stimulus?"
test-318413	Why wasn't Judas Iscariot expelled from the Apostles since he was known to embezzle from the money bag? (John 12:6)
test-318414	Can tooth decay be reversed?
test-318415	Can one reverse tooth decay or a cavity?
test-318416	What is the red dot on Tinder?
test-318417	Does Tinder use data?
test-318418	How do I start doing my final year project?
test-318419	How do I apply for doing 8th sem final year project in IISC?
test-318420	Can you smoke with newspaper paper?
test-318421	Where can I get smoking paper?
test-318422	Will North Korea ever invade South Korea?
test-318423	Will North Korea and South Korea ever become one Korea?
test-318424	Who were the Central Powers during World War I? What were their roles?
test-318425	What should the Central Powers have done to win World War I?
test-318426	What are the top 10 books one should read in his/her lifetime?
test-318427	What are five books to read before you die?
test-318428	Do leather shoes expand?
test-318429	How do I identify pig skin leather shoes?
test-318430	How can I catch my cheating boyfriend?
test-318431	How do I catch my cheating spouse?
test-318432	How is the placements in Amity University Mumbai for BCA?
test-318433	How is the Amity University Mumbai for a BTech in mechanical?
test-318434	What's the temperature needed to burn human bones to ash?
test-318435	At what temperature does the human body instantly incinerate?
test-318436	Will Taiwan ever renounce its ties with mainland China and become the Republic of Taiwan?
test-318437	Will the People's Republic of China ever end the Republic of China and annex Taiwan? When?
test-318438	Should people on Quora be banned for asking absolutely idiotic questions?
test-318439	Why has the quality of questions on Quora declined so much?
test-318440	"Fragrances: What is the difference between ""perfume"", ""eau de toilette"" and ""cologne""?"
test-318441	Perfumes: What is the nearest match to Pub Cologne by Revlon?
test-318442	What is the Bohr Rutherford diagram for magnesium?
test-318443	What is the Bohr Rutherford diagram for calcium?
test-318444	What is the best presentation topic to give for 5 minutes?
test-318445	I'm doing my MBBS. What is a good topic for giving a poster presentation?
test-318446	Can we develop an IOS app on windows?
test-318447	Why can't you develop iOS apps on windows?
test-318448	What is the total number of M.Tech seats in IITs and NIITs for instrumentation engineers?
test-318449	How is an M. Tech. degree in chemical engineering at IITs? What are the job prospects?
test-318450	How can I fall asleep faster?
test-318451	How do I fall asleep fast?
test-318452	Can it be proved that Barack Obama committed any impeachable offences?
test-318453	How did you get into the business that you are currently in? Is this what you studied for growing up?
test-318454	Why do people ask question on Quora that can be easily and definitively answered by Googling?
test-318455	Why do people ask questions on Quora when they can easily find the answer for it on Google?
test-318456	What is the best way to deal with heartbreak?
test-318457	How do I deal with heartbreak?
test-318458	Which is the best way to generate leads for a software development company?
test-318459	How do I get leads for my software development business?
test-318460	What are some 60's and 70's etiquette that have fallen out of trend?
test-318461	What was it like to grow in Liverpool if you were born in the 60's or early 70's?
test-318462	What should I do to increase my concentration in studies?
test-318463	Why do I feel sleepy when I start studying? What can I do?
test-318464	Would a sealed potato chip bag pop on an airplane?
test-318465	How are photos and videos of airliners flying in the sky taken?
test-318466	What is the best way or resources to learn english like a native speakers?
test-318467	How can I learn the English language quickly?
test-318468	How can l learn to live life alone as a student?
test-318469	How can I learn to live my life alone?
test-318470	Why is setting goals important in the workplace?
test-318471	Why is setting goals important?
test-318472	Would you start a relationship even though you know it's going to end?
test-318473	Is it good to let go of a person if you know they pull you back, even though you have a good relationship with them?
test-318474	Psychopaths, what tips would you give a nuro-typical on mental & emotional self discipline & control?
test-318475	"Are there truly ""bad"" films, or are there simply films that are not widely preferred?"
test-318476	What surprised you about your use of technology and the kinds of technology you use?
test-318477	What surprises you about your use of technology and the kinds of technology you use?
test-318478	Is time travel possible?
test-318479	If time travel is possible, where are all the time travelers from the future?
test-318480	"What does ""K"" mean in terms of money?"
test-318481	"What does ""M"" mean in terms of money?"
test-318482	What makes JP Morgan different from other investment banks?
test-318483	What are some cool unknown facts and stories from Wall Street, investment banking, hedge funds, etc in general or about execs and other known figures?
test-318484	What is the best online personal diary/journal website?
test-318485	What are some free online personal diaries?
test-318486	I love my childhood/family friend so much, and I'm so scared she doesn't love me back, how do I make her love me?
test-318487	My son easily gets scared and doesn't know how to fight back, what should I do?
test-318488	If time travel is possible, can we freeze time?
test-318489	Is time travel possible through cosmic strings?
test-318490	What is an intrusive igneous rock?
test-318491	What makes intrusive rocks igneous?
test-318492	Was Erwin Rommel a good guy?
test-318493	Would D-Day be different if Rommel was there?
test-318494	How could Hispanics with surnames that end with -ez or Jewish surnames during the Civil Rights movement been considered non-white?
test-318495	How do some African American families end up with traditional Scottish and Irish surnames if their families are not from Scotland or Ireland?
test-318496	Can you pay for an Amazon gift card with Paypal?
test-318497	Can I transfer money from paypal to an amazon gift card?
test-318498	Daniel Ek: Does Spotify plan on offering FLAC based 16-bit lossless CD quality to your premium service?
test-318499	Does Apple Lossless not sound as good as FLAC?
test-318500	How can I improve my thinking ability?
test-318501	How can I improve my thinking at work?
test-318502	Can kibbles & BITS make you delusional in religion?
test-318503	If NATO went to War against Russia. Who would win?
test-318504	What are the implications of PayTM Wallet being converted into PayTM Bank? Is it good or bad?
test-318505	With in how many years management will be replaced by technology?
test-318506	Whts do you mean by cement?
test-318507	What are some of the top B schools that would accept a donation for admission?
test-318508	If somebody died because of drug overdose or poisoning, do doctors do autopsy, or it is enough to prove the cause of death by analyses of blood?
test-318509	Why do so many actors die from a drug overdose?
test-318510	Will we be having USB Ports in the future (20 years) and what USB-Type will we be using tomorrow? (I want to put USB-Sockets into my walls at home)
test-318511	Given that I have not taken physics, what options do I have when applying to engineering schools?
test-318512	Does the smiley piercing hurt?
test-318513	Why does a smiley piercing hurt?
test-318514	What are the most viewed Indian videos on YouTube?
test-318515	Which are the most watched YouTube videos?
test-318516	Is chili bad for your health?
test-318517	Why are croutons bad for your health?
test-318518	What were the jokes made by All India Bakchod on Salman Khan's sister Arpita Khan in the AIB Knockout Roast of Ranveer Singh and Arjun Kapoor?
test-318519	How did AIB (All India Backchod) get Alia Bhatt and other big names like Karan Johar, Mahesh Bhatt, Arjun Kapoor and Parineeti Chopra ready for their sketch?
test-318520	What is format of GMAT paper?
test-318521	What are the best ways to tell a ho to drop it low?
test-318522	What is the definition of an act of selfishness?
test-318523	What is your simple definition of a selfish person?
test-318524	How much salary does a couple need to live in delhi?
test-318525	How much salary does a couple need to earn for an average/good lifestyle in Sydney?
test-318526	Geolocation: Why the Google streetview images from Europe are of better quality compared to US?
test-318527	How can I improve geolocation by Chrome over my LAN?
test-318528	What are all of Voldemort's Horcruxes?
test-318529	If Harry is a Horcrux, how could Voldemort be destroyed while Harry is alive?
test-318530	What new immigration law for residency in Portugal for tax payers ilegal immigrants?
test-318531	What was the biggest screw up in your life? Did you overcome it?
test-318532	What all career options do I have after BTech?
test-318533	What career options do I have after doing a BTech and MBA?
test-318534	How do I improve my memory if I forget everyhing too fast?
test-318535	How can I improve my memory . I'm losing it?
test-318536	What are the symptoms of high SGPT levels?
test-318537	What does the SGPT level at 124 indicate? Is that related to digestion?
test-318538	Which lord did Jon Arryn actually want to foster his son?
test-318539	Who does Tywin Lannister think killed Jon Arryn?
test-318540	How can I find out where somebody is by their phone number?
test-318541	How do you find out whose phone number is calling you?
test-318542	How do we increase brain memory?
test-318543	How do I enhance my memory?
test-318544	What is the recommended distance between beehives? Why is this necessary?
test-318545	How do bees decide where to make a beehive?
test-318546	How many blog postings are there?
test-318547	How many blogs are there?
test-318548	How do I opt-out of Quora?
test-318549	Why have you opted out of Quora?
test-318550	What is phenol and bromine?
test-318551	Which is more acidic methanol or phenol and why?
test-318552	How can you fix wet iPhone speakers?
test-318553	What is the best way to fix a wet iPhone?
test-318554	How will the 500 & 1000 rupee note ban affect India?
test-318555	How can the ban of 500 and 1000 rupee notes increase the Indian economy?
test-318556	How difficult is it to get into Harvard?
test-318557	How hard is it to get into Harvard?
test-318558	What does Infosys exactly do?
test-318559	How does Infosys work? What does Infosys do?
test-318560	Which is the best coaching center for the GMAT in Bangalore?
test-318561	What is the best GMAT and CAT coaching centre in Bangalore?
test-318562	What Should western women be aware of when dating Arab men?
test-318563	Do Arab men prefer skinny women or curvy women?
test-318564	Am I too sensitive or is there something wrong with me?
test-318565	Why am I too sensitive?
test-318566	Which university is better Thapar University or Amity University or Shiv Nadar University?
test-318567	Which one is better, Thapar University or Shiv Nadar University?
test-318568	Would it be safe to swim in a pool if the water just sat there and no chlorine was added?
test-318569	Is it OK to pee in the pool?
test-318570	How do I develope leadership quality?
test-318571	How do I improve leadership quality?
test-318572	Are the apartments in and around Tokyo that allow giant breed dogs?
test-318573	Why is Amazon ranked so low prestige-wise for a software engineer?
test-318574	How easy is it to fake a degree when applying for a job?
test-318575	When applying for entry-level jobs, does having a Master's Degree help or hurt your chances of being hired?
test-318576	Which among the three PSUs (Power Grid, NTPC and BHEL) would be suitable for a guy who has done his B.Tech and M.Tech from an old IIT and got call letters after qualifying through GATE (EE) and GD?
test-318577	I got a call letter from IIT Guwahati to attend counselling for an M.Tech. I got 11500 rank in the GATE 2015 of the mechanical stream. Should I join an IIT or take coaching and attend and take the GATE 2016?
test-318578	How can we change Indian education system?
test-318579	What 10 things should we expect from a completely reformed education system of India (if it happens)?
test-318580	What's the best time and way to visit Leh (Ladakh)?
test-318581	When is the correct time to travel to Leh, Ladakh? How should one plan to go there on a trip from Delhi?
test-318582	What are some must read poetry books?
test-318583	What are some tips for reading poetry?
test-318584	Can you put some tutorials for learning Adobe illustrator?
test-318585	Where can I find some good Adobe Illustrator tutorials?
test-318586	When was your first sex experience?
test-318587	How/what was your first sexual experience?
test-318588	Which is the best book on aptitude for the GATE?
test-318589	Which general aptitude book is good for gate?
test-318590	Can hymen break by fingering?
test-318591	Does fingering break the hymen?
test-318592	Which is the best bicycle to buy, under ₹10,000 in India?
test-318593	Which is best bike to buy under 10 lak rupees?
test-318594	What best engineering colleges would I get with an all India rank of about 22k through JEE Mains?
test-318595	I got a 400000 rank in the 2015 JEE Main. Which college can I get for civil engineering?
test-318596	How do you differ sodium bicarbonate from sulfuric acid?
test-318597	How do you neutralize sulfuric acid?
test-318598	What is dry bulb temperature and wet bulb temperature?
test-318599	What is wet bulb temperature?
test-318600	How do I find about thomas ravenel net worth?
test-318601	Where can I read about thomas ravenel net worth?
test-318602	What are consolidated charges in Axis Bank?
test-318603	Which IT company manages the axis bank website?
test-318604	In Clash Royale, how do you get a super magical chest?
test-318605	What levels do you usually get a legendary in Clash Royale?
test-318606	Which place is better to live with a family: Australia or Canada? Why?
test-318607	Which country is better to migrate to as a Muslim: Canada or Australia?
test-318608	How can I develop reading habits?
test-318609	How can I improve my reading habit?
test-318610	What mathematics specialization is worth doing?
test-318611	Is the United States becoming a worse society in general?
test-318612	What do you feel is your purpose in life?
test-318613	What is the purpose of life? What are we here for?
test-318614	Is 2.9 GPA very low in 4.0 scale?
test-318615	I pursued BBA with a very low GPA of 2.4. Currently I am pursuing CFA L2. What are of chances of getting an admission in a good business school?
test-318616	Why does my D-link ADSL2+ router 2750U hangs & drops frequently only when a particular mobile tries to access the Internet via WiFi?
test-318617	I use a DLink DIR 600M router for broadband and WiFi. I have a Netgear ADSL2 DG834G v5 lying unused. Can I connect them to extend WiFi range?
test-318618	How is the ISRO interview for the post of Scientist/Engineer 'SC' electronics?
test-318619	How is the ISRO interview for the post of Scientist/Engineer 'SC' (Mechanical)?
test-318620	What programming language does Nitrome use and why?
test-318621	What programming language do you use and why?
test-318622	Does the hardware of Asus Zenfone Selfie 16 GB support the VoLTE feature?
test-318623	Is the Lollipop update available for the Asus Zenfone 5 model T00J?
test-318624	Can we use Jio SIM in a Gionee M3 phone?
test-318625	How do I hire top Facebook app developers in India?
test-318626	Which is your favourite anime episode?
test-318627	What is your favourite anime character?
test-318628	How do I find the email address of a blogger?
test-318629	How do I find an email address?
test-318630	What is the best source for learning Linux?
test-318631	What are the best sources to learn Linux?
test-318632	How can i stop loving a person?
test-318633	How can I stop loving someone?
test-318634	Which EC2 instance size should I use to serve 1 million pageviews per month?
test-318635	Which AWS EC2 instance should I use for my web server?
test-318636	Is happiness really a choice?
test-318637	How can you maximize your happiness in life?
test-318638	What were McDonald's's burgers quality like back when they were pre-assembled and put on timer trays?
test-318639	What are some of the gangs from the 1960's? How were they formed and what were known for?
test-318640	What type of mole is this on this leg?
test-318641	Does science know now their was something before the Big Bang?
test-318642	Why are introverts defined as quiet people?
test-318643	Why are people separated into extroverts and introverts?
test-318644	What are some mindblowing facts about Nikola Tesla?
test-318645	What was Einstein's opinion on Nikola Tesla?
test-318646	Why is solar energy a renewable source?
test-318647	Why is solar energy renewable?
test-318648	What are all the kinds of jewelry?
test-318649	What kind of jewelry do you buy?
test-318650	How can I create a blog on Quora?
test-318651	How do I create blog on Quora?
test-318652	How can I check my Discover card application status?
test-318653	How do you check ICICI Bank's credit card status?
test-318654	Is it possible to find maximum sum of two numbers in an unsorted array such that the numbers are not adjacent to each other in O(N)?
test-318655	Given an array, all of whose elements are positive numbers, what is the maximum sum of a subsequence with the constraint that no 2 numbers in the sequence should be adjacent in the array?
test-318656	What do you think about ban of ₹500 & ₹1000 notes in India? How Will it help Indian economy?
test-318657	How can the ban of 500 and 1000 rupee notes increase the Indian economy?
test-318658	Why did SBI made PAN card mandatory to SBI junior associates?
test-318659	What is Wrong and Dangerous about the US Foreign Policy? How does Washington’s Demands Risk War with Russia?
test-318660	How long do you think it will it take for Trump to be impeached?
test-318661	What do you think the chances are that Trump will be impeached?
test-318662	How did the collapse of the Soviet Union affect India?
test-318663	How did the collapse of the Soviet Union affect the world?
test-318664	Is true that a giant meteor will hit the earth in 2032?
test-318665	I take Diane 35 it is day 5 after the pills ended. I had protected sex on day2 am I'm I pregnant? Will I get my period?
test-318666	What happens when you eat expired food?
test-318667	What happens if you eat expired food? (Like you eat food which is expired this year)
test-318668	If all superpowers of the world would attack the United States of America at the same time, how long will it take them to defeat the USA?
test-318669	Is the United States the sole superpower?
test-318670	What will be the impact of Trump presidency on India?
test-318671	How will Donald Trump benefit India?
test-318672	How can we make time management the organization's priority?
test-318673	What is truly a waste of your personal time?
test-318674	Which online shopping website offers deals every day?
test-318675	Few days ago, an online shopping site was selling a pen-drive for just Rs. 3. There are plenty of such offers & deals where these sites sell consumer products at highly subsidized prices. How does this work and how do they make profit?
test-318676	What is a foot fetish?
test-318677	Why are foot fetishes so common?
test-318678	Where can I buy cheap mason jars in bulk?
test-318679	Where can I find mason jars on wholesale?
test-318680	What is your review of U (2006 movie)?
test-318681	What is your review of Cloud 9 (2006 movie)?
test-318682	What are the cons of the TPP?
test-318683	What are the pros and cons of the TPP?
test-318684	Which is the fastest way to lose weight?
test-318685	Which is the easiest way to loose weight?
test-318686	Who are the best MCAT trainers in Lahore?
test-318687	Who are the best tutors for the MCAT in Lahore?
test-318688	Immunizations: How much mercury is in a flu shot? Why is it there?
test-318689	Is a flu shot and any other injection, considered an immunization? And what things are considered Immunizations?
test-318690	How can I migrate to New Zealand?
test-318691	How do I migrate to New Zealand as a refugee?
test-318692	Will it be possible for us to actually travel to Mars by 2025?
test-318693	How will SpaceX select the astronauts to go to Mars?
test-318694	Is it possible to go so fast that you appear in two places at once? Why or why not?
test-318695	What is the best thing you learnt in JNV life?
test-318696	Who are the best operators in Rainbow Six Siege?
test-318697	Is the gear in Rainbow Six Siege real?
test-318698	Self-Assessment: Am I being surrounded by idiots constantly or am I the idiot?
test-318699	How do I make sure my event is a success?
test-318700	Is there a way to block certain sites in Chrome on Android?
test-318701	How many browsers do you use, and for what purposes?
test-318702	How one can step into Public relations if he/she does not have a experience in it?
test-318703	Data analyst in zsassociate?
test-318704	At what age do vertical nail ridges usually begin to appear on nails?
test-318705	What makes some people's nails ridged and others smooth? Is there a reason?
test-318706	What are some good research title and topic in human resource?
test-318707	I am pursuing a master in Human Resource Development. What could be a good topic for research in HRD?
test-318708	How can you deal with people when you don't trust them?
test-318709	How can you deal with people when you don't trust any of them?
test-318710	Is there anything that travels faster than light?
test-318711	Is there anything which moves faster than light in the world?
test-318712	How can I make myself get out of bed more quickly?
test-318713	Have you ever fallen out of bed?
test-318714	What would be a good project on High-Performance computing?
test-318715	What kind of projects can I do on high performance computing?
test-318716	I got a laptop a couple days ago I got out of bed and accidentally stood on it. It has 12 month warranty will this cover accidental damage? . Thanks
test-318717	How is the image that you have of Brazil and Brazilians, and please be extremely sincere . Not afraid to criticize, okay?
test-318718	Who wrote quran?
test-318719	Who wrote the Quran? Based on what was it written?
test-318720	How much money can government print after demonetization?
test-318721	What is the total cost of printing and circulating of the new Rs 500 and Rs 2000 notes?
test-318722	Does Facebook have a sitemap?
test-318723	Is it good to have multiple XML sitemap for a website?
test-318724	How can I talk with a girl?
test-318725	How can I get myself to talk to a girl?
test-318726	What are the effective ways to learn English?
test-318727	How does one learn English?
test-318728	Why are Indians afraid of police?
test-318729	If you were God, how would you entertain yourself?
test-318730	How do you keep clownfish as pets?
test-318731	Is it good to keep a dog as pet?
test-318732	Why isn't Edelweiss Air a member of Star Alliance?
test-318733	What is Star Alliance to which Air India is associated with?
test-318734	What is the best way to get my IQ checked online?
test-318735	What is your score on an online IQ test and what is your 'real' IQ?
test-318736	How do I make friends in a private school?
test-318737	How can I make friends at a new school?
test-318738	Which distance learning program should I take to assess myself and prepare well?
test-318739	Should I take regular classroom classes or the weekend classes of preparations for the JEE? Is the weekend program available in Kota too?
test-318740	My hair is falling. What can I do to prevent this?
test-318741	What should be done to prevent hair fall?
test-318742	How do I retrieve deleted Snapchat messages?
test-318743	How one can see deleted messages of watsapp? Is there is a way to retrieve it?
test-318744	Should I drink my protein shake before, after or under my workout?
test-318745	Do I take protein shake before or after the gym?
test-318746	Which is the best place in India to procure ready-made garments in a cheap wholesale rate for business?
test-318747	What is the best way to derive a selling price for your own  ready-made garment?
test-318748	What is the hardest thing(s) about raising children in Sweden?
test-318749	What is the hardest thing(s) about raising children in Singapore?
test-318750	Indian Cuisine and Food: Why is aged basmati rice highly prized and more expensive?
test-318751	How did Basmati rice get its name?
test-318752	Why are Punjabis so proud of being Punjabi?
test-318753	What makes you proud about India?
test-318754	Who makes 360 videos?
test-318755	What is the best way to made 360 video?
test-318756	Traffic Law: When a police officer pulls you over can they ask your passengers for their I.D.?
test-318757	Do Police Officers get annoyed when a driver puts a seat belt on while or after being pulled over?
