test-610480	If a restaurant says no children allowed, then are teens (13-17) allowed in?
test-610481	Software architecture sketch?
test-610482	What is the percentile if I have scored 19 marks in XAT(27 positive and 8 negative)?
test-610483	What percentile could I get with a score of 24.5 in XAT-2016?QA=7.25 ,VA-6.5,DM-10.75
test-610484	How do I expose someone on the Internet?
test-610485	Where can I get a bridal lehenga on rent in rajkot in gujarat?
test-610486	Is hair regrowth possible naturally?
test-610487	What hair regrowth products are good for a receding hair line?
test-610488	Why do people still believe god?
test-610489	False Pretences: Why don't some people want to believe in gods?
test-610490	"Song Lyrics: What does ""blinded by the light, wrapped up like a douche in the middle of the night"" mean?"
test-610491	"What is the second line of the song ""Blinded by the Light"" by Manfred Mann?"
test-610492	In what way do you think the reservation system can be diminished in India?
test-610493	Is there any way to completely wipe out reservations in India?
test-610494	Can I make a website for free?
test-610495	Where can I make a free website?
test-610496	Who is the most overrated person at BIT Mesra??
test-610497	Who is/was the most awesome person from BIT Mesra?
test-610498	What is an electron orbital?
test-610499	Where is the electron in a orbital?
test-610500	Where is the best place to spend New Year's Eve in Hyderabad?
test-610501	Where is the best place to spend new year's eve in the world?
test-610502	What is the difference between B.tech and B.E.?
test-610503	What is the difference between B.E & B.Tech?
test-610504	Where can I buy access control systems?
test-610505	What is a project on control systems?
test-610506	What are the most controversial topics in computer science?
test-610507	What are some of the most controversial topics in atmospheric science?
test-610508	Which anime characters have red eyes?
test-610509	What anime characters have red hair?
test-610510	Which is the best website for downloading free songs?
test-610511	What is a good free website to download mp3 songs?
test-610512	Can a person travel to the US on H4 without the primary applicant being in the US?
test-610513	What countries can a US visa holder (F1/J1) travel to without a visa?
test-610514	For atheists, why don't you believe in God and why do some of you like to mock Christians?
test-610515	Why don’t atheists believe in God given that they can’t prove that this life is the creation of nature?
test-610516	What is the best way to start learning how to code?
test-610517	What is a good way to learn to code?
test-610518	Would you review a book on Goodreads if you are offered a PDF copy of its published version?
test-610519	Is it illiegal to take information from a book and post it online if you're only copying a few pages provided you're not selling it?
test-610520	How is KIET for ECE?
test-610521	How is AIACTR for ECE?
test-610522	Is telekinesis truly possible?
test-610523	Is telekinesis (mind over matter) possible?
test-610524	"What does ""Love is blind"" actually mean?"
test-610525	Why does everyone say that love is blind?
test-610526	What financial ratios should we use when comparing IT companies?
test-610527	What financial ratios should we use when comparing IT companies in the USA?
test-610528	In which language AMU professer teach diploma engineering?
test-610529	How much does the giant Franz Kafka statue in Prague cost?
test-610530	Is being 23 years old too late to learn hip hop?
test-610531	I am 23 years old and just started learning Sitar. Is it too late to start?
test-610532	What job could you never do even if was possible for you to do it?
test-610533	What is data entery? Home. Job
test-610534	Can I get job with the help of job consultants in metallurgy engineering?
test-610535	Can I get job with the help of job consultants in civil engineering?
test-610536	What is the difference between statement of problem and background to the study?
test-610537	What is the difference between background of study and statement of problem?
test-610538	Can I use the Square iPad Stand with a different point-of-sale app?
test-610539	Is there a cheaper stand solution than square's iPad reader stand?
test-610540	Why do so many philosopher say that heart control feelings, thoughts?
test-610541	Why so many philosopher says that heart control feelings and thoughts?
test-610542	How Naya Raipur presents a positive image of Development in Chhattisgarh?
test-610543	What are the emotional implications of being a first-generation immigrant?
test-610544	How does xenon bond?
test-610545	What is a single covalent bond and what are some examples?
test-610546	I am a blogger. I want to get huge traffic on my blog. What should I do?
test-610547	How can I get unlimited free traffic to my blog?
test-610548	What is the best way to keep live crabs alive for 1-2 days?
test-610549	I want to export crabs from India. What could be the best way to store them alive for at least 6-7 days?
test-610550	How can I learn Hindi typing?
test-610551	What's the best way to learn Hindi on my own?
test-610552	What is the designation structure hierarchy, with the number of experiences, at HCL?
test-610553	What is the designation or band I could expect from HCL for 7 years of work experience?
test-610554	What is the biggest lie society has ever believed?
test-610555	What is the biggest lie society has taught you to believe?
test-610556	What are some reasons to why not all humans have human rights?
test-610557	What do we mean by human rights?
test-610558	Will science ever make it possible to bring back the dead?
test-610559	How close are we to bringing back the dead?
test-610560	Does drinking milk increase weight?
test-610561	Does milk increase weight?
test-610562	How do I start learning English as a second language?
test-610563	What are the best way to learn english language?
test-610564	How should one deal with depression?
test-610565	What are the best ways to deal with depression?
test-610566	What hotel in Pachmarhi Hill-station would be safe for unmarried couples, without the harassment of police, hotel staff, and moral police?
test-610567	What hotel in Dehradun Hill-station would be safe for unmarried couples, without the harassment of police, hotel staff, and moral police?
test-610568	What do people from United States think of Indonesia?
test-610569	Can Texas secede from the United States?
test-610570	How many traditional kings are in Nigeria?
test-610571	Why do humans seek for patterns?
test-610572	Is it okay to give up on your love to keep your parents happy?
test-610573	Would it be selfish to give more to someone you romantically love than to your parents?
test-610574	Is Amerigo better than RealPlayer Cloud? Why or why not?
test-610575	Is Amerigo better than RealPlayer Cloud?
test-610576	Which is better: Uber or Ola? Why?
test-610577	Is Uber better than Ola?
test-610578	What is the Lewis structure of CH3NO2?
test-610579	What's the Lewis structure of naphthalene?
test-610580	Licensing: Can I use a copyrighted music on my podcast?
test-610581	What do I have to do to legally use clips of copyrighted music in a paid course about that music?
test-610582	Why are there so many questions on Quora that don't have answers?
test-610583	How many questions have been asked on Quora?
test-610584	How can I pass a saliva drug test for crystal meth?
test-610585	How long does meth stay detectable in the body through testing?
test-610586	What's an Indian vegetarian diet plan for PCOS women?
test-610587	Where can I find a 1200 calorie Indian vegetarian diet plan?
test-610588	What is a blockchain?
test-610589	What is a blockchain smart contract?
test-610590	I studied 9th and I did Vocational Training under state government. Can I apply passport under Non-ECR or ECR category?
test-610591	How much information can the world wide web hold?
test-610592	In which courses in the standard physics curriculum does the most variation in curriculum between similarly-named courses in different colleges exist?
test-610593	In which courses in the standard CS curriculum does the most variation in curriculum between similarly-named courses in different colleges exist?
test-610594	What can be done after graduation?
test-610595	What should I do after graduation? Graduation
test-610596	How can I boost up Internet speed or hack internet speed?
test-610597	How can I boost my mobile internet speed?
test-610598	I am averaging 50 marks in my GATE Forum mock tests for the GATE Computer Science. I have one week with me in which I will solve all of the previous year's exams. Will I be able to score well in the actual exam?
test-610599	I am a civil GATE aspirant and have a week for my exam, will it be okay if I solve only previous gate papers and revise concise notes along with attempting GATE mock exams?
test-610600	Is time travel to 2010 possible?
test-610601	Why is it said that traveling in the speed of light would make time travel possible?
test-610602	Is Bangladesh an 'unconventional' Muslim country?
test-610603	I am a indian mba in finance how can I get a job in uk?
test-610604	Why sex is so important in life?
test-610605	What is importance of sex in life?
test-610606	What's the best language?
test-610607	In qPCR, if my probe starts from the very next base of the forward primer, will that pose a problem?
test-610608	Why doesn't IRCTC refund money instantaneously on the cancellation of e-tickets?
test-610609	How do I cancel my RAC ticket in IRCTC?
test-610610	What should I buy with a $10 Amazon gift card?
test-610611	What can I buy with a $10 Amazon gift card?
test-610612	Which games on PS4 support 2 player split-screen?
test-610613	Are PS4 games region locked?
test-610614	How do I [math]\int (\dfrac{x}{5} + 3)  dx[/math]?
test-610615	How do I solve the integral [math]\displaystyle\int_1^4 \dfrac{2}{x}dx[/math]?
test-610616	What are your top five greatest novels of all time?
test-610617	What are some of the greatest novels of all time? Why are they great?
test-610618	You are given a four 3 volts cells. Draw a circuit that shows how you will supply load that operates at 6 volts using all four cells?
test-610619	What is meant by Wide Power supply Range (±2.3 V to ±18 V)? What if I apply +5 and -5 volt and another person applies +10 and -10 volt? Any problem?
test-610620	Is there a place to watch the UFC fight for free?
test-610621	How much will Ronda Rousey get paid to fight in UFC 207?
test-610622	What is the difference between strings and character arrays?
test-610623	What is the difference between character and string?
test-610624	Why is my Windows 8.1 laptop running so slow even though it has antivirus and 8 GB RAM i7 at 2 GHz speed?
test-610625	Will GTA V run on my laptop (Acer Aspire E1-510 Celeron N2028 with intel HD graphics and upgrading ram from 2 Gb to 8 Gb)?
test-610626	How can women reduce belly fat?
test-610627	How do I loose belly fat?
test-610628	How can I download videos from youtube to desktop?
test-610629	How do I download videos from YouTube to an iPod?
test-610630	If Ireland had remained a part of the UK until now, would the UK government still have been willing to let Scotland vote on independence?
test-610631	Why did Scotland vote to stay a part of the UK?
test-610632	Is it wrong for the 20 year old man and the 15 year old girl to be in a relationship?
test-610633	Is it wrong to have expectations in a relationship?
test-610634	What will happen if I put salt directly on mouth ulcers. Will it kill that?
test-610635	What are the reasons behind having close to 20 ulcers, of varying size, in the mouth?
test-610636	Two bulbs of 40W and 60W are connected in series with an AC power supply of 100V. Which bulb will glow brighter and why?
test-610637	If two bulbs of wattages 25 and 100 respectively, each rated 220V are connected in series with the supply of 440V, which bulb will fuse first?
test-610638	I am an Indian Muslim and I am immensely patriotic and love India. Why do Pakistanis not like it?
test-610639	Why are Pakistani Muslims generally more radical than Indian or Bangladeshi Muslims?
test-610640	Is my laptop good for gaming?
test-610641	Is this laptop good for gaming?
test-610642	What are the best reference books for symbolism?
test-610643	Which is the best reference book of English class 9?
test-610644	What are the advantages and disadvantages of having a cat?
test-610645	Cats (pets): What are some disadvantages of living with a cat?
test-610646	Where is Jian Ghomeshi?
test-610647	What is Jian Ghomeshi like in person?
test-610648	Why do some people like to threaten others?
test-610649	What is a path that I can follow to eventually becoming a strength and conditioning coach for a college or pro team?
test-610650	How do I message to a girl who doesn't know me?
test-610651	How can you tell if a guy likes me by reading text?
test-610652	What are some best xbox 360 games?
test-610653	What are your favorite Xbox 360 games?
test-610654	Which season of Seinfeld had the highest ratings?
test-610655	Which Seinfeld season is the best?
test-610656	Project displaced quota in Karnataka?
test-610657	What are the uses of XML in data?
test-610658	"""Behind every successful man there is a woman."" Is it truth or myth?"
test-610659	Is it true that behind every successful man, there is a women?
test-610660	What are some good books for a 22-year-old to read?
test-610661	What are some good books for a 22 year old to read?
test-610662	What number is 10 with a power of 24th?
test-610663	Thrice the square of a number is 10 times another number. what is the ratio of the first number to the second number?
test-610664	Why do we put people on life support machines?
test-610665	What stops people from having the life they want?
test-610666	Can you still buy a printer that uses 564 ink cartridge?
test-610667	What are printers that use HP 564 ink?
test-610668	Is it possible to convert a car with a manual transmission to an automatic transmission?
test-610669	Is it possible to double clutch with an automatic transmission?
test-610670	At what angle the hands of a clock are inclined at 15 minutes past 5?
test-610671	At what angle the hands of a clock are inclined at 15 min past?
test-610672	What do you do to overcome writer's block?
test-610673	What is the best way to deal with writer's block?
test-610674	What are the ways to handle failure?
test-610675	What are the ways to handle failures in UPSC?
test-610676	What is something that bothers you about Japanese people?
test-610677	What do Japanese people imagine about Indians?
test-610678	What are the differences between friendly cuddling and romantic cuddling?
test-610679	What is it like to cuddle with someone?
test-610680	What are some of the best ways to forget someone whom you loved (crush) very much?
test-610681	How do I forget a loved one?
test-610682	Is Iran the only Technologically advanced Muslim country?
test-610683	Which country is the least technologically advanced?
test-610684	What are handcuffs?
test-610685	How do you get out of handcuffs?
test-610686	What is it like having true friends?
test-610687	What is like to have a true friend?
test-610688	How do I get IT jobs in Dubai?
test-610689	How can one get a job in Dubai?
test-610690	Why can't we run or shout in dreams?
test-610691	Do cats dream? If yes, what do they dream about? Chasing other animals? Running on a field?
test-610692	How much are actors on Saturday Night Live paid per episode?
test-610693	What is the funniest Saturday Night Live sketch?
test-610694	What are some examples of cultural leveling?
test-610695	What are some examples of cultural appropriation?
test-610696	How do you calculate the cross-sectional area of a pipe?
test-610697	How do you find the cross-sectional area of a rectangle?
test-610698	"What does it mean when a girl calls a guy ""bro""?"
test-610699	If a girl never texts a guy first does that mean that she's not interested?
test-610700	What are some of the best Rajinikanth memes?
test-610701	What is the hand symbol used by Rajinikanth in the movie 'Baba'?
test-610702	Which is the most overrated IT company in INDIA?
test-610703	Is Modi the most overrated PM India has seen?
test-610704	Which is the best iPhone 6 case?
test-610705	What are the best cases for the iPhone 6?
test-610706	Should I buy INS vikrant instead of knowing that it heats more?
test-610707	Could alpha radiation be used to target cancer cells?
test-610708	To whom are my questions suggested on Quora to answer?
test-610709	How can I start answering questions on Quora?
test-610710	Dishes made from eggs?
test-610711	I am sc and scored 260 is there any hope in private colleges with cut off marks .pls I am scared?
test-610712	Why is my open cut/wound not bleeding?
test-610713	How long does a common cut on the hand take to stop bleeding and what is the science behind it?
test-610714	Does caffeine increase motivation? What is the neurobiological basis?
test-610715	How deadly is caffeine powder?
test-610716	Which are the companies in India that works in the domain of Internet of things (IoT)?
test-610717	"What are the best pre-IPO companies to join that are working in IoT- ""Internet of Things"" domain?"
test-610718	What is the difference between token bucket and leaky bucket algorithms?
test-610719	Regarding leaky bucket and token bucket algorithm, are they implemented for datagrams or virtual circuits, or both?
test-610720	Am I that bad?
test-610721	What is the importance of hertz in music?
test-610722	Which are the career options for a civil engineer diploma holder?
test-610723	What are the best career options for a civil engineer after getting a bachelor's degree for girls?
test-610724	What's the purpose of human life? Will humans ever be able to know about their creator?
test-610725	What is the purpose of life?
test-610726	What are the excercises to reduce belly, thigh and butt fat?
test-610727	How much water should I drink to reduce belly fat?
test-610728	What is the significance of the lion's name in the Chronicles of Narnia?
test-610729	Why was the lion in Chronicles of Narnia named Aslan?
test-610730	How can you learn English well, especially in English grammar?
test-610731	I am poor in English grammar so how should I improve my grammar?
test-610732	What are the life cycle stages of a volcano?
test-610733	What is the life cycle of a snail?
test-610734	Where can I catch a Magmar in Pokémon GO?
test-610735	How do I catch more Pokémon in Pokémon GO?
test-610736	What should be the tagline for a Food Delivery Service?
test-610737	What can be a remarkable tagline for a restaurant chain which serves Indian food in Quick Service Format?
test-610738	What is the Lewis structure for [math]\mathrm{N}_2\mathrm{O}_4[/math]?
test-610739	What is the Lewis structure for fluorine?
test-610740	Would you buy a used car online?
test-610741	How do I sell a used car online?
test-610742	How are Litres measured?
test-610743	What does the litre measure?
test-610744	How powerful is a railway engine?
test-610745	How powerful is an 18-wheeler engine?
test-610746	Is Quora an addiction/obsession?
test-610747	Why is Quora so addictive?
test-610748	1) Why does flour form lumps when it is added to sauce, but doesn't form lumps when added to oil? 2) Why does flour form lumps when cooked in sauce directly, but not when it has been cooked into a roux first?
test-610749	My father is a fussy eater. He says sauces on foods are for old people. He says people are crazy for adding sauces to food. What can I do about it?
test-610750	What are some cheap options to ship products from India to the USA?
test-610751	How do I export plants and plant products from India to USA?
test-610752	What is the scope of doing an MBA in IB from PIMR indore India?
test-610753	What is the scope of specialization in the MBA (IB, marketing) in India?
test-610754	What is the take home salary for 146000 in michigan?
test-610755	What are all the books as a embedded system engineer should read?
test-610756	What are some interesting possible applications of machine learning?
test-610757	What are some real-world examples of applications of machine learning in the field?
test-610758	Which app changed your life?
test-610759	What apps have changed your life?
test-610760	I'm 27 year old Indian male. My salary is 30K per month. Is it a good salary to earn at that age or is it low?
test-610761	I am 27 yrs old married man. I earn 75k per month and my wife earns 25k per month. Is it enough to live a good life in NCR? We have no loans.
test-610762	What is Droop control?
test-610763	How do I explain systems and control engineering to a layman when he asks you about your area of specialization?
test-610764	What is the future of computer science engineering?
test-610765	What is the future of computer science?
test-610766	Which crowdfunding platform works best for developing a software application?
test-610767	Can a psychiatrist write prescriptions?
test-610768	"Why is the line ""but I was going to Tosche Station to pick up power converters"" so iconic for people?"
test-610769	What are the top 10 most powerful Sith?
test-610770	From where can I quickly learn Java?
test-610771	What is an easy way to learn Java?
test-610772	Why does the U.S. Navy have its own army?
test-610773	Is it possible to join the U.S. Army or Navy for only two years?
test-610774	What are some cool places to hang out in Nasik?
test-610775	I'm staying in RVA over the summer and want to explore the lesser known aspects of the city. What are some cool places to check out?
test-610776	Can I change myself?
test-610777	How can I change myself?
test-610778	Was it a mistake for the US Navy to halt production of the Zumwalt-class destroyers after just 3 ships? And if so, just how big of a mistake was it?
test-610779	What is the chain of succesion onboard a US Navy ship?
test-610780	Where do you see yourself in the next five years?
test-610781	Where do you see yourself after 5 years?
test-610782	How can we define the American dream?
test-610783	What is the American Dream?
test-610784	What is the best all day timetable for class 12 commerce student with maths?
test-610785	How do I prepare a study timetable being a class 12 medical science student?
test-610786	Will the total mass of earth plus the humans on earth increase with population, will the total mass of earth be higher for 100 billion people?
test-610787	What is the mass of the Earth?
test-610788	"Why is ""Japan's Marine Day"" unknown in Jamaica?"
test-610789	"Why is ""Japan's Marine Day"" unknown in The Bahamas?"
test-610790	Why was Julianne Hough added as a fourth judge on Dancing with the Stars over other previous professional dancers from the show?
test-610791	How did Rob Kardashian do on Dancing with the Stars?
test-610792	How do I confess my love to a boy who is related to me in a way and I am afraid that he may not get angry. HELP ME?
test-610793	I am attracted to a guy. I really love how he smells when he passes by me. Should I tell him about my feelings? I am afraid he may get offended.
test-610794	How is AI research in China different from AI research in the U.S.?
test-610795	Artificial Intelligence: How is AI research in Japan different from AI research in the U.S.?
test-610796	What should be the preferences order in SSC CHSL 2016?
test-610797	I applied for SSC -CHSL exam 2016, have they released the admit card? If yes, where I can download it from? Do they notify this through e-mail?
test-610798	What are the best midnight snacks?
test-610799	What is the best midnight snack?
test-610800	What causes racism?
test-610801	What causes someone to become a racist?
test-610802	How do you motivate people?
test-610803	D- Excitement: How do we motivate other people?
test-610804	What is an allegory and what is an easily understood example of an allegory?
test-610805	"What inspired Plato's ""Allegory of the Cave""?"
test-610806	What is the gravitational pull of black hole?
test-610807	If light has no mass how can a black hole pull it by gravitational force?
test-610808	What are transition elements?
test-610809	What are some non transition elements?
test-610810	Why are people always unsatisfied?
test-610811	Why are people always two-faced?
test-610812	Can life get better without depression and anxiety?
test-610813	"When a pilot of war fighter take down an enemy fighter. He scream ""OOOWWWW I GOT ONE"" like the movies?"
test-610814	Are there any cheaper alternatives to Safari Books Online?
test-610815	Why do you subscribe / not subscribe to Safari Books Online for accessing programming e-resources?
test-610816	Can I get mechanical engineering branch in manipal campus with 4640 rank in MU-OET 2016?
test-610817	Can I get mechanical engineering branch in manipal campus with 3270 rank in MU-OET 2016?
test-610818	Are there careers like paramedic, that don't require a psych evaluation?
test-610819	How was Lousiana purchase done? How much money was paid for it in today's means?
test-610820	People with fibromyalgia, what symptoms are the hardest for you to deal with? Also, what are the best coping tricks that you have discovered?
test-610821	How can I deal with Mirena's crash symptoms?
test-610822	What are some good quiz plugins for WordPress?
test-610823	What is the best tabbed video gallery plugin for WordPress?
test-610824	Which are the best places to visit in Pune for a good weekend with family?
test-610825	What are some of the best places to visit in pune?
test-610826	Which is better, CSE at IIT Roorkee or EE at IIT Kanpur?
test-610827	Should I choose CSE or EE at IIT's?
test-610828	Can erectile dysfunction be treated?
test-610829	How is erectile dysfunction treated?
test-610830	Can I get a job in large tech company if I am only good at data structure and algorithms but with very few development experience?
test-610831	What is the impact on prices of cars post GST?
test-610832	How long will the Earth's magnetic field last?
