224564	How do I make an animated ebook?
4214	How hard would it be for somebody on my home wifi network to get all the data coming in and going out, even data sent by other computers?
524474	I want to start off in the stream of data science. How do I start off? What all softwares and technologies should I be aware of? I'm a BE computer engineer. How do I go about it?
262661	Why did Marco Arment sell Instapaper?
262662	How does Marco Arment use Instapaper?
70380	Why do Asian parents believe that being a doctor/lawyer/CPA would lead to a happy life?
70381	What happens if you're Asian and your parents want you to become a doctor, but you don't?
246934	Can we download movies from torrents?
465742	Is sciencedaily.com reliable?
91987	Is LabDoor.com reliable?
93534	How long will it take to learn Java and C?
389353	How long will it take me to learn C if I know Java really well?
55272	What is a proxy email address?
29539	Who are the toughest journalists in India?
29540	Who are the worst journalists in India?
356780	Can we agree that mothers are the best when it comes to bringing up children?
356781	Are mothers the best when it comes to bringing up children?
53275	What is the best text editor for the iPad?
243262	What is the best text editor for programming?
156282	What is the best programming language I must learn before starting to learn hacking?
157529	Is arranged marriage good or bad? What do you think?
157530	I am a 23-year-old girl who is about to get married in 4 months. It's an arranged marriage. I have been with him for 5 months already and I am still not in love with my fiancé! In fact, I hate him because of his behaviour. My parents aren't supportive because of society's pressure. What should I do?
347105	How does a floating-gate transistor work?
347106	Why don't iPhones have a memory card slot?
218699	If a Bollywood movie were made on the life and career of Deepika Padukone, what would be its opening scene?
393465	How much will it cost to maintain an e-commerce website in a year?
42389	What is the cost of creating an e-commerce website?
79020	What is the use of learning PLM or any other Data Management tool, if it's existence is temporary?
79021	What is the latest tool used in business rules management system which supports Java language? Currently we are using JBoss Drools. Is there any other tools and what is the scope of this tool learning in software industry?
309008	If Jesus is God and human, why are we only human but not God?
294494	What is the best way to visualize square footage?
294495	What is the best way to smudge your house?
396292	How do I get job in software testing as a fresher?
396293	How can I get a job in software testing as a software engineer with no work experience?
115749	Why had the U.S. bombed Vietnam for 10 years using chemical weapons, but still lost the Vietnam war at the end?
115750	What did Vietnam look like after the U.S. had bombed Vietnam with chemical weapons for 10 years?
57526	What are the best clothes to wear downhill skiing?
57527	What clothes should I wear to suit my body the best?
378059	Is a beef-eating Hindu safe in India?
378060	Is it safe to eat beef in India?
85940	What are some examples of static friction?
85941	What are some examples of friction?
112489	What does it mean marginal cost at short run and long run?
112490	What is a long and short run curve in simple terms?
255068	How much revenue does a supermarket make annually, in India?
255069	Is solving RD Sharma and previous year JEE Mains question paper enough for scoring good in JEE Mains Paper 2?
473504	"What is the translation for the French phrase ""La Vie Bohème""?"
249047	What are the best restaurants to try when visiting Itu, Brazil? What should you try while you're there?
285774	What are the best restaurants to try when visiting Ibirité, Brazil? What should you try while you're there?
363272	Who won the 2nd US presidential debate between Trump and Clinton?
187904	Who won the second presidential debate: Trump or Clinton?
157744	How much does Invisalign treatment cost?
505358	How much does Invisalign cost?
288998	Where do we use Ito calculus in stochastic optimal control for engineering problems? Where and how?
288999	Is Mohammad a common male name in Iran?
397898	I am planning to read a whole encyclopedia. What is the best way to remember as much of it as possible?
84859	If we can invent a number [math]i[/math] so that [math]i^2=-1[/math], why can't we have a number a so that [math]\sin a=2[/math]?
50334	Would you vote for Hillary Clinton and why?
200213	How does Vladimir Putin learn that much?
200214	How tall is Vladimir Putin?
25790	What are some cultural faux pas in Pune?
485244	How would you rate Emilia Clarke as an actor?
287188	Is Emilia Clarke a good actress?
251716	Which country does not celebrate Christmas in December?
207623	Is the vacuum of space filled with dark matter?
207624	What are dark matter and dark energy and do they make the empty space?
275096	What's the next number in the sequence 1, 2, 3, 4, 5?
261556	How do I identify a business opportunity?
511650	How can I identify market opportunities?
44585	How do I bypass the activation lock on a iPhone 6?
267241	How do you text message online?
141905	What is conclusion about demonetisation in India?
188661	Who is your favorite movie star, and why?
502627	How could the police find the rapist, if the rapist was a woman?
502628	Is a 10-year-old boy overweight at 68 pounds?
156293	What are the best restaurants near UC Irvine's campus?
156294	My brother is doing diploma in engineering from private university in Dehradun..he wants to change the university after 2 semester?
214379	I have a windows 10 original version. If it gets attacked by a virus, I may format it. Can I get it back without paying for software again?
214380	If I opened a file with a virus, can I open it again?
337932	Are there other movies like The Secret?
364820	Is there anyone who undoubtedly did hard work but also chanted specific mantras for topping an exam?
364821	Why does petroleum and liquor products are exempted from GST in India?
448390	How long are the Lord of the Rings books?
148098	What does the ring symbolize in the book The Lord of the Rings?
243814	How do you do a Punnett square?
307309	What is a Punnett square?
437251	Is chicken considered meat during lent?
437252	Can you eat chicken during Lent?
65607	Why do my forearms hurt after lifting heavy weights?
65608	Can I have a small naughty meal after lifting weights?
436730	How do I import XLSX files data in MySQL by using CodeIgniter?
436731	How do I import xml files into sql with image using codeigniter?
226480	Is India ready to host the 2024 Olympics?
226481	Is India capable of hosting the 2024 Olympics?
385312	What well known professors frequently use Quora?
385313	What are some good professors and well known people on Quora to follow?
186378	How do I run apk files on windows phone?
186379	What would happen if we run an APK file on a Windows phone?
203719	My son keeps getting into fights at school and bosses his siblings around whenever he's at home. How do I make him stop?
203720	What is cureinstant and why do people are talking a lot about it in India?
457291	How long a DVD disc remain good without degradation?
457292	I got Jio sim in my moto g4+ in 15dayes before. When active the sim?
460406	My son has decided to discontinue 12std to pursue his internationally recognized and funded mobile innovation, should we support him?
460407	How did Socrates examine life?
36733	How do you be your own best friend?
214106	U.S after Donald Trump wins the US presidential election?
276501	What are some amazing facts about snakes?
162263	What are some fascinating facts about snakes?
524114	What is the best strip club in Los Angeles, California?
524115	What are the best strip clubs in Los Angeles?
300760	Who is stronger: The Flash or Arrow?
392838	How do I start learning new things by self?
297727	What happened to Sammy in Dance Academy?
297728	Why did Sammy leave the Dance Academy?
207596	Which is the best board game for children under 10?
207597	Am I blessed to be in a strategy role instead of a trainee role during for my First job after my MBA from a top Bschool in India?
131571	How competitive is the hiring process at TeamHealth?
131572	How expensive is it to make a bunker?
210869	What circumstances make engineering students much apathetic about ethical issues?
210870	If ethical issues were merely subjective, why do people argue about what's the right thing to do?
36375	What is an acceptable bounce rate?
36376	What is an acceptable bounce rate for a paywall site?
484618	What is the healthy pH level of human urine?
484619	Is human urine acidic or alkaline? What affects its pH?
127648	How should I start learning Android app Development?
127649	How should I start learning to develop Android apps?
173204	How can you use aloe vera on your face?
504365	What are examples of the diachronic and synchronic approaches?
504366	What are some examples of synchronic and diachronic approaches?
178352	Which is the best E-commerce platform in Delhi?
178353	Which is the best e-commerce platform for you?
462472	How do I find about latest udemy coupons?
173285	What are the best mobile ad networks in Korea?
147370	What are the differences between Appannie and SimilarWeb?
147371	What are the differences between Intercom and App Annie? Do they both provide the same level of analytics?
297043	Is getting one's wisdom teeth at the age of 12 normal?
297044	Can my parents make me get my wisdom teeth out (under 18)?
106257	Which processor is better i5 6th gen or i7 4th gen?
65737	What would be there, if there was nothing?
149299	What do you do when you have nothing to do?
63448	Why should I tip an Amazon Prime Now delivery man?
31401	"What is the correct pronunciation of the word ""via""?"
85833	What are the career prospects after doing an MS in Mechanical Engineering from Germany?
85834	Is it worth to pursue MS in mechanical engineering from Germany regarding job prospects?
36749	If 70% of a country knows a brand and we pick 10 random people. What is the probability that all of them know this brand?
36750	Why did my brother said my voice should be taken away?
251049	Why do I always end up being single?
251050	How do people end up being single?
58884	How do I stop thinking more?
508356	Is the culture of playing the victim on the rise?
508357	Are Indians forgetting their culture?
177382	Why are humans the only species to develop awareness?
326397	Why did only humans develop such high levels of awareness and intelligence compared to all other species on earth?
214131	What is convexity?
214132	What is a convex parabola?
434994	Who or what does Hillary Clinton and her campaign fault for their losing the election?
434995	What were Hillary Clinton's mistakes that led to her losing the election?
200390	Love Story: How can you let go of something you never had?
525076	O+ Blood Is Very Common In India Should I Donate Blood?
525077	What do you love more: your religion or your nation?
180019	I want to know, How I calculate HP in a 4 cylinder 3000cc engine?
180020	What is the architecture for developing android web app?
518479	How is internship (after MBBS) in AIIMS, Delhi?
518480	I am supposed to give USMLE. What should be better? Giving it after my 2nd MBBS or waiting till internship?
144102	What will happen to U.S. businesses if Donald Trump becomes the President of US?
257287	What are some good schools like UTI?
257288	What are the rules and regulations related to genetic testing in India?
32234	How do you scan a document to your computer?
159038	How can you find scanned documents on your computer?
350410	What is the difference between 100 point and 200 point reservation roster system and how does it affect appointments?
350411	I think abolishing these really high reservations for SCs/STs in all the leading fields is very much necessary at this point of the epoch. Am I right?
36038	What is the relationship between air density and air pressure?
36039	What is air pressure? How is it counterbalanced?
453590	As a citizen of India. What step we should take to solve the issue of brutally deaths of army soldiers and kashmiris, issue of Kashmir conflict?
453591	Do Malaysian Chinese need to take HSK (chinese proficiency test)?
207938	Will there ever be another Witcher game?
113765	What is fun for you?
113766	What do you do for fun?
301846	What is the witching hour in occult belief, and why is it at 3 AM? How does it compare to the Devil's hour?
301847	Why is 3 am called the witching hour?
512221	Why does my family member say, “I don’t want that in the morning”?
512222	Why does my family members say all I do does does does and does?
52021	When the world ends for you?
32198	How can you calculate the value of Phi?
32199	How do you calculate true value in geometry?
280978	What are some ideas for youtube videos?
344395	How is a satellite launched into orbit?
344396	How are satellites launched into orbits?
346727	Who is the dumbest actress in Bollywood?
349216	How can I change my destiny?
86200	How can we change destiny?
432892	What should I do to improve my mathematics?
224898	If death is inevitable, is it fate?
170399	Why is death inevitable?
84748	Where in the world are the most technologically advanced places?
105115	What are some OTC alternatives to Adderall?
105116	Are barbiturates OTC drugs?
79941	How do I prepare for CA-IPCC exam easily?
79942	I am a CA IPCC student. How should I prepare for the law exam?
24213	If there is a real gender pay gap, why do firms hire men at all?
24214	Is gender wage gap a myth and if so how?
409034	What is chemical composition of male semen?
322737	What does Recapitalization of public banks mean, as Arun Jaitley said in Budget 2016?
322738	Is Union Budget 2015-2016 presented by Finance Minister, Arun Jaitley a Super Budget or a Ghanta Bidget and why?
271652	Did Ingrid Bergman study acting?
271653	Where did Lee Pace study acting?
524804	Who is a good marriage counselor in Pune?
524805	Who is a good marriage counselor in London?
236330	Should I buy a Royal Enfield Classic 350?
370544	What are the pros and cons of buying a Royal Enfield Classic 350?
172995	How did your life change after getting divorced?
172996	How does getting a divorce change your life?
85998	In the BBC documentary 'Jesus was a Buddhist Monk' Jesus is said to have died in Kashmir. Do you believe it?
26762	What does it mean when Jesus died for our sins?
2657	What is the best Advantage of using Quora?
99479	I want to buy a new laptop with i5 processor, 8gb ram, 2gb graphic card, 1tb hard disk.which one I should buy?
368279	I'm planning to buy a laptop with i5 (preferably 6th gen),1Tb,Ram 4/8, 2gb graphics (Nvidia) with full HD display. Which one should I buy?
281297	Why do you need an antenna with a converter box?
281298	Why does a converter box need an antenna?
322064	How can I decrease the amount of sleeping?
322065	Is it possible to reduce the amount of sleep I need every night?
95230	How can I prepare for Infosys interview?
408867	What can i do to be clear in my thoughts, i dread trying new things and the things once i was good at?
408868	How should I know what I am good at? I am almost good at everything and nothing! I tried many thing and give up so fast. When I was a kid or when I was at school I was always among the top students.But whenever some one asked me what do you want to be in the future I didn't know what to say!
79212	What is the 4th law of thermodynamics?
498531	Free dog training ebooks download?
498532	Are there any good free dog training ebooks?
498826	What causes rectal pain?
498827	What causes ovarian pain?
341212	What is the difference between vertical and horizontal scaling?
52164	What is the strangest thing that ever happened to you?
69302	What kind of love?
69303	What kind of job you like most?
304715	Has anyone tried cogniflex?
304716	Has anyone tried Synaptol to help ADHD?
392953	Who wrote the Indian Constitution? How were they selected to do the job?
117665	Does India need a new Constitution?
411536	What is your purpose?
411537	What is the purpose of Unacademy.in?
372564	Which is better Nirma University or Manipal University?
372565	Which is better, Manipal University or Nirma University?
84792	How do I get a entry level job in PPC without a degree? I have personal experience, certified in AdWords, analytics, Facebook Blueprint, and Hubspot.
84793	What are some interesting and knowledgeable facts about Cronus?
9933	What is the advantage of brands for using media buyers to purchase advertising space for them?
9934	Online Media: What are some possible exits for PandoDaily and why would the acquirer purchase them?
494488	What does lol yeah mean?
494489	What is the meaning of lol?
88246	How can I watch Hindi movies?
247891	What are some of the must watch Hindi movies to watch in 2015?
221503	What common questions are asked in an IT interview?
431523	Interviewing: What are the common questions asked in an interview and how one need to answer them?
425303	What is the best option after a workout: a cold water shower or a hot water shower?
8439	How can we become rich soon?
335756	How can I prepare RRB sse in mechanical?
385462	How do I prepare for RRB SSE?
86405	Why none of the questions that I post get answered on Quora?
466995	What are the failure's Govt. of Punjab?
466996	Why investors are not investing in kerala?
122502	What are some examples of phase changes?
122503	How does idfc opens account in 4 minutes?
6219	Is it weird for me to consider the wearing of a hijab by women to be sexually attractive and sexually arousing?
6220	Do Muslim women have to wear a jilbab? Is it possible to wear wide pants, and a long-sleeved thick shirt with a hijab?
377401	Should the Electoral College not vote for Trump?
377402	What happens if the electoral college doesn't vote for trump?
329012	How can I quit smoking with depression?
69652	Should abortion be legal in cases that don't involve rape, incest, or possible death of the mother?
69653	Why should abortion be allowed (except in cases of low chance of survival of child, mother or both) for rape, incest or other cases?
375351	Why to choose a treadmill for fitness?
375352	What are my birds thinking?
479408	Where can I win Pokémon GO Poké Coins for free?
168306	What is the best way to get coins in Pokémon GO without spending real money?
518463	What is different between avid learner and absolute learner?
518464	What makes a person a good learner?
49832	Which are the best places to buy cheese in Paris?
49833	What are the best places to buy cheese in Paris?
417941	What does German sign language look like, and how does it differ from Spanish sign language?
145649	What does German sign language look like, and how does it differ from Portuguese sign language?
362155	Can I make my Last.fm profile private or friends-only?
362156	How do I keep my profile private?
78749	I accidentally posted a vulgar message on a WhatsApp group. What should I do?
180733	How do I check Whatsapp messages online?
426464	How do I stop daydreaming so much?
175487	Is it possible to make an Anroid or iOS app using MATLAB GUI .m file code by generating a code for C or Java?
175488	What is the whole origin story, ideology and force of Taliban? How is it that pakistan (+ media) blames every attack on India and vice-versa?
416368	Technology used in amazon?
416369	Non muslims: What is one thing you love about Muslims?
464466	What is the most ironic thing that has ever happened to you? Why was it ironic?
464467	What is the most ironical instance that has ever happened to you?
183929	Is buying a LED TV from Flipkart & Amazon's online sales safe?
247738	Prisons and Prison Life: What’s your idea of the right woman or man for a long-term relationship or marriage?
15421	How do I solve the following problem in measure theory ?
40485	How do I solve the following measure theory problem?
420918	Which are the best online sites for dental shopping?
420919	Which are the best online sites for secure shopping?
367366	How is the word 'discrete' used in a sentence?
460562	Which is the best programming language for making Android apps?
151515	"I am a 21 year old college student, male, 84 kgs, 5'9"" and want to lose 16 kgs in 3 months. How should I do it?"
256941	What does Joshua Engel look like?
256942	What does Joshua Engel do for a living?
163646	What is the best way to wake up early for study?
148352	What are the main functions of chloroplasts?
457681	Why do you love your city? What makes it unique ?
279716	What do you love most about your city or town?
40608	What are 10 things you would tell your 19 year old self?
379234	Was the Turkey coup a hoax?
117831	Is Donald Trump going to win the election since Hillary Clinton's doctor declared that she has pneumonia?
117832	Will trump win since Hillary got sick?
139353	Why isn't studying fun?
139354	Is studying fun?
160790	Is Hakka Noodles and Chow mein same?
160791	Can you eat Taipan Chow Mein Noodles straight from the bag without cooking?
99807	How did Billie Joe Armstrong start his career?
197174	What hotel in Badrinath Hill-station would be safe for unmarried couples, without the harassment of police, hotel staff, and moral police?
241544	A question for the atheists. What would God have to do to convince you God exists?
241545	What would God have to do to convince people that God exists?
214703	What are some of the most arrogant hip-hop lyrics?
214704	Why do people like hip hop?
201370	How much does website design cost for a small business?
201371	How much does a new website design cost?
480332	Is it ok to make a wedding cake just for everyday consumption?
431317	How can I make easy crab cakes?
78895	How do I overcome doubt?
78896	How do I overcome doubt in my product?
85304	What are the best technologies available?
111285	What are the best technologies?
43328	What are some good examples of advance birthday wishes?
43329	Why does Trump wear the end of his ties below his belt line?
218840	How many fully formed corn dogs are estimated to exist at any given time?
296228	How do you know your friend is gay, without asking them?
307879	What would you do if you came to know that your friend is gay?
93557	How do you update your Yahoo mail account?
93558	What is the best way to update your Yahoo mail?
133718	Frozon thoughts Magzin?
133719	What are the three modern adaptations of direct democracy apply today?
382054	What happens when there are no more questions to ask?
382055	What happens if there are no more questions to be asked?
411922	What are some things that university students wish university professors know?
411923	What are some things all university professors should know?
200352	How can I exchange 500 and 1,000 Indian rupee notes in the USA?
189147	Has Quora now also been blocked in China?
103857	I want to make Hacks, bots, cheats for games. I know 0 about programming. What programming language should I learn as a beginning?
243486	I am currently learning different SAS modules and finding it quite interesting. I wanted to know where I can get some projects for SAS. I have the software and rights with me. What are some interesting research ideas?
2725	What is it like teaching at universities in Abu Dhabi for Expats (Masdar, Khalifa, Petroleum inst)?
2726	What is the reason for Abu Dhabi (or the Sheikh) to build Masdar City?
71345	How can I manage all my inventory in my restaurant?
322095	What is the best way to manage inventory?
424442	Is bullet pataka harmful?
424443	What kind of bullet is it?
284151	I've forgotten my Instagram password and I no longer use the email I used to create the account, how do I get into my Instagram account?
125892	How can I find app developers?
125893	How can I find an app developer?
220753	Why is the divorce rate so high among Americans?
220754	Why are divorce rates so high in the USA as compared to other countries?
18504	Can you edit an answer on Quora?
18505	Can I ask an answer on Quora?
237834	How does Vice (HBO) get the access that it does?
237835	How do journalists from VICE get their access to the sources they interview?
267395	What are the physiological causes of a fast metabolism?
267396	What are the physiological signs of a fast metabolism?
160745	Are mutual funds worth the investment?
66989	Which team in the Indian Super League (ISL) has the best fan base?
537050	How would someone start treasure hunting?
537051	The definition of people?
52895	Which Books should I prefer for IIT-JAM Physics preparation?
16187	I have got a message from the CEO of WhatsApp to remove my profile pic specially for girls because they are using it to make nude pictures. Should I remove my pic?
346273	Suggest the best one: Masters of electrical engineering(RMIT) or masters of engineering management MBA(UTS)?
346274	As an electrical engineer, should I go for MBA management or Master’s in CS?
8844	Is it possible to set Google Chrome as the default browser on iPhone and iPad?
8845	Can I permanently mute a tab in Google Chrome browser?
128477	Why my mobile keeps running out of memory if I save all I can in SD card and I am NOT installing any more apps? .I have a Samsung Galaxy Grand Prime.
128478	Switzerland free education for international students?
241065	What was Madonna's best album?
241066	Which is Madonna's best album?
96964	Why do some children send their parents to old age homes?
96965	How many old age homes are there in India?
137591	If I drive without my driver's license and get pulled over by the police, what is the worst thing that can happen to me?
83725	Why could Donald Trump cause war?
83261	What are the little things or activities that I should engage in on a daily basis to make my life better?
475063	Do you like nature? Why?
427095	How was the experience of first time sex
159432	Is it possible to know which device is using most of data when connected to Wifi?
278932	How do I get Patent Rights for my concept?
