187689	What are your top five favorite books and why ?
187690	What are some amazing facts about Africa ?
187691	What are some interesting WhatsApp conversations ?
187692	What are some hilarious WhatsApp conversations ?
187693	How advanced is Turkey compared to other Muslim countries ?
187694	How advanced is Turkey in the fields of science and technology vs other muslim nations such as Iran , Saudi Arabia , or Indonesia ?
187695	How predictive are exit polls ?
187696	Is depression getting more common ? Why or why not ?
187697	Is depression common ?
187698	How do I contact a good hacker to help me ?
187699	How come Donald Trump is winning ?
187700	I want to become a billionaire , how do I become one ?
187701	What is the best way to round to the nearest integer ?
187702	How can you round a number to the nearest integer ?
187703	What is your review of Shapoorji Pallonji Engineering & Construction ?
187704	What is your review of Shapoorji Pallonji Engineering & Construction (SPEC) ?
187705	`` How has'' `` Education for All'''' influenced education in the Philippines ?''
187706	Can iOS devices get malware or viruses ?
187707	What are some great online courses on machine learning ?
187708	How obese is Donald Trump ?
187709	Is Donald Trump obese ?
187710	What is the difference between enthalpy and entropy ?
187711	What is the difference between enthalpy and entorpy ?
187712	What are the recommended books for IIT JEE ?
187713	What are some professional visual IDE for Linux similar to Visual Studios ?
187714	Is there a very strong IDE like Visual Studio for Linux systems ?
187715	Which is the best site to book hotel online ?
187716	How can I make my first 1000 dollars ?
187717	How strong would an ant be if human ?
187718	If a human being had the strength of an ant how strong would that human be ?
187719	Is RT meant to be a propaganda channel ?
187720	Is RT a Russian propaganda channel ?
187721	What's the cheapest way to get from Mountain View to San Francisco International Airport ?
187722	What is the best way to travel from San Francisco airport to Mountain View ?
187723	What is the definition of man ?
187724	What's your definition of a man ?
187725	What happens when we dial 100 in India ?
187726	What is it like to dial 100 in India ?
187727	How do I know when a girl loves me ?
187728	How can I know my girl is loving me ?
187729	What is the main reason for breakup ?
187730	What is the main reason for a breakup ?
187731	What are the good shopping website in Australia ?
187732	What all are the good shopping website in Australia ?
187733	I am working with quality control of smart textiles . Which method do you recommend me ?
187734	What is the best way to grow my hair faster and thick by naturally ?
187735	What are some natural alternatives to Adderall ?
187736	Are there any all natural substitutions for Adderall ?
187737	What does it take to be a good computer engineer ?
187738	How can I be good computer engineer ?
187739	How do I choose a journal to publish my paper ?
187740	How does tread on tyres affect traction ? Why are slick tyres used in racing cars ?
187741	Why slick tyres are commonly used in auto racing ?
187742	How can I learn math from zero ?
187743	What is the difference between a CEO and a COO ?
187744	How can a store officer add value to a company ?
187745	How can a store officer add value to his company ?
187746	By which material , can plastic and wood be stuck ?
187747	By which material can plastic and wood be stuck together ?
187748	Do you believe Narendra Modi was responsible for riots in Gujarat or not ?
187749	Do you belive that Narendra Modi was responsible for the Gujarat riots ?
187750	What is an example of a social contract ?
187751	What are some examples of social contracts ?
187752	What are some of the best collapsed answers on Quora ?
187753	Why are some of the best answers in Quora the collapsed answers ?
187754	How do I find a job online ?
187755	How can I find a job online ?
187756	`` Why's watching foot videos'' `` different'''' to touching feet ?''
187757	Why is watching foot videos different to touching feet ?
187758	How can I make money while Iam just 14 years old ?
187759	What circumstances are the most conducive to the rise of fascism ?
187760	What circumstances are most conducive to the rise of fascism ?
187761	What should I do to be a good customer service ?
187762	What are some tips for providing good customer service ?
187763	Will time end ?
187764	How do I use the Quora app ?
187765	How should I use Quora app ?
187766	Why do so many Chinese people support their government and love their country ?
187767	If you only had one year to live what would you do ?
187768	What would you do if you only had a year to live ?
187769	How can salt cause diabetes ?
187770	Can salt cause diabetes ?
187771	What do you think of selfies ?
187772	What do you think about selfies ?
187773	How can I overcome the feeling of rejection ?
187774	How do I overcome pain of rejection ?
187775	Can I deposit 500 & 1000 INR notes in my savings account multiple times on each banking day till 30/12/2016 ?
187776	Can I deposit 500 & 1000 INR notes in my current account multiple times on each banking day till 30/12/2016 ?
187777	What are some ways to bypass an online survey ?
187778	What do you think of Rand Paul ?
187779	What do you think of Rand Paul and Why ?
187780	Things to do in Hyderabad ?
187781	What are the cool adventurous things to do in Hyderabad ?
187782	What is Balance of payment ?
187783	What is balance of payments ?
187784	Which online/offline publishing house offers the best self-publishing platform/medium in India ?
187785	What is the cure for Dry eyes disease ?
187786	What is the cure for dry eyes ?
187787	What is the difference between cost vs managerial accounting ?
187788	What is the difference between managerial accounting and cost accounting ?
187789	Do female Quorans get more followers and upvotes than male Quorans ?
187790	Why do generally girls have more followers in Quora than boys have ?
187791	What is lesbian sex like for you ?
187792	What is lesbian sex like ?
187793	Will there be another billion dollar lottery Jackpot ?
187794	Why can't we create artificial blood ?
187795	What are some songs with extraordinary lyrics ?
187796	How does the venture capital industry work ?
187797	What does it feel like to be an INTP ?
187798	Where can I buy good replica watches ?
187799	Where can I buy replica watch ?
187800	What are some tips for training for a half marathon ?
187801	Which are the stages of the Big Bang Theory ?
187802	What were the steps involved in the Big Bang theory ?
187803	Why does helium make your voice sound funny ?
187804	How does helium make a person sound high pitched ?
187805	Who is the most well known and the most famous Quora user ?
187806	Who are the most well known people that use Quora , and why ?
187807	What are some algorithmic trading strategies ?
187808	What are algorithmic trading strategies ?
187809	What is activation energy and what are some examples ?
187810	What is activation energy ? What are its uses ?
187811	What are the best programming languages to learn if you want to become an IoT developer ?
187812	What are the best programming languages to learn for developing in the IoT space ?
187813	Which Laptop should I buy ? Mac OS or Windows OS ?
187814	Which laptop should I buy , Mac OS or Windows OS ?
187815	How semaphore and mutex are implemented ?
187816	What is mutex implementation ?
187817	What should be my strategy to crack NEET 2017 ?
187818	What should be my plan as of now to crack NEET 2017 ?
187819	What are the basic assumptions of fundamental physics ?
187820	What are the fundamental assumptions of Physics ?
187821	Where can I get best festival DJ services in Sydney ?
187822	Are all cultures equal ?
187823	Is culture equal ?
187824	Why do I get a lot of gas before my period ? How can I treat this ?
187825	Why do I get so gassy before my period ?
187826	How do Clinton supporters feel about the news surrounding the Clinton body count ?
187827	Who are the most influential women who changed our world ?
187828	`` What is a'' `` fair'''' valuation for Facebook ?''
187829	What would be a fair valuation of Facebook ?
187830	Freelancers : What have you learnt in your work that others might find surprising ?
187831	Work from home freelancers : What have you learnt in your work that others might find surprising ?
187832	`` What is the story behind'' `` No Shave November'''' or Movember ?''
187833	`` What's the reason behind'' `` No Shave November , Why any other month is not a No Shave ?''
187834	Why didn't the Government of India print banknotes with QR codes on it as a measure to avoid counterfeit currency and to fight against black money ?
187835	Why didn't the Government of India print banknotes with bar codes on it as a measure to avoid counterfeit currency and to fight against black money ?
187836	In a few words , how would you describe what is happening in Aleppo , Syria ?
187837	What is the best investment options ?
187838	How do I make the best pumpkin pie ?
187839	What do girls admire most in boys ?
187840	What do most girls like in boys ?
187841	Is political correctness ruining America ?
187842	How are you today ?
187843	How are you doing today ?
187844	Can dogs and wolves understand each other ?
187845	Can dogs and wolves understand each other's body language well ?
187846	Should we build a space elevator ?
187847	Will we ever be able to build a space elevator ?
187848	Why does restaurants/food joints add service tax for take away/home delivery bill ?
187849	What does the law says for service tax that restaurants charge in home delivery and take aways ?
187850	Which bank credit card is best ?
187851	What is the slow carb diet ?
187852	What is the slow carb diet all about ?
187853	Has anyone ever met up from Quora and dated ?
187854	Why is the invention of the light bulb important ?
187855	What is . NET framework ?
187856	What is the purpose of the . NET framework ?
187857	If high power electric current can burn human flesh , what is the temperature of this current ?
187858	What is the thermal temperature of high power electric current passing through the human body ?
187859	Why do the presidential candidates even care about the popular vote when the electoral college has the final say ?
187860	When has the electoral college voted against the popular vote ?
187861	What are common early pregnancy symptoms or signs that make you feel you may be pregnant ?
187862	Why were 2000 + people sent my answer in the Quora Digest ?
187863	What does Quora mean when it says it sent my answer to 2000 + people ?
187864	What does it feel like to be burned out ?
187865	What does it feel like to burn out ?
187866	Is daily or regular masturbation good for health ?
187867	What are Superman's prime powers ?
187868	What are Superman's powers ?
187869	What is Colloidal silver (CS) ?
187870	What is colloidal silver ?
187871	What is contrast potential and kinetic energy ? What purpose do they serve ?
187872	What is the difference between potential and kinetic energy ?
187873	What are some good games to play during class ?
187874	What intelligent games we can play in class when all get bored or sleepy ?
187875	What are the best universities for doing MS in Structural Engineering ?
187876	What are the biggest lessons you have learned in the corporate world ?
187877	What was the greatest lesson you learned in the corporate world ?
187878	Which is the most dangerous chemical ?
187879	Which is the most dangerous chemical on Earth ?
187880	Why do people like sad movies ?
187881	What are the best foods in the world ?
187882	What are the best tuition agencies in Singapore ?
187883	Which is the best tuition agency in Singapore ?
187884	Is rock music dead ? Can it ever make a comeback ?
187885	Do dating apps really find a date for you ?
187886	What are the best contemporary romance books ?
187887	What are the best contemporary romance novels and what makes them the best ?
187888	Why should I consider choosing an executive MBA program ?
187889	Should I go for executive MBA or consider switching job ?
187890	Which is better Redmi note 3 or Redmi note 4 ?
187891	Which is better , Redmi Note or Redmi Note 4G ? Why ?
187892	Why is cricket not played at the Olympics ?
187893	What does it feel like to have cancer ?
187894	Is it true that Donald Trump increased the money inherited ?
187895	What should i learn if want to become a programmer ?
187896	Why is House MD better than Grey's anatomy ?
187897	Is House MD better than Grey's Anatomy ?
187898	What are some good yoga techniques for weight loss ?
187899	What are the yoga asanas for weight loss ?
187900	What do you think the world will look like in 100 , 200 years ?
187901	What do you think the future on Earth will look like in 100 or 200 years ?
187902	How can I improve my life in a year ?
187903	How can i change my life in one year ?
187904	What happens to sound in outer space ?
187905	How will Sound travel in SPACE ?
187906	What are the top high schools of the world and what are their curricula ?
187907	What are the best high schools in the world ?
187908	What are some of the benefits of the Insanity workout ?
187909	What are the benefits of the Insanity workout ?
187910	Can aluminium be welded ?
187911	How can aluminium be welded ?
187912	Do you believe in spirits ?
187913	Do you belive in spirits ? And why ?
187914	What if John C. Breckinridge had won the 1860 presidential election ?
187915	How would John C. Breckinridge winning the Presidential election of 1860 have changed the USA ?
187916	Why Indian society is obsessed with Bollywood , cricket , politics , religion etc. . ?
187917	Why is the Indian society/government so obsessed with religion/caste ?
187918	What is your favorite topic to read about and why ?
187919	What is your favorite topic to discuss and why ?
187920	How do you design an algorithm ?
187921	What does it mean to design an algorithm ?
187922	What are exothermic reactions ? What are some examples ?
187923	What are some examples of an exothermic reactions ?
187924	Where do I catch a Gastly in pokemkon Go ?
187925	Where do I catch a Gastly in Pokmon GO ?
187926	What do you use Google + for ?
187927	What is the Use of Google + ?
187928	What are some examples of pathogens ?
187929	What are early pregnancy symptoms/could I be pregnant ?
187930	What are good books to prepare for GRE ?
187931	Where can I find air conditioning service in Sutherland Shire ?
187932	Where can I find air conditioning in Sutherland Shire ?
187933	How do I prepare for TCS IT Wiz ?
187934	What is the best way to prepare for TCS IT Wiz ?
187935	Does superhuman exist ?
187936	Do superhumans exist ?
187937	What are you tired of ?
187938	What are you sick and tired of ?
187939	Is blood acidic or basic ?
187940	What makes blood slightly basic ?
187941	If light has no mass , how can a solar sail be propelled ?
187942	Which are the best universities in Germany for civil engneering for MS ?
187943	What is the difference between a prologue and an epilogue of a play in Drama ?
187944	How do a prologue and an epilogue differ ?
187945	What are the remedies for dandruff ?
187946	How do I start studying for CFA if I want it to be self study ?
187947	What is the impact of temperature on battery capacity especially Li batteries ?
187948	How does the temperature affect the capacity of batteries ?
187949	`` Is there a subtle difference between'' `` can not'''' and'' `` can not'''' that extends beyond convenience ?''
187950	`` What is the difference between'' `` can not'''' and'' `` can not'''' ?''
187951	Can the absence of time traveler from the future visiting us conclude that time traveling does not exist ?
187952	How do I impress a girl whom I like ?
187953	How do I impress the girl on whom I have a crush ?
187954	What is the best way to bypass a proxy server ?
187955	How do I bypass a proxy server ?
187956	What is a radar and who invented radar ?
187957	Who invented radar ?
187958	Can men wear pantyhose without being made fun of ?
187959	Is the journey more important than the destination ?
187960	What castes comes under obc ? Who has highest reservations in obc ?
187961	`` If an employer asks'' `` Why should we hire you ? What would be the most practical way to answer that ?''
187962	`` What is the best possible answer to the most asking interview question'' `` Why should I hire you'''' ?''
187963	How do someone can sell employee stock options ?
187964	Can you buy someone's employee stock options ?
187965	How does it feel to be under the influence of cocaine ?
187966	What is the feeling of cocaine ?
187967	Where and how is paper made ?
187968	What is paper made of ?
187969	What is your review of UPSC Civil Services Pre 2016 ?
187970	Why is there no gravitational equivalent to stellar aberration ?
187971	Why is there no gravitational equivalent to stellar abbreviation ?
187972	Which is the best assault rifle ?
187973	What are one of the best civilian assault rifles ?
187974	What are the best books C. S. Lewis ever wrote ? Why are they considered the best ?
187975	What is the best book C. S. Lewis ever wrote ?
187976	What is quantum energy ?
187977	What is quantum energies ?
187978	What are the must do courses along with a BBA ?
187979	What are the must do courses along with a BBA for better job ?
187980	What are best languages for server side programming ?
187981	What is it like to study Psychology in Heriot Watt university ?
187982	What it is like to study Psychology in Heriot Watt University ?
187983	How do you decrease the bounce rate on your website ?
187984	What can be done to reduce the bounce rate for a website ?
187985	How can a skincare app help you ? What features would you want it to have ?
187986	Did God create us or we created God ?
187987	I wonder who create whom ? God create us or we create god ?
187988	How do I seduce girls ?
187989	How can find written words that seduce a girl ?
187990	Why is sex and nudity in movies considered more unsuitable than gore and violence ?
187991	How did Kant prove the existence of an external reality if the phenomenal reality is necessarily limited by the way we determine it ? How does Kant prove that noumenal reality actually exists ?
187992	How does Kant prove the existence of the external material world ?
187993	What is a cover letter and how can you make one ?
187994	My husband was only person charged when police raided someone else's home . Drugs were found in locked safe . Can someone help me ?
187995	My husband is charged with drug charges . The drugs he is charged with were in a locked safe in someone else's house . Does anyone know about warrants ?
187996	What are the job openings after doing a B.Tech in chemical engineering ?
187997	What would be the best headphones to buy under INR 5k ?
187998	What does it actually take to become an astronaut ?
187999	What is the difference between the Army , Navy and Air Force ?
188000	What is the difference between Army , Navy and Air Force ?
188001	How could we humans achieve world peace ?
188002	How would you achieve world peace ?
188003	How many ways we can save water ?
188004	How we can save water ?
188005	What cultural value does the Asian elephant have in China and how does this benefit their conservation ?
188006	How can I control myself ?
188007	How do we improve self control power ?
188008	Which are some of the best outsourcing companies for startups ?
188009	What are some good outsourcing companies for new startup businesses ?
188010	What exactly causes addiction ?
188011	Is the Bhagavad Gita a religious text or a philosophical one ?
188012	Is the Bhagavad Gita a religious text ?
188013	How I prepare for the exam before a week ?
188014	How do l prepare for exams before 1 week ?
188015	How will spending in infrastructure impact inflation ?
188016	How does spending on infrastructure cause inflation ?
188017	How is the SI unit for energy determined ?
188018	What is the SI unit for energy ? How is it determined ?
188019	Should I remain friends with my ex ?
188020	Should I stay friends with my ex ?
188021	How can CMB be used to measure the curvature of the universe ?
188022	How can the CMB be used to measure the curvature of the universe ?
188023	What is Jared Kushner's involvement in Donald Trump's campaign ? How much of an asset is he to Trump ?
188024	How politically involved was Ivanka's husband Jared Kushner in Trump's campaign ?
188025	What is the process of buying shares and minimum amount require ?
188026	How can you make stretch marks go away ?
188027	What are some ways to make stretch marks go away after losing weight ?
188028	What are some mind blowing wallets technology ?
188029	Can India win 30 gold medals in forthcoming Olympics ?
188030	Can India win 10 gold medals in 2020 ?
188031	Why are planetary orbits ellipses ?
188032	Why is astronomy so important ?
188033	Why is astronomy important today ?
188034	What's a good GRE score ?
188035	Which is you favorite sex position ?
188036	How many articles and chapter are their in our Indian constitution ?
188037	If black is a warmer color , why are there black people in warm climates ?
188038	If black is a warmer color , why is there black people in warm climates ?
188039	What historical and archaeological proof is there for the presence of Romanian ancestors in present day Romania , before 1200 AD ?
188040	What proof is there of the presence of the ancestors of contemporary Romanians in what is now Romania , prior to 1200 AD ?
188041	How can I get started to learn number theory ?
188042	Who are the most sexiest female and male pornstars ?
188043	What is the conclusive proof of the existence of black holes ?
188044	Is there any Pakistani on Quora ?
188045	Are there any Pakistanis at Quora ?
188046	If I were to hypotheticaly post someone's IP address on a 4chan public board , what would happen to them ?
188047	What happens if I post someone's IP on 4chan ?
188048	How do converting used motor oil to diesel oil ?
188049	How do converting waste lubricant oil to diesel fuel ?
188050	How can I repair a corrupt file ?
188051	How can I repair a corrupted file ?
188052	What do you think about the cause and effect in celebrities scandals ?
188053	What do you think about the cause and effect of celebrities' scandals ?
188054	Why does eating chocolates make you happy ?
188055	How does eating chocolate make you happy ?
188056	Will we be able to stop aging ?
188057	Why is the Affordable Care Act relabeled as Obamacare by some people ?
188058	`` Why do some people refer to the Affordable Health Care Act as'' `` Obamacare'''' ?''
188059	Why do we have to pay service tax in restaurants for take-out ?
188060	When should we pay service tax in restaurant ?
188061	What are some habits of highly effective people ?
188062	How do eyes work ?
188063	Can my height stop increasing by lifting ?
188064	Do indian girls masturbate ?
188065	Do Indian girls masturbate ?
188066	What are your views about this Morgan Freeman quote about Racism ?
188067	Is it really true that nice guys always finish last ?
188068	Which is the best sport for analytics ?
188069	Which sport is best for analytics ?
188070	Is Donald Trump right that CNN is biased against him ?
188071	How do I eat pussy ?
188072	What is the best way to lick pussy ?
188073	How do I get rid of wrinkles and bags under my eyes ?
188074	What has been the biggest achievement of AAP in Delhi till now ?
188075	Why did Quora take off , whereas Yahoo! Answers could not ?
188076	What will happen to the value of the rupee because of the invalidity of 500 and 1000 rupee notes ?
188077	What are the best tongue twisters ?
188078	Why do Japan and the USA have good relations if the Japanese killed thousands of innocent people at Pearl Harbor and the USA bombed Japan with nukes ?
188079	Why do you think about DOTA2 ?
188080	What is the best song of Linkin Park ?
188081	What is the best Linkin Park song ?
188082	What are the main characteristics of a gothic story ?
188083	What are the primary characteristics of gothic literature ?
188084	What's Plagiarism Checker ?
188085	What is a plagiarism checker ?
188086	Why are Directive principles of state policy always being compared to the fundamental rights ?
188087	Why are Directive principles of state policy mostly being compared to the fundamental rights ?
188088	What happened to the Yulin Dog Meat Festival 2015 ? Did all the petition signing help ? Did it stop ?
188089	How can the Yulin dog meat festival in China be stopped ?
188090	Does red bull drink contain bull sperm ?
188091	How does soil fertility decline ?
188092	What are the best resources for self studying machine learning ?
188093	What is the internet ? Can we build another one ?
188094	Can we create another thing like internet ?
188095	How can I improve my logical skills for programming ?
188096	What will happen if Pakistan and China declare a joint war with India ?
188097	If all 500 and 1000 notes were in circulation comes back to banks then how is demonetization a good step against black money ?
188098	How do the waves spread through emptiness ?
188099	How do waves spread through emptiness ?
188100	How can I stop being so rude ?
188101	How much can you charge for a website ?
188102	How much I can charge for a website ?
188103	What sorts of things do people often pass down from generation to generation ?
188104	What sorts of things do people often pass down from generation to generation ? Why ?
188105	How do we know if a person is suffering from HIV or AIDS ?
188106	How do we now if a person is suffering from HIV AIDS ?
188107	What are some best tourist places near Kanniyakumari ?
188108	What are the best travel places in and around Kanyakumari ?
188109	How can you learn organic chemistry ?
188110	Who would you recommend me to write a CV/Cover letter for a software engineer ?
188111	What should I do after Btech Biotechnology ?
