93903	Who is the founder of OSBN®?
341988	Who is the founder of yiest?
70390	Why do I feel like crying but can't?
70391	Why can't boys cry?
337060	What is the cheapest whey protein powder available in India?
337061	Where can I get good quality and cheap whey protein in India?
480238	By what date do I have to apply for ifoa student membership, if I want to sit for September exam diet?
480239	What can Japan do to become more sustainable?
480202	What is the best way to earn, certification or job experience?
480203	I only know that I want a high earning role with progression. I only have customer service experience. What is the best strategy when job searching?
100253	What things should people check for when buying a used bicycle?
100254	What are some common things to look out for when buying an used bicycle?
5652	How good is Elon Musk in engineering and technologies?
5653	Is Elon Musk a good engineer?
72063	What is a website where I can download eBooks legally?
439780	What is the difference between industrial psychology and corporate psychology?
410100	What is your review of Hema Malini (Indian actress, director and producer)?
221705	What are some ways you are privileged?
378365	How can I get a job after graduating from Coding Bootcamp?
378366	Can you have a job after graduating from coding bootcamps, if you don't have a degree?
325114	What is the best way to prepare for ICSE board exams?
268791	How can one prepare for the ICSE 10th board examination?
415108	How is it possible that a storm trooper is black in The Force Awakens? How is Finn black?
310617	Will Lando Calrissian be in Star Wars: The Force Awakens?
435061	I am expecting 115 marks in the CMC Vellore exam. I am from a reserved category (SC). Is there any chance for me to get an admission in there?
435062	I got a 91 in Mains and am expecting 95% in the board SC category. Can I get a seat in any NIT?
123610	What courses I should do after MBA ?
121396	Whom do you think are the capable candidates in Democratic Party to run for the President in 2020/2024?
131450	How can I rank a website, in a fair time frame,if the industry is highly competitive? Any special activity/task that needs to be considered?
131451	How can I make a website that allows a user to upload a file at his subdomain? The file needs to be converted to PDF if it is DOC. Should I choose ASP.NET or Drupal?
109919	"What are the major themes of ""The Castle of Otranto,"" the 1764 novel?"
109920	What is the theme of the novel Persepolis?
437882	What is the best thing someone can do to help manage their partner's depression?
437883	What is the best thing someone can do for all of their followers with depression?
395099	What is private sector housing?
119922	What are the best options after Bsc in physics?
294119	What would happen if I put a burning matchstick in the petrol tank of a bike/car?
294120	What  reaction will happen if sugar is added to a petrol tank (bike)?
306191	What is the average weight of an Apple?
306192	What is the average weight of a hippo?
75952	My palms hurt when doing pull ups, how do I prevent this without wearing gloves?
75953	"Can I do ""pull ups"" with a dumbbell?"
269457	"Why do some people use ""…"" at the end of all their sentences?"
269458	"Why do people on Quora use "":)"" aka a smiley often at the end of each sentence? Is it passive aggression?"
264155	What gaming laptop under 60k should I buy?
228751	Can I have a list of start ups or mid size companies in identity and access management domain?
228752	Which are the best startup companies in identity and access management?
405531	Can we make fully independent solar city?
405532	Can we make deuterium?
155236	How can I change my lifestyle?
155237	How do you change your lifestyle?
461935	What are the legal protocols for ambulance in India?
461936	Do ambulances get involved in accidents as well?
447222	I come from a middle class family and also want to study in the US, even though I know I can't afford it. Right now, I am doing economics honors. What should I do?
447223	I am from a middle-class family.I want to do diploma in biotech in abroad but I can't afford such huge tution fees.what should I do?
389276	What measures or awareness should take to prevent accident caused by lighting strike specially countries like Bangladesh?
389277	What were the most provocative marketing campaigns known to succeed, measured by brand awareness metrics?
378405	What are the best high-end preschools in Orlando? What makes them good or special?
286877	How can you prepare a 10% Sodium Hydroxide (NaOH) solution?
286878	Is sodium hydroxide an acid or a base? Why?
267914	I don't believe in God. Why?
472509	How should I prepare and what are materials to refered for WAT/GD/PI for IIM PGDM selection process?
232936	What is the best way to prepare for the second stage of the IIM selection process?
459449	Why isn't the US dollar even stronger?
318561	Why is the US dollar stronger than the other currencies?
367428	What are Schubert's top, say, 15 most famous lieder?
367429	What were Tchaikovsky's best songs/lieder?
234069	What are some fonts like San Francisco? I have heard it's nearly identical to Roboto. Roboto isn't everywhere, but Segoe UI looks similar.
224361	What are the best Grindr hacks?
445762	As a manufacturer, how do I determine the discount rate for wholesale?
445763	What is a discount rate?
13959	If I have an idea for a video game can I sell my idea and get paid for it?
490887	I run games with low settings at 5 FPS. Do I need a new computer?
210636	Is America likely to go to war with Syria, and by extension Russia, if Hillary Clinton wins the election?
333593	Graduate student should choose what kind laptop?
333594	What is the largest pumpkin ever grown?
171897	How do I become a conductor engineer?
171898	How do you become a conductor?
10580	Are Monsanto crops banned in Canada?
10581	What are some crops that can be planted in the winter in Canada?
150055	What is the remainder when [math]13^{80}[/math] divided by 17?
268724	What is the remainder when 2^33 is divided by 27?
213290	I will take the IELTS next month. How do I get a higher score?
213291	How can I get a score of 7 in the IELTS speaking test?
386001	Where would we be now if slavery and the pillaging of a country's resources for another's benefit never occurred?
386002	What would had happen if a politician in another country would have had (a country where things work properly) Berlusconi situation's? How the system justice works?
34392	When is the IBM off campus drive for 2016 batch?
34393	When is the deloitte off campus drive for 2016 batch?
518199	What is the best way for a girl to make a guy realise his mistake after he cheats on her?
43482	What are some mind-blowing Drivers accessories that exist that most people don't know about?
45220	Which is the best activity of SEO on page?
205537	Why is metallurgical coal different from thermal coal?
205538	How is metallurgical coal different from regular coal?
527497	How do I delete my Yahoo account?
534934	How much money is sufficient to live a peaceful life?
534935	How much money do we need to live life happily?
432337	"How many copies of ""Fear and Loathing in Las Vegas"" were sold over the years?"
432338	How much of fear and loathing is true?
398722	Where did you grow up?
308248	What is the profile needed to get into Cornell in an MS in engineering management?
308249	What is the job profile of someone with an Engineering Management degree?
401765	Who is your favorite Bollywood actor ?
17989	What does it mean when you dream about your crush talking to your mom?
17990	What does it mean when you dream about your crush's mom?
250360	How should I overcome nervousness of driving?
198253	How do I overcome my nervousness for my exams?
525789	Why is the ratio of males to females 1:1?
525790	What would you do regardless of your gender, if you found out that the company you are working at has the male to female ratio skewed at 9:1?
239620	What was the most delicious / exotic food you have ever eaten?
239621	What is the most exotic food you have ever had?
361676	Can two saving bank accounts be open under the same CIF number?
135912	As a venture capital investor, if you had an opportunity to invest in Snapchat but passed, what was your rationale?
317727	Do gravitational waves travel faster than the speed of light?
317728	If space can expand faster than speed of light, then could a gravity wave travel faster than the speed of light as it's a ripple in space?
44824	What is VDerma Revie?
44825	What is VDerma Revi?
519158	"How do I remove virus from Microsoft Edge browser namely ""evotracker.in""?"
519159	"How do I remove virus named ""evotracker"" from Microsoft Edge?"
27300	Why is there such a high rate of ticket cancellation in the Indian Railways?
27301	Why is there such a high rate of ticket cancellations in the Indian railways?
110845	How can I increase traffic on my blog on Blogger?
347127	Are there any family offices that invest in more speculative investments, i.e. non-revenue generating assets with long term appreciation potential?
347128	How Descartes' “cogito ergo sum” affected Kant's and Hume's transcendental philosophy?
207363	How could you know if a guy is serious about a girl?
207364	How do you know if a guy is serious about you?
27791	Where should I start coding?
368925	How should I start coding again?
181878	From which book I should read the extra necessary informations for neet which are not in NCERT?
443540	"I've taken a drop for NEET 2017 & joined Aakash. Apart from NCERT and Aakash material, which ""good"" reference books should I buy for MCQ?"
428143	What is the minimum amount of money an author can get if one of his books becomes a New York Times Bestseller?
41681	How much did Uncharted 4 cost to make?
106591	How do Toto toilets compare to Kohler toilets?
106592	Where can you buy Toto Toilets?
296732	Why are so many people on Quora from Silicon Valley or India?
296733	Why are so many people in Quora in/are from Silicon Valley or India?
419877	Can you name the female body builders with huge clits?
419878	I just started a company, in my country they register companies with numbers and if you want a name you have to go through a huge bureaucratic process, do you think I can use the name with clients while it is a number with the government?
408000	How did Betaworks start? How did they get initial funding?
408001	What are competitors to betaworks?
335096	How can I learn econometrics?
335097	What is the best way to learn applied econometrics as a beginner?
314387	Do recruiters pay recruiting agency in advance the charges of recruiting agency or after the selection of the candidate?
314388	What is the best IT-recruitment agency in Amsterdam?
156838	How do I get investor for application?
156839	How can I get investors?
179354	What are good universities for masters in electrical engineering in USA?
179355	What are the best universities in USA for doing a Ph.D in electrical engineering?
278243	What is the meaning of Tamil word 'Ingeva'?
520964	Which is more basic pyrazole or pyrrole?
330035	How can I make friends if I am an introvert?
462921	What documents does an immigration lawyer provide for an LCA - E3 Filing?
462922	What can happen legally if you don't provide all the documents for an SSI redetermination?
294763	I am 170 cm on wall and when I am standing still I am ONLY 166 cm, will I stay like that if my bone structure has finished?
294764	Are Navy Corpsman always with the Marines in their unit between deployments?
485229	Who is paying for Trump's post-victory tour?
36901	What's your favorite song - top 5?
161347	Which are the top Korean songs of 2016?
79587	What if Messi and Ronaldo played in the same team?
169982	How do I know if a WhatsApp number is fake or genuine?
169983	Can I find out if a WhatsApp number is fake or genuine? If yes, how?
147925	What's the most embarrassing thing your friend has said in front of your parents or family members?
326172	How long should you wait for a patient in coma to recover?
326173	How does it feels to be in coma for a long time?
83646	How do I check my voicemail online?
71100	How do I check my T-Mobile voicemail online?
513150	What will be the legacy of Donald Trump's 2016 presidential campaign?
535594	What will be Donald Trump's legacy?
235913	Which is a good inpatient drug and alcohol rehab center in Logan County CO?
283458	Why does observation is important in life? Can you relate any stories or incidents on this?
283459	How much energy from matter?
274124	Which countries don't have paid maternity leave?
274125	How should I negotiate maternity leave for a new job?
80728	How do you unlock an iPhone 5 for free?
155006	Does Saturn in 3rd house indicate business? ( Capricorn lagna)
155007	What is the interpretation of Mars, Venus and Saturn in Capricorn and in the third house?
355884	What is the difference between half wave and full wave voltage doublers?
248124	I want to write using the mouse instead of typing. Which program should I use?
290764	I want to build my own data website. What type of programming language should I use to make it?
389102	What changes have to be made to make AC motor a DC motor or vise versa?
363535	Who recommends additional interviews at Google? The hiring committee, the interviewers or the recruiter?
363536	Do recruiters present all applications to hiring committee for review? If my recruiter says that she will present my candidacy to hiring committee for review, can I be sure that I did fairly well in my onsite interviews?
210171	Which is a good inpatient drug and alcohol rehab center near Camden County GA?
308314	Which is a good inpatient drug and alcohol rehab center near Baker County GA?
128992	What are the best resources to learn French online for beginners?
190260	How do New Zealanders view Indians?
190261	What are the opportunities for Indians to start businesses in New Zealand?
65222	What are the problems that India is facing?
346078	Why India cannot be a superpower by 2030? What are the major problems India is facing?
112930	What is the horsepower of TOSA electric bus?
112931	Can a bus local bus ticket be reused?
335739	Why do plants need both mitochondria and chloroplasts?
325812	Can anyone give me a good example of how wireless network virtualization actually work in real time situations?
325813	Can anyone give me a good example of how wireless network virtualization actually work in real time situations? N?
245761	Can nano GPS chips made in such a low cost so that it can be embedded in all rs.2000 note?
368617	What are some good open source projects for undergraduate beginners?
419253	What are some modern examples of government corruption in France?
177676	How can I appear offline on whatsapp?
471424	How do I save songs offline in Apple Music (Android App)?
500988	What are things that you want to do but will probably never do?
186731	What is something you want to do, but would probably never do?
472269	Can we change our subject after class 11 CBSE?
477749	What are good Day 2 and Day 7 retention rates for a Social Game on Facebook?
477750	Is D1 and D7 retention for social games critically dependent on how you acquire users?
465910	What is average salary for a electrical Engineer in Curitiba, Brazil, with 4 yrs of experience?
465911	What is the average salary of an electrical engineer in Toronto with 4 years of experience?
508339	"Oprah said, ""in the age of Facebook, have face-to-face conversations even with people you disagree with."" Do you agree with her or not?"
508340	In a question of 'To what extent do you agree or disagree with this opinion?', are the first three words important? How would you respond to them?
513679	Your choice for consistent, reliable car repair and maintenance services. This is the right place with affordable prices.?
513680	Application in function in real world?
240563	What was one story idea that was really interesting but you never pursued to write?
240564	Can I get someone to write a story from my idea?
384158	Can Hulk destroy the universe?
384159	Could a technologically advanced Borg gather all the water in the universe and destroy it and ensure that the universe can never make more?
36198	What are the biggest misconceptions that Indian have about Pakistan?
310518	What are the biggest misconceptions that Pakistanis have about Pakistan?
61738	How many packages are shipped through Amazon per year in the US, and how has that number changed since the company's foundation?
61739	How many Amazon packages are delivered per day, and what percentages of the total are delivered domestically in the US and internationally?
471491	What is the gauge size of a normal ear piercing?
471492	Is it normal that my ear is purple after a cartilage piercing?
295984	SQL: What does DROP do?
295985	SQL: What does DROP TABLE do?
503772	What are some funny stories of your childhood?
503773	What are some funny incidents from your childhood?
372038	How can you be more sarcastic?
164613	Sarcasm: How can I become more Sarcastic?
423188	How do I retrieve a WhatsApp message from someone's phone?
383508	Why is pseudoscience more popular than real science in America?
383509	It’s important to learn about other cultures?
490548	What are some useful iPhone apps? Why are these apps useful?
284388	Should we remove caste based reservation system from India and establish economic position based reservation?
284389	Isn't it time India change its reservation policies from implemented on caste basis to based on financial backgrounds?
175865	How can I be happy? (read details)
175866	How can I be happy from within? Read details.
144790	What is the corporate culture like at Regency Centers? How is the culture different than other companies?
144791	What is the corporate culture like at Rent-A-Center? How is the culture different than other companies?
291414	All gay guys teeth really big?
291415	Is it just me or are all gay guys teeth really big? Request
345819	What is it like to meet Ellen DeGeneres?
345820	Is Ellen Degeneres an atheist?
412751	How far can our eyes see?
412752	How far our eyes can see?
264540	How true to life is the game World of Warships?
264541	How accurate is World of Warships?
262815	How can you calculate the average human heartbeat?
262816	Any private investigator interested in business coperation?
325333	Does the human body keep pressure in a vacuum?
325334	In a fight between the Marvel characters Quasar and Graviton, who would win and why?
113228	"Why is the line ""but I was going to Tosche Station to pick up power converters"" so iconic for people?"
202734	What are the best books on mythology?
202735	What are the best books on water mythology?
196272	What are some examples of using/leveraging technology for profit?
196273	What are good examples of small profit services?
206817	What is normal libido for a 20-year-old man? How often should he want to ejaculate?
206818	What books relating to finance should a 20 year old read before he starts working?
46474	How can I learn the marketing skills?
118073	Would Manchester United fans love to see Liverpool relegated to League One?
118074	How can I help Manchester United as an average fan?
526486	"What do you think about this short film ""The Victim""?"
513935	What do you think about this short film?
402057	I am going to organising an party, for that I need to clean my home on or before 31/12/2017. So suggest me cleaning service company in Perth?
402058	What is the best (and unexpensive) website builder platform according to Google criterias?
237011	Why do I keep losing things at home, and finding them the next day exactly where I'm perfectly 100% sure I checked?
237012	Where can I find last 10 years solved AIPMT papers?
222713	How do I find Odisha vloggers to support in YouTube life?
222714	Do I have to have an exciting life to be a vlogger?
156554	What steps should you take to buy Cialis?
156555	Where can I buy Cialis?
115740	Is bee honeycomb edible, and tasty?
470434	Do queen bees sting?
519239	How do I learn acting at home?
519240	How can I learn acting at home?
174787	Which company tyres are better MRF or CEAT for two wheelers?
122206	Which tyres are better MRF or Ceat?
498649	What is the country located between Poland and Lithuania?
498650	Which country owns the region between Lithuania and Poland?
33281	If Hillary wins the Presidency, is there any rule to prevent a Republican Congress from obstructing all Supreme Court nominations for 4 years?
243252	Why so many luxury cars register in Pondicherry?
186756	What is the best instant coffee?
186757	Beverages: What is the best instant coffee?
166388	What should be my first move after moving from New York City to Miami?
282219	I am a foreigner and I don't understand this thing of mocking Trump. Why do some people from the US make fun of him/hate him?
113160	Do you like to smell your own fart?
113161	Do people love the smell of their own farts?
507795	What is the proof of the existence of space-time fabric?
507796	What is space-time fabric?
371634	How do you get lean?
371635	How can I get lean legs?
42916	What is the average salary for a Senior software engineer in Amsterdam with 10+ years experience?
42917	What is the average salary for a Senior Software Engineer in Norway with 10+ years experience?
425190	How do I create a dataset for a neural network for path planning application?
425191	What are the major factors that motivate us to use Neural networks over Kernel methods for large datasets in layman terms?
127742	How can we find the best SEO service provider company in India?
127743	What are the best local SEO companies in India?
132560	Which is the best brand in roller skates available in India?
132561	What is the best roller pen in India?
519832	How do you get back deleted photos on keep safe?
519833	How can I get some good and short comic scripts, to be performed at my work place?
441136	Why is Saraswati worshipped?
441137	How is Durga worshiped?
78379	When do you know if it's time to divorce someone?
430417	Is Donald Trump a Machiavellian?
430418	Is Donald Trump a blowhard?
489415	Which text is recommended for self study (questions/answers) of Stochastic Processes?
489416	Which is better to use rule- or ML-based text classification to analyze questions for building a NLP question answering system ?
419853	Are any instant soups healthy?
263634	What is the foster care system like?
263635	How does the foster care system work?
363528	What is your review of Deloitte Consulting India Pvt. Ltd.?
363529	Why is Deloitte India considered among worst companies for engineering graduates?
63983	How can I get quick web design clients?
535375	What are the different parts of a nucleotide? What are their individual functions?
535376	Do ONGC allot newly recruited individuals to tatipaka refinery? If else how is that process?
291786	Is it true that Sufi version of Islam was heavily influenced by Hinduism?
442713	Should Quora add more characters for details?
81665	If the sun is in space, why is the universe so dark?
81666	Why is the universe so dark?
62835	Have you done sex with your mother or father? Do you feel guilty?
448891	Would you consent to your wife having sex with another man for a week if she were to receive a million dollars?
87311	What is sistine chapel?
87312	Why is the Sistine Chapel so famous?
280502	How do I lose man boobs?
448190	How do I install Roblox on Mac?
448191	How do you install a PS1 emulator on a Mac?
251843	How do I draw a velocity and acceleration diagram?
382677	What is cotton candy made out of?
517618	Is it better to commit random acts of kindness or deliberate ones?
479354	Is it rational to do random acts of kindness?
194534	Which is the best book to buy to learn digital marketing?
222689	Electrostatic mental thought caused eyeglasses with silica dust to show my eye pupil and iris imprinted on the eye glasses next day. Science advise?
386672	When I shine UV(A) light directly into my own eyes, my eyes - including my pupils/iris etc. - all turn pure white. In this normal?
108453	What are some of the most realistic films ever?
108454	What is the most realistic narrative film ever made?
222256	What would happen to Earth's ecosystems if all house flies suddenly died?
222257	What would happen to earth's ecosystems if Godzillas were real?
225214	What is a training data set & test data set in machine learning? What are the rules for selecting them?
225215	"Machine Learning: Is it the end of the training set/testing set paradigm?"""
220242	What do investment banks do?
220243	What is investment banking like in London?
63275	What limitations are there on the power of the legislative branch?
136957	How can the president limit the power of the legislative branch?
41644	How do i get job in Bangalore ?
41645	How you can get job in Bangalore?
101917	Which is the best website to learn world war history?
101918	What battles, prior to World War One, did most to affect the course of human history?
134030	What's the best question to ask in Quora?
384302	What is a better choice- maths and computing or economics?
384303	Should I get a Master's degree in Economics or Statistics?
426612	What traffic laws in Luxembourg are particularly hard for foreign drivers to get used to?
219496	Which character do you like most in Game of Thrones? Why?
456228	Are there natural remedies to stop the hiccups?
227314	What are the causes and remedies for hiccups?
145879	Is ISIS worse than the Nazis?
463748	Which group is worse: Boko Haram or ISIS?
475491	How come fibre reinforced composites behaviour depends upon the direction of loading?
475492	How do I calculate the fraction of energy being absorbed individually, when a composite (ceramic + foam) is subject to impact loading?
349636	What is social injustice today? What are some examples?
118975	Is there any nude beach in India?
396427	How is Modi different from Kejriwal?
396428	How is Kejriwal different from Modi?
383165	Why do we normalize the data?
