284737	I am a YouTube creator and I want a best budget canon or Nikon DSLR under Rs .40 K for tech video capturing , So which one is the best in the market ?
284738	Does Ashwagandha powder increase weight ?
284739	Is D3.js or Highchart.js better ?
284740	How do I integrate D3.js with SSAS cubes ?
284741	How does demon possession happen ?
284742	Is there scientific evidence of demons and demonic possession ?
284743	Is Islamization of Europe a real threat ?
284744	What is biological psychology ?
284745	`` What does'' `` biological psychology'''' mean ?''
284746	In reverse gear , what will happen if I turn the steering wheel to the right side and vice versa ?
284747	How do I install and use mazar by sending a text ?
284748	How can I (randomly) select a list entry from a text list and send myself an SMS ?
284749	How can I see connected devices to my Mobile hotspot ?
284750	Why do I lose my internet connection through my mobile hotspot when I receive a call ? I use Airtel 3G ?
284751	Which subject should I take with PCM class 11 ?
284752	Hi . . i was offered an IT recruiter job in a global IT company . . what is the scope of this post in Indian IT industry ?
284753	Can I shift to medical from Engineering ?
284754	Does fission occur in the Sun ?
284755	What is the meaning of simple fission ?
284756	Why stack on ; y is used for to evluate the expression in the postfix ?
284757	If I download movies or games using utorrent in Delhi , India , is it illegal or is there any fine I have to pay if they track me down ? Is this true ?
284758	What are some examples of individual contributor jobs in the IT industry ?
284759	What is a better position in a company : being an individual contributor or a manager/lead ? What are the risks of being in a managerial position in terms of job security ?
284760	How do feel about the new Google inbox design change ?
284761	What is new about ` Pixel' by Google ?
284762	Is it a good idea forcing Redis cache on my new E-commerce framework ?
284763	The E-commerce business is booming in India . How good is the idea of e-commercing foods or processed food products in India ?
284764	What are the basic ideas in computer networking ?
284765	What are basic computer books ?
284766	How do I download datastructure and algorithm best book for self study ?
284767	Can I get an Australian student visa from the USA ?
284768	What is the best way to survive life ?
284769	How do you survive in life ?
284770	What are the symptoms if your baby has eczema ?
284771	What are the symptoms of eczema ?
284772	What causes this sensation in my hands when I pee ?
284773	What could cause a sharp pain in the right upper rib cage area ?
284774	Is Gronkowski the best tight end to have ever played in the NFL ?
284775	Who is the best tight end in the NFL right now ?
284776	What are some interesting startup opportunities for international arbitrage ?
284777	What are the best arbitrage opportunities right now ?
284778	What is the most disgusting / disturbing thing you have ever done or witnessed ?
284779	How do you ionize salt ?
284780	What does ionized salt look like ?
284781	What's your view on recent disturbance of intolerance in the nation in india ?
284782	Is India becoming a more intolerant society ? What changes can be made to stop this transition ?
284783	How can you burn calories while studying ?
284784	What is the area of a square inscribed in a circle , which in turn is inscribed in an equilateral triangle of side ` a' ?
284785	Four parallel lines are drawn parallel to one side of an equilateral triangle such that it cuts the other 2 sides at equal intervals , the area of the largest segment is 27 msqr . What is the area of triangle ?
284786	How do I convince parents if you want to study abroad ?
284787	How do I convince my overprotective strict parents to let me study abroad ?
284788	Why was Hulu Japan sold to Nippon TV ?
284789	Why did Hulu choose Japan for the first overseas advance ?
284790	Is it normal to feel nauseous all the time ?
284791	What is topological ?
284792	What is topological order ?
284793	What is a wedding registry and are people required to have one ?
284794	`` What is the origin of the word'' `` sequence'''' ?''
284795	`` What is the meaning of the word'' `` sequence'''' ?''
284796	When I sing high notes , a lot of mucus instantly materializes in my throat/mouth . Does this have anything to do with my singing ?
284797	What are some vocal exercises designed to help sing high notes ?
284798	`` In which situations do you think or say ,'' `` I'm too old for this (shit)'''' ?''
284799	Is it best for the age of conception to be lower or higher ?
284800	Should the age of majority be lowered to 12 ?
284801	Which one is correct who are ?) Or whom are you ?
284802	Which one is correct : they were came or they are came ?
284803	Does minor shoulder dislocation affect your ability to do push ups ? I'm able to lift dumbell and stuffs but not push ups ?
284804	What is difference between wave velocity and particle velocity ?
284805	What are the poems you have ever written ?
284806	What is an Application Program Interface (API) ?
284807	How does application programming interface work ?
284808	How do you install Adobe Flash Player on a Samsung Smart TV ?
284809	What smart TV plays flash ?
284810	What are some tips on making it through the job interview process at Home Properties ?
284811	How can I recover files that seem to have disappeared ?
284812	How do I get job in a football club ?
284813	How can you find a Korean pen pal ?
284814	How harmful is 1-2 cigarettes in a week ?
284815	How harmful could it be to have a headaches for 2 weeks ?
284816	As a venture capital investor , if you had an opportunity to invest in Dropbox but passed , what was your rationale ?
284817	Why did people create God ?
284818	What are the laws to change your status from a student visa to a green card in the US , how do they compare to the immigration laws in Chile ?
284819	What is the best graphic design tablet ?
284820	What is a good graphic designer ?
284821	How does one read input until end of file/end of line in C++ ?
284822	When reading a file using C++ , how do I skip n lines ?
284823	Do you think Lionel Messi or Cristiano Ronaldo can get the same success if they were in the Premier League ?
284824	What is best treatment/exercises for lumber stenosis and calf muscle wastage ?
284825	Where can I buy International designs of Sofas in India ?
284826	What is document cryptography ?
284827	What is cryptography ?
284828	What are ancient folk tales ?
284829	What are some interesting folk tales ?
284830	Will low level clashers catch up with high level clashers ?
284831	How can we prove that transverse sections remain plane in a member subjected to pure bending ?
284832	China's industrialization is over , is it a developed country now ?
284833	Is it necessary for countries to argue over the South China Sea ?
284834	What is a list of the best songs from Disney Channel ?
284835	When did Travelzoo launch its IPO ?
284836	When does TravelZoo update ?
284837	How much money does Apple have ?
284838	How much money does Apple currently have ?
284839	How do I invest in the stock market ?
284840	Generated OTP multiple times over two days and have still not received the code . How do I get the Reliance Jio sim otherwise ?
284841	Why are hotdog or pie eating contests , celebrating dangerous levels of gluttony , allowed in public venues where children under 21 are present ?
284842	Is there any way to stop those credit card robot telemarketers from calling ?
284843	How does one connect their React app to a backend ex : (Node + Express + Postgres) ?
284844	I want to build a social app using React Native , Node and Mongo . Do I need to know React.js / Redux/Flux/HTML / CSS/Jquery ?
284845	What is a good PSAT score for an 8th grader ? I got a 1180 .
284846	Is a 1440 on PSAT good for a 10th grader (2016 new psat) ?
284847	How's is working environment in price water house coopers ?
284848	What competitions currently have the largest prize money for an individual or very small group ?
284849	Can someone see it if I continuously request to follow them on InstaGram ?
284850	Did Bal Thackeray copy Hitler in his speeches ? If so , how and what part ?
284851	Why did Hitler make his moustache like that ? Did he copy from Charlie Chaplin ?
284852	What size of pressure cooker is best ?
284853	Do you have a pressure cooker ?
284854	How can I play Minecraft Indev for free ?
284855	How do I play Minecraft ?
284856	Why is the electoral college necessary ?
284857	Is the electoral college necessary ?
284858	What is 3D ?
284859	What is 3d digitization ?
284860	What is curing of concrete and which is the best way to cure a concrete in a shorter time period ?
284861	How long does it generally take concrete to cure ?
284862	What is the Google Play store ?
284863	What is Google Play ?
284864	Which brand has the best treadmill ?
284865	What are some good treadmill brands ?
284866	Can I lose weight just by eating normal Indian home cooked food , coupled with about half an hour of running every morning ?
284867	Real Estate Rentals : Is there any place to rent a Houseboat in the Los Angeles area ?
284868	What is the corporate culture like at Nuance Communications ? How is the culture different than other companies ?
284869	How is NUANCE for freshers to work for ?
284870	What is the best way to do an N.A.P. for a professional who wants to rank for his personal name and his business name ?
284871	Do domain name effect SEO and Google ranking ?
284872	in my country I have 3 years driving experience but didn't drive Uber , can I drive Uber another country ?
284873	Can I drive for Uber in New Zealand while I am visiting on a tourist visa ?
284874	`` Why is'' `` Guernica'''' by Pablo Picasso important ?''
284875	`` What inspired'' `` Guernica'''' by Pablo Picasso ?''
284876	How do I get Australian skilled visa quickly and easily ?
284877	Karachi won't allow you to live a good life ?
284878	Would you give up Singapore citizenship ?
284879	What are the pros and cons of giving up Indian citizenship , emotional aspects of it aside that is ?
284880	Should you whiten your teeth with a banana peel ?
284881	What is your review of Hult International Business School ?
284882	How is Hult International Business School , Boston MA ?
284883	Is there any IIScian who has gone for the CSE ?
284884	What are the placement records for integrated course (software eng) in VIT ? Can we get jobs like the normal CSE students ? Are we at a disadvantage ?
284885	What are some accessories that would be perfect with this latex maids outfit ?
284886	What accessories would be perfect with this latex maids outfit ?
284887	What are the best resources for learning Ruby ?
284888	What are the best resources for learning Ruby on Rails ?
284889	Do actors in Hollywood really smoke cigarettes if the scene requires them to ? Or is it just another act ?
284890	Have Hollywood actors ever actually had sex in a sex scene without the crew knowing about it ?
284891	If you cut a bill in half and give it to the bank , would they accept it as half the currency ?
284892	What if RBI and banks would come up with a rule stating , we won't accept the currency notes if anything is written on top of it ?
284893	HOW do I TELL A SUPPLIER NOT TO PUT HIS WEBSITE ADDRESS ON SHIPPED ITEMS ?
284894	Will Katrina Kaif marry Salman Khan ?
284895	Will Salman Khan save Katrina Kaif's career ?
284896	How competitive is the hiring process at Marin Software ?
284897	How competitive is the hiring process at Bank of Marin ?
284898	Is it possible to fall in love at the age of 7 ? I met a boy when I was 7 and I still can't stop thinking about him .
284899	Did Tom and Jerry die ?
284900	Astronomy : How does the metallicity of a star change with increasing distance from the star's core ?
284901	Astronomy : Why do high-mass stars have a convective envelope that's primarily concentrated in the core of the star (rather than its outer layer) ?
284902	How do I apply the artificial bee colony algorithm for features optimization and features fusion in image classification ?
284903	What is the best method for image classification : Neural Networks , SVM , Decision Tree , or something else ? What are the new algorithms in this area ?
284904	How much would it cost to construct 1240 sqft area RCC slab ?
284905	How much would it cost to construct 400 sqft area RCC slab ?
284906	How do I become a real estate agent in Texas ?
284907	How do you become a real estate agent ?
284908	How do I delete a disabled Google account ?
284909	What things must be included when you are asked to introduce yourself in a job interview ?
284910	Why are climate scientists saying that the situation is worse than they first estimated it to be ?
284911	Will mosquitoes be worse in DC this year because of climate change ? How much has the climate actually changed in the last 10 years ?
284912	Which is the best laptop under 85k ?
284913	Which is the best laptop under 60K ?
284914	I want to be a professional soccer player , but my dad doesn't support me . What should I do ?
284915	Do body wraps made from duct tape make small waistlines ?
284916	Will logging out of Snapchat delete my saved conversations ?
284917	Will logging out of Snapchat delete all my friends ?
284918	How much money has one made by doing commodity trading ? How much was the amount , How much was the profit in a single day ?
284919	How much money does the Disney corporation make a day ?
284920	What is the writing code for a binary list sorting in Python ?
284921	How do I write a code for multiplication table in Python ?
284922	Is it a logical move to contest Nupur Sharma against Kejriwal ?
284923	Why is Arvind Kejriwal retweeting a tweet against Army in Kashmir violence ?
284924	What is the secret of a successful relationship ?
284925	How can I make $ 10,000 or more from $ 3,000 ?
284926	How can I take 10,000 and make it 15,000 within a month ?
284927	How can you merge small files in Amazon S3 using Spark ?
284928	Should I use Amazon S3 for a social media app I am making ?
284929	What is a DUI ?
284930	What is the best way to defend against DUI ?
284931	How can I become very good at chess from almost nothing ?
284932	How do I become a great chess player ?
284933	I was in contact with a girl for almost a year . I fell for her . She liked me , but then she changed her mind . Now , she says she never liked me and I have gotten too clingy . What should I do ?
284934	How many calories should an IT professional consume per day ?
284935	How many calories should a person must consume and burn per day ?
284936	How much would you pay for a 400 joke ebook for kids ?
284937	How does mtr foods use fayol management priniciple ?
284938	Why did girls avoid an boy but she always seeing him , what is on her mind ?
284939	How can I learn and thoroughly understand algebra and calculus in one year ?
284940	Can I deposit a third party check into my account ?
284941	What are curtailment bars on an r.c.c. slab ?
284942	`` How does this code work : #include <stdio.h> main (-RRB- {int r , c , sum ; for (r = 1 ; r < = 3 ; r = c) {for (c = 1 ; c < = 2 ; c = r) {sum = r + c ; printf ('' `` r = % d c = % d sum = % d \ n'''' , r , c , sum) ;} printf ('''' % d \ n'''' , c) ;}} ? Why does it work ?''
284943	What does destiny mean in Judaism ?
284944	`` What is'' `` Amalek'''' under Judaism ?''
284945	How do budget airlines make money ?
284946	Could airlines make more money if they flew faster ?
284947	Why do you love doing what you do ?
284948	What is better way of reducing weight - Doing workout in gym or doing Physical exercise at home plus running ?
284949	House is cracked . Is it advisable to repair roof r break till window and raise the roof . Its 1000 sq. . Give me a rough idea for both option ?
284950	What is the average cost for health insurance in Ohio ?
284951	What is the average cost of health insurance ?
284952	Why are there two days of Rosh Hashanah , even in Israel ?
284953	What are some books to learn about promoting YouTube channels ?
284954	What is the best Java open source project for a shopping cart ?
284955	Is there any open source site to work on CS projects with Java ?
284956	How can you determine the chemical equation for decomposition ?
284957	How can you determine the chemical equation for plastic ?
284958	How do aircraft shoot themselves down ?
284959	Could a tank-mounted Browning M2 machine gun shoot down a modern aircraft such as an F-16 ?
284960	What are some examples of subatomic particles ? How do they differ among them ?
284961	I am working as a Marketing Manager for an online casino . I would like know how can I create promotions without affecting our affiliates ?
284962	How many interns does Quora hire each year ?
284963	Does Quora hire fall part-time interns/co-ops ?
284964	What is your saddest moment ?
284965	What are some of the saddest moments that a professor can experience ?
284966	What do you think about people supporting themselves with chess ?
284967	What are the causes of carotid artery murmurs ?
284968	Can we begin a movement through Quora where we can discuss on how to protect our environment and thus bring a reform in the government policy ?
284969	How can we solve the space problem related to plate tectonic movement on a spherical geometry ?
284970	What would happen if all the nitrogen in the air were replaced with oxygen ?
284971	What would happen if oxygen were replaced by nitrogen ?
284972	`` What does'' `` co-adaptation of neurons'''' in a Neural network mean ?''
284973	In a neural network using TensorFlow , how to find the vector of weights associated with each neuron in a given layer (e.g. the first hidden layer) ?
284974	What were some of the highlights of Burning Man 2016 ?
284975	What are some of the highlights of Burning Man in 2015 ?
284976	Why do cats have the letter'M' on their foreheads ?
284977	How can my cat tell if I'm sick ?
284978	How can I effectively market my app in a soft launch ?
284979	What are good free ways to promote your Android or iOS game ?
284980	`` How do you pronounce'' `` world'''' ?''
284981	What advancement will there be for black box in the near future ?
284982	Were r u from ?
284983	What are the hardest songs to sing for a child ?
284984	What is the best song to sing for a girl ?
284985	How many Haitian presidents have been overthrown ?
284986	Can MATLAB used to program highway engineering course ?
284987	What is the scariest photo you have ever taken ?
284988	Where should I go to buy royalties and income producing assets ? I'm looking for non-stock investments .
284989	Where to invest ? Tomorrow I will be going to invest stocks for the first time . Can any one suggest which one to buy ? I will be investing 1k-2k INR ?
284990	What brands offer multiple apps that are very use-case specific , like e-commerce ?
284991	What are the other things to line up for starting a grocery e-commerce brand.i have made the app and website ready . (inventory , logistics etc) ?
284992	Can you take Mucinex and Zyrtec together ?
284993	What are the best uninterrupted shots in Bollywood/Tollywood movies ?
284994	Do you know any Bollywood movies where part of it is shot on the Eurostar train ?
284995	Why did Yugoslavia fail ?
284996	What were the reasons behind the break up of Yugoslavia into smaller states ? What are those new states ?
284997	How does a computer or a calculator find the cube root , square root etc. of a number ?
284998	What are the pros and cons of mainstreming ?
284999	What are the pros and cons of SSADM ?
285000	What is your score out of 700 and post through ssc cgl 2015 ?
285001	`` Start learning programming from scratch or starting with'' `` Scratch'''' ?''
285002	How can I smile less ?
285003	Application of mathematics in various field ?
285004	I have 2 year experience in mainframe storage administrator what salary I can expect in IBM ?
285005	Out of curiosity , if Google were to hire just one employee and they had to choose between a Stanford and MIT graduate , CS majors , who would they hire ?
285006	Will Google hire VLSI graduates ?
285007	Can clindamycin phosphate gel for acne be used while being in the sun for a long period of time ?
285008	Where can I file the case against my college ?
285009	How can I convert from base system 4 to 2 ?
285010	How do endangered species affect the environment ?
285011	What would a collision of supermassive black holes be like ?
285012	What is a supermassive black hole ?
285013	What should I do to increase my performance in training at Cognizant ?
285014	Which is the best Web Design agency in Dubai ?
285015	What are some amazing things I can do with my Xiaomi MI 4 ?
285016	What amazing things I can do with my Xiaomi Mi 3 ?
285017	Why do I care about others more than myself ?
285018	Is it possible to integrate the GoToWebinar registration form with a SugarCRM Campaign ?
285019	How can I upload a list of names to GoToWebinar ?
285020	What is the use of getch (-RRB- , putch (-RRB- , getchar (-RRB- , putchar (-RRB- ? Can't we write a program without using these in C language ?
285021	Can I have all three Ubuntu , kubuntu and xubuntu at once when I have dual booted Ubuntu 16.04 alongside windows 10 ?
285022	How do I dual boot Ubuntu 16.04 alongside windows 10 ?
285023	Why does eating radishes cause diarrhea ?
285024	How do I create a fake Gmail account ?
285025	What are the ways to create a joint account in Gmail ?
285026	Why do people ask me to answer questions that there's no reason to think I know the answer for ?
285027	How can I delete my WhatsApp chat history from recipient's phone ? Read details .
285028	Which is best mobile in Lenovo k6 power or Lenovo k5 note ?
285029	How do I set up workshop/seminar consulting in Dubai/UAE ?
285030	How far does the average hamster run in their wheel over their lifetime ?
285031	Are hamsters allowed in Indian Colleges ?
285032	What does it mean if some of my visitors are from a private network ?
285033	Are there any unlisted VPNs ?
285034	Which type of Machine Learning algorithm should I use for a seeing robot ?
285035	Are there any US life insurance companies that sell policies to non-US citizens ?
285036	What are the best places to roam near by Bengaluru ?
285037	I'm a 19-year-old with $ 200 to invest . How do I invest this amount in the stock market ?
285038	Why is the international community unable to do anything about the human rights violations in North Korea ?
285039	Is there anything good about North Korea ?
285040	`` Where is that foozeball table now from'' `` Friends'''' season which was there in Joey's and Chandler's apartment ?''
285041	What makes Joey (from Friends) so successful with women ? (aside from the fact that it's a TV show)
285042	Which is the best time to water a growing plant : day or night ? And why ?
285043	Is it possible to get pregnant if he pulled out , wiped it off , and inserted it back in ?
285044	Is it still possible to get pregnant while pulling out even if you are under birth control ?
285045	How can I purchase a laptop on EMI with credit card ?
285046	What can you do to make helium non flammable ?
285047	What makes helium flammable ?
285048	What is the differences between Windows , Mac Unix , Linux , and Solaris Kernel ?
285049	Which is the best knowledge sites for students ?
285050	Am I the only one who think that new UI of Quora sucks ?
285051	Why does iron shows maximum of +6 oxidation state while in the same group ruthenium and osmium shows +8 as maximum oxidation state ?
285052	How do I find Oxidation state by XPS ?
285053	Who would win in a fight between a badger and a bear ?
285054	Who would win in a fight between a wolf and a bear ?
285055	Is it bad to not wash soap off my face after putting it on my face ?
285056	I hack t WhatsApp account of frd who is 50 km away from me ?
285057	Is there an intelligence agency in real life that is similar to B613 in the TV show Scandal ?
285058	How has the cast been affected by the success of Scandal (TV series) ?
285059	How should you interact with a police officer if your vehicle is pulled over ?
285060	Is time 4d ?
285061	What are some sites similar to channel131.com ?
285062	From my experience with green tea I almost throw up tasting it . I want to speed up my metabolism and heard a good way to do it is by drinking green tea . How do I drink green tea without getting that throw up feeling ?
285063	Is it enough to drink green tea once a week to get its health benefits ?
285064	What are the best career objectives to write down in a cv of a fresher ?
285065	Are there any semantic web applications that detect when a troll appears in a forum ?
285066	Overview On Specific Range Of Bio-Chemical Process Occurs In Fillets Disorder Surgical Repaired Of Joint Loosening ?
285067	`` What is meaning of'' `` passed under vocational scheme of cbse class 12'''' ?''
285068	How do you delete your profile at Angel.co ?
285069	What is Profile Engine , and how can a profile be deleted from there ?
285070	Why does Hillary Clinton hate Iran despite the relations are improving ?
285071	If elected , does the Clinton administration plan to attempt opening up the United States relationship with Iran ?
285072	What are the companies that conduct workshop on IOT ?
285073	How do you become a venture capitalist lawyer ?
285074	How do I become a venture capitalist ?
285075	What is the contact details for UGC query office ?
285076	Which command is used for listing file attribute ?
285077	Can I use any other ink (except blue and black) to highlight points in english in boards ?
285078	Should one use simple English in a CBSE board English exam ?
285079	I have an account in the State Bank of Travancore . Can I withdraw money from any of the State Bank of India branches ?
285080	What is meant by theme ?
285081	What is meant by ` sociological themes' ?
285082	What is a KTM Duke 200 ?
285083	Does the KTM Duke 200 have ABS ?
