test-450369	History of Europe: Given that UK ruled the Earth 150 years ago and won most wars, why isn't it much richer than, say, Germany?
test-450370	I got a score of 43.8 (CAT - 24, GAT - 19.8) in MDES - NIFT 2015. Is that a good or a bad score? How do I need to prepare for GD/PI? What's the highest score this year?
test-450371	Which is more Important to get into NIFT, GAT or CAT?
test-450372	If I changed my DNA and made my face look different, how long would it take to change?
test-450373	Is there any ragging in Karachi University. Is it healthy ragging?
test-450374	"What is the best way to use the word ""perusal"" in a sentence?"
test-450375	"How would you use the word ""perceive"" in a sentence?"
test-450376	How can I get a girlfriend (I'm 14 years old)?
test-450377	How can I get a girlfriend in middle school?
test-450378	Does anybody have any tips for new artists?
test-450379	Does milk paint have any disadvantages artistically wise?
test-450380	If you marry a European citizen do you get citizenship?
test-450381	Is it easier to get a US citizenship if I am a Mexican citizen?
test-450382	Can I lose weight by eating rice?
test-450383	Will you lose weight simply by eating less?
test-450384	In what ways did the confederation function effectively and what were its greatest failings?
test-450385	Jailbreak 10.1.1 on iPhone 5?
test-450386	How much money does Five Nights at Freddy's make?
test-450387	Why does Five Nights at Freddy's make me cry?
test-450388	What is like to work at Walt Disney World?
test-450389	How does it feel to work at Disneyland?
test-450390	"What does the Hindi word ""bhabhi"" mean in English?"
test-450391	What is the English word for the Hindi word 'kanjoos'?
test-450392	My memory is poor, I am constantly forgetting information or cannot retain it. Any suggestions on how improve this issue?
test-450393	How do I increase orders on my eCommerce store?
test-450394	How are rough uncut diamonds valued?
test-450395	How can one locally classify rough diamonds?
test-450396	Are there any chemical engineering based startups in India?
test-450397	What are some electrical engineering based startups in India?
test-450398	"What are some other books similar to the book ""The Fault in Our Stars""?"
test-450399	What are some similar books to the fault in our stars?
test-450400	Which is the best smart phone for 15k?
test-450401	What is the best smart phone with good battery backup under Rs. 15K?
test-450402	Which one is the best hair salon in Vadodara?
test-450403	What are some of the best hair salon software on the market?
test-450404	What do atheists think about miracles?
test-450405	What do atheists think about believers?
test-450406	Who would win in a fight, Darth Vader or Darth Maul?
test-450407	Who would win a fight between Darth Vader and Darth Malgus?
test-450408	How is the work culture in SAS R&D, Pune, India?
test-450409	How is the work culture at Fujitsu Pune?
test-450410	What does the US debt to China mean, literally?
test-450411	Will China pass the US in GDP any time soon? Why or why not?
test-450412	What are some examples of differential equations?
test-450413	What are some examples of differential equations including differential?
test-450414	How much do top electrical core companies like Schneider Electrical, Seimens, HUL, National Instruments, GE, or Texas Instruments pay in IITs during campus placements?
test-450415	What is the campus placement eligibility criteria for companies like L&T, Eaton, Techmahindra, Siemens, Petrofac etc for Electrical Engineers?
test-450416	What are your views about Narendra Modi's decision to stop circulation of 500 and 1000 denomination notes?
test-450417	What do you think of the decision by the Indian government to demonetize 500 and 1000 rupee notes?
test-450418	What are some recommended methods for smoking weed?
test-450419	What is a recommended alternative to smoking weed?
test-450420	What is the best theology school?
test-450421	What is the best book on christian theology?
test-450422	What is the best way to climb Mt. Blanc?
test-450423	How hard is it to climb Mt. Blanc?
test-450424	What are all cell organelles? Why is their importance?
test-450425	Which organelle is the least important?
test-450426	How do I left justify Microsoft Word's page number of a catalog made automatically?
test-450427	How is bharti bhawan publisher series mcq books for jee?
test-450428	Can you be topless in Goa?
test-450429	What are the things not to do in Goa?
test-450430	What kind of music do you prefer?
test-450431	Which kinds of music do you like?
test-450432	What is the difference between supply chain management and operations management. and which is best amongst the two for a mechanical engineer?
test-450433	What are the different roles for a mechanical engineer in supply chain and management?
test-450434	What is the best film of 2016?
test-450435	What are the best movies of 2016? Why?
test-450436	How long does a generation last?
test-450437	How long will generation z last?
test-450438	What is the recruitment procedure for persistent?
test-450439	How is life at persistent Nagpur & how do I reach to it?
test-450440	How do I retrieve deleted photos on a Samsung Galaxy S3?
test-450441	How do I recover photos / videos / files accidentally deleted from an SD / microSD / CF / memory Stick Duo / USB memory card / Pen Drive?
test-450442	Why don’t some people believe in God?
test-450443	False Pretences: Why don't some people want to believe in gods?
test-450444	Where can I find a true hacker community or forum on the Internet?
test-450445	Which is the best Community/Forum for Mobile App Testing?
test-450446	Is 100,000 Euros a good enough salary for a family of three in Heidelberg, Germany?
test-450447	Is 55,000 euros per year a good salary in Vienna, Austria?
test-450448	Who are the famous R&AW agents of India?
test-450449	How can I join India's intelligence agency RAW?
test-450450	Is Deep Learning a prospective research field?
test-450451	Where is deep learning research going?
test-450452	Where can I get best surface cleaning services in Sydney?
test-450453	Where can I find cleaning services in Sydney?
test-450454	Why don't Muslim men sport a moustache along with a beard like Sikhs do?
test-450455	Why did some guys don't grow beard at all?
test-450456	Does [math]f \in \mathbb{L} ^ {1} (\mathbb{R}) [/math] imply [math] \lim_{x \rightarrow \pm \infty} f(x) =0 [/math]?
test-450457	What does [math]  \mathbb{F}((0, \infty );\mathbb{R} )[/math] mean?
test-450458	How do you deal with rude and stubborn person?
test-450459	What are some tips for dealing with a stubborn person?
test-450460	What is the rudest thing you have ever said or done to someone?
test-450461	What was the rudest thing you have said or done?
test-450462	How do I become a male escort in Bangalore?
test-450463	How can I become a call boy in Mysore or Bangalore?
test-450464	Suppose we do merge sort with a three-way split: divide the array into 3 equal parts, sort each part and do a 3 way merge. What would the worst-case complexity of this version be?
test-450465	What is the worst case complexity of selection sort? Is it theta (n) or theta (n^2)? How?
test-450466	What is the best way to beat Inflation?
test-450467	How do I beat inflation?
test-450468	Which mobile network provider is better, Vodafone or Airtel?
test-450469	BSNL provides the cheapest 3G data plan compared to any other service provider like Idea, Airtel and Vodafone. Why?
test-450470	What's the best way to learn Arabic and Persian?
test-450471	How do I learn Arabic?
test-450472	What is the whole story about Taslima Nasrin? Why is she hated so much? What is the book where she has written against Muslims?
test-450473	Is Taslima Nasreen muslim?
test-450474	How does a guy feel when a girl propose to him?
test-450475	How does a guy feel when a girl proposes to him?
test-450476	How competitive is the hiring process at Merck?
test-450477	How can you know if you aren't good at something because of lack of talent, lack of practice or lack of a proper method to be good at it?
test-450478	Is it possible to 3D print with 100% biodegradable materials?
test-450479	Is it possible to 3D print with natural materials?
test-450480	Can you get frustrated doing something you love?
test-450481	Why do some people say Docker is terrible for scaling?
test-450482	Why don't people make better decisions?
test-450483	Why do people hate making decisions?
test-450484	Is ISIS behind the three attacks (Jeddah, Qatif and Medina) which took place in one day in Saudi Arabia?
test-450485	Why doesn't ISIS attack Saudi Arabia?
test-450486	What are the best turmeric supplements?
test-450487	What is the best garlic supplement?
test-450488	On Quora, who owns my answers?
test-450489	Does Quora own my answers?
test-450490	What is the rarest hair and eye color combination?
test-450491	What is the rarest natural shade of red hair? What is the rarest natural shade of blonde hair?
test-450492	Could one choose which type of credit card to accept using Stripe's API?
test-450493	What's the best U.S. credit card to use in Japan?
test-450494	Android fans, as nice as the phones are, aren't you bothered that Google's business model depends on you being the product being sold to advertisers?
test-450495	Are the Google Pixel phones looking nice?
test-450496	Which is the best book for core Java?
test-450497	Which are the best books should I read to learn java?
test-450498	"Do you really believe there's such a thing as a ""Black"", ""White"", Yellow or Red races?"
test-450499	Do white wives fantasize about black men?
test-450500	I feel like I am worth nothing and am guilty for everything I do even though I don't hurt others. Has anyone ever had to deal with such a state?
test-450501	Why do I feel that I am teasing others, even though I am not?
test-450502	Why do people use Quora to ask simple, dumb questions instead of just Googling it?
test-450503	Why do so many people ask google-able questions on Quora?
test-450504	Can I learn algorithm myself?
test-450505	How do I start learning or strengthen my knowledge of data structures and algorithms?
test-450506	How can I get Python program to return true if all conditions are met?
test-450507	Why do we return 0 to the OS when we exit with no errors, but boolean functions within the code generally return 1 (true) to indicate all is fine?
test-450508	What's the best way to start an anonymous blog?
test-450509	What`s the best moment to start advertising my ebook on Facebook? Should I build an audience for my blog first? If so, how?
test-450510	Is React Native easier to learn than iOS Swift?
test-450511	Is it better to keep learning more iOS Development in Swift or should I start paying more attention towards frameworks like Meteor + React Native?
test-450512	What is the best way to contact with unknown girl?
test-450513	How do I talk to an unknown girl?
test-450514	Is Canada a good place to live?
test-450515	Is Canada the best place to live in?
test-450516	How do you fix a file not found error in Java?
test-450517	"How do I fix this ""else without if"" error in JAVA?"
test-450518	Why do I fantasize about being a victim of human trafficking?
test-450519	Why are most of the victims of human trafficking women?
test-450520	What are the most important things in life? And why?
test-450521	Life Advice: What are some of the most important things that we should be informed about in life?
test-450522	What salary hike can one expect at TCS over the years?
test-450523	What is the minimum salary hike at elxsi every year?
test-450524	What is the gdp per capita?
test-450525	What is GDP and GDP per capita?
test-450526	What is the price and feature difference between UberGo, UberX and UberBlack in India?
test-450527	What's the difference between UberX and UberXL?
test-450528	How should I start learning Computer Science?
test-450529	How should I start learning Computer Science considering I know basics of c++?
test-450530	What is the salary of DRDO scientist?
test-450531	What will be the salary of scientist B in 7th pay comission in DRDO?
test-450532	What are the best products to increase the level of oxygen in blood?
test-450533	Can we increase the oxygen levels in drinking water?
test-450534	What are the statistics on deaths due to delayed emergency response in car accidents?
test-450535	What percentage of car accidents are caused by driver distraction due to advertising?
test-450536	Can I use a 24 V solar panel to charge a 12 V battery?
test-450537	How much capacity of solar panel need to charge 150AH battery?
test-450538	What is the most effective way to lose weight?
test-450539	What is the most effective way to lose weight fast?
test-450540	What are the top pilot training schools in India?
test-450541	What are some of the best pilot training institutes for commercial training in India?
test-450542	What do I do if I am 20 years old and cannot concentrate on my studies?
test-450543	Why am I not able to concentrate on my studies?
test-450544	Why do some smart and wise people think Earth is flat?
test-450545	Why is it that some people still believe the earth is flat?
test-450546	Sailing: Why are sailors often portrayed as heavy drinkers?
test-450547	How fond are you of sailing?
test-450548	Can I earn really anything from a free blogspot blog?
test-450549	How much can one earn from a free blogspot blog?
test-450550	What is the best bicycle to buy under 10k?
test-450551	Which is the best gear cycle to buy around 10000?
test-450552	Why do nonmyelinated axons exist if myelination makes transmission of the action potential more efficient?
test-450553	Does mugging up or remembering fewer formulae mean I can use them more efficiently and quickly?
test-450554	What do we need to know to start studying neuroscience?
test-450555	Where should I start to study Neuroscience?
test-450556	Should I drop a year for CLAT 2017 ?
test-450557	I have 2 years, how should I prepare for CLAT LLM 2017?
test-450558	How invest money in share market?
test-450559	How can I invest money in the intraday share market?
test-450560	How can I work in Silicon Valley?
test-450561	How many start-ups are there in Silicon Valley?
test-450562	Does listening to music that you download from iTunes use data?
test-450563	Can I listen to downloaded GANA songs using my phone's music player? If not, what should I do to make it visible in the music player?
test-450564	In Photoshop, what is a smart object?
test-450565	What is a smart object in Photoshop?
test-450566	What are the best free screen recording softwares for iOS?
test-450567	What are some free best softwares for screen recording?
test-450568	How do I stop a redirecting virus on Android in Google Chrome?
test-450569	How can I remove the redirect virus from an Android phone?
test-450570	"What are all the best answer for ""strength and weakness ""question during interview?"
test-450571	"What are the best answers for ""Why should I hire you""?"
test-450572	Will Minerva University degree be accredited? Which accreditation agency will recognize a degree from Minerva?
test-450573	How good or bad is the newly opened Minerva University of USA?
test-450574	Time travel is it possible?
test-450575	Is time travel possible?
test-450576	What should I do when someone is telling me lie when I already know the truth?
test-450577	What should I do when some of my friend is telling me lie when I already know the truth?
test-450578	How do nude beaches in Punta Cana compare to other nude beaches in Jamaica?
test-450579	How do nude beaches in Punta Cana compare to other nude beaches in Montserrat?
test-450580	What is energy engineering?
test-450581	What is it like to be an energy engineer?
test-450582	What is the single best exercise to lose belly fat?
test-450583	What are the best exercise to lose belly fat and double chin at home?
test-450584	Can Brownian motion cause emulsification of non-ionic liquids?
test-450585	What is the cause of Brownian motion?
test-450586	Is timetravel possible?
test-450587	Is time travel possible or will it be possible?
test-450588	Where can I download 70-410 PDF dumps or 70-410 VCE dumps?
test-450589	Food: What is Chinese food from China like compared to Chinese food served in other countries?
test-450590	What are the websites offering free online courses on accounting?
test-450591	What are the websites that offer free online courses?
test-450592	My girlfriend's grandfather just died. What should I do?
test-450593	How can I make trust for my girlfriend 's sister?
test-450594	How do I improve speaking skills?
test-450595	What should I do to improve my language speaking skills?
test-450596	What software is similar to Olark, ZenDesk, or LiveChat that is HIPAA Compliant?
test-450597	Does my lead generation software need to be HIPAA compliant?
test-450598	Which is the best external hard drive to buy?
test-450599	What is the best external hard drive?
test-450600	What properties do all metals share?
test-450601	What are the properties of metals?
test-450602	Where can I share my startup for foreign language learners (forums, Facebook groups, chats etc)?
test-450603	What are the best neighborhoods in Riverside, CA?
test-450604	"What does ""RSVP"" mean?"
test-450605	What is the etiquette for sending an RSVP?
test-450606	What is the ideal time to drink tea?
test-450607	What is he best time of day to drink tea?
test-450608	I want to become an RJ. What course should I take?
test-450609	I want to be a RJ. What should I do?
test-450610	How do I download Pokémon GO on Android phone in India?
test-450611	How do I download Pokémon GO in India?
test-450612	How do you stop your mind from wandering when you are trying to study?
test-450613	How do I stop my mind from wandering when I read?
test-450614	Does a Ceiling Fan running at a slower speed consume less Power (Electricity Units)?
test-450615	If you run a ceiling fan at full speed or lowest speed, which speed will consume more electricity?
test-450616	How do I improve analytical skills?
test-450617	What are some tips for improving analytical skills in finance?
test-450618	Why is Earth, its Moon and nearby planets all spherical? What force of nature shaped them?
test-450619	Why are planets spherical?
test-450620	What will be the impact of demonetization in India?
test-450621	Is there (already) a factual proof that demonetization in India is Success/Failure?
test-450622	Was SS General Wilhelm Mohnke, a man of remarkable bravery and talent?
test-450623	Which SS division was the most despicable?
test-450624	How many grams are in a pound of weed?
test-450625	How many grams are there in an eighth of weed?
test-450626	What is SOTOL (100% Wild Harvested Agavacea)? Is it better than Mezcal?
test-450627	What do girls feel on menarche? Is it a terrifying feeling?
test-450628	How can I forget the person?
test-450629	What would be safe distance from an explosion with mass-energy equivivalence of explosion 10^39 AMU?
test-450630	Where can I find websites and app recommendations by Times of India?
test-450631	What are competitions held for couples(married or not) in India?
test-450632	What is your secret to never eating unhealthy food?
test-450633	What's the most unhealthy food that people eat regularly?
test-450634	If people believe in God then why do they chose not to worship him?
test-450635	If people believe in God then why don't they believe in ghosts?
test-450636	What are the benefits of doing an MBA after getting an undergraduate degree in aviation?
test-450637	What are the benefits of doing an MBA after getting an undergraduate degree in dentistry?
test-450638	What is the future scope of working in the TRMS team at Amazon?
test-450639	What is it like to work with the Amazon Prime Music team in Seattle?
test-450640	How do I prepare for gate?
test-450641	How do I prepare for the GATE?
test-450642	My teacher slaped me in the middle of the school even if I was not in fault. what should I do, slap him back?
test-450643	Will humans eventually stop shaking hands when greeting?
test-450644	How can I attract supportive people?
test-450645	How do I attract people?
test-450646	Where can I find investors for my start up idea?
test-450647	How do I find an investors for my show idea?
test-450648	How can I join a theatre group in mumbai? Can anyone help me with the contacts?
test-450649	Can anyone from Mumbai help me to find the house address of a TV celebrity?
test-450650	What is the best tower defense game for the iPad?
test-450651	What are the best top tower defense games for Android?
test-450652	How likely is it you will get in trouble for downloading movies via torrent sites in the USA in 2016?
test-450653	Can I download any TV series with torrents in the USA?
test-450654	Can anyone ever be 100% evil or 100% good?
test-450655	Can anything be 100% good or evil?
test-450656	What is the best cellphone I can get with $75?
test-450657	Does the black knight satellite exist, and how old is it?
test-450658	What is the Lewis structure for BrF3?
test-450659	What is the Lewis structure for diazomethane?
test-450660	What is Salman Khan's religion?
test-450661	Who is better? Salman Khan or Shahrukh Khan?
test-450662	What are the best resources to study chemistry for homeschoolers?
test-450663	What are the best resources to study for vocabulary tests?
test-450664	Psychology of Everyday Life: Do you prefer people with light or dark eyes? And Why?
test-450665	Psychology of Everyday Life: What can the eyes of someone reveal by observing them?
test-450666	How do I stop worrying about what people said to me?
test-450667	How do I not care what other people think of me?
test-450668	Which are the places to visit in India?
test-450669	What are cheap place to visit in india?
test-450670	I need advice picking a college major. My desired choices are Computer engineering, mathematics, or computer science?
test-450671	What re-ionized the universe?
test-450672	Is there a Silicon Valley in Russia?
test-450673	Will there be a Silicon Valley in China?
test-450674	What is the current difference between MS and ME in Usa. Does job opportunities differ?
test-450675	What is the difference between the USA and America?
test-450676	Can some humans see better than others at night?
test-450677	Do animals see ghosts, spirits or other phenomena unseen by humans?
test-450678	How can I build more self confidence and self esteem?
test-450679	I lack confidence to do basic things in life. How do I build confidence?
test-450680	What are some ways to fix a headphone that doesn't work with Windows 7?
test-450681	Will Windows 7 drivers work on Windows 10?
test-450682	How can I join India's intelligence agency RAW?
test-450683	What is it like to work for Indian intelligence agencies like RAW,NIA and IB?
test-450684	How it is confirmed that the human use only 2% of our potential brain power?
test-450685	Is it true that humans only use 10% of their brains?
test-450686	What is the speed of BSNL's 1099 unlimited 3g plan?
test-450687	How is the download speed in the 800 unlimited plan of Fibernet?
test-450688	How difficult it is to travel in India?
test-450689	Is it safe to travel in India?
test-450690	Is it true that Brahmins are cunning and they are always intelligent by nature?
test-450691	Many Left-wing people say Sanskrit was spoken only by Brahmins and not by Shudras. How true is this?
test-450692	What was the main purpose for establishing area 51 usa and what really happens there?
test-450693	What really happens at area 51 in Nevada?
test-450694	Which college is best for agriculture engineering in India?
test-450695	Which college is best for agriculture science in India?
test-450696	Can we absorb Energy from the Sun and harness it for our growth and muscle gain?
test-450697	Can we absorb energy from the sun?
test-450698	What can you do if your tattoo ink is 'bleeding'?
test-450699	What drawing tools or ink do you use for a flash tattoo sheet?
test-450700	Recently answered GRE score 301,GPA 7.6 2 yrs exp hardware designer . Any good univ for majors in EE with specialization in FPGA /SOC in US?
test-450701	Is the food at any restaurants healthy?
test-450702	How do I save a shared file (shared with me) in my Google drive permanently (shared with me)?
test-450703	If I upload a pirated movie to Google Drive, only for me (not to share), could I get in trouble?
test-450704	Do employees at Noble have a good work-life balance? Does this differ across positions and departments?
test-450705	How long would civilisation last if the sun disappeared?
test-450706	What mobile analytics platforms are most similar to Appsee?
test-450707	What is the performance overhead on how APPSEE effects my app?
test-450708	Why do doctors put their stethoscope to your back/stomach and ask you to take deep breaths?
test-450709	I have typhoid and cough; now I get pain near my pancreas whenever I take deep breath or cough or anything. Is this a serious issue?
test-450710	"Phrase Origins: Where does the saying ""there's more than one way to skin a cat"" come from?"
test-450711	"Where did the phrase ""have my cat and eat it too"" come from?"
test-450712	What is the biggest bag in World of Warcraft?
test-450713	What are the best leather gear in World of Warcraft?
test-450714	What is the reality behind the Philadelphia experiment conducted by the US Navy?
test-450715	Did the The Philadelphia Experiment really happen?
test-450716	How should I prepare myself physically and mentally for the tests in flying category of AIRFORCE?
test-450717	What genres of literature don't exist yet?
test-450718	How can I speak faster in another language?
test-450719	Can you learn to program faster or speak a language faster?
test-450720	What does the blue checkmark in Facebook Messenger mean?
test-450721	What does the check mark on Facebook messenger mean?
test-450722	If someone blocked me, will they still get my text message?
test-450723	Can someone still text me if I have blocked their number?
