188952	What is typical day of an IAS officer ?
188953	What is a typical day like for an IAS officer ?
188954	What is best way to buy new car ?
188955	What is the most optimal way to go about buying or leasing a new car ?
188956	Do women like beards ?
188957	Why does racism still exist today in a supposedly more rational and intellectual society ?
188958	Why do we still have Racism in 2016 ?
188959	Does decaf coffee contain caffeine ?
188960	Does decaf coffee and tea absolutely have no caffeine ?
188961	Is marriage necessary in life ?
188962	Is marriage necessary ?
188963	Can I file an RTI against a private company regarding my delayed joining ?
188964	India - Can I file RTI on a private company regarding delay in my joining ?
188965	Can you become less shy , and become more socially confident ? If so , how ?
188966	Can I claim HRA during ITR Filing ?
188967	Where can I claim HRA exemption during ITR filing ?
188968	Why moving iron instruments work on AC and DC supply both but moving coil instruments work only in DC supply only ?
188969	What is difference between moving coil and moving iron ammeter ?
188970	What is it like to test iPhone 7's waterproof feature ?
188971	How waterproof is the iPhone 7 ?
188972	What makes a semiconductor direct or indirect band gap material ?
188973	What is the difference between direct and indirect band gap semiconductor ?
188974	How do I calculate the cash flow of a company ?
188975	What are the best ways to calculate operating cash flow ?
188976	How do I get rid of my conscience ?
188977	I do not want to have a conscience . How do I get rid of it ?
188978	Is hyperloop a dependable technology for India ?
188979	How feasible is the hyperloop for India ?
188980	Who is the worst Bollywood actress according to you ?
188981	What do you search for in life ?
188982	What are you searching for in your life ?
188983	How important were the Federalist Papers in convincing American public to support the Constitution ?
188984	Did the Federalist Papers make a significant difference in people deciding to adopt the Constitution ?
188985	How can I post an image ?
188986	How do I post an image ?
188987	Which Europeans countries offer free college education to international students in English ?
188988	Do narcissists mean it when they say they love you ?
188989	Do narcissists believe it when they say they love someone ?
188990	Can I tell if someone logs into your Instagram account ?
188991	What is an example of an essay about integrity ?
188992	How can I write an essay about integrity ?
188993	How do I teach someone value of time ?
188994	How do you teach a child the value of time and not to procrastinate ?
188995	I want to build six packs in a month , is it possible ?
188996	I want to build six pack abs in 1 month , is it possible , I am 5 feet 11 inches and weighs 141 lbs , any advice ?
188997	What is the best way to learn digital creative design , Photoshop plus graphic design on my own ?
188998	How do I scale or get funding for my business ?
188999	How can get funding for my business ?
189000	How do I solve differential equations easily ?
189001	How do I solve differential equations ?
189002	Why does Turkey fight every single secular force in Syria and spare ISIS ?
189003	Why Turkey is not fighting ISIS ?
189004	Do pornstars swallow cum ?
189005	Do porn stars actually swallow the cum ? If yes , then isn't it harmful ?
189006	How can one track whether sent email was read ?
189007	What is the difference between current and saving money ?
189008	What is the difference between savings acc and current acc ?
189009	What are some Secret Santa gift ideas ?
189010	I've not had my period for 3 months now (Last period ended on June 9th) . I'm 22 , never been sexually active . What should I do ?
189011	I've not had my period for 3 months now (Last period ended on June 9th) . I'm 17 , never been sexually active . What should I do ?
189012	Where is the highest place on Earth ?
189013	Why are trees green in colour ?
189014	Why are trees green ?
189015	What are the unknown facts of Android that you should know ?
189016	What are some unknown facts of Android ?
189017	`` Have you read'' `` The Power of Now'''' by Eckhart Tolle , and if yes , do you find the content of his book relevant to yours (even if remotely) ?''
189018	`` Did you enjoy reading'' `` The Power of Now'''' by Eckhart Tolle ?''
189019	`` What's the meaning of'' `` feed'''' in Facebook or Quora , etc. ?''
189020	What's the meaning of feed in Quora ?
189021	Which is better Android or iOS ?
189022	How do I tell my friend that her boyfriend is not a good fit for her ?
189023	How do I tell a friend , her boyfriend is not good for her ?
189024	What defines a person's character ?
189025	What determines a person's character ?
189026	How did USA contributed to the WW1 ?
189027	What was the contribution of the US to WW1 ?
189028	What are the reasons , besides feeding his own ego , made Donald Trump to run for presidency ?
189029	Why are many American Jews rich ?
189030	Why are Jews so rich ?
189031	What are differences between anion and cation ?
189032	What are the differences between cations and anions ? What are their similarities ?
189033	What is commercial testing ?
189034	What is commercial testing of materials ?
189035	What is the best strategy to prepare and master the Quant section in the CAT ?
189036	What is the best strategy to prepare quants section for CAT ?
189037	How can the politics be study ?
189038	How can politics be studied ?
189039	Who are Facebook's biggest competitors and why ?
189040	Who are Facebook's biggest competitors ?
189041	Book suggestions : best reads for practical advice on accumulating riches ?
189042	What is pyramid scheme ? How to identify pyramid scheme ?
189043	How can I identify a pyramid scheme company ?
189044	Is man inherently good or evil ?
189045	What are the biggest problems with sustainability and the environment right now ?
189046	What do you hate about teaching ?
189047	What do you hate the most about teaching ?
189048	What are the main biological functions of lipids ?
189049	What are lipids ? What are some of its functions ?
189050	Which English songs are best to listen while travelling ?
189051	Which English songs are best to listen to while travelling ?
189052	What is the best free antivirus for a PC in 2015 ?
189053	What are some of the best vegetarian salad dressings ?
189054	What is the best salad dressing ever ?
189055	Is the iPhone really worth its price ?
189056	What is the fixed deposit ?
189057	How is technology helping us ?
189058	How can technology help us ?
189059	Why can't I save a text file on my Android phone , even I have got 40MB free space storage ?
189060	I have 35 MB free internal space storage on my Android phone . Why can't I just save a text file with a size of 2 KB ?
189061	What is the best way to go from Budapest to Vienna ?
189062	What is an economical way to travel in middle europe ? E.g. Budapest or Prague to Vienna ?
189063	How long does it take to learn how to play the cello ?
189064	How long will it approximately take a teenager to learn to play the cello ?
189065	After demonetization , what will be the next move ?
189066	What will be the next step after demonetization to control black economy ?
189067	What is the difference between a public limited company and a private limited company ? Which is better ?
189068	What does order of a filter mean ?
189069	What do you mean by order of filter ?
189070	How does it taste to perform cunnilingus on your girl ?
189071	What does giving cunnilingus taste like ?
189072	Why do parents sometimes overreact in small matters ?
189073	Why do parents overreact in small things ?
189074	What are the best external monitors for a MacBook Pro ?
189075	What is a Kegel exercise ?
189076	What time do people usually start eating Thanksgiving Dinner ?
189077	What time do most Americans eat Thanksgiving dinner ?
189078	Does the G spot exist ?
189079	`` Does the female'' `` G-Spot'''' exist ?''
189080	How can I sell art ?
189081	What's the best way to sell fine art ?
189082	What is the experiences in ips training ?
189083	How is the experiences in ips training ?
189084	Why won't my MacBook Pro charge ?
189085	Can somebody explain me about GDP in Layman terms ?
189086	What is GDP ? And explain in simple terms ?
189087	What does it mean to have feelings of emptiness as a person with borderline personality disorder ?
189088	Why does it say that Borderline personality disorder is characterised by intense emotions and also feelings of emptiness ?
189089	What are some key differences between Hollywood and Bollywood ?
189090	What is the difference between Hollywood & Bollywood ?
189091	Why do schizophrenic people laugh out of the blue ?
189092	Why might a schizophrenic laugh if nothing funny is happening ?
189093	What's it like to be an androgynous man ?
189094	What is it like being an androgynous man ?
189095	What people who you've never met have influenced your life the most ?
189096	Who are people you have never met who have had the greatest influence on your life ?
189097	What are some of the best SAT prep books to use ?
189098	What are the top SAT prep books to use ?
189099	Why do we need yellow light in a traffic signals ?
189100	What is the best government job in India ?
189101	Can I claim my spouse as a dependent on my US tax return ?
189102	How can I claim my spouse as dependent on my US tax return ?
189103	What makes us a good human being ?
189104	Which is best phone ? Around 15 k ?
189105	How many seat are available in IIT for civil engineering ?
189106	How many seats are available in IIT for civil branch ?
189107	What are the differences between an LED and an LCD ?
189108	What is the selection process for TCS ?
189109	What is TCS selection process ?
189110	Which are the best universities in Europe for doing Masters in Materials Science ?
189111	What are the best European colleges for pursuing Master in Materials Science ?
189112	How can I improve conversation with somebody ?
189113	How do entrepreneurs get startup ideas ?
189114	Which novels should a CAT aspirant read ?
189115	Being a CAT aspirant which books or novels should one read for preparation ?
189116	What is the difference between FBI and CIA ?
189117	What's the difference between CIA , NSA , FBI , and Homeland security ?
189118	How are the numbers of Social Security determined ?
189119	How are Social Security numbers assigned ?
189120	What is your review of Mohenjo Daro ?
189121	What's your review on Mohenjo-Daro ?
189122	What are the 5 authentic resources of software engineering (with brief descriptions) ?
189123	What are 5 authentic resources of software engineering with brief descriptions ?
189124	Why are there pumpkins on Halloween ?
189125	What has pumpkin got to do with Halloween ?
189126	How can I access Google services from China ?
189127	How do you access Google when you are in China ?
189128	Who named Dhoni's shot as helicopter shot ?
189129	When did Dhoni's helicopter shot get it's name ?
189130	Is online learning the backbone of future education ?
189131	Would a Trump presidency help or hurt Singapore ?
189132	What would be the impact of a Trump Presidency on Singapore ?
189133	Is it true that black money helped Indian economy during global recession ?
189134	Is it really true that black money saved India from a recession during the period of 2007 to 2009 ?
189135	`` How do you deal with people that'' `` are always right'''' even when they are wrong ?''
189136	Did you know that Columbus might have been a Jew ?
189137	How do you calculate tensile strength ?
189138	How does one write a Python library ?
189139	I want to write a python library for my work . What are the proper steps ?
189140	What is the best thing to learn in software development ?
189141	What is the most important thing you learned in software development ?
189142	Can yoga poses increase height ?
189143	Is it possible to increase height after 21 ? Through Yoga
189144	What are some tips for finding inspiration to write a story ?
189145	Where do you find inspiration to write your stories ?
189146	What are the different types of seismic waves ?
189147	What was the best memory during your childhood ?
189148	If everyone in the world spoke the same language , would there be more or less conflict ?
189149	Would the world be a more peaceful place if everyone spoke the same language ?
189150	Why are women's shorts shorter than men's shorts ?
189151	Why are girls shorts proportionally shorter than boys ?
189152	I just started using Quora so can you tell me features of it ?
189153	Which countries have free higher education ?
189154	How do I know what interests me the most ?
189155	What are the best ways to study internal medicine ?
189156	What is the best way to study internal medicine ?
189157	Could a message be put on the surface of a atom ?
189158	Could you put a message on the surface of an atom ?
189159	How do I track my lost phone ?
189160	What is the unit of time constant ?
189161	What is the unit of time constant ? How was this determined ?
189162	How can I find a really good immigration lawyer ?
189163	What are some good ways to find a good immigration attorney ?
189164	How do I catch a Romance scammer ?
189165	How do I track a romance scammer ?
189166	A processor running at 3 GHz consumes 100 W of dynamic power . How much dynamic power does the processor consume at 4 GHz ?
189167	2 . A processor running at 3 GHz consumes 100 W of dynamic power . How much dynamic power does the processor consume at 4 GHz ?
189168	What is the hardest jobs in the world ?
189169	What is the hardest job in the world ?
189170	What is the best diet for weightloss ?
189171	What are some fun things to do so you don't get bored on Friday night ?
189172	When and how will India get a permanent seat in UN security council ?
189173	Is Quora only for intelligent people ?
189174	What is the primary cause of voter apathy ? What's the difference between voter apathy and voter fatigue ?
189175	What's the difference between voter apathy and voter fatigue ?
189176	Where is the strangest place you've masturbated ?
189177	Which is the best car air freshener ?
189178	What is the best car air freshener ?
189179	Why can't your switch statement data type be long , Java ?
189180	Why is long type unusable in a switch statement in Java ?
189181	`` What is that best way to become a'' `` success'''' in life ?''
189182	Question That Contains Assumptions : Why isn't Hillary Clinton in prison ?
189183	How do I prepare for the CAT in two months ?
189184	How can I prepare for CAT 2016 within two months ?
189185	Would you be buying iPhone 7 ? Why or why not ?
189186	How can someone be so heartless ?
189187	How can a person be so heartless ?
189188	Where can I download game of thrones episode 4 season 6 ?
189189	Where can I download game of thrones season 6 torrent ?
189190	How do I to become a sovereign citizen ?
189191	How can I become a sovereign citizen ?
189192	What is the most happiest moment in life ?
189193	I like my teacher . What should I do ?
189194	I think I like my teacher . What do I do ?
189195	In India , which is the best consultancy to get a job abroad ?
189196	Which is the best consultancy in India for getting a job abroad ?
189197	Why do people belive in god ?
189198	Why do people believe in God ? What is the real faith in God ? How do you believe God ?
189199	What is the best way to increase stamina for sports ?
189200	Which is the best way to increase stamina for sports ?
189201	How do we use fpga ?
189202	What is FPGA ? How does that works ?
189203	Anybody willing to do online group study for cfa level 1 exam 2015 ? Let me know
189204	How can I join Whatsapp group of CFA level 1 aspirants ?
189205	Should I become a doctor or lawyer ?
189206	Should I become a doctor or a lawyer ?
189207	How do celebrities wear different costumes in every event , will they again wear the clothes that were wear by them before ?
189208	How is it that celebrities rarely wear the same clothes and accessories ? What do they do with them after wearing them once ?
189209	What's the best English translation of the Quran ?
189210	I scored 153 in SSC CGL 2016 tier 1 . How much should I score in tier 2 to get into the CSS ?
189211	I got 155 in tier 1 in CGL 2016 what should be the good score in tier 2 for ending up with a good interview post like ASO in CSS ?
189212	What do I talk with a girl ?
189213	How can I talk with a girl ?
189214	How big is observable universe ?
189215	How big is the observable universe ?
189216	How do I get loan on existing business in india ?
189217	How do I get loan on non existing business in India ?
189218	How practical is drone delivery project ?
189219	Is drone delivery possible ?
189220	If Hillary Clinton is assassinated before the election , how will the Democratic nominee to replace her be chosen ?
189221	What questions are usually asked during an interview for an iOS developer for a fresher ?
189222	What questions are usually asked during an interview for an iOS developer ?
189223	What is the history of Thanksgiving day ?
189224	What is the history of Thanksgiving ?
189225	Which is best career to choose between Oracle Retail and Angular JS ?
189226	Which is better platform to choose between Oracle Retail and Angular JS with Scala ?
189227	What is one of the best books to learn electronics from ?
189228	Does masturbation affect muscle gain ?
189229	What are the factors of production ?
189230	What are the different factors of production ?
189231	What would happen if India completely bans all imports from China ?
189232	What is the best online computer science course ?
189233	What is the best online computer science/programming course ?
189234	What all the points to note to lead healthy life ?
189235	What should I do after completing graduation in engineering ?
189236	What can I do after completing engineering ?
189237	`` What does'' `` All's Fair in Love and War'''' mean ?''
189238	What does all is fair in war mean ?
189239	What is considered a normal menstrual cycle ?
189240	What is considered a normal variation in a menstrual cycle ?
189241	Is cold fusion possible ? Or is it just a theory ?
189242	What do the top salespeople you have worked with have in common ?
189243	What is the easiest way to make money online for a 14 year old ?
189244	How do I make easy , fast money online as a 14 year old ?
189245	Why did Hillary lie about Benghazi and say it was because of a video ? Was she trying to protect Obama's re-election chances ?
189246	What is the GRE syllabus for mathematics ?
189247	What is the math syllabus for GRE ?
189248	How good is a career in digital marketing ?
189249	Is learning digital marketing good or not ?
189250	How do I train myself to build mental visualisation skills like Nikola Tesla ?
189251	How do I train my visualisation ability to be as good as Nikola Tesla ?
189252	How do I start IAS preparation at home ?
189253	How can I start IAS preparation in home ?
189254	Is Arvind Kejriwal the most honest person in India ?
189255	Do you believe in physchic ability ?
189256	Do you believe in psychic abilities ?
189257	How do I become a successful person ?
189258	What are some of the best books about the 2008 financial crisis ?
189259	What is the best book on the 2008 Financial Crisis ?
189260	Which restaurants in San Francisco will serve foie gras since the ban has been overturned ?
189261	Which restaurants in San Francisco will continue serving foie gras after the ban ?
189262	How do I increase my concentration power without meditation ?
189263	How can I improve concentration without meditation ?
189264	When is the best time to go abroad to study ?
189265	What's the best time to go abroad and study ?
189266	When will the USACO 2016-2017 schedule be release ?
189267	When will the 2016-2017 USACO schedule be released ?
189268	Is being an Indian guy really difficult to date a white girl ?
189269	Will my sex drive and inability to climax level off if I stay on Prozac longer than the ten days I'm on it so far ?
189270	Will my sex drive return if I've only been on Prozac for ten days ?
189271	Can anybody achieve an orgasm without ejaculation and how ?
189272	Is ejaculation without orgasm normal ?
189273	How fast could Usain Bolt run a mile ?
189274	How fast could Usain Bolt run 1 mile in ?
189275	Is alien life possible ?
189276	How possible is it that alien life exists ?
189277	What are some examples of polar covalent bonds ?
189278	How can I download video episodes from voot or hotstar ?
189279	What is the way to overcome the stage fear ?
189280	What factors affect health the most ?
189281	What are the factors that affect health ?
189282	Is chiropractic care safe for pregnant women ?
189283	How much of demonetized money , might not come back to the banking system ?
189284	How much money has come into banking system till date due to demonetization of currency ?
189285	Who are the best Hadoop Online training institute ?
189286	What is the best online training institute for Hadoop ?
189287	I take lexapro at night time before going to sleep , will it work or do I need to take it in the morning ?
189288	Should I take lexapro in the morning or before bed ?
189289	Who do you think has dominated in the first us Presidential candidate debate 2016 ?
189290	What is the difference between Static Websites and Dynamic Websites ?
189291	What is the difference between a dynamic and a static website ?
189292	`` Which is the best to read ! Is it'''' how to read a book of 1940'''' or the second version of 1972'''' ?''
189293	`` Which is the best to read ! Is it'''' how to read a book 1940'''' or the second version of 1972'''' ?''
189294	What are the Advent candles names' origins ?
189295	What do the candles at Advent mean ?
189296	Is washing your hair daily with shampoo harmful ?
189297	Who do countries typically borrow money from ?
189298	What are some good places to visit at Kanyakumari ?
189299	How can I prepare smartly for UPSC CSE ?
189300	Who uses cryptography today ?
189301	Who uses cryptography ?
189302	How do I prove ties to the home country if I am not working nor studying ?
189303	What is the best security camera sytems ?
189304	What are some good security camera systems ?
189305	Ride It Out Abigail Mac & Preston Parker (Doctor Adventures) ?
189306	Ride It Out Abigail Mac & Preston Parker (Doctor Adventuress) ?
189307	What is the most delicious dessert you have eaten ?
189308	What's the most delicious dessert you've eaten ?
189309	What is GitHub primarily used for ?
189310	Who invented the ghost ?
189311	Who invented ghosts ?
189312	Where can I find best biryani in bangalore ?
189313	Where can one find the best biryani in bangalore ?
189314	Adam D'Angelo : When will Quora have night mode ?
189315	Does The Huntsman : Winter's War have post credits scenes ?
189316	Does The Huntsman Winter's War have post credits scenes ?
189317	What is epithelial tissue ? What are some examples ?
189318	What are some examples of epithelial tissues ?
189319	Are NFL games rigged ?
189320	Do you think that NFL games are rigged/fixed ?
189321	What is the current status in comparative public administration ?
189322	What is the current status comparative public administration ?
189323	What are some ways to amplify linear motion and what are some of its applications ?
189324	How do you amplify linear motion ?
189325	What is the size of prototyping tool market ?
189326	What is the size of prototyping tool marketplace ?
189327	Is Game of Thrones really that good ?
189328	Is Game of Thrones good ?
189329	How do I raise a puppy ?
189330	How did you turn your life around ? What lessons can you share for others to benefit from ?
189331	Which event turned your life around ?
189332	Is there a way to track historical Twitter followers for over a year ago ?
189333	Is there a way to track the follower growth over time on Twitter ?
189334	What is the importance of zero ?
189335	What is importance of zero ?
189336	Where can I find an HDMI cable for Samsung Galaxy J7 ?
189337	Where can I find an hdmi cable for the Samsung Galaxy J7 ?
189338	What will Trump do if he loses ?
189339	What will trump do when he loses ?
189340	How do I get good grades in IELTS speaking section ?
189341	How do I get a good score in the IELTS speaking section ?
189342	What is net banking ?
189343	What does net banking actually do ?
189344	Hello dear's people . i have a fictief research quest , If someone standing from 13 feet away from me with a 50AE Desert Eagle with ammunition 300grain hollow point hornady xtp 1475fps at the muzzle he's shooting one bullet between my eyes ? I say it with emphasis if there any smallest chance that i could survive ? So yes how much % chance can u that analyse in detail . I hope u have the answer that im looking long time Regards J.
189345	`` How do you define'' `` the one'''' ?''
189346	How do you define the one ?
189347	What Civil Liberties did President Lincoln suspend during the Civil War ?
189348	What civil liberties did President Lincoln violate ?
189349	How do I get the address of someone who was trying to login to my Facebook account ?
189350	How can I find out if someone tried to login on Facebook account ?
189351	How one can crack any interview ?
189352	Does Quora allow advertising ? Where are the ads ?
189353	Has Quora allowed advertising ?
189354	What is the best way to understand computer networks ?
189355	What is the best way to understand computer networking ?
189356	How can I earn money on Instagram ?
189357	How can you earn money on Instagram (male) ?
189358	What are the best Naruto episodes ?
189359	What are the best free iPhone ringtone apps ?
189360	Is Nifty Trade1 is legit or scam ?
189361	Is Niftytrade1 legit or scam ?
189362	What is it like to be raised by Indian mother ?
189363	How do people know if they have diabetes ?
189364	How do you know if you have diabetes ?
