490487	To offer wifi for my cafe for 35 users on laptops and mobiles (70 devices total) . What is the best setup in terms of Internet speed , routers , etc ?
490488	What are the most popular car brands in Asia ?
490489	How do I improve diesel colour from colour 6 to colour 2 ?
490490	Due to bike rides for the past 6 months , my face has now turned into dark complexion from fair . How do I regain my colour ?
490491	Did Kurt Atterberg , the Swedish composer , have Nazi sympathies ?
490492	How does one successfully get a great business idea ?
490493	LGBTQI Cultures : What are some of medical but nonsurgical procedures for male to female gender reasignment ?
490494	What are the best countries to work in for Indians ?
490495	What is the derivative of x ^ 2sinx ?
490496	What are the surgical and non-surgical options for treating an anterior cruciate ligament tear , and what are the possible long-term impacts of the injury and different treatments on one's ability to have an active sports life ?
490497	Which sport is associated with the fewest injuries long term ?
490498	Why is it better to sleep without underwear for females ?
490499	Is Steph Curry human ?
490500	Why is Steph Curry popular ?
490501	How do I learn app development ?
490502	Why is the capital of Assam Dispur and not Guwahati ?
490503	Are the IIT Guwahati hostel buildings safe ?
490504	Has anyone on Quora answered their own questions ?
490505	Why do so many people on Quora answer their own questions ?
490506	If your boyfriend doesn't ever gift you anything ever , never does anything romantic for you , does that mean he doesnt love you ?
490507	Is there any device by which I can on/off my electrical device at desired frequency ?
490508	Is sony camera connected to the internet ?
490509	After setting up Outlook (Exchange) on a Mac , I can't see the groups that were previously created in Outlook on the PC . How can I fix this ?
490510	Is Seinfeld or It's Always Sunny in Philadelphia more absurd ?
490511	I am an electrical engineer working as bms operator.can I switch to software field ?
490512	I am an average student with average MAT score . Where shold j join for MBA in India ?
490513	What's the electric field intensity and direction at its orthocentre if at the vertices of a triangle there are +5 C , -7 C , -3 C of charges respectively ?
490514	PQR is a triangle QS , and RT are drawn perpendiculars from Q and R on PR and PQ respectively . How can I prove that the triangle is isosceles ?
490515	Which is the best comedy TV series currently ?
490516	What are the best way to reduce belly fat and build flat stomach ?
490517	What are some reviews of the Top Gear Vietnam Special Episode ?
490518	When is the next episode of Top Gear going to air after the Patagonia special ?
490519	What is the Tamil word for apple and orange ?
490520	What do two apples and three oranges add up to ?
490521	What is parallax scrolling ?
490522	How are you enjoying your winter nights ?
490523	What do I do when me and my dad hate each other I can't wait till I move out and neither can he I'm 14 and I have harsh words for him and pure hatred ?
490524	What are the biggest challenges Google faces as a company ?
490525	What are Google's biggest challenges ?
490526	How do I get people answer my question in Quora ?
490527	Do people answer questions in Quora only to get upvotes ?
490528	How old do you have to be to go to a strip club ?
490529	My 5 years old son doesn't want to train (table tennis) and every time I take him to the club he starts to cry . I talked to him gently many times and urged him to go at times . What should I do ?
490530	What universities does Kimball International recruit new grads from ? What majors are they looking for ?
490531	Will a 230gr .45 jacketed hollow point penetrate the standard interior home wall ?
490532	Why do Spec op handguns usually fire .45 ACP and not 9mm ?
490533	What are some movies similar to The hunt (2012) and 12 angry men ?
490534	Why mensurating is still a taboo in many parts of India ?
490535	How did Srinatha Mahakavi die ?
490536	How can I dream and take control of it ?
490537	Why is my period 3 weeks late ?
490538	What is the best laptop for an IT student ?
490539	How do I make a duplicate of an existing Firefox tab ?
490540	What can you do if you have nothing left for you in your country ?
490541	What gaming console to buy in 25k and also a good monitor with it ?
490542	What is the scope of getting a job after completing MS in aerospace engeering from Canada ?
490543	How is Satya Nadella in person ?
490544	Can Satya Nadella code ?
490545	`` What is the right way to say'' `` you're welcome'''' in Italian ?''
490546	`` What is the right way to say'' `` live free'''' in Italian ?''
490547	What is a cognitive paradigm ?
490548	How do I get paid for answering these questions ?
490549	How can I get paid to answer questions ?
490550	How do I get my refund on my TATKAL WT waiting ticket after chart preparation ?
490551	Could Hillary's pneumonia have been introduced into her system on purpose by someone opposed to her winning (like Trump or Putin) ?
490552	If Hillary is indicted during the general election , can Bernie take her place or does Trump automatically win ?
490553	Why we use two flags in byte stuffing ?
490554	What encoding uses the least bytes but has most characters ?
490555	Loanwords : What are the most common words borrowed from Spanish that native English speakers use ?
490556	Loanwords : What are the most common words borrowed from English which native Spanish speakers use ?
490557	What do modern day Italians think of the Medici Family ?
490558	`` How do you say'' `` the family'''' in Italian ?''
490559	Is it true that the current generation does not respect elders ?
490560	What is true respect ?
490561	Where a freshere statistician get freelancer projects ?
490562	What do use to create a gaming fansite ? Wordpress vs Enjin ?
490563	If I want to create mmorpg game with a team , where should we start and what should we do step by step ?
490564	What's the next potential company that can beat Apple ?
490565	How is one granted a diplomatic license plate ? Is it only for politicians ?
490566	Is it good if we shift india's time zone to 6 hours ahead of gmt ?
490567	What is the climate of California's coastal regions , and how does it compare to the climate in Pennsylvania ?
490568	If you have an Amazon gift card ID , what is a way to find its gift card code in order to add balance to my account ?
490569	`` What are examples of situational irony in'' `` Othello'''' ?''
490570	What are some examples of a comedic irony ?
490571	When is the best time to prepare for Usmle , I'm a 2nd year mbbs student in India ?
490572	Which U.S. state has the best environmental protection policies ?
490573	Who was the best U.S. president in terms of their domestic policies ?
490574	Is there any way to stop getting answers of self proclaimed lovers out there on Quora ?
490575	How can I improve my Quora newsfeed ?
490576	I have 7 hours spare at London Heathrow Airport (LHR) . Is there anything interesting to do on that schedule ?
490577	What is an interesting thing to do on a 12-hour layover in Heathrow , London in early December ?
490578	How do I make my quadcopter autonomous ?
490579	How can I make a quadcopter myself ?
490580	What is a block deal in share market ?
490581	What is the market share for each of the various Ad blocking companies ?
490582	Why was Osama Bin Laden killed but not captured ?
490583	How does one earn more money amidst lack of opportunity ?
490584	How should I start revision for Neet and AIIMS ?
490585	What is the corporate culture like at Beacon Roofing Supply ? How is the culture different than other companies ?
490586	What are the pros and cons of intimidating others ?
490587	What is it to get circumcised without anesthesia for an adult person ?
490588	Is Google Allo dangerous in terms of privacy invasion ?
490589	Why does Edward Snowden not like Google Allo ?
490590	How do I avoid emotional over eating ?
490591	Which laptop did Aman Goel use ?
490592	Which smartphone did Aman Goel use now ?
490593	How do I get job at Radio station in Jalandhar ?
490594	I am getting 440 marks in neet phase 2 , can I get bds in up ?
490595	What makes Playdough soft ?
490596	I feel like dying . I need someone to talk to . Is there any way I can talk to anyone and stay anonymous ?
490597	What are the requirements to become president in the United States and how are the requirements different in Tanzania ?
490598	How do I know if a girl is a virgin ?
490599	How competitive is the hiring process at Life Technologies ?
490600	Where shall I start just after completing r programming course on one of the e-learning site ?
490601	Why is realism important in international relations ?
490602	I am a cross platform mob app developer . What are the other technology I must know ?
490603	Why would I get a certified letter from the IRS ?
490604	What is a certified letter from the IRS ?
490605	`` What process takes place to transfer the'' `` powers'''' of the President to the Vice-President in the event the VP is elevated to the Office of President ?''
490606	When an American president dies or has to hand over his functions to the VP , how long after that do the new elections take place ? What if the next elections were already planned within that period or shortly after ?
490607	Would you date someone with a learning disability ?
490608	Was Osama bin Laden a coward ?
490609	Is seven a lucky number ?
490610	What are some good examples of comparative advertising ?
490611	Which studio does the best ecommerce photography ?
490612	Which studio does the best ecommerce photography Delhi ?
490613	What is the meaning of CKWL in Tatkal ?
490614	Has anyone got the Nougat update on Oneplus 1 ?
490615	Has anyone got the Nougat update on Oneplus 3 ?
490616	Do you know some economists who support demonetisation ?
490617	`` What is'' `` scene'''' ?''
490618	`` What is a'' `` scene person'''' ?''
490619	Are Arabs ethnically African ?
490620	What should I do if I have a spider on my head ?
490621	What kind of spider is this with a brown body , black head , and black tipped legs ?
490622	What is wetness ?
490623	How should I say 0000 on the phone ?
490624	Why is there so much feminism in countries like USA and Australia ?
490625	South Africa and Australia almost have the same degrees of latitude , so why is there a difference in the skin color between the two countries ?
490626	Who are the competitors of salefee ?
490627	Does every Ukrainian speak Russian ?
490628	Do Russians understand Ukrainian ?
490629	What does the transformer on my laptop power cable do ?
490630	Why is Google asking for credit card information to check the robots while they can use reCAPTCHA ? Are they playing smart here ?
490631	Why does Google Play Music require a credit card for verification when it can access payment methods through Google Play once the user has signed in ?
490632	What happens if you inject air into your veins ?
490633	Is English the most latinized Germanic language ?
490634	How is English primarily a German language ?
490635	Which is the better nucleophile alcohol or water ?
490636	Why is ammonia a stronger nucleophile than water ?
490637	Can Health services research be a STEM major ?
490638	A CS major told me to drop out of school because I don't have a STEM major . How should I react ?
490639	I got149 in NMAT.what are my chances to get call a from NMIMS Mumbai for pharmaceutical MBA ?
490640	What is the historical relationship between the Mexican war and War of 1812 ? Any thoughts ?
490641	I want to do MS in universities , but my GPA is 2.3 / 4.0 . Is there any chance of getting in or which university cant I get ?
490642	I want to do MS in top universities , but my GPA is 2.3 / 4.0 . Is there any chance of getting in ?
490643	What were the advantages and disadvantages of long range artillery during WWI ?
490644	Given the effectiveness of artillery in WWI and WWII , why was it not used more ? What was the limiting factor ?
490645	I am 21 and working , but I still don't know what I want to do in life ! How can I figure it out ?
490646	How harmful could it be to get cut by a rusty nail ?
490647	How can I treat an infection caused by a rusty nail ?
490648	Why is India called ` bharat' in Hindi and ` India' in English ?
490649	Formula 1 : Why can't Ferrari compete with Red Bull ?
490650	How come Red Bull Racing is so far ahead of the other Formula 1 teams ?
490651	Do fresh water fish contain more salt than marine water fish ?
490652	Why am I allergic to fresh water fish but not salt water fish ?
490653	Do we know how Ancient Egyptian sounded like ?
490654	What language should I use to create software ?
490655	What's the best snowboarding experience you've ever had ?
490656	What is camber thrust ?
490657	How negative camber provide benefits to vehicle ?
490658	If I do only VMC modules (theory and exercises) will that be enough for getting a very good rank in jee mains and advanced ? (correspondence student)
490659	What is the scope of C-DAC Certificate Course in Network Security (CCNS) ?
490660	Who discovered the R button in telephone ?
490661	Who discovered the telephone ?
490662	My laptop is not starting and is showing a blinking cursor only . What should I do ?
490663	Why is my windows 7 laptop too slow to start ?
490664	How do I learn Mandarin at home ?
490665	What is the best way to learn Mandarin online ?
490666	Did Freud and/or Jung base their theories on concrete facts or on theories ?
490667	What type of applications go lang is targeted for ?
490668	Is Go the best programming language for next generation A.I. and machine learning applications ?
490669	My mobile no. 8007358558 pls two month call deatial ?
490670	How does money and power affect a youth ?
490671	What makes gas prices rise ? How can this be stopped ?
490672	What makes gas prices rise quickly ?
490673	What are some of the biggest lies that you have ever heard ?
490674	What is the biggest lie you have ever heard a leader tell ?
490675	If water freezes at exactly zero degrees Celsius , and ice melts at exactly zero degrees Celsius , what would happen to a bowl of ice and water at exactly zero degrees Celsius ?
490676	How long would it take for a cubic meter of ice to melt at 20 degrees Celsius ?
490677	Hypothetical Battles : Who is more evil , Dolores Umbridge or Joffrey Baratheon ? Why ?
490678	Is Theon Greyjoy better or Joffrey Lannister a.k.a Baratheon ?
490679	Which is better : Disneyland or California Adventure ?
490680	What do critics and people who are smart about amusement parks think about California Adventure , the sister park of Disneyland in Anaheim ?
490681	Does Donald Trump have a trophy wife ?
490682	Is it true that 70 % of Indian Punjab's youth is drug addict ?
490683	What is the most overrated tech device in 2016 ?
490684	What are some of the causes for teeth to turn black ? How can you whiten them without any dental procedures ?
490685	How do you whiten fake teeth ?
490686	I'm scared of death . What do I do ?
490687	I'm scared of death.What do I do ?
490688	As a tester , how can I break a payment gateway ?
490689	Can a software engineering student write an ICET exam ?
490690	Does it worth to use Scala in Java project ?
490691	I told my friend's secret to my boyfriend and he told someone else . I feel so guilty for what I have done . How can I make things right ?
490692	What are the best mobile interactive agencies ?
490693	What are the best Mobile App Re-Targeting networks ? (For a Mobile Game)
490694	How do I use protein shakes ?
490695	What is Theory U ?
490696	What is a theory ?
490697	`` What is a'' `` cover song'''' ?''
490698	What do the different cards mean in Cards Against Humanity ?
490699	What do I need to know to play Cards Against Humanity ?
490700	Government of India : Why is it expenses charged on consolidated fund of india is not votable by parliament ? Are there any amendments to it or any cases regarding it ?
490701	What is the difference between parliament and government (India) ?
490702	Do any of the religious text make mention of the time machine ?
490703	What are the best universities to study masters in GIS and remote sensing in Europe ?
490704	What is the difference between Instagram and Flickr ? Which is better for me to use when I want to take pictures of craft items I make and my garden ?
490705	What are the major differences between Flickr and Instagram ?
490706	How do I solve this rational expression ?
490707	How do I solve equations with rational expressions ?
490708	How should I prepare for gate cs ?
490709	How do I prepare for GATE CS 2018 ?
490710	What will be the next big thing after globalization ?
490711	What is your experience about Reliance Jio sim card ?
490712	What are some great poems ?
490713	What are some great poem topics ?
490714	What is more important to become a good programmer ?
490715	Is being good at mathematics important to become a good programmer ?
490716	What tools Facebook uses for application lifecycle management ?
490717	Is there any good Facebook page management tool ? Paid or Free both are ok
490718	What is the perfect time to register for CMA for Ca-IPCC student ?
490719	Is it worth completing Dragon Age Origins before playing Dragon Age 2 ?
490720	What are Dragon Age themes ?
490721	Can you play iTunes rental videos on a TV screen ?
490722	How do I stop iTunes downloading TV shows on my Mac ?
490723	Person on a long hunger strike will have less urea in urine why ?
490724	Why urea is more concentrated in the urine than in the filtrate ?
490725	Why is Hour of code so popular ?
490726	Is there a possibility that water will seep into your body when you take a shower ?
490727	Is chlorinated shower water bad for the more sensitive areas of the body ?
490728	Has industrialization & technology innovation done more to create the economic middle class or destroy it ?
490729	How do I download the flash season 2 full episodes ?
490730	Where can I watch the flash season 2 Episode 11 ?
490731	Which is the book or tutorials on photography for non-DSLR camera owners ?
490732	What are some good books on the commercialisation of food and water ?
490733	In the Angry Birds movie , why do the birds have legs ?
490734	Which bird you like most in Angry birds ?
490735	How can I truly find happiness ?
490736	What are some reviews of ibsnetaccess.com ?
490737	I have a small piece of glass in my foot and can't get it can I leave it ?
490738	How difficult is it to learn French after German ?
490739	Is it easier to learn French or German ?
490740	How do I buy gems in clash of clans using visa debit card ?
490741	How can I use FreeMyApps to buy gems in Clash of Clans if I live in India ?
490742	Why do Muslims use loudspeakers on their mosques ? Why do they promote their religion so much ?
490743	Why don't Western nations allow mosques to broadcast the call to prayer over loudspeakers ?
490744	Can black holes create superconductive materials through nuclear fusion ?
490745	Nuclear Fusion : Can magnetically contained plasmas tunnel through the confinement ?
490746	Can a bank issue a Demand draft for more than 50000 rupees ?
490747	If someone deleted their Facebook Messenger app can they still receive messages ?
490748	Can you still see someone's private messages if you delete your Facebook page ?
490749	What does it feel like to be inside a bank when it is being robbed ?
490750	Is it possible to crack ssc exams while working with tcs ?
490751	What were the major contributions of the political leaders during WW1 , and how are the compared to the ones during the Second Congo War ?
490752	What are the best software options similar to Ultrasurf ?
490753	Who are the people behind UltraSurf ?
490754	What exactly does bootstrap mean ?
490755	What exactly can I do with bootstrap ?
490756	Can I show all Amazon products on my e-commerce site ? What technology should I use ?
490757	Is it normal to have periods which last only 2-3 days at the age of 25-26 ?
490758	Is it normal to have a period for two days ?
490759	Can photovoltaic systems operate normally in grid-connected mode and still operate critical loads when the utility service is disrupted ?
490760	I heard Maharaja Patiala Bhupinder Singh died of boredom . Anyone knows more on that ?
490761	How can I meet British women in New York City ?
490762	When a venture capital firm fails/closes , what do the partners normally go on to do ?
490763	What are the best classroom training institutes for Linux RHCSA and RHCE in Pune ?
490764	What does formatting a SD card do ?
490765	How do I write project in resume made outside college ?
490766	How much would it cost to repair a chrome bumper that has a minor dent and scratches ?
490767	How much does it cost for an ACL reconstruction surgery with Blue Cross Blue Shield insurance ? What are the total out of pocket costs or breakdown of the medical bill ?
490768	How much does lap band surgery cost in Canada ?
490769	Is it possible James Comey is being blackmailed by some faction of the Trump campaign ?
490770	Does James Comey have his act together ?
490771	What is the cancellation fee for Geico auto insurance if I terminate my policy early ?
490772	Has your auto insurance premium gone up ?
490773	Why do I need TAN if I already have a PAN card in India ?
490774	Would I be able to study physics in university if I chose Biology , Chemistry ad Maths for A-Levels ?
490775	Should I drop my goal of becoming a physicist if I am unable to do well in JEE level (physics , chemistry and math) ?
490776	Why are Indians , despite being so bad at football , so excited about the Football World Cup ?
490777	What is it like to be a financial manager ?
490778	What is SWOT analysis for Ringing Bell ?
490779	A potential investor just asked to see my SWOT analysis . Is this normal ?
490780	My mobile video is 10 minutes long and 700 MB in size . What is the best way to reduce its size to 40 - 50 MB to upload it to YouTube ?
490781	How do I prepare for JEE main 2017 (Physics) ?
490782	How can I find wps pin on my galaxy S5 connected wifi ?
490783	How can we find wps pin of connected wifi on rooted android phones ?
490784	How do I clear eamcet in 15 days with a rank below 10000 ?
490785	How do I crack VITEEE 2016 ?
490786	What is the cruelest thing you've ever done ?
490787	What is the cruelest thing you have seen ?
490788	If I edit my answer on Quora , does a notification show up for users who are following the question ?
490789	Is it okay as a driver to use a minivan for ride-sharing , Uber or Lyft ?
490790	Is it better to take the 18-105 lens instead of the 18-55 ?
490791	If I have booked my railway ticket in any AC class and it's not confirmed , then should I be allowed to travel in that class or a sleeper class ?
490792	How do I fail in an interview ?
490793	`` How could'' `` mere mortals'''' with IQ's under 150 write an IQ test that could measure IQ's over 200 or even higher ?''
490794	Can an IQ test measure IQs higher than the designer of the test's IQ ?
490795	Do the latest Xiaomi phones work with 4G or LTE networks in the USA ?
490796	How do you make money with bitcoin ?
490797	How do I subscribe to the Quora Digest ?
490798	How can I read a Quora Digest ?
490799	I am a 21 year old software engineer making 300K a year . What are the best Systematic Investment Plans ?
490800	Am a 21 year old in my first year in software Engineering.What is the best option ? Details in comment .
490801	Why do I always feel lonely ? Except for the times am busy
490802	How do airplanes manage to stay inside the atmosphere ? Please see drawing .
490803	Do airplanes need to account for earth's curvature or does gravity do all the work ?
490804	What is the future of Big Data and IOT to take it up as a future career after some years of exp in Indian IT industry ?
490805	Is Alibaba.com some sort of global distribution website ?
490806	What are some things about Tamil culture that everyone should know ?
490807	What are some things about Tamil weddings that everyone should know ?
490808	Can I pay by cash to ola ?
490809	Why do we bias the emitterbase junction of a BJT with a battery Veb which is nothing but potential barrier between emitter-base junction diode ?
490810	Vidyamandir Classes , New Delhi : What was your worst VMC rank but still you are at a good place ?
490811	What is considered a good rank in Vidyamandir booster tests ?
490812	What are some good podcasts on branding ?
490813	The Secret Garden (1911 book) : Why does Archibald Craven abandon his son ?
490814	Does AWS provide Oracle for storage ? Is there a free trial for this ?
490815	Are any of Katie Melua's songs suited to dance a waltz to ?
490816	What are the urls to download hindi and other songs in flac format ?
490817	Is there any embarrassing story because of your significant other having a twin ?
490818	Can wife take legal action towards a woman who is having affair with her husband ?
490819	`` What is the meaning of'' `` assalamualaikum'''' ?''
490820	What is the meaning of mean mugging ?
490821	What are the fertilizers and pesticides used for Dahlia plant ?
490822	How can we make fertilizers without using oil ?
490823	Are Taiwan and China two different country ?
490824	How can I score more in English writing section ?
490825	How mach money gave under the NPS scheme in each person ?
490826	What happens if I don't submit my provisional degree certificate with my Detailed Application Form (DAF) to UPSC because university has not issued it ?
490827	What happens if I don't submit certificates of any training that I have mentioned in my resume after clearing the interview for a company ?
490828	How should we backup our old chat and all new messages on Hike after reinstalling it ?
490829	If I uninstall hike and install it again , will I get new messages as well as previously send messages from hidden messages ?
