487552	Can a child consider a hurricane a traumatic event?
477138	Is it a good idea to work in Maldives?
338037	Can you go deaf from too much ear wax?
502752	Can specific musical chords or intervals trigger specific emotions? What chords, intervals and why?
502753	Why does blood doesnt show up much on chopped,near frozen fishes?
461660	How many rupees equal 1 dollar?
394644	Do sports players have to be human?
22137	Should we report Quorans who spout crackpot Physics ?
257700	How can I read Mritunjay written by Shivaji Savant online, written on Karna?
257701	What are some well-written and interesting Chinese-language novels for someone learning Chinese to read?
88053	What's the worst thing that could happen to you?
63532	What the Chinese food do you like?
443505	What is web services?
443506	What are web services?
2082	How do I see people I unfollow on Instagram?
341247	How do I unfollow a lot of people on Instagram, fast?
351266	What is the future of music?
351267	What is the future of music distribution?
9877	What is the first thing you would do as president?
448218	What specs should we expect in smartphones under 7k by the end of 2015?
486442	What are the differences between linear and non-linear multimedia?
486443	What's the difference between a linear and a non linear mechanic?
118041	How often should we pray?
118042	Why should we pray?
189307	What is liquid work?
189308	What is liquidation of a company?
256878	What are the points on the curve [math]x^2-y^2=2[/math] where the slope of the tangent is 2?
378721	What are the coordinates of the point on the parabola y^2+4x=9 in which the slope is 2?
418195	How much discount (on laptops) does Dell give to its employees in India? I'm Planning to but Dell Inspiron Dell Inspiron 15 3537 Laptop -- 4th Gen/ i7 processor/8gb ram/1Tb costing Rs60,990/--
157617	What do I use when the scenes cut back and forth - continuous, same, dusk/day or does there have to be anything at all?
157618	What are some 1 day vacation ideas? I'm only 18. I have a thousand dollars to spend. It would even be nice to get on a plane to my destination one day and back on the same day to go home. Would be cool if there way a beach right by the airport
150837	What summer programs are ideal for a high school junior interested in engineering?
150838	How do I study for high school in summer?
481655	Are you even really dating someone if you see them once per week for just a few hours?
481656	What should I do if I have gone on a few dates with a girl, but really don't want to see her again?
140103	Is Goa best for a Freelance Developer to live?
140104	What salary and perks do UP judges get?
18478	Should startup companies work with a recruiter to hire new talent?
149471	Which companies in New Haven, CT regularly hire contractors? What are they like to work for?
217687	What are some useless facts?
217688	Can you tell me a useless fact?
531773	What is the contribution of Bollywood in Indian economy?
531774	Do you think Bollywood is in any way helping the Indian economy?
6133	What would happen if you dropped a marble size object, that happens to be heated to 1,000,000 Celsius, into the middle of the ocean?
6134	Why do some people view death as fear provoking while others do not?
502724	What are healthy foods that are also considered good?
502725	What foods are considered healthy by nutritionists and Americans?
99518	Will vasodilation increase cardiac output and venous return or decrease them? Because vasodilation has opposite effects on veins and arteries
99519	Why is an artery red and veins blue?
73786	How do you resolve conflict?
530851	How can I resolve conflicts in a marriage?
372761	What happen when the dc motor starter connected in to the ac motor?
372762	What happen when the ac motor starter connected in to the dc motor?
276782	Has America divided since the election?
276783	Do textbook publishers run a cartel-like operation with schools in order to make money off students and their families?
532112	Why my phone says full storage even if it has some space left?
532113	Do employees at CDW have a good work-life balance? Does this differ across positions and departments?
326866	What is the most romantic thing someone said or did to you?
326867	What is the most romantic thing someone has said to you / done for you?
142678	What is the world's highest battlefield by altitude?
142679	Which is the highest battlefield in world?
12594	What are some examples of high school accomplishments?
12595	What should it be looking to be accomplishing academically as a sophomore in high school?
86348	What are some good lyric prank songs for your best friend?
212453	Can someone translate this picture to English?
212454	Can someone translate this image to English?
277951	What is it like being a doctor?
215966	What's it like being a doctor?
294195	How do I get rid of yeast smell out my homemade bread? What am I doing wrong?  Help appreciated.  Thank you...
294196	How do I get the smell out of a new down comforter?
90036	Is 5'2 tall for a 12-year old?
90037	Is 5'8-9 tall for a 12 year old boy?
318057	What is pixel mapping?
318058	What is pixels?
344515	Are gorillas or chimpanzees more dangerous?
344516	Are chimps or gorillas more dangerous and aggressive?
212848	What are cool math group names?
212849	What are some names for a math game?
332303	How can concentration increase?
125546	Art, chess and snooker - why does art not have the competitiveness that snooker/chess doesn't have?
125547	How do cricketers have fair skin?
40020	How accurate are cognate rules between Spanish and English really?
281568	"What does one learn from the movie ""Pulp fiction""?"
190517	"What is the meaning of the movie ""Pulp Fiction""?"
79900	Is HAL Tejas a world class fighter or a crap?
287565	What is your review of iPad 2?
287566	What is your review of iPad?
190469	"How come Dwayne ""The Rock"" Johnson does not compete in bodybuilding competitions?"
190470	How are people who have 3 hours sleep like Dwayne Johnson still able to work out at the gym?
160342	Could an American be considered Aryan in the eyes of the Nazis?
160343	What is the admission procedure in afmc for bsc in neuroscience?
41358	Why does it become harder to make friends as you get older?
463849	What are the requirements to perform a wedding?
277739	What events can be conducted for an Electronics Engineering Department fest?
73521	What technical events can I conduct in electrical and electronics branch?
69315	How do you even do yoga?
69316	How do you do yoga?
508776	What maximum marks achieved in neet?
508777	What distance can a bike go on reserve?
163193	Which is the best torrent site for bollywood movies?
63329	What is the best music torrent?
137533	Why are caesium and francium the most reactive metals?
137534	Which nonmetals are among the most reactive?
270473	I'm a third year undergraduate student, now. And I teach in my holidays ，in weekends.But I do not want to continue teaching, should I quit the job?
270474	I am a third year medical student interested in giving the USMLE. But I have not yet started preparing seriously. How should I start now?
300933	Can I restore deleted misc files?
109230	What is the greatest, most beautiful city in the world?
9637	What should be the first text to a girl whom you just met?
9638	How do you text a girl you just met?
2114	Where can I get very reasonable price for men's shoes in Sydney?
424682	Where can I found quality men's shoes in Sydney?
532472	What is the limit of transferring money from Paytm to bank account?
480733	I have been talking to a girl for past 3 months (Facebook and WhatsApp only). How can I know if she is in a relationship with me?
480734	I have known a girl for 2 years, but never talked to her. She is a frank girl. I don't know if she ignores me. How can I start talking and How do I win her heart? (I am an introvert person)
164788	What is a flexible benefit plan in a salary breakup?
232011	What would be my take home if my basic salary is 6lpa and flexible pay of 6lpa and Overall 13.68 lpa?
436216	Is it possible to achieve 0% body fat for humans?
436217	Is it possible for me to lose body fat percentage and gain some muscle without going to the gym?
172936	What of we made captain America shield with New Magnesium based alloy?
163138	What are facilities that an airline pilot get?
163139	Do airline pilots ever get sick of the view?
204796	Which are the most popular and genuine online shopping website in BRAZIL like amazon or ebay?
204797	Which are the most popular and genuine online shopping website in ISRAEL like amazon or ebay?
479128	How many houses are there in the US?
479129	How many homebuilders are in the US?
42884	How do I get all the list registered to your gmail account?
313929	Quora Question Templates: What is a good list of questions that could be asked for any moon on Quora?
456022	In Finding Nemo, what neighborhood in Sydney is the dentist's office in?
456023	Who is Peach in Finding Nemo?
140349	Why is Autism harder to notice in females?
414975	Could there be a cure to fix mental illnesses?
209085	Can we permnantly cure from mental illness?
98002	"What's ""philosophy""?"
469949	California Senate Bill 234 (2011): Will digital goods be taxed after September 15?
469950	How much is 15% tax of gym?
268667	Do I have 80HD?
268668	Do you have ADHD?
223630	What is a good book to understand human behavior?
69912	What is the deepest lake in Europe, and how does this lake's flora and fauna compare to that of Lake Victoria?
519760	How do I remove dead skin at my knees?
486000	I would like to do MS in aerospace engineering in USA.My GRE score is 306 Q:161 ,V:145.I have 7 CGPA in btech.what are the universities I can apply?
486001	What are the best tools to build a responsive website following the Material Design guidelines?
250090	I want to take a pee every 5 minutes, after taking an amphetamine. What can it be?
397391	What does rebooting my phone mean?
475592	Can a web designer learn Java?
475593	Where can I buy pure bhringraj powder in Hyderabad?
34438	What is the best facial recognition software on the market?
63997	How do I get started with using bot with JavaScript?
63998	Can we make bot using JavaScript?
61284	What is the fastest tank to this day?
378671	Are the ready meal servings provided for astronauts aboard the International Space Station hunger satisfying?
378672	Where can I get best Loan service for my Business?
219949	How can I take a selfie with Stephen Curry?
86406	Do we or the so-called jews, or other controversial micro groups, define their true nature and deserved destiny?
2075	Bollywood: Which is currently the worst Bollywood movie?
137629	Which is the worst Bollywood movie you have ever seen and why?
537033	How do you create protocol for your blockchain?
335228	How do you build a blockchain?
58196	Is it correct to say twenty hundred when referring to the number two thousand?
58197	"Is it correct to say ""she says me""?"
152135	Should you pop a stye on your eye?
152136	Is a stye the same as pink eye? If not, how do they differ?
323575	What does it mean when I dream of a cow chasing me and I'm trying to hide?
427023	What does it mean when my family wants me to die in a dream?
251020	Thinking about booking a trip to America. Have never been. What locations would you visit if you had three weeks?
251021	I have never been to Taiwan. Where does Ms. Hsieh think I should go if I only have three days to spend?
321432	What can a self-employed claim for?
321433	If equipment, subscriptions to a photography institute, etc. are bought before registering as self-employed, can they be claimed/added to an annual investment allowance (AIA - UK tax)?
64391	What's the of extended warranty on BMW X5?
369602	What are some unknown facts about Bill Gates?
37775	What are the big, mega dance clubs in Greece?
37776	What are the big, mega dance clubs in Chicago?
203180	Should a man change his underwear daily? Also, after wearing a pair of underwear once, is it advisable to invert it and wear it just one more time?
203181	Why do we need to wear clean underwear every day?
155789	Who are the best UX designers?
155790	Who are the best UX designers in Minneapolis?
270134	How do I make a game like clash of clans?
270135	How do apps like clash of clans make the characters?
517138	Who was Guhan in his previous birth?
517139	Who or what were you in a previous life?
54498	What is a decidual bleeding and a miscarriage?
54499	What is decidual bleeding?
226171	Can I ask math questions on Quora?
226172	Is asking math questions on Quora bad?
144496	Do I need to count calories if I only eat fruit and vegetables?
144497	If a high sugar diet is bad for you, then how can it be healthy to eat a lot of fruit every day?
29486	Who has the highest question/answer ratio on Quora?
415608	How do multiply two numbers using only for loop in C?
415609	How do I perform multiplication of two numbers in C by using only + operator?
495083	Do software engineers at Google learn and use popular frameworks and stacks, e.g. Java EE, Spring, Django or use mostly internal frameworks?
518252	What do Azerbaijanis (both from Iran and Azerbaijan) identify more with: Persian or Turkic culture?
518253	What causes increasing nationalism towards their own ethnicity among Azerbaijanis in Iran?
450296	How do I make a long distance relationship successful?
450297	Have you had a successful long distance relationship and how did you make it work?
449939	How can we treat acnes in oily skin?
2692	How do you treat acne?
460838	Manufacturing Engineering: What topic should I choose for my ME/M.Tech final year project?
460839	How do I choose the topic for my M.Tech final year project?
182287	Would starving yourself make you lose weight faster?
255848	Why kubo and the two strings hasn't been released in India yet?
255849	When is Kubo and the Two strings releasing in India?
150413	What is digital marketing?
382861	What is the best way to have sex in a car?
382862	How can sex be done in a car?
136647	I want to record a podcast interview using 2 lapel microphones plugged into my iPhone using a splitter. Is there a way to have the 2 inputs record as separate vocal tracks? Do I need a special app or hardware?
136648	Can I use a male to 2 female audio splitter for 1 headphone and one microphone?
202751	How do you make a pizza?
216240	How do I make money in Bangalore?
216241	How do I make extra money in Bangalore?
105438	If a movie company wanted to make a biopic about your life, what actor is playing as you?
235340	What is the next number of the following sequence? 
235341	What is the next number in the following sequence: 0 0 1 2 2 4 3 6 4 8 5?
424710	What are programming languages programmed in?
27570	What are programming languages?
281618	Do employees at MasterCard have a good work-life balance? Does this differ across positions and departments?
281619	Do employees at Interface have a good work-life balance? Does this differ across positions and departments?
524035	Is it possible to survive having your throat slashed?
524036	Is it possible to survive having your throat cut?
415242	Why some movies feel lonely, like Never Let Me Go?
415243	When did you feel alone?
384866	If you had the power to write 11th Commandment, what would it say?
239438	If science proves that there is a God, but is unable to show which God, what would you do?
79160	Why do we close our eyes when we kiss?
25727	Why do people sometimes close their eyes when they kiss?
255965	Giving up or failure?
255966	Life Lessons: When do you know your life has changed?
138359	Why is Quora in English?
138360	Does content on Quora need to be written in English?
414976	What is the technology stack behind Flipboard?
414977	What technology stack is Flipboard using?
432461	Would a knife blade that was one atom thick slice things truly effortlessly?
432462	How can I make a sharp knife that is a few atoms thick using broken glass?
367911	Will the journey for freedom ever be over?
367912	What are the cheapest option of hiring car in Mauritius?
467295	"What does this sentence mean, ""No such inspired creation is at unity with itself, any more than the clouds of heaven when the sun pierces through them.""?"
467296	"What does this sentence mean: ""No such inspired creation is at unity with itself, any more than the clouds of heaven when the sun pierces through them.""?"
833	Is there a Monster Hunter PC game?
394779	What are people's best experiences with ride-sharing services?
394780	Which ride-sharing service is the best for you?
500029	Do Kit Kat bars have peanut ingredients?
440638	What are the ingredients in a Kit Kat?
467755	Where is jQuery used?
467756	What is jQuery used for?
170378	What are good MOOCs in statistics?
354266	How do I recover my Gmail password when I do not remember email address and mobile number?
197603	How can I contact Google for password recovery, I do not have access to the recovery mobile number and recovery email id?
230694	Are the store return policies in the US because of law or because of culture and consumer expectations?
473612	What is a good inpatient drug and alcohol rehab center near Walton County FL?
159681	Which is better Xbox One or PlayStation?
197567	Which is better: Xbox or Playstation? Why?
75105	Which are some of the best novels by John Green?
225989	What does Accenture mean?
240978	In which episode does Rin die?
192164	If Rin from Naruto Shippuden (Anime) died, why is there an adult konoichi named Rin that looks like her on the battlefield during the fourth war?
536279	How am I gaining weight when I barely eat?
536280	Am I in starvation mode and If I start eating will I gain weight?
436456	How can I become a millionaire on Amazon?
62579	How can I become a millionaire on Amazon? What products can I sell between 150 to 250?
312131	I am going to quit my job: how can I avoid laziness when I will have more time?
145165	What is The Legend of Korra?
145166	What is The Legend of Korra about?
148395	How did Osama bin Laden die?
148396	How was Osama Bin Laden killed?
517165	Can I get into my Kik without downloading the app on my iPhone?
356564	What are the breakfast items that can be cooked in 5 minutes?
356565	What are some vegetarian breakfast items which could be prepared in 5 minutes?
166871	How do I start writing Quora answers ?
169800	How can I be a political leader?
246864	What are ribosomes? What is their main job?
165071	What are the best websites to watch and download Hindi movies with English subtitles?
219130	Who offers the most affordable office cleaning services in Fredericton, NB?
384320	What are the benefits of filling Nitrogen gas instead of air in tubeless tires?
182638	Is nitrogen good for tires?
51211	How do I get started in freelancing?
343929	How are airplanes made?
343930	What are airplanes made out of?
356939	How can I solve the problem in the picture?
280490	How do I solve the problem 10 in the picture?
340133	What can I do on a daily basis which will improve my vocabulary and communication skills?
340134	What are some of the best ways to increase our vocabulary?
496734	What does the Joker look like without makeup?
496735	How should I do my makeup so I look attractive?
429892	What are magnets made out of and how are they made?
1427	What are magnets made of?
64957	How do you charge your Macbook Pro without a charger?
64958	What is the best terminal emulator for Mac OS X?
400999	What motivates you for works?
342995	Which one should I learn first - Java or C++?
301843	Which are the best universities for masters in mechanical engineering in canada?
30108	How was the situation in 1978 when demonetization took place in India for the second time?
296832	What comes to your mind when your hear the word Islam?
64716	What comes to your mind when you hear the word feedback
422220	What's your opinion about iPhone SE? Do you think its a good phone?
422221	What do people think about the iPhone SE?
141469	Why do giraffes have black tongues?
141470	Is it possible to ride a giraffe?
455488	How can someone new to San Francisco meet people?
455489	What would be the best way for someone meet people and create a social circle in San Francisco?
230603	Are water based moisturizers good for dry skin on the face?
397070	What's it like to be approached by Salesforce because they are interested in acquiring you?
320045	What's it like to be approached by Google because they are interested in acquiring you?
326968	What is Boreal by Hundred Waters about?
326969	"What is the song ""White Winter Hymnal"" about?"
442624	What is it like working at Popcap Games?
442625	Where does Popcap Games do all its development?
274886	What are some mind-blowing facts about Adolf Hitler?
127289	What are some less known facts about Adolf Hitler?
198083	What is your opinion about sharing economies?
198084	What is your opinion about the sharing economy?
8350	What is inside a bullet?
8351	What is inside the bullet?
144094	What Hardware and Skill set is required for setting big data environment?
144095	I'm an average final year B.com student who now intends to pursue CA, should I take the plunge?
21083	What is it like to play a video game for the first time on acid?
238742	Are there any earphones with a lost mode?
238743	What are some examples of Newton's 2nd Law of Motion and how is it applied?
42316	What is the difference between the Glock model 20 and Glock model 21?
22014	Which do you find better: Beretta 92FS or Glock 17? Why?
48231	What are the dimensions of the standard sliding glass door?
48232	What kind of glass can be used for doors, and what is the range of prices of these doors?
423387	Is A Brief History of Time still a good read or is it outdated?
423388	I have recently read (again) A Brief History of Time. What has changed since? What book could I pick up to get an update?
218076	Can I upgrade my Note 3 to Lollipop?
218077	When will the Note 3 UAE get the Lollipop update?
317976	Should dentists be called 'doctor' or what?
115290	What is a small thing that makes you happy?
115291	What are some small things that makes you happy?
65776	What is the longest time span, you've ever stayed awake?
23615	What do these symbols mean?
495173	How can I overcome my fear?
81374	How do you overcome fear and insecurity?
250375	What is the cause of diabetes?
87746	What are your sweetest Christmas memories?
87747	What is your favorite Christmas memory?
15833	What are some worth watching hindi short films on youtube?
535474	How do I get rid of my back acne and my chest acne?
535475	I have acne and scarring on my chest, how do I get rid of it?
375588	Web based reporting tool for MongoDB?
375589	What would Hillary Clinton Have To Do To Serve Time?
281767	Which is the biggest football club in the world?
177542	How long does it take for a signal from Earth to reach Mars?
66925	How long does it take for a radio signal from Earth to reach the moon?
135116	What Should I Gift My Dad Under A Budget Of 30,000 To 32,000 Rs ?
135117	What kind of business would I realistically be able to start that would help a lot of people, with a $5,000-$10,000+ budget (my own money)?
267286	What is your review of Tiketturindo.com?
14284	What are some things new employees should know going into their first day at Itron?
183247	How should I prepare for my CA final studies?
132298	What are the best places to visit in Andaman?
415998	Which places should I visit in Andaman and Nicobar island?
234033	Which loka is superior, saket or goloka.Some says saket and ISKCON members says goloka…? I am confused!
391677	Why do people (even some family members) when they're angry with me, lash out and say I'm arrogant or I think I am better than everyone?
248398	What is the one thing you will never regret in your life?
94775	Where can I invest 10 dollars and make daily profits online?
94776	What can I invest online with 10 dollars that will give me daily profit of 5 dollars?
344009	Which are all the polymers and monomers of proteins?
243194	Is it worth to buy yahoo in $4.8 bn?
235206	Is Yahoo worth $5 billion?
280561	What is the best pinot noir?
280562	Where is Pinot Noir from?
301736	Why are most of the Pakistani girls beautiful?
301737	Who do you think is the most underrated beautiful girl in the world?
157772	What time is end of day delivery for UPS?
157773	What is the busiest time in restaurant delivery?
63792	What are the tricks to solve Non verbal reasoning & quantitative aptitude problems?
63793	How can we solve non-symmetric coin problems?
112119	What are some of your favorite childhood memories?
159934	What are your fondest childhood memory?
236196	How do you win in tennis?
236197	How does one win in tennis?
291458	What is Electromagnetic spectrum?
346082	Peter Graham: Can we possibly prove the existence of the spirit realm by the electromagnetic spectrum?
534656	What does it mean when you talk in your sleep?
267607	How can I stop talking while sleeping?
238421	Do planet X exist?
238422	Is there any proof that Planet X actually exists?
20522	What is the law about being seperated since long time with partner?
20523	What should I talk about when I meet a girl for the first time in person after being friends with her online for a long time?
266940	What does time have to do with space?
253258	What is time and space?
326093	How can I be more patient?
458856	"What is the ""O/D Off"" button on my automatic car?"
89182	Why haven't cars yet solved the problem of the blind-spot in wing mirrors?
349871	What are gymnosperms? Why are they important?
349872	Why are gymnosperms important?
9980	How do I research for MUN?
9981	What is the best way to do an MUN research?
306921	Are non-living things made up of cells?
306922	Are non-living things made out of cells?
114253	In present days download movies from torrent is a criminal offence or not in India?
229809	Why doesn't Voldemort torment the muggle world?
229810	On the night James and Lily died, James was ready to die for Lily & Harry. Why didn't the charm work like with Lily protecting Harry?
461668	How can Wikipedia improve?
