test-413888	Can a production engineer work as a supervisor in any firm?
test-413889	How do I deal with my non working supervisor?
test-413890	Which is the best mountain bicycle under 6-7K in India?
test-413891	What is the best bicycle to buy in India?
test-413892	What are the best strategies for preparing for the bar exam?
test-413893	What are good strategies for preparing for the patent bar exam?
test-413894	How do I score above 90% in class 11 ?
test-413895	How do I score above 90% in class 10?
test-413896	How are daguerreotype and calotype photographies different?
test-413897	How are editorial and commercial photography different?
test-413898	Could we make another planet between Earth and Mars?
test-413899	What would happen if Mars, the fourth planet from the Sun, were discovered to be habitable in which there is Oxygen to breathe like Earth?
test-413900	Is it healthy to eat the same thing every day?
test-413901	Is it healthy to eat bread every day?
test-413902	How do I come to that my passport police verification has failed?
test-413903	How do we know the police verification status?
test-413904	How does Quora make money to run this app?
test-413905	How do Quora make money?
test-413906	What is capitalism nd socialism?
test-413907	What is after socialism and capitalism?
test-413908	What is the average length of an Indian penis?
test-413909	Do women prefer a fat penis or a long penis? Why?
test-413910	What are some traditional gifts for a 19th wedding anniversary?
test-413911	What is the traditional gift for a 44th wedding anniversary?
test-413912	How can I quickly learn to speak English fluently?
test-413913	What are the best ways to speak English fluently?
test-413914	What are the four parts of the Declaration of Independence?
test-413915	What are some criticisms of the Declaration of Independence?
test-413916	What are the all time favourite movies?
test-413917	What are your favourite films?
test-413918	Which Hollywood movie will be best in 2017?
test-413919	What is the best Hollywood movie of 2014 and why?
test-413920	From where can I get a free online mock test of the GRE?
test-413921	Where can I find free GRE practice exams?
test-413922	Why might Donald Trump have had doubts about Mike Pence as his VP candidate?
test-413923	Do we know what policies are advocated by US vice-presidential candidate Mike Pence? Do they differ from Donald Trump's?
test-413924	What are the most empirically neutral and unbiased news sources in the US?
test-413925	Does the Guardian UK provide unbiased news as they claim?
test-413926	How tn avoid procrastination?
test-413927	What do I do to avoid procrastination?
test-413928	What one can do after engineering?
test-413929	What someone do after engineering?
test-413930	Is it good to buy a laptop having memory of 32gb eMMC?
test-413931	How do put parking sensor in Honda brv before purchase?
test-413932	Are the nuclear weapons the most contributing factor for the peaceful period the world is now, at least among the most poweful countries?
test-413933	Is a hotel booking via Credit card (hotels have not billed us yet) considered 'confirmed prepaid hotel reservation' for Schengen VISA application?
test-413934	Will CITI Bank India launch UPI (Unified Payment Interface) Based application?
test-413935	How can one create UPI (Unified Payment Interface) account, with popular banks in India?
test-413936	Can I get admission in a good college in DU for political science honours with 87.25%?
test-413937	Which is the best college for pursuing a BA in political science honours at DU?
test-413938	He didn't text me after our first date that went pretty smoothly, why?
test-413939	While planning date night w/my BF, I got distracted, & didn't text back for 27 min. He ignored me & has cancelled tonight’s date night. What do I do?
test-413940	How active is 4g network in Chennai?
test-413941	Is a 4G network available in Chennai?
test-413942	Why is life so unfair?
test-413943	Why does life constantly seem so unfair? Why always me?
test-413944	Which are the largest cities in Thailand?
test-413945	What are the biggest cities in Thailand?
test-413946	How do I recover deleted messages in whatsapp if i didn't backup the messages?
test-413947	How do I recover deleted photos from a Samsung Galaxy S6/S5/S4/Note?
test-413948	What is the net speed at NIT Jamshedpur?
test-413949	How fast is the downloading speed in hostels/library of NIT Jamshedpur?
test-413950	How can I be happy?
test-413951	Can be a single and happy?
test-413952	Why doesn't Quora just delete my account?
test-413953	Why does Quora seem to ignore my requests to delete my account?
test-413954	Why are muslims throughout the world fighting each other? Just like that or are they being fooled?
test-413955	Why don't Muslim men wear hijab?
test-413956	How do you make a song more rock-ish?
test-413957	Which rock n roll/pop songs make you weepy?
test-413958	"What inspired ""Pierre Menard, Author of the Quixote"" by Jorge Luis Borges?"
test-413959	"What is the literary significance of Jorge Luis Borges' book ""Pierre Menard, Author of the Quixote""?"
test-413960	What's it like living in Atlantic City NJ now?
test-413961	What is it like to live in Atlantic City, NJ?
test-413962	Will there be any advantage of learning music or dance while attending interviews?
test-413963	"If someone is old and has dementia, does there come a point where it would be morally okay to give them some poison and say, ""Here's your medicine""?"
test-413964	"Where did the term ""Heavens to Betsy"" come from?"
test-413965	What are the hidden layers in an LDA machine learning model?
test-413966	Should I work for a big company in equity research on a payroll of a third party?
test-413967	Do big companies like Facebook or Google use third party libraries to develop their own product?
test-413968	Where can I learn how to hack?
test-413969	Where can I learn to Hack anything?
test-413970	What does an investment banker do and how can I become one?
test-413971	How are investment bankers?
test-413972	What is the vision of Snapchat as a company?
test-413973	Why does a company like Snapchat need 200+ employees?
test-413974	What colors can be used to make brown icing?
test-413975	What colors can be mixed to make red?
test-413976	Can I change college after first year in (B.arch)?
test-413977	I am getting M.Sc Chemistry in BITS Hyderabad. After first year can I change to M.Sc Maths along with a B.E. program?
test-413978	What should all software engineers know about R?
test-413979	What should all software engineers know about C++?
test-413980	How do I change from non AC room to AC in SRM hostel?
test-413981	Should I take an AC room or non AC room in SRM hostel?
test-413982	Which are the best speedlites (external flashes) under 10k for Canon dslrs ?
test-413983	I have Canon 1200d can I use external mic in it?
test-413984	Is Improvement mark sheet accepted at VIT?
test-413985	Does VIT accept improvement marksheets?
test-413986	Who is the best video game player of all time?
test-413987	Who are some of the best game designers of all time?
test-413988	Is it possible for Stickball players to use the washroom during a match?
test-413989	Is it possible for billiards players to use the washroom during a match?
test-413990	How is Campus life in IIT GUWAHATI?
test-413991	How is life at IIT Guwahati?
test-413992	Which are the best Malayalam songs of 2016?
test-413993	What are the best odia movie songs of the year 2016?
test-413994	How shall I live?
test-413995	Myself a computer science student plz suggest which book should I follow for data structure?
test-413996	What really happens inside Osho Ashram Pune?
test-413997	What are the best spiritual place to visit in India?
test-413998	How soon after taking birth control is it effective?
test-413999	Is birth control effective after 2+ weeks if I started on the fourth day of my period?
test-414000	Why do people think God looks like humans?
test-414001	Why Hindu gods looks like Humans?
test-414002	What is meant by conceptual knowledge?
test-414003	Does the Atos company have a software development center in Bangalore or does it just have a SAP training center in Bangalore?
test-414004	What is the future of banking operations jobs in axis bank?
test-414005	Where is axis bank address?
test-414006	What does it mean when a guy calls you perfection?
test-414007	What does it mean when a guy calls you bad?
test-414008	What is the SI unit of resistance?
test-414009	What's the SI unit of flux density?
test-414010	Why do people choose to live in the countryside?
test-414011	What can city folks learn from the countryside?
test-414012	What will more likely damage your ears? In-ear headphones or earphones?
test-414013	Will headphones or earphones damage your ears?
test-414014	What number comes next - 10, 9, 60, 90, 70, 66, __?
test-414015	What is the next number in the following series, 9, 27, 81?
test-414016	Why does the Turkish government kill Kurdish liberal politicians?
test-414017	Why do Kurdish people hate the Turkish government?
test-414018	How do you activate your Uber driver account?
test-414019	Can I use Uber X for 5 people?
test-414020	Can evaporated milk be used as a substitute for regular milk?
test-414021	What are some examples of foil literary terms?
test-414022	What are some good gifts I can give my parents on their 25th anniversary?
test-414023	What best gift a children can give to their parents on 25th anniversary?
test-414024	How many medals India won in Olympics ?
test-414025	Which Countries have won most medals in Olympics?
test-414026	What shoes and jewelry should I wear for this gold dress?
test-414027	What shoes should I wear with a gold dress?
test-414028	How do I increase the power of concentration while studying?
test-414029	How should I increase my concentration on studies from watching TV?
test-414030	Is here in Quora any lawyer from USA UK or Canada?
test-414031	Is there any lawyer from USA UK or Canada in Quora?
test-414032	How did Priyanka jha, Dhoni's ex-girlfriend look like in real life?
test-414033	Was death of Dhoni's ex girlfriend priyanka really a turning point of his life as being portrayed in the movie M.S. Dhoni: The Untold Story?
test-414034	"What is the meaning of ""fragua""?"
test-414035	"What is the meaning of ""what's up""?"
test-414036	What difference are exactly between Euclidean space and non Euclidean space?
test-414037	What is the difference between a Hilbert space and a Euclidean space?
test-414038	What is a quickest way to improve English?
test-414039	What's the easiest and most effective way to improve my English?
test-414040	What does exactly this essay topic mean?
test-414041	What does this topic mean?
test-414042	How do you get someone to believe you love them?
test-414043	How do you tell someone you love them?
test-414044	I got a rank of 20000 in muoet 2016, which branch can I get in the Jaipur campus?
test-414045	I scored 117/200 in MUOET in 2016 . Which branches can I get in the main campus?
test-414046	What's your favorite task management tool?
test-414047	What is task manager priority?
test-414048	Why are Indian BTech students obsessed with going abroad for higher studies?
test-414049	I got 90 in JEE and 93% in cbse can I get bit mesra cse (obc)?
test-414050	How much money can I make from a YouTube video with 5,000 views?
test-414051	About how much is often gained from a monetized YouTube video for every 1000 views?
test-414052	How is the life after MBA from IITs?
test-414053	How is your life after doing an MBA?
test-414054	How do I convert 4G to 3g net using Micromax Nitro mobile?
test-414055	How do I Run Jio 4G in 3G Mobile set?
test-414056	What are some examples of unity?
test-414057	What are some examples of national unity?
test-414058	What should I do if I want to lose my belly fat and tummy in one month?
test-414059	How do I reduce belly fat in minimal time?
test-414060	What do you call the large net that's thrown to the sea so you can embark on a ship?
test-414061	What is the best affordable phone plan to be on so that you can travel internationally and still call, text, and use data?
test-414062	What should I write for communication skills on a resume/CV?
test-414063	Do you always write a CV/Resume in the third person?
test-414064	What would happen if Sheldon Cooper met M. S. Dhoni?
test-414065	What would happen if Sheldon Cooper met you?
test-414066	What are examples of biotic and abiotic components?
test-414067	What are some examples of biotic and abiotic factors found in the environment?
test-414068	I need a fun place where I can take a big group of teens and adults with mental disabilities? Does anyone know any good spots?
test-414069	Where in NYC can I take a big group of teens and adults with mental disabilities?
test-414070	"What are some systems of thought/belief that have as a  ""baked in"" feature the idea that they can be improved?"
test-414071	What is best way to improve the immune system?
test-414072	Hello
test-414073	Related questions irrelevant? How to delete this question?
test-414074	What is livesphere.com?
test-414075	What is osell.com?
test-414076	What does freedom mean to you?
test-414077	What does freedom mean?
test-414078	What are the best words to describe fire?
test-414079	What is the best word to describe a person who hates numbers?
test-414080	Is Donald Glover related to Danny Glover?
test-414081	How did Donald Glover get his start in comedy?
test-414082	What is the difference between Charms and Defense Against the Dark Arts lessons?
test-414083	How is Harry James Potter the best student in his whole school in Defense Against the Dark Arts if James Potter was incredible in Transfiguration? Harry inherited everything from his mom and dad, so how come he is good at this?
test-414084	Which nation, Spain, France, Germany and the UK, is more powerful economically, culturally, technologically and politically?
test-414085	Why is the population density in France so much lower than in Germany or the UK?
test-414086	Has a Jew ever appeared on an Arab reality show?
test-414087	As an Israeli Jew, how do you feel while passing an Arab village in Israel?
test-414088	What training is given during cts training period?
test-414089	What are cognizant training hours in a day during training period and salary during that time?
test-414090	How can you GPS track a cell phone number for free?
test-414091	Can you track a stolen cell phone?
test-414092	"What does the term ""thread safe"" mean in Java?"
test-414093	How lightweight are Java threads?
test-414094	What is the difference between a solution architect and a project manager?
test-414095	What is different between bach and architect engineer?
test-414096	I scored 169/360 in BITSAT 2016, what rank can I expect?
test-414097	What can I expect with a score of 215 in Bitsat 2016?
test-414098	Do I need to pay tax as a non US citizen?
test-414099	What happened to the Galaxy Note 6?
test-414100	"Has anyone found Christopher Nolan's short films ""Tarantella"" and ""Larceny"" yet?"
test-414101	What is it like working with Christopher Nolan?
test-414102	Who is the best astrologer as per you?
test-414103	Who is the best astrologer in Monkvyasa?
test-414104	How does the concentration of enzymes affect enzyme activity?
test-414105	How is activation energy lowered by enzymes?
test-414106	What mental disorders are depicted in Winnie the Pooh?
test-414107	What do the Winnie the Pooh characters represent?
test-414108	Is diet a key factor for eye inflammation? If yes, what is a good diet to reduce the retina inflammation?
test-414109	How much money do u get if u have 4 subscribers?
test-414110	How popular are Diners Club International credit cards in India?
test-414111	Is there any free fuel credit card in India?
test-414112	What causes daily traffic jam on Outer Ring Road near Bellandur in Bengaluru?
test-414113	What is causing the traffic jam inside of Eco Space/Pritech Park in Bellandur, Bengaluru?
test-414114	How do the prices on airbnb work? Are they per person or per night?
test-414115	How much do Airbnb hosts make on average per month?
test-414116	"How long is a ""typical"" school day for an English boarding school student?"
test-414117	I am 26 years old and people say that I will never get any social security money. why should I keep paying it?
test-414118	How can you move over a magnetic field?
test-414119	Which country has a higher homicide rate: Saudi Arabia, Brazil or Mexico?
test-414120	Where can I get a full range of locksmith services at Sydney CBD?
test-414121	Where can I get inexpensive locksmith services in Sydney?
test-414122	If you accidentally like someone's photo on Facebook, and then unlike it, will they be notified?
test-414123	How do I tag someone in a photo on Facebook?
test-414124	What are some examples of positive sentences?
test-414125	What are some examples of cumulative sentences?
test-414126	How should I control my mind from distraction during studying?
test-414127	How can I stop my mind from wandering and stay focused while solving numerical problems and studying?
test-414128	How difficult is it to get into Georgia Tech?
test-414129	Why is Georgia Tech so hard?
test-414130	Can dogs cry?
test-414131	Do dogs cry?
test-414132	Why is the Kannada film industry not as popular as the Tamil or Telugu film industries?
test-414133	What drones are popular in the film industry?
test-414134	Can soccer players get a concussion from heading a ball?
test-414135	Could someone help me with CAN bus communication? What are the ports and how does these ports aid data collection and transfer?
test-414136	Why do some black people wear silk caps to bed?
test-414137	Why do people wear earings?
test-414138	The capacitive keys of my Lumia 720 are not working, although the touch screen is working fine. What should I do?
test-414139	How do I add a song as a ringtone on nokia lumia 720?
test-414140	How do I express my love to my cousin brothers and sisters?
test-414141	How can I express my love to my sisters, cousins or my parents?
test-414142	Is there a good animation package for Meteor.js?
test-414143	Is Meteor.js good to make simple websites?
test-414144	How can I remotely install a keylogger?
test-414145	How can I locate a keylogger on my cell phone?
test-414146	Why do big Bollywood films release dates clash?
test-414147	What are the daily life hassles that women entrepreneurs face?
test-414148	What are all the different ways that a protein can be attached to a cell membrane?
test-414149	Why are membranes so important to cells?
test-414150	What are the advantages and disadvantages of betterment investments?
test-414151	What are the advantages and disadvantages of investing in gold?
test-414152	How do I instantly regain focus while reading when my mind keeps jumping away?
test-414153	I am not getting interest while I'm reading how to make my mind focus on studies?
test-414154	How does Waze make money from the service?
test-414155	How does Waze make money?
test-414156	Who are the most inspiring people from india?
test-414157	Who are the most inspiring people?
test-414158	How do I make the right choices in life?
test-414159	How I can take the right decision on the right moment of my life?
test-414160	How can I download video lectures from ICAI cloud campus?
test-414161	How can I download UC Irvine OCW video lectures?
test-414162	What advantages do fringe benefits have?
test-414163	Who was the hardest worker you have seen?
test-414164	Will indians be able to capture Pokémon in Pokémon GO and get it in there local areas?
test-414165	How many Pokémon are in Pokémon GO?
test-414166	How do I prove that (A X (B X C)) = B(A.C)-C(A.B)?
test-414167	Given any three vectors A, B, C how will you prove that A×(B+C) +B×(C+A) +C×(A+B) =0?
test-414168	What does the Ministry of Transportation of Ontario geomatics section do?
test-414169	How do I become a iOS program teacher for kid?
test-414170	What will happen to oil-dependent countries like UAE and Angola when oil becomes less valuable?
test-414171	Which country supplies oil to cambodia?
test-414172	Imgur: How long are the images stored before being purged?
test-414173	Why do image files have long random names?
test-414174	What is the difference between '.' and '$' in Haskell?
test-414175	What's the difference between (>>) and (*>) in Haskell?
test-414176	How do baby chicks get salmonella?
test-414177	Can I fix my eyesight naturally?
test-414178	When will we get Android L on the Moto X?
test-414179	When will we get Android L on the Moto G?
test-414180	Besides the Pacific Northwest, where's the best place in the USA to see waterfalls?
test-414181	What are the best places to visit in the Pacific Northwest?
test-414182	What does the sequence of story viewers on Instagram mean?
test-414183	What is INSTAGRAM stories?
test-414184	"In a persuasive essay do you need to write ""I believe""? How can I learn to write a persuasive essay?"
test-414185	How do I write 250 word essay?
test-414186	Why are emotions not a suitable source for beliefs?
test-414187	Cloud computing training institute in Hyderabad?
test-414188	What are the strengths and weaknesses of the advising system at Eastern Florida State College?
test-414189	What are the strengths and weaknesses of the advising system at Florida State College at Jacksonville?
test-414190	How can I politely refuse my friends?
test-414191	Have you ever been in a situation where a guy/guys passed a comment or gesture because your bra strap was visible? How did you handle the situation?
test-414192	What are the lucky numbers and the unlucky numbers in China?
test-414193	I know 4 sounds like death, and 5 sounds like not, but would the combination 45 be considered lucky or unlucky by Cantonese speaking people in China?
test-414194	Which is the sweetest Indian language?
test-414195	What is the sweetest language in the world?
test-414196	PostgreSQL: given a very large table of strings what is the fastest way of seeing which of the strings match sections of a imputed string?
test-414197	Can you reverse a string in PostgreSQL?
test-414198	Why is Google showing my wrong location on my laptop?
test-414199	What is most popular laptop in Google?
test-414200	What does the sequence of story viewers on Instagram mean?
test-414201	Can someone see how many times you look at their instagram?
test-414202	Can I dye my hair a permanent blonde then put semipermanent over it?
test-414203	Should I dye my hair blonde?
test-414204	Where can I found wide range of bouncy castles in Sydney for hire?
test-414205	Where can I found most diverse ranges of Jumping Castles & Bouncy Castles in Sydney?
test-414206	Where can I download Sherlock Holmes Season 4?
test-414207	Who is the third brother? And what did Mycroft do to him?
test-414208	What individuals and events in history are a source of pride for Egypt?
test-414209	What individuals and events in history are a source of pride for Iran?
test-414210	How good is IMS data in capturing specialty products in the US?
test-414211	When was Medicaid first offered in the US?
test-414212	What is a Farad capacitor?
test-414213	Does 1 farad capacitor exist?
test-414214	Why men always want to do sex?
test-414215	Why do women always want to talk after sex?
test-414216	Why are all programming languages written in English?
test-414217	Why all programming languages are in english language?
test-414218	What is a good split of S/M/L/XL quantities when ordering t-shirts?
test-414219	How do you determine what quantities to produce clothes in different sizes (i.e. XS S M L XL) to sell in Europe?
test-414220	What are the best ways to enjoy for 4 days in Goa?
test-414221	How do you track a radio transmission?
test-414222	Why aren't songs from the movie Dangal available on Wynk?
test-414223	What are some good songs that are not well known?
test-414224	If time travel is not possible, is time viewing possible?
test-414225	Will time travel be possible in the next 10 years?
test-414226	What happens if you mix acetone and hydrogen peroxide?
test-414227	What happens if hydrogen peroxide is boiled?
test-414228	I know a woman who is stunningly beautiful, smart, educated, and well-to-do. Yet she's also friendly, humble and down-to-earth. How is this possible?
test-414229	I always feel that I'm not good-looking. I find many girls around me are beautiful and do well in many aspects. I feel so humble. How to deal with these feelings?
test-414230	Which is the best website to learn Mathematical integration?
test-414231	Which is the best website to learn Mathematics for free?
test-414232	Could I have miscarriaged?
test-414233	When candidate filed representation in SSC but after deduction of 100 Rs black page opned up. What to do?will ssc would refund this amount?
test-414234	Do Indian Muslims refuse to sing 'Vande Mataram'? Why?
test-414235	RSS says Jana Gana Mana is not our national anthem, Vande Mataram is. What do you think of it?
test-414236	What are the advantages of all-in-one computers?
test-414237	What are the advantages of using computers in schools?
test-414238	What should we do to become determine about our goal?
test-414239	How can I achieve my goals?
test-414240	What is the best job after completing b.tech especially for EEE?
test-414241	What are the best jobs for a B.Tech in EEE in the USA?
test-414242	Why do some Christians disrespect atheists?
test-414243	As an atheist, what do you wish theists knew?
test-414244	Which was more advanced: Ancient China or Ancient Europe?
test-414245	Was Ancient Greece more advanced than Ancient India or China?
test-414246	What is Aleve and how does it differ from Advil, Tyenol and aspirin?
test-414247	How does Tylenol and Advil differ?
test-414248	What has been the most disturbing Game of Thrones moment yet?
test-414249	What has been the most intense Game of Thrones moment yet?
test-414250	What is the best way to spank my husband?
