367337	`` What if there was no'' `` New World'''' / Americas ?''
367338	India's most cheapest t shirt manufacturers and printing ?
367339	`` Will Jogi'' `` Bert'''' Bhullar regale us with his unique experiences in the Indian Army ?''
367340	What universities does Agilent Technologies recruit new grads from ? What majors are they looking for ?
367341	If you are in heaven and you are being sent back to Earth , but as either a beautiful black woman or as an unattractive white woman with equal quality of parentage and intellectual capacity , which would you choose ?
367342	I missed my periods and I had sex 8 days before my date.does it mean thar I am pregnant ?
367343	We had sex 3 days ago and my normal period is on the 1st week of the month . Yesterday , I felt pain on my breast and stomach cramp and now I had my 1st day of my period . Am I pregnant ?
367344	What are some nice places to spend time with my girlfriend in and around gurgaon ?
367345	What are some nice places to spend time with my girlfriend in and around Bhubaneswar ?
367346	How can I deal with people calling me fake when am not ?
367347	How do I deal with people calling me immature ?
367348	Which bank in the US offers accounts denominated in euros ?
367349	What do I have to do to open a Euro denominated savings account in the UK and get a Visa Debit Card and Internet banking ?
367350	What is the best documentary you have watched in the past year ?
367351	What are some infamous scandals in India ?
367352	What are the most infamous moments in Indian sports ?
367353	What is the best Dota 2 hero to raise MMR in the 3.5 - 4k bracket ? (6.84 patch edition)
367354	What is the best Dota 2 hero to raise MMR in the 3.5 - 4k bracket ?
367355	Why do you think you should win the lottery ?
367356	How can you win the lottery ?
367357	What skills and/or maths are needed to study artificial intelligence ?
367358	What sort of math and programming education do I need , to be able to work on artificial intelligence ? What are the ways to achieve that ?
367359	Where can I get a Baby Marginated Tortoise in Hyderabad ?
367360	Is there any way to make my room (in new delhi) full of good air ?
367361	How much do Singaporean people know about Russia , its people and culture ? What is the image of Russia in Singapore ?
367362	Why do people want to migrate to Singapore ?
367363	What is your favourite country song ?
367364	Is KingRoot , the one tap Chinese rooting app , legit and safe ?
367365	Which is better , western culture or indian culture ?
367366	What are some examples of modern day categorical imperative ?
367367	How do you explain Kant's categorical imperatives to a five year old ?
367368	If currency notes could be banned why not tobacco ?
367369	Where can I found highly qualified refrigeration mechanics in Sydney ?
367370	I struggle with math and science and it makes me feel stupid . What can I do to get better ?
367371	When looking for a job , how to find the hiring manager of a specific job posting and contact him directly ?
367372	What will I learn as a intern at Altair corp ?
367373	What should I learn to be able to intern at FlipKart ?
367374	During a chemical reaction , where does the heat evolved come from ? Where does the heat absorbed go ?
367375	Where does heat come from ?
367376	How hard is it to get into Brown University's CS master's or Ph.D program (machine learning/NLP) for a non-U.S. applicant ?
367377	How does Quora anonymity work behind the scenes ?
367378	What percent of work on Quora is anonymous ?
367379	Is my roommate being normal for suddenly prohibiting me from usinng her utensils ?
367380	Jail break in ios 9.3 ?
367381	What is the business model of offcampusjobs4u.com ?
367382	How can AT&T legally define an HSPA + phone as 4G ?
367383	What is regression analysis , and how is it used ?
367384	Is it better to watch TV programmes on PC or laptops than television ?
367385	Where is the place Charna in India ?
367386	What will happen if I practice Surya-Namaskar (sun salutations) in night ? Is it allowed to practice it in night ?
367387	Can Muslims do Surya Namaskar ?
367388	Where are the most beautiful women in India ?
367389	Will the proposed China Pakistan Economic Corridor ever succeed keeping in mind Pakistan's lucid security situation ? Or will CPEC become a nonstarter ?
367390	What are the benefits of CPEC to Pakistan ?
367391	`` Is'' `` www.ezroadtrips.com'''' (travel site) ahead of its time ?''
367392	Do you have to let your employers know ahead of time if you put them down as a referral ?
367393	What is Arianna Huffington like as a person ?
367394	Who is Arianna Huffington ?
367395	Why does the apparent weight of a body decrease in a lift moving downwards ?
367396	Can lifting heavy stop weight gain ?
367397	What are some things new employees should know going into their first day at Monsanto ?
367398	Is evolution single sided or do things evolve together ?
367399	What can I substitute for Greek yogurt ?
367400	How can you substitute Greek yogurt for crme frache ?
367401	What are some websites like ghost.io ?
367402	What is the site where I can refer for HTML MCQ ?
367403	i love this girl but she's kind of stuck on her ex who treats her like shit & the girl I like is fed up . we're close & she doesn't know . Help me ?
367404	I love a girl I've known for the last 2 years . I talked to her and helped her many times , but she treats me like a friend . She knows that I love her . What should I do ?
367405	I took some moocs before college and now I feel like college is horrid , what do I do ?
367406	Is Toshiba Satellite C50-A547 good for runing games ?
367407	What priorities should be given when developing protocols that promote situational awareness ?
367408	What is a communication protocol ?
367409	How can I gain someone's trust ?
367410	What's the best way to gain your team's trust ?
367411	What is the mechanism used to connect coaches (bogies) in Indian Railways ?
367412	How does the Indian Railway code their bogies ?
367413	What are the advantages and disadvantages of cannabis ?
367414	Why do people love cannabis ?
367415	Can I answer my anonymous question not anonymously ?
367416	Why can I not post an anonymous question ?
367417	Why won't Richard Muller answer my question ?
367418	How do I get Richard Muller answer my questions ?
367419	How does it feel to own a private jet ?
367420	My 29 year old cousin was just diagnosed with bladder cancer will he be okay ?
367421	How long is the recovery time after wisdom teeth removal ?
367422	Why is it important to rinse with salt water after getting wisdom teeth removed ?
367423	Develop a research proposal based on a problem related to Human Resource Management ?
367424	Is a hypothesis required for a Masters thesis proposal on a topic relating to computer algorithm ?
367425	How do I improve my mathematics for algorithms ?
367426	What is the intuitive explanation for Perceptrons ?
367427	What is an intuitive explanation for the perceptron convergence ?
367428	What is an alpha particle ? What is a beta particle ? What is a gamma particle ?
367429	How safe is Brunei for foreign LGBTI tourists ?
367430	What does the night sky being dark tell us about the universe ?
367431	When should I start studying for first semester of B.Com (H) in SRCC if I want to score good marks ?
367432	Can I use Jio 4G in HTC desire 526 Gplus pleace ?
367433	What is the benefit of uploading video on YouTube ?
367434	Can I upload la Liga video on YouTube ?
367435	Where is the camera on an iPad 2 ?
367436	What politicians came from humble backgrounds ?
367437	What can we learn from an Indian politician ?
367438	What should I know to become an data analyst ?
367439	What should a data analyst know ?
367440	What is it like to use butt plugs ?
367441	From a girl's perspective , does anal sex feel dehumanizing ?
367442	What is the reaction between sulfuric acid and aluminum ?
367443	What are colleges to apply to if you have secured a 90 percentile in the CAT ?
367444	My CAT-2015 Score is 71 percentile . I belong to OBC . What are the good colleges where I can apply ?
367445	What are the best restaurants to try when visiting Callao , Peru ? What should you try while you're there ?
367446	What are the best restaurants to try when visiting Hunuco , Peru ? What should you try while you're there ?
367447	When a guy is obsessed with a girl does he want to date her ?
367448	How much will Manoj Bhargava's rain maker cost in the market ?
367449	Why does it rain so much in Peru ?
367450	How long do I need to wear fake braces ?
367451	What are the similarities and differences between Confucius and Mencius and how did they influence China ?
367452	I am working in Adani ports . I am a mechanical engineer . Which specialization in MBA will be a better option ?
367453	Can I get a credit card without Income Tax Return ?
367454	I paid the LIC premium of my family members using a credit card . How should we declare in income tax ?
367455	Which country has better nude beaches : France or Australia ?
367456	`` What is'' `` internal link stacking'''' ?''
367457	Why hasn't our body evolved to prevent bleeding to death ?
367458	If Siri evolves to accurately predict our patterns why not start arresting people for pre-crime ?
367459	What is Thoreau's philosophy of life ?
367460	What is the difference between sine , square , sawtooth , and triangle waves ?
367461	What is the difference between a violin and a fiddle ?
367462	Can a sunburn be treated with Noxema ?
367463	`` What are some slogans about'' `` save water , save earth'''' ?''
367464	What are the basic requirements for developing an IT software Company ?
367465	What are some basic words used by software companies ?
367466	How are cyclists on the West coast different from those on the East Coast ?
367467	What if btech complete in 5 years can stiil get in gre ?
367468	How did bran the builder build the wall ?
367469	How do I build active active data centers using Cisco or Juniper technologies ?
367470	What are the things to consider when building a data center ?
367471	What is the (vector) displacement between positions (0.4 i + 0.1 j) m and ( 0.8 i + 0.6) m , and the distance between the two positions ?
367472	What does the technology stack look like for the server side of a massively multiplayer online game ?
367473	What is a simple server side solution with clear guides/tutorials for developing a mobile multiplayer game exactly like the Clash of Clans ?
367474	Why is it so difficult to build a standard Hindi keyboard ?
367475	I know there is a way where we can use an English keyboard to get text written in Hindi . I have used it before but was unable to do it again . What is the way to do it ?
367476	If I have 50 lakh as black money , what will happen if I disclose it and deposit the money in the bank ? After Modi has banned 500/1000 notes in India ?
367477	I took a loan from bank 2 years ago . I have not used most of that money . What should I do with that money after government's ban on 1000 and 500 note ?
367478	If you were granted just one wish for 2017 , what would you wish for ?
367479	Are racist or hate propaganda Qs (Calling a specific community as pigs as in below snaps) allowed in Quora ?
367480	How do I get a book published for free ?
367481	Why we should not judge others by their appearance ?
367482	Why is rhodium expensive ?
367483	Walmart Employees : How do you change your address on the Wire ?
367484	How do I leave a legacy ?
367485	How do you leave a legacy to your children ?
367486	What is Stanford university ?
367487	If a my stepmother's pantyhose alura jenson & jessy Jones which language do they think in ?
367488	Do we use language to think ?
367489	Why the value of g is zero at the centre of the earth ?
367490	What would the value of acceleration due to gravity , [math] g [/ math] , be in the centre of the Earth ?
367491	What are some unexpected things first-time visitors to Estonia notice ?
367492	What is lonely Love ?
367493	Does she love me or is she with me because she's lonely ?
367494	How can I get rid of small black flying bugs ?
367495	How can I get rid of small black bugs with wings ?
367496	Why is The Tribunal in League of Legends so inefficient ?
367497	Do penguins have ankles ?
367498	Do penguins have knees ?
367499	How do I stay motivated at my internship ?
367500	How does post office make money from international parcels ? So when I send a letter or package from Finland to US , Finnish postal service will receive my payment but the letter/package will be delivered by USPS . Does USPS make any money from my payment ?
367501	How good of a politician is Mamata Banerjee ?
367502	Why is IFTTT so slow to react to triggers ?
367503	IFTTT : What is the maximum wait time for a trigger to occur ? (Not quick triggers)
367504	What is a normal sputum culture ?
367505	What is the relation between torque , slip , and speed in induction motors ?
367506	Why increasing resistance in induction motor increases torque ?
367507	When is it too old for a woman to have children ?
367508	What does Mammoth IIRC mean ?
367509	How do I make my own Teen Titans Raven cape ?
367510	How do I make my own Kakashi vest from Naruto ?
367511	I can't remember how Jaime Lannister was captured by Robb Stark in Game of Thrones . Can anyone tell me which episode is that ?
367512	`` What is the meaning of Jaime Lannister's nickname'' `` Kingslayer'''' ?''
367513	What is the bulge in a tank's cannon for ?
367514	Can a gunship like AC-130 use a tank cannon (Rheinmetall 120 mm) instead of a howitzer ?
367515	How can honey lighten your eyes ?
367516	How do I remove the Google bar on my Moto G2 home screen ?
367517	How do I remove Google bar on Moto G3 ?
367518	What are some examples of formal dresses for 12-year-olds ?
367519	What are some examples of formal dresses for 13-year-olds ?
367520	Who is Gellert Grindewald ?
367521	What is Gellert Grindewald known for ?
367522	Why do people on the Left/Liberal side politically tend to reject the idea that human life begins at conception ?
367523	How long does it take for the GRE general test scores to be sent to the universities of my choosing ?
367524	Is GRE test score a way to get admitted to US universities for those with average GPA ?
367525	Is Google Cardboard any good for VR porn-watching ?
367526	Will I be able to watch movies on Google Cardboard ?
367527	How is friction increased and reduced ?
367528	What is a suitable solar panel installation provider near Cornville , Arizona AZ ?
367529	Why do I get so stimulated by a woman with nice feet encased in nylons ?
367530	Why do feet look so nice in videos ?
367531	How many football/soccer coaches are from the USA ?
367532	Was Eric Taylor a good football coach ?
367533	What is the difference between a flat and an apartment ?
367534	What is the difference between apartment and flat ?
367535	What would our night skies look like if we were located in a similar place in Andromeda galaxy ?
367536	How is it to live in a relationship when your partner doesn't trust you ?
367537	`` What do you do when in a relationship'' `` your girlfriend'''' doesn't trust you and is unhappy ?''
367538	Is there anyone looking for a Job in Mumbai ?
367539	Where should I donate blood in Mumbai were it will be used and not get wasted (due to non usage) ?
367540	What is a good alternative to Comcast in the Bay Area ?
367541	What is a good private school in the Bay Area ?
367542	Is it worth pursuing a graduate degree in industrial design ?
367543	Is a degree in industrial design necessary ?
367544	What are the best fast food chains that aren't in the US ?
367545	What is the best fast food chain ? Why ?
367546	What are the best graduate schools for studying computer science ?
367547	What are the best graduate schools for studying Computational Science ?
367548	What could be the cause of my wrist pain ?
367549	What could be the cause of this wrist pain ?
367550	How long does media mail take to be delivered ?
367551	How long does it take to send a mail from Singapore to Mumbai ?
367552	The old welding machines used electromagnetic winding to step up the current for welding rods . What is the new principle inside the welding machines ?
367553	Why do we call long - side sliced and deep fried potatoes French fries ?
367554	Which is the fastest and most stable OS for an Asus Netbook with 1GB RAM ?
367555	Elementary OS : Is ElementaryOS stable enough to be used full time ?
367556	`` Tamil (language) : What is meant by'' `` eeru ketta ethirmarai peyarecham'''' in tamil grammar ?''
367557	How can I send money to Mexico from India ?
367558	Which is the best way to send money to India from Mexico ?
367559	Should I buy a MacBook Air , MacBook , or MacBook Pro ?
367560	Where should I buy the MacBook Air or MacBook Pro : is it India or London ?
367561	Is the consumption of dog meat legal in Bangladesh ?
367562	Do most Indonesians agree with dog meat markets ?
367563	What are some of the best CAPTCHA solvers online ?
367564	What is a CAPTCHA ?
367565	Why do black holes change ?
367566	Why are libertarians anti federal reserve ?
367567	Why are so many libertarians anti-abortion ?
367568	Do Christians believe in wizards ?
367569	Do Christians believe in magic ?
367570	I have 4 years of experience in the software industry . Should I go for a 2 year MBA , a 1 year executive MBA or a Global MBA through the CAT or the GMAT ?
367571	Should I pursue MBA after 4 years of work experience ?
367572	Was plastic surgery an invention ?
367573	What is the scope for building technology and building sciences masters degree in architecture ?
367574	What is it like to study masters in building science without architecture background ?
367575	Should I get my mom anything on Valentines day ?
367576	What should I gift my wife on valentine ?
367577	I didn't got my ICAI CPT-result (hard copy sent by ICAI through post) . Can I download it online ?
367578	LENOVO Customer Care Service.@1877~778~8.9.6.9@LENOVO telephone support ?
367579	How much marks should I score to get admission in NIT Warangal C.S branch ?
367580	How many marks do we have to get to get a seat in NIT Warangal ?
367581	Why are there patents for HIV and EBOLA ?
367582	What is the path to become a security forensics analyst ?
367583	What a good path to become computer forensic analyst and incident responder ?
367584	Where the best website to buy marijuana seeds online ?
367585	What are some interesting web scraping projects you have done ?
367586	Where can I find the list of web scraping projects to practice ?
367587	Is Radiohead the best band of all time ?
367588	What is the best band of all time ?
367589	When will my ex-boyfriend contact ?
367590	Why did my ex boyfriend contact me after he said he likes someone else ?
367591	Why are Balinese Hindus able to eat meat ?
367592	Why does RSS not say anything about those Hindus who eat the meat of pigs ?
367593	What is the probability that I will die at any given age ?
367594	My dad is probably going to die in the next year . What should I be doing now ?
367595	I have confusion about logical memory . Where does the logical memory reside in my memory and how does a CPU consider it ?
367596	Operating Systems : Why do we need logical memory at all ? Why can't we do whole paging with physical memory only ?
367597	How safe is Bronzeville neighborhood in Chicago ?
367598	Is it safe to travel in the US by bus/train from Chicago to Portsmout , Ohio ?
367599	What is a normal blood pressure reading ?
367600	I got 125/60 blood pressure readings 10 min after exercise . Is this normal ?
367601	Who would win in a fight between Goku and Optimus Prime ? How would they fight ?
367602	What is the difference in time between places one degree longitude apart ?
367603	Is it possible to give the location of a place with position vectors instead of latitudes and longitudes ?
367604	To those who told a big lie to their parents and told them the truth years later - how many years did it take for you to tell your parents the truth and why did it take you so long ?
367605	I am 22/male . Yesterday my doctor told me I have only 2 years to live . How can I tell my parents the news ? What can I do with my remaining two years ?
367606	Can a woman with O positive conceive a child with any man of any blood group ?
367607	What are the names of all the cards in a standard 52 card deck ?
367608	What are some words you can spell out on a calculator ?
367609	What framework would a quantitative analyst in speculative trading work under in order to maximise her research efficiency ?
367610	I'm 40 , Indian , married , born and living in Dubai working as a Oil Trading Analyst and I'm now looking to migrate , what are my best options ?
367611	How much klms we should walk per day in order to loose 5 to 8 kgs per month ?
367612	Does Google pay when your app is downloaded ?
367613	How does the downloads count for an app in the Google Play Store work ?
367614	What is the weirdest thing to happen to you at a gig ?
367615	Where can I get a list of commercial vehicles in india ?
367616	Why we earn money ?
367617	Satellite channels are creating cultural erosuon ?
367618	I was chatting with a guy on tinder for a week or so , & he then disappeared from my matches which took me by surprise . Unmatched ?
367619	In Nevada when pulling out of a parking lot , can you make a left turn into the far right lane if intending to turn into a nearby driveway or business ?
367620	What are the most annoying habits people have ?
367621	Why were the solid rocket boosters on the Space Shuttle Discovery painted asymmetrically ?
367622	What does Panic at the Disco's song Hallelujah mean ?
367623	Who are the best drum & bass (electronic) artists ?
367624	What are the intro tracks in the Drum & Bass Arena podcast ?
367625	What would it require for Humans to coexist in peace indefinitely ?
367626	Can Jio SIM be used with a BSNL dongle ?
367627	Can you gain 0.3 pounds in a day ?
367628	What are some awesome facts of matrices that every physicist should know ?
367629	How do remove odour in polypropylene compounds by twin screw extrusion process ?
367630	Would you go on a dating reality show for a year if they paid you a million dollar ?
367631	I'm doing my 2nd year engineering rite now ! Nothing can stop me from loving biology ! I badly wan na study medicine ! What is it I can do about it ?
367632	Can liking a girl's pictures on Facebook get you beat up ?
367633	How important is it for a girl to get many likes on her photos on Facebook ?
367634	In how many ways can a CSS be integrated as a web page ?
367635	Fuck off sending me emails ?
367636	What is it like for a PLA soldier in a possible futuristic war with the USA (fought in both overseas and home turf) ?
367637	`` What does'' `` ight'''' mean ?''
367638	`` What does'' `` rawr'''' mean ?''
367639	What is the topology of the universe and is it worthy to represent the complement of solar system in the universe as a big CW space ?
367640	Does every Indian girl have a crush in her teen age ?
367641	What are the harmful effects of drinking 5-6 litres of water per day ?
367642	Is drinking more than 6 litres of water per day good or bad for health ?
367643	If my ice cream is in the freezer , why is it melting ?
367644	Why isn't my ice cream melting ?
367645	What do women feel when their breast are being sucked by a man ?
367646	How do women feel when a man looks at her breasts ?
367647	How can you built a network (networking) on instagram ?
367648	How is nail lacquer used ?
367649	What is the best prime number , and why ?
367650	What is the greatest prime number ?
367651	How can I get a rank below 10000 in SRMJEE ?
367652	How do I get a rank below 1000 in SRMJEE ?
367653	Is there any survey about home automation ?
367654	What is a home automation system by PLC ?
367655	How much are you expecting to score Tier 1 + Tier 2 in SSC CGL 2016 ?
367656	Why in ISIS are so many females raped , but it still attracts so many females to join ?
367657	Can I make 10,000 a month playing online poker ? If so , where should I start ?
367658	What do I need to know about getting a moped (scooter) in the UK ?
367659	What is the relationship between x and y in a function ?
367660	What is the graph of | x | = | y | ? (| . | being modulus function) . ?
367661	What is < status : fail , please try again later > on Instagram ?
367662	I am failing in each thing that I am trying . I want something that can make me start again . What are some suggestions on what can help me ?
367663	What are good airline jobs ?
367664	What is the best airline ?
367665	How do setup IP rotation for my web crawler ?
367666	Whay are some basic problems in Ahmedabad ?
367667	When does Taurus start ? Is it from April the 22nd to May the 22nd ?
367668	Taurus (astrology) : What is it like to be a Taurean ?
367669	Could groundhogs be introduced to the Philippines , and survive in the wild there ?
367670	What would be golden opportunity for investment after ban of old Rs 500 & 1000 notes in India , Trump is winning USA elections ? Where I investment ?
367671	Why the input resistance of a transistor is low while the output resistance high ?
367672	Why do we need a high input and a low output impedance in an amplifier ?
367673	Which font was used in this logo ?
367674	Which font does yury.it use for their logo ?
367675	Which one is correct : ` made me realized' or ` made me realize' ?
367676	Which one is grammatically correct ? Mom and I or mom and me ?
367677	How do change palm line according to our wish ?
367678	Can I buy two Jio sim for different phone with same Id proof ?
367679	Should I buy a Jio SIM ?
367680	Do the Feds and the LAPD/NYPD really argue over who is in control on certain crime scenes like they do in the movies ?
367681	Do law enforcement officers really bicker over crime scene jurisdiction as commonly depicted in TV shows/movies ?
367682	When did karma instantly pay you back ever ?
