229193	Which is a good inpatient drug and alcohol rehab center near Hamilton County FL?
47740	Which startups in China are hiring for foreigners?
47741	Which startups in China are hiring?
160796	What is the easiest motorcycle for DIY repair and maintenance?
160797	What is the easiest car for DIY repair and maintenance?
466212	Is OrangeHRM a widely used open-source program big in demand?
308310	Is there a key benefit of programming an Enterprise SaaS solution in Java rather than say RoR or Python or PHP? Which SaaS vendors use Java?
173150	What is the best ultrasonic mosquito repellent?
298352	What is the best way to crack AIPMT?
298353	Can I ever crack AIPMT?
261247	Does energy have mass?
261248	Does potential energy have mass?
456277	What are some mind hacks?
456278	What are some of the best mind tricks?
127736	What are the best substitutes for milk powder?
361719	In simple harmonic motion, when displacement is maximum?
361720	How can I calculate the maximum displacement of a simple harmonic motion?
196810	Why are engineers miserable?
197244	Who created school?
197245	Who created school and why?
390048	What is the best city to stay in US?
390049	What are the best cities to live in the US?
58011	Do programmers in Japan get paid as much as programmers in the US?
58012	How much can an average computer programmer get paid per month?
204447	Why don't airline beverages have lids in case of turbulence?
204448	Why don't airlines use lids for their coffee?
496287	How long does it take for HR to rollout the offer letter after sending the documents at mindtree?
496288	How long does it take for HR to rollout the offer letter after sending the documents at Accenture?
157636	Completed my B.Tech in 2010.but I joined one MNC 2013 Jan, now I have 4 years exp, if I move another company the gap of 2.5 , will it make a problem?
157637	I've passed 10+2 public exam in 2013 and I was admitted to the B.SC course in life sciences that very year. Now, I want to get into a B.Sc in agriculture course prior to the completion of the running course in 2015. So, does this gap of 2 years will affect in building the career?
295103	What are examples of internal conflict in fiction?
295104	What is the internal conflict of a story? What are some examples?
297725	How can guys last long during sex?
297726	How long do you guys last during sex?
203037	Do women prefer to spit or swallow?
203038	Do girls prefer to spit or swallow?
193014	Atoms: What would happen if we used a double slit anode instead of one with a hole in the cathode rays experiment, considering electrons as waves?
98856	What are the best practices and requirements/restrictions for use of social media spaces/networks to recruit participants for clinical trials research?
237819	What led to the rise of the Ottoman Empire?
387402	Will paying tuition fee in full and then applying to NZ student visa increase chances of approval since I've been rejected twice for fd being recent?
387403	I've been living in California for the last few years. My wife is in India and she will be joining me at UC Davis. If I pay her tuition, would I qualify for resident tuition?
397365	Does Mintop stop the hair fall?
397366	How good are SRS and hormone treatments? Can a guy who has horrible skin and balding hair become a woman with glowing skin, thick hair, etc.?
59943	What are the most interesting facts about Earth?
59944	Interestingness: What are some of the most interesting facts about planet Earth which are not known by many?
394263	What is economic interdependence? How can it create problems?
534251	Wake, Work, Eat, Rest, Repeat. I just watch people, make judgments, learn from them, move on. Silent watcher. Why am I not happy with this life anymore?
534252	"Is ""looking for water"" a non-restrictive clause in the sentence, ""I'm in the desert, looking for water""? Should a comma go before ""looking""?"
240443	What is a phrase expressing the aim of a group or party?
331604	"Does the expression ""if you please"" exist? If yes, how is it used in a phrase?"
128483	Have you ever been taken advantage of for your kindness? 
184895	Why do many wealthy people (non-athletes) prefer cardio over lifting weights?
376781	Which one is the best android phone below 7000 in which there will be no issues?
288445	Which is the best mobile below 7K?
356782	Why is Russia not in the list of top 10 countries which are not easy to invade?
356783	What are Top 10 block money countries?
428729	What should I do when a girl ignored me and she knows I like her?
387199	How effective is beard oil?
511936	What is the weirdest thing you have Googled?
511937	What is the weirdest thing you searched on the Internet?
497454	What would be a career option after BBA+MBA IT?
75741	How are Fruit snacks such as Fruit Gushers made?
75742	How are fruit snacks made?
172221	What are exothermic reactions? What are their uses?
244480	What are some best shops in Chennai for laptop exchange?
244481	What are the perks of being a Native American?
12580	What is the difference between an artificial neural network and a biological neural network?
278423	What is the funniest thing you've seen a stranger do?
109915	I'm always horny, 19 years old and a virgin ironically. How do I control it?
332546	I was in an accident 2 years ago and the other driver filed a lawsuit against me. Do I have to appear at court?
332547	How can we raise awareness against road accident?
536547	What are the top 5 countries in CTF-hacking?
536548	Is it wrong to make your own video game about girls if you're a quiet dude who's never had any female friends?
432051	What is the best face cream for fairer, smoother and clearer skin for men?
432052	What is a good face wash for girls for fairer, smoother skin?
78027	If I return a used item to myntra, what will happen?
78028	How can I cancel return request in Myntra?
258962	How do you bring a1c down with type 1 diabetes?
258963	What are the best ways to bring down A1C for type 1 diabetics?
536669	Why is Benjamin Netanyahu famous?
508661	How is sex after marriage?
508662	When is sex done after marriage?
385407	How do I avoid ice crystals in fruit Pulp based ice creams?
385408	How much of the protein I eat is used as energy vs being used to build various tissues?
260950	What is there to search for on YouTube?
260951	What are you searching for on YouTube that you can't find?
99366	Which CDN should I use for a video streaming site with a video size of 5 to 10 MB and most of the users are being from India?
99367	To all the ecommerce business owners out there what is the highest value problem that you are facing right now?
89637	What patterns of settlement and immigration has the UK demonstrated in history?
89638	What is the history of settlement of the British Isles?
462650	What is the unit of torque in a DC motor?
253916	Why do I feel that my relationships with my friends are never the same again after I get into fights with them?
244001	How do geographic poles work and how are Earth's geographic poles compared to the ones in Uranus?
244002	How do geographic poles work and how are Earth's geographic poles compared to the ones in Venus?
70682	What is the best burning incense to cover up the smell when smoking pot?
70683	Am I a loser for still smoking pot at 28?
218560	Where are him from?
218561	What ethnicity do these people look like they are?
176679	How is the word 'impious' used in a sentence?
15199	When should I apply to Harvard MBA?
15200	When should I apply to Harvard?
530727	How should a young person invest his/her time and money?
485143	How we look is unimportant?
485144	How important are looks in life?
228465	Before Chrome and Android, how did Google earn money?
20221	What is the best editor to write React and React-Native code?
20222	Can you replace all jQuery code with React.js code?
408845	How do I apply to companies (including startups) so that they respond?
408846	Is it illegal for companies to hire people just so that they can show off how diverse they are?
427806	What does it feel like to have Ulcerative Colitis?
311490	Why is ulcerative colitis painful?
232515	Will prostitution ever be legal in all the U.S. (not just Nevada)?
232516	Will prostitution ever be legal in the united states?
532048	What is the best question and answer platform?
532049	What is the best question and answer platform? Why?
201314	What is between loops in loop quantum gravity?
349728	What do people think about Loop Quantum Gravity? Who is a Loop Quantum Gravity enthusiast?
480366	Why do Christians eat pork while their cousins Jews and Muslims are forbidden to eat it by the same God?
531930	What would happen if there was a nuclear explosion on the moon?
531931	What would a nuclear explosion look like on the moon?
490032	Who is your favorite character in Mahabharata, and why?
490033	Who is your favorite character from the epic Mahabharata and why?
192458	What is the typical raise in salary from SDE 1 to SDE 2 to SDE 3 across different companies such as Amazon, Google, Facebook, and Microsoft?
192459	I'm a SDE at Amazon (Seattle) for 2 years. Google (MTV) is going to make me an offer soon. What should be the expected salary hike?
166243	What is the reason behind human existence on earth?
34197	How do I become a great computer scientist?
34198	How do I become a great computer scientist? What should I do?
191356	What is the difference between pasturised, skimmed and toned milk?
191357	What is the difference between toned milk and skimmed milk?
530000	Which one is better, a 70K private job or a 40K government job?
530001	Is a government job like IT officer in SBI better than private corporate software jobs?
478503	I am preparing for UPSC-IAS. Many of my friends read lots of outside materials like novels, biographies, and autobiographies. I feel I'm lagging behind as they say it'll help them in the interview. Is this true?
343147	I'm currently studying at IITB. I'm just at the end of my first year here. I want to crack the IAS (UPSC) on my first attempt. What should I do? How do I manage my studies and also get along with the preparation?
230150	How was the ACET May 2016 exam?
254767	I saw this girl I used to have a crush on. Now she's along with me in college too. Should I approach her first or invite her to be my friend on Facebook?
420958	What machine learning tools are used to create Airbnb's price suggestion?
420959	What do people who use Machine Learning think of Quora's use of Machine Learning?
25129	Do video games make you lose interest in other things like reading a book or watching TV?
25130	I think I don't have the patience to do anything. Even simple things like reading a book, watching movies don't interest me at all. What's wrong?
387822	Where is a Codecademy or Code School equivalent for learning how to use analytics to make great products and design decisions?
387823	What are Codecademy equivalents for all kinds of things?
411343	How do I manage time to study wisely?
519957	How do you write 15 December 2016 without using numbers?
519958	How do you write [math]23^{\textrm{rd}}[/math] June 2013 in 5 letters without using any numbers?
349392	What are the salaries of cricketers who play in the Ranji trophy championship?
349393	Can anybody play for any ranji team?
466951	Why is there punishment for involuntary manslaughter? Doesn't it mean that the accused didn't want to commit murder?
476731	How the anti-chat philosophy is helping Helpchat India?
192022	What are best books for learning about real biography of prophet mohamed?
192023	Which are some of the best biographies of Prophet Mohammad?
306825	Are there any movies that depict the Byzantine empire?
306826	What are good non-documentary movies about Byzantine empire epoch?
429338	Which is more loving salamano and his dog or meursault and his mother?
429339	Kendrick Mars is surely a fake and trying to net some scams, should be banned?
181587	Should I close my bank account if I don't use it?
191084	Do guys know when they have a boner?
221556	Do escorts feel nervous when they know they will have a very good-looking client?
104270	What is the best site to find tutorials on design?
479655	How do you make pancakes from scratch without milk?
479656	What's a recipe to make pancakes without milk?
512912	Are there international treaties which prevent nations from increasing the size of their standing army?
512913	Why has the FDA not approved cold caps, which prevents loss of hair resulting from chemotherapy, for use in the US?
466113	Are animals multicellular? If so, why?
182970	What should I know and do to build a career in IOT?
182971	What should I do to build a career in IOT?
383180	Why would a doctor prescribe vitamin D2 50000 units?
128786	What is investment banking?
257870	How does GPS vehicle tracking system works?
263662	What is the most heart touching romantic English song you have heard?
263663	What are best non-English songs you have heard (2015)?
30880	What is the best way to use rented iPads for employee training as my company is not financially ready to buy hundreds of them?
400887	What are G4 nations?
400888	Will India ever secure a permanent seat in UNSC or the other G4 nations has a greater probability for a permanent seat?
117600	How fatal is congestive heart failure?
316705	How do I run 5km in 17 mins?
466507	Is leaving toothpaste on your teeth after brushing good or bad for you?
512702	Are phosphorus, locomotive, gas, and incult brands related to garments?
512703	How some of the original branded garments can be seen selling around the narrow street shops at much subsided prices in big cities?
208667	What are some Vegan wholefood ingredients that have Vitamin D where the Vitamin D is not fortified (must be wholefood)?
208668	What are some Vegan wholefood ingredients that have Vitamin A where the Vitamin A is not fortified (must be wholefood)?
263970	What will be the positive effect of banning 500 and 1000 rupees on Indian economy?
214294	How can I open my Gmail account while I forgote the password?
392481	What does 押一付三，先付后用 mean in English?
53141	What would it take to extract a viable sample of DNA for a service like 23andme from an envelope licked by a dead relative?
384110	Why do our eyes turn red when we want to sleep?
384111	Why will our eyes turn red when we wake up from sleep?
214377	What are the most important modules in CRM?
214378	What is the most important thing to look for in a commercial real estate CRM?
258690	I am 20 years old. Some patches on my face have not got any facial hair. What should I do to overcome this?
457579	Is the Tejas or JF-17 a better replacement for the MIG-21 (F-7's)?
457580	Is lca Tejas better than J17?
113037	What is the 2nd amendment?
113038	Why is the 2nd amendment important? What is it about?
412151	Could a Donzi (go fast boat) cross the English channel?
412152	What is the placement scenario for mechanical engineers this time (2016) in VIT?
2709	What is the scope for a PHP developer in India? What are the MNC companies hiring PHP developers?
2710	Which are the MNC companies for PHP in India?
509551	How do I prepare well for SNAP exam?
51340	Around when is the Mahindra Gusto 125cc going to be launched in other states such as in the Northest?
51341	When is the Mahindra Gusto going to be launched in other states such as in the Northest?
110198	What do Russians think of Donald Trump?
509493	What would Lenin think of Donald Trump?
185318	As quran says, Is the Earth really flat?
164268	I have only one friend. I want a girlfriend. What should I do?
122939	What is the cause of premature greying of hair?
120210	Are there any Parliamentary Republics whose Head of Government and Head of State is not separated?
360798	What do you know about Nikola Tesla?
360799	How can I know more about Nikola Tesla?
239780	Can the size of a penis permanently stretch the vagina?
239781	Can we get permanent tattoos over stretch marks to hide them?
196684	What are the travel API's in India?
196685	What is travel API?
463780	Can I use 2 Twitter developer accounts, one for the streaming API access and another for giving my users oauth access to sign up?
97580	I have been going on a diet where I'm eating 1500 calories a day. I run 2.4km everyday, do 3 minutes of planking and 60 push ups, but I still gained 5kg. Why?
357848	What are some tips for Defense of the Ancients?
357849	Shouldn't this topic be Defense of the Ancients 2?
439785	What are some Punjabi jokes?
439786	What are some good Punjabi jokes?
165003	Can one use heroin responsibly?
375490	Why do I have itchy bumps between my toes?
375491	What are the causes of itchy bumps between my toes?
202960	How do Wildcard SSL certificates work?
195811	How does an SSL certificate work?
161114	How do I hack someones wifi network without them knowing I am using their wifi?
364255	What is OnePlus?
364256	What would OnePlus 4 be like?
257920	How do palm trees grow coconuts?
231326	What is a ring network, and how are its nodes connected? What is the importance of this network to topology?
369005	How do I protect our personal space? Eg: if our warden comes in to check our room is there any law that would protect us from him to check stuffs
369006	How do I protect our personal space from warden when he trys to enter our room? Is there any law that would protect us from him to check stuffs?
96670	When is the best time to take apple cider vinegar? 
508870	How do I take Apple cider vinegar and when is the best time?
16190	What is it like to be a graduate student in mathematics in China?
295376	What is it like to be a graduate student in mathematics at MIT?
234226	What are the main differences between Ahmadiyyas and other Muslims?
137921	What is the exact difference between Muslims and Islamic people?
316356	Heading into the September 2014 Apple press event, will the iPhone 6 likely be the best phone on the planet? Why or why not?
298336	How can I live a simple and satisfied life?
524278	Is all of the matter in the universe just getting farther apart? Or is space-time itself stretching?
524279	Why does space time concept never approves of itself?
479422	"I have read a sentence""I, fugi, sed poteras tutior esse domi."" which kind of language it is and what's the meaning in English?"
479423	My mom is nearly 50 years old, with a basic knowledge of the English language. I want her to start reading books which have a simple story and language usage, as a lot of difficult words would only deteriorate her will to read. What books should she start with?
259577	How are guide dogs so intelligent? Recognising buses, crossing roads, finding seats and shopping?
259578	How do guide dogs know when to cross the road? What other things can they do?
32806	What is the best notebook for programmers?
32807	What are some good notebooks for programmers?
164542	What is mole-fraction of water?
386947	What are the advantages and disadvantages to leasing a car?
499267	What are some best of the motivational songs for studies (Hindi or English)?
499268	What are good English songs videos?
480483	How do you reset your Kindle? Call +1888–811–4532
480484	How do I reset a Kindle keyboard?
47359	Why don't Christians practice what they preach?
47360	Do Christians truly practice what they preach or are taught?
83640	What software packages do aerospace engineers use on a day-to-day basis?
83641	Can you work as an aerospace or software engineer with a BS in computer science?
178428	Would communism work in an economy based of robotic labor?
178429	Could communism work in an economy based on robotic labor?
470469	Where can I get the full version of either Microsoft Office 2003, 2007, or 2010 for free installation?
429613	Why is it not healthy to feed your dog human food?
429614	Is it safe to give your dog human food? What foods could be considered a health risk for your dog?
126481	How do you fly a plane in GTA?
211199	I am in class 9. One of my friends joined fiitJEE in class 7. He has a lot of knowledge. Should I join it in class 10 as well? Please give reasons.
211200	I am in class 9. One of my friends joined fiitjee in class 7 and he has a lot of knowledge. Should I join it in class 10? Please give reasons.
18013	Is the girl I met on live chat real?
18014	What is the best framework for live chat application?
156025	Which is the most reliable car brand in India?
156026	Which is the most car reliable company in India?
469804	How does Spotify offline work? What format do the songs get downloaded and cached? And how much space does each song take?
469805	How can Spotify offer premium users to play songs offline?
309995	What is your review of Grenoble Ecole De Management?
309996	Is Grenoble Ecole De Management reputable?
76946	Dushka Zapata, what do you think of Donald trump overall?
76947	What does Dushka Zapata think about Donald Trump?
270710	What animal is?
218441	Is it possible to find an IT job in Canada from India?
302328	How do I be more intellectual?
302329	How can I become more intellectual?
156002	What is gender stereotype?
156003	What is gender stereotypes?
408994	How many of you are addicted to Quora?
386605	If AI fell into the wrong hands, how would they misuse AI and what would you do to prevent the harmful effects?
386606	Who has an advantage: AI creator or AI itself?
320824	What percentage of the world's population is bilingual?
320825	What share of the world population is bilingual?
223374	What are the Red Cross' aims?
223375	What does the Red Cross do?
426038	What is the best IMDB-style site for music? Why?
106500	Is Computer Engineering a good career in Egypt?
106501	Is computer engineering good as career?
446712	What are the (ancient) Romans beliefs on the afterlife?
446713	Were the Ancient Greeks and Romans white?
97383	What are some good and cheap hotels or hostels within walking distance of the train station in Belgrade?
130185	Should Barack Obama have been allowed to run so Trump could have defeated a real opponent and not a whimp like Clinton?
522856	What are some things new employees should know going into their first day at Skullcandy?
285586	Does alcohol cause low blood pressure?
413239	What do I do when I feel good for nothing?
483980	Why are there bones and fossils evidence of creatures that no longer exist?
483981	Why are there bones and fossils evidence of creatures that no longer exist what happened to these creature?
509144	What are the requirements to import agricultural products to the US from Chile?
509145	What are the requirements to import agricultural products to the US from Colombia?
408547	"Am 21 (female) with a height of 4""9' can I grow taller?"
164297	Is the idol in the Tirupati Temple actually the idol of a Jain God?
454972	Does God really exist in every idol?
390808	I have an interview with Amazon. What are some tips for a successful interview?
390809	How does Flipkart's interview process compare with that of Amazon's?
314570	What are the differences between research method, research tool and research instrument?
270081	How can you avoid a girl who has a huge crush on you without hurting her?
270082	GUYS If you found out a plain, uninteresting girl, who you could never be into, has a crush on u, would u still approach her? 
309387	Which has been the most financially rewarding patent in history?
425137	How can I learn to write better essays?
425138	How can I get better at writing essays?
279329	What happened to ymdb.com?
109885	What rights do you have if you have been accused of a crime in the United States? How are these rights different in Singapore?
459564	What is Neil deGrasse Tyson’s IQ?
58191	From the view of the coach, what is needed to win a youth soccer league?
347832	How do I hide the address bar and the tabs on Google Chrome so that when I hover over them, they display?
403485	How do I hide a tab in chrome?
295920	Should I use Tinder?
187643	What do Greater Swiss Mountain dogs look like?
264255	Can I use pokemon go guide as title for my android application?
264256	How does the department of architecture of UT Austin fare among other universities like Columbia, NYU, Pennsylvania, etc?
501558	As a Canadian citizen (dual-citizen), am I allowed to enter Canada on a foreign passport?
501559	If someone is born on the Canada-US border are they a dual American-Canadian citizen?
385735	Why does the circle have 360 degrees? Does it have anything to do with the fact that a year has 365 days?
22078	What is the difference between making of law and commencement of act?
489951	What are some useful chemistry/maths tricks I should have for a chemistry interview?
73296	What are the secrets behind the Gold Rush TV show?
329295	How many camera men are killed annually filming reality TV shows like deadliest catch, ax men, gold rush, etc.?
73456	Is it easy to learn Kashmiri language for someone who only knows Hindi/Urdu? How would you rate it on a difficulty level compared to other languages?
73457	Why is it so difficult for adult English speaking only males to learn computing from a female, who speak English as additional language teacher? Is it the old inverted power thing? Would they learn better from a male teacher?
460278	Will Oracle DBA have a scope in the future?
460279	What is the future scope of Oracle DBA?
264906	"Can there be""Backspace or Shift Delete"" in life as well?"
264907	Why is the Modi government turning a blind eye to the adversities being faced by poor people?
186260	How many hours should an average engineering college student study to get 9 points or above?
186261	How many hours per week should you spend outside college studying to be better as an architecture student?
242627	What changed when Barry Allen (The Flash) fixed flashpoint?
373044	Which Quora questions deserve to be tagged as 'dead horse beaters'?
200209	Should I learn German or Spanish?
200210	Which language I should learn, German or Spanish?
409647	What should Rahul Gandhi learn from Narendra Modi and vice versa?
409648	How do I get visa of srilanka?
