442828	What are the medicines for fungal infection?
465604	When someone says they'll punish you unless you do a crime, and you can't tell the police, what is the best thing to do?
296838	What is BIOS? What are its characteristics and functions?
296839	What is BIOS?
138873	What are some outstanding indian short films?
407522	Why are AKS so reliable?
407523	Why is the AK-47 so reliable?
215448	How much money is spent sourcing real estate development opportunities in New York City?
215449	How much money will I spend on food and transport during a one week stay in New York City?
229469	Sex Tips: How should I finger a girl?
197597	Is running online raffle legal in US? Given that I don't charge anything from people?
197598	What are some benefits for lawyers who go pro-bono given that it does not pay? What motivates lawyers to not charge anything?
72516	What are the best marketing strategies for small cafes or restaurants?
72517	Which are some good marketing practices for restaurants?
108049	Why are James Carville and Paul Begala not playing an active role in Hillary Clinton's campaign?
317318	Will deleting my snapchat account delete unsaved messages?
241871	Which shampoo and conditioner should be used for curly, puffy & dry hair?
430621	I have this tendency to get bored when I go deep into a subject. How do I get rid of this tendency?
430622	What is a good technology in the Indian IT industry?
42416	What are your favorite short films?
104886	After completing bachelors in telecommunication engineering what can we study at masters level in engineering except telecom engg.?
104887	I study telecommunication engineering. What skills do I need to have before completing college?
62689	What was the darkest phase of your life?
450775	What's the material used to cook meth?
391465	Can a dog be euthanized at home painlessly and humanely with OTC meds?
79420	SBI Vs Axis Bank. Which Is Good. In Aspect Of Online Transactions?
382059	What is On road price of baleno top model petrol in navsari, Gujarat?
382060	A metal has a density of 10.22 g/cc, atomic weight of 95.94 and atomic radius of 0.136 nm. Is it BCC or FCC?
329436	Why should we colonise Mars and not the moon first?
329437	Scientists are planning to colonise Mars but don't you think that colonising the moon first would be a better option?
479910	What were the consequences of the Revolt of 1857?
479911	Discuss the causes of the Revolt of 1857. Why did it fail?
1236	How do I can stop hairfall?
44595	What kind of economy does the United States have compared to the one in Ukraine?
44596	What kind of economy does the United States have compared to the one in Germany?
181235	What is the best way to cook a frozen roast beef?
83952	What are some of the best ways to cook frozen beef?
487917	Which was the wealthiest country before the current one?
260638	What is the wealthiest country in the world?
173074	What are the signs a woman can't be bought?
173075	How can I tell if my man has another woman. What are the particular signs to look for?
205273	How can I simplify the square root of 84?
116096	Can Dutch and Flemish people understand Afrikaans?
116097	What is sugar in Afrikaans?
156732	How do I clear the copyright issue on YouTube?
60170	What is GST? What are the pros and cons of GST?
348580	Can you start a company and sell different products under that one company?
348581	Can I sell 2 totally different products under one company name? What are pros and cons?
438131	What would you want people to say about you at your funeral?
287291	How do I create a brand page in Quora?
287292	Is it possible to create a company account on Quora?
195088	Which country in the world has the best education system and why?
403587	Which education in the world is the best?
366235	Which is a suitable solar panel installation provider in Chandler, Arizona AZ?
454675	Which is a suitable solar panel installation provider in Eloy, Arizona AZ?
324388	What can I do to talk to my old best friend again?
441279	What is core competency of Flipkart?
441280	What is core competance?
497408	Which is the best place for buying designer bags online?
497409	Which is the best place for buying designer makeup bags?
385764	"What is ""poetic irony""?"
385765	Which is the biggest irony about love?
61774	Where Indians can travel without visa?
482213	What are some simple Mediterranean snacks and dishes that are easy for a college student to make?
482214	How do you brew tea using the skin of a kiwi?
197418	Why did Kickass Torrents go offline?
264406	Where can I found quality children's picture books in Sydney?
264407	Where can I get quality children’s books across the Sydney?
53673	How does IntoNow's iPhone Facebook integration work?
53674	"How does Facebook ""Like"" button work? Does it broadcast your Likes to your friends?"
413907	How do I know if something I've invented is really good?
413908	If I am an inventor and when I have an idea to make something want to know something is invented or not then I Google it, how can I trust Google not to steal my idea?
489836	Which book among DC Pandey or BM Sharma is good for clearing concepts in physics and practice IIT level questions?
172767	What can I do to stop loving her?
172768	How can you stay organized while learning multiple things simultaneously?
438107	What is the best Momofuku restaurant in New York?
187304	Why is it difficult to get a job in India?
187305	Why is it so difficult to find a job in India?
40783	Which is the Best weight loss book?
173374	What is a feminist's take on the relationship between Khal Drogo and Daenerys Stormborn?
534419	How good is the book 'Networking & Algorithms for Computer Games' by Jouni Smed & Harri Hakonen?
534420	How is the book 'Networking & Algorithms for Computer Games' by Jouni Smed & Harri Hakonen?
302291	Which country has the least natural beauty?
302292	Is there a relationship between lucid dreaming and astral projection?
221974	Which are the top business schools in australia for MBA?
365696	What are some mind-blowing shoes technologies that will be available to us in the next 10 years?
365697	What are some mind-blowing technologies that will be available to us in the next 10 years?
414324	Why is adsorption an exothermic process?
414325	Is the blast of a nuclear bomb exothermic?
521017	What would it be like if all the wealth in this world is distributed equally among everyone?
521018	Which country has the least inequality in terms of wealth distribution among its citizens and how has it managed to do so?
473450	Why is labor in China so cheap?
473451	Why is labour in China so cheap?
132188	How do you know if you have been drugged?
132189	How do I know if I have been drugged?
204143	How do I use pepper spray?
204144	Is it legal to carry pepper spray for personal defense as a minor in SC?
345963	How do you schedule your working day?
345964	What is the movie watching schedule of movie buffs? How do you acaccommodate that time in your regular work life?
20470	How do I help the pro-life movement?
20471	What are some ways to get involved in the pro-life movement?
516830	Can AWS Instance Storage to CPU/RAM ratio be tuned?
390302	What is global security?
390303	What is security?
510151	How do I invest 1 lakh rupees as a student in India so I can get better return after 5 years?
43195	I want to buy a second hand bike. Ho do I determine that whether the price is worth or not?
43196	Why do people play sad, depressing songs when they are happy?
532670	Why don't peaches ripen?
532671	How do I ripen peaches?
98343	Why is it that the prices are low for certain items in union territories when compared to the rest of the states in India?
1341	What are ways to deal with fabricate security and insurance of android application?
186836	Why do people shout?
15557	What is jask.io?
484622	Is being nice to other people generally considered a sign of weakness?
159880	Why is being nice considered a sign of weakness?
339198	How can I find out if my vehicle need to get servicing and maintenance?
339199	If a person gets out of a vehicle can they still receive a citation?
320632	Who voted for Hillary?
320633	Is a vote for Hillary a vote for Trump?
402189	What is the best way to crack GMAT?
365093	How do I crack the GMAT?
62564	Is there some sort of comprehensive cheat sheet for C++ containers?
495806	Why doesn't Quora have admins that can judge the quality of a question before posting?
154777	How do prisoners entertain themselves in solitary confinement?
154778	What are some fun things to do in solitary confinement?
299150	How can we arouse envy or admiration rather than pity?
299151	I have low GPA and 4 years of experience as web developer, in which all top 15 university can I expect for CS?
171700	Are there any apps that allow the use of the apple pencil on ebooks?
339145	How do you make Aloe Vera spray?
277269	How can I log in into my old Facebook account?
519670	What does this MatLab error mean? I can't fix it
519671	Is Donald Trump the first sexual predator to get elected President of the United States?
157628	What's in your journal?
253370	How do I make a thousand dollars in a week legally?
394791	Does Google make network switches?
394792	Which features/improvements would Google need to add/make to Gmail, Google Calendar, and Contacts to get Outlook users to switch to the web interface of Gmail/Google Apps Mail?
441067	What is the cheapest way to ship books from US to Israel?
404197	Why would someone change operating system to Linux on a wifi router?
404198	Why would someone change operating system to Linux in my Wi-Fi router?
287824	What are your opinions on Donald Trump and his presidential campaign?
498346	Why maximum people after doing engineering give GRE Exam?
498347	What type of questions are asked in the Preliminary Test for a Technical Cadet in Indian Army? How can we prepare for this test?
483697	Does anyone need to hire a hacker?
316613	What do Germans think about Greeks?
316614	What do German people think of the Greeks?
20484	What is lenovo laptop technical support phone number?
81072	Is there any way to remove the password from a unknown password protected rar files?
289827	What is the average placement in HBTI Kanpur?
289828	How are MCA placements in HBTI?
161525	What are the most thought provoking experiences you have had?
161526	What is the most rewarding experience you have had?
347233	How do I invest in gold stock?
347234	How do I invest in gold futures?
478249	How do you win a Nobel Peace Prize?
186624	What is good to eat honey with?
186625	Is honey good for you?
506844	Is it possible that the universe is no longer expanding?
506845	How do I get my girlfriend to defecate herself during anal sex?
80797	I've gained a lot of weight and started developing nasolabial folds, but I didn't have them when I was thin. If I lose weight will they go away?
80798	I'm starting to develop nasolabial folds around my mouth because I've gained weight. If I lose weight will they go away?
496313	Why doesn't Microsoft make Age of Empires 4?
496314	Why doesn't the Age of Empires game have an Indian civilization?
66287	My boyfriend's family absolutely hates me and tries to keep us from seeing each other I've been nothing but kind and they still hate me what do I do?
66288	Can the de Gaulle politic of Grand Ensemble during the Marshall plan reconstruction phase be considered pure Hooliganism?
46490	What does the '100' emoji generally mean?
161154	How do I encode Emojis?
296173	What are the best aspects of living in Szczecin, Poland as a young adult?
296174	What are the best aspects of living in Białystok, Poland as a young adult?
386282	Why do people preach being politically correct and yet vilify anyone who uses there freedom of speech to say something negative?
386283	Why is it politically correct to call African-Americans 'black people' yet incorrect to use the Spanish equivalent for 'black'?
258512	What are some great examples of oxymorons?
406517	What are some funny examples of oxymoron?
165472	Is there any relation between using bad toothbrush and stomach diesease?
165473	How telephone companies benefited when they share infrastructure?
257574	How much does it cost to straighten teeth?
257575	How much does it cost to straighten teeth for adults in India?
261852	What is dark matter's theoretical function?
261853	Is it best palce to start a caree in e learning company or not?
411687	How much would it cost to buy a country?
411688	How much money would it cost to buy a very poor country?
380580	Which submission hold is the most painful for military men (Army soldiers, Green Berets, Marines, Snipers, Air Force men, Navy SEALs)?
380581	Store price of Apple MacBook pro mid 2012 in India?
100305	What are any employee retention programs at Google, Apple and Facebook?
100306	Which are the employee-learning programs in Google?
173052	Who can be a good coach for the Indian cricket team?
190110	what does it mean to have letter M on both palms? how does it affect fortune?
190111	What does it mean to read palms?
406961	What is the rpm of a fencing wire winding tool?
406962	What is the reduction ratio to be given for fence wire winding with 1380 rpm motor?
335511	What are the well-known hacker magazines and forums?
335512	"What is known about the hacker ""OxOmar""?"
356894	What is “Parallel”term means in Computer processing. Also List and briefly define the types of computer system organization?
513019	What does frequency mean in terms of mobile computing? What is the use of frequency and how is it allocated?
205763	How do I get a gyroscope on my smart phone?
115780	How widely accepted are credit cards at small businesses and restaurants in Kyrgyzstan?
199615	What are good ways to stop lying?
21701	What is it like to be the bodyguard of a president?
24961	Superheroes: Who would win in a fight between Batman and the Flash?
24962	Who would win in a fight between Batman and The Flash. How and why?
297397	What are some examples of database management systems?
297398	What is a database management system? What are some examples in how it is used?
22937	How can I get maximum returns by investing Rs 25K in a year?
51534	Could steel beams be melted by jet fuel?
362379	I want to remove vocals from a song. I used Audacity for it, but vocals are not completely removed. What is a way to make a good karaoke in which vocals are completely removed? Is there any other open source software or any other way?
362380	Which software is available for free to remove vocals from a song?
332061	How much does a second-hand car cost in Amsterdam?
52544	How is AB de Villiers in his personal life?
52545	What is AB de Villiers like in real life?
503698	How do you sell a car with a lien?
503699	What is a lien on a car title?
409561	How long until Trump gets impeached or is forced to resign for any reason?
409562	How was ESE stage-1 2017 civil engineering paper?
300406	I have a Kohler RESV8 propane generator and it shuts down after starting. Is anyone familiar with these generators failing in off grid applications?
300407	How do I get the best treatment for fungal infection in maharashtra? My mother has the recurring infection and is diabetic..
487749	What are the best vegetables to feed a sugar glider?
487750	What are the best vegetables for sugar gliders?
111994	"Should one say ""runners-up"" or ""runner-ups""?"
111995	"Is there a list of all of the nouns in English where the pluralization is in the middle of the word -- like ""runners-up""?"
488870	What are the best questions and answers asked in interviews?
26492	What can we learn from Donald Trump's win?
26493	What can we learn from Mr. Trump's victory?
505857	How do I do helical welding by hand? Please describe the proper procedure of welding a strip of flanges in a helical trajectory, on to a metal shaft.
505858	How do I make helical welding by hand? Please describe the proper procedure of welding a strip of flanges in a helical trajectory, on to a metal shaft
87516	What are benefits of drinking ones own urine?
39515	How can you change the privacy settings on Facebook?
39516	How do I change the privacy settings on Facebook?
59822	What do Americans / Europeans think about Filipinos?
59823	What do South Koreans think about Filipinos?
46347	Can I become an engineer or scientist if my IQ (measured online) is just average?
56465	How is a prostatic adenocarcinoma with Gleason's score 3+3=6/10 rated in terms of stages of cancer?
56466	Is HIFU approved for use in the U.S. for prostate cancer? How does it compare with other therapies?
386274	What is the formula for citric acid?
444156	What is the salary of a pediatric surgeon in Australia?
444157	What is the average salary of an Indian surgeon?
151837	FROM WHICH website CAN WE DOWNLOAD PORNOGRAPHY SAFELY AND free?
151838	مين عايز هامبورجر و مين عايز سوسيس؟?
140845	An atom that loses one or more electrons will have what kind of charge?
140846	What happens to an atom that loses an electron? Does it become stable? Does it just disappear? For example, if hydrogen lost its electron.
177309	What's the unbreakable encryption algorithm?
177310	Is there an Unbreakable encryption method?
12566	What is the Heisenberg uncertainty priciple?
122654	Do employees at Diamond Foods have a good work-life balance? Does this differ across positions and departments?
487951	Do employees at Flowers Foods have a good work-life balance? Does this differ across positions and departments?
414412	Is cousin Kenny Vaughn related to Marty Stuart?
273948	How is the life of a commercial pilot in India? 
393852	What rights do I have if Im stressed at work?
393853	What is special methods communication? What are some examples?
417519	What are the differences between lipophilic and hydrophilic?
405117	What does compact() do in Laravel?
405118	Can I use Laravel without Blade?
22772	What BI/Dashboard solutions would you recommend that allow white-labelling, e-commerce, rebilling, etc., for monetizing access to a proprietary database via a software as a service subscription model?
22773	What are some Open Source E-commerce solutions?
450575	Regarding a delivery start-up technology, should I go for an In-house team which will take longer to set-up or a competent local out-sourced team?
450576	When choosing a start-up to work for which would you pick? (imagine you have to pick) One with a strong, respected board and investment team or one with a product that you absolutely love and believe in? And why?
225807	What is the best thing to say to your wife right after she gave birth to your child?
225808	I always wanted to have a son, but my wife gave birth to a daughter. How can I cope up with this disappointment and love my daughter?
43890	Which are the best analytics institutes in Delhi for classroom analytics course?
43891	What is the meaning w/l 2 rlgn?
35788	Does height play a part in how big bicep muscle are able to get?
35789	Does height play a part in how big bicep muscles are able to get?
315710	How do I apply for Fastag in India which can be used in toll booths?
315711	Why is it some people hurt over what they are prevented from doing?
87615	How often can I take steam on face in summer season? I have acne prone skin.?
330507	Why is witch hazel so good for acne prone skin?
205365	On Instagram DMs, if I read the message and then hide it, can the sender keep sending me messages? Can he see that I hid it? Can I unhide it?
410890	How we can use waste plastics bags and bottles in construction?
410891	How we can use waste plastic bags and bottles in the construction?
402086	What are the factors that affect prices of gold and silver in the commodity market? What does it have to do with the depreciation or appreciation of the rupee?
402087	Commodities: What factors affect the price of copper?
471940	Why is North Korea's internet down?
471941	Why North Korea doesn't have Internet?
402968	What is unusual or different about the food and cuisine in Uruguay?
162402	If you were Modi for 1 day what decisions would you make?
162403	If I were Narendra Modi for one day, what would my day be like?
26990	Why do exactly planets revolve around the sun?
74485	What is the difference between the IES batch and the GATE batch at the ACE Academy, Hyderabad?
74486	What is the difference between the IES batch and the GATE batch at the ACE Academy Hyderabad?
145323	What is a good Minecraft server?
242650	How much does a freelance data entry operator earn on average in India if he gets a job via oDesk or Elance?
416253	What are the ways to protect my smartphone from viruses?
416254	Can a smartphone get viruses? If so, how do you prevent or remove them?
458504	My score is 447 in NEET and I am a girl student from general category. Can I get a government seat through 85% state quota of Uttar Pradesh?
178095	What's the difference in a woman's cum and a man's cum? Like texture, colour, smell, taste, quantity or anything?
315184	When does Apple plan to release an updated MacBook Pro?
412469	What will be the impact of brexit on European banks like RBS and Barclay's?
412470	Will Brexit make any impact on Ernst and Young?
443673	What are the best feeds to follow on Quora?
443674	Which feeds should I follow on Quora?
123396	Should I quit my PhD or what should I do?
123397	How can I quit my PhD?
534485	How can I be productive while stuck in traffic?
534486	What do you do when you are stuck in traffic?
409941	Can I use the rules and the design (not logo) of monopoly in my mobile game?
409942	I want to dress more adult/mature but I work at a startup. What are some appropriate outfit options?
413584	If n is inversely proportional to m and if n=3.5 when m=2, find the value of m when n =5?
413585	I was judicial expertized as schizophrenia in 2014.9, and I am involved in court suits now, what should I do?
245887	Is it true that Draupadi from the Mahabharata is a goddess in Tamil Nadu?
245888	Was Draupadi the incarnation of the goddess Durga?
192672	How do you determine the number of neutrons in an vanadium atom?
300822	How can the number of neutrons in a boron atom be calculated?
189968	What is the top speed of the quickest football players?
189969	Who are your top 5 best foreign football players to ever play in the English Premiership?
175253	Have you loved someone and hated at the same time?
175254	What are new emerging technologies a system engineer (5-10 yrs exp) should learn in order to keep him competitive, updated skills and in demand?
112281	What are Elizabeth II coins and how much are they worth?
112282	I have a Euro coin with a defective embossment. How much is it worth and what should I do with it?
487321	Is it illegal to send money with a letter via India Post?
487322	Can I send food via India Post to Hong Kong?
129504	How do you know if she is interested in you?
13615	How do I know if she is interested?
108853	What are the best assets to invest in as a beginner with only $3000?
108854	What vitamins or minerals will help to get strong nails? They're currently very brittle and peel off.
188537	How do I control the mind that is stressed?
188538	What is the best way to control mind?
497258	Do women get turned on by male strippers?
497259	What is your view on a hens nights to have a male stripper? Is that cheating with a guy who is stripping for you and lack of respect for your man?
281740	What are some names you should not name your child?
281741	What names are you not allowed to give your child?
356807	How do I sell my pre-IPO shares?
356808	How do I sell pre-IPO?
109894	Does the USA have better CS schools than Europe?
109895	CareerBuilder: Is studying in India better than studying in USA or Europe?
115589	Who inspired you the most as a leader and why?
115590	What leader has inspired you most and why?
227920	What would happen if the electoral college voted for Hillary on Dec. 19th instead of Trump?
239493	What do you think the odds are of an “Elector Revolt” on Dec. 19th, where electors refuse to vote for Trump?
401312	What is “Dank O.G Kush”?
401313	How would one use the One Ring against Sauron in a one on one confrontation?
363816	Were there fundamental weaknesses in the Arab armies that caused them to give such a poor showing against the Israelis (at least until 1974)?
363817	Why were Arab leaders so incompetent in the 1948 and 1967 wars with Israel?
350016	What herbivores live in the Sahara desert?
350017	What are some animals that live in the Sahara desert?
248701	How does a pressure gauge work?
248702	How does a pressure gauge works?
169889	Is there any machine learning algorithm that can learn how to add any two numbers?
169890	What machine learning algorithms does FiscalNote use?
110095	Why should Karnataka give Cauvery water to Tamil Nadu?
348393	Should Karnataka really release water from cauvery?
228624	How many questions have been asked on Quora till this date? How does Quora company manages them?Which databases they use?
387943	How do you breathe?
387944	How should we breathe?
242202	In terms of training and development of skills in swimming; what should country like India look/help for in their athletes to achieve Olympic medal?
207713	My legs fall asleep when I sit cross-legged for extended periods of time (sometimes 5 minutes, sometimes 15 or 20). Why is this, and what stretches can I do to help?
207714	Why is it necessary to sit cross-legged on a mat to meditate?
8142	How do we reunite India and Pakistan?
305500	Where and how to promote YouTube Channel?
114265	Can a human being have equal romantic feelings for two people?
114266	I was called once in command tasks in three SSB. What is lacking?
208307	What is the salary of Indian foreign service officer?
208308	What is the salary of an Indian foreign service officer?
311206	How is the academics in Hindu Rao Medical College?
311207	How is Hindu Rao Medical college, Delhi in academics?
317288	Will a ban on offshore banking solve money laundering problem and hence help to curb corruption? 
317289	How can crime and corruption be curbed in India?
