366000	Why are The Hunger Games books so popular ?
366001	`` What is a summary of chapter 6 of the book'' `` The Hunger Games'''' ?''
366002	What is the point of the United States Air Force when the US Navy can do the same job with its aircraft carriers ?
366003	Why do Air Force , Navy and Marine Corps aircrafts have the same roundel ?
366004	How do I get rid of too much hair that is present in my arms and legs ?
366005	How do I get over a friend with whom I haven't talked in 3 years but still miss him ?
366006	How do I get over someone I loved now that we broke up last year and I still miss her ?
366007	Which graphic is better quadro k5000 or GTX 1060 ,1070,1080 for high end 3D modelling ?
366008	`` Why is there no'' `` I'''' and'' `` O'''' row in the theaters ?''
366009	How can I start listening to most popular contemporary English songs ?
366010	How can I start listening to English songs ?
366011	Are there any movies on the Sikh riots in 1984 ?
366012	What is a summary of Plato's views on politics ? Would he accept modern democracy ?
366013	Political Philosophy : What are the arguments against democracy ?
366014	Is it safe to send mobile phones across the country using the Indian Speed Post ?
366015	Can we send mobile phones from USA to India ?
366016	Is there a possibility for a depressed man to fall in love with you after he put you on a friend zone ?
366017	Do you think it's possible for a normal man to go to Bangkok with his friends and come back without having sex there (as Bangkok is famous for sex tourism and it was an official trip) ?
366018	What is one of the hardest programming languages to learn for beginners ?
366019	Who is more comparable to the British SAS ? Is it the Navy Seals or Delta Force ?
366020	How does the British SAS compare to the US Navy SEALS ?
366021	What is the best way to get started with hybrid app development ?
366022	If I'm thinking about getting into designing game graphics , should I learn Maya or 3ds Max first ?
366023	Are Maya and 3DS Max useful for graphic design ?
366024	How many students drop out or fail in IIM-A every year ? Out of how many ?
366025	Up to how many years of BTech CGPA is calculated for IIMs ?
366026	Is National Green Tribunal a constitutional body or a statutory body ?
366027	Why do mostly Indians burn the body after death ?
366028	How electronics and instrumentation engineering is related to robotics ?
366029	How are electronics engineering and instrumentation engineering related ?
366030	Is there a way someone could order a custom life-size statue of themself ?
366031	How do you make statues ?
366032	What is scope of biomedical vs biotechnology ?
366033	Where can I watch Dragon Ball Z in Spanish with English subtitles ?
366034	I have learnt that stress is an internal resistance developed in the body due to the force applied . Does this mean that stress developed in the body during application of tensile forces , will be in the direction of compressive forces ?
366035	A force is being applied on a body but it causes no acceleration . What possibilities may be considered to explain the observation ?
366036	What is the best breakfast before a big test ?
366037	What is the most interesting picture you've ever seen ?
366038	What is the relationship between interest rate and money demand ? Negative or positive correlation ?
366039	Can anyone help me understand different types of interest rates set by central banks ? The basic working of zero , negative and positive rates ?
366040	What would happen if no one in the world bought bonds ? How would governments/companies fund roads/expansions respectively ? (less than 5 people have become billionaires buying bonds but thousands have through stock/real estate)
366041	Why do AAA rated RBA bonds yeild less than AAA big 4 bank bonds ?
366042	How do I study for more than 1 hour ?
366043	How do I study for more than 8 hours productively ?
366044	What are your favorite online fashion startups ?
366045	What are some of the best fashion startups existing today ?
366046	Does the Minimum Viable Product (MVP) mentality work for hardware startups ? If so , what is the best example of an MVP released for a hardware product ?
366047	I have my web startup prototype built (just a MVP) . I have $ 100k (my own) in funding . What will be the next step to take using this money to move forward with the product ?
366048	Will Candy Crush Saga ever end ? Does a player who finishes the highest level get anything ?
366049	What is the hardest level of Candy Crush Saga ?
366050	What if the Prophet Muhammad never existed ?
366051	Who was the first prophet , if Prophet Muhammad was the last one in Islam ?
366052	Who are some of the famous electronic engineers who became successful in a field other than electronics ?
366053	Which is the best field for an electronics engineer fresher ?
366054	Is there a direct download site for YIFY uploads ?
366055	What are the alternatives to Torrent ?
366056	How do I regain my bone strength after delivery ?
366057	Can I train myself to eat bones ?
366058	Caltrain : Will I be able to put my bike on the 329 baby bullet in Palo Alto (8:23 AM , northbound) , or are the bike cars full by the time train arrives here ?
366059	What are Caltrain's plans to put Wi-Fi on Caltrain ?
366060	Musical Instruments : Why do bands tune to a concert Bb , but we use 440hz (A) as the primary frequency ?
366061	How did people in the olden days tune their musical instruments to a set frequency (eg ` C' note) without the help of electronic equipments ?
366062	I screwed up CAT 2016 even after preparing well and scoring good in my mocks . What should I do ?
366063	I prepared well for JEE Mains 2016 , and even got 250 + scores in mock tests but still I messed it up and will get 170-180 . What should I do now ?
366064	How do fitness training programs get you on track with your goals ?
366065	How would you compare and contrast mass and matter ?
366066	Is there civil engineering at Amity School of Engineering & Technology in Bijwasan , Delhi ?
366067	If skeletal muscles were capable of hyperplasia , what would be the strength difference vs muscular hypertrophy relative to size ?
366068	Why does Lex Luthor hate Superman ?
366069	Where is Lex Luthor in Season 8 ? What happens to him ?
366070	What are the Universities to pursue masters in VLSI in Germany ?
366071	Which are good universities in Germany to do a Masters in VLSI and Computer Architecture ?
366072	Is it better to start a simple cab or attach it with OLA or UBER ?
366073	Among C , C++ and C# which one should I learn ? I know basic JAVA and C++ .
366074	Is Advil or Aleve better for a sore knee ?
366075	What's the best time of year to go to Paris ?
366076	Is it good to take early interviews for Google ?
366077	What are some problems in the society which you would want to be solved with the help of technology by a student ?
366078	What is your best experience of technology solved your problem ?
366079	How easy is it to learn Python ?
366080	What are some quotes people who don't do competitive programming have said about it ?
366081	Can I just practice competitive programming to become a good programmer if I don't have any interest to work on side projects ?
366082	How can I configure Vim to use the Google C++ coding style guide ?
366083	JVM uses C code to convert Java code into machine language ? Then why can't we use C to do an actual program rather than using Java ?
366084	How do you achieve your goal ?
366085	I am falling for my friend . And he's got a crush . I don't want to lose our friendship . What should I do ?
366086	My 13-year-old daughter decided to start buying bras without my permission . How do I punish her ?
366087	How can I get a traffic ticket reduce in Detroit , Mi ?
366088	Are yoga teachings proven in real life ?
366089	How do I solve Google Chrome not shutting down correctly ?
366090	My Google chrome is infected with virus . It redirects to another website and I can not save my default page as google . How can I solve this problem ?
366091	How can I get through the day with only 4 hours of sleep at night ?
366092	Who is the best player in nba in 2016 ?
366093	Where should I start programming ?
366094	How does Mick Jagger stay in such great shape ?
366095	Will Mick Jagger ever retire ?
366096	Capgemini US H1b Visa transfer delayed after offer letter , transfer not filed after one month of offer letter . Is this usual ?
366097	Why do some companies delay offer letters ?
366098	In how many ways 12 apples can be distributed among 4 children such that every child gets at least 2 apples ?
366099	What is the smart city ? And how will it work in INDIA ?
366100	What is a ` smart city' and how it will work ?
366101	What do people think of Dubai ?
366102	In Mortal Kombat X , how do you unlock the predator skull icon ? I know you have to complete some tower .
366103	Are controversial posts about Mark Zuckerberg and Facebook automatically demoted rapidly on Hacker News ?
366104	How do I post on hacker news ?
366105	If your doctor said you were to die in one hour , what would you do ?
366106	Who is the one person you would miss the most if they were to die suddenly ?
366107	How do I understand economics and finance from scratch ?
366108	Can you be a doctor if you have poor memory ?
366109	Is there any one who will help me in production field ?
366110	Which is the best degree in India to get the best job in Norway ?
366111	Which is best way to get an engineering job in India with 5 percent ?
366112	HTML widgets definition , behavioural aspect and their usage in practise for a web applications ?
366113	What is the difference between a application , widget and web widget ?
366114	What is eigen value ?
366115	What does jelqing do to your body ?
366116	Solve for k in a ^ 2 + b ^ 2 = (b + k) ^ 2 ?
366117	Are good looks important to be popular ?
366118	Does a master's degree (necessarily) improve the chance of getting into a good PhD program (compare to apply with a Bachelor degree) ?
366119	Is there any master's degree/program where I can get knowledge from all the fields (not necessarily all , but interdisciplinary) and after graduating be able to apply my skills to any industry in the future ?
366120	Who is the best skin doctor/specialist in Hyderabad ?
366121	Who is best skin doctor in Hyderabad for treating Tinea Versicolor ?
366122	What do the followers of Asharam Bapu feel about his arrest and the allegations ?
366123	Why Asaram Bapu was arrested though there is not a Single Proof against him ?
366124	What's the best way to raise children in San Francisco ?
366125	Isn't Rio Olympics a good opportunity to get to know North Korea from its own people ?
366126	What is the best lesson learned in military services ?
366127	What was Muhammad Ali's nickname as a boxer , and what were nicknames he gave to his opponents ?
366128	Why did he get the nickname Unabomber ?
366129	Is the career in sales a good option for engineers ?
366130	Which among the two have good career growth for electrical engineer , production or sales ?
366131	Can a petrol bunk owner apply for another bunk from same or other oil company ?
366132	Psychologically what percentage of humans have the propensity to kill ?
366133	What percentage of questions are answered on Quora , and how many questions are asked daily ?
366134	How would you describe your anxiety in a metaphor ? How would you personify your anxiety ?
366135	How can you describe cognitive anxiety ?
366136	Is there a way to know how many questions I have asked on Quora ?
366137	How do I know that a question that I have asked on Quora is answered or not ?
366138	I have selected in HCL TSS Leap Program , should I grab this opportunity ?
366139	What are the criteria to successfully complete HCL TSS program and get a job in HCL ?
366140	What are the pros and cons of benoa Bali reklamasi ?
366141	How famous is Bali in the USA ?
366142	Is Sathyabama a good university ?
366143	What is Victoria University good at ?
366144	Can you be in love with one person but have sex with another person ?
366145	Can someone with bipolar actually love another person ?
366146	How long will it take before Prozac takes effect if taking 20 mg daily ?
366147	How long does it take for taking 10mg of Prozac daily to be effective ?
366148	What is the biggest irony of religion ?
366149	What are some of the scariest things that have happened to you ?
366150	Would my message say delivered if I was blocked on badoo ?
366151	What does it look like when someone blocks you on badoo ?
366152	Is it possible to clear upsc in my first attempt ?
366153	If you know someone else's name , but they've never met you , is it better to address them by their name or pretend you don't know them ?
366154	What is the difference between toll and tax ?
366155	What is the difference between tax and revenue ?
366156	How do pen pals work ?
366157	How do I find a pen pal ?
366158	What are the best online saree shopping sites available in India for handloom ?
366159	What are some best online shopping sites to buy designer saree in india ?
366160	Why does removing U238 atoms from uranium increase the chances of a neutron fissioning a U235 atom ?
366161	`` Why can't atoms having odd number of'' `` neutron + proton + electron'''' form a Bose Einstein Condensate ?''
366162	How are Indian gays treated in the North American gay community ?
366163	Which IC engine SI or CI has more specific output and why ?
366164	Whose efficiency is more IC engine or EC engine ?
366165	`` Cognitive Psychology : Do video games improve selective attention ? (or the'' `` did you see the gorilla'''' task)''
366166	`` Psychology : Does aging affect performance on the'' `` did you see the gorilla'''' task (or selective attention) ? If so , at what age does ability on it decline ?''
366167	Till what age you can learn skating ?
366168	How long does it take to learn to ice skate ?
366169	Out of all possible MBTI types , which have the highest rates of depression ?
366170	What academic degree do you need to become a Flight Dispatcher ?
366171	I have an idea for a cosmetic that I want to sell to a company that makes cosmetics , how do I do this ?
366172	Which one should I learn first - Java or C++ ?
366173	How is South Korea as a job destination ?
366174	What is the best way to get a good deal from Comcast ?
366175	How do you self-install internet from Comcast ?
366176	Is the Fed Chair or ECB chair allowed to do FOREX trading based on announcements that they know they will make in the near future ?
366177	In forex trading , do heads of national central banks also place their positions in the market and do they also utilize their power during announcmnts ?
366178	What can I learn in 5 minutes that will be useful for the rest of my life ?
366179	Is it important to have a boyfriend ?
366180	What do military leaders think of the military industrial complex ?
366181	What is the military-industrial complex ?
366182	What is the best laptop brand for multimedia work ?
366183	How can I make my child get interested in studying ?
366184	What is the cut off for NMIMS hydrabd and Bangalore ?
366185	Do I need a bachelors degree to be a game designer or is a certificate from community college good too ?
366186	How brexit will affect Indian Stock markets ?
366187	What are the commonest pulmonary manifestation of hypertension ?
366188	Can somebody give me an honest assessment of these computer specs ?
366189	What is the best part of your life , and why is it so ?
366190	What is the role of board of director ?
366191	Will Kim Jong un be killed in 2017 ?
366192	Why does my car's temperature get high when I turn the AC on ?
366193	Is it o.k to turn on the car air conditioning with hot temperature ?
366194	How do guys feel after kissing a girl ?
366195	Can a guy feel attracted to any girl after marriage ?
366196	How can you describe an angry person ?
366197	How many GB does Intel HD Graphics 620 have ?
366198	Why did the California protesters burn the American flag ?
366199	How do I create an imaginary friend to chat with ?
366200	How can I transfer text messages (SMS) from iPhone to Gmail ?
366201	Can I block SMS Text messages on an IPhone ?
366202	What are some badly photoshopped pictures you have ever seen ?
366203	What are some best dance performance you have ever seen ?
366204	How do you write an Air Force LOR rebuttal letter ?
366205	Can I join the Air Force ?
366206	Who makes the best long range ptz cooled mwir thermal imaging FLIR camera ?
366207	What popular social apps started off by using fake profiles and bots to create an initial user base when they first launched ?
366208	What should I do if my Amazon order never arrived and it shows delivered ?
366209	`` Why is the final state of orders on Amazon'' `` shipped'''' , not'' `` delivered'''' ?''
366210	What are the advantages and disadvantages of SQL ?
366211	What are the advantages of learning os SQL ?
366212	Is it possible to masturbate in space ?
366213	I lost my phone and I want to recover my whatsapp messages to new phone of same number . Is it possible ?
366214	I have to change my phone and want to retain my WhatsApp number registration . Is this possible ?
366215	What are some gift ideas for my wife on Christmas ?
366216	Does God , Allah , or Buddha have any more backing (reason for belief) than Ganesh , Zeus , Quetzalcoatl , Cernunnos , or Thor ?
366217	Can a total faith in any belief destroy at 100 % the human capacity of a God or Allah , given free choice ?
366218	What came first , the Xbox or the Playstation ?
366219	Why must PlayStation 4 and Xbox One games be installed on the console ?
366220	A guy used to hit on my girlfriend before we were in a relationship , he still hits on her after we are committed , should I ask her to get rid of him ?
366221	What is the difference between the girl you date and the woman you marry ?
366222	Dating and Relationships : Shall I marry a girl who is 10 years younger than me ?
366223	How far in advance should I book my trip ?
366224	I am a B tech (EEE) final year student , is learning courses like AUTOCAD and MATLAB useful for me to get a job ?
366225	What are the major public events for next five years ?
366226	What is your wish for next year ?
366227	What is the additive inverse of 3 / -4 ?
366228	What is the additive inverse of a number ?
366229	How good is India Medtronic as an employer ?
366230	What is yours best performance till date ?
366231	How will Donald Trump rebuild NYC's infrastructure ?
366232	What are some humorous hindi vines ?
366233	How do you sign up for vine ?
366234	Possessive love is it real ?
366235	Is it dangerous to be possessive in love ?
366236	Which IB subjects should I choose ?
366237	Would doing a Congressional internship help me get a White House internship in the future ?
366238	What is the effect of demonetizing Rs 1000 and Rs 500 on Dawood Ibrahim ?
366239	How often do doctors date their patients ?
366240	How often do doctors recall a drug ?
366241	What is the most complicated program ever written ?
366242	What is the most complicated program you have ever written with no errors ?
366243	Why does fear exist ?
366244	`` What's the difference between'' `` shift'''' and'' `` alter'''' ?''
366245	What is an affix ?
366246	`` Can you have a past tense verb after'' `` was'''' ?''
366247	Do women objectify men ?
366248	Do straight women objectify men as much and in the same way as gay men do ?
366249	How can I be very popular in elementary school ?
366250	I want to pursue a master's in the US . Considering my poor financial conditions , should I opt for a university ranked 200th + (full scholarship) or not ?
366251	Datsun or kwid is advicable for cab business ?
366252	What are the safest websites to purchase Mildronate from and how can I know I am getting the real drug and not something else ?
366253	If I score 100 in CLAT , will I be able to get into NUJS ?
366254	I got 130 in my CLAT 2016 will I get NUJS ?
366255	How do most old people with disabilities go to supermarket in US ?
366256	How can I recruit volunteers for a week long camp for people with learning disabilities in July ?
366257	What is the function of a diode in a generator ? How does it work in the circuit ?
366258	Why is there no output when the diode in half-wave rectifier is reversed biased , but there's an output if the diode in clipper circuit is reversed ?
366259	What are the hottest startups to work at in Silicon Valley ?
366260	What are the hottest startups in Silicon Valley (2011) ?
366261	Being a Electronics and instrumentation engineering student what is the knowledge should i required to crack any core (instrumentation) company ?
366262	Why is my garbage disposal leaking from the bottom ?
366263	Why do most coders use MacBooks ?
366264	How much plastic can be made out of a typical barrel of crude oil ?
366265	What does it take to start a successful thrift store ?
366266	What kind of wasp is this ?
366267	What are the procedures for getting Bahrain Electrical Engineering license ?
366268	Was the Telugu poet Sri Sri an admirer of Joseph Stalin ?
366269	How do I stay in touch with an old friend ?
366270	How do you keep in touch with old friends ?
366271	From agnes with love the twilight zone ?
366272	Doing MBA in supply chain management from Victoria university Australia is good option ?
366273	In SD card , sum of memory occupied to apps etc. is 7 GB and its total storage space is 14.62 GB but it shows 0.94 GB is available . How it is possible ?
366274	In reciprocating pump there is work of pressure or not ?
366275	What are the mathematical mental heuristics Terry Tao uses to think about math quickly and accurately ?
366276	Should I stop going out because I have alopecia areata ?
366277	Is it gross or inappropriate for someone to clip their nails in a public locker room ?
366278	What is the difference between React.render , React.renderToStaticMarkup and React.renderToString ?
366279	What is the difference between Angular2 and react ?
366280	Does the Orpheum theater in SF sell discount tickets the day of a performance ?
366281	Why is there a blocking of tickets in theaters ?
366282	Can you think of a company that created an innovative product or service ? Did this company carve a market niche by offering this product .
366283	Calorie value of street food ?
366284	What was the Biggest Tank Battle in World War Two ?
366285	What is Alternating Regression and how is it used for Canonical Correlation Analysis ?
366286	How do I conduct a canonical correlation analysis on mixed continuous and categorical variables ?
366287	Is it true that Mohammad was fake ?
366288	Suppose that religions are fake , what could be the true intention of the messenger/perpetrator ?
366289	How do I hire freshers for Android development in India ?
366290	Which startups in India are hiring freshers as Android developers ?
366291	Why do stray dogs exhibit a lesser variety of colors than pet dogs ?
366292	What are stray dogs ?
366293	`` Why can't I buy bitcoin with a credit card in the US ? It always says ,'' `` Sorry , not available in your area , contact your local government to fix this .''
366294	I use debit cards for all my buying . Is there any benefit of switching to credit cards even though I don't need them ?
366295	What can convolutional neural network do ?
366296	Where can I find free Marvel Comics PDF files ?
366297	What is the reading order for the Marvel Comics' Civil War ?
366298	Is Dilip Oak academy in Pune overrated ?
366299	What is the best consultancy in Pune for an MS apart from Oaks' ?
366300	Is HDFC Life Smart Achievers program fake or real ?
366301	Are there jobs for mechanical engineers in US ?
366302	What universities does Sigma-Aldrich recruit new grads from ? What majors are they looking for ?
366303	Do Redmi 3s prime support VR headset ?
366304	Will Redmi 3s or 3s prime be part of big billion day sale ?
366305	Can castor oil be applied to hair daily ?
366306	I am too soft and ` over-respect' people , which means I may not be able to criticize them , and appear as someone with no opinion or stance and seen as a malleable person . What steps should I take to overcome this weakness ?
366307	If I apologize a lot , am I seen as weak ?
366308	What are some of your favourite movies of all time ?
366309	Where can I find the stock price of delisted companies ?
366310	According to Hindu mythology , how many times has Shiva opened his 3rd eye and why ?
366311	`` Now we are in ` KALYUG' (according to Hindu mythology) . What would have been the scenario if there was democracy in'' `` SATYUG'''' ?''
366312	How do you make an example to help picture thermal energy ?
366313	`` Where , when , and how did the phrase'' `` earn your chops'''' originate ?''
366314	`` What is the origin of the phrase'' `` of course'''' ?''
366315	What months are the Cotton Season in Mississippi ?
366316	I am going to join in TCS this month . Can I wear cotton blend trousers ?
366317	If a fight broke out between a lion and a shark , who would win ?
366318	Who would win in a fight between hippos and lions ?
366319	How do I To Join swtor2credits Summer Promo Up to 10 % Swtor Credits Bonus Activity ?
366320	Where can I find a library that allows me to draw shapes like moqups.com in jquery ?
366321	How does one post pictures on Instagram using Instapic ?
366322	How long do energy drinks last after opening ?
366323	What legal problems can I face if I answer a question on Quora with some content that is present on another site and is copyrighted by the owner of that site ? What should I do to avoid such problems ?
366324	How do I prepare for sociology net exam ?
366325	What does Bjarne Stroustrup think of C++ ?
366326	How did Bjarne Stroustrup turn C into C++ ?
366327	`` What are'' `` collective rights'''' ?''
366328	What can be done against feeling slut shamed ?
366329	What is slut-shaming ?
366330	What happens if I cook a car battery in the microwave or oven ?
