100984	Who has the most money in the world really?
100093	I have just 2 months my board exams are here how can I concentrate o my studies?
100094	Can I enroll one more ug degree course like BA. if I'm already enrolled in 2015 for b.com is it possible?
197824	Why does General Dalbir Singh Suhag of Indian Army wear his cap on his chin just below his lip?
197825	Why is the placement of the chinstrap of General Dalbir Singh at his lower lip? What is the idea behind this design? Or is it self-fashioned?
285791	Are chickpeas the same as garbanzo beans?
223189	Can we flash MIUI 8 stable to developer rom?
205019	I have medical entrance exam in less than 2 months, but I am having focus problems now due to some personal problems. What should I do to keep track of my focus and give the best in this short time?
213736	Can non-white people be racist towards white people?
337623	To those who told a big lie to their parents and told them the truth years later - how many years did it take for you to tell your parents the truth and why did it take you so long?
337624	I am 22/male. Yesterday my doctor told me I have only 2 years to live. How can I tell my parents the news? What can I do with my remaining two years?
474522	How can I post post a YouTube video link on Facebook?
479308	What is another way of saying 'if that's the case'?
479309	"Is there another way of saying ""take over for me""?"
345686	What is the difference between C programming and C language?
345687	What is the difference between (*m) [5] and *m [5] in C programming language?
411384	Is there such a thing as a fear of looking at certain landscapes?
411385	Is there a name for a fear of looking at certain landscapes?
386625	Why are people loud?
386626	Why are some people so loud on the phone?
379035	How can I do better in school?
379036	What can I do to do better in school?
318022	How do I learn to do business?
141374	How can I improve my English vocabulary, grammar, reading, speaking and writing skills without paying any fee?
342844	What is your favorite snack food that you ate as a child and still eat?
110184	Are there any people in their 20's who feel like they're stuck and need some guidance in their life?
506019	How do I swap the functions of two keys on my keyboard? I want my shift key to be my up arrow key and my up arrow key to be my shift key.
506020	How do I buy a plane?
249702	What are the best places to visit in Lower Saxony, Germany?
249703	What should I know before visiting Lower Saxony?
153957	What is a summary of ancient Egypt's history?
447430	Is there any reasonable and logical relation between science and spirituality?
394947	How can I be patient?
443981	Can someone translate into latin “QVIS ERVDIET WOTHOVT DOCVMENTA”?
443982	Can someone translate this to English from latin I guess?
257475	Is ponds bb cream better for oily skin?
257476	What bb cream is good for sensitive skin?
527155	Politics of India: Who is Narendra Modi?
89959	Which is the best online test series for gate biotechnology?
89960	Which is best online test series for gate-metallurgy?
127819	Do I have a crush on my best friend?
127820	What should I do if I have a crush on my best friend?
317548	What are some good restaurants in Manhattan?
317549	What is the best restaurant in Manhattan?
507637	Which comic book artists, aside from Jack Kirby, started drawing comics later in life and is considered a late bloomer?
507638	What do comic book artists think about The Amazing Adventures of Kavalier and Clay?
389200	Am I defective for not having any interest in getting married?
97256	Can art change the world?
97257	Could art change the world?
218304	How can I be a magnetic and memorable communicator?
218305	How do I magnetize rare earth magnets?
136304	Is it normal that I can't shake my anxiety off?
136305	"Is ""Anxiety "" considered a normal feeling?"
331426	Schizophrenia: What is it like growing up with a schizophrenic parent?
331427	Schizophrenia: How should you deal with a schizophrenic stranger?
97095	What are the documents required to be provided to BOE?
97096	What Documents required for driving license in Boston?
302814	How are psychiatric evaluation questions generated?
302815	What are common psychiatric evaluation questions?
273626	What kind of business will flourish in the coming times?
113076	What would you do if you could stop time whenever you want?
168046	How should I know a video is 360 degree?
168047	Can 360 degree videos be viewed on a Wordpress site through a phone's browser?
107613	What if someone watches a video on Facebook/Instagram repeatedly? How many views will it count?
290827	What is open-source ensemble/committee of convolutional neural networks implementation?
290828	While finetuning a model trained on Imagenet on a different: for mean normalization, should I subtract the Imagenet mean from the new images?
126677	How do I get motivated towards my studies?
363375	How do I stop all notifications from Quora?
150417	Which Indian films won awards at Cannes Film Festival in the second half of 20th century?
150418	How can I enter my film into a film festival?
516135	Does Milliken make quality Fiberglass Entry Doors?
491653	What is charge pump capacitor?
137582	My family is moving to Nashville from the SF Bay Area this summer. What suburbs should we consider?
137583	Nashville SEO - Who is the Top SEO In Nashville?
479996	A student simplified the expression /frac {(6^ {2}} over {36^ {2}} as 1/3. Do you agree?
479997	How will users answers on Quora with pictures and images? Do they read question and start collecting it?
521589	How is this black money being stored in the Swiss Bank?
491608	I have mole on my penis, does it mean anything?
523480	Every morning my height increases about a centimeter but reduces during daytime. Is there any way to make that gain permanent?
315136	What heavy metal songs use violin music?
357960	What 10-50 songs would you use to introduce music to someone who has never heard music before?
259825	I smell smoke when I see someone smoking a cigarette in movies or sitcoms. Why is that?
264773	Will Siri support Spanish?
148654	How do I install D-Link wireless N150 Home Router?
148655	How do I connect a D-link 150 wireless router to my laptop/computer?
389636	How does Google deal with conflict when it arises?
389637	How does Google deal with conflict, amongst employees, when it happens?
535695	What are some interesting things to do on a Sunday?
535696	What are some of the best things a person can do on a Sunday?
58804	What is the link between marriage & Navaratri?
250593	What is the importance of economics to engineers?
337578	I smoked a week and a half ago. also a regular smoker. I will have not been smoking for 18 days by the time of the test. I weigh 215 5'8. Will I pass?
337579	Smoked a pack of cigarettes in 5 days, not a regular smoker. Today didn't smoke any and I feel tired and chest pain. Is it normal?
487878	"How true is it that ones height stops growing when you start off with weight lifting? I'm around 5'8"" right now. I'm thinking of going to the gym. Is it advisable?"
487879	I'm 15 and weigh around 130 pounds. When should I start to worry about my weight? And when should I start to hit the gym and eat healthy?
456684	What is the proper age to get married?
456685	What age do you think is proper to get married?
337105	How would India be if Arvind Kejriwal were to become the next PM?
361354	Which is the best institute for PMP Exam training in Bangalore?
75174	What are the advantages of external recruitment?
351634	Can a permanent resident of United States of America make donations to U.S. Army or U.S. Army veterans?
484705	Were there CEOs before the industrial age? If so, how far back does the CEO go?
462046	I am 5th sem student of civil engineering, I want to crack UPSC in my first attempt, how should I start my preparation?
462047	I am 5th sem student of civil engineering, I want to crack IES in my first attempt, how should I start my preparations?
460391	What is the red star in the sky?
460392	What are the first few stars that come out in the night sky?
240134	When considering co-founders, I picked the designer and the genius (I'm the voice).  Lately I've begun studying what investors look for in a startup, and see that we may raise red flags by not having a programmer as a founder.  Is a technical founder something we have to have?
240135	If a startup has three technical co-founders; one of them is CEO, and the other one is CTO, what role should the third programmer occupy?
304028	How can I download all my Facebook status updates for last two years on my desktop?
442046	What do Indian guys think of beautiful bald girls?
246130	What are some low-maintenance dog breeds?
498063	Is there a free tool to track Instagram followers over time?
218264	Health above 50?
218265	How many country clubs are there in kolkata?
100895	What are some good reasons not to move to Denver?
100896	Denver, CO: Is it good to study at this university? I wanna do a English Course.
207324	How is Amazon able to offer products for much cheaper than a lot of other online retailers?
207325	Is it cheaper to buy Lubriderm products on Amazon?
193754	Why is a REO property not available anymore?
193755	Why is an REO property no longer available?
191602	What are the different types of microscopes and what are their uses?
191603	In what circumstances are different types of microscopes useful?
91800	What does the Loch Ness monster look like?
91801	What is the story of the Loch Ness Monster?
274727	What is the corporate culture like at Scholastic? How is the culture different than other companies?
265164	How good is the 17 HMR rifle for coyote hunting?
265165	How suitable is .17 HMR for coyote hunting?
360461	My ex came back after a year, saying that he still love me. Could it be true?
360462	Why do I love my ex so much and can't let him go but still not happy, even though he left me and came back after 2 weeks?
419248	How do I get to meet famous people on Quora?
183234	What is it that boys think attractive?
183235	What do young teenage boys find attractive?
164044	"Is ""Sheila"" an Australian slang word? What is meant by it?"
164045	"What does the word ""sheila"" mean in Australian slang? Which came first, the word or the name Sheila?"
264398	"When Christine sings ""All I Ask of You"" for the last time, is she singing directly to the Phantom at first?"
99612	Why is a user still on my followers list even after I've blocked them on Instagram?
99613	Can you block a person on Instagram and still follow them?
428327	Where can I learn British English accent?
228716	Where can I find practical assignments with solutions of T.E. computer engineering for Pune University?
455615	I had a year down & 15 backlogs in my four years of computer science & engineering at University of Pune. I have a GRE score of 325 (168Q, 157 V) and a TOEFL score of 110 and 52% in engineering. Which US university should I actually go to?
239334	I'm 13 and want to lose weight, what should I do?
239335	I'm 13: What is the best way to lose weight?
523408	How much money per hour do Uber drivers make in Scottsdale? What's the most a person can reasonably make per month?
522137	What is the typical percentage of time spent on Social Media, FB , WA , Twitter, Instagram by an Indian male / female?
479871	Who rules hell?
479872	Who guards the gates of hell?
376311	Where can I download valid 400-351 dumps/400-351 braindump? CCIE Wireless 400-351 VCE dumps and 400-351 PDF dumps?
284408	What is the best way to get rid of an annoying company?
67164	Is it possible to integrate found objects such as glass, metal, or previously fired ceramics into clay and fire it together?
67165	What is the best design for a fire-safe ceramic dutch oven?
150535	Can I deposit money at a SBI branch which is not my home branch?
155218	Which would you prefer, Wayfarers or Aviators? Why?
155219	Which is better: the original or new Ray-Ban Wayfarers?
405863	How can Africa become a developed continent?
405864	How long will it take for Africa to become as advanced (or nearly as advanced) as the other continents?
334944	Will you make america great again?
60052	What would happen if all probable email addresses are taken due to increase in users?
60053	I want to transfer my bike the old owner is not availble the rto chittor asked me adhaar card of the owner wat should I do?
134994	Can dogs eat salmon skin?
93775	Why did Jeanne Calment live for so long despite her smoking habit?
115744	"What is the iPhone 6 plus ""touch disease""?"
115745	Is the iPhone 6 Plus worth the cash?
242646	What happens to an x ray spectrum when voltage, current, filters and target material are changed?
242647	I've read that if you want to use resistors to reduce the voltage to a device, the current through device should not be changing. Why?
123826	My R15 is not starting. Why?
123827	My R15 bike is not starting. Why?
471566	How great is America?
471567	What is a Great America?
366501	What is the difference between jogging and running?
417034	Why is jury service mandatory but voting optional in the United States?
413951	I took a drop after my 12th and just gave all my entrance exams. I have a ton of free time to kill. How do I use it in a productive way?
413952	I have just finished my PGDM and my joining is after 3 months. What options do I have in Bangalore to use my time in a productive way?
336381	What referral bonus amounts do tech companies pay in LA?
336382	What are usual tech company employee referral bonuses?
116275	Is Robert Frost married?
116276	Is Robert Frost married? If yes, who is that lucky lady?
294423	Why do we have a favorite color?
294424	How can I find out my favorite color?
386741	What are some simple SaaS products that generated huge revenue?
323277	What does a classic house in USA look like?
323278	What does a classic house in the USA look like?
155135	How could we improve our brain power using optogenetics?
517054	Where can I get high quality and professional interior and exterior painting at Brisbane?
505034	Are memory and intelligence correlated?
505035	Why is memory associated with intelligence?
289287	Is there any secret football betting tips Apps?
289288	Do we actually see real ghosts?
28949	How long would it take to walk across Tokyo?
28950	How long would it take to walk from one end of Tokyo to the other?
347404	How do I ask a question in Quora?
480933	Why do I still cringe when I think of embarrassing things I did a long time ago?
480934	How do you say someone who you lost a long time ago?
85326	What are some political nicknames for Donald Trump?
490721	How competitive is the hiring process at Home Properties?
490722	How competitive is the hiring process at Post Properties?
177388	How is Harvard’s CS50?
177389	What can you do after completing CS50 at Harvard University?
318836	I scored 65 percentile in cat 2016 with just one day preparation being a non engineering is it good or bad?
318837	I scored 65 percentile in cat 2016 with just one day preparation being a non engineer is it good or bad?
165026	Should I be a data scientist or an actuary?
165027	Should I become a data scientist or an actuary?
316834	What is the impact of the 1947 partition of India?
459569	What is a crisis intervention model?
278974	How did Rock Hudson die?
278975	When did Rock Hudson die?
208531	What is a messiah complex?
208532	What is the messiah complex?
193953	What is the difference between: manual tester in PhP and Java & .Net application?
412286	What is it like to suck in everything you do ?
412287	What do you suck at?
130336	What is different between tutor and student teacher?
373339	Did Jason Bourne and Nicky Parsons have a relationship in The Bourne Directory? If so, what was the result of their relationship?
417309	Would a woman be scared if the guy she is about to have sex with has a very large penis?
496871	What are the Biotech or pharma companies that do H1B sponsor for F1 students?
158657	How can Quora be improved?
144195	How do I forget my ex completely?
450938	Can someone provide an explanation of the answer for this multiple choice question in physics (see image for details)?
450939	"Following are multiple choice questions of Chemistry chapter ""Atomic structure"" What is the explanation of these answers?"
222522	How do I get an internship at Google Mumbai?
222523	What is a line graph? What is the importance?
488152	Why are the hospitals still important today?
488153	Why is the hospital still significant today?
535066	How does the government make sure that professionals like Docs, CA-s etc dont evade Income Tax in India?
535067	Are there mermaids in Middle-earth?
48432	Should I let my girlfriend move in with me?
48433	When should I move in with my girlfriend?
129191	Who will win the olympics?
129192	ENT DOCTORS APPOINTMENT in Kolkata?
112454	How does My.com make money on its free apps?
228560	How is Eobard Thawn still alive in the Flash Season 3 if most everything from the time line has been restored including Edies death?
31796	How do I get emails from Quora?
469079	How do you toggle Quora email notifications?
76529	Do Romanians look more like Slavics or Mediterraneans?
76530	Do Romanians look more like Slavs or Mediterraneans?
503453	How was SavReader viewer developed and what are its main characteristics?
503454	What is the best pest Control is Sharjah?
225100	Can a btech student do major in photography?
225101	How would dogs describe humans to one another?
8406	Can a tornado and hurricane happen at the same time , same place and create more than one in one day?
8407	Can a particle vibrate so fast that it can be said to be in more than one place at the same time?
321723	What is a good vampire romance anime?
438734	What are some of the best online sites for learning programming languages?
148896	What is the best online course for learning programming?
507560	If you own a piece of land and there is an volcano on it and it ruins a nearby town, do you have to pay for the property damage?
507561	Should I really be making career decisions now?
337219	I have a stochastic game with 2 states in which the first state has 4 strategies that can lead to the second state with some probability, is that ok?
337220	How do I get into the Games industry?
294889	Which are the best institutes in Bangalore for VLSI course?
454518	Which musical instrument is the closest to the human voice?
20116	Consider a line to line voltage measured from an unbalanced Y connected voltage source. Are there any zero sequence component in line to line voltage?
171572	Why does my girlfriend of 7 years dont reply to my text or calls when she says that it wont be long. what should I do?
171573	Why is Google providing unlimited storage for the videos and photos taken on Pixel?
149920	Who won the War of 1812: Canada or the United States?
273416	What algorithms can be used to determine if two questions (like the ones at Quora) are somehow similar?
273417	Does Quora use any machine learning algorithms to identify questions that could potentially be redirected to existing question?
517567	What is the corporate culture like at Kimball Electronics? How is the culture different than other companies?
319758	How should I prepare for CA-CPT December 2016?
278674	If someone is trying to rob you and they imply they have a gun but do not show you the gun, is it likely they have a gun?
530456	Which programming language should I learn Java or python?
282415	Which programming language should I learn: Java or JavaScript?
367702	Why do I hate working with people? Teamwork in general annoys me. Is there a reason for this?
462000	What are the top 5 books that lower your IQ?
59375	Is there a tool for a frontend wizard or helper?
59376	We have developed a platform and we are looking for a wizard tool that will allow users during the first login to be guided through our web platform?
467710	Why is my ex still ignoring me?
467711	Why does my ex still call and text me everyday?
139729	What are different types of seismic waves? How do they differ?
428917	If an astronaut in space took his helmet off for a second, what would happen?
245484	If I push a rod of length 0.3 million km, the other end of rod moves immediately. Would that not mean information has traveled faster than light?
516009	How can I recover a deleted browsing history on an Android phone?
516010	Can I recover all the images and videos which are deleted one year before in my Android phone?
144721	Is there going to be a season 3 of NARCOS?
144722	Will there be a Season 3 for Narcos?
52134	How do you measure density?
408609	What is Moore's law in layman's terms?
103325	What is domain in computer network?
413400	What do you think about the single take shot (around 6 min) of True Detective episode 4? Is it the best single take shot in TV history?
514162	It's said that Harry Potter is the only one who survived Avada Kedavra but isn't this a lie?
514163	Why did only Harry Potter who survived from Avada Kedavra curse?
205748	How much Cristiano Ronaldo earns per year?
205749	How much Cristiano Ronaldo earns each year?
350268	How do I study in Canada?
350269	How can I work and study in Canada?
28161	What is good for bulking? Milk or cheese?
28162	Which one profile is highest Salary? 1. Digital Marketing 2. Coding (Java/html.javascript/C++) or Designing?
443517	How many valence electrons are in aluminum?
272713	What wars were caused by women?
272714	"What were some of the motivating causes leading to the ""100 years"" war?"
151446	How do you forgive someone who cheated on you for your whole relationship?
136972	What's the difference between a pre-IPO and post-IPO investment?
136973	What is a pre-IPO tech start up?
523014	When a guy introduces you to his closest friends does that mean he really loves you?
523015	A guy rejected me and he wants me as his friend. What should I do?
277010	What is AdMob's market share?
277011	Is AdMob still active?
310107	Is there a spa in Bangalore where females massage males?
310108	Is there a B2B massage centre in Yehawanthpur, Bangalore?
326457	Can Starbucks baristas give out their personal phone number?
326458	Marriage: My separated wife refuses to give me her phone number... is this wrong? We are working things out, but only she can call me.
150512	How much can a fresh electrical engineering graduate from a local university in Singapore get as starting salary?
150513	Why do we not see a persistent higher-than-average rise in the salaries of fresh engineering graduates if there is a shortage of engineers as claimed by some employers in Singapore?
431217	How was your New Year 2017?
431218	Which is the best Hindi to English translator available?
67079	I recently met a girl and we've been on only two dates. It's only been about three weeks since we've met. Now, she's asking me to meet all of her siblings and her cousins (no parents) at a dinner in two weeks from now. Why would she want me to meet her family so soon?
380061	What is the italian way of life?
380062	"How do you say ""life"" in Italian?"
132451	How do Airbnb differentiate itself from craigslist?
132452	How did Airbnb differentiate itself from Craigslist in the early days?
395150	If a government job states pay scale of INR 16,400-40,500, how do I calculate the salary package I am looking at?
395151	After the 7th pay Commission, what will be the net salary of a Central Government job (India) with Grade pay of Rs. 2400?
76926	Why can't we see our own image in a swimming pool?
76927	How can I become pool player?
397757	"In Hindi, how do you say ""tofu""?"
397758	"How do you say ""livid"" in Hindi?"
470210	Does aging increase molecular crowding in neurons more than other cells?
470211	Is there more molecular crowding in neurons than other cells?
24314	What exactly is the 4th dimension?
244777	How to activate video calling feature in WhatsApp?
145663	How could I write a fantasy book?
145664	How do you write a good fantasy book?
55133	What are some good side dishes for chicken kiev? How are they prepared?
760	Why are my bestfriend still ignoring me?
761	What should I do when my bestfriend is ignoring me?
350276	What happened to the Vikings? Did they disappear?
350277	Why did the Vikings disappear?
352978	Why shouldn't NATO send in ground troops to defeat ISIS?
352979	Why won't NATO send ground troops to defeat ISIS?
277184	Which social media do you use the most often?
459834	Can you really have a dream within a dream?
522034	Is 100,000 Euros a good enough salary for a family of three in Heidelberg, Germany?
522035	I am earning 42K Euros a year in Germany. Is that enough to run a family of 3 and how much savings can I have?
462234	Consider the veracity of the following advice which has been frequently shared in social media?
83409	What are some of the best quotes on technology?
196398	What is the molecular equation for calcium chloride and silver nitrate?
50311	How did people like Margaret Hamilton handwrite their code?
50312	How will I start B2B with Magento 2?
345407	If an earthen pot is porous, why doesn't the water placed in it leak away?
345408	Where can I get Jon after completing MSc?
242410	Do ear piercings hurt?
242411	Is ear piercing painful?
81884	What are the chances of being rejected after giving hr round in Capgemini?
472445	Can fizzy water give you more energy than usual bottled, still water?
472446	Can 'oxygenated' water give you more energy?
101439	What do abiotic components of an ecosystem include?
182557	How do I talk with girls?
476933	How difficult/rare is it for a Tamil guy who grew up in America to marry a Chinese girl?
476934	How I distribute 3 cor cable 8Amp?
414070	What is the best way to change mind set of students parents in sports?
414071	What is DTP course? What its value nowdays? What one should do if their beginners?
442512	What are the steps of cellular respiration and how are they carried out?
469006	How would America look like today if Laissez-Faire (complete free market economy) continued to this day?
