481374	Which programming language is in demand at canada ?
481375	What does baking powder smell like ?
481376	Food Science : Is single-acting baking powder or double-acting baking powder better for baking ?
481377	What is the impact of globalization on social life and/or cultures around the world ?
481378	How do I stop feeling sick ?
481379	How can I stop feeling sick at 3 am ?
481380	What is the best way to change your Yahoo security question ?
481381	How can you change your Yahoo security questions ?
481382	What are your personal goals ?
481383	How can I track my mobile phone for free ?
481384	How many international students are enrolled for Bachelor of Dentistry (BDS) course at University of Otago ?
481385	How many international students in USA ?
481386	How would I go about working in Europe after I graduate ?
481387	Is there any branch of mathematics that a computer can't perform ?
481388	How much real money would it cost to upgrade Archer Queen from Level 1 to Level 40 ?
481389	How should I upgrade my town hall to level 7 ?
481390	What colour ties can I wear with blue shirt and black suit ?
481391	Why isn't the U.S. doing more to combat Ebola ?
481392	What's a more dangerous infectious disease threat than Ebola ?
481393	What is your review of Huntington KB61-100 61-Key Portable Electronic Keyboard ?
481394	Was Voltaire an anti-semite ?
481395	Is supporting Hamas anti-semitic ?
481396	How do I connect my SQL server database with my new website ?
481397	What is the current GDP in 2016 ?
481398	In USA there are electrical plug points with 240 V fit air conditioner , do those plug points carry 50 Hz or 60 Hz frequency ?
481399	How in god's name over my dead body would I decorate my bedroom ?
481400	What are the most common problems in manufacturing industries these days ?
481401	What is the most common problem in a pharmaceutical manufacturing process ? What is the best practice in solving it ?
481402	`` What are some examples of sentences using the word'' `` acceptance'''' ?''
481403	What do you think about Snapdeal's biased survey by AIRLOYAL and paying people to trend a pro-Snapdeal tweet ?
481404	Is there a profit for Snapdeal by paying through cards ?
481405	How do I increase sales on Pinterest ?
481406	How can I increase my sales ?
481407	Can the packed aloe vera gel by Patanjali Ayurveda be used as a herbal hair styling gel ?
481408	Can we apply Patanjali aloe vera gel as serum on hair after washing hair with Patanjali milk protein shampoo and tresemme keratin conditioner ?
481409	What is the role of IAS officers in CBI , IB & RAW ?
481410	What is a vector in linear algebra ?
481411	What is linear in linear algebra ?
481412	What is the best coaching institute for the GRE and TOEFL/IELTS with counselling in Pune ?
481413	What is the best coaching for the GRE in Pune ? And why is it the best ?
481414	Were you a natural when it comes to screenwriting or did you choose it for yourself ?
481415	How can you get yourself motivated about studying when your life depends on it , but you're a procrastinator by nature ?
481416	What is the difference between GRE , TOEFL , IELTS , and GMAT ?
481417	What is difference between IELTS and TOEFL ?
481418	When I insert my micro memory SD card it displays the error as volume is not accessible . I have the images in it . How do I recover them ?
481419	What is the future of Petroleum engineer ?
481420	What do you think about rainbow kiss ?
481421	What are the best heart touching quotes ?
481422	How is nitrogen in the atmosphere important ?
481423	Does the Mafia have any redeeming qualities ?
481424	What are some interesting one liners on IIT's ?
481425	What is GST Bill ? Why it is so important for Government ?
481426	What are some of the beautiful gay (real) stories ?
481427	I'm 21 & a closet gay , why did some men touch me in a strange uncomfy way ? I have nobody to ask . How should I deal with this ?
481428	Is something wrong with my mother ? She's obsessed with work.she's restless . And I need her .
481429	How do I do projects in BTS course IGNOU in 2/3rd Year ?
481430	What's the coolest thing you've ever done for your birthday ?
481431	What is the coolest thing you have ever done in school ?
481432	Amity llb p ?
481433	Why does only Valyrian steel among all kind of steel can kill White Walkers ?
481434	I am an athletic 13 year old girl and weight 82.2 pounds . Is that normal ? Am I healthy ?
481435	I'm 29 years old , my height is 5' 5 and my weight is 44 kgs . I am extremely underweight . What healthy diet can I use or follow to gain weight quickly ?
481436	How can I treat an itchy stye ?
481437	How can I treat itchy welts on my arms and legs ?
481438	I sent a message in whatsapp . It says sent , not delivered . Was it seen ?
481439	Did the detailed Trump plans to make Mexico pay for the wall change your mind ?
481440	What distro of Linux is closest to Mac ?
481441	Is hiding the truth equal to lying ?
481442	How do I change a kid or a spouse if they lie and hide things from you , to be truthful and open up ?
481443	Should Liberals support decriminalization of drugs ?
481444	How good is a GRE score of 320 ?
481445	If you take out a loan for $ 10,000 from the bank @ 10 % how much would you owe every month if this loan was for 1 year ?
481446	What is the easiest way to do illustration like this ? Some automatic filters , maybe ? Where do I find it ?
481447	How do actors get paid when they are not working in any film ?
481448	Apt computer hacking ?
481449	What are some online courses I can take which will be helpful for MSIS program ?
481450	Is it safe to take your dog outside before its third round of vaccines ?
481451	What happens if a person not bitten by dog takes 5 doses of vaccination ?
481452	Do the gospels try to explain why Jesus was uninterested in marriage or reproduction ?
481453	`` If Jesus said'' `` those who belong to the kingdom of heaven shall neither marry nor be given in marriage ,'''' then why do Christians hold wedding ceremonies and marry ?''
481454	What does it feels to spend a week at Burj-Al-Arab , Dubai ?
481455	What is it like to spend holidays at Burj Al Arab , Dubai ?
481456	How do I sign up for a PayPal account living in a country where there is no postal code ? What should I do ?
481457	Help needed with PayPal . Can I create 1 more personal PayPal account if I have moved to different country ? New PayPal would be of New country .
481458	What is your opinion on indigenous Australians ?
481459	How do I convince my parents for a Sikh boy ?
481460	`` How competitive is the'' `` coding bootcamp'''' market ?''
481461	How competitive are coding bootcamp admissions ?
481462	What is the difference between a weightlifter , powerlifter and bodybuilder ?
481463	Is bodybuilding healthy ?
481464	Is 48000 pounds a good salary in london ?
481465	Which libraries do real-time OCR for iPhone or Android ?
481466	What are the best bar code recognition libraries for iPhone and for Android ?
481467	Is the cost of a prestigious university's name worth it over a place that's affordable with a reputable program ? UCBerk is $ 60,100 , UMTC is $ 23,262 .
481468	Are prestigious brand name schools worth it ?
481469	How can I get good marks in RTU exam even if I dont know any answer of question paper ?
481470	Why are people making Quora like Facebook ?
481471	What are the top 50 anime opening songs of 2014 ?
481472	When will coolpad note 3 lite get marshmallow (OTA) ?
481473	How do I get a seat in IISC Bangalore ?
481474	Can you defer a speeding ticket in Nevada ?
481475	What is a deferred adjudication for a speeding ticket ?
481476	I am 20 years old and experienced intense hair loss in the past year . How can I prevent myself from going bald ? Is there a remedy to slow the rate of hair loss ?
481477	I'm a 20 year old girl and my hair loss is getting bad . How do I stop it ?
481478	What are the job prospects after doing MS in Industrial engineering in US ?
481479	Is there really a dengue/chikangunya crisis in Delhi right now ? Are the LG and PM truly answerable instead of the State Govt ?
481480	Explain this in terms of business context ?
481481	What's the best argument to use against scientific racism ?
481482	Can a Sikh Enjoy worldly pleasures ?
481483	Is Islam against seeking material wealth and enjoying worldly pleasures if legally obtained ?
481484	How do I reset gmail password if forgotten ?
481485	Which is the best book by Colleen Hoover ?
481486	What is the 5th roots of unity and how are they used ?
481487	What is the practical usefulness of learning the Nth root of a number ?
481488	What does a script look like ?
481489	Will there be a movie on Harry Potter and the Cursed Child ?
481490	`` Will the stage play'' `` Harry Potter and the Cursed Child'''' be filmed and made available on TV for those who can't afford to travel to London ?''
481491	How is the aeronautical branch at PEC Chandigarh ?
481492	If the crash had never happened , to what degree would the role of dirigibles now be different in civilian and military aviation ?
481493	Hockey : Quite often in the past , the puck would get entangled in the mesh of the goal , triggering a stoppage in play , but this never seems to happen any more . What's different , then and now ?
481494	Can a black hole accelerate an object beyond the speed of light by its attraction ?
481495	What do you call a person who is unintentionally funny ?
481496	Which is the co-valent compound that becomes electrovalent when dissolved in water ?
481497	How many pigs are killed per year to produce Percy Pigs ?
481498	How do I get a job in Pune as a fresh graduate in mechanical engineering without experience ?
481499	What are some examples of chemical adaptations in animals from the tropical forest ?
481500	What are some examples of behavioral adaptations in animals from the tropical forest ?
481501	What language/s are the lyrics for Cirque du Soleil's shows ?
481502	Why did Ted end up with Robin in HIMYM ?
481503	How do I know if my home's foundation can bear an additional floor if I were to pull off the roof and add another story on top ?
481504	If I own a home in the U.S. , can I still be considered a legal resident even if I live in another country ?
481505	How do I enable voLTE in my Redmi note 4G phone ?
481506	Does the Redmi Note 4G support dual SIM ?
481507	I am not able to recall names of people I have already met , like my school classmates or college professors . What is wrong with me ?
481508	What is wrong with me ? I dont like talking to people . I like social gatherings as long as i am invisible .
481509	How do I learn integration ?
481510	How do I learn integration easily ?
481511	Why is Paytm's customer care service so bad ?
481512	How does Paytm plan to improve customer service and product quality ? Have had personal experience of poor quality products/sellers/service wtih them .
481513	What is the Christian meditation websites ?
481514	What is Christian meditation ?
481515	Did anyone attend the IBM drive in September 2016 in Bangalore for the post of associate system engineer ?
481516	What is the in-hand salary for Associate System Engineer in IBM GBS training at Bengaluru ? What happens in training ?
481517	What does the ending of Udta Punjab mean ?
481518	How can I help Udta Punjab so that it is not affected by any financial strain as I've already seen the movie by downloading it ?
481519	Does LinkedIn have any plans to open source their Sizr HDFS utilization visualization ?
481520	5 . Under what circumstances can one expect radiation heat transfer to be significant ?
481521	How does one conquer procrastination ?
481522	How did you conquer procrastination ?
481523	What are the most interesting research topics for finance undergrad ?
481524	I have knee pain . What should I do ?
481525	How did the safest countries in the world become the safest ?
481526	Why is an Android phone better than an iPhone ?
481527	What is the etymology of the word Elosh ?
481528	What are the best blogs for data scientists to read ?
481529	Which blogs would you recommend data scientists to follow (out of those you follow yourself) ?
481530	Who is a better captain , Sourav Ganguly or MS Dhoni ?
481531	Who is the better batsman : ABD or MS Dhoni ?
481532	How do I cover up the holes in my face that are caused due to pimples/acne ?
481533	Can acne be caused by lotion on the face ?
481534	Can I trust a PhD student sending work I did as an extension to one of his papers ?
481535	How many PhD students think that pursuing a PhD is one of the worst decisions they made in their lives ?
481536	How long would I survive on Titan without a spacesuit ?
481537	How would things sound on Mars without a spacesuit ?
481538	How much of a difference to the orchestra does the conductor make ?
481539	Can I apply for a Canadian visitor visa to visit Canada on my spring break since I am in the USA on status change from B1 to F1 ? If yes than how ?
481540	Daniel Defoe summariz the audience ?
481541	How do I prepare for the ISI interview (B.Math) ?
481542	How do I prepare for ISI M.Math interview ?
481543	Who are good consultants in Mumbai for study abroad ?
481544	What do I do to study in a good university abroad through GRE ?
481545	Which country will be least affected by global warming ?
481546	Which countries would be severely affected by global warming ?
481547	As suggested by Jeb Bush & co , Trump's campaign is an act orchestrated to help Dems (Hillary) to the White House . If true , what would be the fallout ?
481548	Should I take Sydenham this year or try for JB next year with 99.83 in CET 2016 ?
481549	I have 2.5 yrs exp in IT , plan to give CET next year , target-JBIMS-MMS . Does JBIMS select candidates with > 3 years of exp ?
481550	Can you criticize critical thinking ?
481551	What is a good idea for a startup project in IT ?
481552	What is the the difference between value and growth stocks ?
481553	Dhruva , IBS , imt , vjim and abs which college is best for placements ?
481554	How advanced are we in GM plants ?
481555	Super Bowl XLIX (February 1 , 2015) : Who will win Super Bowl 2015 , Seattle or New England ?
481556	What is tokyoxvanitys real name ?
481557	What is God's real name ?
481558	Which BI tool is best in regards of cost and functionality wise Adeptia or Qlik Sence ?
481559	Pleade suggest me the best mechanical mini project ?
481560	What is RELIANCE JIO MONEY ?
481561	Will Reliance Jio change India ?
481562	Why didn't TATA manufacture a highly secured Jaguar/Landrover for PM Narendra Modi ? Why does PM still have to use foreign brand car like a BMW ?
481563	Why didn't TATA manufacture a highly secured Jaguar/Landrover for PM Narendra Modi ? Why PM still have to use foreign brand car like a BMW ?
481564	Do you think my nose is big ?
481565	What is the basic pay scale for software engineers in the Mexico ?
481566	What is the basic pay scale for software engineers in the UAE ?
481567	What should I do if I discontinue engineering in 3rd year ?
481568	Should I pursue Aerospace engineering or mechanical engineering with 3rd and 4th year specialization in aerospace ?
481569	What is the best college , with a better laboratory faculty , for studying BSc genetics in India ?
481570	What is the minimum gre score to get an admission into california state university fullerton ?
481571	What's the rudest thing a salesperson has ever said to you ?
481572	How does a male feel while touching a boob ?
481573	How can I overcome my fear of exams ?
481574	What is the difference between phonetic , phonology and phoneme ?
481575	What is the difference between linguistics and phonology ?
481576	What are IPTV products ?
481577	What is IPTV ?
481578	Why are some cherries sour ?
481579	How do I show and hide header and footer in the Android ViewPager when I single tap the screen ?
481580	How do spelling bees work ?
481581	Can Autism be confused for Schizoaffective disorder ?
481582	What is it like to not have social anxiety ?
481583	How much weight can you lose in two months without endangering your health ?
481584	My family has around 15 million dollars in net worth . Is this considered rich ? What defines rich ?
481585	How can someone be in $ 53million debt when their net worth is $ 145 million dollars ? Is that possible ?
481586	`` Is there anything like musictheory's note exercise that allows notes extended past the'' `` normal clef'''' ?''
481587	The Indian currency notes display Mahatma Gandhi's picture . Is there any legislation or government notification that sanctions it ?
481588	How will the FBI shut down of Silk Road affect Bitcoins ? Short term ? Long term ?
481589	How do you write an educational leave of absence letter ?
481590	Has anyone got the free reliance jio 4g sim which reliance is giving to any 4g handset user ?
481591	Why didn't Krishna ask Barbarik not to use the three arrows ?
481592	What is Cheat Engine ?
481593	What are some tips on making it through the job interview process at Hancock Bank ?
481594	How can I turn on Find My iPhone if I don't have my phone ?
481595	How do I claim sec 80gg and what are its procedures ?
481596	Is Israel what it claims to be ? Are their claims of treating Palestinian and Arabs equally valid or a lie ?
481597	Is it unsafe to eat moldy fruit ?
481598	Is it healthy to eat seedless fruits ?
481599	How do you fix a computer screen that is all black ?
481600	Infosys training retest ?
481601	What is after life ?
481602	I'm getting ready to hit 1,000,000 likes on Facebook & I would love to get a tour of the NYC Facebook office . Who do I contact ?
481603	Did Facebook just get hacked ?
481604	Was Tiny Tim an aspie ?
481605	Do Aspies fake-smile less than NTs ?
481606	What is lim t - > infinity sin (e ^ t ^ 2) × e ^ (- at) ?
481607	Are there any weekend batches available at the I-Medita Institute ?
481608	Is eventual annexation of West Bank the unstated policy of Netanyahu ?
481609	What are enewsletters ?
481610	I have the Class 12th (AISSCE) marksheet provided by CBSE . Does CBSE provide any Class 12th pass (AISSCE) certificate also ?
481611	What are the best books for CBSE class 12th ?
481612	Why does a guy avoid a girl that he likes ?
481613	What does current protection mean ? How does it work ?
481614	Why a marraid women cough is it a signal ?
481615	Why is specific heat at constant pressure greater than specific heat at constant volume ?
481616	What is the specific heat of NH4NO3 ?
481617	What is the relationship between entropy and enthalpy ?
481618	Is it possible to gain 10 kg of weight in 15 - 20 days ? If yes , then how ?
481619	How does a digital inclinometer work ?
481620	What experiences have people had in a sensory deprivation tank in Atlanta ?
481621	What experiences have people had in a Sensory Deprivation tank ?
481622	Flat Earth : Do short direct flights from Chile to Australia debunk the theory ?
481623	What is the typical revenue per number of sales / marketing FTEs for B2B and B2C companies in the insurance , financial services , utilities , and compliance industries ? What is the typical sales/marketing spend per billion dollars in revenue ?
481624	What is the typical revenue per employee for a B2B SaaS company ?
481625	How do I work with machine learning researchers after graduation ?
481626	How can undergraduate help with machine learning research ?
481627	What AMD RX 480 version should I get (Gigabyte , Asus , MSI or EVGA etc.) ?
481628	Why the AMD Radeon RX 480 which is available for $ 199 in America is priced at 28,990 in India ?
481629	How do I get rid of red bumps on my legs ?
481630	Do stars (zodiac signs) influence our lives ?
481631	When will the media realize we don't want to hear about trump ? Does Trump even understand what the different branches of government are for ?
481632	Why does the BBC use such a cumbersome name to describe ISIL ?
481633	How do I cash a fake check ?
481634	What makes a person undesirable ?
481635	How do I make a person care for me ?
481636	My gmat mock score is 310 . My actual test is after a month from now . How can I work hard to score high ?
481637	I faltered in my iit JEE class mock test even after studying really hard for it for a complete month ? What can I do to improve my score ?
481638	What topic (s) or subject (s) interest you the most and why ? *
481639	How can I make my physics class interesting ?
481640	How did Modi use black money to develop our India ?
481641	What are some examples of radio waves and their uses ?
481642	Can I use a TV antenna to pick up higher-frequency radio waves ?
481643	What are the major stereotypes people have about Burkina Faso and to what extent are they true ?
481644	What led to present situation of Burkina Faso ?
481645	What is the energy source of the International Space Station (ISS) ? And how does it maintain its energy ?
481646	What is the atheist prayer experiment ?
481647	What does an atheist's prayer look like ?
481648	What is VRAM on a graphics card used for ? Dual/triple monitor ? If so , how much VRAM is enough to power triple 4K gaming machines at high settings ?
481649	How do you prevent an infected black head ?
481650	What causes an infected black head ?
481651	How many 2/7 are there in 5/6 ?
481652	File Systems : What are essential differences in the implementation of Symbolic Links between Windows and Linux ?
481653	Which website is best to see hollywood movies with subtitiles ?
481654	Where is the Maruti Suzuki Service Centers in Madurai ?
481655	Where is the Maruti Suzuki Service Centers in Indore ?
481656	Why was OK Computer by Radiohead such a seminal release ?
481657	What are the similarities between mitosis and meiosis ?
481658	What is the tale of Robin Hood ?
481659	What is the importance of the Tales of Robin Hood ?
481660	How long would it take for a signal message from Mars reach the Earth ?
481661	Why is Indian media jingoist ?
481662	Are there alt-right movements in Africa ?
481663	What is the ` Alt-Right' movement ?
481664	I'm going to run in a police recruitment endurance test , in which I have to run 1600m in 7 minutes . I have been practicing for a month , but I'm only able to run 1200m . How can I motivate myself to pass the test ?
481665	I want to be able to run 10k in 40 minutes . What are some things I can do to help myself ?
481666	How can I record acoustic guitar audio like in this session ?
481667	When can I contact the Candidate Helpdesk ?
481668	Distance from Vazhakkad to wagah border ?
481669	Which oil is used in hydraulic system ?
481670	How to treat the influence of new media on the government supervision ?
481671	New Media : How do I get a show on Hulu ?
481672	Do raw eggs and milk make you gain weight ?
481673	What does Lithium chloride soluble in ?
481674	Is lithium chloride soluble in alcohol ?
481675	Where do documentary filmmakers find old footage ?
481676	How do documentary filmmakers get such genuine footage from their subjects ?
481677	Milk acid or base or neutral ?
481678	Why can't I watch putlocker videos on my phone ?
481679	Which is best industry for marketing ? Bank or FMCG
481680	When we go to install spring tool app they appear one dialogue box will appear but not open . ex file , why ?
481681	How many cups are in a pint ?
481682	How many cups are in a quart ?
481683	How long it takes to completely max out town hall 8 in COC ?
481684	What is a good base design for level 4 town hall in COC ?
481685	How is it possible for sun to have more energy than Lightning ?
481686	What are some good topics for biology investigatory project for class 12 (cbse) ?
481687	What are the examples of Newton's Second Law of motion ?
481688	What are some examples of the second law of motion ?
481689	What is the best way for an unexperienced person to start a business without any risk ?
481690	What is the recipe for the bread at Pazzo's restaurant ?
481691	How does Rocky get his money back in Rocky Balboa (film) ?
481692	What are frequently asked technical questions in product manager interviews ?
481693	What are frequently asked questions in product manager interviews ?
481694	What are the advantages of Pentaxim ?
481695	Is there any safe place for unmarried couples to have night stay in Matheran ?
481696	What are things to do in Matheran ?
481697	Is it actually possible to be stranded on a deserted island ?
481698	What were the 80s/90s equivalent of vines/memes ?
481699	If you report a comment on Facebook and message the user , is the message anonymous ?
481700	How do I archive Facebook messages ?
481701	I hate how much power girls have over me ! How can I change that the other way around ?
481702	What is the surge impedance method ?
481703	What will be Hillary clinton's policy towards india if she becomes the president ?
481704	Are psychiatrists relevant ?
481705	What are good developer centric startups to work in India ?
481706	Is it possible for a person to be pedophile and teleiophile at the same time ?
481707	Can one be so happy and smart at same time ?
481708	What are the best episodes of Regular Show for getting someone new into the show ?
481709	`` What is'' `` hamboning'''' on the Regular Show ?''
481710	How do you allow the user to input the array size in C ?
481711	Does the Ferrari 488 Gtb have a Turbocharger ?
481712	What is the horsepower of a Ferrari 488 GTB ?
481713	What are the countries within South Africa and why have the not been annexed by the country ?
481714	Why is Lesotho not a part of South Africa ?
481715	`` Tamil Song Meaning : What is the meaning of the song'' `` Usuru Narambula'''' from the film'' `` Irudhi Suttru'''' ?''
481716	What is thereforeindia technology stack ?
481717	What are frontier markets ?
481718	Is the verdict given in Salman Khan's hit and run case right or wrong ?
481719	What are your views on Salman Khan's hit-and-run case verdict ?
481720	What is the best recurring billing system ?
481721	What is time-multiplier setting of a protective relay ?
481722	What happens if I mark all my notifications as read ? Can I delete individual notices ?
