test-445480	Who is your favourite character in Game of Thrones? Why?
test-445481	Who's your favorite character in Game of Thrones? Explain why he/or she was chosen, and explain what separates them from the others?
test-445482	What would happen if I shifted my car to park going 65 mph?
test-445483	Two cars hitting head on, each going 60 mph, have an impact equivalent to either of the cars going 120 mph and hitting a stationary car?
test-445484	What is awesome?
test-445485	What makes one awesome?
test-445486	What does the Large Hadron Collider do?
test-445487	What is the mass of a proton in the beam of the Large Hadron Collider?
test-445488	What is your success story?
test-445489	What can I start today that will benefit me for a lifetime?
test-445490	How do I invest 10 million dollars?
test-445491	If a person with a net worth of 10 million dollars invested 5 million in Berkshire Hathaway stocks could they live off the returns?
test-445492	"What does ""Everything that kills me makes me feel alive"" mean in the context of the song Counting Stars?"
test-445493	What does it mean when you dream someone is trying to kill you?
test-445494	How do I use a web crawler to extract RSS feeds and use the feeds to build a blog?
test-445495	What are some resources to visualise bilinear algebra?
test-445496	What are some everyday problems faced by the common man that need to be solved?
test-445497	What are the common problems faced by women?
test-445498	To what extent was the American Civil War fought over the issue of slavery?
test-445499	Was the American civil war really about slavery?
test-445500	What are outsourcing services similar to TaskRabbit?
test-445501	What are the services that a company can outsource?
test-445502	When someone married says he loves me, yet he has no intention of leaving his wife and daughter, should I believe him and love him back?
test-445503	My first love was a great feeling but soon I realized I was with the wrong guy who never cared and yet I loved him. I left him and moved on and now he's back. He says he cares and wants me back. What should I do?
test-445504	How can I meet Emma Watson in person and become friends with her?
test-445505	Why do many people find Emma Watson hot while I find her cute?
test-445506	What are the best social media management tools?
test-445507	What are some social media management tools?
test-445508	What are some useful tips to crack the SSC CGL 2015?
test-445509	What are the answers of SSC CGL 2015 tier 1?
test-445510	What is the difference between a creole and a dialect?
test-445511	What is the difference between accent and dialect?
test-445512	How likely am I to get deployed in the Air Force Reserve?
test-445513	Is it possible to pursue a Ph. D and be in the Air Force Reserve?
test-445514	Is death by hanging painful?
test-445515	What would be in the mind of someone who is going to be hanged till death?
test-445516	Why are Quora users active in giving detailed answers?
test-445517	Why isn't Adithi active on Quora?
test-445518	What is to be like still single?
test-445519	What is it like to be single?
test-445520	Is failure a life?
test-445521	Will I become a failure in life?
test-445522	What is ecological service?
test-445523	What is ecology?
test-445524	Why is a chemical change considered to be important?
test-445525	Is photosynthesis considered a chemical change?
test-445526	What are some changes you have made after listening to seminars of Sandeep Maheshwari and following his ideas?
test-445527	What are some great things about Sandeep Maheshwari's character that I should learn?
test-445528	If Harry Potter were to be made today, without the restriction of only British actors, who should play the major characters?
test-445529	If you casted a remake of Harry Potter, without the limit of British actors, who would you cast?
test-445530	What should I do if someone doesn't reply to my email?
test-445531	What does it mean when a guy all of a sudden doesn't reply as expected?
test-445532	How do I use file inside winrar which does not extract it?
test-445533	How do I open a file with the help of WINRAR in window 7?
test-445534	Is there any evidence for reincarnation?
test-445535	Have you ever been reincarnated, and if so, what is your evidence?
test-445536	Which common habit found in most of the Information technology guys, I feel is the strangest thing on earth?
test-445537	What are some weird habits or things I can do?
test-445538	What is your experience with using 87seconds?
test-445539	Do grown adults use Pokémon GO?
test-445540	Where can I get affordable mobile photo booth hire services in Sydney?
test-445541	Where can I get most affordable rates on photo booth hire services in Sydney?
test-445542	How can you tell how many people are following your website in Google Reader?
test-445543	Why shouldn't Google link 'Google+ Following' with Google Reader?
test-445544	Do I need to learn asp.net to build a website?
test-445545	How can I deploy my ASP.NET website for free? Are there any good solutions?
test-445546	Are gauge theory and quantum field theory known to be Turing-computable?
test-445547	Are there useful applications of homological algebra to quantum field theory and string theory?
test-445548	Is China GFW blocking SSH tunnel recently?
test-445549	Is it illegal to use an SSH tunnel or any kind of proxy to access a website blocked by the Great Firewall of China?
test-445550	How do I use lucky patcher without rooting the phone?
test-445551	How do l make root for lucky patcher?
test-445552	What's the easiest way to learn a new language? For example French?
test-445553	How can I learn any new language quickly?
test-445554	From which institute should I learn post production and lightning, sound camera etc for my YouTube channel in Delhi?
test-445555	Which country should I visit where I can buy products and carry them in my bag for selling back in New Delhi? Which products should I buy? Where to sell in Delhi/NCR?
test-445556	"How do I make the right pronunciation if ""T"" is followed by ""N"", like ""mountain"" or ""certain""? Is keeping the tongue up the right way to pronounce these words?"
test-445557	What is the right way to read the word LaTeX?
test-445558	What are the features you expect in you ideal/ dream partner?
test-445559	Can an average student crack IIT Mains in 4 months with Pradeep as physics and rs Agarwal & NCERT for maths?
test-445560	Do american girls like pakistani guys?
test-445561	What is the best way to impress a girl?
test-445562	I want to learn automation testing which is best UFT/SELENIUM?
test-445563	Which site is best to learn selenium (Automation testing)?
test-445564	Why are many Hindu gods shown young and without beards and moustaches?
test-445565	Do Sikhs pray to Hindu gods?
test-445566	When does the loop in Interstellar actually end?
test-445567	What is the end of Interstellar?
test-445568	What games can an i5 laptop with Nvidia Geforce 940m (4gb) run?
test-445569	How do I make GTA V run on Intel i5 5200U CPU @2.2Ghz 8GB ram 1600 MHz, Nvidia Geforce 940M without problems?
test-445570	How did George Bush win the 2000 election with less votes?
test-445571	If he had been allowed to run for a third term – would President Clinton have won the 2000 presidential election against Governor Bush?
test-445572	How do I change the mentality of my orthodox parents and come out of the shackles ?
test-445573	How do I change the mindset of orthodox parents?
test-445574	How do I ask a question on Quora?
test-445575	How do I add a question on Quora?
test-445576	What is Cirque Du Soleil?
test-445577	What are the best Cirque du Soleil shows?
test-445578	If time travel would be possible, could we meet ourselves?
test-445579	Is time travel still theorized as being possible?
test-445580	How can I improve my Java skills?
test-445581	How do I develop logical skills in Java programming?
test-445582	What is the difference between LTE and VOLTE?
test-445583	What is the difference between 3G and LTE?
test-445584	How do I fix an an error on WhatsApp that happens every time I try to verify my phone number?
test-445585	How do I know why WhatsApp banned my phone number?
test-445586	How can I or my products stand out on instagram?
test-445587	Instagram (product): How can I login to Instagram if I don't remember the password, and I dont know the email address that was used to set up the account?
test-445588	What side dishes go well with chicken and dumplings?
test-445589	What side dishes go well with kielbasa?
test-445590	How do I be confident enough and improve my speaking skills?
test-445591	How can we improve our English language skills?
test-445592	What should be considered a crime but it isn't from a legal standpoint?
test-445593	Is CSE with specialization in banking, financial services and insurance in UPES, dehradun a good course to choose?
test-445594	If [math]f(x) = \mathrm{cot}^{-1} (\tan(x)+\sin(x))[/math], what is the derivative of [math]f[/math]?
test-445595	What is the derivative of [math] f(x)=\dfrac{1}{\sqrt{x+2}} [/math]?
test-445596	How can one objectively prove if a book is more eloquent than the quran?
test-445597	Why do people run or bike to raise donations?
test-445598	What is the ultimate bliss?
test-445599	What is the highest peak of spirituality?
test-445600	What are the common human threats to biodiversity?
test-445601	What are the most serious human activities that threaten biodiversity?
test-445602	What is the best way to send money from the Philippines?
test-445603	How do I send money from the Philippines to India?
test-445604	How not to write a Quora answer?
test-445605	How do I write an answer on Quora?
test-445606	Is messi the best player the world has ever seen?
test-445607	Who is the best finisher the world has ever seen in football?
test-445608	If you create an Instagram account, does it automatically connect to Facebook?
test-445609	Instagram (product): How can I login to Instagram if I don't remember the password, and I dont know the email address that was used to set up the account?
test-445610	How can I get rid of the fat above belly button?
test-445611	What are some good ways to get rid of belly fat?
test-445612	Which intersections in Honolulu are particularly dangerous? Why? What could be done to improve them?
test-445613	Which intersections in Philadelphia are particularly dangerous? Why? What could be done to improve them?
test-445614	Why doesn’t the Quora app have a night mode?
test-445615	I took pictures of Khalifa tower in Dubai. After going home and looking through them, I noticed that there is a small green circle in the pictures.
test-445616	What went wrong with Batman v Superman: Dawn of Justice?
test-445617	Does Superman die in Batman v Superman: Dawn of Justice?
test-445618	"Does Facebook ""reduce"" the quality of uploaded videos?"
test-445619	How do I upload video which is on Facebook to YouTube? Or how can I download a video to my system or phone from Facebook?
test-445620	What is your position on the Israeli-Palestinian conflict?
test-445621	Who is responsible for the Israeli-Palestinian conflict?
test-445622	What are the current technologies and trends running in IT?
test-445623	What are the current technology trends?
test-445624	How is starch used as an indicator?
test-445625	Why is starch used as an indicator?
test-445626	How do you market your Kindle eBook?
test-445627	How do you market your Kindle book?
test-445628	How do you find a cook or a maid in Bangalore and what are the problems faced in the hiring process?
test-445629	How can I find someone to hire me as a maid or cook during the Masters tournament in Augusta?
test-445630	What can I expect when taking care of a Blue Heeler/Boxer mix?
test-445631	What are full grown blue heeler/beagle mixes like?
test-445632	What exactly is time travel and is it possible?
test-445633	Will time travel be possible in future?
test-445634	How is the Franz Ferdinand assassination viewed in present day Serbia, Croatia, and Bosnia?
test-445635	How is Gavrilo Princip seen in countries that were part of Yugoslavia except Serbia?
test-445636	What is it like to leave the Army with a dishonorable discharge?
test-445637	How many people are dishonorably discharged from the US armed forces every year?
test-445638	How does mutation occur?
test-445639	When and how does a frameshift mutation occur?
test-445640	What is the Lewis structure for magnesium bromide?
test-445641	What is the Lewis structure of H2PO4?
test-445642	Will Candy Crush Saga ever end? Does a player who finishes the highest level get anything?
test-445643	How do I skip levels in Candy Crush?
test-445644	If R+L=J was true in Game of Thrones, wouldn't that technically make Jon have more rights to claim the throne than Danny?
test-445645	If R+L=J is true, whose claim to the iron throne will be stronger, Daenerys or Jon Snow's?
test-445646	What are the benefits of having the panel (taskbar) on the left/right side of the screen?
test-445647	Why is my taskbar so big? How can I reduce it?
test-445648	Signs (astrology): In what ways are Cancer, Scorpio, and Pisces different from one another?
test-445649	What are the differences between Cancer and Scorpio, in astrology?
test-445650	How will you understand what do you want life?
test-445651	What should be done when you don't understand what you really want to do in life?
test-445652	How can I reduce sex interest?
test-445653	How do I reduce high sex drive?
test-445654	What is rank wise list of IIITs?
test-445655	What are the ranking of the IIITs?
test-445656	In the Harry Potter films, in which scenes is it possible that Daniel Radcliffe was drunk?
test-445657	Is Daniel Radcliffe gay?
test-445658	How do I solve this physics problem involving friction, tension, and pulleys?
test-445659	What are the issues with pulley tension?
test-445660	I have a rank of 488 in Manipal. Can I get CSE there in the main campus?
test-445661	What score (out of 200) in the Manipal entrance exam would get me a CSE seat in MIT (Manipal branch)?
test-445662	How can I improve my writing skills? Some tips?
test-445663	What are the best ways to improve writing skills?
test-445664	Can drinking milk cause kidney stones?
test-445665	Can consuming too much milk (calcium) increase chances of kidney stones?
test-445666	What is the perfect excuse for bunking school?
test-445667	Data center cooling cost?
test-445668	What are the most fun/adventurous things to do in Goa on a 4 and a half day trip with friends?
test-445669	How do I plan a 4 day trip with 4 friends to goa in january?
test-445670	Is there any significant difference between the new 2015 Mazda 3 vs the 2014 Mazda 3?
test-445671	Is the Mazda 3 a good car?
test-445672	Should I meet up with the guy I met online?
test-445673	Should I meet the guy I met online?
test-445674	Why is my dog vomiting and shivering?
test-445675	What should I do if my dog is vomiting?
test-445676	Are there any other website similar to Quora?
test-445677	What are some sites like Quora?
test-445678	What are the perks of being an IAS?
test-445679	What are the perks of being an IAS officer? What are the job pressures? How much do they earn?
test-445680	How and where can I find a developer in California interested in my business idea to collaborate together?
test-445681	What are some business ideas to sell retail goods in my developing local town?
test-445682	Why does hot concentrated sulphuric acid react with copper and dilute sulphuric acid not?
test-445683	For the hydration of alkenes, concentrated or dilute sulphuric acid, which one is used to produce alcohol from alkenes and why?
test-445684	How many cities, towns, and villages are there in India?
test-445685	Why are there not many planned cities in India?
test-445686	What are the culture differences between China & UK, China & US, China & France, China & Germany? What kinds of culture shocks are to be expected?
test-445687	Why do France and Germany love each other while China and Japan hate each other?
test-445688	Where can I find a jaw crusher in zambia?
test-445689	How can I find Jaw Crusher in Eritrea?
test-445690	How many U.S. Forever stamps do I need to send a letter sized envelope of normal letter thickness and weight to the UK?
test-445691	Can I use letter stamps as postcard stamps?
test-445692	Who will be the first to get to Mars -- Elon Musk or the U.S government?
test-445693	Who will get to Mars first, Elon Musk's SpaceX or NASA?
test-445694	What is the worst mistake you've made as a parent?
test-445695	What is the worst mistake you've made?
test-445696	Are feral dogs and stray dogs the same or different in nature?
test-445697	Which is the best way of integrate OPC Server with SAP PI?
test-445698	What are the limitations of human rights with a detailed explanation?
test-445699	Are women's rights human rights?
test-445700	"Linux Kernel: What is the purpose of ""ata_sff"" Kernel Thread?"
test-445701	"What is the purpose of ""kupdated"" Linux Kernel Thread?"
test-445702	How often can/should I post a question on Quora?
test-445703	How should I ask a question on Quora?
test-445704	Will a player ever get into a long distance relationship with someone they just met?
test-445705	How do I to get rid of insecurity in a long distance relationship if I know he loves me but is just busy?
test-445706	How do you know if someone has blocked you from Buber?
test-445707	How do I know if someone has blocked me from calling them?
test-445708	[SPOILER] Was Cersei the rightful heir of Tommen or did she just take the throne because there was no one to object her?
test-445709	[SPOILER] In S6 E10, how can Cersei become the Queen? Was she the rightful heir, or did she just take the throne because no one objected?
test-445710	How come cigarettes are addictive, but second hand smoke isn't?
test-445711	Why isn't second hand smoke addicting? Does the nicotine only take effect with first hand inhaling?
test-445712	If I delete a message from WhatsApp group chat will that get deleted for everyone in that group?
test-445713	If we delete chat on my mobile does it get deleted from my friend in whatsapp?
test-445714	Men watch women in the porn. Do women watch men?
test-445715	Do women watch porn as much as men?
test-445716	How do I gain weight fast but still be healthy?
test-445717	How do I become fat or gain weight with a healthy diet?
test-445718	What do you think of entrepreneurship in Cameroon?
test-445719	What do social scientists think of the obsession with entrepreneurship?
test-445720	Snacks: Why don't they sell ketchup-flavored potato chips in the United States?
test-445721	What is the all time best Indian food/snack?
test-445722	How do I get a private mobile number in India?
test-445723	Where do I get my laptop/mobile insured in India?
test-445724	Where can I find good jQuery training?
test-445725	Where can I find good jQuery video training?
test-445726	Where are you buying a high fashion wig from a website?
test-445727	Where would you buy a high fashion wig?
test-445728	What's the ultimate aim of education?
test-445729	What is the ultimate aim of education?
test-445730	What is meant by single sided repayment from IGBL for eduaction loan SBI?
test-445731	How do I repay my Education loan?
test-445732	Cleaning: Is washing the dishes more effective in hot water or cold water?
test-445733	My mom doesn't use dish soap when she washes the dishes. How can I make her use it?
test-445734	How do I know if I am doing the meditation correctly?
test-445735	How do I know if meditation is working?
test-445736	Which Institute is better SIOM Nashik or Fore School of Management?
test-445737	How good is SIOM (Symbiosis Institute of Operations Management) Nashik?
test-445738	Who manufactures Guess Jeans?
test-445739	How do Guess shoes run?
test-445740	Is Trump the president-elect with most ex-wives?
test-445741	Are water moccasins classified as amphibians?
test-445742	Are icebergs made of fresh water or salt water?
test-445743	Why am I allergic to fresh water fish but not salt water fish?
test-445744	"As a fund manager, what is the best response to, ""What is your edge?"" when asked by a potential investor?"
test-445745	What is the best tool a hedge fund can use to manage its email?
test-445746	How many times we can merge Facebook pages?
test-445747	My Facebook account says I liked many pages that I didn't even know about.  Even though I click unlike, they still show after I refresh the  page. I have tried changing my password many times, but it doesn't change. How can this can happen? How can I fix it?
test-445748	How many calories does one slice of pizza have?
test-445749	How many calories are in pizza?
test-445750	Which current TV sets feature integrated tuners for both the ATSC and DVB-T standards?
test-445751	What is you opinion on sportscientia for investment?
test-445752	What do cramps feel like before your period?
test-445753	What do period cramps feel like?
test-445754	Which is the best institute for IT training in Bangalore?
test-445755	Which is the best institute for PMP Exam training in Bangalore?
test-445756	Is it safe to drink tap water in the US?
test-445757	Is it safe to drink tap water in Shanghai?
test-445758	How can I download a C language software?
test-445759	How can I perform C and C++ programming on Windows 7? What are some of the softwares I can download for that?
test-445760	Why should one vote for Hillary Clinton in the 2016 presidential election?
test-445761	Do you support Hillary Clinton for President in 2016?
test-445762	What are the best topics or ideas for final year project in information technology?
test-445763	Where can I choose best design for envelopes in Sydney?
test-445764	I accidentally formatted my genuine windows OS. Now my laptop does not have any OS. How can I retrieve my product key?
test-445765	My friend accidentally formatted my laptop while changing OS. Is there any tool for getting my data back?
test-445766	Quora: How do you post a question on Quora?
test-445767	How do I add a question on Quora?
test-445768	How do I get rid of a bad roommate?
test-445769	What is the best way to get rid of annoying roommates?
test-445770	How can I get call girls?
test-445771	Where I get call girls?
test-445772	I have everything I thought I wanted, and I'm still not happy. Why?
test-445773	I just found out my wife is pregnant. We both wanted this. I'm 30 and my wife and I have been together since high school. I plan everything and I'm just worried I haven't thought this through enough. Is this normal?
test-445774	What is the significance of working capital?
test-445775	What is working capital?
test-445776	What's the best parenting advice?
test-445777	I'm about to go to prison, maybe for a long time. My mom & dad are old. What should I do?
test-445778	What is the difference between making love and fucking?
test-445779	What's the difference between sex and making love?
test-445780	I got a rank of 1342 in NPAT 2016, will I get CS or IT branch in Mumbai campus?
test-445781	I got a rank of 1342 in NPAT 2016, will I be able to get CS or IT branch, Mumbai?
test-445782	Are competitive programmers very good application developers as well?
test-445783	Is Python alone enough to be a good competitive programmer?
test-445784	What were the cinematic techniques used in Mad Max: Fury Road?
test-445785	What was the most dangerous stunt performed in Mad Max: Fury Road?
test-445786	Is feminism still needed?
test-445787	Has modern feminism failed, why or why not?
test-445788	I'm doing my 2nd year engineering rite now! Nothing can stop me from loving biology! I badly wanna study medicine! What is it I can do about it?
test-445789	Best Lal Kitab Astrologer In ALWAR-Guru Ji N K Rai (Lal Kitab & Vedic Astrologer)?
test-445790	Is CIEM college Kolkata good for engineering?
test-445791	Is St. Xavier's College, Kolkata a good college for studying statistics?
test-445792	What's the fastest way to learn Japanese?
test-445793	What's the best way to learn Japanese?
test-445794	How can I edit a vector image in EPS on a Mac?
test-445795	What is the best EPS Viewer for a Mac?
test-445796	What's the best way to write a research paper?
test-445797	How can I write a summary of a research paper?
test-445798	How do I talk English fluently?
test-445799	How can I improve my English skills?
test-445800	What do you think of life after death?
test-445801	Is there life after death?
test-445802	What are the primary and secondary forces acting on an engine?
test-445803	What are the forces acting on a space rover?
test-445804	Why are car dealerships closed on Sundays?
test-445805	How do I find a best used car?
test-445806	What are some of the biggest problems of our society?
test-445807	What are the biggest problems in modern society?
test-445808	How can the following Arabic words be translated?
test-445809	What is the translation of the following Arabic word?
test-445810	Is it a good idea to write documentation before I start coding?
test-445811	Is it a good idea to use in built functions while writing code for selection process of a company?
test-445812	How is Obama destroying America?
test-445813	Why do conservatives think Obama is out to destroy America?
test-445814	Nees to buy a home theatre system for room size 20*20,suggest a good package?
test-445815	Why is the measure payback and book rate of return used in capital budgeting?
test-445816	How can Uber handle a huge amount of concurrent connection?
test-445817	Uber (company): Why and how does Uber use AWS?
test-445818	Is it possible to track an IP address of a deactivated Instagram account and find out who made it?
test-445819	How do you track down/find what phone an instagram account was made on?
test-445820	What are the best Tamil songs for a bass voice?
test-445821	I am using windows 8 32 bit. my PC's processor intel G2020 2.90Ghz which is x64 based processor how can I upgrade to windows 10 64 bit?
test-445822	What is the procedure to get an internship in Mercedes Benz India?
