28191	What's the craziest thing that has happened to you on the dark web ?
28192	Which are the best books to learn HTML , CSS and JavaScript ?
28193	I want to learn HTML , CSS and Javascript , which books ?
28194	Is it fine to run and jump after drinking water ?
28195	Why do we drink water after eating food ?
28196	How do start preparation for IAS ?
28197	How do I start IAS preparation along with BE engineering ?
28198	How do I motivate someone lazy ?
28199	What is Ellen DeGeneres' phone number ?
28200	What is the phone number for The Ellen DeGeneres Show ?
28201	What is your dream today ?
28202	What is your dream ?
28203	How did Hillary Clinton mess up her chances of winning the US presidential election ?
28204	Why should one vote for Hillary Clinton in the 2016 presidential election ?
28205	My girlfriend speaks Japanese , and as a native English speaker , what would be the best way to learn Japanese ?
28206	How can I learn Japanese ?
28207	How legit is www.chatropolis.com ?
28208	How legit is www.tumblrplug.com ?
28209	Which is the best hybrid bicycle to buy in India around the range of 10000 ?
28210	What is the best bicycle to buy under 10k ?
28211	How do I get into a data science job ?
28212	How do I get a data science job at Spotify ?
28213	What is a good book about design ?
28214	What are the best books about designing for emotion ?
28215	Why are most rockets that return from space nonreusable ? Why don't they simply refuel and prepare for another launch ?
28216	Why are most rockets that return from space non reusable ?
28217	Why do you love living in Georgia ?
28218	What do you love about the state of Georgia ?
28219	How do I create a chatbot app ?
28220	How is dry humping done ?
28221	Do girls like dry humping ?
28222	What does owl signify ?
28223	What do owls signify ?
28224	What should I prepare for second job interview for Mechatronics engineer in MNC ?
28225	How should I prepare to ace an interview for a job in mechanical engineering ?
28226	How do I prepare for RBI grade B exam 2017 ?
28227	How should I prepare for RBI grade B exam 2017 ?
28228	Is it okay that I don't believe in conspiracy theories ?
28229	Why do people believe in conspiracy theories ?
28230	What are the embarrassing moment of your life ?
28231	What are the most embarassing moment in life ?
28232	Why do some people not believe in Jesus Christ when all the proof is in the Bible ?
28233	Is Jesus the only begotten son or Christ the only begotten son ? Is Jesus the only Christ - and does it say so in so many words in the Bible ?
28234	What is the best university in France ?
28235	What are the top Universities in France ?
28236	What happens if you place the PIN number in backwards at an ATM ?
28237	What causes an earphone to become dysfunctional after a while so that you have to keep adjusting the pin (and holding it in place) to get reception ?
28238	Do animals commit suicide or is this uniquely a human trait ?
28239	What animals knowingly commit suicide ?
28240	What is the general possibility to get a faculty position after attaining a PhD from UPenn Engineering ?
28241	What is the best exit plan after a PhD to possibly make a positive impact on the world ?
28242	Have any one spotted a Tiger in Periyar Tiger Reserve ?
28243	Do big cats like lions or tigers purr ?
28244	How can you live with yourself at age 50 if you've never had a career ?
28245	Is a concrete building conductor or insulator ? If insulator why do I get shock if I touch live wire standing on the top floor ? How the circuit closed ?
28246	How do I become faster ?
28247	How do I become faster physically ?
28248	Why does copying multiple files take longer time than copying a single file of same size ?
28249	What would cause my files to take up more disk space than the actual sum of their file sizes ?
28250	Which are the best possible methods of stress relief ?
28251	Wat is the effect of gst bill on normal man ?
28252	Why is GST amendment a gamechanger for Indian Economy ?
28253	How do you ask a question in Quora with anonymity on ?
28254	How does one ask a question anonymously ?
28255	Why are modern parents so dumb ?
28256	What is the hierarchy of sytems engineers in capgemini ?
28257	Is Donald Trump going to become president ?
28258	Could Donald Trump actually win and become POTUS ?
28259	Why do Christians believe in Jesus ?
28260	How does a Christian believe in Jesus ?
28261	What are some best cheap hotels in Goa (beach side) ?
28262	What are cheap but good hotels to live in goa ?
28263	Why should one vote for Donald Trump ?
28264	Is Turkey a safe place to visit considering the recent events ?
28265	Is Turkey safe now ?
28266	Could my childhood have set me up for failure in life ?
28267	How do I make a guy commit ?
28268	What do the Chinese people think about India ?
28269	What do Chinese people think of Indians ?
28270	Where would you use a 14-3 wire vs. 14-2 ?
28271	Heated blanket directions : don't fold blanket/bend wires (also , wires can get brittle over time) . Is this a fire hazard , so buy new one every 2 years ?
28272	What is your favorite love song ?
28273	How long does it take the average person to run a 10k ?
28274	How long will it take to make one of my regular runs a long run ?
28275	How do I become a penetration tester ?
28276	I need a piece of clothing designed and manufactured . A non-existing piece of underwear . Where can I find someone that specializes in the design and manufacturing of such ?
28277	I have a design for an electronic product . How can I get that manufactured in chunks of 20-40 pieces ?
28278	Why is the media against Trump ?
28279	India as a developed nation ?
28280	Why India is not a developed nation ?
28281	Why do some students cheat during tests and exams ?
28282	Why do some students cheat on tests in the US ?
28283	Do nipple piercings make a woman who is lactating leak milk ?
28284	My infected nose piercing is now making my whole nose hurt . I don't have anything here to help . What can I do ?
28285	If Jesus is God , then who is God ?
28286	Who is God ?
28287	Who is the Jaguar company's biggest automobile competitor ?
28288	What is MS&S in Jaguar LandOver Ltd ?
28289	Why am I not taken seriously ? Is it because I don't have a degree ?
28290	How can I be taken more seriously ?
28291	What's the best way to increase agricultural productivity ?
28292	I own an innovative advertising & marketing company operating for over 1 year & I am looking for an investor or financier partner to help expand fast ?
28293	What if the South won the American Civil War ?
28294	What would have happened if the American civil was lost ?
28295	Can I find or track my lost mobile device using the IMEI number ?
28296	I have lost my mobile . How do I find my IMEI number ?
28297	What are your 2017 New Year's resolution (s) ?
28298	What are polar bear tubes ?
28299	How do I approach an engineering PhD to land an industry job & what can I do to make the most out of my PhD ?
28300	Why has the Tata Sons Board voted to remove Cyrus Mistry as chairman ?
28301	If a person is wounded or killed in service of the IDF , what benefits are given to them or their family ?
28302	Is serving in the IDF good for you ?
28303	What are my career options after completing BBE (Bachelor in Business Economics) ?
28304	How can I pursue a career in music after completing bachelor in zoology ?
28305	What should I do for belly fat ?
28306	How should I reduce my belly naturally ?
28307	How is the Vice President of India elected ?
28308	Does the president of india vote in the assembly elections ? If yes , then from which constituency ?
28309	How do you stop a English Bulldog/Pitbull mix puppy from biting my shoes ?
28310	What is your review of The Contract (2006 movie) ?
28311	What is your review of I Do (2006 movie) ?
28312	How should I study for ICSE class 10 board exams ?
28313	Problem Solving : If 3 +2 = 7 , 5 +4 = 23 , 7 +6 = 47 and 9 +8 = 79 to what is 10 +9 equal ?
28314	If theta is the angle between the diagonals of a parallelogram ABCD whose vertices are A (0,2) , B (2,-1) , C (4,0) and D (2,3) . show that tan theta = 2 ?
28315	How do I improve my profile for admission to business schools ?
28316	How should I build my profile for top business schools ?
28317	How can I become and investment banker ... and is it worth it ?
28318	What should i do to become investment banker ?
28319	How do I become a good teacher/tutor ?
28320	How I become a good teacher ?
28321	What is the best and most effective home remedy to get rid of sun tan ?
28322	Meeting with my biological half-brother in a few days and need some advice ?
28323	How one can deal with a breakup ?
28324	What are the steps one goes through getting over a breakup ?
28325	What data science and machine learning career opportunities are there at Fitbit ?
28326	What data science and machine learning career opportunities are there at Facebook ?
28327	Are we moving closer towards the next world war ?
28328	Is it better to be a vegetarian or vegan than to be omnivorous ?
28329	How much healthier is it to be vegan than vegetarian ?
28330	What are some startup ideas for India ?
28331	What are the best ways to think of ideas for a startup in India ?
28332	My mother is a family pensioner and I am working as an officer in bank . Will I come under non-creamy layer other backward class category ?
28333	Which is the most exciting turn in Australian grand prix F1 ?
28334	How do I contact whatsapp with a feedback ?
28335	How do you find contacts on WhatsApp ?
28336	What are the best books on diplomacy ?
28337	What are some of the best books about diplomacy ?
28338	What are some ways to spot a homeschooler ?
28339	What are some ways I can be homeschooled online ?
28340	How do I increase metabolism ?
28341	How can I boost my metabolism ?
28342	Looking for part-time PhD in computer science engineering at Bangalore . Any help ?
28343	What would you do if a competitor asks for a clients Adwords account .
28344	What are some reasonable research topics for undergrads in pure mathematics ?
28345	What are some easy mathematics research paper topics ?
28346	What is the fastest Internet speed in India ?
28347	What is highest internet speed in India ?
28348	What are the best pictures that showcase kindness ?
28349	What are some of the best pictures that showcase India ?
28350	Why are people against being allies with Russia ?
28351	Why are people so against working with Russia ?
28352	Will the Borneo Pygmy elephants die out if the Malaysian government collapses ?
28353	What parameters should we consider in linear regression and can someone explain the significance of each output parameter ?
28354	What books would you suggest for microbiology ?
28355	What is the best book for microbiology ?
28356	What are the chances of getting selected in IITs ?
28357	How many students from Assam get selected in IIT ?
28358	How are Arduino shields stackable ?
28359	Do I really need a shield to connect four servos to an Arduino Uno ?
28360	How we lose belly fat india ?
28361	How safe is Papua New Guinea , and how does it's crime rate compare to Belgium's ?
28362	How likely is it that life forms exist outside Earth ?
28363	What is the highest break that can be achieved in a game of snooker ?
28364	What is harder to do , a 147 break in snooker , or a nine-dart finish ?
28365	What the differences of Chinese and American culture ?
28366	Who is the President of India ?
28367	Who was the first President of India ?
28368	What's the inverse function ?
28369	What is inverse function ? What are some examples ?
28370	What kind of men are attractive to woman ?
28371	What kind of woman is attractive to most men ?
28372	Do Muslims think that Islam needs reformation ?
28373	`` Do you think Islam is under the phase of'' `` Islamic reformation'''' akin to the Protestant Reformation ? Why and why not ?''
28374	What's the meaning of 369 ?
28375	What does 3.3e-5 mean ?
28376	What is the best way to avoid cancer ?
28377	What are the best ways to prevent cancer ?
28378	Is it true that bananas are radioactive , and if you eat too many they can kill you ?
28379	If you eat too many shrimp can you get iodine poisioning ?
28380	What are the best places to go in Venice ?
28381	What are some places of interest in to travel to in Venice ?
28382	How do you reheat a peeled boiled egg that was refrigerated overnight ?
28383	How do you know when hard boiled eggs are done ?
28384	How can I keep the peace of mind ?
28385	How many photons can be emitted by a single electron ?
28386	Why does an electron absorb a photon ?
28387	What's the difference between the poor , middle class , and the rich ?
28388	What's the difference between rich vs middle class vs poor ?
28389	What is the true color of indigo ?
28390	If I were to overlay a green image over a blue image followed by overlaying it on a green image , would I get a true color image ?
28391	Can I use Jio sim in my 3G mobile ?
28392	What is a suitable solar panel installation provider near Riverside , California CA ?
28393	What is a suitable solar panel installation provider near Ridgecrest , California CA ?
28394	How can I buy bitcoins using my credit card by myself ?
28395	What is the easiest way to buy bitcoins using my credit card ?
28396	What is the difference between regular expression and regular grammar ?
28397	What is the difference between a * | b * and (a | b) * in regular expressions ?
28398	What dose it mean when you think about somone constantly ?
28399	How can Modi transform India ?
28400	Is Narendra Modi dangerous for India ? How ?
28401	What are the full implications of the Indian government's decision to withdraw all the old 500 and 1000 rupee notes from circulation ?
28402	Is there a limit to how many devices that can be lined to a Netflix account ? How about how many that can access it at the same time ?
28403	Why is the Netflix instant movie selection so limited ?
28404	What do you think of sharing economy ?
28405	What do you think about the sharing economy ?
28406	How do I find a good manufacturers representative looking to represent an EMS company in the northeast ?
28407	What is the career as a Medical Representative ?
28408	What is the difference between Shall and Will ?
28409	What is the difference between will and shall ?
28410	Why India is bad at Sports ?
28411	When/how did you realize were not straight ?
28412	At what age did you first realize you were gay/bisexual and how did you realize it ?
28413	How did Luxembourg become a wealthy country ?
28414	How does a nation become wealthy ?
28415	How do I hire a hacker ?
28416	Which is better intel i5 (6th gen) or i7 (5th gen) ?
28417	How the black money be recovered by simultaneously demonetising 500 , 1000 notes and introducing 500 , 2000 notes ?
28418	How can I delete my Facebook id ?
28419	How can I delete my fake Facebook ?
28420	What are the universities I should apply to with a GRE score of 281 for industrial ?
28421	Can I apply for universities with a GRE score of 281 ?
28422	My laptop works slow ! How to make it faster ?
28423	How do I make my laptop work fast ?
28424	What should I learn as someone approaching middle age from dead poets society ?
28425	Why do some people recreational smoke cleaning products ?
28426	Is there a legal alternative to overcome the Lok Sabha logjam ?
28427	How can we have petition over Lok Sabha logjam ?
28428	How many sponsored candidates are shortlisted for CMC vellore ?
28429	What is the office culture and woking at Patanjali office , haridwar ?
28430	What are the effects of banning Rs . 500 and Rs . 1000 notes on Indian economy ?
28431	What is your view about banning of 500 and 1000 rupees notes ?
28432	Should I tell my crush I like her ?
28433	Where can I make some online friends ?
28434	Is there a website where you can make online friends ?
28435	Teen Pregnancy : My 16-year-old son has just announced that his girlfriend is pregnant . Not only that -- they made a conscious decision to conceive a baby . I feel crushed , ashamed and defeated . Being told you are going to be a granddad is supposed to be a joyous occasion . Am I overreacting ?
28436	Arranged Marriages : I'm a 22-year-old guy who has never had a girlfriend . Am I missing something ? Is it too late ? Should I feel ashamed ?
28437	How many states in America wan na be independent ?
28438	What is the meaning of aanika ?
28439	How do I convert CGPA to a percentage ?
28440	How do they convert CGPA to percentages ?
28441	Contribution of higher education in make in India ?
28442	Could someone give me some real time example of naive Bayes as a predictor ?
28443	What happens if I drink bleach ?
28444	How extensive is U.K. Government support for startups ?
28445	Can I use a battery charger to use an automotive stereo in my house ? If not why ?
28446	What are some interesting places to visit in China ?
28447	What are the best places to visit in China ?
28448	Why is there so much corruption in the Indian judiciary ?
28449	How much corruption is there in Indian Judiciary ?
28450	What are some cool Uber ride hacks in India ?
28451	What are the best hacks while using Uber in India ?
28452	What can I do after my tenth grade ?
28453	What should I do after my 12th grade bio-maths ?
28454	How can I make every day $ 10 online ?
28455	How can I earn 10 $ per day online ?
28456	What is the difference between the two types of subroutines : Functions and procedures ?
28457	What is the funniest book that you have read ever ?
28458	I am a 35-year-old and I am planning to improve my smile through orthodontic treatment . Is this a right age for this treatment ? Will it be effective ?
28459	I am 25 years old and am planning to go for a PhD after completing a master's . What am I getting into ?
28460	How do I get rid of pimples on my face ?
28461	What is the difference between DDR , DDR2 , DDR3 and DDR4 RAM ?
28462	What is better , 1GB of 2666 MHz DDR4 RAM , or 4GB of 400 MHz DDR RAM ?
28463	Are black people under-represented on Quora ?
28464	Why are African/Black Americans under-represented on Quora ?
28465	How can I self-treat my social anxiety ?
28466	How is moderate to severe social anxiety treated ?
28467	How do you become an air traffic controller ?
28468	How does one become an air traffic controller ?
28469	Is it good to put CVT transmissions in an off-road car ?
28470	Which is a good car in the range of 2-3lacs on Delhi road ?
28471	What is the earliest written language ?
28472	What was the first written language ?
28473	How do I develop interest in studies ?
28474	How can I make studies more interesting ?
28475	Why do guys like to stare at girls ?
28476	Why do guys stare at girls in public ?
28477	Most Indians shop through their mobile . Is that true ?
28478	What is the best phone under 15000 Rs in India (2017) ?
28479	How many enterprises are there in the world ?
28480	How many enterprise exist in the world ?
28481	What are some examples of limited government in the Constitution ?
28482	Can you explain writ of constitution clearly with examples ?
28483	How do you know what is right to do ?
28484	How does one know what is right ?
28485	How do I create a blog on Quora ?
28486	How to creat a blog on quora ?
28487	Newton's third law of love ?
28488	Does love follow Newton's Third Law of Motion ?
28489	Is Lalu Prasad Yadav a genius politician or a joker ?
28490	Is Lalu Prasad Yadav a comedian in Indian politics ?
28491	Is bitcoin mining even worth it anymore ?
28492	Is Bitcoin mining still profitable in 2016 ?
28493	How should I talk to this girl in my college lecture class ?
28494	There is this cute girl in my class . How do I talk to her ?
28495	What are some substitutes for coconut vinegar ?
28496	How can an avalanche occur ?
28497	Why do avalanches occur ? How do they occur ?
28498	How much does it cost to get dreadlocks ?
28499	How much does it cost to get dreadlocks done in the UK ?
28500	How do I gain access to my gmail when I don't have access to the phone number or recovery email ?
28501	What do beggars think about ?
28502	Why did Bernie Sanders lose to Hillary Clinton ?
28503	Why did the USA choose Hillary Clinton over Bernie Sanders ?
28504	How do I deal with anger ?
28505	What's the most productive way to deal with anger ?
28506	What are the best techniques for off-page SEO ?
28507	What are the best techniques used in Off Page SEO ?
28508	India : What is the real conflict between Tamil Nadu and Sri Lanka ?
28509	Why don't Southern India and Sri Lanka form a new country ?
28510	Which is the best way of achieving a good GATE rank ?
28511	What can I achieve with a good GATE rank ?
28512	When will Moto G3 get Android N update ?
28513	What does $ 15 an hour for minimum wage really mean for the U.S. economy ?
28514	What is the outcome of a $ 15 minimum wage in the U.S. ?
28515	How did Harry Potter make Marge blow up and float away , if he didn't verbally/physically cast a spell ?
28516	Why didn't Harry Potter die at the end of the 7th book ?
28517	How can we prevent rapes in Delhi ?
28518	Is their any way to prevent rapes in Delhi ?
28519	How do I find the equation of the perpendicular bisector of a line segment with endpoints (-2 , -5) and (7,-1) ?
28520	Does the parabola y = 2x ^ 2-13x +5 have a tangent whose slope is -1 ? If so , find the equation for the line and point of tangency . if no , why not ?
28521	`` Is'' `` Can't Help Falling In Love'''' the same tune as'' `` Eres Tu'''' ?''
28522	`` Is the song'' `` Can't Help Falling In Love'''' the same tune as'' `` Eres Tu'''' ?''
28523	What is your opinion on Saudi Arabia's new law which declares all atheists are terrorists ?
28524	Does Saudi Arabia fund terrorism ?
28525	Are chess players really psychic ?
28526	Does chess players really psychic ?
28527	Is there any version of Age of Empires 2 for Mac OSX ?
28528	Why am I not able to play Age of Empires 2 ?
28529	What is the longest journey which you took in your life ?
28530	What was the longest travel journey that you did in your life ?
28531	Joseph Armethia ?
28532	Is Fleury losing the starting job to Matt Murray ?
28533	What is the best way to learn guitar without taking classes ?
28534	How do I learn playing guitar without formal training ?
28535	What is the difference between the prior and the posterior in statistics ?
28536	What is the difference between statistics and stochastic ?
28537	What is the best wax for beards ?
28538	What are the best beard wax products ?
28539	How can people believe that Earth is round ?
28540	Why can so many people believe , without question , that the Earth is round but not that it might indeed be flat ?
28541	How do I see who viewed my Instagram video ?
28542	How can I see who viewed my video I just posted on Instagram ?
28543	Why should you declaw a dog ?
28544	How can you get a dog declawed ?
28545	If there were an east pole and a west pole on earth where would they be ?
28546	Where is the east and west pole ?
28547	What is about the company ATOS ?
28548	What's good about working for an insurance company ?
28549	My answer was collapsed and I can't even appeal against it . What should I do ?
28550	How do I appeal a collapsed answer ?
28551	Is the Periscope app from Twitter Chromecast compatible ?
28552	What is the cost of developing periscope app ?
28553	Does Donald trump victory beneficial for India ?
28554	What does Trump victory means for Indian grads ?
28555	What are the best earrings for ears that seem to always be infected ?
28556	I have a bump on my ear from a piercing . I took out the earring . Now there's a little bump and blood and a little pus comes out the back . What can I do ?
28557	How can I get my boyfriend of 3yrs to spend more time with me ?
28558	Is milk vegetarian or non vegetarian ?
28559	Are eggs and milk considered vegetarian or non-vegetarian food ?
28560	What are the differences between Chinese culture and western culture ?
28561	What are the major differences between Chinese and Western culture ?
28562	Is it safe to buy an unlocked phone from eBay India ? What if I receive a defective product as the seller has specified no refund ? Should I buy it an HTC One m8 Verizon unlocked version ?
28563	I have forgot the screen unlock PIN code of my HTC , how can I unlock it now ?
28564	How can I replace my Apple headphones ?
28565	How do I replace Apple earbuds ?
28566	What is the height of a 4700 metre coconut tree ?
28567	How can I get rid of a woodpecker from a coconut tree ?
28568	How can we prevent ourselves from sleeping while studying ?
28569	Why do I not reach orgasm when using a condom ?
28570	How do you reach orgasm during sex when using a condom ?
28571	Why do men love anal sex with women ?
28572	Why do men like anal sex ?
28573	Do eCommerce sites like Door Dash , who take retailers menus and inflate the prices to their users and deliver them , pay sellers tax , or resale tax ?
28574	Does Uber take taxes out of the driver's pay or is the driver responsible to pay taxes ?
28575	Is there a way to get H1B sponsorship from US company directly without applying via consultancy ?
28576	Which companies provide H1B visa sponsorships to get a job in the USA ?
28577	Will digital marketing a good course to learn ?
28578	How can you tell if a Gucci bag is real ?
28579	How authentic are the bags for sale at the Gucci Online Outlet ?
28580	What do I do to make my hands fair and soft ?
28581	Why does PHP include not working any more ?
28582	When I rename index.html to index.php , why doesn't my website work anymore ? I know that the server (Apache) supports PHP .
28583	What should I do in my life ? I don't know what I want to achieve .
28584	What were the top key activitiesyou learned from Drucker ?
28585	Why Indian government abruptly announced the demonetization of 500 and 1000 rupees currency ?
28586	How should one prepare for Eurofins technical interview ?
28587	How do I prepare for a Technical interview ?
