test-448624	"Punishment: Why are some prison sentences life plus ""x"" years? (Life + 65 years, for example.)"
test-448625	"What does it mean when a criminal is given ""multiple life sentences"" or a ""life sentence plus 135 years""?"
test-448626	How will banning 500 and 1000 currency will help to reduce corruption?
test-448627	Replacing 500 and 1000 notes- how will this move reduce black money?
test-448628	Are eggs mostly good (HDL) or bad (LDL) cholesterol?
test-448629	Do eggs contain good or bad cholesterol?
test-448630	Do Indian women like to give blow jobs? Why? Why not?
test-448631	Who enjoys more sex men or women?
test-448632	If my iMessage goes from blue to green does that mean I'm blocked?
test-448633	How can you tell if someone blocked you in iMessage with latest OS 8?
test-448634	Why do people make life so complicated?
test-448635	Why is life getting complicated?
test-448636	Which colleges will accept an ST candidate with a 60 percentile in the 2016 CAT?
test-448637	What colleges should I apply for with a percentile ranging between 50-60 in CAT mocks?
test-448638	What is the best news app in India?
test-448639	Which is the best news app in Google play?
test-448640	What has been the most embarrassing moment in front of your parents?
test-448641	What are the awkward moment in front of your parents?
test-448642	How long will my transfer to Pakistan last?
test-448643	What else can we do of dead bodies rather than donating, buring and burning?
test-448644	Which is beeter option for MBA from India or Canada and why and what are the difference?
test-448645	Should I learn how to play the drums?
test-448646	What is the best phone to buy below 15k?
test-448647	India: What is the best phone to buy between (Rs, INR) 11-12k?
test-448648	Which branch can one opt for after clearing the GATE in mathematics?
test-448649	What are the options after clearing the GATE exam?
test-448650	What is the syllabus for math for MHT-CET 2016
test-448651	What is the syllabus for the MHT CET engineering 2016?
test-448652	What does the order of who views your story on Instagram mean? Why is one person always on top no matter when they view it?
test-448653	Can I know if someone viewed my Instagram page?
test-448654	What is best way to stop feeling wrong about being a single girl who is successful but yearns for a good relationship?
test-448655	Everybody says that if you don't like your job you should quit. Should you really do that if you feel so miserable about it or should you suck it up like an adult and wait until you find a new one?
test-448656	How did John F. Kennedy acquire a net worth of $1 billion?
test-448657	When do you think a single person's net worth will reach 100 billion dollars?
test-448658	What will be the biggest consequence of AI becoming smarter then humans?
test-448659	What are the most memorable backbenches jokes?
test-448660	Do Indian girls masterbate while watching porn ?
test-448661	Do Indian girls watch porn too?
test-448662	Can you tell me about Visakhapatnam?
test-448663	How can I improve my handwriting in a short period of time?
test-448664	How many people in the world are named Quadarius?
test-448665	How many people in this world have your Name?
test-448666	Where is the border of Northern California and Southern California located?
test-448667	Where does Northern California end and Southern California begin?
test-448668	"When an application says ""under review"" for more than a month, what does it mean?"
test-448669	"What does ""Under Review"" mean on my Amazon job status?"
test-448670	How can I start my own business without investment?
test-448671	How do I start a business from scratch with no money, no credit and no expert friends to help?
test-448672	Scientifically speaking what happens to vinegar when it's boiled?
test-448673	What happens to an old boil when hot oil is applied?
test-448674	What's the best way to attach a GoPro camera to a dog?
test-448675	What is the real use of GoPro cameras?
test-448676	Where can I invest my $100 savings for fairly profitable income?
test-448677	What does pleco fish eat?
test-448678	How do I know if I'm pretty?
test-448679	How do I know if I'm pretty or not?
test-448680	Which color shirt suits on purple pants?
test-448681	What color shirt should I wear with tan pants?
test-448682	How much time will it take to complete a B. Tech degree from AMIE in EE if I am eleigible for attempting SECTION B exams directly?
test-448683	Is AMIE is equivalent to degree and how many years it can take to complete the AMIE for diploma candidate?
test-448684	What should I reply after someone wishes me a happy Veterans Day?
test-448685	What is important for class 10?
test-448686	What is the difference between voltage and current?
test-448687	What is the difference between voltage and current in details?
test-448688	Why does video on Facebook buffer slower than video on YouTube?
test-448689	Which is more effective: sharing a YouTube video on Facebook or a Facebook video?
test-448690	What makes Quora so much more effective/reliable than other search engines like Yahoo! Answers?
test-448691	Why is the quality of content so much better on Quora than other Q&A websites like yahoo answers?
test-448692	Is there common ground between Science and Religion?
test-448693	What is the relationship between science and religion?
test-448694	Can a degree be restarted from the beginning after cancelling the previous one?
test-448695	Are any Americans jealous of the UK's NHS?
test-448696	Why should one join civil services?
test-448697	Which institute should I join for the civil service exam?
test-448698	Do you know anyone who experienced a miracle?
test-448699	What are the disadvantages of Bluetooth?
test-448700	How can India become an economic superpower?
test-448701	How can India become a superpower?
test-448702	What is the easiest way to learn English?
test-448703	What is the good way to learn english?
test-448704	How do I wank?
test-448705	How much do you wank?
test-448706	Does Samsung Galaxy Note II supports 4G?
test-448707	Can 4G work on Samsung note 3 Neo?
test-448708	Which azure certification should a beginner take?
test-448709	How difficult are the Azure certification?
test-448710	What are the job opportunity for internationals after MBA from US?
test-448711	What are the job opportunity for internationals after MBA from Insead Singapore?
test-448712	How can I be positive when Trump news/fear is constantly shoved in my face?
test-448713	Why is Donald Trump often in the news?
test-448714	What is a synonym?
test-448715	"What is a synonym for ""find out""?"
test-448716	What is the International House of Prayer and why could it be considered a cult?
test-448717	Is it different between P2O5 vs. P4O10?
test-448718	How is the formula for lead IV nitrate determined?
test-448719	How is the formula for lead (IV) phosphate determined?
test-448720	"Is Hinduism really a ""way of life"" or a ""philosophy""?"
test-448721	Is Hinduism a religion or a way of life?
test-448722	Why did Snape not publish his own potions book?
test-448723	Why didn't Severus Snape brew a love potion to make Lily fall in love with him?
test-448724	Why is it so difficult to imagine a new color?
test-448725	Can you think of a color other than ones we already have?
test-448726	What is the expected date for SSC-CGL 2016 Tier-1 examination? Could it be extended further to November?
test-448727	What is the expected cut off for SSC CGL 2016 tier 1 for general category? (owing to the easy question paper this year)
test-448728	Why did Amazon phase out Listmania over the past few years?
test-448729	How bad are things for Flipkart today (early 2016)? How are they competing with Amazon (on price, service, delivery, etc.)? How has that changed over the last year?
test-448730	Is there a place to get a free minecraft account without answering or getting a virus?
test-448731	Is there any website that can give you a free minecraft account without taking surveys?
test-448732	How companies can track website users without using cookies?
test-448733	How does Google track users without cookies?
test-448734	What is the solution of Kashmir problem?
test-448735	What's best solution between India and Pakistan over Kashmir issue?
test-448736	Which one is the best music app among Saavn, Gaana, Wynk, Hungama, and Guvera?
test-448737	What file format do Wynk/Hungama/Saavn/Gaana use for their songs?
test-448738	What are the benefits and side effects of drinking green tea?
test-448739	What are the side effects of drinking one green tea 5 days a week at 10:30AM?
test-448740	What is the best compliment to be given for a girl in a picture?
test-448741	How do I respond when someone gives me a compliment?
test-448742	Should I do a sexual relationship?
test-448743	How do people start a sexual relationship?
test-448744	What should I do to become a stand-up comedian?
test-448745	Can a stand-up comedian be called humorous?
test-448746	Is there any possibility to use drones in Indian agriculture?
test-448747	How can FPGA be used in Agriculture?
test-448748	How do I make life worth living?
test-448749	What can I do to make my life worth living?
test-448750	Is it wrong that I love only myself?
test-448751	If I love other person, I cannot love myself. How can I love myself and other person at the same time (Or have I chosen a wrong person)?
test-448752	What is the future of the Momentum faction within the Labour Party?
test-448753	How can teenagers establish more mature romantic relationships?
test-448754	What are the favorite hobbies to tell?
test-448755	What's your favorite hobby?
test-448756	What do I have to do to improve my writing skills?
test-448757	How can I improve my writing skills for blogs?
test-448758	Why is Avast considered a good antivirus?
test-448759	Why does Avast give free antivirus?
test-448760	What is the answer of this math probability question?
test-448761	What is the answer of this probability question?
test-448762	Can we use Jio sim as any other sim after welcome offer?
test-448763	What is it like to work at Thales as a software engineer?
test-448764	What are the best On/over ear Headphones around ₹3000?
test-448765	What are the best over the ear headphone?
test-448766	What should be the best resume title for a BTech fresher?
test-448767	What is a good account manager resume title?
test-448768	If Pokemon were real, in your opinion, what would be the most deadly Pokemon?
test-448769	What is the scariest Pokemon in your opinion?
test-448770	How can I earn money online for free?
test-448771	How do free online games earn money?
test-448772	What is the difference between expats and immigrants?
test-448773	What is the difference between expatriates and immigrants?
test-448774	What's your definition of beauty?
test-448775	What is the definition of true beauty?
test-448776	What do you think about Elon Musk's plans?
test-448777	How does it work when your 'guys' host another show (like Buck for Rush)? Do you encourage that?
test-448778	Which are the best filling machines manufacturing companies in India?
test-448779	Which are the top tiles manufacturing companies in India?
test-448780	Are certain people of the rightwing persuasion at Quora targeting Natalii Kai?
test-448781	Is Natalii Kai being harassed by rightwing Quora employees who don't like her answers?
test-448782	Is there a way to download MS Office free for my Windows 10 PC?
test-448783	How do I download Lava PC Suite for a Windows 10 PC?
test-448784	What can I do to stop a forced marriage?
test-448785	How do I get rid of a forced marriage?
test-448786	Why is it said that traveling in the speed of light would make time travel possible?
test-448787	Is time travel possible?
test-448788	How do I prepare for technical rounds in campus interviews?
test-448789	How do I prepare for my upcoming interview at GoFrugal Technologies' campus placement? Please be specific on how to prepare for the aptitude round.
test-448790	What is the funniest Alia and Rahul joke?
test-448791	How can we make Rahul Gandhi appear credible and respectable?
test-448792	Is it true that Japan is forced to import rice just to comply with the WTO rules though it doesn't need to import?
test-448793	What is the best import business from Japan?
test-448794	Is there any life in Mars?
test-448795	How do we detect life on Mars?
test-448796	Can I get call from any IIM If I score good in CAT? If yes, what minimum percentile would I need for ABCl?
test-448797	How much percentile do I need to get a call from IIM A, B or C?
test-448798	How can I improve my English as a French native speaker?
test-448799	How can I learn to speak English well in non-English environment?
test-448800	What is the difference between ROM and internal storage in mobiles?
test-448801	When a manufacturer tells you the phone has 8GB ROM, is there a particular structure on how you can identify how the memory is divided into the phone storage and internal storage?
test-448802	What are some resources about the technological background of Google Goggles?
test-448803	Where can I buy Hancock goggles?
test-448804	"What is the difference between ""Regards,"" ""Best regards,"" ""Sincerely,"" ""Yours Faithfully,"" and all of the other formulations? Which one is the best to use in North America in an email conversation?"
test-448805	What Is Your Best Strategy For Email Marketing?
test-448806	Which tank would win in a one-on-one battle: the Landkreuzer P.1000 Ratte or the M1A2 Abrams?
test-448807	Has ISIS put an M1 Abrams in service or have they captured a working one?
test-448808	How much would it cost to construct a 20,000sqft, two-story warehouse?
test-448809	How much would it cost to build a two-car garage with apartment on top?
test-448810	What are the major guidelines for patient history taking?
test-448811	Should I take two majors in university?
test-448812	What are the easiest punching bag combos?
test-448813	What are the best punching bags?
test-448814	How would Brexit affect India?
test-448815	How will Brexit affect India?
test-448816	How can I increase my English fluency?
test-448817	How can I be perfect in English language?
test-448818	What are the best government initiatives for tackling unemployment from around the world?
test-448819	Why shekhar failed in exam?
test-448820	What is the importance of the cell membrane in animal cells?
test-448821	What is the importance of the cell membrane?
test-448822	Why do Americans make fun of Canada?
test-448823	Why do Americans make fun of the French?
test-448824	Will the Nintendo Switch support Wii remotes?
test-448825	What are the details of the hemp vs cotton war in ancient Egypt?
test-448826	How does Quora decide which topics to suggest for a question?
test-448827	How does Quora decide the topic of the questions?
test-448828	Why was Muammar Gaddafi killed?
test-448829	How did Muammar Gaddafi die?
test-448830	What's an affiliate link?
test-448831	What do affiliate links to Amazon look like?
test-448832	Is lactose intolerance curable?
test-448833	Is it possible to become lactose intolerant after being normal for 23 years? Is there a way to stop it?
test-448834	How do I learn hardcore programming in C and Java being a beginner?
test-448835	How can I learn C# as a beginner?
test-448836	How do you get rid of brown scars?
test-448837	How can you get rid of the appearance of scars?
test-448838	What are the three constitutional forms of soveriegnty?
test-448839	How could we change the Georgia constitution to let teachers form unions?
test-448840	What is a good website for free books?
test-448841	Where can I find good books for free?
test-448842	Why do I perceive some black people as loud?
test-448843	Are Chinese people racist against black people?
test-448844	How many days does it take for a printing before being dispatched?
test-448845	My passport has been printed on 10/10/2015 and today is 20/10/2015 and still my passport has not been dispatched. What may be the reason?
test-448846	I just installed a graphics card and there is no video output. Why is that?
test-448847	I ordered a laptop lacking video card NVIDIA GeForce. It has an Intel HD Graphics 620 with 16GB of RAM. Is it fast for video editing & gaming purpose?
test-448848	Is the history of browsed videos in a YouTube mobile app saved in a public WiFi router?
test-448849	If I’m using incognito mode in my mobile browser through WiFi, Is it possible to monitor the browsing history?
test-448850	I see opposing NFL players talking to each other between plays. Is it smack or (like in Bull Durham) is it about topics outside the game?
test-448851	Which NFL player holds the record for the most games played?
test-448852	Is vaginal sex better than anal sex?
test-448853	Is it better than vaginal sex?
test-448854	What do Bangladeshi youth think about India?
test-448855	What do Bangladeshis think of India?
test-448856	How can I make people in my region follow traffic rules?
test-448857	Why don't people follow traffic rules?
test-448858	Why is the cross an important Apache tribe symbol? What does it mean?
test-448859	Why is the bird track an important Apache tribe symbol? What does it mean?
test-448860	What is the best neuroscience free online courses?
test-448861	What is the most interesting course offered for free online?
test-448862	Why do the Olympic winners bite their medals?
test-448863	Why do olympic medal winners, bite their medals?
test-448864	Why is cement packed only in 50 kgs?
test-448865	How much time can courts take to resolve disputes that involve information security?
test-448866	What is RamNath optical modulator?
test-448867	Is it ok to add date and time on a website page?
test-448868	What is Moe in anime?
test-448869	"What does ""moe"" mean in the context of anime?"
test-448870	What is the purpose of putting eye shadow and make the eyes look dark? Is there any evolution theory in favor of darker eyes?
test-448871	What makes cats' and dogs' eyes glow in the dark?
test-448872	Will there be a Star Wars 10, 11 and 12? Or will it stop with the 9th?
test-448873	What are the top 10 Sith lords in Star Wars?
test-448874	What did Darth Sidious think of General Grievous?
test-448875	180amper battery how much time to full chaged?
test-448876	"Can a 15 year old girl who's 5""0 grow 5 inches?"
test-448877	I'm 15, is there any way to maximise my potential height and grow faster and taller?
test-448878	What are the laws covering the pistol grip shotgun?
test-448879	Which firearm is more effective against an attacking bear: pistol, rifle, or shotgun?
test-448880	Could you help me find a specific online medical video site?
test-448881	Can you help me find a specific online medical video site?
test-448882	"Who is more powerful in ""The Lord of the Rings"", Galadriel, Saruman, or Gandalf the White?"
test-448883	Was the One Ring more powerful than Gandalf and Saruman ?
test-448884	Why does Bhishma not permit karna to fight the Mahabharata war as long as he was the commanded in chief of the kaurav army?
test-448885	"No Fat Diet: In 1993 Dr. Dean Ornish published a book called ""Eat More, Weigh Less"". Is his book, his advice and the ""No Fat Diet"" still valid today?"
test-448886	What's wrong with Nietzsche's philosophy from a modern perspective?
test-448887	Is symbolic thinking philosophy? Are they related? In what way(s)?
test-448888	How do you know when you really love someone?
test-448889	How do you know that you are fallen for the love at first sight?
test-448890	Why did Brazil lose its 2010 World Cup quarterfinals match?
test-448891	Why did Brazil lose to Germany in the 2014 World Cup semifinal?
test-448892	How can I recover my old gmail account without having a back up email or the mobile number provided?
test-448893	How do I recover my Gmail account password without a recovery email or the security question?
test-448894	What's the most popular dance style in India?
test-448895	What's the most popular dance style?
test-448896	How is the campus & social life of Manipal University, Jaipur?
test-448897	How is Manipal University, Jaipur?
test-448898	Is someone born in 2003 considered a millennial?
test-448899	Am I a millennial if I was born in 2001?
test-448900	Why do I need Aadhar when I already have a passport and a voter ID card to prove my identity?
test-448901	I'm an Indian. Can I produce my Aadhar Card as an ID proof for TOEFL on the exam day?
test-448902	How is i5 4th gen for gaming?
test-448903	Which one is best for gaming: an I5 4th gen and 4GB graphic card DDR3 or an I5 5th gen and 2GB DDR3?
test-448904	What is the history of the Spanish language?
test-448905	Where can I find a summary of the history of the Spanish language?
test-448906	Do Indian Muslims have to leave this country?
test-448907	Do Indian Muslims want to convert India into an Islamic country?
test-448908	How do we choose?
test-448909	How do you choose not to feel? Can you?
test-448910	How do I know if my English is good or not?
test-448911	How can I learn if my English is not good?
test-448912	You have just murdered someone, where would you hide the body?
test-448913	What happens if a child murders someone?
test-448914	What are the best online tutorials for database management systems?
test-448915	What are the best books on database management systems?
test-448916	How can I download and use torrent for movies?
test-448917	What is the best way to download a movie not available in torrent?
test-448918	How can I go from upper-intermediate to advanced in English in only one month?
test-448919	How can I go from upper-intermediate to advanced in English in 4 months?
test-448920	How do I become more articulate and aggressive?
test-448921	How can I become more articulate?
test-448922	Why is my dog vomiting and shivering?
test-448923	My dog is constipated and vomiting, what should I do?
test-448924	What are the chances of CKWL 12 ticket getting confirm?
test-448925	What are the chances to sleeper ckwl 18 ticket will be this ticket confirmed, will amount be refunded?
test-448926	How would you feel if you shot your parent because they thought you were an intruder?
test-448927	How would you feel if your child shot you because they mistakenly thought you were an intruder?
test-448928	Do you have a hydraulic cone crusher in Kenya?
test-448929	Are there hydraulic cone crusher vendors in Romania?
test-448930	How many feet are in one mile?
test-448931	How many feet are there in a meter?
test-448932	Where do you advertise to find a M.C.A. in India?
test-448933	What is the history of advertising and advertisements in India?
test-448934	What advice would Awdesh Singh sir give to an 22 year old UPSC aspirant?
test-448935	I have graduated from civil engineering. I'll apply for MBA(Finance) in Australia. After graduate will it hard for me to get work visa?
test-448936	What is the best method to seduce a German girl/woman?
test-448937	How do you impress a German girl?
test-448938	How many missions did a Soviet fighter pilot used to fly before getting shot down?
test-448939	How many times do fighter aircraft get refueled during a mission?
test-448940	Home/Office/Car Relocation/Loading/Unloading for Contact Now Movers5th.in?
test-448941	Why Many Company Ask For BTech BE In Computer tester?
test-448942	What are the career options after studying PCM in 10+2?
test-448943	What are the careers options in humanities and in PCM?
test-448944	Which all CPA Offers or Niches / Verticals Convert BEST on Facebook CPC Traffic? Please Help
test-448945	How do I block lower paying ads on AdSense? Does it help to improve CPC & RPM for the site?
test-448946	Which colors combine to make brown?
test-448947	What colors mix to make orange?
test-448948	Which are the best online dating sites for Indians?
test-448949	What are the best dating sites in the USA for Indians?
test-448950	Food: Why are people still eating McDonald's food?
test-448951	Do people in Canada eat spicy food?
test-448952	What are some of the biggest and best hospitals in America?
test-448953	What is the best hospital in America?
test-448954	Can both we take mass gainer and whey protein?
test-448955	Should I take a mass gainer or whey before bed?
test-448956	What are the most and least Christian countries in Europe?
test-448957	Is the United States of America a Christian nation? Why or why not?
test-448958	Why is simplicity so complex?
test-448959	Is simplicity the tentative abridgement of complexity?
test-448960	Why can't we post questions in another language?
test-448961	Does content on Quora need to be written in English?
test-448962	What are the ballscrew testing methods and equipment?
test-448963	What are other methods for usability testing besides crowdsourced testing?
test-448964	How long does it take to get a Dubai visa ?
test-448965	How long does it take to get a tourist visa for Dubai?
test-448966	How many states can quantum bits have and what are they?
test-448967	How do the current quantum computers store quantum bits?
test-448968	Can salt and saliva break a glass?
test-448969	What does it mean if i keep on breaking glass items?
test-448970	Did you ever have bad luck after a black cat had crossed your way?
test-448971	Luck: What is the luckiest business break ever?
test-448972	How can I break up with someone I love but don't love me?
test-448973	How do you break up with someone you truly love?
test-448974	Is Fallout 4 better than Fallout 3?
test-448975	What is the goal to achieve in Fallout 4?
test-448976	Is there anything worth reading on the Warrior Forum?
test-448977	What posts on warrior forums (or anywhere else on the Internet) will help me to be successful at affiliate marketing?
test-448978	Is there a cure for maladaptive day dreaming and dissociative disorder?
test-448979	What is the best way to be independent in any situation?
test-448980	What is the differance in Job profile of ME biomedical engineering verses MS BME?
