199682	If you could ask God three questions , but not ask if he/she exists or ask him/her to answer more questions , what would they be ?
199683	If you could ever ask God 3 questions , what would they be ?
199684	How is life at nliu Bhopal ?
199685	How is the life at NLIU , Bhopal ?
199686	Why is memory important ?
199687	Why are memories important ?
199688	I want to start a mobile phone case making business how I can start ? And what are the requirements ?
199689	I want to start a mobile phone case making business how I can start ? And what are the requirements
199690	What are some interesting facts about an astronaut ?
199691	What are some interesting facts about astronauts ?
199692	What is the best Antivirus software to be installed for my Android phone ?
199693	If you had the power to cause anything to happen , what would you cause to happen ?
199694	Can I get a CS at LNMIIT Jaipur with 160 marks in the JEE Mains ?
199695	Is sodium an element or a compound ?
199696	Is sodium a element ?
199697	Is it possible to prepare for UPSC while working in a job ? If so , how ?
199698	Is it possible to prepare for UPSC while working ?
199699	Who invented the internet and how ?
199700	Do we need a President of the United States ?
199701	Does the United States need a President ?
199702	How can I make my life a beautiful artwork ?
199703	How do I quickly get over someone who didn't love me ?
199704	How can some people get over someone they love so quickly ?
199705	What and Who is God ?
199706	Why does the hair become white ?
199707	Can Magneto control light ?
199708	Since Magneto is the master of magnetism , shouldn't he be able to control light ?
199709	What does one do with a PhD in psychology ?
199710	What can you do with a PhD in Psychology ?
199711	I'm an ECE student , 2nd year completed . What should I do in order to go to abroad for higher studies ?
199712	What should I do to go abroad for my higher studies ?
199713	Who is the Archangel Michael ?
199714	Who is St. Michael ?
199715	At what speed will a speed camera (UK) not be able to catch you ?
199716	How fast would I have to drive (theoretically) to make it so that a speed camera couldn't catch me ?
199717	How can I get rid of a stink bug smell ?
199718	Should the U.S lower the corporate tax rate ?
199719	Should Federal corporate tax be lowered ?
199720	How is Avanse ? Can I take an education loan from them ?
199721	Is it safe to take education loan from avanse ?
199722	What is the procedure to transport a bike to Bangalore from Hyderabad by train ?
199723	Is Donald Trump considered a feminist ?
199724	Is Donald Trump a feminist ?
199725	What is your favorite werewolf movie ?
199726	What's your favorite werewolf movie ?
199727	How do I stop being so gullible ?
199728	Which are the best motivational videos ?
199729	How are passive and active transport different ?
199730	How do passive transport and active transport differ ?
199731	Does any airline company use WhatsApp as a customer support tool ?
199732	Does any airline use WhatsApp as a customer support tool ?
199733	Why was India invaded by foreigners ?
199734	Why was India invaded so many times ?
199735	How long does it take to install Windows 10 ?
199736	How long does it take to upgrade to windows 10 ?
199737	What is most difficult thing about learning English for non-native speakers ?
199738	What aspects of English do non-native find difficult ?
199739	Can the White House be vulnerable to a blackout ?
199740	Does the White House ever experience a power blackout ?
199741	How is the Modi government faring at the national level ? What changes has it brought about after coming to power ?
199742	What is the best advice your father ever gave you ?
199743	What is the best advice ever your father gave you ?
199744	How can humanity adapt to the long term impact of Climate Change ? For what reasons should we hold out hope that our species will adapt and survive ?
199745	How will humans adapt to climate change ?
199746	How can one do a thought experiment ?
199747	Is it possible to do a thought experiment ?
199748	What's your best shoplifting story ?
199749	What's your shoplifting story ?
199750	How can I promote my online business ?
199751	Can one change his/her additional subject in CBSE Class 12 ?
199752	Can I change my optional subject from maths to physical education in class 12 cbse ?
199753	What is the employee discount for Amazon employees ?
199754	What are pesticides and fertilizers used for ?
199755	How are pesticides and fertilizers alike ?
199756	Which is the best sports bra ?
199757	Which one is the best sports bra ?
199758	What are the things to keep in mind when having sex for the first time ?
199759	What are things one should keep in mind while having sex for the first time ?
199760	What does a compiler make ?
199761	What does compiler do ?
199762	How should I improve my height ?
199763	What can I do to improve my height ?
199764	How do I launch a new product in the market ?
199765	What are the strategies to launch a new product into the existing market ?
199766	How can you be a successful musician ?
199767	How can I become a successful musician ?
199768	How do you contact EA Sports ?
199769	What are some ways to contact EA Sports ?
199770	What is the need of caste based reservation in the education system of India ?
199771	Is there any need of reservation in education based on caste reservation ?
199772	What is Hepatitis B ? Can it be deadly ?
199773	How deadly is Hepatitis B ?
199774	What's the difference between autism and schizoaffective disorder ?
199775	Can autism be confused with schizoaffective disorder ?
199776	Is Rogue One better than The Force Awakens ?
199777	Which movie is better , The Force Awakens or Rogue One ?
199778	What is one thing you miss the most ?
199779	What is the thing you miss most ?
199780	What does it take to become a politician ?
199781	What does it take to become a good politician ?
199782	Is Japanese or Chinese harder to learn ?
199783	Which language is harder to learn : Japanese or Chinese ?
199784	How corrupt is India ?
199785	How rampant is corruption in India ?
199786	Why is Christopher Columbus important to history ?
199787	How is Christopher Columbus important in history ?
199788	I want to be a poet what should I do to get my poems published ?
199789	I am a budding poet and I want to get published . Where do I begin ?
199790	Why is the Indian stock market falling since PM Modi's demonetisation move ?
199791	Why is stock market (sensex) falling after the demonetisation of 500 and 1000 notes ?
199792	Why do you believe in ghosts and the supernatural ?
199793	How do I know when I've fallen in love ?
199794	How do I know if I have fallen in love with someone ?
199795	How does a bactrim treat a staph infection ?
199796	Is there any difference in the results from practicing mindfulness meditation vs using guided meditation ?
199797	What is the difference between the yogic path of meditation and the Zen path of meditation ?
199798	Can I install Mac OS on my Dell laptop ? How ?
199799	How do I install Mac OS on a Dell laptop ?
199800	Which is the best private medical college in mp ?
199801	Which is best private medical college in MP ?
199802	Which is the best country to do MS in ECE ?
199803	Why are you following me ?
199804	Why are you follow me ?
199805	How can you calculate pressure under water ?
199806	Why is my EarthLink so slow ?
199807	Why is EarthLink so slow ?
199808	What are some of the strange habits that you have ?
199809	Can a court judge in New York force my husband to give me Islamic divorce after he grant the civil divorce ?
199810	Should the US let Japan have nuclear weapons to balance China ?
199811	Should Japan be allowed to develop nuclear weapons to maintain balance of power in Asia ?
199812	How does conciousness create reality ? Is it proven scientifacally ?
199813	How does the mind create reality ?
199814	What are some good beef jerky recipes ?
199815	What is a good beef jerky recipe ?
199816	What is a sin ?
199817	Who was Napoleon Bonaparte ? What did he do ?
199818	Who was Napoleon Bonaparte ?
199819	How can one cope with the loss of a loved one ?
199820	How did you cope with the loss of a loved one ?
199821	What is the best way to control the use of credit cards ?
199822	What is the use of credit card ?
199823	How do I stop wasting money ?
199824	What is the best way to stop wasting money ?
199825	What is it like to study at McGill University ?
199826	How can I become a class topper ?
199827	How should I become a topper in my class ?
199828	I have one year for preparing for CAPF AC 2017 . how should I prepare for Written , medical test as well as Interview ?
199829	How do you add and subtract in binary ?
199830	How to become a dentist ?
199831	How do I become a dentist ?
199832	Who was the first emperor of a united India ?
199833	How is group theory used in Neuroscience ?
199834	Are there (existing) applications of group theory in neuroscience ?
199835	Why does the mass of a electrodes change when voltage is increased ?
199836	How does the mass of a electrodes change when voltage is increased ?
199837	What transformations does Facebook with uploaded images ? jpeg quality ? sharpness ?
199838	What JPEG compression library does Facebook use ?
199839	Which are best colleges in India for supply chain management ?
199840	What's the best supply chain management course in India ?
199841	Who is that one fictional character you want on Quora answering questions ?
199842	Which fictional character you wish was on Quora ?
199843	What are IT project manager best traits ?
199844	What are an IT project managers best traits ?
199845	What is the best mic to record vocals ?
199846	What are the best microphones for singing and recording vocals ?
199847	What should Satoshi Nakamoto do with ` his' Bitcoins ?
199848	What has Satoshi Nakamoto done with ` his' Bitcoins ?
199849	Which YouTube channel has the most subscribers ?
199850	How do I train myself to think & work like Elon Musk to achieve greatness ?
199851	How does one think and work like Elon Musk ?
199852	How does gravity induce a time difference as it does in Interstellar ?
199853	Is it bad for a 19 year old to date a 17 year old ?
199854	Can a 19 year old date a 17 year old ?
199855	Do the colors of pigments in a leaf correlate with the color of the leaf ?
199856	Do the colors of leaf pigments have anything to do with the color of the leaf ?
199857	What is the best Telugu book for everyone ?
199858	How is anaerobic and aerobic respiration similar ?
199859	How do aerobic and anaerobic respiration compare ?
199860	What do you think is Forex Trading so much risky ?
199861	What do you think is forex trading is risky ?
199862	What are some special cares when you have a dry throat and a runny nose ?
199863	What causes a dry throat and a runny nose ? How should it be treated ?
199864	Does Antarctica have oil/gas deposits ?
199865	Does Antarctica have oil ?
199866	Why are people afraid of success ?
199867	Why some people are afraid of success ?
199868	What are good languages for machine learning ?
199869	What is the best language for machine learning ?
199870	What is the best way to find out how many people search for specific keywords online ?
199871	How do I find out what people are searching for online ?
199872	How do I reduce cellulite on my butt ?
199873	What will be the impacts on Indian economy after the Prime Minister's decision of barring the 500 and 1000rs notes ?
199874	How's the Tata DoCoMo wired broadband ? Do they provide that much speed as they promise and how's their service ?
199875	How's the Tata DoCoMo wired broadband ? Do they provide that much speed as they promise ? How is their service ?
199876	A genie just granted you a wish . What are you going to wish for ?
199877	Which TIME coaching center is the best in Bangalore for the CAT ?
199878	Which is the Best TIME coaching centre for CAT in Bangalore ?
199879	What are the best fiction novels ?
199880	Which are best fiction novels ?
199881	How different would the world be if Hitler never existed ?
199882	How would the world be different today if Hitler had never born ?
199883	Why can't US legalize prostitution but they can legalize gay marriage ?
199884	Why can't the US legalize prostitution but they can legalize gay marriage ?
199885	I had sex last night with my girl but now I am not feeling anything about her . I guess I have lost interest on her , so what should I do ?
199886	I had sex last night with my girl but now l am not feeling anything about her . I guess l lost interest on her , so what should I do ?
199887	Does a fan consume less electricity (save my bill) if it works on 1 speed rather than 5 or maximum ?
199888	Why does the Quora algorithm repeat the same question in the feeds ?
199889	How can I become a Nascar driver ?
199890	How does one become a NASCAR driver ?
199891	What is a weak minded individual ?
199892	What makes someone a weak minded individual . ?
199893	In a cellphone , what allows you make an emergency call even if there is no SIM card installed ?
199894	If a cell phone doesn't have a SIM card , how can it make emergency calls ?
199895	How can I teach myself machine learning ?
199896	How should I teach myself either of Machine Learning & Data Science ?
199897	Why did the Greeks call themselves Romans ?
199898	Why did the Greeks call themselves Romans in the Middle Ages and until recently and their language as well ?
199899	How do I follow others on Quora ?
199900	How have the planets been named ?
199901	How did the planets get their names ?
199902	What does it means when couple doesn't meet up ?
199903	what does it means when couple doesn't want to meet up at all .
199904	Why is the gap between the theatrical and DVD release of a movie getting shorter ?
199905	Why is the gap between theatrical and DVD release of a movie getting shorter ?
199906	How many clothes canyou make limited or unlimited ?
199907	How many clothes can the clothes company make limited or unlimited ?
199908	Is dark matter the luminiferous ether ?
199909	Is dark matter the ether ?
199910	What would happen if you shot a gun while in space ? Would the bullet keep traveling at the same speed ?
199911	Will the world end in 2016 ?
199912	How can I be a designer ?
199913	What is the best way to be a designer ?
199914	Why does only royal Enfield has amper gage ?
199915	Why do only Royal Enfield motorcycles have an ampere gauge ?
199916	Who is the most popular person on Quora ?
199917	Who is the most popular person answering questions on Quora ?
199918	Is the American School System failing American children ?
199919	How long is this planet (Earth) going to last ? What are the predictions ?
199920	How long will earth last ?
199921	What will happen if someone died in the ISS ?
199922	How can you make Saravana Bhavan Pongal ?
199923	How can you make Saravana Bhavan's pongal ?
199924	Where can I make gay friends online ?
199925	How/where can I make gay friends ?
199926	What is the best job portal in India , and why ?
199927	How do money orders work ?
199928	What are money orders and how do they work ?
199929	In economic terms , what is a zero sum game ?
199930	Which are the best books for reference for JEE Mains ?
199931	What are the best book which I follow for Jee Mains exam ?
199932	What do you think of banning 500 / - & 1000 / - notes in India as it is a sudden decision with out any prior information and required time ?
199933	What should I do to make my aptitude strong ?
199934	How can I make my aptitude strong ?
199935	There are always people who say that they don't trust Wikipedia sources . What does Jimmy Wales have to say ?
199936	Why is it healthy to crack your back ?
199937	Is it safe to crack your back ?
199938	What should Every Programmer Know about Software Testing ?
199939	What should beginner programmers know about software testing ?
199940	What should be taught to kids ?
199941	What should be taught to children ?
199942	How and why we dream within a dream ?
199943	Can you really have a dream within a dream ?
199944	What if India becomes a cashless economy ?
199945	What will happen if India becomes a Cashless economy ?
199946	What is the most painless and peaceful way to kill yourself ?
199947	What is Google adsense ?
199948	What is Google Adsense all about ?
199949	What is the best stylus pen for handwriting (not drawing) on an iPad ?
199950	What is the purpose of existence of this universe ?
199951	What is purpose of existence of universe ?
199952	What are some of the best Telugu poems ?
199953	What's happening to Hong Kong ?
199954	How should you handle aggressive behavior from German Shepherd dogs ?
199955	How can we control German Shepherd aggressive behavior ?
199956	What are some mind blowing water gadgets ?
199957	What are some mind blowing water gadgets that most people don't know ?
199958	What is the best YouTube documentary ?
199959	Does everyone go through existential crisis ?
199960	Does everyone have an existential crisis at some point in their lives ?
199961	Is project manager and project engineer at IIT Bombay working under Prof Ganesh Ramakrishnan involved in criminal activities ?
199962	What's the best gift you ever gave to yourself ?
199963	How do we know if a person is suffering from hiv aids ?
199964	What are the most entertaining movies of all times ?
199965	What are some of the most entertaining movies ?
199966	What annoy you the most ? And why is that ?
199967	What annoys or irritates you the most ?
199968	Does coffee stop or interfere with sleeping ?
199969	Coffee can interfere with sleep at night ?
199970	How can I become serious in life ?
199971	Why is not the virgin Mary among the holy trinity ?
199972	`` Why is not the virgin Mary among the holy trinity'' `` In the name of the father , the son , the mother'' `` Mary'''' , and the holy spirit , one God'''' ?''
199973	What are some common examples of computer hardware components ?
199974	What will be the effect of note ban in real estate ?
199975	Which books should I read to understand international relations ?
199976	Which book should I read to understand international relations ?
199977	Why do I feel ugly ?
199978	Why do I feel so ugly ?
199979	What is a good architecture dissertation topic ?
199980	Are humans naturally vegetarian ?
199981	Is human body vegetarian ?
199982	There are brilliant minds out there who change the whole context of one's questions . How can I avoid people from editing my questions on Quora ?
199983	Which is the best packers and movers company ?
199984	Which is the Most reliable Packers and Movers Company ?
199985	Which Olympic Games were the best ?
199986	What are some sexiest lesbian movies ever made 
199987	What is the sexiest lesbian movie ever made ?
199988	Is Virat Kohli a good player ?
199989	Is Virat Kohli a good fielder ?
199990	Was Lee Kuan Yew a dictator ?
199991	Are there any black Amish ?
199992	Are there black Amish people ?
199993	How was Newton's gravitational constant (G) determined ?
199994	How was Universal Gravitational Constant first measured ?
199995	Most of Indonesia is Muslim , so why is Bali Hindu ?
199996	Why is Bali still predominantly Hindu ?
199997	How do I increase my number of push ups ?
199998	How do you increase the number of push ups you can do ?
199999	What do Americans think of China & Mainland Chinese people ?
200000	How do Americans think about Chinese ?
200001	How random is DNA ? What are the chances of two people ever having the same DNA , probability wise ?
200002	Could two people have the same DNA by chance ?
200003	What are the best things to do in Pune ?
200004	How can I get emotionally strong ?
200005	Where did you have the best Biryani at Kolkata ? Which Biryani was that ?
200006	Where do you get the best Biryani in Kolkata ?
200007	What are some of the applications of a 3 phase induction motor ?
200008	What is the application of a 3 phase induction motor ?
200009	What are some examples of non-biodegradable waste ?
200010	What are some examples of non biodegradable waste ?
200011	Is there a difference between mughals and Muslims ?
200012	What is the difference between Muslims and Mughals ?
200013	What do you think about Barcelona vs Real Madrid this season ?
200014	What do you think about the Barcelona vs Real Madrid match today ?
200015	Who was the youngest pregnant girl ?
200016	Who is the youngest mother in the world ?
200017	How strong would be privacy laws of Poland if it wasn't part of EU ?
200018	How strict would be privacy regulations in Slovakia if it wasn't part of European Union ?
200019	Which is the best coaching center for history optional in delhi ?
200020	Which is the top question on Quora ?
200021	What are Quora top questions ?
200022	How do I buy a bitcoin ?
200023	Which is the best city in the world to live in ? Why ?
200024	What if Chandler Bing was Siri ?
200025	What if Chandler Bing is a Siri ?
200026	How can allergies be cured ?
200027	Can allergies be treated ?
200028	Can I have java 6 and java 8 on the same machine and switch between them ?
200029	How do I run java 6 & java 8 on the same Machine (Mac) ? I want java 8 by default , but at times I will need java 6 ?
200030	Why do so many republicans despise environmentalism ?
200031	Why do Republicans object to environmentalism ?
200032	Is Germany the best place to do MS in pharmacy ?
200033	Is Germany the best place to do an MS in Pharmacy ?
200034	Do white girls like brown men ?
200035	Do white girls like brown boys ?
200036	Can an idea be patented ?
200037	In what direction could I keep my head pointed while sleeping ?
200038	How does livestock grazing renders land barren ?
200039	How does grazing by livestock render land barren ?
200040	Can I make my own programming language ?
200041	Is it possible to make your own computer language ?
200042	How can I get back deleted WhatsApp messages ?
200043	How can I get back my deleted whatsapp messages ?
200044	How do I stop being jealous of my ex ?
200045	Have you ever visited Switzerland ?
200046	Have you ever been to Switzerland ?
200047	Why doesn't the Quora app have a night mode or a dark theme to ease the eyes while reading at night ?
200048	What are the best R rated movies ?
200049	What are some of the best R rated movies ?
200050	Why do schools spend so much on athletics ?
200051	Why do colleges spend so much money on athletics ?
200052	I am 16 years old and I want to become a professional footballer ? What should I do ?
200053	I am turning 16 now and I want to become a professional footballer ? What should I do ?
200054	Is there any scientfic evidence for psychic ability ?
200055	What is it like to live in Hyderabad alone ?
200056	New ant farm ants stopped digging now , they rarely come out of soil and are not visible under the earth . Are they dead ?
200057	Just got ant farm ants dug for while stopped now rarely come out not visible . Are they dead ?
200058	Why aren't my Facebook messages being delivered ? We're friends on Facebook and she has been online multiple times since sending .
200059	Why are my `` delivered'' Facebook messages not `` seen'' even though the recipients have been online recently ?
200060	Is it okay to upvote very long , researched answers just to keep the person motivated , though the answer is not interesting to you ?
200061	How do you teach and guide a child to value and respect time ?
200062	Why are handicraft popular ?
200063	Are handcraft popular ?
200064	Why do many people lack basic manners nowadays ?
200065	What are the basic manners that people lack nowadays ?
200066	How do I find my passion and career ?
200067	How can I make my passion my career ?
200068	Which university is considered as the best medical university yin Ukraine ?
200069	Which university is considered as the best medical university in Ukraine ?
200070	What are technical interviews like ?
200071	What is it like to be in a technical interview ?
200072	How do I apply for an internship at Amazon (India) ?
200073	How does one apply for summer internship at Amazon India Development Center ?
200074	What are some of the types of frictions ?
200075	How many types of friction are there ?
200076	How do I earn money now ?
200077	Can I get a loan against my mineral rights ?
200078	How do I get a loan against my mineral rights ?
200079	What is the basis of the combination of Greek letters in naming fraternities ?
200080	How are letters chosen in the Greek sorority and fraternity system ?
200081	How can I set a song as ringtone on iPhone ?
200082	How can I set a song as a ringtone on my iPhone easily ?
200083	Is there a relation between Pure ` O' OCD and high intelligence ?
200084	Is there a link between Pure-O OCD and high intelligence ?
200085	Where do banks store their money ?
200086	Where/How do banks store their money ?
200087	What happens when a wife is older than a husband ?
200088	Will Donald Trump be the first US President not to accept his salary ?
200089	Will Donald Trump be the first US president who refuses presidential salary ?
200090	Are all men visual creatures ?
200091	Are men visual creatures ?
200092	How do you know if you have a bad idle air control valve ?
200093	What are signs that you have a bad idle air control valve ?
200094	What is forced migration ? What are some examples ?
200095	What are some examples of forced migration ?
200096	Which is the smallest unit of time ?
200097	What is the smallest unit of time ?
200098	How do I delete myself from the Internet ?
200099	`` How do you convince the upcoming generation that'' `` Education is The Key of Success'''' when we are surrounded by poor graduates and rich criminals ?''
200100	How do you convince the upcoming generations that education is the key to success when we are surrounded by poor graduates & rich criminals ?
200101	According to you , what is Love ?
200102	What is qualitative observation ?
200103	What is a qualitative observation ?
200104	What are unknown facts about World War 2 ?
