294024	How do you handle complex situation? How do you solve your problems in complex situation? Is it right to share your problems with your friends?
404472	How can democracy be improved?
404473	How can democracy improve?
536866	"How is the word ""sufficient"" used in a sentence?"
78031	How do I earn money through online in India?
273509	What is the break even point for Reliance Jio?
496061	Will there be a fifth Indiana Jones movie?
496062	Will there be another Indiana Jones movie?
261649	How High-Definition (720p or 1080p) prints are uploaded using torrents over the internet?
340874	Is it good to go to the gym every day or every other day?
340875	What is that one good thing that you do every day?
515334	How do I make Jerk Chicken Pasta Recipe?
395806	What are some of the best pictures that showcase India?
154170	What is the best programming language to learn in 2016? And Why?
340373	JEE 2017 confusion?
340374	Where will I look for mentors in research?
80458	How much data does deezer uses per song?
394433	What are the reasons why honor killings are wrong?
394434	What reasons and justifications are given for honour killings?
250811	Why are female doctors so beautiful?
492567	Why are there many Indians in Malaysia and Singapore, but not in other SE Asian countries?
500710	What is the procedure and terms for joining industrial training during C.A articleship?
500711	What is the procedure to apply for Industrial training during final year of CA Articleship?
503436	What are some of the easy but online way to learn C and C++ for free?
376028	Why are guys disgusted with the thought of girls pooping or farting?
459942	What part of the body causes you to breathe faster/deeper due to CO2?
459943	Hypothetically, say air has more than 0.04% carbon dioxide. What is the threshold of the increase in CO2 so that the human body can still breathe?
32262	How long does it take to learn PHP and JavaScript to develop a web?
94251	How effective is CPR?
94252	What does it feel like to have saved a life using first aid and/or CPR?
197079	Who are some lesser known important historical figures of Egypt and what should people know about them?
384102	What is a virtual particle?
4930	What will be the output of this C program?
363508	How does R&D at intelligence agencies work?
363509	How does an intelligence agency work?
499125	How do I get admitted in university of VASSA in masters of electronics?
499126	Can I get admitted to University of Alberta?
351853	Have you ever felt the ”Impostor syndrome”? How did you get over it?
393750	How do some Quorans find the time and patience to write such long answers on Quora?
499879	How were the Nazis capable of the murder of 11 million people and didn't break down psychologically?
499880	Why did the Nazis bother with death marches? Why didn't they just leave the camps when they saw they were doomed?
366052	What was the motivation of the first ship builder?
366053	How do I recover old chat history on Skype?
34267	Is web development a good career?
266412	What is the Chase check cashing policy?
266322	Why was Sriharikota chosen by ISRO as the place to launch rockets?
266323	What is the permit amount to launch a rocket?
182366	Is it good to book low fares with SpiceJet airlines as it is going through so much financial scrutiny? Will they survive or will it be Kingfisher airlines?
182367	Why do airline fare change on a daily basis?
401807	Where can I get the newest prep materials for the 1Z0-055 exam?
349370	How can I get over a girl that I really liked?
212726	Why should a country have two currencies?
212727	Should there be two currencies at once in a country instead of one? Or not?
176086	What is the difference between the United Nations and the League of Nations?
176087	Why does United Nations prefer French?
316811	What will happen if nuclear radiation touches our body (at atomic level)?
316812	What are the best ways to remove nuclear radiation from the body?
93904	Who is the founder of Telemainia?
239810	Can I play GTA V in windows 8.1 intel corei3 4gb ram and intel HD graphics 4400?
137303	Where can I get best DJ management services for any wedding party in Sydney?
311968	Where can I get best DJ services for engagement parties in Sydney?
310747	What is your favourite social networking site?
257500	What is your favorite social networking platform? Why?
27883	Is CS ETS Major Field Test useful to apply an MSCS for a non-CS undergraduate?
279017	How is campho-phenique used in kids?
216711	What are the new features in the 2016 MacBook Pro?
216712	What are the new features of the pre-2016 MacBook Pro?
287015	What is the most popular mobile game in America?
154750	Do astronauts use microwaves to heat their food?
127989	How do astronauts use a microwave in space?
145906	What signs a girl gives when she is interested in a guy?
24763	Is it sufficient to study from Free Code Camp for front end development? Is it necessary to study from books as well?
24764	Why does free code camp teach us the bootstrap framework even though they do not use it for their front end.
116313	What are the characteristics of periodical literature and what are some examples?
116314	How do I prepare for an MUN as Finland in the UNDP with the agenda “Equal participation of men and women in democratic govt. and peace-building”?
160960	Why do I care about people's opinions of me so much?
514348	Do dimple piercings hurt?
514349	Do eyebrow piercings hurt?
198539	What is the feature for Linux in India?
198540	What are the some features of linux?
342336	"What is the difference between ""sang"" and ""sung""?"
280100	How can I figure out my life passion? I want to dedicate my life to something, and master it. Alas, I am having trouble figuring out what. Any tips?
388520	Is it valuable to do MBA after completing chartered accountancy?
388521	What are the advantages of doing MBA after CA?
524875	If you could create a planet, what would it be like?
209552	What are the Impacts of social networking sites on youth and society?
209553	What are the impacts of social networking sites on society?
46458	What was the last country to experience the Industrial Revolution?
517472	How can I tell if a man loves me? How can I tell if I should move on?
128149	How do I build a drone?
70911	What do Caucasian people smell like to Asian people?
405835	Why doesent Tom Nook work at Nooks homes at least 1-4 hours?
405836	Food related rituals for women?
495330	How can you take out a eye contact that is stuck in the back of your eye?
483574	Why does my iPhone 6s dies at 25-35% sometimes?
413556	How do you grow your email list with YouTube?
21809	What is the one thing you did not regret after buying?
479338	How many times faster is a supercomputer than a PC?
143910	Why is the Big Bang theory important?
383098	Are there more prisons than schools in the US? If so, why?
383099	Crime Statistics: Does the US have comparatively more prisons, prisoners, and prison spending than other countries? Why?
176261	Where can I find a good call record application for my android phone (Google Nexus 5) I tried all leading paid and free apps but no one is recording?
176262	What is a good detective book like Sherlock Holmes and where can I get it for free for my Android?
28301	Is Magnus Carlsen happy?
209092	Will North Korea be vaporised if Kim Jong Un continues to threaten the USA?
209093	Is my movie script safe when I send it through email to any production company?
407129	What is a research report in research methodology?
407130	How do I write a good methodology for a university marketing research report?
323723	Who is Keanu Reeves?
370709	Are there any exercises to improve the jawline?
370710	Can facial exercises really improve the jawline?
440834	I got fired for supporting Trump at a company in Silicon Valley. Where do I go from here? (NOT GRUB HUB)
440835	I'm from Silicon Valley and I'm a high schooler that programs a lot and goes to Hackathons. Is it worth going to another great CS school outside of Silicon Valley or should I stay here?
40201	Does Spotify intentionally make their ads obnoxious and annoying to try and get listeners to go premium, or do they just suck at creating ad spots?
40202	How can I get in the advertising industry? I want to create innovative TV ads.
329277	Why isn't Pakistan retaliating against terrorist attacks from India?
329278	Why isn't India retaliating against terrorist attacks from Pakistan?
168085	Has your friend tried to defame you just because of misunderstanding or small mistake from your side?
461439	How much India is/Indian nationals are divided, devising & divisive over/within the meanings/denominations of Indianism/Nationalism?
461440	How much India is/Indian nationals are divided, devising & divisive over/within the denominations of Hinduism?
109367	What are the best high-end preschools in Miami? What makes them good or special?
196478	How is the calculation of a least count of a micrometer determined?
196479	What is the difference between count and calculate?
250492	Is love the strongest force in the universe?
250493	Is there something called eternal love ? If it is the case, how can you love a second person after your breakup ( chosen or forced)?
155437	Is it possible to purchase an Antikythera Mechanism replica?
155438	How do I use the Antikythera mechanism if I have a copy?
115084	I have booked a Tatkal e-ticket. It got confirmed but it is not showing the coach number, although it is showing berth status and seat number. What should I do now?
420998	Which MBA course I must do after computer engineering?
420999	Which MBA should I do after computer engineering?
426465	If the universe is infinite then how can it expand? What is it expanding into? Is an infinite universe consistent with the idea of multiple universes?
213112	How can I make $200 a day?
282536	If someone converts to the Jewish faith, does the conversion have to be processed in Israel, even if the person converts to Reformed?
282537	I have to give a presentation on LEED, anyone has any ideas?
279541	What are the advantages of using non-time delay fuse?
279542	What is the advantage of using non-time delay fuse?
200875	What is the format of VAT and CST number?
383653	If my product is changing states, do I have to register for both CST and VAT or only CST? Why?
186882	IS there any course available online for lifting heavy equipment?
294491	Can I receive money on PayPal if I don't have a credit card?
294492	If I don't want to use a credit card or exchange money in every new country, what would be the best way to pay for myself?
215345	How do I clone a website?
215346	How do you clone a website?
256474	Why do we have sauces in modern culinary events?
256475	How can we make a working model based on properties of circles and its applications?
498596	What is it like to be a forensic psychology professor?
498597	What is forensic psychology?
278307	Is a guy still a virgin after having gay sex?
427659	"Are there ""Ivy League"" level colleges and universities on the West Coast?"
427660	What is an ivy league school? Is Vanderbilt University an ivy league school?
44232	Does the universe evolve?
443159	What are the function of education?
443160	What is the function of current-day education systems?
106812	What happens when you break the copyright law in Australia?
403982	What are the best project management and team management tools?
30119	How can i get into an embassy job?
355407	How does one proceed for an embassy job?
6862	Naruto: when will they english dub up to the last chapter?
190178	Who is the first philosopher who asked a question about Theos?
121938	What jobs will there be in 2050 that haven't been taken over by robots?
487583	How do you explain the international date line to a ten years student?
487584	What is the International Date Line? How would you explain it to a 10 year old?
178815	What is maximum elongation in spring?
178816	How become a stock broker in us studying from India?
135090	"What is a ""mall ninja""?"
135091	How can I become a mall cop?
480481	Which novel or book you liked most and why?
480482	Would AI of future going to follow law of nature praposed by chales darwin?
355525	What happens to a human's body upon impact with the water when jumping off the Golden Gate Bridge?
226523	Where can you park a car and get a close-up view of the Golden Gate Bridge in San Francisco?
19162	How can I find my path and my dream job?
19163	How can I find my dream job?
518022	What is more efficient for weight loss, HIIT cardio or HIIT weight lifting?
518023	Exercise: Which is better: cardio, weight training, or HIIT?
120492	What is Belgium?
150168	What is block chain?
150169	What is block chain technology?
187015	Was Yao Ming a dominant player in the NBA?
187016	Why is NBA dominated by African Amercians?
288393	What is the meaning of design in terms of biology?
288394	"What does the term ""spindle"" means in biology?"
41752	I can't sleep. What do I do?
394976	Why are we having sex?
394977	Why is having sex painful?
310864	Why do dogs chase moving vehicles with great ferocity but once you stop they stop chasing? Are they enchanted by the rotation of the wheels?
170911	How often can/should I post a question on Quora?
233385	What is the best and very helpful project in IT by college students?
233386	What is the best project in the power electronics field that will help me get an intern and a placement?
223371	What are the servicing and maintenance costs of a new Mercedes Benz C Class 220 in India (Pune)?
223372	Amongst the Mercedes S-class & the BMW 7 series, which is more costly for maintenance & service?
273015	Can I jailbreak iOS 10.1?
272927	Why do many people think that all punjabis are sikhs, although most punjabis in this world are muslims?
272928	Does 'punjabi' always mean Sikhs?
102582	How can I build my own phone?
102583	Is it worth to buy next nexus phone ? Should i have to wait for Google's own phone?
321687	Which company is better for a fresher, Infosys or IBM?
321688	Which company is better for Freshers, Infosys or IBM?
268106	Where should I start the preparation for IIT-JEE from?
275807	Can dogs and wolves understand each other?
275808	Can dogs and wolves understand each other's body language well?
328576	How did The Weeknd get famous?
162670	Is it necessary to leave job for study for CAT?
113707	What is beyond the Milky Way?
379899	How does GCM generate registration_ids?
379900	How does Google GCM work?
161979	How do I get out of a funk?
161980	How do you get out of a funk?
312448	Derive Maxwell's Equations in Differential form.
332452	How many Maxwell's Equations are there?
339255	In addition to presenting at conferences and publishing in journals, how can researchers publicize or even promote their research?
264537	What is it like to have your first lesbian experience?
60367	Is it appropriate if I keep running 10 km every day?
60368	Is running 10 km on a regular basis a good thing?
506637	What does it mean when you CR and DR the Cash At Bank account?
506638	If you have a PayPal account does that automatically mean you have a bank account? How can cash be withdrawn from it?
366637	Is it true that the value of most US assets is largely driven by illegal/black money from US itself and from advanced emerging markets?
366638	I made out with a guy randomly. And, He feels for me but I don't. I'm so guilty, what should I do?
78456	What is the recipe for making Dutch Crunch bread?
39756	How long does it take for a USA fiancé visa to process?
39757	How long will it take for a visa to be processed?
531076	What is the most sensual picture ever?
531077	What are some of the best and most unique poses ever done for a picture?
217786	How do you close a Chase checking account?
55307	How can I close a Chase account?
275605	What is constant?
275606	What are the constants of universe?
501919	What font does Fast Company use?
501920	What's the font used in Vine?
72254	Why do some people find the 24 hour time format so hard to understand?
72255	A clock is set right at 10 AM. A clock gains 10 minutes in 24 hours. What will be the true time when the clock indicates 3 PM the following day?
417178	Netaji Subhas Institute of Technology: Should I give an improvement in Mathematics of 3rd sem?
417179	Netaji Subhas Institute of Technology: How did Saurabh Modi start coding and how did he reach to Facebook?
267549	How do I get rid of past?
267550	How do I get rid of my habit of living in the past?
162620	When should we use having with are? In sentence?
162621	"Where should we use ""in"" and ""on"" in a sentence?"
71087	What are some mind blowing Robotic gadgets that exist in 2016 that most people don't know about?
287863	What is the best lie ever told?
156110	What is the backstory in Portal?
156111	Why does Chell awaken inside Aperture Science post the events of Portal 1 at the start of Portal 2?
27793	What is Banksy's greatest piece of street art, and why?
27794	As of 2013, what street art by Banksy remains in New York City?
479745	Why do the 30 day months go quicker than the 31 day months?
479746	Why do the 30 days months go quicker than the 31 day months?
255381	Do you ever feel sick to your stomach when you see a girl you would like to get to know better or see a piece of art you’re fond of?
255382	What do you get from a physician when you're sick to give it to your school as a verification?
104546	Is it okay to throw shit at people?
104547	What does it mean if a CPU has a high usage and is it advisable to keep it running on a lower usage? I have a T6600 Dual Core Intel 2.2Ghz
267758	What are good ways to make account on line?
357567	How can I make an account?
52652	What are good songs to prank my guy friend with?
342107	What is digital marketing in IT?
321890	What was the most successful civilization in history and why?
321891	What civilization would you choose as the most successful of all ages?
146472	Can introverts become extroverts?
438793	Is it very hard to get into nitk?
438794	I got 96% in my board exam and 210 in the JEE Mains. I have Karnataka state quota. Can I get NITK, CSE or ECE?
236346	Does love at first sight exist?
373432	Where can I find a mentor to help me with my MUN skills?
396004	Where can I buy robot kits in Madurai?
396005	Where can I buy robotic kits in Madurai for children?
512522	Does Travis Kalanick take Uber to office?
487016	Why does a pinhole camera produce an inverted image?
487017	What does a pinhole camera do? What purpose does it serve?
115035	Who would win in a fight between Marvel's the Incredible Hulk and DC's Doomsday?
384869	What is the best Airsoft gear to wear?
274156	What is the relation of this Gandhi family (Sonia, Rahul, Rajiv, Indra) with Mahatma Gandhi?
274157	To what extent are the common people in India aware that the (Indira) Gandhi family is not related to Mahatma Gandhi and that the matching surname is only a coincidence?
433408	How do I download HD movie in Android with 5.1 sound surround?
433409	When will the Android One get Android 5.1.1?
522554	Why is it not uncommon for property developers listed on Hong Kong and Singapore stock markets to trade at a discount to book value?
144391	How can I get motivated toward studies?
154187	Why do we use registers instead of memory?
154188	Can I use an external memory drive as a server?
490057	Can Court order CBSE to issue me new 10th and12th certificates with my father's name changed on it?
490058	Salary of faculty at kota?
207013	How much should one score in CAT 2015 to get 99 percentile?
393262	Is a China visa valid in Hong kong?
208676	Which one is better: hardbacks, paperbacks, or eBooks?
188046	What is the most difficult thing about being a parent?
188047	What would you say is the single most difficultt thing about being a parent?
232477	Do women in India watch Breaking Bad?
231050	Why are there so many IIT students on Quora?
231051	Why do people ask so many questions about IIT & IITians on Quora?
535304	Why is nothing free in this world?
536764	How much does it cost to sponsor Serial?
536765	How much does it cost to become Corporate sponsor for V&A?
514688	While inside a mother's womb, the baby gets oxygen through the placenta. How is this balanced so both the mother and the baby get enough oxygen?
514689	What do you think about a baby's memory in a mother's womb?
292907	How can you tell if someone saved your pictures in a snapchat conversation?
169988	How do the Japanese feel about pre-marital sex?
169989	What is something that bothers you about Japanese people?
233805	What is the best job for someone who doesnt want to have anything to do with other people?
200681	I sing from the diaphragm but I sound shaky while I sing. What can I do to sing better?
245609	What can I do for a temporarily locked Facebook account without any ID proof?
23602	How do you lose 20 pounds in 7 weeks?
251139	What are the most surprising things of the year 2016?
251140	When did your child surprise you the most?
257917	How can you track someone by their phone?
483971	How do you find someone phone by GPS?
468944	How do I deal with an overly controlling mother in law?
468945	How do I deal with very controlling mother-in-law?
314267	"What is a ""free thinker""?"
314268	"How does one become a ""free thinker?"""
497942	For admission in medical college only neet required?
497943	What are the best sites to learn web develepment?
417299	If time is continuous, how is reincarnation possible?
417300	If time is a continuum how is reincarnation possible?
141477	What problems is the ECOWAS facing?
117151	Which is the best quote to write on t-shirts?
117152	Which is the best quote you have in your T-shirt?
294717	Are there any Libertarian, Green Party or Trump voters who regret their decision now that Trump has won?
467136	What is the procedure for 48 days Lord Murugan fasting?
467137	What do I need to do to prepare for a 4 day fast?
222912	What's the rock song that has a telescope fish in the mv and the singer of the group has dreadlocks and the band is playing in some kind of sewers?
222913	What's the rock song that has a black telescope fish in the tv, the singer of the group has dreadlocks, and the band is playing in some kind of sewer?
349653	How does one get a NC OBC certificate?
446352	Does calling yourself white automatically make you anti-black?
446353	Does Calling yourself Black automatically make you anti-white?
426222	Has Facebook updated live video broadcasting for users?
63492	How much time do I have to devote for CAT preparation?
63493	How much time should I dedicate every day to my CAT preparation?
213784	"""It was a pleasure meeting you"" or ""it is a pleasure to have met you"": if either is possible, is there really a difference?"
213785	Is dwelling on the past a form of pleasure?
159406	Why does Arvind Kejriwal want Modi to roll back the demonetization?
159407	Why does Kejriwal want Modi to roll back the demonetization drive?
161120	LAUX: Who are some of the best UX designers in the Los Angeles metro area?
55918	What is the best moment in our life?
160125	How can I apply at uber?
160126	How can I re apply to uber?
79490	If someone deserves to get punched, should you initiate a fight by hitting them first?
79491	If someone attempts to punch me, and I do get it and hit back with lethal force, am I legally wrong?
15863	Which American restaurant chains can be found in Norway? What do Norwegian people think of them
440818	What you recommend to buy Windows laptop or MacBook? I want to run Adobe Photoshop, illustrator, Coreldraw x7 and Lightroom and other Adobe softwares?
440819	Since Saudi Arabia is 2150000 km² and Germany is 357000 km²,should Saudi Arabia take all of refugees?
7397	How can we have a Direct Democracy system?
7398	How has direct democracy evolved?
532810	Which are some dummy CBSE schools in Howrah?
532811	Which are the dummy commerce CBSE schools in Pune for 11th?
141840	How can I get birth certificate with only one name?
471927	"English Grammar: Which is more Grammatically Correct - ""I wish I was there"" OR ""I wish I were there""?"
344993	What would happen if the President elect was charged with a major crime prior to inauguration?
344994	What happens if a president elect is mute/temporarily loses his or her ability to talk and cannot take the oath of office?
100906	How do I use the word off in a sentence?
445387	Is man the enemy of mankind?
445388	Is China an enemy?
145938	What is turbulence?
270043	How do I copy and paste on my Android phone?
399887	What does  OD  -2.00 SPH  +2.00 add  0.5 p.d. BD  mean on my glasses prescription?
492354	What is this German to English translation for this tank?
492355	Is there any hotel in kota which provides room for couples?
204760	What criteria do movie experts pay attention to in a movie that audiences do not?
164525	Do you read news daily (or often)?
164526	Do you read this news everyday?
231534	What is the cheapest car insurance in Massachusetts for new driver?
231535	What is the cheapest car insurance in Massachusetts for a new driver?
421612	How should I improve my accuracy in verbal sections of CAT?
421613	How do I improve verbal section for CAT?
499776	Does anyone successfully invest in penny stocks?
453542	What are the best video lectures for learning linux?
453543	How a beginner should start learning Java? Which are the best books and video lectures on this topic?
402957	What type of ideas can I patent?
45297	How is life at VIT?
45298	How is college life in vit?
339416	What were the costliest questions ever asked?
271414	How do I get the probability generating function of a normal distribution?
515045	Where can I get very affordable window cleaning service in Sydney?
515046	Where can I get very comprehensive window cleaning service in Sydney?
460509	What are some products that should exist, but don't?
460510	What are some great products that were born as hacks of existing products?
531775	What is the first postulate of special relativity?
531776	What is special relativity?
