190224	Are guys more introverted than girls ?
190225	Why are guys more introverted than girls ?
190226	Why do people make fun of Ariel the mermaid ?
190227	Why do people make fun of Ariel from Disney's The Little Mermaid ?
190228	How do I start final year project ?
190229	How do I apply for doing 8th sem final year project in IISC ?
190230	Is Indian Army the Best in the World ?
190231	Is the Indian army the best in the world ?
190232	Can the president replace the vice president when he wants ?
190233	Which are the top 10 videos to watch on YouTube ?
190234	What are the top ten videos to watch on YouTube ?
190235	How do I preserve driftwood ?
190236	What are some ways to preserve driftwood ?
190237	Why do circuit breakers fail ?
190238	What causes a circuit breaker to fail ?
190239	In what area India is significantly better than China ? What is the reason for Indian advancement ?
190240	Do narcissists always lie ?
190241	Do narcissist always lie ?
190242	Why are aboriginals in Australia referred to as indigenous when they are descendants from Africa ?
190243	How do I change the IMEI of a mobile phone ?
190244	How do you change your imei ?
190245	How do you convert mp3 files to iTunes ?
190246	How do you convert MP3 to iTunes ?
190247	How is everyone doing today ?
190248	Why did Quora get rid of asking credits ?
190249	Why did Quora remove it's credits ?
190250	Is there any piece of land on Earth which is not claimed by any country ?
190251	Is there any land , island on earth not claimed by ?
190252	How do I master Java in one month ?
190253	How do gasoline and diesel engines differ ?
190254	What is similarity between data base and data warehouse ?
190255	Why is it hard for me to express myself ?
190256	Why is it so hard to express myself ?
190257	Are cats' purrs healing gifts to humans with bone , nerve or tendon maladies ?
190258	Is a cat's purr beneficial to humans with bone , nerve or tendon maladies ?
190259	Why should I vote for your preferred presidential candidate ?
190260	Why should I vote for your presidential candidate choice ?
190261	Why time is considered as the 4th dimension ?
190262	Where , when , and why does erosion happen ?
190263	Where does erosion happen ? Why ?
190264	What are the best things I can do/say for a friend with anorexia ?
190265	What are some things I can do to help someone with anorexia ?
190266	What is the weirdest thing somebody has said to you ?
190267	What is the strangest thing anyone has said to you ?
190268	What are some beginner Python web-scraping tutorials ?
190269	Are there any WhatsApp groups that provide stock market updates regarding what to buy and what not ?
190270	Are there any free WhatsApp or telegram groups for stock market advice ?
190271	`` What is the best sarcastic reply to'' `` I Love You'''' ?''
190272	What are the best sarcastic replies to I love you ?
190273	Why won't my dog eat dry food ?
190274	Why does my dog won't eat dry food ?
190275	How can I become a software engineer at google ?
190276	How can I become a software engineer of Google ?
190277	What advantages does Google Home have over Amazon Echo ?
190278	Which car is best seller in India this year ?
190279	Which car is the best seller in India this year ?
190280	How is MDMA being used to treat PTSD ?
190281	What is the second energy law ?
190282	Can I pass class 12 pre-boards if I study only all the past year's Q&A s from CBSE Chapterwise Solutions ?
190283	Can I get 80 % marks in physics and chemistry CBSE class 12 boards just by studying past year questions and chapterwise solutions ?
190284	What is the best way to use samsung knox ?
190285	Who is the most beautiful actress ever lived ?
190286	What is the longest time span , you've ever stayed awake ?
190287	How did the classical mechanics fail ?
190288	What is the failure of classical mechanics ?
190289	Dave Consiglio who are you ?
190290	Who is Dave Consiglio ?
190291	Which is the best engine oil for bikes in india ?
190292	Which is the best bike engine oil in india ?
190293	What are the best websites to understand genetics ?
190294	What are some of the best websites to learn genetics ?
190295	How do I transfer WhatsApp messages from to iOS Android ?
190296	How do I transfer WhatsApp messages from iphone to Android ?
190297	What is a monatomic ion ?
190298	What are monatomic ions , and what are some examples ?
190299	What was the first programming language that you learned in life ?
190300	Why was the Battle of Verdun important in World War I ?
190301	What is the Battle of Verdun related to the World War 1 ?
190302	What is a polytropic process ?
190303	What is polytropic process ?
190304	What is the agenda of isis ?
190305	What is the hidden agenda of ISIS ?
190306	Which are some of the best hotels to stay in Helsinki ?
190307	What are some of the best hotels to stay in Helsinki ?
190308	How does one become a scientist ?
190309	How can I become a scientist ?
190310	What are some great ways to make money online ?
190311	Good ways to make money online ?
190312	What are some horror stories that have happened in real life ?
190313	What are the horror stories witnessed by real life ?
190314	What is the maximum power transfer ? And when is the maximum power transferred ?
190315	When and how is the maximum power transfer used ?
190316	What will happen to Indian students in the US after Donald Trump's victory ? Will they be harmed in some way or another ?
190317	What is the fate of Indian students in US universities after Trump's Victory ?
190318	What are some useful tricks in complex numbers ?
190319	Are there any tricks in complex numbers ?
190320	What does getting a tattoo feel like ?
190321	What does it feel like when you are getting a tattoo ?
190322	How do I figure out what should I do with my life ?
190323	Where can I find a list of the best local business directories online in Australia ?
190324	Where can I find a list of the best local business directories online Australia ?
190325	What colors are in the Mexican flag and what does the flag mean ?
190326	Which is best UPI app ?
190327	Which UPI app has best features ?
190328	Assuming I have an ISO of windows 7 , and I am making a new computer , how can I make a bootable drive to get windows 7 on that computer ?
190329	I want to install a Windows 7 operating system from a bootable pendrive to a new laptop , how should I make a bootable pendrive ?
190330	How can you hack/spy on someone's BBM ?
190331	How can I hack my wife BBM ?
190332	What is emmentaler cheese ? How is emmentaler cheese made ?
190333	What is Emmentaler cheese ?
190334	Why should men wear underwear ?
190335	Will Brexit signal the end of the European Union ?
190336	Will Brexit lead to a breakdown of the European Union ?
190337	Will computers replace human interpreters/translators in 10 years ?
190338	How soon will computers replace human translators ?
190339	What are the new security features in 2000 rupee notes ? Do you think the security features are enough to make sure nobody is able to counterfeit it ?
190340	What are the new security features of the 2000 Rs note issued by the Indian govt ?
190341	What is a marathon ?
190342	How can we minimise sleep ?
190343	How can I minimize sleep ?
190344	Can I use a tester in a 3 phase current ?
190345	Can use tester 3 phase voltage ?
190346	How can I remove vocals from a song to make it instrumental ?
190347	How do I remove vocals from a song ?
190348	What is the best way to reduce blood pressure ?
190349	What is the best digital marketing company in Hyderabad ?
190350	What are the best digital marketing companies in Hyderabad ?
190351	How are the parts of the cell cycle described ?
190352	How would you describe the parts of a cell cycle ?
190353	How can you tell if one of your answers (or someone else's answer) has been downvoted on Quora ?
190354	How do I get rid of wasps building a nest ?
190355	What's the best way to get rid of a wasp nest ?
190356	What is the changes in IBPS RRB Exam ?
190357	Can IBPS RRB change the exam date ?
190358	What is the best place in Australia ?
190359	What are the best places for vacation in Australia ?
190360	How is wind generated ?
190361	How is the wind generated ?
190362	If an astronaut dies in space , how do they deal with the corpse ?
190363	Intuitively , how does mini-batch size affect the performance of (stochastic) gradient descent ?
190364	What is a good way to choose the mini-batch size in stochastic gradient descent ? Is the larger the better ?
190365	What is the difference between Promotional & Transactional SMS ?
190366	Which is a better DSLR ? Canon EOS70D or Nikon d5500 ?
190367	How do I remove dry paint from my clothes ?
190368	How can I remove paint from clothing ?
190369	Why would people follow me on Quora ?
190370	Why are people following me on Quora ?
190371	Who was a better leader , Bhimrao Ambedkar or Mahatma Gandhi ?
190372	Who was a better leader Dr. Ambedkar or Mahatma Gandhi ?
190373	Is it safe to paint your body with acrylic paint ?
190374	Is it safe to use acrylic paint on your body ?
190375	What is your opinion about death penalty ?
190376	How do you feel about the death penalty ?
190377	What do we know about Hillary Clinton's health ?
190378	What are examples of simple machines found at home ?
190379	What are simple machines ? What are some examples of some of them found at home ?
190380	How do you generate traffic for a website ?
190381	How can you generate a traffic to website ?
190382	Which business is good start up in Hyderabad ?
190383	Which business is better to start in Hyderabad ?
190384	What are characteristics of a German Shepherd/Husky mix ?
190385	What are the traits of a German Shepherd/Husky mix ?
190386	How can I feel more confident in myself ?
190387	How does inflation affect the economy ?
190388	How exactly inflation affects economy ?
190389	Why is a quadratic equation called ` quadratic' , though it has a degree of two and quad means four (eg : x ^ 2-2x-3) ?
190390	Why do quadratic equation gives only two roots when quad mean 4 ?
190391	Are technical founders/co-founders often full stack developers ?
190392	Are technical co-founders usually full-stack developers ?
190393	Why do some people want to become a model ?
190394	Why do people wan na be a model ?
190395	I am 23 years old , and my family wants me to marry . They want me to meet a girl whom they selected for me , but I don't want to marry now . What should I do ?
190396	I am a female , 22 years old . My family wants me to marry just because they think this is the right age for marriage.But I don't want to marry now.What should I do ?
190397	What books should teenagers read ?
190398	What book should a teenager read ?
190399	Which companies are good to invest shares ?
190400	What are the best companies in which you can invest in shares ?
190401	What is the best advice your grandparents gave you ?
190402	Is there any new trick to earn a free recharge ?
190403	How do I earn a free recharge ?
190404	What is the center of gravity of an object ? How is the gravity of an object measured ?
190405	What defines the center of gravity for an object ?
190406	What are the financial markets (all) ?
190407	What exactly are financial markets ?
190408	What open source software is popular for writing and self-publishing an ebook ?
190409	What software can I use to make an eBook ?
190410	After a bad breakup , did you think you would never meet someone again again ? Did you later find happiness and a better match ?
190411	Did you find happiness again after a bad breakup ?
190412	What are tips for scratch removal from a car ?
190413	How do you make melodies ?
190414	What are the greatest Tamil movies of all time ?
190415	What are the best Tamil movies of all time ?
190416	Who is a better replacement of MS Dhoni as a Captain of Indian cricket team ?
190417	Who is a better replacement for MS Dhoni as a limited-overs captain of the Indian cricket team ?
190418	Where can I learn to sing exclusively online ?
190419	Why do I have lower back pain when I breathe ? How can I treat this ?
190420	How can I cure lower back pain ?
190421	Does Jake Williams have a girlfriend or wife ?
190422	Is Jake Williams married ?
190423	How are golf courses planned ?
190424	How is a golf course designed ?
190425	How Can I lose more weight from my face ?
190426	What is the best framework for web development ?
190427	Which is the best framework for web development ?
190428	What would happen to my Solarcity shares if Tesla buys the company ?
190429	What's going to happen to my Solarcity shares now that Tesla buys it ?
190430	Which is the best country for studying a master's in civil engineering and why ?
190431	Where is the best school to earn a Master's in Civil Engineering ?
190432	What are phases (1 phase , 3 phase) in an electrical system ?
190433	What is phase (1phase and 3phase) in electrical system ?
190434	What is the most ruthless book you have ever read ?
190435	What is the most cruel book you have ever read ?
190436	I talk to myself , ALOT . Does this mean I have schizophrenia ? Or is there a possibility that . I'm normal , and healthy ?
190437	I talk to myself , ALOT . Does this mean I have schizophrenia ? Or is there a possibility that I'm . normal , and healthy ?
190438	I think I am suffering from depression . How can I help myself ?
190439	If you're a physicist , I want to ask you this : Does past really exist , or does it exist only in my memory ?
190440	Does past really exist , or does it only exist in our memory ?
190441	Which cream is rally glow the mens face ?
190442	Which cream is really glow the mens face ?
190443	How can I change my registered mobile number ?
190444	What will happen if the bank increase the interest rates of loan ?
190445	What will happen if banks increase the interest rates ?
190446	Why does forced migration affect the growth in population ?
190447	How can forced migration affect growth population ?
190448	How does one have a flawless complexion ?
190449	What would life be like without technology ?
190450	Is it possible to live a good life without technology ?
190451	What is mechanical energy , and what are some examples ?
190452	What are the important topics to be prepared for the CAT ?
190453	What are the important topics for CAT ?
190454	How does a recruiting office make money ?
190455	How do recruiting agencies make money ?
190456	Why is it OK to vote for Hillary Clinton because she is a woman , but not OK to not vote for her because she is a woman ?
190457	What is a now ?
190458	What is now ?
190459	What is it like kill someone ?
190460	What is it that Pakistan or Pakistani nationals have contributed to the world that we can say is remarkable ?
190461	What has Pakistan contributed to the world that can be considered good for the development of the world ?
190462	How do I file for divorce in California ?
190463	How can I file for an uncontested divorce in California ?
190464	What is the difference between marmalade and jam ?
190465	What's the difference between jam and marmalade ?
190466	What is the hierarchy of the English royalty ?
190467	What is the hierarchy of British royalty ?
190468	Is there anything that can be done to prevent a child from inheriting its parents bad eyesight ?
190469	Is there anything that can be done to prevent a child from inheriting its parents' bad eyesight ?
190470	What is rapture ?
190471	How can I change a Google + custom URL ?
190472	Is there a way to change my Google + profile custom URL beyond capitalization ?
190473	What is the eligibility criteria for the SSC ?
190474	What is the eligible criteria for SSC ?
190475	How do we change a person ?
190476	What is the best way to change a person ?
190477	What technology makes an almost 180 degree viewing angle possible ? Hows does it do it ?
190478	What technology makes an almost 180 degree viewing angle possible ?
190479	Can nose picking permanently change the shape or size of your nose or your nostrils ?
190480	Can picking your nose change its shape permanently ?
190481	Who is great Lord shiva or Krishna ?
190482	How would you solve the South China Sea territorial disputes ?
190483	How can the territorial disputes over the South China Sea be resolved ?
190484	What are the best web design firms in New York ?
190485	What do you love about China ?
190486	How much would a laser hair removal treatment cost in India ? Is it safe ?
190487	What are full body hair removal by laser costs in india ?
190488	What are some of your favorite DJ mixes ?
190489	What is your favorite DJ mix ?
190490	Will Hillary Clinton win the US presidential elections in 2016 and prevent us from another war ?
190491	What are some attention grabbers for a speech on global warming ?
190492	How do I write a short speech about global warming ?
190493	What steps can be taken by the Government to reduce the ever widening economic inequality in India ?
190494	What measures can be taken by the government to reduce the economic inequality in India ?
190495	How do I transfer data from an old iPhone to a new iPhone ?
190496	How can I transfer data from my old iPhone to the new one ?
190497	What are your best tips for learning a new language ?
190498	What are your greatest tips for learning a language ?
190499	Is Star Wars overrated ?
190500	Why are people so crazy about star wars ? Is it overrated ?
190501	Why are most rental agreements for eleven months only ?
190502	Usually we do rental agreements for 11 months only . Is there a specific reason for this number 11 ?
190503	What is Mac ?
190504	What is the MAC ?
190505	Is there anyway to spy on my girlfriend's text messages on her phone ?
190506	How do I read text messages on my girlfriends phone without her knowing ?
190507	What is the most difficult thing about being a parent ?
190508	What would you say is the single most difficultt thing about being a parent ?
190509	What should a mechanical engineer do besides studying college to improve his profile for doing an MS in mechanical engineering ?
190510	What should I do now I am studying mechanical engineering ?
190511	What is meant by length scale in heat transfer and fluid mechanics problems ?
190512	What is meant by flow length scale in fluid dynamics ?
190513	Why does the letter U always follow the letter Q ?
190514	Why does ` U' always follow ` Q' ?
190515	Charging phone with different charger ?
190516	Why do dogs chase cats ?
190517	Who or what labs are doing the most advanced research in machine learning ?
190518	Andrew Ng : Who or what lab is doing the most advanced research in machine learning ?
190519	What are some mind blowing facts about Steve Jobs ?
190520	What are some mind-blowing facts about Steve Jobs ?
190521	What are the best things in Quora ?
190522	What is the best thing we can do on Quora ?
190523	How does meditation help ?
190524	Is meditation useful ?
190525	How do I stop procrastinating and become more bold ?
190526	Who were the leaders during WW1 , and how are they compared to the leaders during other major armed conflicts ?
190527	Who were the world leaders during WW1 ?
190528	When being sworn in as a witness in a court of law , and you are asked if you swear to tell the truth what happens if you say no ?
190529	If in court you have to say yes when being sworn in why bother asking the question if you can not say no ?
190530	What are your two favorite programming languages ?
190531	What is your favorite programming language ?
190532	How do I integrate log (sinx) ?
190533	What is the integration of log (sinx) ?
190534	How can I get rid of chub around my stomach area ?
190535	Will the U.S. try its propaganda hard to make division between Philippine & China ?
190536	Do breast implants have a life span ?
190537	How long do breast implants last ?
190538	How can a software project be built today to prevent it from becoming legacy code in the future ?
190539	How can one build a software system today to avoid becoming legacy code in the future ?
190540	What is it like to have sex with a porn star/actor/actress ?
190541	What's it like to have sex with a porn star ?
190542	What's a good synthesizer ?
190543	What is the best synthesizer ?
190544	Why am I waking up with swollen lips ? How can I treat this ?
190545	Which are the best Facebook groups for gate 2017 CSE ?
190546	What is good and bad ?
190547	What is good and what is bad ?
190548	What should you check before purchase domain and hosting ?
190549	How do I get a hold of my life ?
190550	How do I get a hold on my life ?
190551	Romney in 2020 ?
190552	Will Romney run in 2020 ?
190553	What is the best way to prepare for GK for AIIMS ?
190554	Is a gravitational wave longitudinal or transverse ?
190555	What are do's and dont's for an engineering student ?
190556	What are the do's and dont's of an engineering student ?
190557	Why did Zayn Malik leave One Directon ?
190558	What would Madonna dress like in the 1870's ?
190559	How would Madonna dress in the U.S. in the 1870's ?
190560	How do I become successful blogger ?
190561	What is the best way to become a successful blogger ?
190562	Where is the cheapest to live in the United States ?
190563	Where are the most inexpensive cities (and suburbs) to live in the United States ?
190564	I'm 17 years old and I'm in my last year of high school . I don't know what I want to do with my life . No clue . Help ?
190565	I'm a junior in high school and I still don't know what I want to do in life . Help ?
190566	What is the practical use of algebra ?
190567	What's a common everyday use for algebra ?
190568	Who are the best Delhi architects ?
190569	Who are the best architects in Delhi ?
190570	How many companies does Donald Trump own ?
190571	How can I improve my Spanish ?
190572	What are some ways to improve my Spanish ?
190573	What is the demand curves ? What causes shifts in this ?
190574	How do you get the best when buying new cars ?
190575	How can I lose 5 kg in one month ?
190576	How can I lose 5 kg in 1 month ?
190577	Why do girls wear revealing clothes and then complain when men look at them ?
190578	What are static variables and static methods in Java and how are they used differently ?
190579	How reliable are PS3 slims ?
190580	Are PS3 slims reliable ?
190581	What is like to stay single ?
190582	What is it like to stay single ?
190583	What are some amazing facts about snakes ?
190584	How do you apply to google ?
190585	What do dogs think about cars ?
190586	What do dogs think cars are ?
190587	What is the aim of the life ?
190588	Is Earl Grey tea decaffeinated ?
190589	Does Earl Grey tea have caffeine in it ?
190590	How can I tone my buttocks fast ?
190591	How do I tone up my buttocks ?
190592	What is a good inexpensive laptop for light gaming (Spore , Civilization IV , Sims) ?
190593	What is a good gaming laptop that is relatively inexpensive ?
190594	Who is a common man ?
190595	What is a common man ?
190596	How can I study anatomy ?
190597	How the load on engine controls the speed of governor ?
190598	How is the load on an engine controls the governor speed ?
190599	What is the strangest website you have seen ?
190600	How shall I remember my dreams ?
190601	Which smartphone is better Samsung Galaxy J7 (2016) or Xiaomi Redmi Note 3 (3 GB) ?
190602	Which smartphone is the best for gaming , Redmi Note 3 or Samsung Galaxy J7 (16) ?
190603	Design an app ?
190604	Who is the best chief minister of any state of India till date and why ?
190605	What are some ways to cash a check ?
190606	How do I cash a check ?
190607	Why doesn't Nintendo sell older Pokmon games (FireRed , HeartGold , etc.) on the Nintendo eshop on the 3DS ?
190608	Why doesn't Nintendo sell Pokemon games (Firered , Diamond , etc.) on the app store (besides Pokemon GO) ?
190609	Which OS should I choose from Linux Mint or Ubuntu 14.04 as I am moving from Windows 7 ?
190610	How can one become a politician in india ?
190611	How do I become a politician in india ?
190612	How are viruses created ? How do they spread ?
190613	Why do computer viruses spread ?
190614	What is your idea of marriage ?
190615	What is the idea of marriage ?
190616	What is the least competitive engineering field currently ?
190617	What is the least competitive engineering field ?
190618	Why are Indians worried about what others think ?
190619	Is the era of PC gaming coming to a close ?
190620	Is PC gaming on the decline ?
190621	What kind of psychological testing do the police take ?
190622	What psychological testing does one need to go through before working on a police force ?
190623	What are octane boosters ?
190624	How do octane boosters work ?
190625	Which is the highest rated movie by IMDb (whether Hollywood or Bollywood) ?
190626	What are some of the best photos of IITs ?
190627	What are the best photos of the IIT campus ?
190628	Which is the best way to learn SAP UI5 / SAP FIORI ?
190629	How we can learn sap UI5/sap Fiori ? Which is the best ?
190630	What should I do to create an Android app ?
190631	How can we create android apps ?
190632	What is a good website for job seeking in the Bay Area ?
190633	`` What are some'' `` insider'''' websites people use for job search in Silicon Valley/the Bay Area ?''
190634	What is the best thing about Ohio ?
190635	What's the best thing about Ohio ?
190636	What is a cyclone ?
190637	What are cyclone ?
190638	What shoud be strategy to crack RBI Grade B 2016 ?
190639	What is a strategy to crack the RBI Grade B exam ?
190640	What are some examples of 3 stanzas in poems ?
190641	What are some examples of poems with 3 stanzas ?
190642	If Donald Trump loses the general election , will he attempt to seize power by force claiming the election was fraudulent ?
190643	If Donald Trump loses the general election , what do you think his reaction will be ?
190644	What is the difference between Farsi and Arabic and which is easier to learn ?
190645	How similar are Arabic and Persian (Farsi) ? Which is easier for a native English speaker to learn ?
190646	Has anyone had an encounter with black magic ?
